sickle_address,tx_hash,block_date,block_time,log_index,block_number,address,token_id,liquidity,amount0,amount1
0x095d0de0ecfd6832f1a7961ae26d285d68655d60,0xdf9700082545907b9c52c87214c601161103906446b1682cd163e831876787bd,08-05-2025,2025-05-08 13:05:49.000 UTC,466,29960101,0x827922686190790b37229fd06084350E74485b72,13135733,81043801129786941138659,39984391599660433286,47185393468091367631280
0x2791dc5e14f7680d9d969acc26059ba56403b6d5,0x9371551ee850b45e67afc9139c0b7921c5ee36ce993463199be7bde3fcef32dc,02-01-2025,2025-01-02 20:09:45.000 UTC,394,24529619,0x827922686190790b37229fd06084350E74485b72,4993504,1642507578150917589,903197532,52323897307451388600673
0xdc98dbffcc648d6088a2ff8f7dc01aef050e58fc,0x5c7d5b321cde609b6dc1061cce102711e3af409f51810118a2c5609c468260d1,14-01-2025,2025-01-14 08:14:39.000 UTC,416,25026566,0x827922686190790b37229fd06084350E74485b72,5537519,1000983498716474945758,316568342904138564671,22452389684931129
0x2791dc5e14f7680d9d969acc26059ba56403b6d5,0xa0c577b1c4f914e8e4fbbcf8405b1aba00c21cf45e822ad0b21611643744592c,14-12-2024,2024-12-14 12:21:41.000 UTC,2568,23694777,0x827922686190790b37229fd06084350E74485b72,3997058,5981884526782654254,4648275684885532978,0
0x8508fd4238162cb3f3d485f432202af3b40f164e,0x69f85fcca7b00b981e9796aa1219b5df76737e8d4d22704d7878e7e4cb8ad470,18-05-2025,2025-05-18 02:50:55.000 UTC,289,30373654,0x03a520b32C04BF3bEEf7BEb72E919cf822Ed34f1,3048196,98405155530936969294,74142526574142368,258063574941019416117
0x2791dc5e14f7680d9d969acc26059ba56403b6d5,0xea5bfef74ed9115e0f189a4fb0843780b7888147a49e5151e7de03e84fa56e17,15-12-2024,2024-12-15 05:55:53.000 UTC,747,23726403,0x827922686190790b37229fd06084350E74485b72,4023750,7563338798854326179,4579250104862882180,887890780678326
0x9eb86e93a809a41ab0e7cc0ba6f62561fda3015c,0x5f3ebe6dd1566587e7abd32ddd5a4808972d3c9e1dd7b9ca2b996c4be3f98471,03-06-2025,2025-06-03 16:34:05.000 UTC,756,31089549,0x827922686190790b37229fd06084350E74485b72,15517601,25881692282,342323,952279
0x8508fd4238162cb3f3d485f432202af3b40f164e,0xfdd53ace9f65afdfd31e512ac4cb0e1c6ee68be9f79bec093cb11c5492433529,03-06-2025,2025-06-03 14:08:07.000 UTC,1076,31085170,0x827922686190790b37229fd06084350E74485b72,15507936,13628835523,282873,398599
0x351f61e4c49cf11f24d9f2e737ca5eff81806355,0x45871fd97313c806cf7e034a150b4f88cc3f9123c5e9a7061118d9e4fbac6490,01-12-2025,2025-12-01 02:25:23.000 UTC,602,38883288,0x827922686190790b37229fd06084350E74485b72,33578704,71252945936340348,52969048,74462929902095691750669
0x9eb86e93a809a41ab0e7cc0ba6f62561fda3015c,0xfce2a7c0920eb8f9ef6263f5164adbafa69f612bd63808d0fa708823d6015c31,09-12-2024,2024-12-09 16:03:47.000 UTC,938,23485440,0x827922686190790b37229fd06084350E74485b72,3730230,1162296260745363152276,250092572279036188,531306177768612575439
0x9eb86e93a809a41ab0e7cc0ba6f62561fda3015c,0xf5531c40d93fe869bfedeb3084aa6b21ff9cc5713634a29513949eaa3b4a8060,21-12-2024,2024-12-21 06:58:41.000 UTC,410,23987487,0x827922686190790b37229fd06084350E74485b72,4367641,1081397552583715274430,476123833568514534289,527022302066882715
0x2791dc5e14f7680d9d969acc26059ba56403b6d5,0x44f970a6a7642ac51f065336c0f97cfc351b3dcf1d44e01f13b93cc331a8f430,20-12-2024,2024-12-20 23:25:55.000 UTC,895,23973904,0x827922686190790b37229fd06084350E74485b72,4349702,1596972160462959296994,703316007034661174650,782647454759252571
0x2791dc5e14f7680d9d969acc26059ba56403b6d5,0xcc105c68ae53979aa183d5f714676404919f7186873714182275372dfa506494,17-01-2025,2025-01-17 21:45:43.000 UTC,445,25180498,0x827922686190790b37229fd06084350E74485b72,5746063,169036951508603428,787037793,14195220044330911582359
0x38f6d2d9ea493c3c6ee865b5b952b5fe9e3e61fc,0xd496d638005dfc0d61ec3118fa017862e4ad771a8388196348d95177e5a1bca6,06-01-2025,2025-01-06 16:46:31.000 UTC,392,24696322,0x827922686190790b37229fd06084350E74485b72,5156615,1701633562498253778195874,3005028951264357776834,13617435152882536135118
0x38f6d2d9ea493c3c6ee865b5b952b5fe9e3e61fc,0xeb5930b18dbfb030b215af86901a15fe12b9502006483775046a8427ef71dec1,04-01-2025,2025-01-04 06:22:25.000 UTC,355,24591199,0x827922686190790b37229fd06084350E74485b72,5055052,2178052208589846317310,459304116463129150335,202548461255816108
0xdc98dbffcc648d6088a2ff8f7dc01aef050e58fc,0x94eee2f5d98741a88d999982489525b83e858f14c1339449310d99333949438c,05-01-2025,2025-01-05 04:17:27.000 UTC,436,24630650,0x827922686190790b37229fd06084350E74485b72,5093859,2461892061041327209410,113407938870369146405,714325401725601560
0x8508fd4238162cb3f3d485f432202af3b40f164e,0xbf41ee33ae318829ac938c9e5ada1d53706cfe516798e09dd9be1c5af02bbdf6,14-05-2025,2025-05-14 03:03:35.000 UTC,300,30201234,0x03a520b32C04BF3bEEf7BEb72E919cf822Ed34f1,3024667,6590170564343972356398,18091802860348402,169611351494514038016278
0x8508fd4238162cb3f3d485f432202af3b40f164e,0x56bdf0d466039af70ad60ca6459f6f40d1fa1d4807b4bb4ea02040f641519a72,28-05-2025,2025-05-28 00:57:29.000 UTC,613,30802251,0x03a520b32C04BF3bEEf7BEb72E919cf822Ed34f1,3110239,176897350110647639345,97891273857279376,125061323667464530132
0x351f61e4c49cf11f24d9f2e737ca5eff81806355,0xa7fb5d32585ab160f35bbd1e48b4287423cf048235e2571782c4d2c6388d27b5,16-10-2025,2025-10-16 15:22:01.000 UTC,502,36919387,0x827922686190790b37229fd06084350E74485b72,29018127,177382812942760337,308112127,89155099322542478464494
0x38f6d2d9ea493c3c6ee865b5b952b5fe9e3e61fc,0xc7cedcd56a57d452b862cdb930daaf030245234ea46eb6ffa06ac2f182f4c3d8,04-01-2025,2025-01-04 12:46:11.000 UTC,483,24602712,0x827922686190790b37229fd06084350E74485b72,5064973,2072596473708497819814,499968507747968009426,118000065356482112
0x9eb86e93a809a41ab0e7cc0ba6f62561fda3015c,0xc1dd1ed257611d8754b7e68f25cf069549280961b6de8f2e2f75301136d3b832,17-02-2025,2025-02-17 12:39:35.000 UTC,1331,26503314,0x827922686190790b37229fd06084350E74485b72,7472575,5977501258,914049983,11306
0x8fd1b615c006ebeb8a7cfb00a1dd809f31943b08,0xdde8afce1ddfd90ba046e718a87b626b814050b2ff730bbf4f9a8b13f5103278,19-12-2024,2024-12-19 01:15:09.000 UTC,523,23890781,0x827922686190790b37229fd06084350E74485b72,4241890,2800235707959742614977,2552210017208978749643,2571886492972726613
0x8508fd4238162cb3f3d485f432202af3b40f164e,0x84713359c61f98c3aa6165ed0e3e1e2c5cbbc4ac0120dbe9f76bf19577702f20,09-03-2025,2025-03-09 18:15:47.000 UTC,409,27377400,0x827922686190790b37229fd06084350E74485b72,8745500,682111616517540,82648324165621679812,121155
0x2791dc5e14f7680d9d969acc26059ba56403b6d5,0x47cbd667c3d43d58186fb8dacbaaa193a25b7f0ab02b66a4388cecade9eddae5,12-01-2025,2025-01-12 23:24:29.000 UTC,363,24967461,0x827922686190790b37229fd06084350E74485b72,5465472,1747107018206858497252,35043479378765607661,470504924021571099
0x9eb86e93a809a41ab0e7cc0ba6f62561fda3015c,0xf40e3f33d866846db1491300189e285cd8fc8c5ff7661c991e29c7aab12de186,24-01-2025,2025-01-24 03:41:39.000 UTC,295,25450376,0x827922686190790b37229fd06084350E74485b72,6080701,10781971399545829,64920218,2593666919343323372572
0x095d0de0ecfd6832f1a7961ae26d285d68655d60,0x022e5f754d36a40aae50d9343d2157b59cdce8d4f469dfe26eee8a16ed6f8c06,22-04-2025,2025-04-22 19:51:29.000 UTC,379,29281071,0x03a520b32C04BF3bEEf7BEb72E919cf822Ed34f1,2915600,7030285967509925076485,81568109974333622,234713253279803224407538
0x8810de2baa17067ddcfbd9e8f29c55f070a55f0b,0x6f1dd934c94a9789f6a0315b6d53f919cb2f98d50b1475a845cf0bafcd2c9525,13-09-2025,2025-09-13 08:19:01.000 UTC,169,35481097,0x03a520b32C04BF3bEEf7BEb72E919cf822Ed34f1,3888187,576331684932352146863,13343254858808966,15153563263695058173425
0x2791dc5e14f7680d9d969acc26059ba56403b6d5,0x81c81501fcea4ba050e74d9a5b5f1cb8386daf05db86e3a7354290b210de28df,04-01-2025,2025-01-04 08:35:05.000 UTC,464,24595179,0x827922686190790b37229fd06084350E74485b72,5058279,2813909288298579634829,23681493889120663683,934976976650056200
0xdc98dbffcc648d6088a2ff8f7dc01aef050e58fc,0x467fce2ef44d58487e91292afccbf30c140bbf252cf7eb38dcb7e413862ad999,03-01-2025,2025-01-03 22:28:45.000 UTC,409,24576989,0x827922686190790b37229fd06084350E74485b72,5043611,2571649877082306323636,561865884262722044770,211280856737436435
0x9eb86e93a809a41ab0e7cc0ba6f62561fda3015c,0x9dcc156a23b569088058362e013750d573d714a0812a1510193383e461f100d4,26-02-2025,2025-02-26 03:09:45.000 UTC,352,26875019,0x827922686190790b37229fd06084350E74485b72,8017633,4000237150,169974565,478248
0x8810de2baa17067ddcfbd9e8f29c55f070a55f0b,0x11e9b843470cd15c0216609c7b7872cac7c4204f7837b959ccd9a43bb11ccb46,19-05-2025,2025-05-19 05:24:07.000 UTC,173,30421450,0x03a520b32C04BF3bEEf7BEb72E919cf822Ed34f1,3051115,265493450902605,1425581,10932344299122168177
0x095d0de0ecfd6832f1a7961ae26d285d68655d60,0x4699ad10a148ec9cefa90f504be903331f44e4a4002348b32702daa71b629182,05-02-2025,2025-02-05 18:24:37.000 UTC,317,25995265,0x03a520b32C04BF3bEEf7BEb72E919cf822Ed34f1,2039904,8552704055261398593546,195230878730659429,191685633471671006221808
0x8fd1b615c006ebeb8a7cfb00a1dd809f31943b08,0xbedb83856c0452dcb82c5b90a338706038c2f10c11e9e793d03880d4f1d3f87b,19-12-2024,2024-12-19 20:49:21.000 UTC,350,23926007,0x827922686190790b37229fd06084350E74485b72,4289652,1446286671699293480760,404692739946737907567,404748278620239735
0xdc98dbffcc648d6088a2ff8f7dc01aef050e58fc,0x62ff0ff4f72ec6de2d748f9a1e66d2af6240a4c6a70c416cde4f3fc444ab4af1,17-05-2025,2025-05-17 06:33:25.000 UTC,56,30337129,0x46A15B0b27311cedF172AB29E4f4766fbE7F4364,381661,603295242040329191913,21542479240319622,7943698420836314
0x8fd1b615c006ebeb8a7cfb00a1dd809f31943b08,0x85cf1e9c3d26275a210123cfb5189e295e1d4bbec2e9c788e637cde17c32e64f,09-01-2025,2025-01-09 02:59:49.000 UTC,492,24801121,0x827922686190790b37229fd06084350E74485b72,5277321,30128038881939622099701,531171358932922238,40572738039119564246793
0xdc98dbffcc648d6088a2ff8f7dc01aef050e58fc,0xacb50a43dbad536b9335a7f58bf2dc0d8ef6bfeaf130ce4ca6b40895de996fb8,05-03-2025,2025-03-05 23:41:07.000 UTC,184,27214360,0x03a520b32C04BF3bEEf7BEb72E919cf822Ed34f1,2186880,6333800353645054356355,170630806913987288,129924339992708420727108
0x38f6d2d9ea493c3c6ee865b5b952b5fe9e3e61fc,0x1724c8f3d8b1a08cfca58b7c192565be434567f9bed1c655b95b8e35a90213a8,11-01-2025,2025-01-11 22:19:25.000 UTC,326,24922309,0x827922686190790b37229fd06084350E74485b72,5420576,480249977261071056231,122459135739165874212,177642598229429492
0x8508fd4238162cb3f3d485f432202af3b40f164e,0x4cff276e263a4477e1fb337db18d0747785f0f0d99223a43a5d8aee409c9766a,05-04-2025,2025-04-05 08:08:01.000 UTC,259,28525567,0x827922686190790b37229fd06084350E74485b72,10548414,275379742356031,16236782314435651882,49513
0x38f6d2d9ea493c3c6ee865b5b952b5fe9e3e61fc,0xba339132d197cbc3329665079c4f21bf4f610988d4495d20d27196cb52e70437,06-06-2025,2025-06-06 04:29:07.000 UTC,556,31197400,0x827922686190790b37229fd06084350E74485b72,15731054,27350451888,522194,845446
0x9eb86e93a809a41ab0e7cc0ba6f62561fda3015c,0x63c9c8ecdd933cc7efd30521174f23ba91c7ea7d243489e130671fdccf0f6a57,20-02-2025,2025-02-20 11:56:21.000 UTC,292,26631617,0x827922686190790b37229fd06084350E74485b72,7659235,5340068773,5003029,848961
0x8fd1b615c006ebeb8a7cfb00a1dd809f31943b08,0xce8f98c48ebc068f9e9e8b8e8b2ea304918fe974ad9e2fdb303770c131aa5ecf,19-12-2024,2024-12-19 10:39:23.000 UTC,317,23907708,0x827922686190790b37229fd06084350E74485b72,4250231,5458717235451380370,6287857942020419361,4134310787288999
0x8508fd4238162cb3f3d485f432202af3b40f164e,0xf46a30f7de450b64919a35d0bf4301f94419d0f4821fde06ba99b080a456aef2,30-05-2025,2025-05-30 02:15:15.000 UTC,739,30890984,0x827922686190790b37229fd06084350E74485b72,15102125,15722582056,205151,581373
0xdc98dbffcc648d6088a2ff8f7dc01aef050e58fc,0xe5864e52986f287a86e0785b7827e2cea77fb690557ed11dcc0f75538f5a9012,17-07-2025,2025-07-17 02:16:05.000 UTC,639,32964609,0x46A15B0b27311cedF172AB29E4f4766fbE7F4364,445570,10423824440098944230518,288535299016448717,229050170105534785
0x095d0de0ecfd6832f1a7961ae26d285d68655d60,0x371f0427889d57b10c745f40b1af465400c05007007b2d1d6d3a0974d949e1d2,12-03-2025,2025-03-12 14:05:49.000 UTC,378,27499501,0x827922686190790b37229fd06084350E74485b72,8914852,375467128458608451131368,241563523797795873258,155322857278293652976595
0x8810de2baa17067ddcfbd9e8f29c55f070a55f0b,0x728e7070eeb27e2b8c35e9307be631a2867033f1c2c8a15650ef0ab58e803468,15-05-2025,2025-05-15 03:27:45.000 UTC,581,30245159,0x03a520b32C04BF3bEEf7BEb72E919cf822Ed34f1,3030436,5272465212253975561416,41201496034549152,156422471153393049072233
0x2791dc5e14f7680d9d969acc26059ba56403b6d5,0x2c8ca93dc3e3db8e3f64c27931292c490471760820fa066d66f9025beb5f3538,21-12-2024,2024-12-21 14:46:43.000 UTC,545,24001528,0x827922686190790b37229fd06084350E74485b72,4388652,1597775981067234830079,656634384247320207390,814954612866262940
0x8fd1b615c006ebeb8a7cfb00a1dd809f31943b08,0x925705f97f51c6d84a4fed84d656c4e84bcc17cc68b3b18121f7ca7281002620,11-01-2025,2025-01-11 03:46:45.000 UTC,430,24888929,0x827922686190790b37229fd06084350E74485b72,5384212,2704745841494077783620,187756094281782017385,1446588027163554055
0x38f6d2d9ea493c3c6ee865b5b952b5fe9e3e61fc,0x95366ad82a5fa85eb16d6982af18aba0a802fce69eee7cd0c5ca26a2f7d683a7,05-01-2025,2025-01-05 04:17:51.000 UTC,354,24630662,0x827922686190790b37229fd06084350E74485b72,5093873,1920539909754173720139,92796699554366916167,552045872914764435
0xdc98dbffcc648d6088a2ff8f7dc01aef050e58fc,0x0f7436b7318f51628105be7b970806824295848a8bda21970acf84dbaa838254,05-06-2025,2025-06-05 06:11:45.000 UTC,598,31157279,0x827922686190790b37229fd06084350E74485b72,15648899,11438103331,338772,233005
0x38f6d2d9ea493c3c6ee865b5b952b5fe9e3e61fc,0xfdd598feb9e1720869222e590c4cd5c923173925a2946648af1730f359a13322,07-06-2025,2025-06-07 07:37:57.000 UTC,295,31246265,0x46A15B0b27311cedF172AB29E4f4766fbE7F4364,398472,5456306849,112887,159955
0x0b27b59171a4ffe19f23d54126cd797be17c6551,0xdba93c6bf479e4fb6cfddfb0e13315d404d34a571d8f42e590d385b57a9d3507,22-10-2025,2025-10-22 17:17:47.000 UTC,791,37182060,0x03a520b32C04BF3bEEf7BEb72E919cf822Ed34f1,4087489,1770951085698576870010,44905050873452031,41972752354091825109374
0xdc98dbffcc648d6088a2ff8f7dc01aef050e58fc,0xbabea3ffdb5a9fe5c754dd95446dbe495dc246b7e9014c6c6de15c69ee288bff,05-01-2025,2025-01-05 17:26:09.000 UTC,415,24654311,0x827922686190790b37229fd06084350E74485b72,5109265,25607560619170324485,6437624131342476955,1391696586160807
0x38f6d2d9ea493c3c6ee865b5b952b5fe9e3e61fc,0x35a08882da80ea6c2d9bc510056d4093c23ab2efb8b1dbcb4690f557fe819227,06-01-2025,2025-01-06 23:56:17.000 UTC,342,24709215,0x827922686190790b37229fd06084350E74485b72,5171815,1753789474118242315588,101735577052662653107,458688755348505208
0x9eb86e93a809a41ab0e7cc0ba6f62561fda3015c,0x103869dcf012d029b1ce961017dd831e1e9d09d0166cdb1c7112dc3be6c49237,26-02-2025,2025-02-26 07:39:41.000 UTC,370,26883117,0x827922686190790b37229fd06084350E74485b72,8030553,3976245819,431824971,179530
0x8508fd4238162cb3f3d485f432202af3b40f164e,0x6aed01d0939035f185384c5fa6bea1d81e0b937fb23517cc25281a4b582a9297,05-06-2025,2025-06-05 07:10:43.000 UTC,551,31159048,0x827922686190790b37229fd06084350E74485b72,15652287,13294504019,623468,40829
0x0b27b59171a4ffe19f23d54126cd797be17c6551,0xe91c8779389ea242b3ca24ba5317c4278ce74b90ea925689c21918c466b89a86,11-06-2025,2025-06-11 13:14:23.000 UTC,581,31429158,0x03a520b32C04BF3bEEf7BEb72E919cf822Ed34f1,3230419,12788413774570502303028,502844058029649799,192267150609765259319561
0xdc98dbffcc648d6088a2ff8f7dc01aef050e58fc,0x9cf43d0233bda1b9951d112bc7ff5beca7ff457f68717ac598323bc75087d057,17-12-2024,2024-12-17 06:32:27.000 UTC,414,23813900,0x827922686190790b37229fd06084350E74485b72,4137802,330094709415026409736,279611443448506625381,319984246742644642
0x351f61e4c49cf11f24d9f2e737ca5eff81806355,0x8b4da1701250a80ebcb047d3cecd5b54c5db19c0912b255a0ef0d6925c96c487,12-12-2025,2025-12-12 08:57:49.000 UTC,761,39370261,0x827922686190790b37229fd06084350E74485b72,35130899,51022819438281805,68086634,33393633688947663083004
0x9eb86e93a809a41ab0e7cc0ba6f62561fda3015c,0xf90bb085877e2ac9cd54150eb6b681e95c02f4851e0605e52168d3453602d890,29-05-2025,2025-05-29 01:48:03.000 UTC,1071,30846968,0x827922686190790b37229fd06084350E74485b72,15011252,33816987938,36307,1656359
0xdc98dbffcc648d6088a2ff8f7dc01aef050e58fc,0x31705e203bd888cb266dca9f69bc0667e150ae5e6951e01791dd2b70a5668e38,23-05-2025,2025-05-23 09:02:13.000 UTC,519,30600793,0x46A15B0b27311cedF172AB29E4f4766fbE7F4364,385817,12931265208946914393019,76029240693494989,594332798645893070
0x8508fd4238162cb3f3d485f432202af3b40f164e,0x749d773da52728e4b77cb1f94a0d3371c14122b5f5a6efdb41f453e30160e5b6,09-03-2025,2025-03-09 05:17:09.000 UTC,277,27354041,0x03a520b32C04BF3bEEf7BEb72E919cf822Ed34f1,2263222,6660071686871933880541,173005844091766001,169380041125454267559914
0xdc98dbffcc648d6088a2ff8f7dc01aef050e58fc,0x2f90cb8b7a0b9ce11ebff01d6f65648dc0ba5bf6db829a3d86d1a30a9d5b9d11,08-01-2025,2025-01-08 00:29:59.000 UTC,313,24753426,0x827922686190790b37229fd06084350E74485b72,5217321,2123600044439912433782,136418148164273553525,549584863412154435
0x9eb86e93a809a41ab0e7cc0ba6f62561fda3015c,0xe7fbb2c30541cde50aafc933425efc40be91c05f77ac08bc798b6b366032d4a6,11-06-2025,2025-06-11 17:00:19.000 UTC,492,31435936,0x827922686190790b37229fd06084350E74485b72,16191579,21788243497,723412,365710
0x8508fd4238162cb3f3d485f432202af3b40f164e,0xaaa67954bedca0200cbac8488bc5c2690dcf6d6c5c1b311d909a0fa58a1fd59d,11-07-2025,2025-07-11 23:55:01.000 UTC,483,32744377,0x827922686190790b37229fd06084350E74485b72,19040525,160786144678683848112,71487965306259172,141549233575195943258
0x8508fd4238162cb3f3d485f432202af3b40f164e,0x0ee156f3e17b90ef728039d908127e0ad70b39a8cf1133375b845dfcd7a523ad,08-05-2025,2025-05-08 16:29:29.000 UTC,599,29966211,0x827922686190790b37229fd06084350E74485b72,13149573,79735831473984800925739,229950098512327685871,32544415475543223146411
0x2791dc5e14f7680d9d969acc26059ba56403b6d5,0x3efd70cbc67857f42cd060569ba2cca83f34da411ce2140ac3e810590d8444fe,11-01-2025,2025-01-11 08:38:03.000 UTC,422,24897668,0x827922686190790b37229fd06084350E74485b72,5391459,1871248253027923206481,164275942253966844964,412866060239880639
0xdc98dbffcc648d6088a2ff8f7dc01aef050e58fc,0x8af44ffed0e0c3f1ab1171615286c08dc5d138cfd4123a58eb1a3c326af7dd70,14-01-2025,2025-01-14 12:08:31.000 UTC,552,25033582,0x827922686190790b37229fd06084350E74485b72,5546361,972686731778449258986,143774106793863392109,160287206217673171
0x8508fd4238162cb3f3d485f432202af3b40f164e,0xa251939a69a76aa183571eeadf67c917e04e18f2d6961ae872e62da87480c143,01-04-2025,2025-04-01 15:56:29.000 UTC,314,28366821,0x827922686190790b37229fd06084350E74485b72,10271955,370898460472103,104448772660857060858,29498
0x38f6d2d9ea493c3c6ee865b5b952b5fe9e3e61fc,0x71f22f3428919e4d0d76014b272a865106531f07aa3ab6e1bf67246560025241,08-01-2025,2025-01-08 15:44:59.000 UTC,389,24780876,0x827922686190790b37229fd06084350E74485b72,5252032,1534304635906231701700,121561165168520369990,364869608591236694
0xdc98dbffcc648d6088a2ff8f7dc01aef050e58fc,0x2f10729e58a7eb0fb69ae104faf36ce7dae664154e358429d0a256ae2fae6e1b,10-01-2025,2025-01-10 10:10:23.000 UTC,432,24857238,0x827922686190790b37229fd06084350E74485b72,5348583,20545184124531351669206,226218819044508773,33959172051789166936063
0x38f6d2d9ea493c3c6ee865b5b952b5fe9e3e61fc,0x0898ee5a4c7ec63a484a6c05c91658800e26d590e69adc9dacd0b6da5916600f,01-06-2025,2025-06-01 15:25:43.000 UTC,442,31001098,0x46A15B0b27311cedF172AB29E4f4766fbE7F4364,392704,3257862757,24302,138745
0x38f6d2d9ea493c3c6ee865b5b952b5fe9e3e61fc,0xd62ad6daad435b1a4a746476834cf0f8b77b9ba84358ea3ec7628d6c29f771b7,04-01-2025,2025-01-04 06:45:51.000 UTC,571,24591902,0x827922686190790b37229fd06084350E74485b72,5055582,1803111883157796945274846,3075285718516029288555,14642412544968116915445
0x8810de2baa17067ddcfbd9e8f29c55f070a55f0b,0xc47f2e29731b68aa2d137c3cd7de3ec443865a91a46cce92f836b7d05467db17,30-05-2025,2025-05-30 06:45:39.000 UTC,562,30899096,0x03a520b32C04BF3bEEf7BEb72E919cf822Ed34f1,3129165,22746526760977475,922562595,488661364683746632457
0x38f6d2d9ea493c3c6ee865b5b952b5fe9e3e61fc,0xfbd4c0fc4448c43b67db8b563cfa12f566a71a57e1f5d08879fef6101e3c8a65,07-01-2025,2025-01-07 15:41:27.000 UTC,561,24737570,0x827922686190790b37229fd06084350E74485b72,5196265,1616435445277060113,1514242690,40625146199685844661265
0xdc98dbffcc648d6088a2ff8f7dc01aef050e58fc,0x2a02f8f996ee330a41810258e3ff7fcdb4acb79b9c0aa84678462a0961871314,31-12-2024,2024-12-31 17:11:29.000 UTC,586,24437871,0x827922686190790b37229fd06084350E74485b72,4892451,292637791574739154632,237852885421538864692,313560805322463799
0x8508fd4238162cb3f3d485f432202af3b40f164e,0xdeff3c805b00dcc7d38ea6dcae00ffbe117fda3793235281b08f0195ef5aea15,13-03-2025,2025-03-13 22:15:59.000 UTC,254,27557406,0x827922686190790b37229fd06084350E74485b72,9000958,549382698266667,213335818394600080666,2630
0x9eb86e93a809a41ab0e7cc0ba6f62561fda3015c,0xf26b10194deb732f5b12914cb2a5715679358c3a5b99ab6f9ec30d1788bd8977,09-06-2025,2025-06-09 12:35:55.000 UTC,801,31341604,0x827922686190790b37229fd06084350E74485b72,15994061,22847170162,953793,187792
0x9eb86e93a809a41ab0e7cc0ba6f62561fda3015c,0x46d01795ffba18662bc87c06046d21c4f9daa1c793c04889c28341022933f1a9,06-02-2025,2025-02-06 08:36:29.000 UTC,496,26020821,0x827922686190790b37229fd06084350E74485b72,6788824,4151767228074530023356,192686794037168313,67467085404946093111984
0x9eb86e93a809a41ab0e7cc0ba6f62561fda3015c,0x5562889e0d352f8aaad5dd23b64d198cd0e9e4f87ea4d320b757316e4ba51311,04-01-2025,2025-01-04 05:51:01.000 UTC,285,24590257,0x827922686190790b37229fd06084350E74485b72,5054255,2321216906340272336309,657991583100792692150,15943413225864342
0x2791dc5e14f7680d9d969acc26059ba56403b6d5,0xd4082693cb6a1f12563beb191939835c5b996ee75cdfd510300d0bac516b2ffb,02-01-2025,2025-01-02 22:21:27.000 UTC,414,24533570,0x827922686190790b37229fd06084350E74485b72,4997397,2253677853584445961179250,905239672818907496572,89563401943492174138498
0x351f61e4c49cf11f24d9f2e737ca5eff81806355,0xeceaf3d800a10ce873d8e214b7e139c53df405825f8d5fddc2f8e64731a15410,21-08-2025,2025-08-21 00:45:03.000 UTC,414,34473878,0x827922686190790b37229fd06084350E74485b72,23041872,894123430075950561,438816724,297466487370549056941739
0x9eb86e93a809a41ab0e7cc0ba6f62561fda3015c,0x233ccaae9d7c7ab4c9d341900e2c7df447b25af254d241dbc86258d6f5699071,08-07-2025,2025-07-08 12:44:25.000 UTC,173,32594659,0x827922686190790b37229fd06084350E74485b72,18646691,58983044936,2830074,117094
0x2791dc5e14f7680d9d969acc26059ba56403b6d5,0x4129aeb58d9695ec12d0413b0b29fc3f2aaf2043c11e73a1855b12988ef5cae7,26-12-2024,2024-12-26 09:22:49.000 UTC,375,24207811,0x827922686190790b37229fd06084350E74485b72,4636817,1368064864031757819147,566644015976370450645,708497104761053355
0x9eb86e93a809a41ab0e7cc0ba6f62561fda3015c,0x81a778ab90d494fc84d898e3e357dbc55906210218eb47bef467cfb4090dc1c9,22-01-2025,2025-01-22 02:37:59.000 UTC,141,25362066,0x827922686190790b37229fd06084350E74485b72,5963757,3123111558736313096641,354533106486834254,24026811652208221669762
0x0b27b59171a4ffe19f23d54126cd797be17c6551,0x98662c6e9532a177db7b94a59c3a81b4eaa9092dfcfd28be4fc3f501eb777778,18-07-2025,2025-07-18 05:27:31.000 UTC,980,33013552,0x03a520b32C04BF3bEEf7BEb72E919cf822Ed34f1,3550260,4383097312751558175303,100581866187607640,115466601672236362438053
0x2791dc5e14f7680d9d969acc26059ba56403b6d5,0x511255c5fc3560e860cf4da2de0c92fd5e0af97df1f305f093642ee93b282206,25-12-2024,2024-12-25 04:57:55.000 UTC,300,24156664,0x827922686190790b37229fd06084350E74485b72,4575394,5524110662660651164,2271686161426699881,2856671585651886
0x9eb86e93a809a41ab0e7cc0ba6f62561fda3015c,0x553891d92a7fa23b0489346f9c3bb18d34964b6fdf2080fc8b788ad2620b4851,22-05-2025,2025-05-22 13:57:49.000 UTC,1920,30566461,0x827922686190790b37229fd06084350E74485b72,14420088,26736434171,1123859,212089
0xdc98dbffcc648d6088a2ff8f7dc01aef050e58fc,0xfdb9eefafd9d2ab71a0ec17328efe9dfa6f6b3bde8d9a4c5e51409d8ccb85d99,27-12-2024,2024-12-27 13:53:53.000 UTC,323,24259143,0x827922686190790b37229fd06084350E74485b72,4695656,292817299762491237114,250875353923585416785,296660636864343797
0x9eb86e93a809a41ab0e7cc0ba6f62561fda3015c,0x6bac24ff3862490f17d3daa9f6d5cf16013d692b1c8a87bfe6f44787ccc6324b,07-02-2025,2025-02-07 16:14:41.000 UTC,516,26077767,0x827922686190790b37229fd06084350E74485b72,6875104,76316815160720111,360175075,24794422327587532719565
0x2791dc5e14f7680d9d969acc26059ba56403b6d5,0x796db73ebba9de9b021e49d59e009c308675c75c73ba84028bd3cfa61a979082,02-01-2025,2025-01-02 21:46:21.000 UTC,377,24532517,0x827922686190790b37229fd06084350E74485b72,4996529,2289130021891025491351041,2206940836756572293225,59011166854606884509496
0x8fd1b615c006ebeb8a7cfb00a1dd809f31943b08,0x3a80da6d90db33ebb60b517bfa0db993f70fd4e89bbf86f404470daaada2355c,02-01-2025,2025-01-02 03:07:57.000 UTC,408,24498965,0x827922686190790b37229fd06084350E74485b72,4956112,10792062783559619577727,85595326616744757,21639097078373220306221
0xdc98dbffcc648d6088a2ff8f7dc01aef050e58fc,0x7a19e2ec1dc899af3c0735d8009936667901fd376f319468573d2ec814a2e92e,29-05-2025,2025-05-29 16:14:13.000 UTC,354,30872953,0x827922686190790b37229fd06084350E74485b72,15064113,6284754018,161669,152537
0xdc98dbffcc648d6088a2ff8f7dc01aef050e58fc,0xe1daac0fd55a2e3f91c3816cd9374bb69510667b0321fc8ec68d40bd855c4371,03-01-2025,2025-01-03 22:19:57.000 UTC,305,24576725,0x827922686190790b37229fd06084350E74485b72,5043421,2585741033898546859786,25815860956859620963,862646146999141301
0x38f6d2d9ea493c3c6ee865b5b952b5fe9e3e61fc,0x534b60573aff27e39259df7fee7b790707792caf6c33cc38840d4d61cd57148d,14-02-2025,2025-02-14 18:48:55.000 UTC,384,26384794,0x827922686190790b37229fd06084350E74485b72,7327919,265484750694781093,1124119382,92386789908607096913709
0x9eb86e93a809a41ab0e7cc0ba6f62561fda3015c,0x8f08d9138d252efce59b15b6ae2c7fe83d50bbb05e003aa3958183e654ff42e4,20-02-2025,2025-02-20 04:37:03.000 UTC,450,26618438,0x827922686190790b37229fd06084350E74485b72,7643533,5367831738,79651207,776664
0x0b27b59171a4ffe19f23d54126cd797be17c6551,0x62a35919046d723b38c352f8d053f18e6fd7b389f47be1a84c91ba470eba502c,12-08-2025,2025-08-12 21:50:03.000 UTC,230,34123028,0x03a520b32C04BF3bEEf7BEb72E919cf822Ed34f1,3737559,1169753074932541294920,32062198976525236,25465995363380393510428
0x38f6d2d9ea493c3c6ee865b5b952b5fe9e3e61fc,0xaaa46ef192d7db509fd9e95a65b2f3d3e25ba2ff87f668428ed01345244f546a,27-01-2025,2025-01-27 20:01:11.000 UTC,388,25609362,0x827922686190790b37229fd06084350E74485b72,6265680,379124054060330711,2426771462,90277563927279980391893
0x0b27b59171a4ffe19f23d54126cd797be17c6551,0x507094d96e65235ea818571b510b6c23a82c0434d777e0a7c0860fcb20bd9875,13-10-2025,2025-10-13 04:04:51.000 UTC,494,36769472,0x03a520b32C04BF3bEEf7BEb72E919cf822Ed34f1,4047791,2372346155541625066662,69666523361780430,47794591079175368709341
0xdc98dbffcc648d6088a2ff8f7dc01aef050e58fc,0x7a3b8daf09d3d97d19dfccd8d3c0bb68996e74296492b2cb31aa95403da96022,13-01-2025,2025-01-13 23:16:27.000 UTC,429,25010420,0x827922686190790b37229fd06084350E74485b72,5518330,1046939874409406310616,235012192139349888130,104739706015193962
0xdc98dbffcc648d6088a2ff8f7dc01aef050e58fc,0x09b97b9f3a502c432985ce8acd07d62ff0d3f20d327d6db0c226a37405e729ef,10-01-2025,2025-01-10 18:21:13.000 UTC,568,24871963,0x827922686190790b37229fd06084350E74485b72,5365553,1418422008087252272757,172711122652976898288,272568234487635840
0x2791dc5e14f7680d9d969acc26059ba56403b6d5,0xbf1dcc355384fd47ac7c7a00f49ceeab7c5da32220acf7275d2953ad4b4ef416,31-12-2024,2024-12-31 07:24:09.000 UTC,579,24420251,0x827922686190790b37229fd06084350E74485b72,4844950,3983352638242173320,599511252386149788,3212954651560822
0x2791dc5e14f7680d9d969acc26059ba56403b6d5,0xad84a45c2ac8bc95974f84d9afb654af2a2966e8bda2dcf7f60652a511621b25,10-01-2025,2025-01-10 08:00:47.000 UTC,461,24853350,0x827922686190790b37229fd06084350E74485b72,5343639,1296426091033986210928690,2809250972375912402948,4854792657806491620766
0x9eb86e93a809a41ab0e7cc0ba6f62561fda3015c,0x9605f2ff482d5f6f1f7b7d74d9f9adef8d0b947cdbb13df2db0ff257a7a17380,05-01-2025,2025-01-05 07:19:15.000 UTC,343,24636104,0x827922686190790b37229fd06084350E74485b72,5097506,1265558763249740780620,116807683821084850,1286565650113196736722
0x38f6d2d9ea493c3c6ee865b5b952b5fe9e3e61fc,0xbe6baef9ab146527239b72a3d3f5c89ad34abb2136e9d8a35c847e0cc0218a89,14-01-2025,2025-01-14 18:58:59.000 UTC,440,25045896,0x827922686190790b37229fd06084350E74485b72,5561927,1005781184762050868590963,1622008050353410409197,11878947738779572961229
0xdc98dbffcc648d6088a2ff8f7dc01aef050e58fc,0x67d777d22520cc4760f0c04c8f36b9447c9617edefe18507179b8ec139faf37e,04-06-2025,2025-06-04 12:53:13.000 UTC,1058,31126123,0x46A15B0b27311cedF172AB29E4f4766fbE7F4364,396019,11744514250128561338944,289717109163953893,297148993326821699
0x38f6d2d9ea493c3c6ee865b5b952b5fe9e3e61fc,0x83b5b85b1ba27a27873256ac897a346fc13f2dcb441b2942efd1bc4382cd6d8c,27-02-2025,2025-02-27 11:41:21.000 UTC,2602,26933567,0x827922686190790b37229fd06084350E74485b72,8100673,19511301245703910632892,241316169052233596,121421521081555880345354
0x2791dc5e14f7680d9d969acc26059ba56403b6d5,0xdf98a37db3d26013645151a989c80b30cafd2c066ea9adb225ad2b28b98919cd,22-12-2024,2024-12-22 04:17:25.000 UTC,292,24025849,0x827922686190790b37229fd06084350E74485b72,4409718,6730742466736451963,4468203335024976703,2147425980974018
0xdc98dbffcc648d6088a2ff8f7dc01aef050e58fc,0x4e54a1639a81b8b1b41317925e7a80be460c33d6b992b68eceb44f8cf3352a3d,17-06-2025,2025-06-17 05:07:57.000 UTC,463,31673765,0x827922686190790b37229fd06084350E74485b72,16708508,60602784903115761170887,155801882867411981524,142062042252599752331527
0x38f6d2d9ea493c3c6ee865b5b952b5fe9e3e61fc,0x177ab5de7782468724c1076fdbc60ee0653a940abc416d3245f2ff18dbd702dc,02-06-2025,2025-06-02 05:10:49.000 UTC,911,31025851,0x46A15B0b27311cedF172AB29E4f4766fbE7F4364,393472,3235568087,111675,50012
0x2791dc5e14f7680d9d969acc26059ba56403b6d5,0x5319fea77d18bc5b5888e261e550e8b7797120047b065b05104e3885fc21c89a,20-12-2024,2024-12-20 22:13:03.000 UTC,367,23971718,0x827922686190790b37229fd06084350E74485b72,4341881,4670507219920225751,3562696650578982198,1121049386821832
0x8fd1b615c006ebeb8a7cfb00a1dd809f31943b08,0x2ccdf6f9a336ba40d8a21cb48d4d07e0eea9a63c1e15500e81eb9422108a0662,08-05-2025,2025-05-08 02:17:15.000 UTC,972,29940644,0x827922686190790b37229fd06084350E74485b72,13094660,791707184453754018,2318242377,415485590386951649001524
0x38f6d2d9ea493c3c6ee865b5b952b5fe9e3e61fc,0x93e8fd4580d822056bd5b0d8533abf63a2b2d99701b05eb01eb707b6139a60e1,09-07-2025,2025-07-09 05:03:01.000 UTC,593,32624017,0x46A15B0b27311cedF172AB29E4f4766fbE7F4364,432229,11860975758,403695,189184
0x8fd1b615c006ebeb8a7cfb00a1dd809f31943b08,0x867cb2af5f42f4280cb3d080862e700691a3bb57f7eb20f3ed10e4dfdc5b9e29,31-12-2024,2024-12-31 01:05:49.000 UTC,267,24408901,0x827922686190790b37229fd06084350E74485b72,4770202,12389469732860032485,15606045122551387452,7395981679951825
0x38f6d2d9ea493c3c6ee865b5b952b5fe9e3e61fc,0x8ce4befd9d7a12534ce4867f6a18f805973010995a26ee5ffcfbe316cbcaed02,09-01-2025,2025-01-09 17:34:19.000 UTC,582,24827356,0x827922686190790b37229fd06084350E74485b72,5312905,1243047742730238048,2279714525,13750210845120279215839
0x2791dc5e14f7680d9d969acc26059ba56403b6d5,0xda7f80e1443d8191c9be19338da853b42d2f4bc57a1c3a9c47acdda0e0d934fb,10-01-2025,2025-01-10 05:26:55.000 UTC,264,24848734,0x827922686190790b37229fd06084350E74485b72,5337812,1313922719515617248348154,255897746756608397778,50160549459282132627226
0x9eb86e93a809a41ab0e7cc0ba6f62561fda3015c,0x8fcbb1e41cb3cb7549f383270cdae8b4560c5a045a1d75c22da051bb16c570db,04-01-2025,2025-01-04 06:27:33.000 UTC,273,24591353,0x827922686190790b37229fd06084350E74485b72,5055174,2278398111775755296873,487341567770622318398,203701536416560474
0x2791dc5e14f7680d9d969acc26059ba56403b6d5,0x1b15e89aab52be09062e1eed28528ce0ccc53c1aa2ce57f14ea6f1b3b47eb355,07-01-2025,2025-01-07 08:13:17.000 UTC,420,24724125,0x827922686190790b37229fd06084350E74485b72,5180176,11076570512677649190,2960970512863468122,463649478132472
0x8508fd4238162cb3f3d485f432202af3b40f164e,0x526cc7126cf371f380c864ed722c0d3a59d1e6bcd4f2f4b3268c797bd690eb9e,05-04-2025,2025-04-05 16:20:35.000 UTC,194,28540344,0x827922686190790b37229fd06084350E74485b72,10568462,270524616892391,104507012575472934229,10821
0x2791dc5e14f7680d9d969acc26059ba56403b6d5,0x24ead1425eeb05cbe0668baebba96d90e3082c9e06456932088add19caa82214,07-01-2025,2025-01-07 22:44:25.000 UTC,439,24750259,0x827922686190790b37229fd06084350E74485b72,5213474,1294963887563746144,3093116895,166438545366268751440
0x2791dc5e14f7680d9d969acc26059ba56403b6d5,0x064395bd440f3e66d86924ed249baeb695e8f4f6f9b96e1b718c0e2cd527a747,09-03-2025,2025-03-09 05:01:43.000 UTC,273,27353578,0x827922686190790b37229fd06084350E74485b72,8660628,22070875594746719,42609690,4465042402811290924410
0x095d0de0ecfd6832f1a7961ae26d285d68655d60,0x7fd316ace929f8e8d606cc0e2eb14fc6c27230dfd4c898d69f7463d344f1bcb7,08-02-2025,2025-02-08 07:33:03.000 UTC,551,26105318,0x827922686190790b37229fd06084350E74485b72,6918947,87886943522050423,211413939,48758470584952399463893
0x9eb86e93a809a41ab0e7cc0ba6f62561fda3015c,0x42b129be1d263b22b9c96161fca3e06efe54b126d84d7d9a473b7b888048e646,12-02-2025,2025-02-12 21:31:29.000 UTC,275,26303271,0x827922686190790b37229fd06084350E74485b72,7207852,5573652855111381912014,217765901679160415,53073571565549789330106
0x2791dc5e14f7680d9d969acc26059ba56403b6d5,0x4bd14499b70c4fe4e1c3fd82ed1da9c86c7347f63a36c6a7e4d7e80dbfe66ccd,25-02-2025,2025-02-25 07:56:33.000 UTC,564,26840423,0x827922686190790b37229fd06084350E74485b72,7965637,281531607808267143,1154670828,81191028769393032268257
0x8fd1b615c006ebeb8a7cfb00a1dd809f31943b08,0xe367090eda2c08f9d8131e54a4f56476c8619e15a99fa73f8b7c996cec73a916,23-12-2024,2024-12-23 21:11:05.000 UTC,546,24099459,0x827922686190790b37229fd06084350E74485b72,4511911,7398847595807530793,2936224216686872562,10211765744888229
0x9eb86e93a809a41ab0e7cc0ba6f62561fda3015c,0xc3dd57d052156717573e26151a04a647733892b26481996b66ecb697e5c2326a,04-01-2025,2025-01-04 20:51:43.000 UTC,417,24617278,0x827922686190790b37229fd06084350E74485b72,5081640,2044295890544762024826,97047043085527080688,584981636539806291
0x2791dc5e14f7680d9d969acc26059ba56403b6d5,0x0a873e00179b8b7c3e87ee1ebe74d57ae14d83156d4339d332aef4f31481a4c9,09-07-2025,2025-07-09 16:45:17.000 UTC,172,32645085,0x03a520b32C04BF3bEEf7BEb72E919cf822Ed34f1,3498604,115724083623407570482,110392475571094059,205192171802133642456
0x9eb86e93a809a41ab0e7cc0ba6f62561fda3015c,0x4952a5aa956ff3a61bf63be24d04d9cd6d7a5857bb56cba01717a1aefc0f8274,13-06-2025,2025-06-13 16:48:01.000 UTC,1399,31521967,0x827922686190790b37229fd06084350E74485b72,16384943,21501273579,545309,529676
0x8810de2baa17067ddcfbd9e8f29c55f070a55f0b,0x210a4f7feb73aab72b9578895370c591337fca179e7db7b31db569cce8a9ca3f,11-05-2025,2025-05-11 05:51:01.000 UTC,282,30076657,0x827922686190790b37229fd06084350E74485b72,13374240,60345049971242908,13125812311109362057070,103964145
0xdc98dbffcc648d6088a2ff8f7dc01aef050e58fc,0x000f61105be98682a9ecc8f29250c2ce56f028bc8a0c170ce4e09ee65adc9ffd,17-01-2025,2025-01-17 11:54:19.000 UTC,407,25162756,0x827922686190790b37229fd06084350E74485b72,5720106,367201654022190860294,142994362329665176720,316474645679439387
0x2791dc5e14f7680d9d969acc26059ba56403b6d5,0xf1f3ddb67d2c9756deea9f9e453c95c9893696c0c1bd3df89f085913ba4aab4c,09-03-2025,2025-03-09 08:22:03.000 UTC,259,27359588,0x827922686190790b37229fd06084350E74485b72,8718825,60722096906796345619,46928397670461897,68546958035732269014
0x38f6d2d9ea493c3c6ee865b5b952b5fe9e3e61fc,0x727983b55094847431d41db1703ebdc447a33775a626ab07b14b20462d4f3ef2,22-05-2025,2025-05-22 22:40:55.000 UTC,471,30582154,0x827922686190790b37229fd06084350E74485b72,14457757,8178581031,366127,42448
0x2791dc5e14f7680d9d969acc26059ba56403b6d5,0x04573ec277508ec3b4aa08bf2e92b566dc2c79002049dda579d174c61b37c3df,29-12-2024,2024-12-29 06:48:09.000 UTC,284,24332771,0x827922686190790b37229fd06084350E74485b72,4771170,1338097610483601553872,682410133404042572078,572380146526136471
0x8508fd4238162cb3f3d485f432202af3b40f164e,0xd1890196465f63e0d23c2c433ad6c3e51a6bf71bb19bfa754988ab6014c64b14,12-04-2025,2025-04-12 04:39:03.000 UTC,334,28821698,0x827922686190790b37229fd06084350E74485b72,10988378,158222202813146,35155098363410619242,17710
0x19d36b9ee92a53ec1900447eba958f0030c688be,0x44b3cb6d5ffd5f95037b8ceb6352f2d6a8596ce79b7acb499491fea7fc66cf12,19-05-2025,2025-05-19 05:01:05.000 UTC,207,30420759,0x827922686190790b37229fd06084350E74485b72,14089769,69177724477586678,116596693,117132681195588707762340
0x351f61e4c49cf11f24d9f2e737ca5eff81806355,0x8b0d2767c31ecbb93e9221c53a3a330480849f2438eb9f7df7a08886c290adf9,21-10-2025,2025-10-21 22:16:17.000 UTC,891,37147815,0x827922686190790b37229fd06084350E74485b72,29534898,138098076854930926,235551796,70706878316193869684033
0xdc98dbffcc648d6088a2ff8f7dc01aef050e58fc,0x643b83d98674b2990ea384530f2a6f592299fa9e610fc0f90df40a804aef3d07,20-03-2025,2025-03-20 07:45:31.000 UTC,129,27833692,0x827922686190790b37229fd06084350E74485b72,9429051,7905599454218326,359508562,378120142308484806841
0x095d0de0ecfd6832f1a7961ae26d285d68655d60,0xce9d636ecc9ccde822501d30ecf8875582eb66b6a165bf6663762d43bebed000,06-05-2025,2025-05-06 17:21:11.000 UTC,678,29881362,0x03a520b32C04BF3bEEf7BEb72E919cf822Ed34f1,2976605,122181499724860792330,196246922248593738,396966724825439499667
0x2791dc5e14f7680d9d969acc26059ba56403b6d5,0xa2bfe127c2ef6d53ff99bfca28f3aa7de49bcbc898d5c35e1f3e1b2456902618,27-12-2024,2024-12-27 07:28:49.000 UTC,381,24247591,0x827922686190790b37229fd06084350E74485b72,4673890,4805033324432219791,987297511027454986,3418894052824353
0x38f6d2d9ea493c3c6ee865b5b952b5fe9e3e61fc,0x5c927a76697c2d79b581008dbc28d1a5ec34d0d03aa8cddf519a7dd38cff2bda,04-01-2025,2025-01-04 11:44:11.000 UTC,405,24600852,0x827922686190790b37229fd06084350E74485b72,5063001,1781997371902698970059988,3198268449456287163982,11350821880055328870911
0x9eb86e93a809a41ab0e7cc0ba6f62561fda3015c,0x473cad1fd9d867b1ba42435df710708a139f2cfd77b8e48681e99da6e123a4fd,29-12-2024,2024-12-29 16:15:15.000 UTC,229,24349784,0x827922686190790b37229fd06084350E74485b72,4785880,618828466386926386662,277510058011287035508,305813240258221848
0x8fd1b615c006ebeb8a7cfb00a1dd809f31943b08,0x0b324086d1df92c45976fe6264217117dca797b664ed64415339e387e5534bab,19-12-2024,2024-12-19 06:10:49.000 UTC,422,23899651,0x827922686190790b37229fd06084350E74485b72,4250231,6348697784114766069,5250758808626259019,6268562046447034
0xdc98dbffcc648d6088a2ff8f7dc01aef050e58fc,0x50505fcb8e3f399a774601d27f7fd971dff441d9a04f951ed7921a2696ad6a82,24-01-2025,2025-01-24 05:15:19.000 UTC,325,25453186,0x827922686190790b37229fd06084350E74485b72,6084813,232412939137312347698859,1149574808489192032025,197129159286417904871492
0xdc98dbffcc648d6088a2ff8f7dc01aef050e58fc,0x66f5fa36d6491c3c7aea6c8f7ac1179f6e06eca884b022f37e7df54bc891ce03,13-12-2024,2024-12-13 00:21:59.000 UTC,602,23629986,0x827922686190790b37229fd06084350E74485b72,3924061,401833162114149601723,627997133414228765068,210342974716425367
0x8810de2baa17067ddcfbd9e8f29c55f070a55f0b,0xc329cdb9aa9b5b75da0cb56903fe8ab224f95dae5d58b1e4afc7095ff42c4da3,28-07-2025,2025-07-28 09:05:33.000 UTC,1407,33452093,0x03a520b32C04BF3bEEf7BEb72E919cf822Ed34f1,3624548,1678172585568216991095,48619168648843499,33923565488786996423450
0x8fd1b615c006ebeb8a7cfb00a1dd809f31943b08,0xa31e8bf5bd55fba540b1eb78460c2d0193ea4510938e1963e0a5b9c614b32d9c,23-12-2024,2024-12-23 18:16:29.000 UTC,637,24094221,0x827922686190790b37229fd06084350E74485b72,4490263,8533930124448734292,2799631069804781071,11988104677282868
0x8fd1b615c006ebeb8a7cfb00a1dd809f31943b08,0xd21d31bbdb93c56285ffe05a9a94727a3c51ef4caf93d82a4f749d9c4104b2a9,23-12-2024,2024-12-23 01:57:53.000 UTC,399,24064863,0x827922686190790b37229fd06084350E74485b72,4409690,9825460627204860339,16727221062528097244,3538871665323444
0xdc98dbffcc648d6088a2ff8f7dc01aef050e58fc,0x41fa030e52da1f4e7717d8ae58479d6c4052635bd524d42df96bcd99f282ef4f,09-01-2025,2025-01-09 21:46:21.000 UTC,579,24834917,0x827922686190790b37229fd06084350E74485b72,5313358,15929456960443762902,4741867741427439616,339916020979027
0x2791dc5e14f7680d9d969acc26059ba56403b6d5,0x611651af89d1aac328673318d26530a743641e91c1b7d71338e2ec0c59cb971c,16-01-2025,2025-01-16 01:09:51.000 UTC,602,25100222,0x827922686190790b37229fd06084350E74485b72,5634487,353355359422691046,799616635,15437836472271861165961
0xdc98dbffcc648d6088a2ff8f7dc01aef050e58fc,0x6d99f3ded53838d7373c8809bc95b260342f7674e50f703011dfc6aaa917cbf4,14-01-2025,2025-01-14 12:24:35.000 UTC,325,25034064,0x827922686190790b37229fd06084350E74485b72,5547121,457623378657410383072873,178288340544443808755,16435215937724400506315
0x9eb86e93a809a41ab0e7cc0ba6f62561fda3015c,0x5b7e5275406357e9b7fd45a6682433e219fe9efa43e05085001a5015ccc34933,19-02-2025,2025-02-19 10:14:21.000 UTC,239,26585357,0x827922686190790b37229fd06084350E74485b72,7593336,5517459632,70724101,813461
0x8fd1b615c006ebeb8a7cfb00a1dd809f31943b08,0x2fded81e6b133d4ca75e8d54fe1a8792151923038e54d85e15c6668b6d3489bd,12-02-2025,2025-02-12 23:10:31.000 UTC,267,26306242,0x827922686190790b37229fd06084350E74485b72,7212819,2282307925003445,261285373493444386,1069786157
0x2791dc5e14f7680d9d969acc26059ba56403b6d5,0x428561e361ac7084585b4ce4fffb42ed6770ae21277e5c3d9726f68cd3f27684,09-01-2025,2025-01-09 05:31:23.000 UTC,183,24805668,0x827922686190790b37229fd06084350E74485b72,5282873,1522716633616040004665921,3455137382198878463786,1179675490539523816609
0xdc98dbffcc648d6088a2ff8f7dc01aef050e58fc,0x388ab7949d876d0fb500094520a85386bf2b6f50887ccc4bff46da198bc35fff,14-01-2025,2025-01-14 21:18:21.000 UTC,231,25050077,0x827922686190790b37229fd06084350E74485b72,5568198,8452552703449995868871,363421090500843223,19436614950627234176795
0xdc98dbffcc648d6088a2ff8f7dc01aef050e58fc,0x9e31080e1f3df97d2e518b2a2a01df9d197487df0e9e0d1996a46755fb95af7d,11-01-2025,2025-01-11 11:20:19.000 UTC,305,24902536,0x827922686190790b37229fd06084350E74485b72,5396533,1259494131750607561020,63400767776751470547,320739863540599572
0xdc98dbffcc648d6088a2ff8f7dc01aef050e58fc,0x1bf4e1a63c68ad35df1d26d886b14c3cb310c75287e0357ef11b778650233424,25-05-2025,2025-05-25 01:18:41.000 UTC,427,30673287,0x46A15B0b27311cedF172AB29E4f4766fbE7F4364,386899,12573829038904322905572,195586650565309848,444115470813943355
0x2791dc5e14f7680d9d969acc26059ba56403b6d5,0x6080ed1201dabd1f433007d84d706f608b7041a886c7b81bee4d43fb58c484f6,06-03-2025,2025-03-06 17:46:41.000 UTC,484,27246927,0x827922686190790b37229fd06084350E74485b72,8557676,226315520539527623,729085961,82234090045387236884649
0x095d0de0ecfd6832f1a7961ae26d285d68655d60,0xac9399621b680ae99f6281c96439ecef66db8209aa53560fd1a5aada37be449d,13-03-2025,2025-03-13 06:23:09.000 UTC,387,27528821,0x827922686190790b37229fd06084350E74485b72,8956229,367323329252535569264536,75559262902678577297,164759437566702050721115
0x2791dc5e14f7680d9d969acc26059ba56403b6d5,0xe83bd24a858f7cb5b60581914e6463c27989149a237051ac7cd1cec514eb3aff,29-12-2024,2024-12-29 03:03:11.000 UTC,330,24326022,0x827922686190790b37229fd06084350E74485b72,4760158,5778951624769617428,831624554184147533,4625727946349453
0x2791dc5e14f7680d9d969acc26059ba56403b6d5,0x6424df0e6869b5710b45068abf7ea3745f1e9ea6e1a880209c5eb699556c5bd6,02-01-2025,2025-01-02 10:18:27.000 UTC,456,24511880,0x827922686190790b37229fd06084350E74485b72,4970649,3405708706513459071067,570403052143099768221,475596950458353574
0x38f6d2d9ea493c3c6ee865b5b952b5fe9e3e61fc,0x60a8a1dfed4886f727fdbd72deb9994aad64c3557712bf0e999315463b5b4249,06-01-2025,2025-01-06 15:22:39.000 UTC,628,24693806,0x827922686190790b37229fd06084350E74485b72,5152383,1834858447909946598671,253424469009346872465,329182875688689887
0x2791dc5e14f7680d9d969acc26059ba56403b6d5,0x40e6837dfd84fbe058c672c4f05758b66b8ed94686731cf2b60430ab2df95d23,04-01-2025,2025-01-04 11:39:17.000 UTC,356,24600705,0x827922686190790b37229fd06084350E74485b72,5062872,1517914044413950545,368035557,52963369694461986203147
0x8810de2baa17067ddcfbd9e8f29c55f070a55f0b,0x44d35fc1fd9b25c466bd613a3542e9a8e217084132793790e67ec79dfa3efe07,25-03-2025,2025-03-25 19:49:21.000 UTC,573,28071407,0x827922686190790b37229fd06084350E74485b72,9783697,132411490936625735,106003798,56765889935461380992162
0x8508fd4238162cb3f3d485f432202af3b40f164e,0xa092d106789c1660e867b8069480d59555838f4f22f444a20f3b4dedbd37c7a2,25-05-2025,2025-05-25 09:21:39.000 UTC,226,30687776,0x827922686190790b37229fd06084350E74485b72,14680149,271480248975412952748,139185392358013316,207223751937514960221
0x38f6d2d9ea493c3c6ee865b5b952b5fe9e3e61fc,0x1f2cef5ed08b0201442a64805b172436e619dd2a7563a63cc4de63d59812d86d,12-12-2024,2024-12-12 01:16:03.000 UTC,338,23588408,0x827922686190790b37229fd06084350E74485b72,3869720,390987820545376597,738109120,290157716448861103516869
0x8fd1b615c006ebeb8a7cfb00a1dd809f31943b08,0x9e0edccd227ea002431c03981a18f0e2b5615abc33fcde5c482ae92b057e47e8,06-04-2025,2025-04-06 20:32:01.000 UTC,737,28591087,0x827922686190790b37229fd06084350E74485b72,10634452,581977561937038951,1386717793,358055889014766120695686
0x8810de2baa17067ddcfbd9e8f29c55f070a55f0b,0x188821a98a24795ed993cf341c871ad90254152c03e9f7bf625b4d48c765dbb4,21-07-2025,2025-07-21 10:35:31.000 UTC,327,33152392,0x03a520b32C04BF3bEEf7BEb72E919cf822Ed34f1,3577090,3105682040591470949094,84327244183331314,67713436887244351013141
0xdc98dbffcc648d6088a2ff8f7dc01aef050e58fc,0x324f7f1aa7e9fda038fcce35cadbd92872c8338075f0a08bc50a19d57cd65b97,08-01-2025,2025-01-08 02:27:59.000 UTC,364,24756966,0x827922686190790b37229fd06084350E74485b72,5221753,641702885410029241,538360126,43169036053563292159310
0x2791dc5e14f7680d9d969acc26059ba56403b6d5,0xefcfe792a382d308dd4eee73158e0ad8caa00854d7f20c705b0d73014f654154,16-01-2025,2025-01-16 05:00:15.000 UTC,585,25107134,0x827922686190790b37229fd06084350E74485b72,5644227,14079670838763852787404,347460159907272424,13601330007047319355858
0x2791dc5e14f7680d9d969acc26059ba56403b6d5,0xf76f4df2cf947175b1f904b9f6b7c817c6eee76b182d6f21954832e7f34b209d,31-12-2024,2024-12-31 00:25:45.000 UTC,385,24407699,0x827922686190790b37229fd06084350E74485b72,4844950,9595819351834411883,5361374280519055934,3642196747331483
0x8508fd4238162cb3f3d485f432202af3b40f164e,0x091a73c5e25b532ffd48a891a535248819b3b2780d3a839ed7f28a16bced4d91,02-06-2025,2025-06-02 05:09:03.000 UTC,685,31025798,0x827922686190790b37229fd06084350E74485b72,15384756,14175078343,494843,213495
0xdc98dbffcc648d6088a2ff8f7dc01aef050e58fc,0x9af8220c0ab8b4443ed9c2ed3a511bcc3491a263aa1884b11207f4bec27f530d,24-12-2024,2024-12-24 00:05:07.000 UTC,309,24104680,0x827922686190790b37229fd06084350E74485b72,4523418,305041736184378546180,250890498822171583013,314122541025751205
0x095d0de0ecfd6832f1a7961ae26d285d68655d60,0x05a51ca42726bb04eebd98eff1e8ca6a7f516e673bb7186ca238b5360bdaaee4,22-01-2025,2025-01-22 04:38:25.000 UTC,468,25365679,0x03a520b32C04BF3bEEf7BEb72E919cf822Ed34f1,1894299,10794300878524202273889,1238994672636522485,136522754408404483287132
0x8508fd4238162cb3f3d485f432202af3b40f164e,0xb072fde43fa4a2f5a9688ab3283a52fc96dee169f76252010ebc5cc452b57344,16-04-2025,2025-04-16 08:19:57.000 UTC,536,29001125,0x827922686190790b37229fd06084350E74485b72,11312082,116821536829965,51063937024746905930,1473
0xdc98dbffcc648d6088a2ff8f7dc01aef050e58fc,0x1345387847eb4e10e8fd6c9942630acdb05e8282a97e1da74fe99e3da7cea8fd,12-01-2025,2025-01-12 21:21:35.000 UTC,623,24963774,0x827922686190790b37229fd06084350E74485b72,5461349,491131598832311659,1114629087,21215062561241552463705
0xdc98dbffcc648d6088a2ff8f7dc01aef050e58fc,0xfcc29753bce0aa1a285a5c1c6ee2ffa612dcb8373605f8984dc07a864db7faeb,07-06-2025,2025-06-07 19:23:41.000 UTC,230,31267437,0x46A15B0b27311cedF172AB29E4f4766fbE7F4364,398872,11351803830460142246442,432746845767971819,118873871729942456
0xdc98dbffcc648d6088a2ff8f7dc01aef050e58fc,0xf1df05db680f8d4c6205e98974a18200d11c461fcbf8955c8944053f197710c5,04-01-2025,2025-01-04 22:36:29.000 UTC,484,24620421,0x827922686190790b37229fd06084350E74485b72,5084998,2505342021193707477631,589307021140982995208,155017944301887414
0x2791dc5e14f7680d9d969acc26059ba56403b6d5,0x1c576574b03c432243de327765e976cb66fa22a8971b715fe97b2fdd9ba9098f,18-12-2024,2024-12-18 19:42:53.000 UTC,311,23880813,0x827922686190790b37229fd06084350E74485b72,4221647,11767908372654814509,10234036333909786145,2038377381946092
0x38f6d2d9ea493c3c6ee865b5b952b5fe9e3e61fc,0x533a7d5e73fa1f372320b271a49a8d35a0e92c7feb51bfa0e03b19e49d67151c,03-07-2025,2025-07-03 02:51:13.000 UTC,547,32360863,0x46A15B0b27311cedF172AB29E4f4766fbE7F4364,425569,12000969307,184644,415478
0xdc98dbffcc648d6088a2ff8f7dc01aef050e58fc,0x6bb68816b9e14e392c58bfb3bc583081d4e55c36c4f92eda808635c9b6af608c,07-02-2025,2025-02-07 08:40:19.000 UTC,712,26064136,0x03a520b32C04BF3bEEf7BEb72E919cf822Ed34f1,2050573,8970549746942760717149,447098251673169595,140764762754170884564355
0x9eb86e93a809a41ab0e7cc0ba6f62561fda3015c,0xa8e8d4e9e51e4cfe7e6dd2941d6669276be431709ed0c345a54cb4be0055b20b,01-01-2025,2025-01-01 22:04:15.000 UTC,495,24489854,0x827922686190790b37229fd06084350E74485b72,4943903,592645591849760691029409,516124469106958598144,16041211725116447210093
0xdc98dbffcc648d6088a2ff8f7dc01aef050e58fc,0xe17dc4695dd3be019165e1aa4669228c299e2978dca35080e90faef1a5be1a3a,05-01-2025,2025-01-05 19:52:09.000 UTC,334,24658691,0x827922686190790b37229fd06084350E74485b72,5109265,20820178409151797272,3403303193204658227,3143352425519709
0x2791dc5e14f7680d9d969acc26059ba56403b6d5,0xc342b602ad78d5607bc836051fedbb53062b7169255d2a9c3cf35c8d91bef685,18-01-2025,2025-01-18 22:31:07.000 UTC,260,25225060,0x827922686190790b37229fd06084350E74485b72,5804956,39838720779890795220803,154710031032477733886,4008978195730142504649
0x8fd1b615c006ebeb8a7cfb00a1dd809f31943b08,0x6155f979148acadbb85dadabbcf8dea29b8d860c7b4989929fb8c6c726329514,03-01-2025,2025-01-03 00:44:21.000 UTC,428,24537857,0x827922686190790b37229fd06084350E74485b72,5001458,9367610774583275182959,81051102229194556,18091671937915832740185
0xdc98dbffcc648d6088a2ff8f7dc01aef050e58fc,0xfeb207a878a7832cb62d5af9e4cc5627b21ede7e9352772b24a064353b8f52af,03-07-2025,2025-07-03 03:03:29.000 UTC,479,32361231,0x827922686190790b37229fd06084350E74485b72,18170997,11314584445,496317,69136
0x2791dc5e14f7680d9d969acc26059ba56403b6d5,0xacbe33453cecec8acb034c9511f438613487e85a541032493bfb225202d3026e,19-12-2024,2024-12-19 11:21:03.000 UTC,480,23908958,0x827922686190790b37229fd06084350E74485b72,4266422,1686210487209217075674,1043454197544253972385,595508593288990582
0x8810de2baa17067ddcfbd9e8f29c55f070a55f0b,0xb7b9471207b85dc484133aae3d1078539f01cac3a04801834bb2ff8789015f15,01-09-2025,2025-09-01 05:25:59.000 UTC,284,34957506,0x03a520b32C04BF3bEEf7BEb72E919cf822Ed34f1,3837097,627069891713147972484,13674062375255795,17401262341095565726662
0x2791dc5e14f7680d9d969acc26059ba56403b6d5,0xa5012cafdd3ad1f0853835d6c61217a68a85188b402289ef14b0b549abcc553e,02-01-2025,2025-01-02 08:22:07.000 UTC,372,24508390,0x827922686190790b37229fd06084350E74485b72,4965915,1747889311822369357,680099963,58576360665746167749763
0x095d0de0ecfd6832f1a7961ae26d285d68655d60,0x077d2047e0ce8e05bf24101f93e938226aa47fd97a7541cf47d1db037115ec24,02-03-2025,2025-03-02 11:24:37.000 UTC,513,27062665,0x03a520b32C04BF3bEEf7BEb72E919cf822Ed34f1,2195017,12267480825408255819349,257332472296444453,316315221810251313289241
0x095d0de0ecfd6832f1a7961ae26d285d68655d60,0x78eda15d9f3776e4967c5083a23454f909a2ecc71409e0e2d29ef51be9f70934,19-06-2025,2025-06-19 04:22:43.000 UTC,1796,31758808,0x827922686190790b37229fd06084350E74485b72,16883980,97401286008474175870485,567479367716023914409,98811073790755512583394
0xdc98dbffcc648d6088a2ff8f7dc01aef050e58fc,0x3748f41cb8321fe7d808cbe8168f016891e6c0915a8c6df44ce03e6fe1e826c9,31-12-2024,2024-12-31 07:49:57.000 UTC,249,24421025,0x827922686190790b37229fd06084350E74485b72,4870012,1387498117554851748884194,1474681183022551707031,32172346264909665596110
0x8508fd4238162cb3f3d485f432202af3b40f164e,0x696149712f756936f0af79f69c6cf2dfe5fea8c8c9a5ba4ce47dd5b76c6f8a1c,15-07-2025,2025-07-15 18:50:05.000 UTC,656,32908029,0x827922686190790b37229fd06084350E74485b72,19478335,28006803872,562089,838337
0x095d0de0ecfd6832f1a7961ae26d285d68655d60,0x2a7365b87020b46b224425d1a263eff7ff29d35dd10e21b44facc8abb98bb3d9,23-04-2025,2025-04-23 01:28:57.000 UTC,445,29291195,0x827922686190790b37229fd06084350E74485b72,11767872,125607800505716382878728,142518947840407077235,53659130370880806077327
0x095d0de0ecfd6832f1a7961ae26d285d68655d60,0xf9dc2674b9bb35d4c9dd2487ee9dcd23bae3841a4588b756a5012c03c7c235ac,27-02-2025,2025-02-27 10:21:59.000 UTC,369,26931186,0x03a520b32C04BF3bEEf7BEb72E919cf822Ed34f1,2173214,12931271353391334557128,166090366507095178,344075383718878028655038
0x8810de2baa17067ddcfbd9e8f29c55f070a55f0b,0xf4e1106e70dcb0bceb879c994a624a5a85db7e5723fa71527daf9943a00c64e1,23-04-2025,2025-04-23 04:31:49.000 UTC,701,29296681,0x03a520b32C04BF3bEEf7BEb72E919cf822Ed34f1,2917922,195735520399417900386,2620317068008105,5481056749283010651573
0x8fd1b615c006ebeb8a7cfb00a1dd809f31943b08,0x8754871abf732282df0340304a95c8ea72694118379a4d910e4073ac2259ebab,07-01-2025,2025-01-07 00:38:47.000 UTC,264,24710490,0x827922686190790b37229fd06084350E74485b72,5173263,4636166757915584883984,1079621177986588948525,1863580823140822239
0x351f61e4c49cf11f24d9f2e737ca5eff81806355,0x606ee52de4e4fdeccfbc686d482f5fc703404f450ef6fa1a9a924600590979a6,23-08-2025,2025-08-23 02:06:13.000 UTC,665,34562713,0x827922686190790b37229fd06084350E74485b72,23267638,721788731560476580,228328070,276668839011287128959971
0x8fd1b615c006ebeb8a7cfb00a1dd809f31943b08,0xebf452f9a4bc8057fa9e11b84007505fdc1f319978a510612287e4f8bf709e8f,19-12-2024,2024-12-19 12:48:15.000 UTC,341,23911574,0x827922686190790b37229fd06084350E74485b72,4250231,7576230651163565296,4715050683257669237,8594390657536424
0x8fd1b615c006ebeb8a7cfb00a1dd809f31943b08,0x21304f9485efdbaafe43594757c2d7350c8438a37a319ec9e6dfc89ec09c3c62,18-12-2024,2024-12-18 16:15:59.000 UTC,503,23874606,0x827922686190790b37229fd06084350E74485b72,4199283,11675261772500957514,12828882969844675199,9279852740485844
0xdc98dbffcc648d6088a2ff8f7dc01aef050e58fc,0x5f4b9312628ca1a6f87bf4f3850c5a7b714c66ce54d6c7d03b495bd2cc20bc1f,04-01-2025,2025-01-04 14:36:29.000 UTC,486,24606021,0x827922686190790b37229fd06084350E74485b72,5064954,19349742763554234134,1625610772575247924,4732169101708102
0x9eb86e93a809a41ab0e7cc0ba6f62561fda3015c,0xcc608db1f0d59d84e74188054a706fca2c1b3ee69b3dd2463f476ba5c55d3ac7,09-12-2024,2024-12-09 14:25:51.000 UTC,528,23482502,0x827922686190790b37229fd06084350E74485b72,3726655,1172551674539205203560,80086808570467619,842696913666245085765
0x095d0de0ecfd6832f1a7961ae26d285d68655d60,0xc4e3637dc4426875106d3091de9914caeb32203cf52ae23c8f6f513acad3a1bd,25-03-2025,2025-03-25 00:09:41.000 UTC,519,28036017,0x827922686190790b37229fd06084350E74485b72,9724517,297617475558187653425297,242971109092034565206,121106033984441126552339
0x8fd1b615c006ebeb8a7cfb00a1dd809f31943b08,0x3322bb7c8c203a6a677591619a363d661a06be37f755c76b124f6a83bb1963f8,15-12-2024,2024-12-15 07:10:05.000 UTC,439,23728629,0x827922686190790b37229fd06084350E74485b72,3972922,6030033140927453562,10080033592382659356,2600064577399525
0x9eb86e93a809a41ab0e7cc0ba6f62561fda3015c,0x36d6ced906dd7294b4edd8b690eba8d4e864a9685cbf62a1419f2a4cfdc8136e,01-01-2025,2025-01-01 08:50:59.000 UTC,266,24466056,0x827922686190790b37229fd06084350E74485b72,4919669,4022562731974352171214,61741858997176371719,1315969740528897713
0x095d0de0ecfd6832f1a7961ae26d285d68655d60,0x496366341f985d6ec4450e0ab7a2fee19dccbe0bfb77a889e124c590f69fcf5c,18-01-2025,2025-01-18 22:43:31.000 UTC,150,25225432,0x827922686190790b37229fd06084350E74485b72,5807674,3751091692679234599408,106517147681683888,92624118262997475468634
0x8508fd4238162cb3f3d485f432202af3b40f164e,0x47976c967fbad7cf6f3a6efaff21e0fcffde917c1ae6c92073fcbf4b1ae68ef1,10-04-2025,2025-04-10 17:18:35.000 UTC,401,28758084,0x827922686190790b37229fd06084350E74485b72,10883940,184776018817046,8392865475939489344,35212
0xdc98dbffcc648d6088a2ff8f7dc01aef050e58fc,0xe5c2e8fc352ae84c95e562a5cf96e1ee859dc673b8c511c9731787e613b2e33f,23-05-2025,2025-05-23 06:45:41.000 UTC,989,30596697,0x827922686190790b37229fd06084350E74485b72,14494237,13939265600620796,1099563081,6034331760104554668
0x2791dc5e14f7680d9d969acc26059ba56403b6d5,0x1c2e198af3ec6f832cec1730a18620abba1af2186c86d5e71bf65f45d9750ce9,14-12-2024,2024-12-14 18:19:23.000 UTC,282,23705508,0x827922686190790b37229fd06084350E74485b72,4005402,16973217901238442244,10217530336674126363,1938109835308226
0x095d0de0ecfd6832f1a7961ae26d285d68655d60,0xac1420ecee548f3b93555da4d263888c54f10c202ff486bc6ff6385445131ebb,13-04-2025,2025-04-13 23:31:57.000 UTC,799,28898885,0x827922686190790b37229fd06084350E74485b72,11122431,159497426738615192642690,162589828779236116580,68413263520125123388226
0x8508fd4238162cb3f3d485f432202af3b40f164e,0x7465bea92d70971589eeeab2edcc9e047d5427fb1cff70e374c2065c0194a28b,09-05-2025,2025-05-09 11:56:53.000 UTC,485,30001233,0x03a520b32C04BF3bEEf7BEb72E919cf822Ed34f1,2993252,4050004616339974537332,154380796222203029,63837809022194180302066
0x38f6d2d9ea493c3c6ee865b5b952b5fe9e3e61fc,0x0b0a4b1ea12e754f4d7b9ff91fceb00ea21906996e12e2659014dc17217311a0,06-01-2025,2025-01-06 22:02:51.000 UTC,271,24705812,0x827922686190790b37229fd06084350E74485b72,5168773,1672981647581049330690785,527010956447226017152,67292171693623632226972
0x9eb86e93a809a41ab0e7cc0ba6f62561fda3015c,0x6deac8715bbd24b74f3a42c8f3a0bc06394fe8f67e6f671af8dd6074e8254c6a,07-01-2025,2025-01-07 14:31:01.000 UTC,359,24735457,0x827922686190790b37229fd06084350E74485b72,5194203,1481912007102194868284,290343411582197781617,172218003499616638
0x095d0de0ecfd6832f1a7961ae26d285d68655d60,0xd2375fc639e53272cac6bf308e2b94aca70fa588a0e91d23e094474a24ba4ecd,05-06-2025,2025-06-05 06:44:01.000 UTC,560,31158247,0x03a520b32C04BF3bEEf7BEb72E919cf822Ed34f1,3178807,4643980752527812372973,11950947431607167,217819847028194153580297
0x2791dc5e14f7680d9d969acc26059ba56403b6d5,0xdd0e3c579df2b11238de8708c44e408d38ff590e7f3b02d05519d2f53fa3f1e1,24-12-2024,2024-12-24 15:01:07.000 UTC,425,24131560,0x827922686190790b37229fd06084350E74485b72,4548217,4794795812633162404,657477845135993830,3713429310338507
0xdc98dbffcc648d6088a2ff8f7dc01aef050e58fc,0x68baa7eaa96079d5606374a6e80258d811a4c3a432ff385911f70722ba6dc38a,02-01-2025,2025-01-02 16:41:45.000 UTC,380,24523379,0x827922686190790b37229fd06084350E74485b72,4985354,1046707570526389089894754,55349133636681763928,51708246664660778671408
0x2791dc5e14f7680d9d969acc26059ba56403b6d5,0x4a7ac35c8fefa36d96ed9e5f821c57fba2d0274ca1bbfef5225d04028ab7a42f,16-12-2024,2024-12-16 16:25:25.000 UTC,481,23788489,0x827922686190790b37229fd06084350E74485b72,4104328,3253161904555999429438,572616626150250620439,1380331239588115327
0xdc98dbffcc648d6088a2ff8f7dc01aef050e58fc,0x61e7e5d3613280b440210d8ddf5086db2ef5c7554208d88112db94e91d735fcb,19-05-2025,2025-05-19 22:16:19.000 UTC,1135,30451816,0x46A15B0b27311cedF172AB29E4f4766fbE7F4364,383550,13058807954769370319412,619410313295025543,3479811321087116
0x9eb86e93a809a41ab0e7cc0ba6f62561fda3015c,0xc695421a2380684cbb4173fbccba81d85e5d633c3bcfabd208f1231357002f13,08-01-2025,2025-01-08 18:46:15.000 UTC,439,24786314,0x827922686190790b37229fd06084350E74485b72,5258983,1267420815606877522029,193762941415049577078,206190979579080885
0x095d0de0ecfd6832f1a7961ae26d285d68655d60,0x3c99b3f304b0c578b352830177d1fbefb9ff2173805fce5d46d468d5de414026,28-03-2025,2025-03-28 15:21:19.000 UTC,343,28192966,0x827922686190790b37229fd06084350E74485b72,9985929,254238388914644196895375,230964507797284735911,104700448630600240100858
0x9eb86e93a809a41ab0e7cc0ba6f62561fda3015c,0x6432dedb88a11a554649e92687f3366935ecbe660563f430c36b9918273c1829,06-06-2025,2025-06-06 03:41:27.000 UTC,483,31195970,0x827922686190790b37229fd06084350E74485b72,15728011,24128654975,440098,766497
0x2791dc5e14f7680d9d969acc26059ba56403b6d5,0xfcb3415704aa2b4d7b384fc582d70c2195f3d8cdfbd3e6e9261e221e8013e568,22-12-2024,2024-12-22 06:59:03.000 UTC,393,24030698,0x827922686190790b37229fd06084350E74485b72,4409718,5460517714262272268,4861584731521636875,839081142704876
0x8810de2baa17067ddcfbd9e8f29c55f070a55f0b,0xac121e54461e08b3ca2c79bbac5e8d70fc686e1e0f03b48399e64ff5dc8abfea,24-04-2025,2025-04-24 10:25:41.000 UTC,897,29350497,0x03a520b32C04BF3bEEf7BEb72E919cf822Ed34f1,2924950,188708992663172154378,2870691687612334,5010769814833891344487
0x8508fd4238162cb3f3d485f432202af3b40f164e,0x98417232101de95a2b0367531477de5ce0fd7b8dd597144c515d2cfefa4b7cee,03-06-2025,2025-06-03 04:56:51.000 UTC,265,31068632,0x827922686190790b37229fd06084350E74485b72,15478567,13871150721,686332,6494
0xdc98dbffcc648d6088a2ff8f7dc01aef050e58fc,0xffc15af150b4eeef8b217a9d2b0c311589ba84ba312fd615d4640119c104a9af,06-01-2025,2025-01-06 21:49:21.000 UTC,596,24705407,0x827922686190790b37229fd06084350E74485b72,5168402,908382404024034545590082,403776475479911575484,33884025804461523690159
0x38f6d2d9ea493c3c6ee865b5b952b5fe9e3e61fc,0xdd276840df7e41c8705f07b167c3cf52b7d18d5e3b6856dfe2faddd0b324bc9d,18-02-2025,2025-02-18 05:26:03.000 UTC,293,26533508,0x827922686190790b37229fd06084350E74485b72,7515268,19575511467848495709119,387267477962967048,92130965741198000612635
0x19d36b9ee92a53ec1900447eba958f0030c688be,0xcec8969035a7b91a5fcad2add235c5b075ae062cf8423ce6d7a6fac9b08585aa,01-06-2025,2025-06-01 04:15:13.000 UTC,192,30980983,0x03a520b32C04BF3bEEf7BEb72E919cf822Ed34f1,3145966,32962129340815826750305,324122756851963482,734374012849603689174571
0x2791dc5e14f7680d9d969acc26059ba56403b6d5,0x9e47f262cef38f36ee9fecd847a9d88189abe5f5f0766e7d774c9a4d6837a4f7,27-12-2024,2024-12-27 09:03:01.000 UTC,457,24250417,0x827922686190790b37229fd06084350E74485b72,4673890,6132859290136369236,1680922296375391860,3977736692077818
0x2791dc5e14f7680d9d969acc26059ba56403b6d5,0xe92936fb65f81439e092313e0444a8455c0817a0d26d47ab8f7bf632404474b8,02-01-2025,2025-01-02 11:52:21.000 UTC,539,24514697,0x827922686190790b37229fd06084350E74485b72,4974303,3225665898135305353038,574956072813196994422,406636292541308022
0x38f6d2d9ea493c3c6ee865b5b952b5fe9e3e61fc,0x22f965600129caa37010276b54a69eaecbb8158ca64a36c0aa885eb533e0f4a4,02-01-2025,2025-01-02 13:00:49.000 UTC,324,24516751,0x827922686190790b37229fd06084350E74485b72,4976773,1734496282609130399222,170079324101455700503,404233744021044521
0x38f6d2d9ea493c3c6ee865b5b952b5fe9e3e61fc,0x74e29fab8b97a6ecca824efa7a2e113b4b4e81149f8c294689daf1b83027cf89,05-06-2025,2025-06-05 07:56:11.000 UTC,402,31160412,0x46A15B0b27311cedF172AB29E4f4766fbE7F4364,396733,5605356306,117841,162433
0x38f6d2d9ea493c3c6ee865b5b952b5fe9e3e61fc,0x9c1b52b0dda73e337c9aae9545f270375faa0279587f2a8923d32962e0c701b4,04-01-2025,2025-01-04 13:27:21.000 UTC,458,24603947,0x827922686190790b37229fd06084350E74485b72,5066524,1787261099606801575,223154704,64889098677212051134864
0xdc98dbffcc648d6088a2ff8f7dc01aef050e58fc,0xb2807cc1b3bcbb2995147a9435a001889fe312908fe33c3566d29477560c5867,17-07-2025,2025-07-17 10:12:55.000 UTC,662,32978914,0x46A15B0b27311cedF172AB29E4f4766fbE7F4364,446038,14929666891,113957,632757
0x2791dc5e14f7680d9d969acc26059ba56403b6d5,0x0382ecc6b18717810ae03eb5c7a59c954dc682056fca07a2e8cfc9770d38bbba,12-12-2024,2024-12-12 06:08:13.000 UTC,536,23597173,0x827922686190790b37229fd06084350E74485b72,3881133,3666882640235523083366,60098097377325286525,1563486548181830400
0xdc98dbffcc648d6088a2ff8f7dc01aef050e58fc,0x7694321ca34a3811de77a5549d9675f44f67d1ffefbbc486d8506c918efbcd6e,12-01-2025,2025-01-12 02:36:07.000 UTC,412,24930010,0x827922686190790b37229fd06084350E74485b72,5428872,547821799289034846478927,198136365900550340370,19162673086169998259472
0x9eb86e93a809a41ab0e7cc0ba6f62561fda3015c,0x88b6f969d542055a4aa2c5a7fda0c65382f6a7bbcfcdd3a9fdb52b4bfc109bb7,28-02-2025,2025-02-28 09:49:03.000 UTC,196,26973398,0x827922686190790b37229fd06084350E74485b72,8153992,3378158901,305415731,214698
0x2791dc5e14f7680d9d969acc26059ba56403b6d5,0x432327110dd3a6c02446ae8d4882c05027e91e4075895748f354f762b33706bc,13-12-2024,2024-12-13 09:55:45.000 UTC,432,23647199,0x827922686190790b37229fd06084350E74485b72,3940533,11076426393288509797,7469640041129896002,930685708998624
0xdc98dbffcc648d6088a2ff8f7dc01aef050e58fc,0xcf5e7edb1913fa53b35bea795b67beb28ba6a5db42b15cc37c7a098109cea8c2,07-06-2025,2025-06-07 13:43:13.000 UTC,942,31257223,0x46A15B0b27311cedF172AB29E4f4766fbE7F4364,398652,11362709216187241385739,89053920861963776,498179287873406187
0x38f6d2d9ea493c3c6ee865b5b952b5fe9e3e61fc,0x7c24f1888848c01c7119767e57452b2669ea31983b0732ce2f2615d1fcb183d6,10-07-2025,2025-07-10 10:33:17.000 UTC,872,32677125,0x46A15B0b27311cedF172AB29E4f4766fbE7F4364,433955,28956521166,1379676,67189
0x8fd1b615c006ebeb8a7cfb00a1dd809f31943b08,0xffdddfd38d5c21aa11861a491d2636f1b48f8e43e2ea76cf5f2ea978299e2b0d,06-01-2025,2025-01-06 10:16:51.000 UTC,305,24684632,0x827922686190790b37229fd06084350E74485b72,5142836,2926823003271142052372,117264370933148656,7217862865218708695528
0x8810de2baa17067ddcfbd9e8f29c55f070a55f0b,0xb98fcb0dbd54a800a3e713867359e53277803d77cf631f6011015902e9f831c5,01-07-2025,2025-07-01 22:37:57.000 UTC,501,32310065,0x827922686190790b37229fd06084350E74485b72,18059365,62416347897612628,22997501,47120337565085185992295
0x8fd1b615c006ebeb8a7cfb00a1dd809f31943b08,0xd27efb2b9c0d4cf1d5e7ba4700a77e6391b802045335857bce24018e9b3b57a1,28-12-2024,2024-12-28 07:22:13.000 UTC,482,24290593,0x827922686190790b37229fd06084350E74485b72,4717816,5242590540216399239,7740517236530776004,1911523571207660
0x2791dc5e14f7680d9d969acc26059ba56403b6d5,0x1f3f434f475bc03b1dd0939d78f59d278d59ff5b8faadc1d042a5f1cb8f21a03,08-01-2025,2025-01-08 02:27:17.000 UTC,498,24756945,0x827922686190790b37229fd06084350E74485b72,5221728,1879262864522520909720829,1976217286283626465971,44446360099574848918074
0x8810de2baa17067ddcfbd9e8f29c55f070a55f0b,0xb039921a6d40b071d40421de7f0a40051fcc00fd6456503b66db927cdef2e235,21-07-2025,2025-07-21 11:13:27.000 UTC,245,33153530,0x03a520b32C04BF3bEEf7BEb72E919cf822Ed34f1,3577259,3018392648144672455566,84437100964183470,63873914609967795723746
0x8508fd4238162cb3f3d485f432202af3b40f164e,0x085852a2df0233ba36d46ad739ebaf23f01ad85d33cd8839f07fa6e949aa285c,01-06-2025,2025-06-01 21:54:09.000 UTC,681,31012751,0x827922686190790b37229fd06084350E74485b72,15357684,14387968163,257295,462341
0x2791dc5e14f7680d9d969acc26059ba56403b6d5,0x2d1b329a59a1ba56465b08091751ccede33c8f947454c38cb96e66775e2793f2,09-01-2025,2025-01-09 00:27:49.000 UTC,290,24796561,0x827922686190790b37229fd06084350E74485b72,5271517,1893636238856363079599,207918920739218125191,394668137749868726
0xdc98dbffcc648d6088a2ff8f7dc01aef050e58fc,0x74ed896cc6067a8574f27a75f22dc56dd52ecf0f52aba745fc4762e30d73c9b0,02-01-2025,2025-01-02 08:30:35.000 UTC,431,24508644,0x827922686190790b37229fd06084350E74485b72,4966263,2959463570272690237162,66751559911913062186,1022937668617655911
0x2791dc5e14f7680d9d969acc26059ba56403b6d5,0xd514dd3909aa700097965d2be2928e9146ab1f8301e853eaa31f37cb5d089c0d,08-01-2025,2025-01-08 14:20:45.000 UTC,256,24778349,0x827922686190790b37229fd06084350E74485b72,5249346,2122948644690432935410,461648823169121453032,203207258693739081
0x8810de2baa17067ddcfbd9e8f29c55f070a55f0b,0x77d2d22451d37adc0b8c499f5542cb9244d88c73ba81d6b5f7063ad4b92e1062,22-07-2025,2025-07-22 00:35:23.000 UTC,260,33177588,0x03a520b32C04BF3bEEf7BEb72E919cf822Ed34f1,3581567,2625046523429963145023,82386777602031698,50313174664072344509268
0x2791dc5e14f7680d9d969acc26059ba56403b6d5,0x4e5363b1d757f79f29301ce8095ec43b22109ed8d34bb3e24a1a00ac5dc482fd,29-12-2024,2024-12-29 04:28:43.000 UTC,221,24328588,0x827922686190790b37229fd06084350E74485b72,4768626,1355509096936275789037,789774107925915290779,481049567435464437
0xdc98dbffcc648d6088a2ff8f7dc01aef050e58fc,0xd7b606296a0a614a662d869d667d0e33cc6e051e3793bff652e785ebd5eaec12,16-01-2025,2025-01-16 00:24:07.000 UTC,595,25098850,0x827922686190790b37229fd06084350E74485b72,5632246,105031595465908246,1019526609,24991531489658503549597
0x8810de2baa17067ddcfbd9e8f29c55f070a55f0b,0x642e850c8efdceae8a25b329de0bd009b81eaf798fa01233eac38747deb5402b,18-05-2025,2025-05-18 12:54:33.000 UTC,491,30391763,0x03a520b32C04BF3bEEf7BEb72E919cf822Ed34f1,3051115,10959202150884394,438703136,239105948708365498204
0x8508fd4238162cb3f3d485f432202af3b40f164e,0x44fc1379723fd1013e50243a24cc7a51403b8b3fa6b4d8d2a54b66ead106137d,12-03-2025,2025-03-12 19:44:53.000 UTC,337,27509673,0x827922686190790b37229fd06084350E74485b72,8928712,572588095625484,64106444040236405388,102802
0x095d0de0ecfd6832f1a7961ae26d285d68655d60,0xa53760b973899b4f4ca77815cdc42962edea588f2a7233d58bdd9555d1de6855,29-03-2025,2025-03-29 11:07:47.000 UTC,252,28228560,0x827922686190790b37229fd06084350E74485b72,10041209,38501041261760523,60368194,30746726456122724401727
0x095d0de0ecfd6832f1a7961ae26d285d68655d60,0xee4cd164005729480ab9bce2e9f8c68c7db076d0c8109e381635d14ac7f091e4,13-05-2025,2025-05-13 05:57:55.000 UTC,207,30163264,0x03a520b32C04BF3bEEf7BEb72E919cf822Ed34f1,3000994,21867278417764002457,69551032470503428,23809887298141529158
0x2791dc5e14f7680d9d969acc26059ba56403b6d5,0x2509ae4ec963b1fbfd7d4695184ab674f9b8b910a83bc0a597064b444cf1db95,30-12-2024,2024-12-30 08:42:17.000 UTC,367,24379395,0x827922686190790b37229fd06084350E74485b72,4808073,7488056070394592653,5212371914673972261,1784884686125678
0x9eb86e93a809a41ab0e7cc0ba6f62561fda3015c,0xea73ad93f8d6e1b92a7e3494196f3f0cd4e8446ba4543c5e7b2a28e3165ee420,03-01-2025,2025-01-03 18:40:49.000 UTC,1056,24570151,0x827922686190790b37229fd06084350E74485b72,5035068,2483722862011575618734,525584147573264297024,228808793979729711
0x2791dc5e14f7680d9d969acc26059ba56403b6d5,0xbc8cfb59ca0d642bbb76c67a775279412509fc5894288bbaacda148993338da4,23-01-2025,2025-01-23 00:45:11.000 UTC,534,25401882,0x827922686190790b37229fd06084350E74485b72,6016953,446665249533125914,3484561176,66755652644078537465132
0x2791dc5e14f7680d9d969acc26059ba56403b6d5,0x01cea6e92b447786b47379f64a03a7e40c0c83f2cf117ef01293447e564dbdf7,23-12-2024,2024-12-23 14:25:19.000 UTC,685,24087286,0x827922686190790b37229fd06084350E74485b72,4501490,1514195230495375587318,569201319355520360462,813503757372674081
0x9eb86e93a809a41ab0e7cc0ba6f62561fda3015c,0x077d4d61448b22391ac6fbc8ea5b7c6d336840bea365e5cdb5580f82cd2c6746,19-12-2024,2024-12-19 02:46:49.000 UTC,387,23893531,0x827922686190790b37229fd06084350E74485b72,4245931,1278857567307252984167,602567110364347103595,580211701211591613
0x9eb86e93a809a41ab0e7cc0ba6f62561fda3015c,0x3cf52f1df4defb9e6d3e1bc27815b80758287c0df4eea5490e3961b9a23a4d1e,09-01-2025,2025-01-09 01:41:11.000 UTC,409,24798762,0x827922686190790b37229fd06084350E74485b72,5274338,1058872537585272921143,70316347552930150,1274703136153611260193
0x8fd1b615c006ebeb8a7cfb00a1dd809f31943b08,0x73ea485921223eb449481202feb7c02e10f28c4aadc2d59683c9c680a8ea624c,11-12-2024,2024-12-11 22:05:59.000 UTC,380,23582706,0x827922686190790b37229fd06084350E74485b72,3862717,10620305913506498911778,3226466781868971335161,3100750515432292340
0xdc98dbffcc648d6088a2ff8f7dc01aef050e58fc,0xf930ed9242c6ba05dc3bee106524782e20366a0bfccf661cd6f065531168cb1c,12-01-2025,2025-01-12 17:23:33.000 UTC,428,24956633,0x827922686190790b37229fd06084350E74485b72,5455284,1199476068035288969106,113393547311124798937,249530698025065647
0xdc98dbffcc648d6088a2ff8f7dc01aef050e58fc,0xd15a608f480a9f00a6a5d735c8a240334d948d7db64b73ce14a3ef3557e53308,02-01-2025,2025-01-02 00:04:51.000 UTC,478,24493472,0x827922686190790b37229fd06084350E74485b72,4947565,877402858470599005,1439101984,45827396317402207471954
0x0b27b59171a4ffe19f23d54126cd797be17c6551,0x0e370a3091a3bdf0eb45477879db44c57cf3d492d7e3be4a4e2eb7b0b1fe3997,19-09-2025,2025-09-19 20:56:29.000 UTC,1037,35763021,0x03a520b32C04BF3bEEf7BEb72E919cf822Ed34f1,3926390,4103543379277132062285,97459196954352932,104523714448696452874224
0x9eb86e93a809a41ab0e7cc0ba6f62561fda3015c,0x8c2c0512775923f3e018850dd7d8f8eb16f29f891efa66884c142b1a74ad6750,27-05-2025,2025-05-27 09:02:57.000 UTC,491,30773615,0x827922686190790b37229fd06084350E74485b72,14862389,34614646697,1698153,30615
0x2791dc5e14f7680d9d969acc26059ba56403b6d5,0x49fd99d3e6c721084ba4f82fc8c74b179376f5b5bc2bc48c33315589dcafca6c,14-01-2025,2025-01-14 19:00:45.000 UTC,472,25045949,0x827922686190790b37229fd06084350E74485b72,5562016,756753864128047571461663,1220405470243647982029,8937768710818853897755
0xdc98dbffcc648d6088a2ff8f7dc01aef050e58fc,0xeeee59b4f36d24e111159a743de1268eb15ddc71c51d59cb18b1fd04781749f1,29-05-2025,2025-05-29 01:30:13.000 UTC,706,30846433,0x827922686190790b37229fd06084350E74485b72,15010075,6554654358,110956,216897
0x2791dc5e14f7680d9d969acc26059ba56403b6d5,0x3452f0dfa564460a0bfcde5854b77a8cba29efa3f1e655088719cb7bbe090b01,07-12-2024,2024-12-07 18:49:33.000 UTC,380,23404013,0x827922686190790b37229fd06084350E74485b72,3636587,467581123792820312,1171358509,499999999773344365118292
0xdc98dbffcc648d6088a2ff8f7dc01aef050e58fc,0x35e5ff177a9b4e58d148d92ea1b0daddd135d47c04efedf960f578d688dcbcce,18-12-2024,2024-12-18 21:46:55.000 UTC,422,23884534,0x827922686190790b37229fd06084350E74485b72,4203951,5751503945055472828,8038054502662859957,3324034899232133
0x38f6d2d9ea493c3c6ee865b5b952b5fe9e3e61fc,0x759877f22f57e73d3023e05986bcc8d1dc9ee4e316a88dfe1f2fb9a2b312a683,02-06-2025,2025-06-02 14:45:45.000 UTC,294,31043099,0x46A15B0b27311cedF172AB29E4f4766fbE7F4364,394009,5794451840,246458,43010
0x9eb86e93a809a41ab0e7cc0ba6f62561fda3015c,0xb60878344acc440bda8ab4bcb32651efc5665f19d9fce4bc0f693a7befea019c,30-05-2025,2025-05-30 10:24:05.000 UTC,437,30905649,0x827922686190790b37229fd06084350E74485b72,15134049,32123683247,500331,1106497
0x351f61e4c49cf11f24d9f2e737ca5eff81806355,0x02ee7c44608004c15be2b8cd6802f570065891d2cb567eee87eb43e3bf8f7726,22-08-2025,2025-08-22 00:58:37.000 UTC,429,34517485,0x827922686190790b37229fd06084350E74485b72,23147258,786546143629980084,470598678,254067518873170669798582
0x38f6d2d9ea493c3c6ee865b5b952b5fe9e3e61fc,0xe6fdced48f8313e70bf5b6613d61a7cfb5ab59b3701afa6e5568b831bf94c51b,22-05-2025,2025-05-22 05:47:33.000 UTC,765,30551753,0x827922686190790b37229fd06084350E74485b72,14382645,8610493071,409364,20779
0x351f61e4c49cf11f24d9f2e737ca5eff81806355,0x691199c2d7dbddd189654de1d6b3bc7384a2b10476a298d6941ed544f1aa6cdc,04-09-2025,2025-09-04 03:08:29.000 UTC,346,35082981,0x827922686190790b37229fd06084350E74485b72,24576964,307378465722589249,163635491,111189933597491165715092
0xdc98dbffcc648d6088a2ff8f7dc01aef050e58fc,0xb2520311cc61e3e156f7ec45be9444b708e9d6663362c134ef90624f375119f0,19-06-2025,2025-06-19 12:42:13.000 UTC,2601,31773793,0x46A15B0b27311cedF172AB29E4f4766fbE7F4364,411067,11040619092313364754475,2497082499420309,576840246658639360
0x8fd1b615c006ebeb8a7cfb00a1dd809f31943b08,0x4cf4ff1214ab436fda227b66cae6423b9f316b48021777cebaab650bf2c69957,04-01-2025,2025-01-04 23:23:41.000 UTC,487,24621837,0x827922686190790b37229fd06084350E74485b72,5086329,3605067730224049860129,148153982399872682,8655373279568341307417
0x2791dc5e14f7680d9d969acc26059ba56403b6d5,0xb270d6f44c65308be429fa6c7cd64f37a7c1bd3b0dba8869a59bfb02dd297fe1,29-12-2024,2024-12-29 22:29:17.000 UTC,379,24361005,0x827922686190790b37229fd06084350E74485b72,4786308,10429182320144363025,4670732969271035142,5160580450125228
0x9eb86e93a809a41ab0e7cc0ba6f62561fda3015c,0x5e5dad79f3cb0aeb533d7ef2cd9de285baef3ff1730bb23940937827e57e6214,30-01-2025,2025-01-30 14:03:59.000 UTC,369,25728246,0x827922686190790b37229fd06084350E74485b72,6420870,2301750550062273750223,70208438005605225,37562373274624266387759
0x0b27b59171a4ffe19f23d54126cd797be17c6551,0x7833611f366328f3268392c2d7847e7fd22e17ee265bef30cd4469a7df2c5d3f,31-07-2025,2025-07-31 00:43:35.000 UTC,178,33566634,0x03a520b32C04BF3bEEf7BEb72E919cf822Ed34f1,3645276,1594364806620441479019,50808324456526096,29859528946327715118372
0x8fd1b615c006ebeb8a7cfb00a1dd809f31943b08,0x44f2fba0aaa0993a8e2333dca199abade13516c1d9b135d32315b28896548aa6,10-01-2025,2025-01-10 18:14:23.000 UTC,409,24871758,0x827922686190790b37229fd06084350E74485b72,5365249,2848663553369884351506,371596039171170518733,1396971193794604851
0x9eb86e93a809a41ab0e7cc0ba6f62561fda3015c,0xd12e16c56a2daedbfa49fa6178158b8175c9d075751681302d872aaff13783fc,10-06-2025,2025-06-10 16:18:41.000 UTC,517,31391487,0x827922686190790b37229fd06084350E74485b72,16096494,22512752686,452261,673445
0x8810de2baa17067ddcfbd9e8f29c55f070a55f0b,0xfa1322f097f511dc0b85746a954ca3d4540e61b25239068d19a78c412785f110,25-03-2025,2025-03-25 19:19:17.000 UTC,371,28070505,0x03a520b32C04BF3bEEf7BEb72E919cf822Ed34f1,2639965,287090096266108759584,4316921610456407,6952199525855176686689
0x9eb86e93a809a41ab0e7cc0ba6f62561fda3015c,0x2226fcd577d9c0ea1dd18e25380067a5b2e566058263dccd2d87c6a21f7759a0,09-01-2025,2025-01-09 02:54:21.000 UTC,305,24800957,0x827922686190790b37229fd06084350E74485b72,5277150,8595877516360439814752,141985449278780391,12050283118270821672475
0x8508fd4238162cb3f3d485f432202af3b40f164e,0xf0d13228a3bbba5d439c995c133421e2efde1474c476a79fd5fb4fa0c756d67e,22-04-2025,2025-04-22 13:48:59.000 UTC,411,29270196,0x827922686190790b37229fd06084350E74485b72,11725830,101090793313671,36448683358948614878,4835
0xdc98dbffcc648d6088a2ff8f7dc01aef050e58fc,0xb8d518ba6ecfe38cd525cecd4fa740ae36cc94da622062597aad231148ee90e7,17-07-2025,2025-07-17 13:09:45.000 UTC,232,32984219,0x46A15B0b27311cedF172AB29E4f4766fbE7F4364,446196,10410059291831030847845,271699944914354996,246914086612655616
0x2791dc5e14f7680d9d969acc26059ba56403b6d5,0x2e51c4d58a8b1e0d6e92754c77805baaaa1574aaa82b4634ac9cd87b5d904a33,14-12-2024,2024-12-14 10:58:23.000 UTC,843,23692278,0x827922686190790b37229fd06084350E74485b72,3997058,2863682344811112549842,613635125452299371802,1061626967593212396
0xdc98dbffcc648d6088a2ff8f7dc01aef050e58fc,0x79bfb270dee334689dacd3c7a5e11df1f44062c330879751f3c925bc5fcfbb35,02-01-2025,2025-01-02 22:34:57.000 UTC,440,24533975,0x827922686190790b37229fd06084350E74485b72,4997876,1020388864982018590382320,1952989194937673363908,2378824065044067112147
0x095d0de0ecfd6832f1a7961ae26d285d68655d60,0x06101e69da4fdd57b8f677777a591ff725ed6e084f4789d544ec39080ee5c999,19-03-2025,2025-03-19 01:15:25.000 UTC,349,27778789,0x03a520b32C04BF3bEEf7BEb72E919cf822Ed34f1,2496731,156457049952652121450,291175570454471326,438831100491509151537
0x8508fd4238162cb3f3d485f432202af3b40f164e,0x9bc629153cdd31ad85e8dd49b350e5c654824a74dbc731260610a60eb83a165f,06-06-2025,2025-06-06 07:16:01.000 UTC,577,31202407,0x827922686190790b37229fd06084350E74485b72,15740917,12825384945,306897,334339
0x9eb86e93a809a41ab0e7cc0ba6f62561fda3015c,0xc6071072d71be45eb361dfe5413851ecd9718e30e7c4ee4001cbd3e2fd038f2d,23-12-2024,2024-12-23 04:17:37.000 UTC,409,24069055,0x827922686190790b37229fd06084350E74485b72,4477267,999076459535097949192,592878509725399515396,370548605324522381
0x8fd1b615c006ebeb8a7cfb00a1dd809f31943b08,0x1280d63d8de8db4c9427966960f7195f62d061378ce9b3ac92b7fab641400023,10-12-2024,2024-12-10 02:55:03.000 UTC,384,23504978,0x827922686190790b37229fd06084350E74485b72,3747288,2910974406125358417604,857385254205011284414,822273891715470599
0x2791dc5e14f7680d9d969acc26059ba56403b6d5,0x3ed8bb13518a5e45132cc2cc421729e7d7108bfa21083a73251c33a26784b908,04-01-2025,2025-01-04 11:15:09.000 UTC,447,24599981,0x827922686190790b37229fd06084350E74485b72,5060837,10623060099983286385,311766625678697051,3266995828863868
0xdc98dbffcc648d6088a2ff8f7dc01aef050e58fc,0x5b920e27bce56fc4b25e3e0ac2c11338a4cf4dac311d5d6e09746b860c9cbc50,23-04-2025,2025-04-23 04:23:55.000 UTC,663,29296444,0x03a520b32C04BF3bEEf7BEb72E919cf822Ed34f1,2917882,11692591291506715980386,577568121013261780,205106826622431620551182
0x38f6d2d9ea493c3c6ee865b5b952b5fe9e3e61fc,0x301eeaab79eaf1e335d60484eac320116ef77cff093548e7afc7a9af3dfbe834,01-06-2025,2025-06-01 05:04:23.000 UTC,97,30982458,0x827922686190790b37229fd06084350E74485b72,15295743,8066924396,259139,144024
0x0b27b59171a4ffe19f23d54126cd797be17c6551,0x9e62172b9da5a3f16da73fd4120326d4c174f98cff1d983e1e54014048297a2c,28-06-2025,2025-06-28 16:32:07.000 UTC,389,32169490,0x03a520b32C04BF3bEEf7BEb72E919cf822Ed34f1,3440152,8499139785363679408652,199563083736149984,219256955093265446306087
0x8810de2baa17067ddcfbd9e8f29c55f070a55f0b,0x34a2daad19ba485c2060166c4a36e78b7b0d0c65f693577dae24a6e0cb51a0cb,09-11-2025,2025-11-09 22:18:39.000 UTC,554,37968686,0x03a520b32C04BF3bEEf7BEb72E919cf822Ed34f1,4168157,475215842814129850035,10971258736623236,12180802677529357812081
0x2791dc5e14f7680d9d969acc26059ba56403b6d5,0x970800667b19dd6e7de6915f3be5bf7423bffdbad4d6c388635cf18087a94f27,06-01-2025,2025-01-06 15:20:35.000 UTC,622,24693744,0x827922686190790b37229fd06084350E74485b72,5152279,22698736396407247407522,695205952120727110,15176106932178796823443
0x8508fd4238162cb3f3d485f432202af3b40f164e,0xdcb783c6489511f96dabf5b0c2b77d4eaaca328233c47d7006ab36acbc25aa26,18-06-2025,2025-06-18 21:12:53.000 UTC,1383,31745913,0x03a520b32C04BF3bEEf7BEb72E919cf822Ed34f1,3324322,260266418476461590246,96483773630025450,263076756337563318480
0x095d0de0ecfd6832f1a7961ae26d285d68655d60,0x433f29bdb3cc11cb3cc6ce6166b006cd4996cbddbc527f18233270c33ef0009a,23-06-2025,2025-06-23 13:36:45.000 UTC,1062,31948229,0x03a520b32C04BF3bEEf7BEb72E919cf822Ed34f1,3387703,4734908976026537542567,61805781035853167,205572217680398828546909
0x38f6d2d9ea493c3c6ee865b5b952b5fe9e3e61fc,0x44086534a7627284441413417574ff3517da1295f477b19851420871f6be00f1,13-01-2025,2025-01-13 21:20:19.000 UTC,612,25006936,0x827922686190790b37229fd06084350E74485b72,5514108,1142095553109071652441472,1592682507610827366015,19477866506331966187852
0xdc98dbffcc648d6088a2ff8f7dc01aef050e58fc,0x653e82e40d4eab45ccb7636cbcd06abffa070aa7b9f4f2ba709c354d78f35cfa,12-05-2025,2025-05-12 10:01:55.000 UTC,3216,30127384,0x46A15B0b27311cedF172AB29E4f4766fbE7F4364,377910,13032667479765431064741,592755588063225984,31547260704351159
0xdc98dbffcc648d6088a2ff8f7dc01aef050e58fc,0x3799bcc69529043b1d2fa5639ddbdaef45827f47cbf0c7eb32b0477b273a6e0b,07-07-2025,2025-07-07 15:12:47.000 UTC,423,32555910,0x46A15B0b27311cedF172AB29E4f4766fbE7F4364,430600,10571354798017496948294,225191124174933316,306704782233118512
0x8508fd4238162cb3f3d485f432202af3b40f164e,0x952b64fb708cc31fbf44c59e9302b7d8c6c038bd15efec59f9df135301c41c53,24-04-2025,2025-04-24 15:40:45.000 UTC,1262,29359949,0x827922686190790b37229fd06084350E74485b72,11909967,93731044638412701503976,301810545474283103086,33910420024865765291572
0x095d0de0ecfd6832f1a7961ae26d285d68655d60,0xb9becdcc0fa258e5270889e6141bff25655688fe002e6727ba63fdaf7f03fa6c,15-05-2025,2025-05-15 10:02:49.000 UTC,619,30257011,0x03a520b32C04BF3bEEf7BEb72E919cf822Ed34f1,3031730,6713119262879498904344,41874887210698281,248397573643976148959460
0x8fd1b615c006ebeb8a7cfb00a1dd809f31943b08,0x75e200769294551306e0c44e410728b0bdecf0606fde9670e4e243b1273f8dcd,27-12-2024,2024-12-27 12:28:27.000 UTC,480,24256580,0x827922686190790b37229fd06084350E74485b72,4689633,5925760004627384784,604743949266503646,10348747474830532
0xdc98dbffcc648d6088a2ff8f7dc01aef050e58fc,0x3b3f1884a18bb0c4d8128f3aaf928cd510b64797b39a95d8cb6d04e5e85d39c8,09-01-2025,2025-01-09 06:53:29.000 UTC,3426,24808131,0x827922686190790b37229fd06084350E74485b72,5285829,574045537591419059,1497374162,21785569482512656563892
0x8508fd4238162cb3f3d485f432202af3b40f164e,0x94c1f2a4d3bc92d86373259988dacce6e963a6191066cf497cdac2a55a03f825,09-06-2025,2025-06-09 16:15:51.000 UTC,484,31348202,0x827922686190790b37229fd06084350E74485b72,16008453,12557201764,406889,220751
0x9eb86e93a809a41ab0e7cc0ba6f62561fda3015c,0x08f8db9f3fefdeb3a082e549559aab397b6bd01963faa194be2084885f357d87,05-01-2025,2025-01-05 03:07:39.000 UTC,337,24628556,0x827922686190790b37229fd06084350E74485b72,5092399,593532206309685805880777,68137845390199180191,26062836246891764780971
0x351f61e4c49cf11f24d9f2e737ca5eff81806355,0x13953df1097e3334dcc778f52fbc44a2bcd81d634aa16652af591ece1c69a095,05-09-2025,2025-09-05 06:06:29.000 UTC,531,35131521,0x827922686190790b37229fd06084350E74485b72,24697633,271441644224451822,69950238,117252915549632340027526
0x2791dc5e14f7680d9d969acc26059ba56403b6d5,0xe39d75a30a85eaead1c453c81a5793761278a62e338aeedea59d6de673652dc5,11-01-2025,2025-01-11 08:19:37.000 UTC,331,24897115,0x827922686190790b37229fd06084350E74485b72,5390923,1885659593327420757179,483429518628254452339,125946129303092146
0x9eb86e93a809a41ab0e7cc0ba6f62561fda3015c,0xfa336177f983832541aabf330c60609e082f9055458ffc2d189596b6b06bda23,08-02-2025,2025-02-08 14:10:09.000 UTC,425,26117231,0x827922686190790b37229fd06084350E74485b72,6936513,5876659342692548908256,258858584169677888,52080309635109706688759
0x9eb86e93a809a41ab0e7cc0ba6f62561fda3015c,0x38631d669a578393049f9e65916273c49e84f700e2ef3d81d938c1f080817045,02-06-2025,2025-06-02 02:43:37.000 UTC,253,31021435,0x827922686190790b37229fd06084350E74485b72,15376584,29174238996,33409,1427213
0xdc98dbffcc648d6088a2ff8f7dc01aef050e58fc,0xfb051fdcf2cd90ecb3afea005687991b94cfe011637df0c66d511e913697758f,07-01-2025,2025-01-07 01:32:49.000 UTC,469,24712111,0x827922686190790b37229fd06084350E74485b72,5175162,25380334557884116444643,593694039557018546,26531704384801223124853
0xdc98dbffcc648d6088a2ff8f7dc01aef050e58fc,0xcbf91e954c3142cd6a4861f88d642d51fa1d19e19cfcddac38d0ac33ac541110,16-05-2025,2025-05-16 06:28:43.000 UTC,771,30293788,0x46A15B0b27311cedF172AB29E4f4766fbE7F4364,380996,12389938361803924784679,437942004971421682,168047507316024022
0x8810de2baa17067ddcfbd9e8f29c55f070a55f0b,0x30025daeaf0ae95593ed4277909e990285b50130f04c0b74b96edde3333f7479,07-05-2025,2025-05-07 22:43:23.000 UTC,385,29934228,0x03a520b32C04BF3bEEf7BEb72E919cf822Ed34f1,2981847,172482379432270919022,423664159383044,5447962157550115759812
0x9eb86e93a809a41ab0e7cc0ba6f62561fda3015c,0x2d4a5435dd57e523a4b383f85d2fc34b27787383f49c1d33b1b715bd46b682fa,21-05-2025,2025-05-21 10:26:01.000 UTC,819,30516907,0x827922686190790b37229fd06084350E74485b72,14305641,29859866940,768587,724260
0x8508fd4238162cb3f3d485f432202af3b40f164e,0xf0853ca9d7352a2010bcfacbcf8cab463530591baea64a1abcc7b994b9ab0461,10-06-2025,2025-06-10 17:23:47.000 UTC,3389,31393440,0x827922686190790b37229fd06084350E74485b72,16100682,12390770289,581391,37775
0x0b27b59171a4ffe19f23d54126cd797be17c6551,0x0ac08b004d83a30fd59ead74de7dd9a12eef33a365d6781972a6a7ac5ce6b8a0,04-08-2025,2025-08-04 15:24:21.000 UTC,391,33765857,0x03a520b32C04BF3bEEf7BEb72E919cf822Ed34f1,3679264,1449380467185921191242,60911099631772022,20239322759921416874971
0x095d0de0ecfd6832f1a7961ae26d285d68655d60,0x85440f2aa883c9fef187481ab1476fa56175fd1453c2338a18a8c61bf9e253cf,13-03-2025,2025-03-13 06:20:29.000 UTC,309,27528741,0x03a520b32C04BF3bEEf7BEb72E919cf822Ed34f1,2351179,10818752672495296782039,204610854844040168,300723405737717378163427
0x2791dc5e14f7680d9d969acc26059ba56403b6d5,0x4b09eea8940150ef1fe9d34cae6491d1d142f1c923e8d8e4c1f0b6ddff2fa9a4,10-01-2025,2025-01-10 11:35:31.000 UTC,459,24859792,0x827922686190790b37229fd06084350E74485b72,5351587,2335394096761969441287,590506611280856528032,142746643088672222
0x9eb86e93a809a41ab0e7cc0ba6f62561fda3015c,0xd7077a55f2a2f309d6d36f38ad225428cf7705db147fd3004e0a5ab05ed9bfce,14-05-2025,2025-05-14 19:46:55.000 UTC,153,30231334,0x827922686190790b37229fd06084350E74485b72,13686121,10270184384,364702,148598
0x38f6d2d9ea493c3c6ee865b5b952b5fe9e3e61fc,0xf422d8794779008b1fd24dd000ce5d9899bef9a2e4f1f7898db2afdaa4d40c6c,03-06-2025,2025-06-03 19:51:53.000 UTC,961,31095483,0x46A15B0b27311cedF172AB29E4f4766fbE7F4364,395448,5657488906,257953,24667
0x2791dc5e14f7680d9d969acc26059ba56403b6d5,0xbcc81f0303d0df94226b22e8bc9b34caabfd9a7ae5c508ebc560447b63b5bbcc,16-12-2024,2024-12-16 10:29:41.000 UTC,307,23777817,0x827922686190790b37229fd06084350E74485b72,4089705,3400895598423609389351,847259206095849714704,1211780524027525957
0xdc98dbffcc648d6088a2ff8f7dc01aef050e58fc,0x0424a1ef2766ebc9045f949b1661fad26555064199304066f5d1b9c8c4ee72b9,29-05-2025,2025-05-29 03:43:37.000 UTC,1351,30850435,0x46A15B0b27311cedF172AB29E4f4766fbE7F4364,389793,12274237603143252441926,228299541730490050,392464244636543076
0x8508fd4238162cb3f3d485f432202af3b40f164e,0xee78407cc0458b960614aa618e04b03f964d7a5497867d58c47d8b94898be9bf,05-06-2025,2025-06-05 08:01:19.000 UTC,378,31160566,0x827922686190790b37229fd06084350E74485b72,15655206,12999251054,155299,494872
0xdc98dbffcc648d6088a2ff8f7dc01aef050e58fc,0x894887fcce373cbe1c428778a3e2fee228bc352b19da21155cc89399ffb1328e,17-05-2025,2025-05-17 04:39:15.000 UTC,107,30333704,0x46A15B0b27311cedF172AB29E4f4766fbE7F4364,381661,12143444945090180926260,448562289410898258,143468018371587919
0x9eb86e93a809a41ab0e7cc0ba6f62561fda3015c,0xe5fda692acc251bb4cba9ffc40d9a4f4c65bc2a912dfc37233518c88148b3f9e,03-06-2025,2025-06-03 12:38:49.000 UTC,613,31082491,0x827922686190790b37229fd06084350E74485b72,15502662,27047573857,303408,1049470
0xdc98dbffcc648d6088a2ff8f7dc01aef050e58fc,0x84039efd789b45e0b4dd857037e02e095e5dc18291bc39c412d8e48563caa46e,17-07-2025,2025-07-17 19:42:19.000 UTC,764,32995996,0x46A15B0b27311cedF172AB29E4f4766fbE7F4364,446499,14903018171,24030,721519
0x8810de2baa17067ddcfbd9e8f29c55f070a55f0b,0x668e2746bc89ae5b175f96820e2e17f6a4ce31ea12dd8bedd427eb41e6b03085,29-03-2025,2025-03-29 11:07:21.000 UTC,258,28228547,0x827922686190790b37229fd06084350E74485b72,10041187,107646387399158910,76700226,50768843525606677969476
0x9eb86e93a809a41ab0e7cc0ba6f62561fda3015c,0xea29999f73ae2d1a63429e8d5814569deb63475997dca8e330e2d42e823c8308,04-01-2025,2025-01-04 06:46:23.000 UTC,346,24591918,0x827922686190790b37229fd06084350E74485b72,5055589,627643078414476340367779,1070472561022192589628,5096860029031413651547
0xdc98dbffcc648d6088a2ff8f7dc01aef050e58fc,0x6745c741865f59b8d5892ae86b9d18d0acbe43c69c63553b0e13a2bdfe2887a0,09-01-2025,2025-01-09 04:10:45.000 UTC,306,24803249,0x827922686190790b37229fd06084350E74485b72,5280051,22516243121072948393229,410165484124930954,29667890185943963154858
0x8508fd4238162cb3f3d485f432202af3b40f164e,0xf5a376cb5f4579b6c6b853617060022fc1b5d1dd623231e65ec59b763f5f1335,22-06-2025,2025-06-22 01:21:37.000 UTC,242,31882975,0x827922686190790b37229fd06084350E74485b72,17134956,211446348348459966408,81684472507985431,206554040426046672916
0x8fd1b615c006ebeb8a7cfb00a1dd809f31943b08,0xcc84d470410a2146661976bb1f8b331625f1be4979f32963e1603ad0d2898151,17-12-2024,2024-12-17 18:49:05.000 UTC,433,23835999,0x827922686190790b37229fd06084350E74485b72,4159055,13973318240431391808,9305475483544928581,15060223964562118
0x8508fd4238162cb3f3d485f432202af3b40f164e,0x1efa63729d30266b25ad78e584efcde788dd13b0559c20b08c5dee068a9ec927,15-05-2025,2025-05-15 23:17:43.000 UTC,447,30280858,0x03a520b32C04BF3bEEf7BEb72E919cf822Ed34f1,3024699,2172750869346927063,639546651180733,7017588915941984192
0xdc98dbffcc648d6088a2ff8f7dc01aef050e58fc,0xf97fe7f2e7b6bf9b22c0a910fd077f5e84f5fa2c2377d788c661da7a4e99f3b5,07-06-2025,2025-06-07 17:50:45.000 UTC,738,31264649,0x46A15B0b27311cedF172AB29E4f4766fbE7F4364,398810,11354846028653944552059,51605967434372286,539048304679000000
0x38f6d2d9ea493c3c6ee865b5b952b5fe9e3e61fc,0xfa109bc4a8314ce646554e762b0469c008c0cac2483faaae1a1d7b5e4e262a04,01-01-2025,2025-01-01 23:25:21.000 UTC,358,24492287,0x827922686190790b37229fd06084350E74485b72,4946433,1506835904053050464024744,1628028481896437252096,34668945858378660101566
0xdc98dbffcc648d6088a2ff8f7dc01aef050e58fc,0xe5bf7218f88956b297dbcdd1c36802ebb49029bca6773d32fe5f66a6bfc873c0,12-01-2025,2025-01-12 04:48:03.000 UTC,361,24933968,0x827922686190790b37229fd06084350E74485b72,5432423,20086444420655691977741,834657944576436532,2963851159317734435552
0x0b27b59171a4ffe19f23d54126cd797be17c6551,0xc8d29e57917325d20541d1bdfacf251f8ca78bd340c38cad579a682f54879bee,27-07-2025,2025-07-27 14:43:43.000 UTC,342,33419038,0x03a520b32C04BF3bEEf7BEb72E919cf822Ed34f1,3618272,2019631061305076643567,76997149040595492,32290217305393438200994
0x38f6d2d9ea493c3c6ee865b5b952b5fe9e3e61fc,0x4b78bd1c5e37736969c52ae232314892527596bc56a332b66ce954e437a878b2,04-01-2025,2025-01-04 05:40:45.000 UTC,1074,24589949,0x827922686190790b37229fd06084350E74485b72,5054055,2196329598614344723351,10998851546376915588,738625132501352528
0x8fd1b615c006ebeb8a7cfb00a1dd809f31943b08,0xd72c4ff3e9b1fc132bad8fb66fe169bf07e91cc0f79fc4473479f9103f6e3f27,21-12-2024,2024-12-21 00:23:29.000 UTC,481,23975631,0x827922686190790b37229fd06084350E74485b72,4349624,4752025414432174002,2478178713578694910,5974381964383062
0x9eb86e93a809a41ab0e7cc0ba6f62561fda3015c,0x9fd1a303030ad6b525ead0fcd4de9a6509b15d26491b28b4e52967d849d643c6,28-02-2025,2025-02-28 20:20:53.000 UTC,352,26992353,0x827922686190790b37229fd06084350E74485b72,8176946,3159129015,146136508,370287
0x8508fd4238162cb3f3d485f432202af3b40f164e,0x395fff068a9761bf42232b2e125f4ed4c9221228c79646f6b63e7e87f8cc9f3e,14-07-2025,2025-07-14 05:31:07.000 UTC,542,32840860,0x03a520b32C04BF3bEEf7BEb72E919cf822Ed34f1,3522033,180215070532774395150,43662524510806210,226631507123089743127
0x2791dc5e14f7680d9d969acc26059ba56403b6d5,0x5fd1f3607efc8daf8530ef74ac6bad70bfc5caa0734117a176bb65588997355d,22-12-2024,2024-12-22 10:22:59.000 UTC,372,24036816,0x827922686190790b37229fd06084350E74485b72,4409718,5159029196143107220,2908170503179138107,2026625935202357
0x8508fd4238162cb3f3d485f432202af3b40f164e,0x32a84d97682d96862018aecc183a05f15f452937cf874dd5c78d45436688d0ad,30-04-2025,2025-04-30 21:46:43.000 UTC,489,29630128,0x827922686190790b37229fd06084350E74485b72,12482879,25967637379498670055,16607348614501065,47067407553739758892
0xdc98dbffcc648d6088a2ff8f7dc01aef050e58fc,0x2da7b1b87ea50e4959fa4645ed6a9171636c720c6d9c209fdaf257cae0c0f87b,05-07-2025,2025-07-05 05:54:19.000 UTC,778,32452756,0x46A15B0b27311cedF172AB29E4f4766fbE7F4364,428410,10618143554121630701926,1025018433325778,556340269785865137
0x38f6d2d9ea493c3c6ee865b5b952b5fe9e3e61fc,0x60ae3f254c168f5aec860d6867e312594a061a6e71705057d8fde400859fa1ff,17-07-2025,2025-07-17 10:58:47.000 UTC,181,32980290,0x46A15B0b27311cedF172AB29E4f4766fbE7F4364,446084,28547934429,312430,1115385
0xdc98dbffcc648d6088a2ff8f7dc01aef050e58fc,0xf05be9e915f843d2853a173a797ba7accaa7cc52d8ac945e8edd8fa46713f2b1,31-12-2024,2024-12-31 13:49:31.000 UTC,522,24431812,0x827922686190790b37229fd06084350E74485b72,4883224,1367272623046214837959271,2515026152553839783250,11972908981773788283259
0xdc98dbffcc648d6088a2ff8f7dc01aef050e58fc,0xfd1111828d7fc7620d5ee6fb0ba981b890406fb8d9f62b15a70c1a3dc2df0460,08-01-2025,2025-01-08 23:16:51.000 UTC,598,24794432,0x827922686190790b37229fd06084350E74485b72,5269230,1922459574060447085763,258025933798479419552,351570535585530337
0x095d0de0ecfd6832f1a7961ae26d285d68655d60,0x42d813c5f98ac0394b9fc39e161cb86c9bf8b25f8925deee08238433a3c66092,18-03-2025,2025-03-18 19:27:33.000 UTC,304,27768353,0x827922686190790b37229fd06084350E74485b72,9330560,341679551377968027797905,79006860048605466009,139957146986653989836202
0x38f6d2d9ea493c3c6ee865b5b952b5fe9e3e61fc,0x59d082a8be76eb408f660f5743982d96be0ccb4f4ac5bafec205f1a0e320f088,02-01-2025,2025-01-02 13:50:01.000 UTC,587,24518227,0x827922686190790b37229fd06084350E74485b72,4978653,2000461470622063077,3573556965,22237586283032620247565
0x9eb86e93a809a41ab0e7cc0ba6f62561fda3015c,0x1dc071c15adede7b4841e7ff0d06fae8c9d803717fbea0367d5b309fd087b0c7,21-02-2025,2025-02-21 00:56:19.000 UTC,416,26655016,0x827922686190790b37229fd06084350E74485b72,7699269,5065187571,780182139,11669
0xdc98dbffcc648d6088a2ff8f7dc01aef050e58fc,0xf860a6087074c85ad14611a28cbd782621cbf1022ef289f5c09e20d72540a07b,27-05-2025,2025-05-27 03:43:47.000 UTC,281,30764040,0x827922686190790b37229fd06084350E74485b72,14800389,1975231543,13948,84885
0x38f6d2d9ea493c3c6ee865b5b952b5fe9e3e61fc,0x7a527d5999e53e917e63bc41f92c8b0c51b72a367073ede823eb9221e1ea7437,19-06-2025,2025-06-19 17:20:23.000 UTC,520,31782138,0x827922686190790b37229fd06084350E74485b72,16928665,36230059434,493619,1318415
0x9eb86e93a809a41ab0e7cc0ba6f62561fda3015c,0x3fb285e19676b1147fc9db905911712a11e8390bb7c92de2902ba5ab7b00f526,23-02-2025,2025-02-23 10:41:41.000 UTC,3297,26758977,0x827922686190790b37229fd06084350E74485b72,7839371,4701708054,665400275,64561
0x8508fd4238162cb3f3d485f432202af3b40f164e,0xf74282e7f6434b70d6cc40719e17a7ceb8d6eb8ee7f84b9ba34cebb4c937262d,02-04-2025,2025-04-02 01:03:33.000 UTC,477,28383233,0x827922686190790b37229fd06084350E74485b72,10300422,352549737396626,3153704416283889127,78138
0x0b27b59171a4ffe19f23d54126cd797be17c6551,0x9afa27b8e1531b6ef76ce436c07b4b84fa5c958e3d345f31e978ac1eb8206597,18-07-2025,2025-07-18 13:47:39.000 UTC,418,33028556,0x03a520b32C04BF3bEEf7BEb72E919cf822Ed34f1,3552885,4325184940492234822368,93211059006460141,118778225751391140580736
0x8508fd4238162cb3f3d485f432202af3b40f164e,0x35a45837c42f619760ab9e1bf1f4abc1bffb235eabe85c19c1a4bb097a28c270,08-05-2025,2025-05-08 00:44:25.000 UTC,446,29937859,0x827922686190790b37229fd06084350E74485b72,13088794,20594959917200636267,18946924031756751,26374296792790166644
0x8810de2baa17067ddcfbd9e8f29c55f070a55f0b,0xd5694bea484034cd82f9404d3bf401a3b13cba0fe8d3474880204e63ef18fd09,24-04-2025,2025-04-24 03:44:55.000 UTC,418,29338474,0x03a520b32C04BF3bEEf7BEb72E919cf822Ed34f1,2923854,194493653684068113264,1132160917814941,5562418931960559635534
0x8508fd4238162cb3f3d485f432202af3b40f164e,0x93cce2eddb56941605551a7f4bb7c88cbcffafc2981822936e0d3709f70ed807,10-03-2025,2025-03-10 20:02:13.000 UTC,234,27423793,0x827922686190790b37229fd06084350E74485b72,8813583,639701471907628,139224149313934683485,72175
0x38f6d2d9ea493c3c6ee865b5b952b5fe9e3e61fc,0x3dde216dc4327fba2b304bb5f4723e63a6fcbb5b8cf564756c907ddb6e56acb8,11-06-2025,2025-06-11 08:09:41.000 UTC,948,31420017,0x46A15B0b27311cedF172AB29E4f4766fbE7F4364,402833,5406275100,96262,174092
0xdc98dbffcc648d6088a2ff8f7dc01aef050e58fc,0x3f31b301463ecbb4e0f29368e16f885bedf516911f2752a73a95d90898593c49,19-05-2025,2025-05-19 06:22:03.000 UTC,154,30423188,0x46A15B0b27311cedF172AB29E4f4766fbE7F4364,383060,274766593976861,6821662481196095621,9494727
0x095d0de0ecfd6832f1a7961ae26d285d68655d60,0xd1e5abe5f5414a4b6ec4350dcee2a13c03f50789d1e81a93f2b379390a9c1840,11-06-2025,2025-06-11 15:19:05.000 UTC,525,31432899,0x03a520b32C04BF3bEEf7BEb72E919cf822Ed34f1,3232185,4218385750340598610284,32665700107631820,195541316545708154953438
0xdc98dbffcc648d6088a2ff8f7dc01aef050e58fc,0xa53bdf5d712085da6c810c0348cc6042ed52775778b51dd75d81e62102d908fa,24-05-2025,2025-05-24 23:21:43.000 UTC,564,30669778,0x46A15B0b27311cedF172AB29E4f4766fbE7F4364,386856,12583139306091210014667,250247469922536769,384532216384063869
0x9eb86e93a809a41ab0e7cc0ba6f62561fda3015c,0x406d01092f35d07e41b3c86fe2e12f85415296ad49d27b18d41a6ee20a558098,10-12-2024,2024-12-10 14:20:59.000 UTC,426,23525556,0x827922686190790b37229fd06084350E74485b72,3786719,3170158930888594628881,824831159751670235136,970340379613614640
0x8508fd4238162cb3f3d485f432202af3b40f164e,0x8c02c5f3790c7075cbab1090d71c6577f125bacc9f6aad5f20dff1b86ff2c4f7,11-07-2025,2025-07-11 11:10:41.000 UTC,627,32721447,0x827922686190790b37229fd06084350E74485b72,18974519,28031906750,275281,1126723
0x0b27b59171a4ffe19f23d54126cd797be17c6551,0xe1b2a7b11d125188e978a621cab9d67d3c5a060d59b79aa520e5d1122aab5451,17-05-2025,2025-05-17 06:26:57.000 UTC,137,30336935,0x03a520b32C04BF3bEEf7BEb72E919cf822Ed34f1,3044095,18988382878476750384958,208000526142610239,482347534918918498371084
0x9eb86e93a809a41ab0e7cc0ba6f62561fda3015c,0xed0b91426dd80994fc7f58d2a119d87a54cd9cb08f146e0bd380f7c9de6e2e4b,11-06-2025,2025-06-11 04:48:53.000 UTC,664,31413993,0x827922686190790b37229fd06084350E74485b72,16145374,22083867419,729662,374313
0xdc98dbffcc648d6088a2ff8f7dc01aef050e58fc,0x187381640a061caccdd7811741bb3653e2adf32beb775ec2ea4fe9375fe6650b,03-06-2025,2025-06-03 16:40:53.000 UTC,463,31089753,0x827922686190790b37229fd06084350E74485b72,15518033,11528427221,151647,425007
0x38f6d2d9ea493c3c6ee865b5b952b5fe9e3e61fc,0xe8987e2a2f203c960a0ac8d65510888a0a4af7df4cf60eae8c9397e19ef298ae,11-06-2025,2025-06-11 08:23:05.000 UTC,687,31420419,0x46A15B0b27311cedF172AB29E4f4766fbE7F4364,402846,5405111666,198977,71164
0x8810de2baa17067ddcfbd9e8f29c55f070a55f0b,0x53fdfae2b1916fc74c8ac98b02cdbb40c71498ada8ba3d0ab3e0bb718b0239c1,08-05-2025,2025-05-08 20:24:15.000 UTC,500,29973254,0x827922686190790b37229fd06084350E74485b72,13165606,61012212571260044,18230294,34606567601588171028622
0x8508fd4238162cb3f3d485f432202af3b40f164e,0x360e871a588e7f54d7c745a07aea1ba2fc6db7cde52ee8b924a31f7a1fc4928f,22-06-2025,2025-06-22 04:47:33.000 UTC,381,31889153,0x827922686190790b37229fd06084350E74485b72,17149550,207674670721711614780,92611384862833948,182177284273922835322
0x9eb86e93a809a41ab0e7cc0ba6f62561fda3015c,0x987532bc5c3085a825ff8ec26199f2bf6cd2f215c7851be42474594c1d33cd9c,26-02-2025,2025-02-26 13:10:53.000 UTC,191,26893053,0x827922686190790b37229fd06084350E74485b72,8045539,3881914113,452931768,138032
0xdc98dbffcc648d6088a2ff8f7dc01aef050e58fc,0xa4c8ebabf1495217ff6a839f9096c3e19f34e9cc885c55bb611e8d0f852a1f7b,10-05-2025,2025-05-10 05:23:05.000 UTC,813,30032619,0x03a520b32C04BF3bEEf7BEb72E919cf822Ed34f1,2997438,9826937147329757842918,437626084269880805,186090735524283484661682
0x351f61e4c49cf11f24d9f2e737ca5eff81806355,0x1d43e10211deef7181c1dcb1ec7b13ff55a92e0796809f2143245b8b0103c5c4,04-11-2025,2025-11-04 23:33:37.000 UTC,324,37754935,0x827922686190790b37229fd06084350E74485b72,30736089,115302811957815632,122958332,88291747726554603272551
0x095d0de0ecfd6832f1a7961ae26d285d68655d60,0xa0f6f96e22dfcc2bbd12d3aac2099a502dfdcb054d6ed12df92e80e9223eb686,25-03-2025,2025-03-25 01:08:23.000 UTC,705,28037778,0x827922686190790b37229fd06084350E74485b72,9727409,293575694273151674458890,333517875283987579657,114711590951398100541491
0x9eb86e93a809a41ab0e7cc0ba6f62561fda3015c,0x1b593aa3581fe59fcc8cbfb716d916e3e097f23b205fbf8ffc84d4004c0669bd,01-01-2025,2025-01-01 07:27:31.000 UTC,178,24463552,0x827922686190790b37229fd06084350E74485b72,4912788,580845429334050909952,382199124400893587840,139227238418029933
0xdc98dbffcc648d6088a2ff8f7dc01aef050e58fc,0xdb02498ea9fd61e06ab91e17d13d86fdec7389f0a61e44005811abdc9c8ae9ac,30-05-2025,2025-05-30 16:32:17.000 UTC,788,30916695,0x46A15B0b27311cedF172AB29E4f4766fbE7F4364,391145,12148895063943747855663,321976825031314944,282856533012220804
0xdc98dbffcc648d6088a2ff8f7dc01aef050e58fc,0xb106bdc3aaf96ff2eb65108326e5afeca3c0c8a8c25e1719f3670fe3a3536e4b,08-01-2025,2025-01-08 22:41:57.000 UTC,482,24793385,0x827922686190790b37229fd06084350E74485b72,5268137,1942732608946245992861,475669452454678558577,119527181780399258
0x9eb86e93a809a41ab0e7cc0ba6f62561fda3015c,0x4208102bbf7defba0515f28b150fbd330e4d2e2113544a0a9ccd11b1b2a6b424,25-12-2024,2024-12-25 10:43:13.000 UTC,346,24167023,0x827922686190790b37229fd06084350E74485b72,4591293,814494975571995108248,274442087842624040446,476826620360968337
0x095d0de0ecfd6832f1a7961ae26d285d68655d60,0xf61150406e5691a36b019c4236a9129cbf6e6055916a6701c5d63741d2f72b67,24-04-2025,2025-04-24 16:07:05.000 UTC,614,29360739,0x827922686190790b37229fd06084350E74485b72,11911995,110118651251085690652215,67209860756859189014,54819404585780471890543
0x8508fd4238162cb3f3d485f432202af3b40f164e,0x9fcf17cc34d92fa739aebc9915184672c1bbfcb4abc3d4e85df60c7b41be1822,20-04-2025,2025-04-20 07:07:53.000 UTC,327,29171763,0x827922686190790b37229fd06084350E74485b72,11563695,108996829370193,43511746810608794523,2927
0xdc98dbffcc648d6088a2ff8f7dc01aef050e58fc,0x851987b1e18ffcd8fc509350834e6d00d73667f2f93d1b5e78d0c4c3a7456db0,11-01-2025,2025-01-11 07:14:21.000 UTC,359,24895157,0x827922686190790b37229fd06084350E74485b72,5389296,1266756254377678753954,92055931675395652961,296879016197947383
0x38f6d2d9ea493c3c6ee865b5b952b5fe9e3e61fc,0xb0493ccf9c8b7818edbd666276145e551dd942336ebfd6c1e05dd2385eec26a8,08-07-2025,2025-07-08 13:32:47.000 UTC,947,32596110,0x46A15B0b27311cedF172AB29E4f4766fbE7F4364,431616,11871823165,360349,233126
0x8508fd4238162cb3f3d485f432202af3b40f164e,0xf2f3b903cf7400df0c4d1e95362b3c4e3ffb69864c26c38ed1919c84fe517be4,07-06-2025,2025-06-07 08:32:39.000 UTC,922,31247906,0x827922686190790b37229fd06084350E74485b72,15831275,171256161807702664057,69046728300181348,158550849467368233476
0xdc98dbffcc648d6088a2ff8f7dc01aef050e58fc,0x27adba358a57f4d6ebb6dcb691306d7a442268d52349f96897a98f4081cff83c,14-01-2025,2025-01-14 17:26:41.000 UTC,361,25043127,0x827922686190790b37229fd06084350E74485b72,5557884,938899711744225414420,146665254321628208546,148808863944319227
0x8fd1b615c006ebeb8a7cfb00a1dd809f31943b08,0x2d9973bfbdde6ec7b863c812fe35bc5610bb138fbf907244d43df85ce89f342e,05-02-2025,2025-02-05 00:52:33.000 UTC,228,25963703,0x827922686190790b37229fd06084350E74485b72,6655421,30540798879806595,65987247,13533150509855291543713
0x8810de2baa17067ddcfbd9e8f29c55f070a55f0b,0xda7d72b779a4f95c5c9ae4b1cb022491abfcaf94145097537ec6d22ffce1c087,17-04-2025,2025-04-17 05:51:25.000 UTC,290,29039869,0x827922686190790b37229fd06084350E74485b72,11381476,76654623503925800,26209360,46997087935970370889358
0x8508fd4238162cb3f3d485f432202af3b40f164e,0x75af149150b262ce9a5212ddd59d21b4080b50608acc0f8f9d59a9a82a110bb5,02-06-2025,2025-06-02 03:57:13.000 UTC,360,31023643,0x827922686190790b37229fd06084350E74485b72,15380969,14257850147,62719,650885
0x8810de2baa17067ddcfbd9e8f29c55f070a55f0b,0x9c1d14df5eb86d9768a73cfc24c44cbcc58db5bce63a99184cd1ccea7b06eec6,20-06-2025,2025-06-20 16:26:05.000 UTC,932,31823709,0x03a520b32C04BF3bEEf7BEb72E919cf822Ed34f1,3349447,21153205999069081,701254025,555775989688419342274
0x38f6d2d9ea493c3c6ee865b5b952b5fe9e3e61fc,0xadf2f3ba2dcc7e4703991dcc766864db115c7c7ad2cea83fc30ee684d57def93,07-01-2025,2025-01-07 14:30:39.000 UTC,412,24735446,0x827922686190790b37229fd06084350E74485b72,5194187,1685165355107838604346,324988329434270801618,201421087671475514
0xdc98dbffcc648d6088a2ff8f7dc01aef050e58fc,0xbbf0bd1008d9a014616a27be81ebd48da9733f009d6fa3804a1f64635169ef4a,01-01-2025,2025-01-01 22:49:53.000 UTC,469,24491223,0x827922686190790b37229fd06084350E74485b72,4945240,1220694360213173595098294,160278970395769007111,51211393128501394378950
0x095d0de0ecfd6832f1a7961ae26d285d68655d60,0xdfb5487ffdfa3f41773d71c3f2d0bdee8bdfc3e2c8e903902ac8c04c42ff68bf,12-04-2025,2025-04-12 09:45:55.000 UTC,526,28830904,0x827922686190790b37229fd06084350E74485b72,11004892,169602743553052789341073,58941821036186369250,84340180777604738154625
0x38f6d2d9ea493c3c6ee865b5b952b5fe9e3e61fc,0x44e452999b338cad37d152d664d78085e093171d3a0f5858df1afb1df5317ac2,05-06-2025,2025-06-05 07:22:19.000 UTC,387,31159396,0x827922686190790b37229fd06084350E74485b72,15653006,28626641286,1343626,86971
0x8fd1b615c006ebeb8a7cfb00a1dd809f31943b08,0x0f116495e6bb78ebf8510faac045d5760592ecedb8f159bf2aae7bf163051731,05-01-2025,2025-01-05 02:03:27.000 UTC,442,24626630,0x827922686190790b37229fd06084350E74485b72,5090805,24276383894202634179375,283251280250371425,40395972565442952955312
0x8fd1b615c006ebeb8a7cfb00a1dd809f31943b08,0xde79e67aaaca137cd3387f527737ae10d8d9511980ac0a3201c4bc56e48870fb,22-12-2024,2024-12-22 03:14:59.000 UTC,375,24023976,0x827922686190790b37229fd06084350E74485b72,4409690,5931054903188498450,7483057465608441127,4010295570782331
0x38f6d2d9ea493c3c6ee865b5b952b5fe9e3e61fc,0xdc2e940566d9059b8582c87df6a0f89dbcf41b20529b0f3b517ef19656192dc0,15-07-2025,2025-07-15 15:17:23.000 UTC,330,32901648,0x46A15B0b27311cedF172AB29E4f4766fbE7F4364,443375,28648311850,1156358,275425
0x38f6d2d9ea493c3c6ee865b5b952b5fe9e3e61fc,0x4d81b4666b3f392524f526034d3c04fb8e7b6e488897c02b6e04a523cbaaebde,09-01-2025,2025-01-09 21:40:53.000 UTC,324,24834753,0x827922686190790b37229fd06084350E74485b72,5321362,14037117270411255068120,352842310713970500,13722689720318244164605
0x38f6d2d9ea493c3c6ee865b5b952b5fe9e3e61fc,0x5c0fa67e3da61f2916dcd166834b96331b5d85cd52d241493fe17fcb3c2fab87,10-06-2025,2025-06-10 14:42:17.000 UTC,4285,31388595,0x46A15B0b27311cedF172AB29E4f4766fbE7F4364,401886,5441741076,150502,121539
0x8fd1b615c006ebeb8a7cfb00a1dd809f31943b08,0x87387c4c0adbf18e81d079319d432a8f3698778284c93c3a0344437063c85db4,02-03-2025,2025-03-02 18:29:17.000 UTC,431,27075405,0x827922686190790b37229fd06084350E74485b72,8294022,635018912735709741,2702427342,227860772513004284317376
0x9eb86e93a809a41ab0e7cc0ba6f62561fda3015c,0xcbba44f5aaf5b23861a8679ec6f4fde283be5d033ba0ad0d8deda3390f57087e,06-01-2025,2025-01-06 21:56:47.000 UTC,336,24705630,0x827922686190790b37229fd06084350E74485b72,5168570,1003002692877352483910,80942280958988778,1083991920694655450507
0xdc98dbffcc648d6088a2ff8f7dc01aef050e58fc,0xc1f9098bcf2c2db80c680285f032b5c64d43f689892e007f22734183c64bc580,09-01-2025,2025-01-09 12:53:51.000 UTC,317,24818942,0x827922686190790b37229fd06084350E74485b72,5300924,547435478447676135,826559989,29649426266069222031645
0x9eb86e93a809a41ab0e7cc0ba6f62561fda3015c,0xcebc25561d9950ebdfbb15e825d0ac02e68ba9154cb2f7af0b71c094e7e41a42,30-05-2025,2025-05-30 21:27:15.000 UTC,567,30925544,0x827922686190790b37229fd06084350E74485b72,15177807,31179210396,1293309,264147
0xdc98dbffcc648d6088a2ff8f7dc01aef050e58fc,0xdfd84a479f1817f4961ea28ccc408542e90ed77d72cc2b7311e6007a929f62c8,03-06-2025,2025-06-03 02:54:39.000 UTC,346,31064966,0x827922686190790b37229fd06084350E74485b72,15471383,12001241827,322895,277083
0x9eb86e93a809a41ab0e7cc0ba6f62561fda3015c,0x13c42db4c688f67876c058a8cf4e6e67ae2016617c5ac76f480ff95137b92935,18-02-2025,2025-02-18 08:12:19.000 UTC,606,26538496,0x827922686190790b37229fd06084350E74485b72,7523428,5920592245,902825554,9163
0xdc98dbffcc648d6088a2ff8f7dc01aef050e58fc,0x88ae56f13657670f1fcc5fe07a0fb65c3b3dfc3fd0353a0eec2f1b56d32b512f,29-05-2025,2025-05-29 01:56:11.000 UTC,502,30847212,0x46A15B0b27311cedF172AB29E4f4766fbE7F4364,389710,12282990935897170651774,439245171551253504,160976326108475988
0x9eb86e93a809a41ab0e7cc0ba6f62561fda3015c,0x7abc8efc6e6813fee0ed0d92ea3948da2b1e9e5fcad8eeefe0599117f58ef2cc,02-01-2025,2025-01-02 14:32:51.000 UTC,602,24519512,0x827922686190790b37229fd06084350E74485b72,4980322,3007624684941298527043,621936838704012167829,258163453073477807
0xdc98dbffcc648d6088a2ff8f7dc01aef050e58fc,0x7903428e05fda2033e4c91aef95936c5084846c59c13362dbd8d74748c27fade,17-07-2025,2025-07-17 10:59:09.000 UTC,865,32980301,0x46A15B0b27311cedF172AB29E4f4766fbE7F4364,446085,14920506205,157231,589021
0xdc98dbffcc648d6088a2ff8f7dc01aef050e58fc,0x2d43ed0a7525534aef317fe956a7ec599eb90db0d3d8d08c3f81cb930d17a7d3,08-01-2025,2025-01-08 10:45:09.000 UTC,356,24771881,0x827922686190790b37229fd06084350E74485b72,5240533,2130290440695117191515,328086039371364259148,344038074032702354
0x38f6d2d9ea493c3c6ee865b5b952b5fe9e3e61fc,0xb6cc3b38ea64b6381552d4e3acbdc72c22069f1f17c9c17c6afdebfebc707f19,01-06-2025,2025-06-01 04:33:37.000 UTC,642,30981535,0x827922686190790b37229fd06084350E74485b72,15294996,25169732991,1172610,84258
0xdc98dbffcc648d6088a2ff8f7dc01aef050e58fc,0xbc3dc68df6ba1733a7e924997292e62822b6bc1c80c2cf4c56f8a695ab93228d,12-07-2025,2025-07-12 02:34:07.000 UTC,1046,32749150,0x46A15B0b27311cedF172AB29E4f4766fbE7F4364,436476,10475197808949027698650,135132865342377565,401090285573559735
0x0b27b59171a4ffe19f23d54126cd797be17c6551,0xc3b392db669b5a372264a58dc2dcd262764061ac2b040f1db59eafbd651c1034,01-06-2025,2025-06-01 05:37:43.000 UTC,84,30983458,0x03a520b32C04BF3bEEf7BEb72E919cf822Ed34f1,3116818,948540305730858005712,20411986919482212,22380929720608137726261
0xdc98dbffcc648d6088a2ff8f7dc01aef050e58fc,0x2708756f20ec50e8f56e526e3877b09be3fb34a0ce7c26c23ebd5cfec12c1b72,14-01-2025,2025-01-14 10:27:47.000 UTC,425,25030560,0x827922686190790b37229fd06084350E74485b72,5542504,462511711164084507296922,884439521909433958400,3290923487526596853171
0xdc98dbffcc648d6088a2ff8f7dc01aef050e58fc,0x3c3b540db15806dbb23be7d6b3e2a4e4a759d823bb11af2d5e315afb08f419e9,03-07-2025,2025-07-03 12:56:07.000 UTC,789,32379010,0x46A15B0b27311cedF172AB29E4f4766fbE7F4364,426322,10968106118901918931731,158031430420388012,401716146438084223
0x351f61e4c49cf11f24d9f2e737ca5eff81806355,0x2c17f5d095de9c1c1c3791bc0ed23218f8f0c6c139f1955e3d56b7cc33052a74,03-11-2025,2025-11-03 17:19:41.000 UTC,218,37700517,0x827922686190790b37229fd06084350E74485b72,30621642,118985153355455867,164395378,74886633019235765614895
0x38f6d2d9ea493c3c6ee865b5b952b5fe9e3e61fc,0x1c892650d1a9b56e7759cfd2ccd8318042a323d735f3b9a869b2a913bd19c396,08-01-2025,2025-01-08 21:41:35.000 UTC,407,24791574,0x827922686190790b37229fd06084350E74485b72,5266074,1444418641211994090034,365954082255549101966,78594686173876211
0x2791dc5e14f7680d9d969acc26059ba56403b6d5,0xe4553b6a87e59c69993bf9e813a3b3fe19127ab025029513ccc4c427c1984448,17-12-2024,2024-12-17 18:59:19.000 UTC,422,23836306,0x827922686190790b37229fd06084350E74485b72,4163027,10226686140044036160,4558600263501903831,4811369491335249
0xdc98dbffcc648d6088a2ff8f7dc01aef050e58fc,0xa8df4423a96bef4c05307b09bff6faf75c08fee92faaf6e0f014e980db8572d8,02-07-2025,2025-07-02 16:43:55.000 UTC,370,32342644,0x46A15B0b27311cedF172AB29E4f4766fbE7F4364,424877,11032300921621388254495,387873793793694795,151562848681231679
0x38f6d2d9ea493c3c6ee865b5b952b5fe9e3e61fc,0xb85c9750922a4f7b48645ea841042d01619798208c48237da9e4b63d15cb1752,02-01-2025,2025-01-02 00:41:17.000 UTC,471,24494565,0x827922686190790b37229fd06084350E74485b72,4949342,1481837173577425827248817,1922152601141096175476,27339743735135210760518
0x8810de2baa17067ddcfbd9e8f29c55f070a55f0b,0x5a599f54ffa71885d0ac72dfe7c66714d113f642770ed2aca6513183b9ff6a98,27-05-2025,2025-05-27 03:17:25.000 UTC,1112,30763249,0x03a520b32C04BF3bEEf7BEb72E919cf822Ed34f1,3103716,25536639888474742,1060143946,536676733334568083317
0x8fd1b615c006ebeb8a7cfb00a1dd809f31943b08,0xd9722065532ef3d2a84f0d7626a361091f42106bd7a95b1fc4060f0f5f3e99b8,17-02-2025,2025-02-17 15:29:33.000 UTC,325,26508413,0x827922686190790b37229fd06084350E74485b72,7480366,2158433684175831,360728161976555450,695364453
0xdc98dbffcc648d6088a2ff8f7dc01aef050e58fc,0x3e18eb19ebacb41cee35abb6f0e1f0666f4ac7bcaf67ebb3a17c28a47bbd5518,04-01-2025,2025-01-04 12:45:43.000 UTC,436,24602698,0x827922686190790b37229fd06084350E74485b72,5064954,2550705468607329943082,615301831794754871481,145220459370101846
0x8fd1b615c006ebeb8a7cfb00a1dd809f31943b08,0x8a3ecc4334a2c12f4ed7ac856ce81d633259278bc64e50e0d0d4f934867273ee,08-01-2025,2025-01-08 21:13:45.000 UTC,414,24790739,0x827922686190790b37229fd06084350E74485b72,5264876,3747841719881870060467,295503313949054874046,2112444637836630050
0x2791dc5e14f7680d9d969acc26059ba56403b6d5,0x78eab93421c4b0d694ec3f1251e4f52ad0038f11f0ee329f15aa0aec59e068f6,24-12-2024,2024-12-24 06:10:05.000 UTC,319,24115629,0x827922686190790b37229fd06084350E74485b72,4525977,5085084865610971355,652764897539433592,3979346172664156
0x095d0de0ecfd6832f1a7961ae26d285d68655d60,0x5ff4dfae8d781095508f8e302a722faa0cc15f23ace9f6aa499a66549a7ad188,06-02-2025,2025-02-06 08:44:11.000 UTC,188,26021052,0x827922686190790b37229fd06084350E74485b72,6789113,7425520702628724559380,144805205945170752,180649805706120095731699
0x9eb86e93a809a41ab0e7cc0ba6f62561fda3015c,0xac9b01871adb3b989f0fee424a3bd918f55340423bf5b7f3b1863d5097065394,03-06-2025,2025-06-03 14:07:11.000 UTC,931,31085142,0x827922686190790b37229fd06084350E74485b72,15507884,26543236165,552185,775034
0x8508fd4238162cb3f3d485f432202af3b40f164e,0xb77e8df1691c991a0369bc3479236227fbe8660dacef3e514a88461433f74b66,29-05-2025,2025-05-29 01:28:45.000 UTC,716,30846389,0x827922686190790b37229fd06084350E74485b72,15009971,16165793905,275034,533549
0x2791dc5e14f7680d9d969acc26059ba56403b6d5,0xaa1984f341fe171ff2052de03a1d2f9ff462205d7546f59b7566cfac53e435d2,24-12-2024,2024-12-24 06:54:59.000 UTC,548,24116976,0x827922686190790b37229fd06084350E74485b72,4536868,1468268388973369575071,889148410922545377482,505154008463549540
0x0b27b59171a4ffe19f23d54126cd797be17c6551,0xbe3bd8fe93d565b4bdd5149fad660533c3b007e361c663211c12267a7bf7d8f5,21-06-2025,2025-06-21 20:01:23.000 UTC,729,31873368,0x03a520b32C04BF3bEEf7BEb72E919cf822Ed34f1,3365117,10925215066347294180808,344144196051110486,210720377570872472122272
0x9eb86e93a809a41ab0e7cc0ba6f62561fda3015c,0xc1b295651df8610a65bc95d903c7a7607ea1b7c9f6d8bbfeb5f1479df8b1ccac,04-01-2025,2025-01-04 16:09:27.000 UTC,482,24608810,0x827922686190790b37229fd06084350E74485b72,5072638,1423848479365218454492,43926981543974489,2074772502728036827197
0x8810de2baa17067ddcfbd9e8f29c55f070a55f0b,0xb3976259495e79317ee164e8faabb3032cc93024575a33d11e0e1f215010e043,12-04-2025,2025-04-12 18:24:45.000 UTC,678,28846469,0x827922686190790b37229fd06084350E74485b72,11033139,79761796597276810,46746673,44095051398691651726554
0x9eb86e93a809a41ab0e7cc0ba6f62561fda3015c,0x05f270b4a19fb0680f739450c340ebff08f5d339d18821bee9c17c7090ca9c92,18-02-2025,2025-02-18 08:54:49.000 UTC,345,26539771,0x827922686190790b37229fd06084350E74485b72,7525620,5907153250,800407154,114524
0x2791dc5e14f7680d9d969acc26059ba56403b6d5,0x1e9b8b0cb607440a9566bbbf2f19cf46d100ae420c2326aec630ab9527ca7ea9,18-01-2025,2025-01-18 16:35:49.000 UTC,294,25214401,0x827922686190790b37229fd06084350E74485b72,5792702,159269512122269136,377333578,20143858691898901734984
0x8508fd4238162cb3f3d485f432202af3b40f164e,0x9ea89108b9043c4d132a1fc28910dddda3b3cc5047d29411d6429ac7d3a51dbe,04-04-2025,2025-04-04 16:48:31.000 UTC,458,28497982,0x827922686190790b37229fd06084350E74485b72,10511992,289764229040439,92652753943441658477,20352
0xdc98dbffcc648d6088a2ff8f7dc01aef050e58fc,0x3e1959e30dd433ba589f3cfdbb1430f2bb7b810c860bf0a5877155854f65e9e8,11-01-2025,2025-01-11 05:54:33.000 UTC,188,24892763,0x827922686190790b37229fd06084350E74485b72,5387433,1285088908690846638063,366017772036848423473,55143540128573890
0x095d0de0ecfd6832f1a7961ae26d285d68655d60,0x55e606c387ff5bb3dff9daad4068afb165cea49141011ebe51ddea02ca361698,04-04-2025,2025-04-04 11:02:33.000 UTC,442,28487603,0x03a520b32C04BF3bEEf7BEb72E919cf822Ed34f1,2790367,7872564117979690866982,92327914324287897,262544620830356444759997
0x19d36b9ee92a53ec1900447eba958f0030c688be,0xb3625c61aeae99cdc7ae69aa418646ca54345153e10e58c1bcaf781107242644,04-06-2025,2025-06-04 01:12:47.000 UTC,730,31105110,0x03a520b32C04BF3bEEf7BEb72E919cf822Ed34f1,3165730,31743459487039281769106,382923753513871979,684466279471111471125971
0x0b27b59171a4ffe19f23d54126cd797be17c6551,0xfc3f299e716b94f738a1a9b460e7e40d0c90ae4f2a608a9e3e98c28eb3bbb602,29-08-2025,2025-08-29 02:36:09.000 UTC,349,34822811,0x03a520b32C04BF3bEEf7BEb72E919cf822Ed34f1,3825466,725631470607468263037,13798601743240603,23253693678679170026265
0x9eb86e93a809a41ab0e7cc0ba6f62561fda3015c,0xd207956ecaf20f0831f40ccd67062559ef5bff845f763fcabc49d0660bdbd0fa,07-01-2025,2025-01-07 23:05:21.000 UTC,443,24750887,0x827922686190790b37229fd06084350E74485b72,5214214,1346090447213560667849,56058779170306292337,384678041447505582
0x9eb86e93a809a41ab0e7cc0ba6f62561fda3015c,0xe9b5286d22dba32a50191a8441e08ce95bc17ffaada955a82a67e3108edbb65b,29-05-2025,2025-05-29 01:18:49.000 UTC,484,30846091,0x827922686190790b37229fd06084350E74485b72,15009325,34001146022,406903,1294184
0x2791dc5e14f7680d9d969acc26059ba56403b6d5,0x6fca25e8cece4e36d26651320c0a5c4a71a928977650a014e56d0777a47e9831,05-01-2025,2025-01-05 07:50:15.000 UTC,357,24637034,0x827922686190790b37229fd06084350E74485b72,5095205,18090564911649289130,1701884334518625219,4184098674124515
0x8508fd4238162cb3f3d485f432202af3b40f164e,0x61f7e95ee3b8cb53c0a91f11fcad825ab8883c29184dfb57007c2182fa59fca5,26-06-2025,2025-06-26 13:27:29.000 UTC,614,32077551,0x827922686190790b37229fd06084350E74485b72,17588075,202071671682086533934,75625626430778128,202975869907720555168
0x8fd1b615c006ebeb8a7cfb00a1dd809f31943b08,0xf0396445cc025f2be70926744b641af649fa1328d2901820a70abe1405e5eca6,26-12-2024,2024-12-26 22:38:21.000 UTC,443,24231677,0x827922686190790b37229fd06084350E74485b72,4639903,8177303984144015548,675239776864706380,13636719661095111
0x38f6d2d9ea493c3c6ee865b5b952b5fe9e3e61fc,0x8d00f55f79e1981fb2f48200b70edfd0fa72f43f26d312266c0e824ed7774a58,30-01-2025,2025-01-30 01:24:23.000 UTC,368,25705458,0x827922686190790b37229fd06084350E74485b72,6389698,8002444537588328624917,669347102449151802,82855686748772844821258
0xdc98dbffcc648d6088a2ff8f7dc01aef050e58fc,0x31f23cf0ed473a91da05166cae2c2f0136c1ef64e62fe71c4b169ff87767078d,13-01-2025,2025-01-13 03:03:17.000 UTC,364,24974025,0x827922686190790b37229fd06084350E74485b72,5473908,525113063802192699007454,162338177491274368574,19162539294383915300510
0x9eb86e93a809a41ab0e7cc0ba6f62561fda3015c,0x4cc6f8e73b584fd98bf1dbec44e85d81c317771b77ca3494c81646dd73064861,19-05-2025,2025-05-19 04:24:47.000 UTC,510,30419670,0x827922686190790b37229fd06084350E74485b72,14087780,10163342334,192755,315550
0x8fd1b615c006ebeb8a7cfb00a1dd809f31943b08,0xec86cf23839f841169ca11ef8f7bc064cfecf091ef29ab929ce2d1e961868fb6,07-02-2025,2025-02-07 16:10:23.000 UTC,439,26077638,0x827922686190790b37229fd06084350E74485b72,6874878,718894183177305308,2736927886,273668191356260252258000
0x8810de2baa17067ddcfbd9e8f29c55f070a55f0b,0x040633c8476b8c50265f3af84b525351da47689d8f8d91e67c833415a4eac7d2,23-06-2025,2025-06-23 23:34:29.000 UTC,448,31966161,0x03a520b32C04BF3bEEf7BEb72E919cf822Ed34f1,3391571,19417238751206727,619379050,526795949260527722568
0x8fd1b615c006ebeb8a7cfb00a1dd809f31943b08,0x8f67431bd634526dd773f89dfe8832c3863aef4e87adbb9af9cb7c518ae421f3,22-12-2024,2024-12-22 19:26:55.000 UTC,307,24053134,0x827922686190790b37229fd06084350E74485b72,4409690,7409910799313063400,15176880922579225953,870293979474328
0x38f6d2d9ea493c3c6ee865b5b952b5fe9e3e61fc,0x46371a7d58e8e96f183e5bfe0511c56c0c389e98f47565b02c85a61bd248820b,21-02-2025,2025-02-21 20:11:13.000 UTC,481,26689663,0x827922686190790b37229fd06084350E74485b72,7753673,256192598302398336,1061919495,91623951506052150404135
0x8810de2baa17067ddcfbd9e8f29c55f070a55f0b,0x1bde968f3fb533c35f2c7abce7ce4822a294924a838a5f10f5f06b2b37554891,14-05-2025,2025-05-14 03:48:53.000 UTC,144,30202593,0x827922686190790b37229fd06084350E74485b72,13629073,87689706350176988,26562180290401600705985,341966672
0xdc98dbffcc648d6088a2ff8f7dc01aef050e58fc,0xaa19a5445ae284bc6cbe324de3fd7d7aa52ff03e989110cdb247970cb7fe364b,19-06-2025,2025-06-19 10:06:43.000 UTC,472,31769128,0x46A15B0b27311cedF172AB29E4f4766fbE7F4364,411010,11042703175799177102584,505368175452288784,22526115808311533
0x8fd1b615c006ebeb8a7cfb00a1dd809f31943b08,0x438115677475a394582cb2cf8f1a5cc3572042357848fcaeb92ebb88f21feee8,15-12-2024,2024-12-15 02:25:03.000 UTC,237,23720078,0x827922686190790b37229fd06084350E74485b72,3972922,8447562537184997710,7616120501969160170,7758993374332404
0x2791dc5e14f7680d9d969acc26059ba56403b6d5,0xd0163a67c2461a0202751baf7a9dcf94bf3196221016be353ab7bc458a98bb3f,08-01-2025,2025-01-08 02:28:07.000 UTC,324,24756970,0x827922686190790b37229fd06084350E74485b72,5221759,1237325613794761972,1038061054,33128154001059327850404
0x095d0de0ecfd6832f1a7961ae26d285d68655d60,0x34e39fbd5cd4588433559ddce5da27a6e2166b428dda5fe7d16db613f9420ad5,28-03-2025,2025-03-28 06:28:25.000 UTC,351,28176979,0x827922686190790b37229fd06084350E74485b72,9957797,258544296270369797452272,222722115025297576167,106331006048491263631539
0x8fd1b615c006ebeb8a7cfb00a1dd809f31943b08,0xce23ce39257330d46a46d829c9a891865931fe3d1341d528992f8a7c03515335,08-05-2025,2025-05-08 21:24:33.000 UTC,857,29975063,0x827922686190790b37229fd06084350E74485b72,13169771,755700518245772945,2318265516,378289825977066665661384
0xdc98dbffcc648d6088a2ff8f7dc01aef050e58fc,0xff08fda93f6c37f37cbd26279b2352b6f7fdb937c75a74328dea0571b56c18cd,10-01-2025,2025-01-10 18:43:25.000 UTC,296,24872629,0x827922686190790b37229fd06084350E74485b72,5366564,599563918117305963999456,1183607947716951590268,4430510696437650255063
0x38f6d2d9ea493c3c6ee865b5b952b5fe9e3e61fc,0xce8b5dbadb7418c82dbb2eb9951a9a46e77220657b470c83f524c17992de0b9b,17-07-2025,2025-07-17 19:05:11.000 UTC,1759,32994882,0x46A15B0b27311cedF172AB29E4f4766fbE7F4364,446473,28493406218,1361069,62651
0x9eb86e93a809a41ab0e7cc0ba6f62561fda3015c,0xbe7bd2dabd09c8a04fe02385d2e15b90fbd591cfe388b41d669c86f669080462,13-05-2025,2025-05-13 18:10:39.000 UTC,659,30185246,0x827922686190790b37229fd06084350E74485b72,13593380,10339812593,184951,332144
0x38f6d2d9ea493c3c6ee865b5b952b5fe9e3e61fc,0x9459892f673584c8e93eb61cbdc4311fa98cf6cba6da52e3307b2401def28f94,10-06-2025,2025-06-10 18:04:15.000 UTC,419,31394654,0x827922686190790b37229fd06084350E74485b72,16103271,23839739376,1821,1190909
0xdc98dbffcc648d6088a2ff8f7dc01aef050e58fc,0x34fe1f34668f75bb9ef467821ded099979f54f936baf83f12565a8c13c14ef51,03-01-2025,2025-01-03 12:29:53.000 UTC,521,24559023,0x827922686190790b37229fd06084350E74485b72,5018966,2562373906119502468263,98574583630982583182,773403994085940907
0xdc98dbffcc648d6088a2ff8f7dc01aef050e58fc,0xa3e461a9bc7f8f224e0f05e1014a7ced66a5f85b74ac7db4401bb644e85542db,15-12-2024,2024-12-15 03:09:41.000 UTC,188,23721417,0x827922686190790b37229fd06084350E74485b72,3996371,2516145861099755265,3482899542766090143,1530217086218860
0x9eb86e93a809a41ab0e7cc0ba6f62561fda3015c,0xec500245286abe0fbf1ddc19c726bb10e0e0b44ea5702c0ee17d153a4716b706,03-03-2025,2025-03-03 11:13:09.000 UTC,544,27105521,0x827922686190790b37229fd06084350E74485b72,8340931,2735901570,93233079,347972
0xdc98dbffcc648d6088a2ff8f7dc01aef050e58fc,0xdaafc44df296c02966e7cb03dd1c96f407ead0fa7d070b7c3aa0425e80c0b93d,09-01-2025,2025-01-09 09:52:05.000 UTC,313,24813489,0x827922686190790b37229fd06084350E74485b72,5293335,689713302375783505412971,169843722205667867099,25940038751596298217709
0x8fd1b615c006ebeb8a7cfb00a1dd809f31943b08,0x056258af9962d7c559c85b8bb5531dd565ca4e5deb510a738bb93e222a727f4d,26-02-2025,2025-02-26 19:01:53.000 UTC,463,26903583,0x827922686190790b37229fd06084350E74485b72,8060677,665599603379072995,2260875345,282451141781468040206714
0x9eb86e93a809a41ab0e7cc0ba6f62561fda3015c,0xf9d141f6752bcd79970bae591a809b380fdb4375f68e45a496e34c1a394b9de5,23-05-2025,2025-05-23 19:29:05.000 UTC,864,30619599,0x827922686190790b37229fd06084350E74485b72,14502812,3716606903,137245,48475
0x8508fd4238162cb3f3d485f432202af3b40f164e,0x810f59612ee8025fa36789bfdc2af6b9a37966c7b3acd44d2ac7061858ffb6b1,31-05-2025,2025-05-31 00:34:43.000 UTC,1245,30931168,0x827922686190790b37229fd06084350E74485b72,15190820,14892171536,202615,542399
0x8508fd4238162cb3f3d485f432202af3b40f164e,0xc54593cc3af1aa20361e7b604b59a369ddf35faac1546e6710b203de7b242143,05-06-2025,2025-06-05 22:57:01.000 UTC,451,31187437,0x03a520b32C04BF3bEEf7BEb72E919cf822Ed34f1,3188303,111331824136334321782,43005397843335957,105211897748534350721
0x095d0de0ecfd6832f1a7961ae26d285d68655d60,0xeac6033f52d5ab1e129c20f6548b71a9671632b01e99864641e27e7b09aeced5,09-04-2025,2025-04-09 19:17:39.000 UTC,395,28718456,0x827922686190790b37229fd06084350E74485b72,10822699,204365333277571592037767,5400963708315137879,95853475040736925682984
0x9eb86e93a809a41ab0e7cc0ba6f62561fda3015c,0x5be9919674bc7e6f9eaff7131ce99bf90e7f4ee762ea4fce4e660f1f84caf1c6,24-01-2025,2025-01-24 04:07:53.000 UTC,359,25451163,0x827922686190790b37229fd06084350E74485b72,6080650,40735247003159097731,2470089843481063,483723856944944568960
0x8508fd4238162cb3f3d485f432202af3b40f164e,0x9135f883755bde536b12f5842d1ef59526c41ae892833a6e4687896db20b0b1b,20-03-2025,2025-03-20 01:12:09.000 UTC,640,27821891,0x827922686190790b37229fd06084350E74485b72,9412503,470906334148784,85535846650974720340,63863
0x9eb86e93a809a41ab0e7cc0ba6f62561fda3015c,0xdd2f3fb73818094cabd7a57e72e0a15cb2ee9f24daeed55cff0a1e809a83f2c5,02-03-2025,2025-03-02 07:46:57.000 UTC,540,27056135,0x827922686190790b37229fd06084350E74485b72,8268465,3035380196,21411760,490683
0x9eb86e93a809a41ab0e7cc0ba6f62561fda3015c,0x9e75ffdbf02426940d4d47565542691d6c60b90d28816925650f026bc478943a,28-02-2025,2025-02-28 14:26:23.000 UTC,340,26981718,0x827922686190790b37229fd06084350E74485b72,8163286,3295579318,274339625,239925
0x9eb86e93a809a41ab0e7cc0ba6f62561fda3015c,0x988ad55331e2782714a93ea7a78f5e064b0af7d62403b0eef418b341c7a56ff6,08-01-2025,2025-01-08 16:23:15.000 UTC,573,24782024,0x827922686190790b37229fd06084350E74485b72,5253456,664067164437066765128914,627483230459973467958,17226710129982323032064
0x2791dc5e14f7680d9d969acc26059ba56403b6d5,0x0d3d37b449093203e05a7c06bea01ff849d7ec9ce77a954c0ad3fd37af2795e3,08-02-2025,2025-02-08 07:32:13.000 UTC,351,26105293,0x827922686190790b37229fd06084350E74485b72,6918896,334581800520990904,1595880541,81356898127191112137500
0xdc98dbffcc648d6088a2ff8f7dc01aef050e58fc,0x5dd7a5d0afedc4e1b16f0fa74834b4850494dda5d2731b5eb4701d7b9a94dc07,07-01-2025,2025-01-07 12:10:07.000 UTC,471,24731230,0x827922686190790b37229fd06084350E74485b72,5190208,2332003004271960805057,598767583931679641323,123522708254591954
0x8508fd4238162cb3f3d485f432202af3b40f164e,0x39d10927a0899efd9cfce4bc8b0e3cd2da42a20b20c027ba1b7c263c487440e4,04-06-2025,2025-06-04 00:18:51.000 UTC,348,31103492,0x827922686190790b37229fd06084350E74485b72,15545206,189978666299514725046,89352193655158429,156667872247390914247
0x8810de2baa17067ddcfbd9e8f29c55f070a55f0b,0xa99fe9e182c7831565942a7235378bc4521d47201b7d7862799a83779bbc8565,01-05-2025,2025-05-01 21:11:33.000 UTC,686,29672273,0x827922686190790b37229fd06084350E74485b72,12568967,70831001111431102,4649113,41952786581991316708314
0x2791dc5e14f7680d9d969acc26059ba56403b6d5,0x3f760819036e53cf0f2c244d6da8766accc446ddbd64ab2959bdee8b920f81f5,12-12-2024,2024-12-12 04:40:35.000 UTC,300,23594544,0x827922686190790b37229fd06084350E74485b72,3870655,938707693810616991130,355839965222874933380,239228681351862305
0x9eb86e93a809a41ab0e7cc0ba6f62561fda3015c,0xabfeca01b2935fbf53bd7cea9da00a2d30f8fff67520def233e0c49fc680971f,02-01-2025,2025-01-02 08:22:37.000 UTC,532,24508405,0x827922686190790b37229fd06084350E74485b72,4965942,714703749573810719118671,363559299003335909016,26148834178343161328966
0x2791dc5e14f7680d9d969acc26059ba56403b6d5,0xcbc0e258afeb81f9d294f8fba1a2b5919c547e47017b3ae526f5c0aa2d74b245,21-12-2024,2024-12-21 03:06:09.000 UTC,425,23980511,0x827922686190790b37229fd06084350E74485b72,4349702,7472201847718664146,6127192004408676894,1403304811961241
0x095d0de0ecfd6832f1a7961ae26d285d68655d60,0x9f78fb986ea51924800309472675e607479b47d396db8874e62a24db3f4fc224,22-01-2025,2025-01-22 04:49:49.000 UTC,356,25366021,0x827922686190790b37229fd06084350E74485b72,5968612,9537550469380333,92081124,2326818789339668373859
0x2791dc5e14f7680d9d969acc26059ba56403b6d5,0x30b118fd690185d7bf8a9e5d2119a76fcc6ec3acf19bc5db8c87d397cda6c171,28-02-2025,2025-02-28 04:28:35.000 UTC,2599,26963784,0x827922686190790b37229fd06084350E74485b72,8142300,260647438445952897,939290059,85378933424592228787921
0x2791dc5e14f7680d9d969acc26059ba56403b6d5,0xbd46e2af6d2ce08ef1cd7e9be9386f27e8be8efa4330daa1ebee61b27465a7b3,08-01-2025,2025-01-08 03:00:11.000 UTC,566,24757932,0x827922686190790b37229fd06084350E74485b72,5217310,15181780120971815643,3036068048623846124,1697946403406990
0x9eb86e93a809a41ab0e7cc0ba6f62561fda3015c,0x7ffe0dc138150cb798d8085e762fd68d78e299e4320db2c1e7c3a577695f7559,02-03-2025,2025-03-02 14:47:49.000 UTC,236,27068761,0x827922686190790b37229fd06084350E74485b72,8285772,3016997993,292712488,172394
0x9eb86e93a809a41ab0e7cc0ba6f62561fda3015c,0x23e42abd684c782e8134ece3b6ef782d62e4d83feac7cc69fec7281f624b3c81,06-06-2025,2025-06-06 12:45:35.000 UTC,679,31212294,0x827922686190790b37229fd06084350E74485b72,15760520,23340024822,393741,773483
0x2791dc5e14f7680d9d969acc26059ba56403b6d5,0x1a627442e147b947d5fabf43eb34d421401e907e930385a862c1b80494de1228,16-12-2024,2024-12-16 10:15:01.000 UTC,385,23777377,0x827922686190790b37229fd06084350E74485b72,4088159,7913579375184223391,4962678541497914381,608274451778760
0xdc98dbffcc648d6088a2ff8f7dc01aef050e58fc,0x25d8ec0999cf83fb2f2b3e1fa4fccb5f0a671a7b44f967eaa49ac05bb5157cb0,29-12-2024,2024-12-29 11:17:47.000 UTC,403,24340860,0x827922686190790b37229fd06084350E74485b72,4777604,1551210379042857803313623,3092768576678379728287,9605939311345513085687
0x38f6d2d9ea493c3c6ee865b5b952b5fe9e3e61fc,0x3189ef4a045e7c1560e82a913e178e83678f44f28deddcc24771a57858bfe4bc,12-06-2025,2025-06-12 05:14:19.000 UTC,742,31457956,0x827922686190790b37229fd06084350E74485b72,16239539,22617047119,1123022,7076
0x8508fd4238162cb3f3d485f432202af3b40f164e,0xf863d71d40b72e83bd7db0ef7979509ad316490d00b065420baa33b946bdcaf4,06-06-2025,2025-06-06 07:04:23.000 UTC,747,31202058,0x827922686190790b37229fd06084350E74485b72,15740186,176759266255414884973,84264718187657531,144588436837901642978
0x8508fd4238162cb3f3d485f432202af3b40f164e,0xa0144e6f095eedde888f6adac456b3f12ea0ff239aef3b2ce13f736085b805b1,25-03-2025,2025-03-25 12:20:33.000 UTC,240,28057943,0x03a520b32C04BF3bEEf7BEb72E919cf822Ed34f1,2633466,6995097363257643052018,338164686721278278,87401464797490539020307
0x8508fd4238162cb3f3d485f432202af3b40f164e,0x4aa0936d62a27054c604d595ace8b267c4f402003ce699b42a6fa6323e9d4361,17-05-2025,2025-05-17 05:38:09.000 UTC,185,30335471,0x03a520b32C04BF3bEEf7BEb72E919cf822Ed34f1,3043845,115394613968604926717,1252660330989746,2935349114003181161905
0x351f61e4c49cf11f24d9f2e737ca5eff81806355,0x257a8e4f19c0b87b79b2e79c8851b0b816a2db9dd28ba6bf4140ce6e0a3e0679,19-10-2025,2025-10-19 07:30:45.000 UTC,397,37034849,0x827922686190790b37229fd06084350E74485b72,29272980,157288012703091404,238206568,89441740264433505145235
0x0b27b59171a4ffe19f23d54126cd797be17c6551,0xbbbb598428afa79a6b14c3e0b0d636d7fe67c2d9f5834c1bb36ec86b360a4ca3,25-05-2025,2025-05-25 16:39:55.000 UTC,1281,30700924,0x03a520b32C04BF3bEEf7BEb72E919cf822Ed34f1,3094444,13823019326221272743515,617967623676218880,182133204763226394345177
0x2791dc5e14f7680d9d969acc26059ba56403b6d5,0x3b4eeccfd75f52bc59a3f38603210b485377cf26b3354746ca71861f68eb6a27,11-01-2025,2025-01-11 12:36:23.000 UTC,481,24904818,0x827922686190790b37229fd06084350E74485b72,5399346,1790814949026895288315,577782571935807643658,11100090539778121
0x38f6d2d9ea493c3c6ee865b5b952b5fe9e3e61fc,0x81db420a3f53fa249a85dfe98a30c9e00aa3dd08390f87c9c99cfcad478307c0,17-06-2025,2025-06-17 05:05:53.000 UTC,282,31673703,0x46A15B0b27311cedF172AB29E4f4766fbE7F4364,408887,6770746838,247417,90964
0x2791dc5e14f7680d9d969acc26059ba56403b6d5,0xe494984966fdee36ac63512a56ceaf4e89009f389f7e2c1c678cb7a539837c4f,09-01-2025,2025-01-09 05:33:11.000 UTC,363,24805722,0x827922686190790b37229fd06084350E74485b72,5282927,18934366770768283341604,370166218081911516,23583644888122004613099
0x8508fd4238162cb3f3d485f432202af3b40f164e,0xe90b79e870c7b7c4dc542151ba34d49cc941b020faa229b07e486891232a918f,03-04-2025,2025-04-03 01:17:11.000 UTC,624,28426842,0x827922686190790b37229fd06084350E74485b72,10385563,311045032865803,88150609453268391361,25461
0x38f6d2d9ea493c3c6ee865b5b952b5fe9e3e61fc,0xb4ce804a3785190b134bbba9aeb1aa380f02a2918f20d82397316fa3ad5bfe4e,26-02-2025,2025-02-26 19:44:11.000 UTC,371,26904852,0x827922686190790b37229fd06084350E74485b72,8062412,229769633629145676,971998342,83200244293592943717447
0x8810de2baa17067ddcfbd9e8f29c55f070a55f0b,0xf83766348524cf1acb78db699568c66553fccfc85035f1c08ff58bccfbb30ca3,11-05-2025,2025-05-11 05:46:23.000 UTC,275,30076518,0x827922686190790b37229fd06084350E74485b72,13373857,145353158604622097,122618769,76871189142273975626467
0x8508fd4238162cb3f3d485f432202af3b40f164e,0x438144f4af2e0dd0f801a86a3279234cd4c4c304df5100d4db32c8026163c03a,04-05-2025,2025-05-04 10:45:11.000 UTC,431,29783082,0x03a520b32C04BF3bEEf7BEb72E919cf822Ed34f1,2968101,25342859288576595260,25283642322637078785,22185242152438931
0x9eb86e93a809a41ab0e7cc0ba6f62561fda3015c,0xd09ae8a27a545024b8bb5b4e138287af68a1519de8290bc30644217d7063aeb8,03-06-2025,2025-06-03 13:18:03.000 UTC,576,31083668,0x827922686190790b37229fd06084350E74485b72,15504785,27019079172,707140,643687
0x2791dc5e14f7680d9d969acc26059ba56403b6d5,0x7d8e127357bd0d15f0d4e05d284bb80ed2c2c33c10a31fc0a144e5d02a974a86,26-12-2024,2024-12-26 19:07:49.000 UTC,229,24225361,0x827922686190790b37229fd06084350E74485b72,4636817,3927687719686254206,885319038413519839,2684594540279343
0x38f6d2d9ea493c3c6ee865b5b952b5fe9e3e61fc,0xb8f8ef8d7f379e037ca66867fa3260aaad1e0601dd49201056a69c0483afd162,22-01-2025,2025-01-22 20:14:59.000 UTC,382,25393776,0x827922686190790b37229fd06084350E74485b72,6005201,427558788675870014,3435585488,81725378442145928109117
0xdc98dbffcc648d6088a2ff8f7dc01aef050e58fc,0x4ebecd8236724934671528b23c87ec1abe2c4a19d57d532c47a89ea472df1c7c,12-01-2025,2025-01-12 04:04:05.000 UTC,893,24932649,0x827922686190790b37229fd06084350E74485b72,5431293,1234269369808582600025,315965783032978194617,84893129905917713
0x2791dc5e14f7680d9d969acc26059ba56403b6d5,0x9cad673c3ea2dae940a62fb5043e787c969a3a24fc2c2b4bcd1c42022f8c59fa,05-01-2025,2025-01-05 01:56:11.000 UTC,366,24626412,0x827922686190790b37229fd06084350E74485b72,5087669,15067682632245883995,2048535169895648026,2747489044571672
0xdc98dbffcc648d6088a2ff8f7dc01aef050e58fc,0x18702b963ed7e771c8c8dcf2cc9cc1ef7d1b36871f492a4a1eb553798d737cab,07-02-2025,2025-02-07 16:29:33.000 UTC,374,26078213,0x03a520b32C04BF3bEEf7BEb72E919cf822Ed34f1,2052600,8803062131465308852818,553628753675970418,120408209274989528444664
0x0b27b59171a4ffe19f23d54126cd797be17c6551,0x7f329771004a5ca0f98147656a7f6b53a11c5a9cf77dc74ae8c1c282d9a67dfc,19-05-2025,2025-05-19 05:40:17.000 UTC,134,30421935,0x03a520b32C04BF3bEEf7BEb72E919cf822Ed34f1,3057436,14383813248046321656952,88517585950194539,386550632023828462537621
0x38f6d2d9ea493c3c6ee865b5b952b5fe9e3e61fc,0x58af09887448fb13d6243ea20175ae23014e82812412509575ecd45e3afe657e,03-06-2025,2025-06-03 11:49:51.000 UTC,393,31081022,0x46A15B0b27311cedF172AB29E4f4766fbE7F4364,395072,5698344251,234061,50698
0x9eb86e93a809a41ab0e7cc0ba6f62561fda3015c,0xc4e507fef4dc7ae83f477cac0d66f810910c2688392248477b2b4ed08e53575c,07-01-2025,2025-01-07 02:44:39.000 UTC,218,24714266,0x827922686190790b37229fd06084350E74485b72,5175237,156887552228401991245871,55777140085335574667,6265660245911398955627
0x8fd1b615c006ebeb8a7cfb00a1dd809f31943b08,0xab0c1f5af06f9752eb1fdab93dcc015c562c6b05a64d876b1d15354bfd5dfc57,12-12-2024,2024-12-12 02:38:05.000 UTC,483,23590869,0x827922686190790b37229fd06084350E74485b72,3871616,398239160856565512747,330222220148565783972,187061357207740879
0x0b27b59171a4ffe19f23d54126cd797be17c6551,0x2b14493aece203deaea876542e51ff4ea21fd3f0948fedac136711e13adab887,01-08-2025,2025-08-01 10:32:55.000 UTC,1210,33627514,0x03a520b32C04BF3bEEf7BEb72E919cf822Ed34f1,3655979,1524963078899817293912,46108217375704050,30155991011877270615138
0x38f6d2d9ea493c3c6ee865b5b952b5fe9e3e61fc,0xc46c1bbdb6db9a4995757578c44a8b0d705c1e154e3ca0ff71e2b9488fe5167e,09-01-2025,2025-01-09 04:24:31.000 UTC,565,24803662,0x827922686190790b37229fd06084350E74485b72,5280675,1291610455981289937120729,2104911295354263005069,16124171906814550466708
0x8810de2baa17067ddcfbd9e8f29c55f070a55f0b,0x8d28a91d1df91b2377f8de5be87972f00189bbc2d9453cbf27d61c927da996c5,24-07-2025,2025-07-24 15:37:49.000 UTC,307,33291061,0x03a520b32C04BF3bEEf7BEb72E919cf822Ed34f1,3599023,1970993321578505387266,87109878065973254,27003735004204489698836
0x9eb86e93a809a41ab0e7cc0ba6f62561fda3015c,0x9eb889868fb5e23159790b4b762f435890c4d9a4dd7219265df5bd78c888b70e,13-12-2024,2024-12-13 21:38:45.000 UTC,341,23668289,0x827922686190790b37229fd06084350E74485b72,3974297,1877828880251707067400,1441707079061977364347,487433948223109262
0x2791dc5e14f7680d9d969acc26059ba56403b6d5,0x38e479f65e29870c9d7e722d5a7a0e8a3537821a9acce88257dcfbb262b8ab03,02-01-2025,2025-01-02 08:29:51.000 UTC,563,24508622,0x827922686190790b37229fd06084350E74485b72,4966247,3448084710865350433802,100878512253185658853,1158507863851149639
0x8508fd4238162cb3f3d485f432202af3b40f164e,0x8b1c76586a7c0233fdd71c4b9439bac0d42ce3d6c95c337102cc7ee61736c1a3,23-05-2025,2025-05-23 08:56:51.000 UTC,1141,30600632,0x827922686190790b37229fd06084350E74485b72,14502837,16805564583,371834,468501
0x8508fd4238162cb3f3d485f432202af3b40f164e,0x9fb5dfe90edab8740ef756395e6080326fa9f90af4fb6e1b2a2c27db7ac4ad6c,05-06-2025,2025-06-05 07:31:37.000 UTC,523,31159675,0x827922686190790b37229fd06084350E74485b72,15653533,13268246509,173706,489849
0x351f61e4c49cf11f24d9f2e737ca5eff81806355,0x3482f36e0207c52b47e1c9bd838022691ff735dd0259e4ff9795b0b6c326225a,14-08-2025,2025-08-14 00:57:27.000 UTC,480,34171850,0x827922686190790b37229fd06084350E74485b72,22314575,1344092549362686411,540211355,398849853693112668100133
0x2791dc5e14f7680d9d969acc26059ba56403b6d5,0x472815db1c3e0c0cbc88c85701e6ab9f392ce466f4564ff0a3eea545e8b22d56,12-12-2024,2024-12-12 16:33:03.000 UTC,401,23615918,0x827922686190790b37229fd06084350E74485b72,3904154,3816048038449722735342,1533089873880454536059,929945297187336385
0xdc98dbffcc648d6088a2ff8f7dc01aef050e58fc,0xaa8865390afb245ba8eb3e2beee450c7c7ce0ac853aed4a59dafb119e8092683,11-01-2025,2025-01-11 10:37:31.000 UTC,357,24901252,0x827922686190790b37229fd06084350E74485b72,5391464,6143932001543604755,345609349180571117,1531561697241384
0x351f61e4c49cf11f24d9f2e737ca5eff81806355,0x5df8ac29a96f56f4450c5fba9bda832874e69dfe96f1eae00220c2820f90f803,02-09-2025,2025-09-02 15:03:25.000 UTC,392,35018029,0x827922686190790b37229fd06084350E74485b72,24411767,340562845679933243,23040952,170949366741031864246500
0x2791dc5e14f7680d9d969acc26059ba56403b6d5,0xf6b57b1650517dc74ac4f56089d034280def8d2e056c0f840e6918674b46e0f4,12-12-2024,2024-12-12 03:18:51.000 UTC,467,23592092,0x827922686190790b37229fd06084350E74485b72,3870655,12331912306857440755,3206808502631831926,3867271954849381
0x38f6d2d9ea493c3c6ee865b5b952b5fe9e3e61fc,0x521cfad2364b1733365bca1e695def199688bd1d7ee9358bd38f3aecb2ce0614,22-01-2025,2025-01-22 04:32:49.000 UTC,377,25365511,0x827922686190790b37229fd06084350E74485b72,5967940,168250114708417730,1382218954,31414746001668807944154
0x9eb86e93a809a41ab0e7cc0ba6f62561fda3015c,0x53f23c7b2fd19d4d0f88733714fcde80a5c3c6bb1a0b467e7fcd5fec097c7846,15-12-2024,2024-12-15 12:11:19.000 UTC,280,23737666,0x827922686190790b37229fd06084350E74485b72,4042106,1784609274689100725951,1330251277000887443921,496272502905596389
0x2791dc5e14f7680d9d969acc26059ba56403b6d5,0x670bd4220309f6409ef320d30eccded0bde17cdac43b7ef32e56dc4f3ca8ff75,15-01-2025,2025-01-15 03:06:19.000 UTC,610,25060516,0x827922686190790b37229fd06084350E74485b72,5581375,304542843074857579852,124623643001305983617,248347370366813366
0x8508fd4238162cb3f3d485f432202af3b40f164e,0x6dadba5a8c58b506452d2fd34851d15544c6254219aa6f96995c9626c4dfc328,18-05-2025,2025-05-18 12:38:41.000 UTC,1027,30391287,0x827922686190790b37229fd06084350E74485b72,14021934,222019702050038460421,121474487508008738,239766956518256214016
0x351f61e4c49cf11f24d9f2e737ca5eff81806355,0xdf9a00eea5f1ab18683376a7c74ccfadb61aac6437409f35637982e4263a3c71,27-08-2025,2025-08-27 18:35:13.000 UTC,266,34765183,0x827922686190790b37229fd06084350E74485b72,23788454,559140200447307433,9521961,275542145785402568145545
0x2791dc5e14f7680d9d969acc26059ba56403b6d5,0xe9ffc5d1b20173cef18bcc20c2040e5418c764452fdd02cda72ba981ef24988d,29-12-2024,2024-12-29 08:08:17.000 UTC,412,24335175,0x827922686190790b37229fd06084350E74485b72,4771170,4575634348391024328,1519269705190220777,2839480921535296
0x8810de2baa17067ddcfbd9e8f29c55f070a55f0b,0x00391763f95aee409f38a3a40377824a99d1e3d7c612762f18c3f84627d09c99,18-06-2025,2025-06-18 13:25:03.000 UTC,561,31731878,0x03a520b32C04BF3bEEf7BEb72E919cf822Ed34f1,3319669,23055070044820723,716210628,644692243235416706493
0x8508fd4238162cb3f3d485f432202af3b40f164e,0xd95c2feb8c0fc01291d3a2f97a847e5866d3cbbb2e6292eccf11995c7ee74b2d,26-05-2025,2025-05-26 02:44:17.000 UTC,681,30719055,0x03a520b32C04BF3bEEf7BEb72E919cf822Ed34f1,3096990,191689004520739820871,56459035150848233,200228182259462997688
0x8508fd4238162cb3f3d485f432202af3b40f164e,0xbc3564c74d83ccafc6e1837e58bb0bdd2725cebb98f0d2b70b8b2e8f9883847b,02-07-2025,2025-07-02 09:10:15.000 UTC,426,32329034,0x827922686190790b37229fd06084350E74485b72,18098997,181096710889788309627,86274316933838203,148499021665715785804
0x095d0de0ecfd6832f1a7961ae26d285d68655d60,0x21d2110c0b0e48a4984f200361856eb12ac1e11d6ac938217f4f4c8add9094e0,12-02-2025,2025-02-12 21:30:15.000 UTC,439,26303234,0x827922686190790b37229fd06084350E74485b72,7207771,6869384246105351577160,95498696890281825,168740894415175612083458
0x38f6d2d9ea493c3c6ee865b5b952b5fe9e3e61fc,0x594b4a56fbac5a687dc7b33e48b1f6ec11698c0f183ee8827096545d2917ccd2,02-07-2025,2025-07-02 06:47:49.000 UTC,1248,32324761,0x46A15B0b27311cedF172AB29E4f4766fbE7F4364,424209,12086320677,565249,38733
0x2791dc5e14f7680d9d969acc26059ba56403b6d5,0x783fc33ef5b7749eef038da1a02d97ebd142f9e8a1f9807c80b9d87ad1a55951,17-01-2025,2025-01-17 10:18:19.000 UTC,449,25159876,0x827922686190790b37229fd06084350E74485b72,5716273,27068646249708554240080,1046902220832828728,5473292551195732961478
0x8508fd4238162cb3f3d485f432202af3b40f164e,0xc5cc4a8243da42b4b28eb09f220b2f4eb4be654ac9994bea243b9f58194887ea,06-04-2025,2025-04-06 14:35:05.000 UTC,582,28580379,0x03a520b32C04BF3bEEf7BEb72E919cf822Ed34f1,2816066,5527550660336786383167,210403369691548472,85399026467124231012341
0x095d0de0ecfd6832f1a7961ae26d285d68655d60,0x44072f709b07cb1c3535ebcd8d43d351c1ac068a00db635e8288c00eb92851bc,11-05-2025,2025-05-11 04:54:47.000 UTC,111,30074970,0x827922686190790b37229fd06084350E74485b72,13370861,58182647824538283728,71223420107432548,112732377651422640593
0x8fd1b615c006ebeb8a7cfb00a1dd809f31943b08,0x1fb9dd36c183892843cae7026aa375dbed43672b50ec54fb4906a249fe7af007,15-12-2024,2024-12-15 16:30:49.000 UTC,266,23745451,0x827922686190790b37229fd06084350E74485b72,3972922,13161231390822900714,15593775804315275320,9700415388584210
0x9eb86e93a809a41ab0e7cc0ba6f62561fda3015c,0x7ac373cf8cf597b311a91e6af28b8b6b30a4de8a6fe5738df38392a8f3eaffd9,07-01-2025,2025-01-07 17:51:55.000 UTC,310,24741484,0x827922686190790b37229fd06084350E74485b72,5201812,704648849389313078606445,202318013690535557107,29274158725349506369360
0x8810de2baa17067ddcfbd9e8f29c55f070a55f0b,0xf90461279538e58c82dbb810725f2ae37b3fd0585c96237e63e15088362343b3,13-07-2025,2025-07-13 05:54:07.000 UTC,534,32798350,0x03a520b32C04BF3bEEf7BEb72E919cf822Ed34f1,3517899,5059255161098821742447,111771868394475695,137996217200536699567590
0x9eb86e93a809a41ab0e7cc0ba6f62561fda3015c,0x47f84f075e3369e51e8b57c6aa6a408731618b9fc0b562681fa2a91f25ec1b37,10-12-2024,2024-12-10 12:01:11.000 UTC,450,23521362,0x827922686190790b37229fd06084350E74485b72,3780421,3210670253202242239121,1043983067573051076342,883388516397596367
0x8fd1b615c006ebeb8a7cfb00a1dd809f31943b08,0x825b71adccea93cb503f5951c0ff1c1970d4553f56f98ab93c0ec87d9be2f851,12-12-2024,2024-12-12 17:23:37.000 UTC,556,23617435,0x827922686190790b37229fd06084350E74485b72,3906362,1357259391731476143089,575111734808365734093,316090263189246343
0xdc98dbffcc648d6088a2ff8f7dc01aef050e58fc,0xeec59a1750f93e53eba604a2bdcb68a4b276b8d7ffccc199fc883c70f4b60049,04-01-2025,2025-01-04 05:26:17.000 UTC,342,24589515,0x827922686190790b37229fd06084350E74485b72,5053779,2586478719691494203098,555862870976594381793,228125405849761497
0x8508fd4238162cb3f3d485f432202af3b40f164e,0x0a77838ab99987d0a3660fe419589ba00b7ca3b17381618f560341a5b0703538,13-06-2025,2025-06-13 13:15:11.000 UTC,365,31515582,0x03a520b32C04BF3bEEf7BEb72E919cf822Ed34f1,3256523,92017154204506571046,31753081856894937,98022108388684748512
0x0b27b59171a4ffe19f23d54126cd797be17c6551,0x26c4d9a80c4443f94ca5f752987826f896b6b4494597344a57bcf6bb0d742bfa,21-07-2025,2025-07-21 11:13:13.000 UTC,143,33153523,0x03a520b32C04BF3bEEf7BEb72E919cf822Ed34f1,3577256,3350288813635702118434,92274668047343261,71677794604608065321337
0x8fd1b615c006ebeb8a7cfb00a1dd809f31943b08,0xfcd2cbb30b7c69785dafb7c71308bf8b13e278edbf7b2be0cd3ba0e09a2ddb7e,13-12-2024,2024-12-13 20:58:53.000 UTC,346,23667093,0x827922686190790b37229fd06084350E74485b72,3972922,3004716040050005204941,3093205542504608002007,2512703619657034953
0x9eb86e93a809a41ab0e7cc0ba6f62561fda3015c,0xca27215de201f6fdb5f18977df6828b14d441a454e3ec51871d793f54073eae4,01-01-2025,2025-01-01 11:03:43.000 UTC,543,24470038,0x827922686190790b37229fd06084350E74485b72,4923373,4287237123072482997820,337466459375973003,1316354334109355787861
0x8508fd4238162cb3f3d485f432202af3b40f164e,0x603bb9434fe7f22642be1156e6a648d54f8a2a5075bdaa6c7c409806d2a44261,22-05-2025,2025-05-22 05:12:33.000 UTC,713,30550703,0x827922686190790b37229fd06084350E74485b72,14380031,280144855604656250206,140289670895414406,216885482060080462111
0x2791dc5e14f7680d9d969acc26059ba56403b6d5,0x98e67692453564cf2ae7653f72d881b1a9236c7e827461a12e5cd5ae790c6e33,20-12-2024,2024-12-20 21:05:57.000 UTC,669,23969705,0x827922686190790b37229fd06084350E74485b72,4341881,5884048541985882019,5621107220863259484,555980114029470
0x9eb86e93a809a41ab0e7cc0ba6f62561fda3015c,0x8a42f935be90dd5fd89703383cb4f8b0dd6f8a202f583e633b1753cb8c29bb20,22-05-2025,2025-05-22 09:03:37.000 UTC,907,30557635,0x827922686190790b37229fd06084350E74485b72,14397153,27655486162,722118,660525
0x8508fd4238162cb3f3d485f432202af3b40f164e,0xa59b9d8199c02c79d165a4c8a44fcffda7a0f08c961b1812e9c5a188fa450847,06-06-2025,2025-06-06 19:00:19.000 UTC,656,31223536,0x827922686190790b37229fd06084350E74485b72,15785193,174597175600793887296,85404755983581155,139811160157189171218
0xdc98dbffcc648d6088a2ff8f7dc01aef050e58fc,0xeaabe90c47760baf7c083942cf764dc21c23425377068992625099cc609de373,11-01-2025,2025-01-11 08:20:25.000 UTC,665,24897139,0x827922686190790b37229fd06084350E74485b72,5390938,1267140181141389782574,324858723160504041127,84634258306168238
0x38f6d2d9ea493c3c6ee865b5b952b5fe9e3e61fc,0x1cd3a65b45236bb064f88fa23b451f2ce531695b6bbe47aca76d94b941d00a30,10-01-2025,2025-01-10 04:45:49.000 UTC,283,24847501,0x827922686190790b37229fd06084350E74485b72,5334384,4334357936751977575,952216592344407832,421156815308243
0x9eb86e93a809a41ab0e7cc0ba6f62561fda3015c,0x3f866c16807242c2fc28b4e9469c64e5a096ca441299826b7ae0ed71ce01f414,20-02-2025,2025-02-20 16:14:41.000 UTC,366,26639367,0x827922686190790b37229fd06084350E74485b72,7670706,5308788067,257199276,584984
0x9eb86e93a809a41ab0e7cc0ba6f62561fda3015c,0xb045e7116d05d3d46d6f97f56b4e7052d4654ae2c4d8c9565f6e82ac56b13dc0,19-06-2025,2025-06-19 17:19:43.000 UTC,535,31782118,0x827922686190790b37229fd06084350E74485b72,16928594,59090667506,800079,2155327
0x8508fd4238162cb3f3d485f432202af3b40f164e,0x25993edea6aa6f655689e861495f84ab6e1189668f41d562a3a8e05f68e6794d,03-06-2025,2025-06-03 12:39:01.000 UTC,6795,31082497,0x827922686190790b37229fd06084350E74485b72,15502676,13789156367,154411,535302
0x9eb86e93a809a41ab0e7cc0ba6f62561fda3015c,0xbdb3984dee4ff02f56ba935f7ce5f1a95fd57efae9d8abf3007987a07605519d,17-05-2025,2025-05-17 08:54:27.000 UTC,1472,30341360,0x827922686190790b37229fd06084350E74485b72,13925324,10219549752,257453,253488
0x8fd1b615c006ebeb8a7cfb00a1dd809f31943b08,0xb311618eb008e190f5c14a0775e92d233a481d86e6ce069ddc0af4fe367bd67d,23-12-2024,2024-12-23 03:56:39.000 UTC,299,24068426,0x827922686190790b37229fd06084350E74485b72,4476248,1285520571574910792801,76833634185686601279,466088864187059376
0x8508fd4238162cb3f3d485f432202af3b40f164e,0x41eb50fe6630e07ad37d9ddd179a1d9620797ecff517b34558c8c49682ad7d2c,25-05-2025,2025-05-25 21:30:07.000 UTC,759,30709630,0x827922686190790b37229fd06084350E74485b72,14723537,16577890350,492725,335918
0x2791dc5e14f7680d9d969acc26059ba56403b6d5,0xd82a4fea907f002eb3e5472832182413314daa206177e7aad825bfade3e8524a,14-12-2024,2024-12-14 10:48:47.000 UTC,243,23691990,0x827922686190790b37229fd06084350E74485b72,3996193,6349146067667328118,252538542017534283,3068450761433309
0x2791dc5e14f7680d9d969acc26059ba56403b6d5,0x1724bcf1c8fdbb4aff583ab5648a52890ee2a52ed4c697e2b9ac3ac61ad9c758,03-01-2025,2025-01-03 06:56:43.000 UTC,186,24549028,0x827922686190790b37229fd06084350E74485b72,5010151,12287555098891114756206,466774952997540383,3177728929312908624878
0x095d0de0ecfd6832f1a7961ae26d285d68655d60,0xf70fced812206c09021feaddf1c1100af8dce34831bfa4900a048a8bee60f748,19-01-2025,2025-01-19 22:59:33.000 UTC,197,25269113,0x03a520b32C04BF3bEEf7BEb72E919cf822Ed34f1,1856673,3058164380452198670904,138167834017235697,79895265140260636954848
0xdc98dbffcc648d6088a2ff8f7dc01aef050e58fc,0x3cfb6e6ffc3593e416bfdf4721717b1eb5bfd872b15770ef1979331c80bd3e9c,11-01-2025,2025-01-11 03:34:35.000 UTC,329,24888564,0x827922686190790b37229fd06084350E74485b72,5383936,506093107742089079,1249499476,20261864029109123372024
0x0b27b59171a4ffe19f23d54126cd797be17c6551,0x88b0ee561c9fae219856b26f1ac9d3462ad74856d102fa97afe76c2b47fe3441,03-07-2025,2025-07-03 04:25:19.000 UTC,297,32363686,0x03a520b32C04BF3bEEf7BEb72E919cf822Ed34f1,3468950,7737821252136235320985,241882714811548552,149784467219420119444382
0x9eb86e93a809a41ab0e7cc0ba6f62561fda3015c,0x10e507b93b03eeaf05d69f949a99e05715146b75ce10b93b3b166e833f5b0a6b,04-01-2025,2025-01-04 17:55:41.000 UTC,398,24611997,0x827922686190790b37229fd06084350E74485b72,5076379,1403591660446004532627,62250009161814846,1924693698130108746104
0xdc98dbffcc648d6088a2ff8f7dc01aef050e58fc,0x2a9620b2b6f2377921cf3557892b25d60dfb05ba78904863c4aee6478a41ee48,20-03-2025,2025-03-20 07:38:03.000 UTC,245,27833468,0x03a520b32C04BF3bEEf7BEb72E919cf822Ed34f1,2524999,855893689820579651050,17937517215984077,19610366735947696963568
0x8810de2baa17067ddcfbd9e8f29c55f070a55f0b,0xf64d6036d8766e93234c099e60804b52161036c2a8ed34c6725e30ef8c6f5716,21-05-2025,2025-05-21 01:25:21.000 UTC,296,30500687,0x03a520b32C04BF3bEEf7BEb72E919cf822Ed34f1,3069186,27775990355784224,1128906635,595062850475747068858
0x38f6d2d9ea493c3c6ee865b5b952b5fe9e3e61fc,0xdf3f35c7ad0267786fc1bfb4873f8e774b2e4a37f4c06442f814165dffee8934,07-06-2025,2025-06-07 02:49:21.000 UTC,697,31237607,0x46A15B0b27311cedF172AB29E4f4766fbE7F4364,398328,5460929201,109240,163835
0x2791dc5e14f7680d9d969acc26059ba56403b6d5,0x409dcad701724b82f2ca4ff2dd1b3c3320fcf34f2fe7c6c4a513d032b040ad1f,27-12-2024,2024-12-27 04:56:05.000 UTC,560,24243009,0x827922686190790b37229fd06084350E74485b72,4673890,4459115732451171770,707553294551487803,3364818535376566
0x351f61e4c49cf11f24d9f2e737ca5eff81806355,0x68120b063d289d71a5da998c6996115fd1e348a53609c9728e6fc3f4bcd5f471,21-08-2025,2025-08-21 02:34:41.000 UTC,579,34477167,0x827922686190790b37229fd06084350E74485b72,23050619,865851523387687142,273654680,326646476429001115877368
0x8508fd4238162cb3f3d485f432202af3b40f164e,0xa04d21e66cadc4b4b6593a24edf42bb059a9ff4daa3e090980aa6dfce8344248,10-04-2025,2025-04-10 20:05:31.000 UTC,179,28763092,0x827922686190790b37229fd06084350E74485b72,10890865,183584415268195,82021144849016638308,1857
0xdc98dbffcc648d6088a2ff8f7dc01aef050e58fc,0x21f07e78b9d7246ecffb474ebdae9df96f2ab50eacb89a0dc855d6166191c505,25-03-2025,2025-03-25 00:08:53.000 UTC,643,28035993,0x03a520b32C04BF3bEEf7BEb72E919cf822Ed34f1,2625524,16110855129774035016068,938362819678173741,241230993493757214723001
0x8508fd4238162cb3f3d485f432202af3b40f164e,0x5572dffc0f523725456d2f69049cd80af30873ca2814a23ff2fa39cac77a2747,19-05-2025,2025-05-19 08:06:21.000 UTC,1225,30426317,0x03a520b32C04BF3bEEf7BEb72E919cf822Ed34f1,3058218,187314782751187471657,155198941567424975,132576211999507513344
0x8508fd4238162cb3f3d485f432202af3b40f164e,0xb742b62046552efa7ad145593b0b298b47989ee9dfb6759784388c42d4970ecc,17-03-2025,2025-03-17 05:53:15.000 UTC,155,27700724,0x03a520b32C04BF3bEEf7BEb72E919cf822Ed34f1,2457986,63299590695928827259,94247255786849103827,37129389583495475
0xdc98dbffcc648d6088a2ff8f7dc01aef050e58fc,0xd8c3466cc26f2c4cc5833606ecd5d7ab945eec3d389d4e9a7e51816796d244d2,29-05-2025,2025-05-29 19:39:49.000 UTC,592,30879121,0x46A15B0b27311cedF172AB29E4f4766fbE7F4364,390464,12260074087336393111127,26989095591965612,613212371181973436
0x2791dc5e14f7680d9d969acc26059ba56403b6d5,0xf3df5746e87b7794032e64307e9d46e5fe6841a9b81cc9472141d043de487547,14-01-2025,2025-01-14 06:07:27.000 UTC,383,25022750,0x827922686190790b37229fd06084350E74485b72,5533305,1458451921216081768193,35729137342340355927,394649916242517504
0xdc98dbffcc648d6088a2ff8f7dc01aef050e58fc,0x46e92f58cfa571e07bd85322e12c7fbf4fcd60ce2629f88c36118d8a54115629,09-07-2025,2025-07-09 06:21:01.000 UTC,535,32626357,0x46A15B0b27311cedF172AB29E4f4766fbE7F4364,432294,1709280553,46096,39359
0x9eb86e93a809a41ab0e7cc0ba6f62561fda3015c,0xd8b74d50a1befe6534fd1753b6af006b1df2511930c922b7f2b348488e64f317,05-03-2025,2025-03-05 06:27:53.000 UTC,217,27183363,0x03a520b32C04BF3bEEf7BEb72E919cf822Ed34f1,2224223,171310301,143508687,195161
0xdc98dbffcc648d6088a2ff8f7dc01aef050e58fc,0x23dd085461edac56b83de2e2d0d435262ce6bafd0f5355111d78da8bdbfdc048,10-06-2025,2025-06-10 12:29:35.000 UTC,459,31384614,0x827922686190790b37229fd06084350E74485b72,16081751,13099749025307522,61899263,1547089128305273359388
0x8508fd4238162cb3f3d485f432202af3b40f164e,0x2581631f724ec5dc4412521338deb67d512436ad3abf6dc0fedc2ef383382a4a,07-07-2025,2025-07-07 17:52:41.000 UTC,612,32560707,0x827922686190790b37229fd06084350E74485b72,18572183,173672009179675154345,77485997992871460,151963132528540946100
0x2791dc5e14f7680d9d969acc26059ba56403b6d5,0x4d271e7e427f04240f7f1d360dbe28013782e899df1a61d773f384341836d88b,13-12-2024,2024-12-13 12:51:43.000 UTC,350,23652478,0x827922686190790b37229fd06084350E74485b72,3951270,3367446071370064980609,844223462550538626903,1123150418114611173
0xdc98dbffcc648d6088a2ff8f7dc01aef050e58fc,0x2e922540321bb17604a003d71541c76e4921d1c0d678d95c691ab2fdc9f21d68,15-07-2025,2025-07-15 16:18:25.000 UTC,205,32903479,0x46A15B0b27311cedF172AB29E4f4766fbE7F4364,443447,10453055064796203016165,409668126760624706,96834852715662338
0x8810de2baa17067ddcfbd9e8f29c55f070a55f0b,0x2ab6d61aca871cc13ac0316d1c1e9a3f0639113775c88026ee1d90dc8ec240a9,19-03-2025,2025-03-19 22:09:59.000 UTC,390,27816426,0x827922686190790b37229fd06084350E74485b72,9403332,152150193196517435,55785949,69985673221223901955220
0x38f6d2d9ea493c3c6ee865b5b952b5fe9e3e61fc,0x717a2d2c985ad3ed510ceaa7e022423004f9efc20f1ad15c54e28bc7b5f25497,03-07-2025,2025-07-03 17:41:37.000 UTC,950,32387575,0x46A15B0b27311cedF172AB29E4f4766fbE7F4364,426677,11942378948,253958,343184
0x9eb86e93a809a41ab0e7cc0ba6f62561fda3015c,0x33311215ae8077a79aab25a68d5965a695ac08b8a6c5df4fe7c549722ec2c508,09-01-2025,2025-01-09 02:44:11.000 UTC,416,24800652,0x827922686190790b37229fd06084350E74485b72,5276727,1009153157025621606855,78440687756090723,1156415264883357988892
0x38f6d2d9ea493c3c6ee865b5b952b5fe9e3e61fc,0x451b7091b51da81d866b67dd4bb017cbaa553c2c7c76cf0ae47402e307aa2d17,30-05-2025,2025-05-30 21:34:03.000 UTC,622,30925748,0x827922686190790b37229fd06084350E74485b72,15178120,25519704823,1026929,247911
0x095d0de0ecfd6832f1a7961ae26d285d68655d60,0xf4c2489674718748cb463cd262904156634cb8e06d452c139d06b57916e2da71,28-02-2025,2025-02-28 05:17:01.000 UTC,365,26965237,0x827922686190790b37229fd06084350E74485b72,8144174,66183403214826136,89458264,45093510383872072513887
0x8508fd4238162cb3f3d485f432202af3b40f164e,0xd87fe3db07e2427f89307ea1a738bb68a5951714301c7c2b0f54947a95230d06,31-03-2025,2025-03-31 09:56:15.000 UTC,572,28312814,0x827922686190790b37229fd06084350E74485b72,10177786,373925455779012,9794392104963974660,81045
0x095d0de0ecfd6832f1a7961ae26d285d68655d60,0xe5bb9a5a638513a62ab6d1127c244c4515cbb6d1886da3c93cd4c284f70aed02,18-03-2025,2025-03-18 11:35:25.000 UTC,294,27754189,0x827922686190790b37229fd06084350E74485b72,9305373,43978063542460709,46941090,34397300412385202679159
0xdc98dbffcc648d6088a2ff8f7dc01aef050e58fc,0xd475fdecbb95aec30d69beb4ff47cddf4d2b064be035ed07bdfef65241245fe3,27-05-2025,2025-05-27 03:46:43.000 UTC,309,30764128,0x827922686190790b37229fd06084350E74485b72,14800389,179253646,1267,7703
0xdc98dbffcc648d6088a2ff8f7dc01aef050e58fc,0x51293d2015a8de6ec3beb1cfc5a29377870bd68c5fee55b8351e86fcaa1c9a7c,06-01-2025,2025-01-06 02:43:07.000 UTC,520,24671020,0x827922686190790b37229fd06084350E74485b72,5129590,2506672916939760774898,553201568796628444550,216698036328951796
0xdc98dbffcc648d6088a2ff8f7dc01aef050e58fc,0x6f652a78c93f00ba402b4ec57800e43724e0e7a907f79facea4d16e4ff8db274,20-01-2025,2025-01-20 03:44:55.000 UTC,243,25277674,0x03a520b32C04BF3bEEf7BEb72E919cf822Ed34f1,1846739,2652094097590796870152,268296668140371008,22476898963916133158989
0x38f6d2d9ea493c3c6ee865b5b952b5fe9e3e61fc,0x372c18fac7d317e6618e04009f437b3f844d5909672730d445b97ccfa6691f39,12-01-2025,2025-01-12 01:34:57.000 UTC,437,24928175,0x827922686190790b37229fd06084350E74485b72,5427063,913230630486216386323517,326097169762229337681,32016254248943401542964
0x9eb86e93a809a41ab0e7cc0ba6f62561fda3015c,0x1cac5ebc01b16254e868e2709a279db3e9fd6ea380200d2f94d0ab04baa5cebb,22-01-2025,2025-01-22 02:36:03.000 UTC,309,25362008,0x827922686190790b37229fd06084350E74485b72,5963692,10283797136842914,89552806,2262010524259080020519
0x2791dc5e14f7680d9d969acc26059ba56403b6d5,0x5c1ee5cdbe1f7d171dd1586f88f44a0055a3f1d38456a3746b7f84a9ef874e25,07-02-2025,2025-02-07 16:12:53.000 UTC,312,26077713,0x827922686190790b37229fd06084350E74485b72,6875010,6113762854313788044005,476408908615529837,92334605772139761923393
0x8508fd4238162cb3f3d485f432202af3b40f164e,0xf9ecec76f0048059f4015f9241cc9915f7dbcd882a018230818faed8838ccf40,09-04-2025,2025-04-09 23:03:11.000 UTC,395,28725222,0x827922686190790b37229fd06084350E74485b72,10833761,31503789763258183188,24768407188049590,47383025923984577127
0x351f61e4c49cf11f24d9f2e737ca5eff81806355,0x04cdfa02d54ef4b8e853a55da57fa716cf81832cebcfb9a57104c262b20d9914,21-09-2025,2025-09-21 09:03:39.000 UTC,174,35828036,0x827922686190790b37229fd06084350E74485b72,26271067,198326689345514540,112403324,59605303033948116408019
0x2791dc5e14f7680d9d969acc26059ba56403b6d5,0x376ec1631f4fde288301bc5baf548dc224ce783686207b0ee01fa4316cb6f970,23-12-2024,2024-12-23 22:27:39.000 UTC,568,24101756,0x827922686190790b37229fd06084350E74485b72,4519459,1469735750156412909853,926911053673554708939,485356500201886393
0x8fd1b615c006ebeb8a7cfb00a1dd809f31943b08,0xdde6d669f8f45b1931d4749b2736a25eb8074a0bc52099f5c7ee6ab18863234c,09-02-2025,2025-02-09 13:54:33.000 UTC,290,26159963,0x827922686190790b37229fd06084350E74485b72,6995742,2450899799476887,317198516530026216,1043254781
0x2791dc5e14f7680d9d969acc26059ba56403b6d5,0xb431d4980243498ef92092053ed772ad37a3a770a28493ef32b183635ce41a79,15-01-2025,2025-01-15 19:51:59.000 UTC,632,25090686,0x827922686190790b37229fd06084350E74485b72,5620302,15056328078834711244536,599281392124175081,428303548443087059336
0x095d0de0ecfd6832f1a7961ae26d285d68655d60,0x54f1445d28bd056d279116a08f1d9f30fa8fa574560255c9d3c38e01fc37daa1,05-06-2025,2025-06-05 11:22:27.000 UTC,674,31166600,0x03a520b32C04BF3bEEf7BEb72E919cf822Ed34f1,3181242,4467908714320618570235,55009564451998700,190890243874853890212382
0x0b27b59171a4ffe19f23d54126cd797be17c6551,0xd43cd380d32a6ba3f31862fee2c5ddbb791790a7f4713a3d9f5e274e2909cc54,17-10-2025,2025-10-17 12:37:17.000 UTC,232,36957645,0x03a520b32C04BF3bEEf7BEb72E919cf822Ed34f1,4065110,2121749605292257104836,57198742801723988,46054948616281909655633
0x8508fd4238162cb3f3d485f432202af3b40f164e,0x3c829bf064357b6c249120610b4a0d5aeb520ca406ca22bd48701387281b2282,12-03-2025,2025-03-12 12:57:39.000 UTC,390,27497456,0x827922686190790b37229fd06084350E74485b72,8912498,580972862889664,225677916313405477571,1314
0x8fd1b615c006ebeb8a7cfb00a1dd809f31943b08,0x8c0bb8181a61978e568724c092b2c2401b386793eccf31c498a819388d618cd8,14-12-2024,2024-12-14 12:57:21.000 UTC,297,23695847,0x827922686190790b37229fd06084350E74485b72,3972922,6535091702160905462,5296471816778615651,6387452890228837
0x8fd1b615c006ebeb8a7cfb00a1dd809f31943b08,0x4fcdc8dc9eb067ccf8664f4b8678b0124012f01cd13a5a278f5137b6ec323f1d,23-12-2024,2024-12-23 12:09:55.000 UTC,249,24083224,0x827922686190790b37229fd06084350E74485b72,4490263,7247295189960762667,2420857451683425623,10145609940377522
0x9eb86e93a809a41ab0e7cc0ba6f62561fda3015c,0x28486e5ae41b0084f2aa5472d49c4cf6b7fea2c43331e7d5b015bd39f864ae24,31-01-2025,2025-01-31 17:02:49.000 UTC,432,25776811,0x827922686190790b37229fd06084350E74485b72,6486728,2148643484440377956423,104896929639373499,31935454093813905123454
0x2791dc5e14f7680d9d969acc26059ba56403b6d5,0x245d7475997bb236cc9f0704a51c7af0b63a5ea7895ec5178a3b22bc8f4b4628,16-12-2024,2024-12-16 10:58:07.000 UTC,305,23778670,0x827922686190790b37229fd06084350E74485b72,4089705,8057150501438429061,1015185349703223646,3604263479585168
0x2791dc5e14f7680d9d969acc26059ba56403b6d5,0x4ffeca80dbbe19b1779551ac68cdf0c90b4383dcd34c27ba85b42c859af3cd39,19-12-2024,2024-12-19 01:40:39.000 UTC,373,23891546,0x827922686190790b37229fd06084350E74485b72,4243124,1700018374599020475673,678677983757591654839,856123687580298401
0x2791dc5e14f7680d9d969acc26059ba56403b6d5,0x017d494a44e01846b514bb53c60a9949884287e0f58d6b70825e77f15fe6ed4a,14-12-2024,2024-12-14 04:12:21.000 UTC,552,23680097,0x827922686190790b37229fd06084350E74485b72,3975597,14257583850097979871,2396961272424425968,5643775830123862
0xdc98dbffcc648d6088a2ff8f7dc01aef050e58fc,0xd1e335c9d029608564478e49486338d4e98bfe1da7744d25e55687b052b46930,12-01-2025,2025-01-12 20:12:55.000 UTC,552,24961714,0x827922686190790b37229fd06084350E74485b72,5459599,1178185594103788687133,307785740199299842048,82943115498831231
0x38f6d2d9ea493c3c6ee865b5b952b5fe9e3e61fc,0x5f7e2258ef9a152b4fe09aee3f76e1b24c5d3ea45f29a5974029206959e10611,31-05-2025,2025-05-31 11:38:01.000 UTC,670,30951067,0x827922686190790b37229fd06084350E74485b72,15233945,25355418907,525689,742322
0x8810de2baa17067ddcfbd9e8f29c55f070a55f0b,0xdbe26f43410bed9cbbffa3def25a7986650b93ef62b133a6c450316fa46f9e5c,01-05-2025,2025-05-01 23:12:21.000 UTC,838,29675897,0x827922686190790b37229fd06084350E74485b72,12574930,69865161120029752,51876955,34504069976848032589905
0x8508fd4238162cb3f3d485f432202af3b40f164e,0x417e71a3b54f4541b4261240ee6266ecfa35f2fd5f564b95f1fa2ae47f1a7688,03-06-2025,2025-06-03 13:40:11.000 UTC,510,31084332,0x827922686190790b37229fd06084350E74485b72,15506251,13701957372,325404,359664
0x9eb86e93a809a41ab0e7cc0ba6f62561fda3015c,0x9b336efb4b4cca39842de09f71805f9897dff39370f1341deba0110a45fbb2d4,09-06-2025,2025-06-09 13:00:45.000 UTC,997,31342349,0x827922686190790b37229fd06084350E74485b72,15995714,22838846227,628981,512806
0x38f6d2d9ea493c3c6ee865b5b952b5fe9e3e61fc,0x4ddaa2ec64bdbcdadbef4d9c37ee19e63489d0eebaeec6b0cb7e29c952c45ee6,11-06-2025,2025-06-11 04:11:41.000 UTC,290,31412877,0x46A15B0b27311cedF172AB29E4f4766fbE7F4364,402697,5414737260,4541,266385
0x2791dc5e14f7680d9d969acc26059ba56403b6d5,0x5fa87bd8c99aafdbb9e0ca4ab2f8d56022a02197e2c3a6cfa86da8e98304c6e1,12-12-2024,2024-12-12 19:17:25.000 UTC,340,23620849,0x827922686190790b37229fd06084350E74485b72,3910776,3776396137634966803662,884453918421865291703,1240522072182782242
0x38f6d2d9ea493c3c6ee865b5b952b5fe9e3e61fc,0x4ea9942150997dd3b2e671cd6990c054b43ad7b064a46b580ad0737d2fc328c7,09-01-2025,2025-01-09 04:12:29.000 UTC,671,24803301,0x827922686190790b37229fd06084350E74485b72,5280113,15363446689529432721202,307168292634215036,18890169491074507843363
0x8fd1b615c006ebeb8a7cfb00a1dd809f31943b08,0xba735824981e5b2ed92decf9ce0e60d1f6c45ea350bc6b090eeea5a84c34ef8c,04-01-2025,2025-01-04 09:47:07.000 UTC,427,24597340,0x827922686190790b37229fd06084350E74485b72,5060160,4042576327981657512929,96605362970005387,13506363318390256304125
0x38f6d2d9ea493c3c6ee865b5b952b5fe9e3e61fc,0x8b6324b68808e4dd36a948bddac849a75f47c2c93ea5bb7e31ae765c036669ea,03-06-2025,2025-06-03 00:45:45.000 UTC,799,31061099,0x827922686190790b37229fd06084350E74485b72,15462335,29922696015,131045,1366460
0x8fd1b615c006ebeb8a7cfb00a1dd809f31943b08,0x941d4cd05cbd41acfe5c97f7ec7466e3bb304e09689a750117db6d50c04b00b6,02-01-2025,2025-01-02 11:49:59.000 UTC,620,24514626,0x827922686190790b37229fd06084350E74485b72,4974197,6183832858140947843342,1653151423762151103742,2289127360129661532
0x38f6d2d9ea493c3c6ee865b5b952b5fe9e3e61fc,0xfef784c39fdfaf845f395d315de262134d6dc5581cbd5e9ff0b42218aa8191e0,04-01-2025,2025-01-04 11:40:07.000 UTC,459,24600730,0x827922686190790b37229fd06084350E74485b72,5062885,18816214589950103225889,567084355325265046,13071992027247585562598
0x9eb86e93a809a41ab0e7cc0ba6f62561fda3015c,0xd9292dd4e0dc2924e06d13908a28924e386053453cb259238f73fcef63399a1d,07-06-2025,2025-06-07 04:18:29.000 UTC,1002,31240281,0x827922686190790b37229fd06084350E74485b72,15818434,23137304134,1129566,26275
0x2791dc5e14f7680d9d969acc26059ba56403b6d5,0x38145f977772de763d516bcb647cf457c67630f276832567701efd0f9f7cfda3,02-01-2025,2025-01-02 07:04:59.000 UTC,682,24506076,0x827922686190790b37229fd06084350E74485b72,4963716,2529297398645849810304412,1223996047385226132573,92098538893089546022939
0x9eb86e93a809a41ab0e7cc0ba6f62561fda3015c,0x32869030a1a827d9a730d60562e65b79eabcfa8ba3f59ac67504bd9502d6b1bc,01-01-2025,2025-01-01 20:00:35.000 UTC,553,24486144,0x827922686190790b37229fd06084350E74485b72,4939542,3735286937202427915183,613777143263432401775,548467682511919353
0x38f6d2d9ea493c3c6ee865b5b952b5fe9e3e61fc,0x077a205ea7a39ddb5528b4b20f5176fad33f4ec16d15435e78af728c1aea1b9e,13-01-2025,2025-01-13 18:28:33.000 UTC,431,25001783,0x827922686190790b37229fd06084350E74485b72,5508648,1176387521201826975792898,329622140534803885704,43912141126313686075662
0x8810de2baa17067ddcfbd9e8f29c55f070a55f0b,0x9a544d89ac5eec8b175435665678c9d10c2fc34da7ceaa022e25def3c4d0fffb,09-03-2025,2025-03-09 13:48:25.000 UTC,343,27369379,0x827922686190790b37229fd06084350E74485b72,8732581,206349536384650625,194979234,80146633801739024510181
0x8508fd4238162cb3f3d485f432202af3b40f164e,0xaaf0af35e3513f9bee81c42afbed0edbe191c74eb785172bb4627ef5ce0bfdc6,19-04-2025,2025-04-19 14:42:21.000 UTC,174,29142197,0x827922686190790b37229fd06084350E74485b72,11525590,112100584546164,41081499743881726687,5056
0x8508fd4238162cb3f3d485f432202af3b40f164e,0xefa6c2090210cb7c9ac79aedfbaf46052b194f83cc1e6f7b4e6edd83f483009c,03-06-2025,2025-06-03 03:46:51.000 UTC,706,31066532,0x827922686190790b37229fd06084350E74485b72,15474545,13877595159,677233,15967
0x9eb86e93a809a41ab0e7cc0ba6f62561fda3015c,0xbe42420bd9d332c277b342283056fc7faa651fb09b482a0578a7d7b359c87487,08-12-2024,2024-12-08 22:18:57.000 UTC,257,23453495,0x827922686190790b37229fd06084350E74485b72,3686608,109888032928275,207418085697413014,1361763
0x38f6d2d9ea493c3c6ee865b5b952b5fe9e3e61fc,0xc47b70aa01f0239b363d18d285c38840694bf528ce00f9484a96aed1deb34d78,07-06-2025,2025-06-07 01:21:33.000 UTC,510,31234973,0x827922686190790b37229fd06084350E74485b72,15808082,25592093606,909318,369819
0x9eb86e93a809a41ab0e7cc0ba6f62561fda3015c,0x16595d170406ee648a23d970bc7815b552b128ba91ae539f0f9af554a548dac4,12-12-2024,2024-12-12 21:56:19.000 UTC,275,23625616,0x827922686190790b37229fd06084350E74485b72,3918171,2177442278703761361698,1466420087667510814160,716052745169514749
0x38f6d2d9ea493c3c6ee865b5b952b5fe9e3e61fc,0xa9cc5c38e3843d287760c8fecf4a7d6c61cd6cf47c5ed641ab37597b7ffb0b24,19-05-2025,2025-05-19 05:36:09.000 UTC,110,30421811,0x827922686190790b37229fd06084350E74485b72,14092879,9732577425,399430,86741
0x9eb86e93a809a41ab0e7cc0ba6f62561fda3015c,0xbe2e79ef1f64d44037b6d3c202c8b6d4a6d0e14bb9776eb8c0923190f69565f9,05-02-2025,2025-02-05 21:21:45.000 UTC,253,26000579,0x827922686190790b37229fd06084350E74485b72,6763472,4438508528461384995019,222408156106290765,67395244944036844623179
0x095d0de0ecfd6832f1a7961ae26d285d68655d60,0xf3e93489a50efebece19e1a7899ca3a98ed2ec74917c588372c9073e8bca0a4a,13-04-2025,2025-04-13 22:02:57.000 UTC,676,28896215,0x827922686190790b37229fd06084350E74485b72,11117873,162575614792659274148717,46989031913168953396,77812130791559924473553
0x38f6d2d9ea493c3c6ee865b5b952b5fe9e3e61fc,0x199df996c958c8b2adaa1149073989ca72026aff0fec0c1ba47d75a1df119ce4,13-12-2024,2024-12-13 02:09:11.000 UTC,183,23633202,0x827922686190790b37229fd06084350E74485b72,3928586,779518385079210888,1472473690,58757083280985155351185
0x8fd1b615c006ebeb8a7cfb00a1dd809f31943b08,0xd8366e6e3003093d6eb239ba5302ae4585fb289949c930d76275b9cb2f29466c,29-12-2024,2024-12-29 18:57:23.000 UTC,441,24354648,0x827922686190790b37229fd06084350E74485b72,4791239,1239769040482984103929,57956671583656516599,455596197392771700
0xdc98dbffcc648d6088a2ff8f7dc01aef050e58fc,0xd05fa3238770f8e216394e78ed4399cf96760f646ffa6ddca0ebf0365d0b7051,14-01-2025,2025-01-14 07:20:39.000 UTC,359,25024946,0x827922686190790b37229fd06084350E74485b72,5535751,1002931618812052543745,30062995295681833965,264277411251538123
0x8508fd4238162cb3f3d485f432202af3b40f164e,0xd6b751c37ddebf41982f1a1d856601e7b40735ea4ef19fcb7820d88d96f09f3b,27-05-2025,2025-05-27 19:27:51.000 UTC,801,30792362,0x827922686190790b37229fd06084350E74485b72,14905434,250088962411449465573,128176882168968925,188539910497760222061
0x9eb86e93a809a41ab0e7cc0ba6f62561fda3015c,0xe3a91a723cb4e79efd20dcd755a0073f050533782a933d8c97094f24d5092536,23-12-2024,2024-12-23 17:54:29.000 UTC,324,24093561,0x827922686190790b37229fd06084350E74485b72,4508549,924161086111699387848,330914879177850430736,514304003127717699
0x2791dc5e14f7680d9d969acc26059ba56403b6d5,0x6eace9816d68cd324e34c65234bf8e16138476d3a6534275e11b09b0a96f4b2e,17-12-2024,2024-12-17 08:58:33.000 UTC,464,23818283,0x827922686190790b37229fd06084350E74485b72,4128480,9608457326172291040,6013818470556832804,3353794722533623
0x0b27b59171a4ffe19f23d54126cd797be17c6551,0x951e30eb2abbe87db082821207a2a444c43f3a9767e47d2deb196a0a31858ef7,11-09-2025,2025-09-11 01:01:31.000 UTC,281,35381572,0x03a520b32C04BF3bEEf7BEb72E919cf822Ed34f1,3876854,4525053540845842641929,120905353720061622,101103082141401641023671
0x2791dc5e14f7680d9d969acc26059ba56403b6d5,0xc6d9c62cbd168f91f7b0af8e9756de78a3051b8f88149bb2cb1e5554f64bcd9c,29-12-2024,2024-12-29 13:36:33.000 UTC,231,24345023,0x827922686190790b37229fd06084350E74485b72,4780664,1341253452087401930502,516619250139997828205,750737275181174558
0x38f6d2d9ea493c3c6ee865b5b952b5fe9e3e61fc,0xe2288d0c2e1c3c828114c7b445df5b906dc6254095066256debbbde878533909,02-01-2025,2025-01-02 14:18:37.000 UTC,458,24519085,0x827922686190790b37229fd06084350E74485b72,4979732,1706751978520902249729,422161483932558242370,51997703805948321
0x2791dc5e14f7680d9d969acc26059ba56403b6d5,0x1258fbf655263c6dee39778b0c13dbc64ea3becac5d972a38da172c8c7ccdf48,12-01-2025,2025-01-12 21:21:53.000 UTC,530,24963783,0x827922686190790b37229fd06084350E74485b72,5461375,415300924049389871,942530456,17939458805739499188893
0x38f6d2d9ea493c3c6ee865b5b952b5fe9e3e61fc,0xf94976e20e2396abcb1163d89fee9506a3066995ca2c009bc782ab97945e84bc,10-01-2025,2025-01-10 01:00:05.000 UTC,298,24840729,0x827922686190790b37229fd06084350E74485b72,5328114,1212011570669867634,78975327,45507389219513420454000
0x095d0de0ecfd6832f1a7961ae26d285d68655d60,0x45dd9e0be87cfec30c8b3750b6b7d8a932afcdcb921d19b4691e2193edd1ad44,18-03-2025,2025-03-18 19:27:21.000 UTC,252,27768347,0x03a520b32C04BF3bEEf7BEb72E919cf822Ed34f1,2490290,10304989609668025054793,214317690813376576,270596249995105189183941
0x8810de2baa17067ddcfbd9e8f29c55f070a55f0b,0xcb371e2e85ad4e3b2e4d315c92bab6da3335bc67cc86878eafa7023fffcab967,10-07-2025,2025-07-10 20:26:39.000 UTC,384,32694926,0x03a520b32C04BF3bEEf7BEb72E919cf822Ed34f1,3505105,5241671736025990914784,132844931769039947,125144850111460438613389
0x8508fd4238162cb3f3d485f432202af3b40f164e,0x32c15a9e24c63f1d91f74adfc989071446477310322ba9ac608ede3de2267eb0,02-04-2025,2025-04-02 00:46:33.000 UTC,571,28382723,0x827922686190790b37229fd06084350E74485b72,10299497,356285280570200,153846235435081146863,1055
0x9eb86e93a809a41ab0e7cc0ba6f62561fda3015c,0xb0206cc58a95981626cfcc7a176c278f857e85b42f9ed378dbe52a0243d53043,01-01-2025,2025-01-01 18:57:03.000 UTC,467,24484238,0x827922686190790b37229fd06084350E74485b72,4937308,3803906923360085735238,588421879961126765995,607455290533404697
0x9eb86e93a809a41ab0e7cc0ba6f62561fda3015c,0x99e397593ba340a3d96666f5230b6c06eedf1f957685ab799b76605837275efc,21-02-2025,2025-02-21 17:29:23.000 UTC,439,26684808,0x827922686190790b37229fd06084350E74485b72,7747475,4795950823,575102336,177853
0xdc98dbffcc648d6088a2ff8f7dc01aef050e58fc,0xb43ce157929e0153f6caeb298466b261ec05b9188e6434fedc144fdfb13022b4,02-06-2025,2025-06-02 18:29:53.000 UTC,426,31049823,0x46A15B0b27311cedF172AB29E4f4766fbE7F4364,394257,11944565114968631886321,24398568087135577,599775034084176433
0x2791dc5e14f7680d9d969acc26059ba56403b6d5,0x7e1f0d984da8492b8c50bd2b20b3c1238fc3174882d911b061a437beee0076ff,08-01-2025,2025-01-08 02:28:17.000 UTC,215,24756975,0x827922686190790b37229fd06084350E74485b72,5221763,21306424874849014625705,432533858186761171,26083598492159923138117
0x38f6d2d9ea493c3c6ee865b5b952b5fe9e3e61fc,0x02bd1cac64615a521c4d408d4b836b7268af86fa83216a23e09210e74f18907e,03-01-2025,2025-01-03 06:36:45.000 UTC,249,24548429,0x827922686190790b37229fd06084350E74485b72,5009841,19014345905501920414336,663331918379443658,8120246865476766272870
0xdc98dbffcc648d6088a2ff8f7dc01aef050e58fc,0x27b3efc85d8fe1e5efb11be889bf100395342b202ad54638ad3d0a8e849c5f3c,04-01-2025,2025-01-04 10:13:39.000 UTC,267,24598136,0x827922686190790b37229fd06084350E74485b72,5060845,2538560505931617135524,117433606058259656444,730045781813956887
0x38f6d2d9ea493c3c6ee865b5b952b5fe9e3e61fc,0x9b0170ead73358238a65c19106b7b969a0b7bf6ce1d7ff49a943d2f51a349ab8,01-07-2025,2025-07-01 03:11:51.000 UTC,767,32275082,0x46A15B0b27311cedF172AB29E4f4766fbE7F4364,422477,12143255861,585832,21003
0x2791dc5e14f7680d9d969acc26059ba56403b6d5,0xc07fb5f3167e257058c8de11526774d4273592ec72a8cba6b281ea7183d78bef,14-01-2025,2025-01-14 16:36:49.000 UTC,225,25041631,0x827922686190790b37229fd06084350E74485b72,5556145,1302396772667002737296,347652162735579395246,79096821651535735
0xdc98dbffcc648d6088a2ff8f7dc01aef050e58fc,0x3f9bd1bcd743497ef1d73e11ddfde7056f57112361aa727dd6cf9eb40dfe8f51,19-06-2025,2025-06-19 17:23:15.000 UTC,338,31782224,0x827922686190790b37229fd06084350E74485b72,16928879,11459178184,157141,415984
0xdc98dbffcc648d6088a2ff8f7dc01aef050e58fc,0xc6b117ab00ec4df674b2dc9715286fa908ee67ce8114a27e834506f59bb712ae,15-01-2025,2025-01-15 23:53:37.000 UTC,174,25097935,0x03a520b32C04BF3bEEf7BEb72E919cf822Ed34f1,1819355,9159823055821408786825,247646490357913375,115760859350442918435420
0x2791dc5e14f7680d9d969acc26059ba56403b6d5,0x7ef269b76d4c7e51988ce994e813da869978bdad7c9d2595fc11a9d635515076,14-12-2024,2024-12-14 00:53:55.000 UTC,414,23674144,0x827922686190790b37229fd06084350E74485b72,3975597,13794582325439609882,3291025376725749823,4835942315570111
0x2791dc5e14f7680d9d969acc26059ba56403b6d5,0x45527ee56ceff8c473e4c0674ca614790187430e7dd9b099fcea95e7da11d9bc,03-03-2025,2025-03-03 21:04:55.000 UTC,531,27123274,0x827922686190790b37229fd06084350E74485b72,8369420,235056552723110144,961289251,67416553666712072907407
0x095d0de0ecfd6832f1a7961ae26d285d68655d60,0x67e632f4c33f38b6277d06ba8a74029a62cda04371547c467c7663e0e6c00a14,05-02-2025,2025-02-05 21:14:37.000 UTC,321,26000365,0x827922686190790b37229fd06084350E74485b72,6763278,101640814133039788,225285331,52279529869157280823862
0x351f61e4c49cf11f24d9f2e737ca5eff81806355,0x9662ad02a8830c5afd0f997425508b185fd258311e32c64df2b885711c5c33b0,23-08-2025,2025-08-23 02:50:45.000 UTC,688,34564049,0x827922686190790b37229fd06084350E74485b72,23271326,714679751077055235,198168545,282963960250261228918399
0x8508fd4238162cb3f3d485f432202af3b40f164e,0xad23ff83788842029f27df7ef3b934cc4aa8af112fceffc7356c847b88329edf,22-05-2025,2025-05-22 08:19:11.000 UTC,1318,30556302,0x03a520b32C04BF3bEEf7BEb72E919cf822Ed34f1,3076349,202616693516248228922,78753339570706255,185879993507042730757
0x351f61e4c49cf11f24d9f2e737ca5eff81806355,0x02e9ad2b2cf91b1cb4d09d1e79e0830e7f8be2d53b0f374f28f6619bb7258b88,04-09-2025,2025-09-04 04:09:35.000 UTC,571,35084814,0x827922686190790b37229fd06084350E74485b72,24582056,296295897384302571,160917614,107247169190716751431486
0x8508fd4238162cb3f3d485f432202af3b40f164e,0xc3a3a6bf679f14595f98ee617744eaafe890af971e4993b86e9bab95263fc3af,03-07-2025,2025-07-03 18:34:55.000 UTC,882,32389174,0x827922686190790b37229fd06084350E74485b72,18235080,28481312631,1412262,10856
0x2791dc5e14f7680d9d969acc26059ba56403b6d5,0x52809de33261d5aea89c1b55dc24adf4f1a7d2999532e64d7a6ee951e485815a,02-02-2025,2025-02-02 16:01:05.000 UTC,338,25861359,0x827922686190790b37229fd06084350E74485b72,6603231,342805070701900178,1795410281,77252249260408163788801
0x9eb86e93a809a41ab0e7cc0ba6f62561fda3015c,0xbd9fc91a51273ff30356121d1b0f6afe2b82ccd9b41f4a6bf98d2d10e5852c7c,20-02-2025,2025-02-20 15:02:19.000 UTC,468,26637196,0x827922686190790b37229fd06084350E74485b72,7667149,5324397589,572287281,263409
0x9eb86e93a809a41ab0e7cc0ba6f62561fda3015c,0x71abc4b769d97124f6aae8f0712e5a11af71522895e3b38457d45e9454282595,27-02-2025,2025-02-27 05:46:41.000 UTC,252,26922927,0x827922686190790b37229fd06084350E74485b72,8085184,3684735838,193737234,402413
0x095d0de0ecfd6832f1a7961ae26d285d68655d60,0xab2e569f8eecbffc0431e4baf8d3d19eb37ed4e4adf6e4fc05e4dbcbaaa6608c,09-05-2025,2025-05-09 06:40:25.000 UTC,577,29991739,0x827922686190790b37229fd06084350E74485b72,13203583,29888914012118647,25534693,27915354455484065903268
0x9eb86e93a809a41ab0e7cc0ba6f62561fda3015c,0xd841b6220846ca3fde72c2e9c7b7887babdd8411ce9895575d960f96e810e911,23-02-2025,2025-02-23 06:38:13.000 UTC,210,26751673,0x827922686190790b37229fd06084350E74485b72,7830113,4708336865,31083016,724556
0x2791dc5e14f7680d9d969acc26059ba56403b6d5,0x56606699f528adb2c3c7d0b2e8128e0b78ee903b4f7de614e1994ad17a7c9bd5,02-01-2025,2025-01-02 13:50:11.000 UTC,865,24518232,0x827922686190790b37229fd06084350E74485b72,4978660,1699161540378556383,3035324922,18888267491214949181330
0x8fd1b615c006ebeb8a7cfb00a1dd809f31943b08,0x72a1c6697e0d411d559be3ba236f9ad114f30fc2aa57bdd1a5e3db9cd17af2a4,09-01-2025,2025-01-09 20:52:59.000 UTC,284,24833316,0x827922686190790b37229fd06084350E74485b72,5319872,27662168602746111425106,222753372817906443,50026887765079175728582
0x38f6d2d9ea493c3c6ee865b5b952b5fe9e3e61fc,0xa6cbd57b5a59c3474234f7a3222efb6ea284488c83f745024d2ba3a4ad54afbb,09-01-2025,2025-01-09 21:39:11.000 UTC,309,24834702,0x827922686190790b37229fd06084350E74485b72,5321287,1216445671577681926,1874922091,18829526256277871302200
0x9eb86e93a809a41ab0e7cc0ba6f62561fda3015c,0xb5dc8d12dddac6ed9ef3873ada7e473f3dad3c3a90bbe59397c21ec1504a826a,20-05-2025,2025-05-20 09:28:35.000 UTC,456,30471984,0x827922686190790b37229fd06084350E74485b72,14207605,30122227330,857829,647910
0x8fd1b615c006ebeb8a7cfb00a1dd809f31943b08,0x8bc023b3f425b9c83eeb971da7592c8531d04b4bda2c232a79e94efa224f123d,16-12-2024,2024-12-16 22:11:39.000 UTC,273,23798876,0x827922686190790b37229fd06084350E74485b72,4110769,14129831838975127923,14338411708209283348,12129008827163608
0x095d0de0ecfd6832f1a7961ae26d285d68655d60,0x1301b8c4e786dd1a19097231aa6d9d5edfca24a297eb17cb2cee1448f205eaf1,01-05-2025,2025-05-01 10:57:59.000 UTC,482,29653866,0x03a520b32C04BF3bEEf7BEb72E919cf822Ed34f1,2956205,6776422922232408812105,121560496347525073,217303471916380757249674
0xdc98dbffcc648d6088a2ff8f7dc01aef050e58fc,0xe8f372055c63ae60c88d68f5793b7337690e4784a36074d9938802c1fc1ef66e,02-01-2025,2025-01-02 07:30:53.000 UTC,352,24506853,0x827922686190790b37229fd06084350E74485b72,4964462,1129354637023240386654913,635039520760476144623,39376633229585927024754
0xdc98dbffcc648d6088a2ff8f7dc01aef050e58fc,0x76e32190912346919f7a2bcc10a348cd5c64c0936057dc514c97d4e90add2ddf,13-01-2025,2025-01-13 20:09:37.000 UTC,471,25004815,0x827922686190790b37229fd06084350E74485b72,5511827,472410797310591324639595,976916238758478319182,2287152523431222463565
0x9eb86e93a809a41ab0e7cc0ba6f62561fda3015c,0xaabe46a846dc6e76defd744ec569fdb2abf86ace137140b284fd08d142fdab20,17-02-2025,2025-02-17 01:31:29.000 UTC,266,26483271,0x827922686190790b37229fd06084350E74485b72,7443158,6068863276,906739938,33590
0xdc98dbffcc648d6088a2ff8f7dc01aef050e58fc,0x0f59272cdaddced8d0c9de0da4cdb04d1c4c9756a79b44148cc815c54c9fb62d,08-06-2025,2025-06-08 07:05:03.000 UTC,392,31288478,0x46A15B0b27311cedF172AB29E4f4766fbE7F4364,399188,11346759540032781396174,51889901394844164,538287014016645741
0xdc98dbffcc648d6088a2ff8f7dc01aef050e58fc,0x9d172f611951e8a11e1b8b40d404f9b91950dd9189c79994151fde571bfaeeca,12-01-2025,2025-01-12 20:05:07.000 UTC,216,24961480,0x827922686190790b37229fd06084350E74485b72,5459361,1185943284554125883960,9545877685233289027,331126284826949104
0xdc98dbffcc648d6088a2ff8f7dc01aef050e58fc,0x4c4077bed854400ce94f290ce4a526d0e9e4491c173b64535ea95b72dffd6fca,05-02-2025,2025-02-05 15:25:25.000 UTC,119,25989889,0x03a520b32C04BF3bEEf7BEb72E919cf822Ed34f1,2038857,9678157188876115916427,534469412961039111,139182461513018175477485
0xdc98dbffcc648d6088a2ff8f7dc01aef050e58fc,0x56c05867971ef5cb9601cd9265a05f0615f50b9bf964ca123894f6fea0261129,05-07-2025,2025-07-05 06:11:41.000 UTC,358,32453277,0x46A15B0b27311cedF172AB29E4f4766fbE7F4364,428421,10614509813896510340668,241591110170659732,290877216813525222
0x9eb86e93a809a41ab0e7cc0ba6f62561fda3015c,0xf2ba976613d33e2c33a715b2f93f000af9eb3ca81b15afb9bbb3d9c48ede41e4,20-02-2025,2025-02-20 11:48:05.000 UTC,283,26631369,0x827922686190790b37229fd06084350E74485b72,7658846,5340922847,828377467,2258
0x9eb86e93a809a41ab0e7cc0ba6f62561fda3015c,0xf8bf89a9402ed593aa81c26beb236b6eb3d5c68d629d4960000fa2628f0299a2,01-06-2025,2025-06-01 04:46:29.000 UTC,379,30981921,0x827922686190790b37229fd06084350E74485b72,15295731,30496270633,483997,1041489
0x38f6d2d9ea493c3c6ee865b5b952b5fe9e3e61fc,0x9a7a679a8680e7f48bc67fdebaf43d57bce61164fc4eb61f61deb18d1612b51f,01-06-2025,2025-06-01 08:09:49.000 UTC,1598,30988021,0x46A15B0b27311cedF172AB29E4f4766fbE7F4364,392377,3263629212,6069,157297
0x9eb86e93a809a41ab0e7cc0ba6f62561fda3015c,0xd3cb2e1a5e8a2adcc6a7882c6a0e49be45b38608021135a02fa735b072485c0b,08-01-2025,2025-01-08 04:27:27.000 UTC,368,24760550,0x827922686190790b37229fd06084350E74485b72,5226296,9186717002597533036384,192823241859124998,10886103312851102531366
0x38f6d2d9ea493c3c6ee865b5b952b5fe9e3e61fc,0x858a3c71a6e43b1563f0af97b59c74af789f4e1faabe5a80804d47999bb1de88,22-01-2025,2025-01-22 00:01:07.000 UTC,511,25357360,0x827922686190790b37229fd06084350E74485b72,5958150,63648225649667799276071,2306074130513377262,173402273302094820247358
0xdc98dbffcc648d6088a2ff8f7dc01aef050e58fc,0x6d3831092c50d33db6d526a70af362e5ec2bb40220031a34932b681e854b3fae,03-06-2025,2025-06-03 11:39:15.000 UTC,951,31080704,0x827922686190790b37229fd06084350E74485b72,15499588,11837207581,310704,281098
0x9eb86e93a809a41ab0e7cc0ba6f62561fda3015c,0xa57cb86961c256381c8fe497004794c315932ae5f7d705efa3c03e29cc398c78,09-01-2025,2025-01-09 09:25:39.000 UTC,462,24812696,0x827922686190790b37229fd06084350E74485b72,5292277,1080673092930365023587,284590251507911393594,54580637759210050
0x2791dc5e14f7680d9d969acc26059ba56403b6d5,0xc0bc2fec0c8cba7d6119cec48c38ecefc7342cde88df6f4b30196a361c8557c5,17-01-2025,2025-01-17 02:32:39.000 UTC,345,25145906,0x827922686190790b37229fd06084350E74485b72,5698251,27789488075145959930833,425307342873765810,41934945944834146732705
0x9eb86e93a809a41ab0e7cc0ba6f62561fda3015c,0xd43b0993a3c175184a0c0474707a11b4100c6afadafd256b029793e1aab8c08d,30-12-2024,2024-12-30 20:06:15.000 UTC,234,24399914,0x827922686190790b37229fd06084350E74485b72,4845384,596745332510510032830,215108640662693519364,349419630208404735
0x8508fd4238162cb3f3d485f432202af3b40f164e,0xbb038277a938257d19651f486dd56d19355d4aa54bf604c383b6b3127d3bad43,01-04-2025,2025-04-01 21:24:21.000 UTC,296,28376657,0x827922686190790b37229fd06084350E74485b72,10290078,364475439552317,137149952664465030070,10327
0x9eb86e93a809a41ab0e7cc0ba6f62561fda3015c,0x30882c9aa09d20c951be6436fb0c6a5bd54dabf26d4d3e42d803bce5df1d873c,16-05-2025,2025-05-16 13:05:23.000 UTC,654,30305688,0x827922686190790b37229fd06084350E74485b72,13846344,9590768457,331206,148116
0x8810de2baa17067ddcfbd9e8f29c55f070a55f0b,0x5e2b865b8151f54f2d6a64c4804b991a8c448feaa21b6d70dcc52d772fbb281e,10-07-2025,2025-07-10 06:24:15.000 UTC,549,32669654,0x03a520b32C04BF3bEEf7BEb72E919cf822Ed34f1,3501900,19775114266114790,691537757,492366277840806167892
0x8508fd4238162cb3f3d485f432202af3b40f164e,0x6f50581649c02700e46624129f671ad00a3ee74a82fa168000a4667387dbb071,27-04-2025,2025-04-27 11:07:35.000 UTC,396,29481354,0x03a520b32C04BF3bEEf7BEb72E919cf822Ed34f1,2938698,4444780173244257143213,214429253864566421,55971943551025195506636
0x38f6d2d9ea493c3c6ee865b5b952b5fe9e3e61fc,0xc7d442814c164673dbaa0958391c6a4f68df6927a8ec35790ae1cfc289add9a9,06-01-2025,2025-01-06 22:35:35.000 UTC,366,24706794,0x827922686190790b37229fd06084350E74485b72,5169732,17672511788171045763347,618796348957456294,6880621310746325082329
0x9eb86e93a809a41ab0e7cc0ba6f62561fda3015c,0x6c6f57129782cf029ab50ef7825eb2b6f000e5fc6a1c8c529882abe11e1cf6a6,04-01-2025,2025-01-04 10:13:49.000 UTC,3642,24598141,0x827922686190790b37229fd06084350E74485b72,5060852,2199099224952633940957,101730154338526665622,632422630548187991
0xdc98dbffcc648d6088a2ff8f7dc01aef050e58fc,0x0b227c6f9cd798f1b5adcc4b0ba1736ae30a4b0d01126bae923afce46ed95be5,13-12-2024,2024-12-13 06:04:23.000 UTC,207,23640258,0x827922686190790b37229fd06084350E74485b72,3937163,313579353506959362,1861529742,427203193847578833061268
0x8810de2baa17067ddcfbd9e8f29c55f070a55f0b,0x78f4b8a39bf0efa815333461000fa1ce9b7b2e4b90d02d02aeabfb1aecb24fe1,09-03-2025,2025-03-09 06:21:09.000 UTC,398,27355961,0x827922686190790b37229fd06084350E74485b72,8714318,209985845010476777,169658925,83600767067414395960728
0x38f6d2d9ea493c3c6ee865b5b952b5fe9e3e61fc,0x873b913326f9ac709d926bcd503d2ce21000e3a32329310795bc3f2ef9ee0422,01-07-2025,2025-07-01 04:44:57.000 UTC,481,32277875,0x46A15B0b27311cedF172AB29E4f4766fbE7F4364,422580,12132690909,303719,302878
0x38f6d2d9ea493c3c6ee865b5b952b5fe9e3e61fc,0x20974b306b6efe3c6a849bd413023c732f29dd920bcc53a12b2530dad8d92811,17-07-2025,2025-07-17 02:58:55.000 UTC,616,32965894,0x46A15B0b27311cedF172AB29E4f4766fbE7F4364,445598,28581600351,418577,1010846
0x9eb86e93a809a41ab0e7cc0ba6f62561fda3015c,0xb404be1d07d4eaa8de62901bf8ffbd566a8d0784739f3d9fe8b1bc16a72a5897,21-02-2025,2025-02-21 18:29:01.000 UTC,405,26686597,0x827922686190790b37229fd06084350E74485b72,7749393,4792175575,691922385,54853
0x2791dc5e14f7680d9d969acc26059ba56403b6d5,0x12a1faa0723095bb3fa8d2eda5e926f66a41df4abe3613fe9337e248c8de4658,24-12-2024,2024-12-24 02:15:31.000 UTC,388,24108592,0x827922686190790b37229fd06084350E74485b72,4525977,7076079504989082922,2976618618699594411,3644412232428582
0x38f6d2d9ea493c3c6ee865b5b952b5fe9e3e61fc,0x17e8114180ba571baa3a25b9d03595347ee0302344fd15b81eab34fd87f36f63,03-06-2025,2025-06-03 05:10:09.000 UTC,665,31069031,0x46A15B0b27311cedF172AB29E4f4766fbE7F4364,394820,5749969514,281210,5964
0x2791dc5e14f7680d9d969acc26059ba56403b6d5,0xeafd0d59e691f888bda9f2c0b3669b03812777f2a651dfbf74cab15d7cc64a4c,16-12-2024,2024-12-16 23:05:21.000 UTC,323,23800487,0x827922686190790b37229fd06084350E74485b72,4120807,2974308006690520496511,336072222140461150223,1359222897704242199
0x0b27b59171a4ffe19f23d54126cd797be17c6551,0xab703b261ca15faf416e338d7caa64ebf4f343a4d438ec7ec0f313ccbd0796bd,07-10-2025,2025-10-07 06:52:49.000 UTC,718,36515311,0x03a520b32C04BF3bEEf7BEb72E919cf822Ed34f1,4018036,3196195885784281699513,86332399656640372,72027863362643085724794
0x9eb86e93a809a41ab0e7cc0ba6f62561fda3015c,0x522e6bfcb33b83526c3927f479f97f543e4b19b4fd70abda4923942b278c0f97,08-01-2025,2025-01-08 21:15:51.000 UTC,412,24790802,0x827922686190790b37229fd06084350E74485b72,5264977,1229830488541240625357,94096349563935131789,299875442902908390
0x9eb86e93a809a41ab0e7cc0ba6f62561fda3015c,0xd6de18fc05c1ea5b20709797f16e6e75aa2245cde9fe8d76ecc56420576880a9,15-05-2025,2025-05-15 12:50:31.000 UTC,380,30262042,0x827922686190790b37229fd06084350E74485b72,13748991,9740864708,464464,22123
0x9eb86e93a809a41ab0e7cc0ba6f62561fda3015c,0x5b8cb7dcb65ac770fec238a2213829544bfac72afb07a7fd54a8469654e40aa5,02-01-2025,2025-01-02 16:28:27.000 UTC,527,24522980,0x827922686190790b37229fd06084350E74485b72,4984751,2931841194444450424029,702853224150414488253,128020735946291779
0xdc98dbffcc648d6088a2ff8f7dc01aef050e58fc,0x707ca2eb1900f637e16ca35fa58a2b51ca8504aec2d4b8502c94f8664be2b16a,09-01-2025,2025-01-09 00:27:37.000 UTC,337,24796555,0x827922686190790b37229fd06084350E74485b72,5271508,1909296639362315528908,209638413377100897227,397932049253713881
0x38f6d2d9ea493c3c6ee865b5b952b5fe9e3e61fc,0xc68852e39f871a108186c86fbae3a77b7a420d3a5e238ae94795727d0db97107,09-01-2025,2025-01-09 13:25:07.000 UTC,560,24819880,0x827922686190790b37229fd06084350E74485b72,5302352,14205821653207724772343,451876361231345109,9173155234720093967817
0x8810de2baa17067ddcfbd9e8f29c55f070a55f0b,0x3e1e3e844446f116c7ab72bcf92c089ef064488a42479019e7caf48cc0168fa0,29-06-2025,2025-06-29 23:09:03.000 UTC,561,32224598,0x03a520b32C04BF3bEEf7BEb72E919cf822Ed34f1,3453279,18572392069947884,684386462,439825583518386847385
0xdc98dbffcc648d6088a2ff8f7dc01aef050e58fc,0xd4008b227a91aca762ebdbbf7798324fb77967e9ba889034448c2834319d240b,09-07-2025,2025-07-09 19:36:53.000 UTC,190,32650233,0x46A15B0b27311cedF172AB29E4f4766fbE7F4364,432978,15770913955,304963,483673
0x2791dc5e14f7680d9d969acc26059ba56403b6d5,0xb0645024ac33cce6018839b11729b729013fa22c5b7b392fe3199b4e57b38dea,21-12-2024,2024-12-21 10:36:39.000 UTC,730,23994026,0x827922686190790b37229fd06084350E74485b72,4378231,1603685460699482004390,990903544728876888389,557985720225167725
0x095d0de0ecfd6832f1a7961ae26d285d68655d60,0xbcc1b34f617aff5593339275fe0be5d8555bf8affb12900d7bf1c03fc1cd0c15,07-02-2025,2025-02-07 08:40:09.000 UTC,361,26064131,0x03a520b32C04BF3bEEf7BEb72E919cf822Ed34f1,2050571,7964102444182361005765,5939605927326023,216173696686688125537929
0x095d0de0ecfd6832f1a7961ae26d285d68655d60,0x78b0f80518dec148a485755d5421aa72ed8fb49e35afa1723e227992c26ef4f9,27-05-2025,2025-05-27 19:54:49.000 UTC,615,30793171,0x03a520b32C04BF3bEEf7BEb72E919cf822Ed34f1,3108893,5318097742503045141087,70126805999731827,208317910026588542698278
0xdc98dbffcc648d6088a2ff8f7dc01aef050e58fc,0x7362959e412b1ef0ba2e7ebf11457b1efac0060122df6df3883695d85008edce,02-01-2025,2025-01-02 05:51:37.000 UTC,299,24503875,0x827922686190790b37229fd06084350E74485b72,4961516,271744808577670365073,160495827024127438317,380587480512179748
0x351f61e4c49cf11f24d9f2e737ca5eff81806355,0xa4e76ead16287a1d46fe5bf22a915a9fff0903a0ed8553b21527382db989e123,08-10-2025,2025-10-08 00:43:55.000 UTC,132,36547444,0x827922686190790b37229fd06084350E74485b72,28084732,188166861972064378,119880206,55643952159074437533019
0x351f61e4c49cf11f24d9f2e737ca5eff81806355,0x06f16d45163452831aa7fb16cef9f3bdb0c4ed1900e9293060c723ab15fb0945,20-10-2025,2025-10-20 19:15:21.000 UTC,838,37099187,0x827922686190790b37229fd06084350E74485b72,29424986,152166251183076921,251995266,80245441671267444372565
0x38f6d2d9ea493c3c6ee865b5b952b5fe9e3e61fc,0xae9b050d22085d26dde2c3caea0e2ace00394a6ec674458936748e9c85a2ad06,01-06-2025,2025-06-01 06:28:09.000 UTC,604,30984971,0x46A15B0b27311cedF172AB29E4f4766fbE7F4364,392332,3266615248,92786,70503
0xdc98dbffcc648d6088a2ff8f7dc01aef050e58fc,0x6de5163947f1113e43add37d52cf02e8a3c9decffa75c139764a8bd4319d6440,07-01-2025,2025-01-07 00:19:39.000 UTC,262,24709916,0x827922686190790b37229fd06084350E74485b72,5172484,2337057832471763331982,241437289620013812156,503210322580215007
0x38f6d2d9ea493c3c6ee865b5b952b5fe9e3e61fc,0x54c1a1d33b099cbc843836e179007523b054e73f748565d6ad3dfbe0ab525ede,01-02-2025,2025-02-01 00:20:01.000 UTC,334,25789927,0x827922686190790b37229fd06084350E74485b72,6504750,339301934593328811,1894218361,92530438202472737562795
0xdc98dbffcc648d6088a2ff8f7dc01aef050e58fc,0xd07881b860333eeea75008847be56c0f62997501c549a5f8ea9edcc47febaaac,07-06-2025,2025-06-07 01:23:19.000 UTC,954,31235026,0x827922686190790b37229fd06084350E74485b72,15808179,10524212604,67631,458815
0x9eb86e93a809a41ab0e7cc0ba6f62561fda3015c,0xaf33e70e82cf3f418bffac828ed2812519c3e21b4ed6c64e865a3f5f0a7eb814,22-05-2025,2025-05-22 17:57:39.000 UTC,457,30573656,0x827922686190790b37229fd06084350E74485b72,14438296,25427702228,1088074,182357
0x8810de2baa17067ddcfbd9e8f29c55f070a55f0b,0x1c8f1275615df4fa810c0ed368e2f7faa5a1cb02a994d6b4fac05a4a696cda89,24-07-2025,2025-07-24 01:02:33.000 UTC,253,33264803,0x03a520b32C04BF3bEEf7BEb72E919cf822Ed34f1,3594692,2300859934639882134879,68014632922679394,45874997819558932392505
0xdc98dbffcc648d6088a2ff8f7dc01aef050e58fc,0xa065f88fa5c22c4af7ffd505125884ee1f44e9d7f0d2b862680caea5069acb24,14-05-2025,2025-05-14 14:26:25.000 UTC,770,30221719,0x46A15B0b27311cedF172AB29E4f4766fbE7F4364,379765,12543935127374083633920,541157394365175161,62517955553323173
0xdc98dbffcc648d6088a2ff8f7dc01aef050e58fc,0x69b9411f0492af1a73306a2348095294a62861da0b72c4dc1a0e9dc4b16a2b00,02-01-2025,2025-01-02 14:57:45.000 UTC,472,24520259,0x827922686190790b37229fd06084350E74485b72,4981204,814858518434928618,1400633085,42824997551846418528017
0x8508fd4238162cb3f3d485f432202af3b40f164e,0x5d5bfcc493fdb7ddfefe1df42ea549535ee63c6d2fdc513de47e13a9d7a8d569,13-03-2025,2025-03-13 10:07:03.000 UTC,421,27535538,0x827922686190790b37229fd06084350E74485b72,8966084,559751226373332,218061088197856458946,2238
0xdc98dbffcc648d6088a2ff8f7dc01aef050e58fc,0x9b7722fb31e07932fcd1ebf11b8b9aadcf41578b6214ccabc8b7b4b3f34fcbca,13-01-2025,2025-01-13 01:58:11.000 UTC,565,24972072,0x827922686190790b37229fd06084350E74485b72,5471092,1167721303498732056913,359952710138348874297,36730802198530279
0x2791dc5e14f7680d9d969acc26059ba56403b6d5,0x90fe544c97d6fee59aca1f3166e7cba4c4605d92ee3832a556225362192b60c6,27-12-2024,2024-12-27 19:18:43.000 UTC,435,24268888,0x827922686190790b37229fd06084350E74485b72,4704679,6317470773876130853,2543196374702360758,3421442489399635
0xdc98dbffcc648d6088a2ff8f7dc01aef050e58fc,0xb194ab9d46d97dd91a4831adace5804adb4931b2e8ed29c0c70dd9c2a4815b02,27-05-2025,2025-05-27 09:08:19.000 UTC,1011,30773776,0x827922686190790b37229fd06084350E74485b72,14862726,6382868891,310194,8594
0x8508fd4238162cb3f3d485f432202af3b40f164e,0x2c2aa134ed2484ffda8ec5b075a6951fb6b45dd80c30af4012ab959aef73ae7f,13-06-2025,2025-06-13 17:23:25.000 UTC,463,31523029,0x03a520b32C04BF3bEEf7BEb72E919cf822Ed34f1,3259062,91035924842425421636,25627605616805023,105975425960724093117
0x8508fd4238162cb3f3d485f432202af3b40f164e,0xf0bb1bf5849dd867af38c6d70d94ac687a1b3396140603bd2b467a7a758b0181,19-05-2025,2025-05-19 04:39:13.000 UTC,310,30420103,0x03a520b32C04BF3bEEf7BEb72E919cf822Ed34f1,3057123,193274812218967554977,125683728788241792,180990750873831591593
0x2791dc5e14f7680d9d969acc26059ba56403b6d5,0xc57fd0401956b2d1974b83d623378d3cabd8b7a9399b2da1f2540dc96270e031,12-01-2025,2025-01-12 23:27:45.000 UTC,387,24967559,0x827922686190790b37229fd06084350E74485b72,5465533,1741723127119407029510,545637825918514528388,47550930701662822
0x9eb86e93a809a41ab0e7cc0ba6f62561fda3015c,0xb7f8a7f7bd54f9354f28a3946f5e61f124b6a156797118fd74829430fdc6eccd,09-01-2025,2025-01-09 03:17:59.000 UTC,321,24801666,0x827922686190790b37229fd06084350E74485b72,5278084,1000116380169977399168,76986037952428235,1157410944844912455847
0x38f6d2d9ea493c3c6ee865b5b952b5fe9e3e61fc,0xa277db26318acd23e4a76f24ef6de399bea7e6261402ab650992faaec5343992,16-07-2025,2025-07-16 08:38:49.000 UTC,356,32932891,0x46A15B0b27311cedF172AB29E4f4766fbE7F4364,444260,28608919615,97316,1333827
0x8fd1b615c006ebeb8a7cfb00a1dd809f31943b08,0x7aa493beb3ceda0fcd7f6f3671817a1d13b82055fb91d3e1df8fc813badbbaca,04-01-2025,2025-01-04 01:39:37.000 UTC,313,24582715,0x827922686190790b37229fd06084350E74485b72,5048802,4180799495505919778167,161422839858689317,10680985213556018014746
0x2791dc5e14f7680d9d969acc26059ba56403b6d5,0xf87b6f82ee882f6d61ceccd329d84a4a94a9fa6471090781a681d708f0d91fa3,02-01-2025,2025-01-02 18:48:59.000 UTC,545,24527196,0x827922686190790b37229fd06084350E74485b72,4990724,1662870363394458073,3801002673,3161896333303033128257
0x9eb86e93a809a41ab0e7cc0ba6f62561fda3015c,0xcfe5ec0e29c34890c183135e28ce653e2c8d651e93e6163203e70836542cff1b,02-06-2025,2025-06-02 14:54:01.000 UTC,1716,31043347,0x827922686190790b37229fd06084350E74485b72,15420738,28645104080,1350805,79881
0xdc98dbffcc648d6088a2ff8f7dc01aef050e58fc,0xd1f43a64e308a6ac039ae8ac3ba8dbad10139d252517a0ad6ba9b4129ce5186c,28-12-2024,2024-12-28 03:13:09.000 UTC,573,24283121,0x827922686190790b37229fd06084350E74485b72,4714222,1984946921700090234,3071355175973362347,579005842258892
0x9eb86e93a809a41ab0e7cc0ba6f62561fda3015c,0xefcf74cb20050d5b1b4c49950bd38a04d9d4ade41347354b923dd45a6d8b89a7,03-01-2025,2025-01-03 00:04:53.000 UTC,360,24536673,0x827922686190790b37229fd06084350E74485b72,5000305,1885631825761619730289,77817626923890539,2546271857889079970027
0xdc98dbffcc648d6088a2ff8f7dc01aef050e58fc,0x052ae0055f737c36056863f84e25d447beb6247e4cf9cd06ea45429740fb88b6,25-05-2025,2025-05-25 07:18:19.000 UTC,588,30684076,0x46A15B0b27311cedF172AB29E4f4766fbE7F4364,387024,1670016755981703,34966807218329487655,69651391
0xdc98dbffcc648d6088a2ff8f7dc01aef050e58fc,0x50d6c2d971a0ebf1354154ede43ab809fe63c8c47b6e887c8a5c95b98dc99525,14-01-2025,2025-01-14 14:00:29.000 UTC,509,25036941,0x827922686190790b37229fd06084350E74485b72,5550875,956636211891153156202,153999751155522266929,147452816235789595
0x9eb86e93a809a41ab0e7cc0ba6f62561fda3015c,0x453cb04dd533b7c14dc254b07ea5c1de5630114ce466e1e987420f294ceb8b7f,12-12-2024,2024-12-12 16:33:15.000 UTC,612,23615924,0x827922686190790b37229fd06084350E74485b72,3904173,2206559367234364432256,1867688454553568450410,537723709410608677
0x8fd1b615c006ebeb8a7cfb00a1dd809f31943b08,0x3c369fa2a47e2261e44b9b4ef95fc371a806141c1c4177d97a5d25d227169b5e,08-12-2024,2024-12-08 22:38:41.000 UTC,398,23454087,0x827922686190790b37229fd06084350E74485b72,3686960,1816271358583089185815,203564615217474713684,656161046709656091
0x38f6d2d9ea493c3c6ee865b5b952b5fe9e3e61fc,0xcf74942d76e5c6081de741fc62ede28b6ac46e988577f27edd0e2d2bfed7c029,09-01-2025,2025-01-09 02:07:47.000 UTC,692,24799560,0x827922686190790b37229fd06084350E74485b72,5275334,16261051932435793353735,42644345371847572,35011620381243331248584
0x8810de2baa17067ddcfbd9e8f29c55f070a55f0b,0xbe92ab8ea3bcdbce39fb517e3acf200af12250ce938cfb2604b061316116cb08,27-03-2025,2025-03-27 14:25:19.000 UTC,459,28148086,0x827922686190790b37229fd06084350E74485b72,9910166,115574629997000559,45817997,56775646971714104132497
0x8508fd4238162cb3f3d485f432202af3b40f164e,0x65d4b57e3e70114a089022e86685b5f288e6fdcc9089e4f3a57946e3b9f417e8,11-06-2025,2025-06-11 04:56:11.000 UTC,745,31414212,0x827922686190790b37229fd06084350E74485b72,16145873,12337981008,119675,497349
0xdc98dbffcc648d6088a2ff8f7dc01aef050e58fc,0x4b526d33a62388543d855a7cfede7491b095b8127d1b432a71f9f6871f225cf5,12-01-2025,2025-01-12 13:00:25.000 UTC,453,24948739,0x827922686190790b37229fd06084350E74485b72,5446766,1217057635066411014238,157249427363434499744,220344954155733353
0x0b27b59171a4ffe19f23d54126cd797be17c6551,0x0a65d9011f9a8fdf9e9d843a766075ff2c26eafe35adc8fad2190ef805a123ec,21-08-2025,2025-08-21 00:45:51.000 UTC,165,34473902,0x03a520b32C04BF3bEEf7BEb72E919cf822Ed34f1,3785736,943951242926812963375,25248332047827951,21439357600046703309879
0x8fd1b615c006ebeb8a7cfb00a1dd809f31943b08,0x5100e00586dffd4623e83285968020fe2c8656daade54efcd40f5b62f2d53141,16-12-2024,2024-12-16 08:14:19.000 UTC,267,23773756,0x827922686190790b37229fd06084350E74485b72,4055444,8268791412356446607,499505440458269400,12540704519980716
0x2791dc5e14f7680d9d969acc26059ba56403b6d5,0x8df40a9bd02220dcb929c71c4f461a3a2a6f311628f5ed28b496a263de3491ce,02-01-2025,2025-01-02 22:22:51.000 UTC,430,24533612,0x827922686190790b37229fd06084350E74485b72,4997457,1605683919456197853,1433452584,41364916213538439286241
0xdc98dbffcc648d6088a2ff8f7dc01aef050e58fc,0x9edf503a07a320d488214093184a06d236aada6c4f4c0f74209a0512a88b8b1b,27-05-2025,2025-05-27 11:51:41.000 UTC,1117,30778677,0x46A15B0b27311cedF172AB29E4f4766fbE7F4364,388304,12351129504874045558640,399016527690884270,208783038440993182
0xdc98dbffcc648d6088a2ff8f7dc01aef050e58fc,0x158085af2d3c3459d72f1afe9c6987e8e0a7b0991005fa782c8ebb3401572d51,02-01-2025,2025-01-02 21:48:09.000 UTC,500,24532571,0x827922686190790b37229fd06084350E74485b72,4996584,780668672433427233,1326714264,41280673257353633464988
0x095d0de0ecfd6832f1a7961ae26d285d68655d60,0xa585cfbe9be7b0448ab7132c49c62dbaee7c01b56ba2db7bbf70788dd3cbd561,23-02-2025,2025-02-23 17:54:25.000 UTC,306,26771959,0x03a520b32C04BF3bEEf7BEb72E919cf822Ed34f1,2142054,13700395057983598139766,335710397428566327,322134056580839230997817
0x38f6d2d9ea493c3c6ee865b5b952b5fe9e3e61fc,0x4a551d3dd446b1161f0eafacfdc54c6db166a08bc7f3d3cd0a4fbe1577e444bf,02-07-2025,2025-07-02 03:45:55.000 UTC,554,32319304,0x46A15B0b27311cedF172AB29E4f4766fbE7F4364,424025,12089672749,544998,59198
0x38f6d2d9ea493c3c6ee865b5b952b5fe9e3e61fc,0xbd54f91107adb41711681eb52b4c735372170ee5112cdd37b4cbd26181bb8e8c,09-01-2025,2025-01-09 11:30:19.000 UTC,449,24816436,0x827922686190790b37229fd06084350E74485b72,5297219,14387689222020846113405,638124537900397440,725843457602040521711
0x2791dc5e14f7680d9d969acc26059ba56403b6d5,0x09b7adcf1e831f76662cee75212e9e3d7ab2a70b23a11ffff5b64bf4c96653a2,12-01-2025,2025-01-12 20:12:27.000 UTC,391,24961700,0x827922686190790b37229fd06084350E74485b72,5459590,1717732010207653717252,448735259429101734456,120926656404306833
0x38f6d2d9ea493c3c6ee865b5b952b5fe9e3e61fc,0x578bbbb205264872e76a55f4830e954868f236193ce74db6001aff34e4585e52,13-01-2025,2025-01-13 02:42:01.000 UTC,322,24973387,0x827922686190790b37229fd06084350E74485b72,5472854,537193018991984831,832205933,29593326664383086935404
0x0b27b59171a4ffe19f23d54126cd797be17c6551,0x75a206b44f939c935eafc14c63ec3a893b865f4bdedec3af4898863875db1eb0,09-11-2025,2025-11-09 15:13:29.000 UTC,650,37955931,0x03a520b32C04BF3bEEf7BEb72E919cf822Ed34f1,4166861,1564533767510610311008,33820115747005594,43786392031753147567162
0x2791dc5e14f7680d9d969acc26059ba56403b6d5,0xcde1000c95c109c4fea529fa4f57558d6622b6c1b693fb90a0bf2ea41eae9e39,16-01-2025,2025-01-16 00:33:11.000 UTC,417,25099122,0x827922686190790b37229fd06084350E74485b72,5632743,14503405022189485119050,264583476968093627,19574752162527742693887
0x2791dc5e14f7680d9d969acc26059ba56403b6d5,0x71ac7857bae77116c56af5498295df81838611394e193c2af715d886bcd0783c,13-01-2025,2025-01-13 00:05:25.000 UTC,418,24968689,0x827922686190790b37229fd06084350E74485b72,5466573,1031389867353287709372807,2292163841898793179313,2861645094930730437915
0x38f6d2d9ea493c3c6ee865b5b952b5fe9e3e61fc,0x96dd5b32b64b633d919d9368272bffccef2b69e364c37da2d623ea7203af935e,09-07-2025,2025-07-09 19:36:23.000 UTC,519,32650218,0x46A15B0b27311cedF172AB29E4f4766fbE7F4364,432976,28997342191,560722,889310
0x38f6d2d9ea493c3c6ee865b5b952b5fe9e3e61fc,0x5cb7d5fcb584dbdf0f931a902d7c304778fb7578cd5d54dfe0733bc355abbe6b,29-12-2024,2024-12-29 13:42:11.000 UTC,235,24345192,0x827922686190790b37229fd06084350E74485b72,4780796,568160713007051663,1310206374,43143047359277225301690
0xdc98dbffcc648d6088a2ff8f7dc01aef050e58fc,0x478572cbdc8cc3da05fd749f7f14c3e002297867c63f731d08d39831c9439c35,12-07-2025,2025-07-12 12:09:23.000 UTC,348,32766408,0x46A15B0b27311cedF172AB29E4f4766fbE7F4364,436865,10468766770803550900524,464107064041683660,37650550342494098
0x0b27b59171a4ffe19f23d54126cd797be17c6551,0xd853e576916737e32fc05c6d8408edc3507d974e514248bab26a8014c5bb87ba,24-07-2025,2025-07-24 03:08:23.000 UTC,508,33268578,0x03a520b32C04BF3bEEf7BEb72E919cf822Ed34f1,3595096,2496647781528479220614,99407058937968160,38173970534010224628520
0x2791dc5e14f7680d9d969acc26059ba56403b6d5,0x6e4bda1b86f5cf3c758fe9a1b43939c6cf81510bfd210675db235723d259212b,14-12-2024,2024-12-14 03:07:19.000 UTC,325,23678146,0x827922686190790b37229fd06084350E74485b72,3975597,10830857828454868937,2281301339456658488,3991236408446973
0x8508fd4238162cb3f3d485f432202af3b40f164e,0x017599787762e73c1aac6f2996d4368394e1deea642c588a0fdddc3221886483,30-06-2025,2025-06-30 21:15:15.000 UTC,315,32264384,0x827922686190790b37229fd06084350E74485b72,17965917,191109485938666995964,91503474940592944,156220930195801399052
0xdc98dbffcc648d6088a2ff8f7dc01aef050e58fc,0x8d2aba2537ed5fcee06690fa795da3bd1bb1e3f116af60eda70bac37ae214ccd,15-05-2025,2025-05-15 16:15:23.000 UTC,351,30268188,0x46A15B0b27311cedF172AB29E4f4766fbE7F4364,380648,12392024125500785170442,42695207580949351,602714623493796756
0x38f6d2d9ea493c3c6ee865b5b952b5fe9e3e61fc,0x84ccfe0649c239006afd686754084227ca4af6bec58813cb11cdddc2a18afe96,03-07-2025,2025-07-03 04:11:45.000 UTC,711,32363279,0x46A15B0b27311cedF172AB29E4f4766fbE7F4364,425639,11949148829,90233,507452
0x8508fd4238162cb3f3d485f432202af3b40f164e,0x23d4695a70fcd8ee76609702f8d882512e085ac4681846c232ddda31e654f0f3,14-04-2025,2025-04-14 08:21:25.000 UTC,1524,28914769,0x03a520b32C04BF3bEEf7BEb72E919cf822Ed34f1,2880571,5170875622226573262711,247269103625721972,65890196132503181739837
0x38f6d2d9ea493c3c6ee865b5b952b5fe9e3e61fc,0x3c6b9ec9dc7f898f3d13b97c0c42fc4410e5978f309205f5c5681defcf26e959,06-01-2025,2025-01-06 04:55:55.000 UTC,587,24675004,0x827922686190790b37229fd06084350E74485b72,5133457,1719923637610200803,329048673,60209711440630596050397
0xdc98dbffcc648d6088a2ff8f7dc01aef050e58fc,0x151fa584305512cd498b0e35237f264996fd1aa59b266f6f0bd98d774f42cf51,15-01-2025,2025-01-15 20:50:09.000 UTC,402,25092431,0x827922686190790b37229fd06084350E74485b72,5622774,181458091797921685367392,650380006536157633542,10927941686198930730411
0x38f6d2d9ea493c3c6ee865b5b952b5fe9e3e61fc,0x4a5f522356256e1d55ee76864cf1d7db274d7583ac3cff5c9e7174351e1f22a4,10-01-2025,2025-01-10 02:44:05.000 UTC,334,24843849,0x827922686190790b37229fd06084350E74485b72,5332190,1168961446968063340564,252005992927912251422,116961849459630637
0x2791dc5e14f7680d9d969acc26059ba56403b6d5,0xe830d42edc78af51118e89ec579795056cda883b5e3566b643ffdfccac66f4da,01-01-2025,2025-01-01 11:25:11.000 UTC,371,24470682,0x827922686190790b37229fd06084350E74485b72,4923931,1282217846211784837801,385954123081026943651,855454076423021049
0x8508fd4238162cb3f3d485f432202af3b40f164e,0x8b3bc2bc9f2894f4be480b210b9bb43e139012e6ebc19e332b5d19f2285deb54,23-04-2025,2025-04-23 19:24:07.000 UTC,925,29323450,0x03a520b32C04BF3bEEf7BEb72E919cf822Ed34f1,2922207,4576724327202269777155,211554948131092954,60336900618427604380983
0x38f6d2d9ea493c3c6ee865b5b952b5fe9e3e61fc,0xa5ecaf606217c1707897850706b6b821ccfeaf61a36dd81b08d7d5048c8b1784,07-06-2025,2025-06-07 04:30:23.000 UTC,471,31240638,0x46A15B0b27311cedF172AB29E4f4766fbE7F4364,398370,5460060139,253726,19046
0x2791dc5e14f7680d9d969acc26059ba56403b6d5,0xe7db6ba726467bcc8abc153426386869ee96d97079e60bbc48ae437eb9cd2623,12-12-2024,2024-12-12 09:01:51.000 UTC,317,23602382,0x827922686190790b37229fd06084350E74485b72,3882262,15099604043281759010,12750694203768750184,480832816781427
0xdc98dbffcc648d6088a2ff8f7dc01aef050e58fc,0x8ae392a818274cb0951a3784f0aa3dc703d85fa377625803d629ff202b472cbf,20-06-2025,2025-06-20 07:04:41.000 UTC,355,31806867,0x827922686190790b37229fd06084350E74485b72,16976387,11231125409188429,17423414,1141577408324603733744
0x8fd1b615c006ebeb8a7cfb00a1dd809f31943b08,0x5d2e17f4e8ae1ab0ca4039f6a4c1d19393de11951d7060cf3d2e2552a2918316,18-12-2024,2024-12-18 10:34:21.000 UTC,568,23864357,0x827922686190790b37229fd06084350E74485b72,4199283,9769540260501518301,9435137488873233358,8701328558417518
0x8508fd4238162cb3f3d485f432202af3b40f164e,0xb4c7d6f4a839a7d9fca2357bbba04b4e3b22011f70ae80f8e12b28dc6fe5d7ed,04-04-2025,2025-04-04 21:33:17.000 UTC,258,28506525,0x827922686190790b37229fd06084350E74485b72,10525975,284415130278788,75178088941429125307,26459
0x8fd1b615c006ebeb8a7cfb00a1dd809f31943b08,0x67235e2344d25a32338cf6ccecb4bedb4102c3e7b45b83bdae0a948807805587,16-12-2024,2024-12-16 10:45:39.000 UTC,330,23778296,0x827922686190790b37229fd06084350E74485b72,4085096,7386991059493340443,3692345672382717254,9098877053312421
0x8810de2baa17067ddcfbd9e8f29c55f070a55f0b,0xc4ecf2bf0b19c0db9eaa054d809096fab6c9f193c91196208b1426b850576103,28-03-2025,2025-03-28 06:00:33.000 UTC,226,28176143,0x827922686190790b37229fd06084350E74485b72,9956116,114361002628137656,6851462,61469874415205069360085
0x095d0de0ecfd6832f1a7961ae26d285d68655d60,0x0a3d1ee2d266ff29b6a1cb72ac2c3b71c6af304cd8dc0fb9ae1bf558f4f3a57d,13-03-2025,2025-03-13 13:22:49.000 UTC,1171,27541411,0x03a520b32C04BF3bEEf7BEb72E919cf822Ed34f1,2360129,10625422791193244791985,109856180783953530,318398747704147077553073
0x095d0de0ecfd6832f1a7961ae26d285d68655d60,0x93b50f67189bb2205230a9096d1bd73b15d0ec2a775fa9023e9ffeea07f121d7,23-04-2025,2025-04-23 04:24:15.000 UTC,410,29296454,0x03a520b32C04BF3bEEf7BEb72E919cf822Ed34f1,2917885,6904902795380737707494,92436133261619437,228930728283783632372685
0x095d0de0ecfd6832f1a7961ae26d285d68655d60,0x2601c282cf6f4ff1cb2d28e9a29b75c41b8d36943fda31dc7212a5b17501ae5b,06-02-2025,2025-02-06 03:31:01.000 UTC,732,26011657,0x827922686190790b37229fd06084350E74485b72,6776536,99393261663208608,189644886,53587735516772273393065
0xdc98dbffcc648d6088a2ff8f7dc01aef050e58fc,0x33d0b552e3c2c65837627624346b9b1c9788cdb3bf4ca5ba3a920d70c72d305a,09-04-2025,2025-04-09 20:42:49.000 UTC,582,28721011,0x827922686190790b37229fd06084350E74485b72,10826639,6568709240686581,6860645,995949397909721318201
0xdc98dbffcc648d6088a2ff8f7dc01aef050e58fc,0x307720fcafbb1288b29e020ea5757cb70e920c9566f49dc8625affbf19a6910a,17-07-2025,2025-07-17 03:07:01.000 UTC,344,32966137,0x46A15B0b27311cedF172AB29E4f4766fbE7F4364,445602,10420690878139461571837,88020495778819389,450217913918814032
0x8810de2baa17067ddcfbd9e8f29c55f070a55f0b,0x02417d65d8779840f039f4c260bf4c617195ec9abd2a4f6c4dab61c1b2ddb3ad,18-04-2025,2025-04-18 15:52:07.000 UTC,247,29101090,0x827922686190790b37229fd06084350E74485b72,11474978,75604031436092882,51661151,41735403502352834762757
0x9eb86e93a809a41ab0e7cc0ba6f62561fda3015c,0x453b386f41f98228d79ab43c9aabf581f51a374548a7e7a9cf9271f372c40c3d,16-12-2024,2024-12-16 18:25:15.000 UTC,573,23792084,0x827922686190790b37229fd06084350E74485b72,4109979,1566140347582275279666,1001255142820912841689,520898997272476582
0x9eb86e93a809a41ab0e7cc0ba6f62561fda3015c,0x8e1a3e41c3cf391d43d5ef6f912aff7c809f2588767978787ac45c01022fcdea,14-12-2024,2024-12-14 10:21:37.000 UTC,591,23691175,0x827922686190790b37229fd06084350E74485b72,3996206,1846641112937113422112,1293987677895153732257,559879830501852334
0x8810de2baa17067ddcfbd9e8f29c55f070a55f0b,0x5723b30fa58e0476bc9fc2796c50388362546c975f2502cc2f63c888d0e14366,27-07-2025,2025-07-27 00:23:53.000 UTC,227,33393243,0x03a520b32C04BF3bEEf7BEb72E919cf822Ed34f1,3614256,1931538884195986559673,73267018894051600,30744415193571851279618
0xdc98dbffcc648d6088a2ff8f7dc01aef050e58fc,0x21babd407e717d7f4d7b5d649528129ac6d9992ccb79208f6125bb3beb35299d,28-02-2025,2025-02-28 23:37:47.000 UTC,183,26998260,0x03a520b32C04BF3bEEf7BEb72E919cf822Ed34f1,2186880,11254169963643909621808,718825583567031383,153059228241431669692473
0x8fd1b615c006ebeb8a7cfb00a1dd809f31943b08,0x900a8980bcd099907b2e1358be7ff89da66b3642c80cb61b23377c6a0c19dfbe,09-01-2025,2025-01-09 00:26:31.000 UTC,438,24796522,0x827922686190790b37229fd06084350E74485b72,5271467,3624719778752938628386,393781240927553634170,1928158303156816829
0x8508fd4238162cb3f3d485f432202af3b40f164e,0xfb6bee1ca5fdb59384f1aa75d54c20dd1564f17349289e77bb682537062b4a37,26-03-2025,2025-03-26 05:26:05.000 UTC,331,28088709,0x03a520b32C04BF3bEEf7BEb72E919cf822Ed34f1,2647279,6442189352084936994509,271186607493175618,90017862275547648753662
0x8fd1b615c006ebeb8a7cfb00a1dd809f31943b08,0x95d0ae62d927ee1c8bc550aad8753ceb5fac57386c19ca694ff21e47296c7138,01-01-2025,2025-01-01 21:24:47.000 UTC,444,24488670,0x827922686190790b37229fd06084350E74485b72,4942480,11353051287888357881519,342877043905900024,6995030509220489548095
0x2791dc5e14f7680d9d969acc26059ba56403b6d5,0xc1d2d6efa91efeaf136873bc2eaa5f1cdd1d25cf772ea07ba0d8d907a76e8b9e,26-12-2024,2024-12-26 20:32:01.000 UTC,456,24227887,0x827922686190790b37229fd06084350E74485b72,4636817,4803759144147358982,1646875449583090978,2787483028640577
0x8508fd4238162cb3f3d485f432202af3b40f164e,0xb3b18a89f866f5f93e89ab8bc11231bc3f02aa03e4707db760e7d75964fc3c90,27-03-2025,2025-03-27 15:10:53.000 UTC,873,28149453,0x827922686190790b37229fd06084350E74485b72,9913170,415015954431603,81183954988926056863,52692
0x9eb86e93a809a41ab0e7cc0ba6f62561fda3015c,0xa83f1477fcbff402be8c338493bfb5f53b855bc7ffbe6ecb7d54902ae4d2880e,20-12-2024,2024-12-20 05:37:41.000 UTC,462,23941857,0x827922686190790b37229fd06084350E74485b72,4309991,1183315223009577147177,623316392485916670386,492679314779124942
0x8fd1b615c006ebeb8a7cfb00a1dd809f31943b08,0x89f54691bed0799482f2fd91502f5dee54a2614aee7bca0b32e0536bccd07071,09-01-2025,2025-01-09 06:16:53.000 UTC,399,24807033,0x827922686190790b37229fd06084350E74485b72,5284499,3431443893282034118836,970821434427728754356,1187286826358357710
0x8508fd4238162cb3f3d485f432202af3b40f164e,0xe1b01143bf0512119c2b6a0034f4a42bea2324940acbe14d1346a7547cc10b72,03-04-2025,2025-04-03 10:57:55.000 UTC,448,28444264,0x827922686190790b37229fd06084350E74485b72,10417870,308811718427154,13990660836885897418,61000
0x8508fd4238162cb3f3d485f432202af3b40f164e,0x0d83f8f7ef6a272d55f7deaaea802c7f248811ec71c3fd01260049b113761d9d,03-06-2025,2025-06-03 03:31:43.000 UTC,605,31066078,0x827922686190790b37229fd06084350E74485b72,15473741,13882325166,156021,538389
0x8508fd4238162cb3f3d485f432202af3b40f164e,0x4f557ff8e98ac543dd8fe28940c386ec1693bbe53b49768ee51f3c5c58ab4425,11-04-2025,2025-04-11 12:57:49.000 UTC,326,28793461,0x827922686190790b37229fd06084350E74485b72,10942893,168001840967597,55674837690771273511,10443
0x8fd1b615c006ebeb8a7cfb00a1dd809f31943b08,0x24a2d45ab47ae39d232485efdfb36e5422674d3557a06709eb414d172f746db7,13-01-2025,2025-01-13 06:49:35.000 UTC,618,24980814,0x827922686190790b37229fd06084350E74485b72,5483281,2314905783469234483598,48755737333057665142,1252138203400845795
0xdc98dbffcc648d6088a2ff8f7dc01aef050e58fc,0xf4a2179e73b68da7d7c462764785ad6e8f2451d650af7602730d51a51ae38544,02-06-2025,2025-06-02 08:18:11.000 UTC,481,31031472,0x827922686190790b37229fd06084350E74485b72,15396161,12261767652,582488,29975
0xdc98dbffcc648d6088a2ff8f7dc01aef050e58fc,0xf35661e0628d51f1aff7d21499f62e183622eca08f58f40c8d00a4adc6c859ca,04-04-2025,2025-04-04 00:37:09.000 UTC,323,28468841,0x827922686190790b37229fd06084350E74485b72,10464654,7731222697448269,437754517,41615273396554417719
0x8810de2baa17067ddcfbd9e8f29c55f070a55f0b,0xb28536c4eeb51f975c35f580341893d66f68a11aca19a3f148c2500cb3a4dbb1,10-09-2025,2025-09-10 07:46:17.000 UTC,1129,35350515,0x03a520b32C04BF3bEEf7BEb72E919cf822Ed34f1,3873780,601928527003223878262,11568187176377538,18665336594061322633143
0x9eb86e93a809a41ab0e7cc0ba6f62561fda3015c,0x0d2eb11362821e08c000744169a07c1e203e53a6e341a062f330951b4ea5b912,26-01-2025,2025-01-26 10:23:29.000 UTC,358,25548831,0x827922686190790b37229fd06084350E74485b72,6196949,70053938070361235,485004926,15418852166398832651488
0x2791dc5e14f7680d9d969acc26059ba56403b6d5,0x3e92ba7b5d84466da4373b33e9780a2f0e304f09ca8a590b9de3cc55468fd60f,16-12-2024,2024-12-16 16:08:47.000 UTC,683,23787990,0x827922686190790b37229fd06084350E74485b72,4103595,3305275658421425596974,309593841785174052485,1611714554375530461
0x8508fd4238162cb3f3d485f432202af3b40f164e,0x1788b89084773b7183bf19fd77d0111295412d51b47bcc71a1817579d6cdf8c7,26-05-2025,2025-05-26 04:22:41.000 UTC,658,30722007,0x827922686190790b37229fd06084350E74485b72,14751872,16376039358,177464,641789
0x8fd1b615c006ebeb8a7cfb00a1dd809f31943b08,0x4a7347db99d705bd2a4bdfe59a3d7c452537ac00685a336df16399b01884bcd0,08-01-2025,2025-01-08 00:27:25.000 UTC,456,24753349,0x827922686190790b37229fd06084350E74485b72,5217221,4151672283949482781041,225660142470395214420,2470600075829765585
0x8fd1b615c006ebeb8a7cfb00a1dd809f31943b08,0x380a720843b695601e8e84297b1f30c348e71baec9616486a03787de3bfd09b7,15-12-2024,2024-12-15 03:00:01.000 UTC,459,23721127,0x827922686190790b37229fd06084350E74485b72,4028079,1510869138826722523044,614609017511555838342,359799692228820888
0x8fd1b615c006ebeb8a7cfb00a1dd809f31943b08,0x0abbea543a447f531797ecddddc89104a00ab9b99b65e46389e68a02df8e7e76,08-01-2025,2025-01-08 10:37:17.000 UTC,410,24771645,0x827922686190790b37229fd06084350E74485b72,5240298,4117749680015455852896,247925278967109963863,2381418010505649614
0x38f6d2d9ea493c3c6ee865b5b952b5fe9e3e61fc,0x9fdf5939691b7d4d8734696b1e4f2d6dc9b909338ecac80a6871d08223a75434,03-06-2025,2025-06-03 11:20:47.000 UTC,401,31080150,0x46A15B0b27311cedF172AB29E4f4766fbE7F4364,395052,5719106632,156838,129077
0x9eb86e93a809a41ab0e7cc0ba6f62561fda3015c,0x3997ee0d51f8aa84e0ed2edb73fce541c40e9809c8bb74a47cb26401282506d1,02-01-2025,2025-01-02 06:45:57.000 UTC,394,24505505,0x827922686190790b37229fd06084350E74485b72,4962446,80237804923300569483350,38829263861801063624,2921674849854001316323
0x9eb86e93a809a41ab0e7cc0ba6f62561fda3015c,0xe7b28c8206542c98443d04cd83e12b1005c3ebceff8f895c6de62ff521ebb7b5,19-02-2025,2025-02-19 21:28:33.000 UTC,555,26605583,0x827922686190790b37229fd06084350E74485b72,7625347,5373405633,117511910,741756
0x2791dc5e14f7680d9d969acc26059ba56403b6d5,0x0f3f83c68394e015406d05e28feaa53b3c9bda1965878ceb3da848636b89f8f1,18-01-2025,2025-01-18 04:49:59.000 UTC,430,25193226,0x827922686190790b37229fd06084350E74485b72,5762674,165706896067073832,623252054,16456901891509756562654
0xdc98dbffcc648d6088a2ff8f7dc01aef050e58fc,0x5c53c4e7184e30eeedaa41bbfc895b7e8af7c153c3112dfd6172ef69699db9f8,18-06-2025,2025-06-18 19:17:11.000 UTC,395,31742442,0x46A15B0b27311cedF172AB29E4f4766fbE7F4364,410541,11160588450104450147076,391143063478425061,154637889465166012
0x38f6d2d9ea493c3c6ee865b5b952b5fe9e3e61fc,0xbc605a7d02bdbd958e6f1f35892e2336153ce6313f1585bc69b43a463f948d9d,10-07-2025,2025-07-10 17:22:37.000 UTC,478,32689405,0x46A15B0b27311cedF172AB29E4f4766fbE7F4364,434363,28939697805,1093520,352879
0x9eb86e93a809a41ab0e7cc0ba6f62561fda3015c,0xc01c88c40e52323179adae1c23f58da3f48ed5abf273370de37505a1e9eed49b,03-01-2025,2025-01-03 22:48:51.000 UTC,393,24577592,0x827922686190790b37229fd06084350E74485b72,5044113,2367975003949402257239,180418464649596687802,601340035393642685
0x38f6d2d9ea493c3c6ee865b5b952b5fe9e3e61fc,0x643ba525553d444a9cc4217c741248465610532e320e2288b847afdc8a80cf6c,31-12-2024,2024-12-31 03:04:59.000 UTC,384,24412476,0x827922686190790b37229fd06084350E74485b72,4860854,1851838982300509902742462,1747635154362951986537,47064766801750700064768
0x2791dc5e14f7680d9d969acc26059ba56403b6d5,0x8815d8ae54b49835fcec052402f0f036aebf57b522815c614898943f4c5bc455,08-01-2025,2025-01-08 02:02:23.000 UTC,427,24756198,0x827922686190790b37229fd06084350E74485b72,5220767,1267921472192629185,2805283399,4015544755806263218826
0x8810de2baa17067ddcfbd9e8f29c55f070a55f0b,0x44e3df8f6cfda54ec418ba0ac46cb283b1c8eb78e725c4b89d5c257a9e0e25ef,19-05-2025,2025-05-19 07:54:43.000 UTC,491,30425968,0x03a520b32C04BF3bEEf7BEb72E919cf822Ed34f1,3058177,11428786933988866521828,563603286441058727,136008423494832580463759
0xdc98dbffcc648d6088a2ff8f7dc01aef050e58fc,0xf51a73fb08d0e5b135fc12558bbeda40ed9e5563cf27e1791f234306a93f4c4f,24-12-2024,2024-12-24 03:07:51.000 UTC,937,24110162,0x827922686190790b37229fd06084350E74485b72,4523418,1724251212633944194,743130997174340713,2380453199646663
0x38f6d2d9ea493c3c6ee865b5b952b5fe9e3e61fc,0xf6a60913a803ba17e42f9267e06d293dc22c6614f6633d6c5b650ccd6e3bcb23,31-12-2024,2024-12-31 07:33:39.000 UTC,348,24420536,0x827922686190790b37229fd06084350E74485b72,4869563,1828380193436833107919859,1943265963793885609480,42395214770319757095946
0x38f6d2d9ea493c3c6ee865b5b952b5fe9e3e61fc,0xba60fb162cbd853a9883a75cc529b53bf6c86585330015a1253a4c893eaabcf9,04-01-2025,2025-01-04 17:11:43.000 UTC,383,24610678,0x827922686190790b37229fd06084350E74485b72,5074978,2076722417923350035643,429817139081855497935,202783395789085749
0x8508fd4238162cb3f3d485f432202af3b40f164e,0x6e12cd5fc93a70c2ec02c98ca247fd85234c1dc7143848f1debcfa2b095a0e36,15-05-2025,2025-05-15 23:13:53.000 UTC,66,30280743,0x827922686190790b37229fd06084350E74485b72,13791924,12651956345597320380,6542430301304803,14267146884362523645
0x8508fd4238162cb3f3d485f432202af3b40f164e,0x25de2a503dd5a6ec6edf9daebe68d79fd6b53520172a216672edda4f6aae5bef,09-07-2025,2025-07-09 19:29:25.000 UTC,518,32650009,0x827922686190790b37229fd06084350E74485b72,18778452,169110091959057263881,70085891069657963,158506170189057492528
0xdc98dbffcc648d6088a2ff8f7dc01aef050e58fc,0x88d9e560bf9bf2c11c737d95433ec1ee9132f0319149769260ca649215706bdb,12-07-2025,2025-07-12 03:19:53.000 UTC,116,32750523,0x46A15B0b27311cedF172AB29E4f4766fbE7F4364,436492,10473096860888828175769,28919291723690458,518208199871677896
0x2791dc5e14f7680d9d969acc26059ba56403b6d5,0x3f5f9cedeedb20662cb1f827da042e7f1514f68df66d6d023d7d2762a362a5b6,21-12-2024,2024-12-21 06:58:23.000 UTC,509,23987478,0x827922686190790b37229fd06084350E74485b72,4367617,1615356881260442696589,711218468221437798926,787248963332154261
0x38f6d2d9ea493c3c6ee865b5b952b5fe9e3e61fc,0x88adc3f4413554c9c3687d3b8e64bed8dcbd8e839cd67f46655a41d15ed6079d,23-01-2025,2025-01-23 00:52:03.000 UTC,419,25402088,0x827922686190790b37229fd06084350E74485b72,6017309,414708364510597427,3054504281,86084182231462271495844
0x8810de2baa17067ddcfbd9e8f29c55f070a55f0b,0x08b19f4cea804f0aa4d0ae98b7f41db6a835c1a117d86923c13df09ead17aa5e,03-04-2025,2025-04-03 08:15:55.000 UTC,421,28439404,0x827922686190790b37229fd06084350E74485b72,10408796,100265474054959377,45131877,53078158169676320790980
0x8fd1b615c006ebeb8a7cfb00a1dd809f31943b08,0x21e2345acbe811d3e69d97b63f67f17636b0c193a11ac6e005a3ca3530af0ad3,11-12-2024,2024-12-11 07:00:25.000 UTC,409,23555539,0x827922686190790b37229fd06084350E74485b72,3826330,11213631393102057635448,4847629066302924348556,2549767525694188994
0x8fd1b615c006ebeb8a7cfb00a1dd809f31943b08,0xf5c859a14deffd471640b095abccdb761ca687df270fb5b9cee25c09b5f10dab,03-01-2025,2025-01-03 03:32:09.000 UTC,550,24542891,0x827922686190790b37229fd06084350E74485b72,5005931,8944131773182305796227,301827067108009691,3855613606367913470823
0x8fd1b615c006ebeb8a7cfb00a1dd809f31943b08,0x08a79629eba1ae7fc61f6922dac3caa4fcbaf6155561c88e1b4a1987e929951e,19-12-2024,2024-12-19 00:55:05.000 UTC,635,23890179,0x827922686190790b37229fd06084350E74485b72,4199283,10381480335594182535,21336209692052380362,1303134824526409
0x2791dc5e14f7680d9d969acc26059ba56403b6d5,0x9a76e2c4765dd8d514ef8ddf18047e31ed0c9d4444d33b5713d3e1794e75f2bf,20-03-2025,2025-03-20 06:59:23.000 UTC,276,27832308,0x827922686190790b37229fd06084350E74485b72,9427145,29570057485841748,48277217,179880599547141915877135
0xdc98dbffcc648d6088a2ff8f7dc01aef050e58fc,0x8a4542743509a1c306193fe407e4fb09464ccfdc3fc9c3ee1dfaaf4f435729a2,01-01-2025,2025-01-01 23:25:53.000 UTC,469,24492303,0x827922686190790b37229fd06084350E74485b72,4946450,1206153307100429576658862,1303162429439925439139,27750907440082449468031
0x8fd1b615c006ebeb8a7cfb00a1dd809f31943b08,0xc2c8efbf013b9958819e0052657dcb392433ddcfef69b95111204a52c62fab76,13-01-2025,2025-01-13 21:42:09.000 UTC,389,25007591,0x827922686190790b37229fd06084350E74485b72,5514846,890686655085697918484,623672928950317492615,1004722656639408354
0x9eb86e93a809a41ab0e7cc0ba6f62561fda3015c,0xe9030cb1be0d554688535595c878caa21e9e5267f48c9df91b337a2a29612d3e,03-02-2025,2025-02-03 04:39:41.000 UTC,436,25884117,0x827922686190790b37229fd06084350E74485b72,6626812,1955926123267090580028,88618529657531192,30325159127676635479850
0x38f6d2d9ea493c3c6ee865b5b952b5fe9e3e61fc,0x7aca095e33930a7c6f5226edcf71f92da43544211580bc938f89e523d90bbe3a,02-01-2025,2025-01-02 22:24:39.000 UTC,427,24533666,0x827922686190790b37229fd06084350E74485b72,4997542,1637575441293805976756,116964644409016150820,436615270241137284
0x2791dc5e14f7680d9d969acc26059ba56403b6d5,0xf345fed693455a4a65ae5da0dbe989311a09e6cee3be71d8337a3ebf87882bb2,13-12-2024,2024-12-13 03:30:17.000 UTC,838,23635635,0x827922686190790b37229fd06084350E74485b72,3931857,3481596617000376681753,876686201345139306753,1152472549481277858
0x2791dc5e14f7680d9d969acc26059ba56403b6d5,0x71d6062ef86ed3a7039884f1e3a3f6e72db0df5ef905d984620d2123df81f409,15-12-2024,2024-12-15 10:01:33.000 UTC,220,23733773,0x827922686190790b37229fd06084350E74485b72,4034167,8225542839611340608,4542981816691465558,1272415144803830
0xdc98dbffcc648d6088a2ff8f7dc01aef050e58fc,0x9127448ccdac71bf235c9c75aa788f67d78755641b38ff2f936535fa5c6f4405,04-01-2025,2025-01-04 09:24:15.000 UTC,384,24596654,0x827922686190790b37229fd06084350E74485b72,5059638,2544135938825740919152,656520849691225384612,94069264460328444
0x9eb86e93a809a41ab0e7cc0ba6f62561fda3015c,0x422264cdda8a8a89d71c567b4d554e4f2d3c6a0aaec9cfe1e47b683c950619d7,25-02-2025,2025-02-25 06:47:47.000 UTC,295,26838360,0x827922686190790b37229fd06084350E74485b72,7963443,4448803229,21786523,709434
0x8508fd4238162cb3f3d485f432202af3b40f164e,0xd8063dcd2c2ec61da98e00df31a9920237891976bb4f00a3422974d02dfdbb87,29-05-2025,2025-05-29 08:44:01.000 UTC,625,30859447,0x03a520b32C04BF3bEEf7BEb72E919cf822Ed34f1,3119681,169775030029176252413,55946271789691260,163700659292157590864
0x2791dc5e14f7680d9d969acc26059ba56403b6d5,0xe36d1896de343ffc345034605c2bd51c0940a66afcc8d0ba31bc3c7ac68cb3cb,06-02-2025,2025-02-06 05:33:29.000 UTC,153,26015331,0x827922686190790b37229fd06084350E74485b72,6772558,23447013028102110,49814700,9186478586490365135160
0x8810de2baa17067ddcfbd9e8f29c55f070a55f0b,0x6f5d82e3325db1b8eb94bd48b921477ca41eb499c4644ab6bc99d93bab943ec7,17-06-2025,2025-06-17 05:32:13.000 UTC,527,31674493,0x03a520b32C04BF3bEEf7BEb72E919cf822Ed34f1,3304563,259531598950463317413,14034133561344517,2153856913072509709067
0xdc98dbffcc648d6088a2ff8f7dc01aef050e58fc,0xcfe72d0ba78ec5e590afef28a1ace3b66bb1b12780993209b91cc5cc5123818a,04-01-2025,2025-01-04 08:35:17.000 UTC,533,24595185,0x827922686190790b37229fd06084350E74485b72,5058284,2558451164524183960713,21531591608245266732,850095966014600147
0x8508fd4238162cb3f3d485f432202af3b40f164e,0x4a4312ed18a6be7972b192aab46a3a75392143ad0cf01221fb4ad4bef1527f5f,05-06-2025,2025-06-05 02:59:45.000 UTC,601,31151519,0x03a520b32C04BF3bEEf7BEb72E919cf822Ed34f1,3177003,114450011888902737584,55520666394107687,92361400621751270930
0xdc98dbffcc648d6088a2ff8f7dc01aef050e58fc,0x21456352216ba0818e051171d072f6000346962f3fc506e1d2e0c6de7474968f,05-01-2025,2025-01-05 07:50:25.000 UTC,295,24637039,0x827922686190790b37229fd06084350E74485b72,5095207,17500803485233623643,1795681294934612370,3872279485174929
0x9eb86e93a809a41ab0e7cc0ba6f62561fda3015c,0x4de789bc21b2ff92ad25ef879fdb9d2d76592b36f03ddad40a47147033663daf,08-01-2025,2025-01-08 21:16:37.000 UTC,320,24790825,0x827922686190790b37229fd06084350E74485b72,5265012,1117062145914703500164,90479079109290325,1263044165118791991806
0xdc98dbffcc648d6088a2ff8f7dc01aef050e58fc,0xaacbe4a0ac01acf7c7887441f0d6c9b13cfc2b050211cff5da4b7d442b27723f,01-06-2025,2025-06-01 22:54:11.000 UTC,301,31014552,0x827922686190790b37229fd06084350E74485b72,15361703,12368257145,529213,88515
0xdc98dbffcc648d6088a2ff8f7dc01aef050e58fc,0xf4fba61ece5aac18da0391dbc02153290c7852b87c56f8db5f06db14a2c21594,12-01-2025,2025-01-12 16:16:31.000 UTC,304,24954622,0x827922686190790b37229fd06084350E74485b72,5453238,1205861461196670429449,87030212822743442112,275028872038108466
0x8508fd4238162cb3f3d485f432202af3b40f164e,0x0e932169a7737e0842177e2e46205488dabde63e00720f83cca59f4f27fc91aa,02-06-2025,2025-06-02 14:55:25.000 UTC,297,31043389,0x827922686190790b37229fd06084350E74485b72,15420816,195391348620191465079,93504799925515602,157639562798057803313
0x9eb86e93a809a41ab0e7cc0ba6f62561fda3015c,0xcfd878c9a521223ad305854e20b9a76ca1d94e814689670e6622535030599144,28-02-2025,2025-02-28 13:19:15.000 UTC,273,26979704,0x827922686190790b37229fd06084350E74485b72,8160964,3334808515,237182709,292286
0xdc98dbffcc648d6088a2ff8f7dc01aef050e58fc,0x2248260c9c4de9a7aa527ed473086de71f518f4e8fd2fdeb45bb5d9ee0cb4132,02-01-2025,2025-01-02 22:23:43.000 UTC,425,24533638,0x827922686190790b37229fd06084350E74485b72,4997500,2713898930484222942025,192532339426481690173,725290876564231437
0x351f61e4c49cf11f24d9f2e737ca5eff81806355,0xd564d630bfec26318797836ccbd11ce4ed9cb7dc739def4d30e8aef0c23be1d8,12-12-2025,2025-12-12 06:34:45.000 UTC,631,39365969,0x827922686190790b37229fd06084350E74485b72,35108087,55438336611043550,45945932,52693486727674604438570
0xdc98dbffcc648d6088a2ff8f7dc01aef050e58fc,0x957018e9888d7935b769a25ec11833f70e777ae5ba1e9c5f55f94771151aaa0c,11-07-2025,2025-07-11 18:24:01.000 UTC,488,32734447,0x46A15B0b27311cedF172AB29E4f4766fbE7F4364,436142,10479161817849340219047,480383278882200185,20182691298790002
0xdc98dbffcc648d6088a2ff8f7dc01aef050e58fc,0x5322a1bb2d102c683be1209e050752647d2b7c43a1df4d4fe0703213c6be8e6c,09-01-2025,2025-01-09 02:53:29.000 UTC,2741,24800931,0x827922686190790b37229fd06084350E74485b72,5277133,755781698210372133008980,535425905971465265152,22732483067302762849367
0x9eb86e93a809a41ab0e7cc0ba6f62561fda3015c,0x51ebea55bb9065e25bcadee3cc06457fad9b1e5edaf81177f4764e906d978473,01-01-2025,2025-01-01 20:05:31.000 UTC,1467,24486292,0x827922686190790b37229fd06084350E74485b72,4939763,616036582024789528687953,696473073055248858333,13541780832397961491630
0x8fd1b615c006ebeb8a7cfb00a1dd809f31943b08,0x10775b8d82e09bf45552f46e21534aadd093a2f00b883d03bedb6409ff5fad11,28-02-2025,2025-02-28 05:06:13.000 UTC,574,26964913,0x827922686190790b37229fd06084350E74485b72,8143707,646645516043536359,2273913906,273068755790178020406275
0x38f6d2d9ea493c3c6ee865b5b952b5fe9e3e61fc,0x4f039198b2d6885c7ff186b6cffcf4a2503bf0b14ab65f95ac32b62c94d3825f,31-01-2025,2025-01-31 17:10:09.000 UTC,423,25777031,0x827922686190790b37229fd06084350E74485b72,6487081,7583039185732069716377,603244358434074637,83140961151878019488913
0x9eb86e93a809a41ab0e7cc0ba6f62561fda3015c,0x0c8f2f23e31a3d529df99de609f9e2e2cd447a48c84d602481657bcd5f9b33ed,02-01-2025,2025-01-02 06:17:39.000 UTC,471,24504656,0x827922686190790b37229fd06084350E74485b72,4962446,536040543173520445435425,523365123506965531585,13583172401571823874705
0xdc98dbffcc648d6088a2ff8f7dc01aef050e58fc,0x2eebb017eb2adf1d8197f6d541811a76ebe7a61897da726d846bf61dd335f7e5,03-01-2025,2025-01-03 07:16:55.000 UTC,822,24549634,0x827922686190790b37229fd06084350E74485b72,5010834,2547605160773859028755,326103604685619626476,489717572852133883
0xdc98dbffcc648d6088a2ff8f7dc01aef050e58fc,0xa797acd59818a60b28f815d0bc5661e729b2426e511b53f428bd78b2a8c3a986,02-06-2025,2025-06-02 22:29:23.000 UTC,441,31057008,0x827922686190790b37229fd06084350E74485b72,15452452,12053179227,456229,146014
0xdc98dbffcc648d6088a2ff8f7dc01aef050e58fc,0xecf3242642b99763e785116c4794e3e84a0a61c627f3889b3808a53496633675,02-01-2025,2025-01-02 11:53:05.000 UTC,379,24514719,0x827922686190790b37229fd06084350E74485b72,4974339,2765258977748760125039,482486191938100615619,362573034108063804
0x9eb86e93a809a41ab0e7cc0ba6f62561fda3015c,0x7b45ff7dc1c896d52f440a7ea47299f1e1bd5621110e551d91e4da5c66d8fb01,24-01-2025,2025-01-24 03:40:17.000 UTC,270,25450335,0x827922686190790b37229fd06084350E74485b72,6080650,2917852519175671413564,182161731559460628,34224564542976135256666
0x38f6d2d9ea493c3c6ee865b5b952b5fe9e3e61fc,0xae8e4d82c67610ddfc7bf02926e8058695ca33ae447560d141de01fea25d884d,09-07-2025,2025-07-09 01:03:39.000 UTC,233,32616836,0x46A15B0b27311cedF172AB29E4f4766fbE7F4364,432033,11866095556,470413,122658
0x8810de2baa17067ddcfbd9e8f29c55f070a55f0b,0xf2d755430774324532ea57d6bd1612fed937335ec3516589cefcd3f5d1fb010b,26-03-2025,2025-03-26 16:17:39.000 UTC,420,28108256,0x03a520b32C04BF3bEEf7BEb72E919cf822Ed34f1,2655761,271632006043807779466,362550546859832,7260098902757008297819
0x0b27b59171a4ffe19f23d54126cd797be17c6551,0x6e26cf4565f74721f58321215d65677d6b76e6cecc5aec894e792a66a93268dc,22-07-2025,2025-07-22 00:30:05.000 UTC,442,33177429,0x03a520b32C04BF3bEEf7BEb72E919cf822Ed34f1,3581540,2948853520689892061864,100303897274621264,52753498310932958776459
0x351f61e4c49cf11f24d9f2e737ca5eff81806355,0xc51776616cb5a919efd8afa740946ade856c2d305ef8797b83725473c9d88a33,22-08-2025,2025-08-22 19:16:03.000 UTC,659,34550408,0x827922686190790b37229fd06084350E74485b72,23232492,747085908637488204,53070816,324084268713873843792901
0x2791dc5e14f7680d9d969acc26059ba56403b6d5,0x3e9621e8b769c06d19096288b252d1622296acc2f94d77ac52aebc234bf964d4,12-12-2024,2024-12-12 15:56:19.000 UTC,452,23614816,0x827922686190790b37229fd06084350E74485b72,3882262,24954687314026677815,5844101407219002801,8092686472231048
0x9eb86e93a809a41ab0e7cc0ba6f62561fda3015c,0x1313addad83c1753bbee78f5ea9c6a426ec81349cd81f90af98c5ae849bf73ce,21-12-2024,2024-12-21 14:47:09.000 UTC,390,24001541,0x827922686190790b37229fd06084350E74485b72,4388674,1059703487355132436182,435503947455381248987,540507715426841039
0xdc98dbffcc648d6088a2ff8f7dc01aef050e58fc,0x9acd5192f0052c9cf70ce6fc28c67ca1ef9b1c4a79cf98c4cf1bdf808ff06ece,03-06-2025,2025-06-03 13:29:55.000 UTC,414,31084024,0x827922686190790b37229fd06084350E74485b72,15505606,11794847762,435129,154431
0x8fd1b615c006ebeb8a7cfb00a1dd809f31943b08,0x90bcdbce25d39bb24fd19e33e1f0a1ca849abbbd20700e2ff22fa926f464edcc,20-12-2024,2024-12-20 17:58:49.000 UTC,308,23964091,0x827922686190790b37229fd06084350E74485b72,4337509,2684501924623304432286,2567965452808498728944,2419201234781381281
0x8fd1b615c006ebeb8a7cfb00a1dd809f31943b08,0x707de9775b6d5b4ca78d7a0130e1fc61f2857c1feb6cb2ec08b0b6b46a36ba35,01-01-2025,2025-01-01 14:39:23.000 UTC,339,24476508,0x827922686190790b37229fd06084350E74485b72,4929256,7467457283531348873546,711500293570462583692,4212645256626692154
0x9eb86e93a809a41ab0e7cc0ba6f62561fda3015c,0xb941a39202a37ef91821132e0458c8b5d49c8c1d71173a4fb3cb40e6f1c872ac,04-03-2025,2025-03-04 17:51:27.000 UTC,343,27160670,0x827922686190790b37229fd06084350E74485b72,8425449,2304212194,304515905,36638
0xdc98dbffcc648d6088a2ff8f7dc01aef050e58fc,0x414349db86cc95985ca30893ff49548ba788fddbfadb63c579fe83a7af29af2c,28-05-2025,2025-05-28 17:14:09.000 UTC,519,30831551,0x46A15B0b27311cedF172AB29E4f4766fbE7F4364,389429,12303117144504333752025,559620979301665499,29553890918232405
0x8508fd4238162cb3f3d485f432202af3b40f164e,0x52f5487f9b1cd07ca578ab4240fd3895a8beba05473c4d2cfa412358fa87c4c6,04-06-2025,2025-06-04 18:47:29.000 UTC,634,31136751,0x827922686190790b37229fd06084350E74485b72,15608603,184828255528254955840,84370614151762887,157327538320580836496
0x8508fd4238162cb3f3d485f432202af3b40f164e,0x126521a8fe8369b885b8136f7caee07a4841db4ba332763086e587d908e45290,09-03-2025,2025-03-09 06:13:23.000 UTC,480,27355728,0x03a520b32C04BF3bEEf7BEb72E919cf822Ed34f1,2263491,68158318409448452861,109478997699911839852,37048553118126399
0x8fd1b615c006ebeb8a7cfb00a1dd809f31943b08,0x6b59edbad0376be747fb5801f98ef6f61f9748bbad0a63bbe5c43d624c712d7d,09-05-2025,2025-05-09 11:55:53.000 UTC,694,30001203,0x827922686190790b37229fd06084350E74485b72,13222658,734649649239877993,2111658485,385607752680669306210780
0xdc98dbffcc648d6088a2ff8f7dc01aef050e58fc,0x23e21fcd21f6e3c1cf4bd9568d36714a06d9a0b3b98d01dc8590fdea4f210265,09-04-2025,2025-04-09 14:41:25.000 UTC,359,28710169,0x827922686190790b37229fd06084350E74485b72,10811322,6652807421905893,17382117,1079347420033058493067
0xdc98dbffcc648d6088a2ff8f7dc01aef050e58fc,0x247865957b1dd7f2af11d48621a0878af22ab870a9afe39aef3348d6c94bda39,03-06-2025,2025-06-03 12:39:21.000 UTC,4473,31082507,0x827922686190790b37229fd06084350E74485b72,15502704,11834432651,132522,459419
0x2791dc5e14f7680d9d969acc26059ba56403b6d5,0x7b07a8b4b039f0721468178f3fc5c3b6dc9c58a965a6dec1bd6a6819565ddd67,19-12-2024,2024-12-19 03:36:53.000 UTC,357,23895033,0x827922686190790b37229fd06084350E74485b72,4248345,1683987716254539493066,1024657807803530698366,609659241546305695
0x9eb86e93a809a41ab0e7cc0ba6f62561fda3015c,0x8dd86b350a68e30c77cfb7dc5a7ac5ef15bdb0be10ed821e3be2f70c71a9d7b9,02-01-2025,2025-01-02 13:36:27.000 UTC,335,24517820,0x827922686190790b37229fd06084350E74485b72,4978193,3030773926451112184956,616292581511595368135,279985705360376627
0x2791dc5e14f7680d9d969acc26059ba56403b6d5,0xe7e688ba9b35b5536541f156abebf25a7654ff5a3d783d5dff370d82cd31f645,11-01-2025,2025-01-11 22:25:21.000 UTC,653,24922487,0x827922686190790b37229fd06084350E74485b72,5420752,1797584464197875291875,355988552997492359168,215162754196125086
0x38f6d2d9ea493c3c6ee865b5b952b5fe9e3e61fc,0x93dd76e7273e0ffa2f6cdce8d3dfef26595e96b243bac526de0fe1e2564fa3ca,08-01-2025,2025-01-08 19:07:57.000 UTC,384,24786965,0x827922686190790b37229fd06084350E74485b72,5259673,1468022991681840575502316,257261302807170643861,61405440978348780027904
0x2791dc5e14f7680d9d969acc26059ba56403b6d5,0xfd44fc6d6b2e59f460b472836c88cdfe4372cc64d9f84a9b10841bd43eae270b,05-01-2025,2025-01-05 05:18:13.000 UTC,550,24632473,0x827922686190790b37229fd06084350E74485b72,5095205,2499139990440150310470,87009130960229847274,752451125709207175
0x8810de2baa17067ddcfbd9e8f29c55f070a55f0b,0xe24b47664c892bf63d3de6c047c5af9c35c3fdf0053023e1a65d0813253b6534,11-05-2025,2025-05-11 05:58:29.000 UTC,72,30076881,0x827922686190790b37229fd06084350E74485b72,13374290,466717349474985,151863034651970643745,2188434
0x8810de2baa17067ddcfbd9e8f29c55f070a55f0b,0x988b3c4d896f22fa1ddc06554a1ee5de3b86d8f97e065e6ac2e3acea0ab93ec4,15-05-2025,2025-05-15 11:35:37.000 UTC,346,30259795,0x03a520b32C04BF3bEEf7BEb72E919cf822Ed34f1,3032101,4694649428854899246280,77184843795743057,135723344654017070254371
0xdc98dbffcc648d6088a2ff8f7dc01aef050e58fc,0x51fdf00567bffa30669c3b81fe0477711f7dd5053d7d5011000e909e7a37debc,31-12-2024,2024-12-31 04:23:11.000 UTC,876,24414822,0x827922686190790b37229fd06084350E74485b72,4770214,3022585909330739084,3360208052053043446,2265296099743928
0x8508fd4238162cb3f3d485f432202af3b40f164e,0x32b74b696cf8fc3ea5a1df22db843168e06446e2837fd6158db7f09511593991,03-06-2025,2025-06-03 15:30:13.000 UTC,645,31087633,0x827922686190790b37229fd06084350E74485b72,15513192,13478662113,348956,324915
0xdc98dbffcc648d6088a2ff8f7dc01aef050e58fc,0x7038fcc7be626eceb13f7b4d92342568056e3aa30c9a905f3bd8847ea4be3c39,14-07-2025,2025-07-14 08:20:01.000 UTC,122,32845927,0x46A15B0b27311cedF172AB29E4f4766fbE7F4364,440245,15176816166,613742,144762
0x8810de2baa17067ddcfbd9e8f29c55f070a55f0b,0xe4d229afbf87d36f054d519b112d5ef76761bfefed846c69582cd48001084469,12-03-2025,2025-03-12 14:01:47.000 UTC,324,27499380,0x827922686190790b37229fd06084350E74485b72,8914701,180911074744693906,109721681,82161083864138772784841
0x8508fd4238162cb3f3d485f432202af3b40f164e,0x674dc2e97f9ff27ba23c08b7397b9bd55afd8b756903cac982541df386d69e69,13-04-2025,2025-04-13 22:19:21.000 UTC,184,28896707,0x827922686190790b37229fd06084350E74485b72,11118713,137680979467514,15914617721743424572,22648
0x095d0de0ecfd6832f1a7961ae26d285d68655d60,0xc0f6509ccbd706d25d2af995e6f1c1d93853286a93d2406d357d8d71f1665bd0,19-05-2025,2025-05-19 05:14:01.000 UTC,45,30421147,0x03a520b32C04BF3bEEf7BEb72E919cf822Ed34f1,3023231,14194701969861082515,31424670701058817,32857206961010604995
0x351f61e4c49cf11f24d9f2e737ca5eff81806355,0xaa17e23cb5a3b7227d34690c466cda871e02fbd39e02207d92c0f1d08c9aba85,02-09-2025,2025-09-02 02:42:35.000 UTC,502,34995804,0x827922686190790b37229fd06084350E74485b72,24354595,359092080578978588,88505951,171107146182638577864255
0x38f6d2d9ea493c3c6ee865b5b952b5fe9e3e61fc,0x9af054a814310b6401535f60a8241d039890cb156849b71a50db1738d65ee207,01-06-2025,2025-06-01 01:53:07.000 UTC,853,30976720,0x827922686190790b37229fd06084350E74485b72,15286053,25183909589,1177333,80177
0x8fd1b615c006ebeb8a7cfb00a1dd809f31943b08,0x7f1e32f1a1d161abbb838fc31fdb71550519d99de9a90bffe1a40dd175214c2d,01-01-2025,2025-01-01 03:32:05.000 UTC,339,24456489,0x827922686190790b37229fd06084350E74485b72,4893127,6814572066768654285,5678764938500357306,7139232709312711
0x2791dc5e14f7680d9d969acc26059ba56403b6d5,0x5b572eb67fc244e62f87a2c3b9e9ed0942c95438104c81e860c830dcdc5141a2,14-01-2025,2025-01-14 08:56:49.000 UTC,299,25027831,0x827922686190790b37229fd06084350E74485b72,5539267,1415072285959857142192,463761819360554376117,18053037127958290
0x8508fd4238162cb3f3d485f432202af3b40f164e,0xbf0734f5ea622965630e45480d4c22ad50d9575f330c5900803f1fe76f3daa3b,25-03-2025,2025-03-25 19:34:05.000 UTC,342,28070949,0x03a520b32C04BF3bEEf7BEb72E919cf822Ed34f1,2640215,6799676849534398522969,373806689451490752,75136428478759396823414
0x38f6d2d9ea493c3c6ee865b5b952b5fe9e3e61fc,0x429181d466158616474acc3c43098a822da04a15cc3ee6c78e00aee9fe8e1b68,02-01-2025,2025-01-02 02:11:19.000 UTC,794,24497266,0x827922686190790b37229fd06084350E74485b72,4953820,1437496126524269530572947,887897071484028320461,47731853083914999429417
0x8fd1b615c006ebeb8a7cfb00a1dd809f31943b08,0x368f975ce6a9ad960c61d9f15162e58468e63682bf3aca3ad229cef3a0b1ac92,05-01-2025,2025-01-05 17:49:55.000 UTC,438,24655024,0x827922686190790b37229fd06084350E74485b72,5114823,24112543080461239919563,623223842518149939,22389143809870967858064
0x8fd1b615c006ebeb8a7cfb00a1dd809f31943b08,0xbd42dd174c4d6a983f5390090093b2e5dd884db74b9195c489932ad94a960266,26-12-2024,2024-12-26 20:51:49.000 UTC,360,24228481,0x827922686190790b37229fd06084350E74485b72,4639903,5594655845303363055,1800631349630987047,8147204485312183
0x8fd1b615c006ebeb8a7cfb00a1dd809f31943b08,0x5deeb7c41b2c10691ab09e298931aa7a2c493c4ee0440fe8c9ad446912148f2e,09-01-2025,2025-01-09 09:18:25.000 UTC,429,24812479,0x827922686190790b37229fd06084350E74485b72,5291949,3386177477245583430931,917330010170783605686,1214880749510632558
0x2791dc5e14f7680d9d969acc26059ba56403b6d5,0xf4e49ee966f3f1a6d1d29cd8621839449ebcadb4b82926279eb492a1b37fa844,12-01-2025,2025-01-12 04:48:15.000 UTC,218,24933974,0x827922686190790b37229fd06084350E74485b72,5432431,17223410694309155653788,715689460396725786,2541396808946403012233
0xdc98dbffcc648d6088a2ff8f7dc01aef050e58fc,0xb2393d528f9c06cb78ef5e2299d66edb116ec6ad28ec4c8b89bcfd82c4302f2d,31-05-2025,2025-05-31 01:13:57.000 UTC,499,30932345,0x46A15B0b27311cedF172AB29E4f4766fbE7F4364,391437,12098135682404004488495,101614483676870027,522790876720180785
0x351f61e4c49cf11f24d9f2e737ca5eff81806355,0x0a124b4a4643df26a7c10acc0d363ba7e6909506d3a4049547e3f85aa62481cf,18-11-2025,2025-11-18 02:46:37.000 UTC,841,38322325,0x827922686190790b37229fd06084350E74485b72,32127104,104346420364403434,94979072,91302318029590720228060
0x2791dc5e14f7680d9d969acc26059ba56403b6d5,0xaaca469830c41c644da2ca5a74ef7fbfec42e9df2170b5321aedfa7488c610ae,13-01-2025,2025-01-13 08:26:05.000 UTC,535,24983709,0x827922686190790b37229fd06084350E74485b72,5487390,1598039451996388689805,238306941157568033125,258825230447406744
0x8508fd4238162cb3f3d485f432202af3b40f164e,0xb15f00ae344f900de39ea1eff771bc7b1424a66feef6075ca1650a6a447ebb8e,27-03-2025,2025-03-27 17:53:35.000 UTC,544,28154334,0x827922686190790b37229fd06084350E74485b72,9922900,411427163828879,15734918233630159075,90488
0x351f61e4c49cf11f24d9f2e737ca5eff81806355,0x510038f64c148a93bc243a581c2b638085ee255ce87064c752fd26d47ba8ba1f,27-11-2025,2025-11-27 20:32:21.000 UTC,148,38743097,0x827922686190790b37229fd06084350E74485b72,33247964,74064650952277330,66870517,68106363556479655669524
0x9eb86e93a809a41ab0e7cc0ba6f62561fda3015c,0x685c61bd358085834aee750abb9d568029d8f3e6f2ad683b3f03eb049ac8bb44,13-02-2025,2025-02-13 21:06:21.000 UTC,250,26345717,0x827922686190790b37229fd06084350E74485b72,7271932,6235830344,126439054,871112
0x38f6d2d9ea493c3c6ee865b5b952b5fe9e3e61fc,0x4af59f0eb71690435fd76eff4f4192b6aae0ca42db1bc328b139a6778470e143,10-06-2025,2025-06-10 01:25:59.000 UTC,362,31364706,0x46A15B0b27311cedF172AB29E4f4766fbE7F4364,401103,5445055829,178138,94008
0x38f6d2d9ea493c3c6ee865b5b952b5fe9e3e61fc,0x40444c74ebb5bae11bdd6fced781a57caa252f928d7618109c002f17dbdc6f7a,18-01-2025,2025-01-18 21:04:17.000 UTC,564,25222455,0x827922686190790b37229fd06084350E74485b72,5804066,13433856462323353781711,509730813269886528,34997204719098965845560
0x9eb86e93a809a41ab0e7cc0ba6f62561fda3015c,0x5ea58519003fb246a7dc2d03234f380e8b4c91ec5af1e89fa500d54cbf4592f0,30-01-2025,2025-01-30 01:24:49.000 UTC,599,25705471,0x827922686190790b37229fd06084350E74485b72,6389715,2424528423102526687718,129004557916440278,32604810004166816966315
0x2791dc5e14f7680d9d969acc26059ba56403b6d5,0xcb5f6ccdf8788657fc0f77589358c89e7d3086bcf3f24ea95ae744dd7037dd68,14-01-2025,2025-01-14 07:15:59.000 UTC,270,25024806,0x827922686190790b37229fd06084350E74485b72,5535603,1445644620433553246193,440860720454620094740,46207270703227655
0x2791dc5e14f7680d9d969acc26059ba56403b6d5,0xf2af7a94567b026a7ecff74f9ce014785a82688a0138f4bbba409e209e9e166f,12-12-2024,2024-12-12 18:49:59.000 UTC,450,23620026,0x827922686190790b37229fd06084350E74485b72,3904154,21972226413910892827,7081554496769451400,6214488350503941
0x8810de2baa17067ddcfbd9e8f29c55f070a55f0b,0x33f95ecf85cc65b7f191d3bf837c7763dc13af2c3da31b8a9b73b1d29bb4f2a3,15-06-2025,2025-06-15 09:15:35.000 UTC,1230,31594794,0x03a520b32C04BF3bEEf7BEb72E919cf822Ed34f1,3282756,24681273118602880,844203735,630099982994849186650
0x9eb86e93a809a41ab0e7cc0ba6f62561fda3015c,0xb712b2bae84792daf9c24ae7f05df84adbcc2097618a72b6db916fc44506b4b5,21-12-2024,2024-12-21 20:24:59.000 UTC,183,24011676,0x827922686190790b37229fd06084350E74485b72,4402924,1033687640833075688109,400199431249626335296,546325620254604432
0x38f6d2d9ea493c3c6ee865b5b952b5fe9e3e61fc,0xfb865ed0212b0bb7938431ce13d0c6fa8dada9cc914631888b17af3e584dbf0d,31-05-2025,2025-05-31 00:32:53.000 UTC,525,30931113,0x827922686190790b37229fd06084350E74485b72,15190653,25364313886,345225,923681
0x2791dc5e14f7680d9d969acc26059ba56403b6d5,0x73dfcafd71d7fd7818b464aa1a6828528e1b4143bd9a4869f4b55abd29300e4a,31-12-2024,2024-12-31 17:26:55.000 UTC,403,24438334,0x827922686190790b37229fd06084350E74485b72,4893140,1293730905877702878132,632790615683596344195,573745936231114859
0x2791dc5e14f7680d9d969acc26059ba56403b6d5,0x3d5f8f113fc63d96b15c692995afab5f4b30d09405ec350d1807792ad020304a,02-01-2025,2025-01-02 01:10:49.000 UTC,354,24495451,0x827922686190790b37229fd06084350E74485b72,4951281,1199546220574865551364,384071127773302439799,801795651312970297
0x351f61e4c49cf11f24d9f2e737ca5eff81806355,0xb0c408670556ada566f06754d6cf80e4c29b88de16e5b987166c116f8cc30a37,23-08-2025,2025-08-23 08:48:37.000 UTC,650,34574785,0x827922686190790b37229fd06084350E74485b72,23299834,664344178058444710,53563526,306539408591672822335961
0x0b27b59171a4ffe19f23d54126cd797be17c6551,0xd25f27115534f13731c29141f7e0cc54e6bac89dabdc3d48804f26be40ec35ae,31-08-2025,2025-08-31 21:55:49.000 UTC,105,34944001,0x03a520b32C04BF3bEEf7BEb72E919cf822Ed34f1,3836008,713837130911640148435,12938021257892099,23921455653967274117982
0x095d0de0ecfd6832f1a7961ae26d285d68655d60,0x5aad7c749833d6d31252c76f857cdb8e13cf64c75252a91a71f0d6784a510dc1,10-07-2025,2025-07-10 11:43:25.000 UTC,1125,32679229,0x03a520b32C04BF3bEEf7BEb72E919cf822Ed34f1,3502855,2525691767144604468563,18798732569091146,145771659303719171771268
0x8fd1b615c006ebeb8a7cfb00a1dd809f31943b08,0x04e7471a3a8f748bbeeb1cfb940aec0c1f64541735aadb33fb1cec0ac17ba6fc,02-01-2025,2025-01-02 01:57:07.000 UTC,361,24496840,0x827922686190790b37229fd06084350E74485b72,4953213,11003544408445919097186,381051237201745472,3389104622528730669994
0x8508fd4238162cb3f3d485f432202af3b40f164e,0x4814e64068f7182f9309b0d70acc2638e11912efd24000af47979e074099b820,31-05-2025,2025-05-31 11:53:37.000 UTC,693,30951535,0x827922686190790b37229fd06084350E74485b72,15234908,14872780516,9500,735498
0x095d0de0ecfd6832f1a7961ae26d285d68655d60,0x0709e68cebfda71a359ee6cd103dad4cf8de5f593f507c3f85f65be83ad34597,11-05-2025,2025-05-11 05:03:27.000 UTC,132,30075230,0x827922686190790b37229fd06084350E74485b72,13354281,231644534578507338918544,350000000000000000000,94928750475995588253514
0x8508fd4238162cb3f3d485f432202af3b40f164e,0x973037a55b56fc5f21509e3937067b596be8a649e1a25537c6da8747105109b2,14-07-2025,2025-07-14 11:36:47.000 UTC,286,32851830,0x03a520b32C04BF3bEEf7BEb72E919cf822Ed34f1,3523360,176101566330740136489,68719847934436225,173679099787913963763
0x095d0de0ecfd6832f1a7961ae26d285d68655d60,0xe4450779f037e6a39852430aed36a225acd47d7a8bc453f45ce2a801401f4c54,25-03-2025,2025-03-25 10:59:15.000 UTC,592,28055504,0x827922686190790b37229fd06084350E74485b72,9753477,287720833491083762380745,42208599102031204282,122685383943289275678720
0x8fd1b615c006ebeb8a7cfb00a1dd809f31943b08,0x6239d71892ed8aff4ad675a0c114a47385252f900055cfee73110219f0e69070,02-01-2025,2025-01-02 15:33:55.000 UTC,441,24521344,0x827922686190790b37229fd06084350E74485b72,4982358,5995965831927353948861,348450758089252212127,3872193609168607570
0xdc98dbffcc648d6088a2ff8f7dc01aef050e58fc,0x28f090252b6c0e68373e8fa761aa39e0847de0b81d1a5c8475e943f7ff4d710a,08-01-2025,2025-01-08 20:15:39.000 UTC,590,24788996,0x827922686190790b37229fd06084350E74485b72,5262364,23944725494649188458308,331656768995539066,37537222742250463690752
0x9eb86e93a809a41ab0e7cc0ba6f62561fda3015c,0xc9fc207227df3643edf5d6a057ac9903e199111ddb6ccf7de6278e004eecb7d3,01-01-2025,2025-01-01 09:42:25.000 UTC,335,24467599,0x827922686190790b37229fd06084350E74485b72,4921380,4453065767483968300811,397592825687144553,1098855095390248197350
0x2791dc5e14f7680d9d969acc26059ba56403b6d5,0x16c07038db2cbbc0acc1cbde61286696f8e9fc1423cf271d986b23f9ca9971a9,12-01-2025,2025-01-12 03:38:39.000 UTC,239,24931886,0x827922686190790b37229fd06084350E74485b72,5430662,1783598313218900800332,86972589786704254506,452997860258187457
0x9eb86e93a809a41ab0e7cc0ba6f62561fda3015c,0x6e0c19f2f3503f5ed14e87b4e0e69833a94b195558164223eb8ff3283bcd3dcd,17-12-2024,2024-12-17 16:47:05.000 UTC,347,23832339,0x827922686190790b37229fd06084350E74485b72,4161857,1426804869045827594951,694362917443110358319,632773735367280891
0xdc98dbffcc648d6088a2ff8f7dc01aef050e58fc,0xe3c3d4ac0c502e1360ae623b602697342956a479fc897b5b74b4c69d4396280f,22-01-2025,2025-01-22 19:10:37.000 UTC,595,25391845,0x03a520b32C04BF3bEEf7BEb72E919cf822Ed34f1,1902190,12812044700966482105130,1346947555963184972,106199659517475423629904
0x38f6d2d9ea493c3c6ee865b5b952b5fe9e3e61fc,0x0e85dc980c0814f2112d6838342cd2e456521a9b364a8f83bea34743193e374b,01-07-2025,2025-07-01 03:23:51.000 UTC,400,32275442,0x46A15B0b27311cedF172AB29E4f4766fbE7F4364,422496,12139795185,147006,460097
0x2791dc5e14f7680d9d969acc26059ba56403b6d5,0xa37006559853388161badfad451a02d387cd6b000e3fa2fb4aa9aa8199feaf9e,10-01-2025,2025-01-10 07:35:05.000 UTC,147,24852579,0x827922686190790b37229fd06084350E74485b72,5342632,442335903624373285,1119748291,17287763074655816841800
0x9eb86e93a809a41ab0e7cc0ba6f62561fda3015c,0x640bc23e4ef1bf449200c7586bc3ecb9368a3afda8c57786ef151d6d6baa0a38,03-01-2025,2025-01-03 20:18:23.000 UTC,374,24573078,0x827922686190790b37229fd06084350E74485b72,5039291,2443991494043819116333,264531069122251628964,524599095404827830
0xdc98dbffcc648d6088a2ff8f7dc01aef050e58fc,0x060e66f2c56d09294217cf041b29cd70ee358c8b289be69986c9525d20c0882b,13-01-2025,2025-01-13 13:58:13.000 UTC,337,24993673,0x827922686190790b37229fd06084350E74485b72,5500414,19190381753052053049957,776648441865709056,1975091652590451047396
0x9eb86e93a809a41ab0e7cc0ba6f62561fda3015c,0x715033d3e5d09206ae63f4205581eab1cbd7e868d6ee9f99a97afe0d7085fae5,02-01-2025,2025-01-02 17:12:13.000 UTC,564,24524293,0x827922686190790b37229fd06084350E74485b72,4986743,676380406145468679409113,77723992210129314554,32321909015240274339350
0xdc98dbffcc648d6088a2ff8f7dc01aef050e58fc,0x7a4c465c897fcfc6c1a0cb3aef4d3e5a54423296b6c4192116b45841a15cac51,11-01-2025,2025-01-11 03:00:03.000 UTC,301,24887528,0x827922686190790b37229fd06084350E74485b72,5382983,1319644658166134209262,427869127928419674499,2360451846122525
0x9eb86e93a809a41ab0e7cc0ba6f62561fda3015c,0xbb677bb3e3c6745b5f58a76eaa72be23a1100d290a88f592d43ce28d3e2fc045,30-12-2024,2024-12-30 14:09:47.000 UTC,321,24389220,0x827922686190790b37229fd06084350E74485b72,4830876,606182648819168717038,231535177929487533180,339270608685991671
0x8810de2baa17067ddcfbd9e8f29c55f070a55f0b,0xb10e34d4777066de551499c1e352159a723836412ee7e868c84960892a969127,01-06-2025,2025-06-01 05:29:49.000 UTC,141,30983221,0x03a520b32C04BF3bEEf7BEb72E919cf822Ed34f1,3137195,8090986374256630,176803266,252410152184833965876
0x9eb86e93a809a41ab0e7cc0ba6f62561fda3015c,0x732040538cb46ae2c70e00e381b915f0b1c4baa244ec0f064f92e6c32ec23cce,28-02-2025,2025-02-28 11:30:43.000 UTC,169,26976448,0x827922686190790b37229fd06084350E74485b72,8157400,3352214396,62179622,512311
0x9eb86e93a809a41ab0e7cc0ba6f62561fda3015c,0xeaad27d4c4c172062ab3c0c86297ce51e7706cbf5e71bf0ebebed06e8ad92d34,04-03-2025,2025-03-04 16:19:03.000 UTC,293,27157898,0x827922686190790b37229fd06084350E74485b72,8421048,2339445892,244872548,109942
0x9eb86e93a809a41ab0e7cc0ba6f62561fda3015c,0xf5bf25219fd6c39b07a63137f829b81c87c4a5dc455ad68ceae1faabb31ea7af,02-01-2025,2025-01-02 01:42:31.000 UTC,354,24496402,0x827922686190790b37229fd06084350E74485b72,4952709,3057721839749344678140,2638858403443821,2272083295365015925518
0x2791dc5e14f7680d9d969acc26059ba56403b6d5,0x22e5c3a6cb17c4f6bb25c613d0116f449c58269d7079ac0b8b35be75daafddbb,08-01-2025,2025-01-08 19:06:25.000 UTC,574,24786919,0x827922686190790b37229fd06084350E74485b72,5259638,1760318993604980274884935,308484240517380045979,73631792333878915499772
0xdc98dbffcc648d6088a2ff8f7dc01aef050e58fc,0xf003e59fd1df370a9d9bb19a0d0515f3de9fade3cb2e97900fe843d97de666be,06-01-2025,2025-01-06 01:30:39.000 UTC,412,24668846,0x827922686190790b37229fd06084350E74485b72,5109265,21765453852592868984,3493643436128788751,3356801681779882
0x095d0de0ecfd6832f1a7961ae26d285d68655d60,0xb279f3f291954d58450b057ca4c4c8737d87e3ea66bb671dc90c5cf8bdf5bcb5,15-05-2025,2025-05-15 04:57:49.000 UTC,1150,30247861,0x03a520b32C04BF3bEEf7BEb72E919cf822Ed34f1,3030679,6952281998104754214613,121157300543784752,225898321650986880405973
0xdc98dbffcc648d6088a2ff8f7dc01aef050e58fc,0x42e08eac6e64cce97d063bd1a13837a99291a8c272c49e193f7f3c037821e179,21-06-2025,2025-06-21 17:16:23.000 UTC,538,31868418,0x46A15B0b27311cedF172AB29E4f4766fbE7F4364,412805,11037003747781798425209,476223279299671459,54406909540828879
0x095d0de0ecfd6832f1a7961ae26d285d68655d60,0x0380329e1d5fc5b4fcf801b5cd2c6ce2ffdd8642743f6e931eaf00426b32863f,24-02-2025,2025-02-24 21:38:35.000 UTC,302,26821884,0x03a520b32C04BF3bEEf7BEb72E919cf822Ed34f1,2152293,13572132204865916889223,285994308073556516,329514967867184519307945
0x38f6d2d9ea493c3c6ee865b5b952b5fe9e3e61fc,0x72364399e10610d85cb0cc5114adcdcf02c41770ef0b7359ddcfc9deacc41628,30-05-2025,2025-05-30 12:40:13.000 UTC,697,30909733,0x827922686190790b37229fd06084350E74485b72,15142760,26583058300,391975,937793
0x8810de2baa17067ddcfbd9e8f29c55f070a55f0b,0x22e7f25a43851998b5c081b0a66483837f8c49abb53adff2cfce86dedd92e1c8,21-07-2025,2025-07-21 05:23:41.000 UTC,175,33143037,0x03a520b32C04BF3bEEf7BEb72E919cf822Ed34f1,3575951,3314497453947313125152,91743483916876087,72232015836435255161018
0xdc98dbffcc648d6088a2ff8f7dc01aef050e58fc,0x98a93b63e7dcd9d83b5b3a61b023695662d1b2985e162a433406bcdffbe31da4,05-06-2025,2025-06-05 07:36:47.000 UTC,558,31159830,0x827922686190790b37229fd06084350E74485b72,15653856,11363483537,408093,159917
0x2791dc5e14f7680d9d969acc26059ba56403b6d5,0x5bebc2eb0654a17fea1a2ec0a7672cbdecc352efbd525bb345d17fdccbd467d7,13-01-2025,2025-01-13 17:43:29.000 UTC,466,25000431,0x827922686190790b37229fd06084350E74485b72,5507158,16202690729178058735710,478682885249691433,11629650275972610240195
0x9eb86e93a809a41ab0e7cc0ba6f62561fda3015c,0x65ca6238b627d5469fd5b3c638848663c8154352e71e0901c37c11785086741e,10-01-2025,2025-01-10 02:57:15.000 UTC,327,24844244,0x827922686190790b37229fd06084350E74485b72,5332753,948357027366637797821,214557371986366481728,84838746078854468
0x9eb86e93a809a41ab0e7cc0ba6f62561fda3015c,0x74a2faefb264f7e63367c88634f5338668f1bc209ca226dcc6654a68f5d8640a,02-02-2025,2025-02-02 07:45:05.000 UTC,408,25846479,0x827922686190790b37229fd06084350E74485b72,6582670,56772649229217664,303194107,16171897689055307367900
0x2791dc5e14f7680d9d969acc26059ba56403b6d5,0x697d965f4dd62a6253f87a51db721bc81673194970d83a582966e5409f76e9c7,10-01-2025,2025-01-10 21:32:35.000 UTC,300,24877704,0x827922686190790b37229fd06084350E74485b72,5373836,1992477392275308627622,629706099631148959734,7050383661713952
0xdc98dbffcc648d6088a2ff8f7dc01aef050e58fc,0xdafd083ba0f359f3f0e5a941700ef26360bfb4aa0f3c288623324a2d1706ff31,09-01-2025,2025-01-09 16:27:53.000 UTC,875,24825363,0x827922686190790b37229fd06084350E74485b72,5309879,531936763826334897,260387173,36884200006425819328601
0x8508fd4238162cb3f3d485f432202af3b40f164e,0xf91728b0c38a1a26a0daadf0309dea445c9f922531eef790fb9b676bcf8a2dca,24-04-2025,2025-04-24 23:17:45.000 UTC,199,29373659,0x827922686190790b37229fd06084350E74485b72,11939346,85138950040728,23710257889691197380,6500
0xdc98dbffcc648d6088a2ff8f7dc01aef050e58fc,0x317287beee41eb994ac9db3defe589564d82e73061a19e88f6d7c105ab4b0b03,11-07-2025,2025-07-11 06:19:19.000 UTC,797,32712706,0x46A15B0b27311cedF172AB29E4f4766fbE7F4364,435300,15217457673,336679,424210
0x38f6d2d9ea493c3c6ee865b5b952b5fe9e3e61fc,0x739ca8427a893572ddce1f64e183f503ee53d974120abb893e810ec98cbcadc2,02-02-2025,2025-02-02 16:00:53.000 UTC,371,25861353,0x827922686190790b37229fd06084350E74485b72,6603225,319974035464705544,1675834817,93259065413083263686172
0x9eb86e93a809a41ab0e7cc0ba6f62561fda3015c,0xf16c19ce63c92272b86a1e4c09bd5c9a5094ad5ff40a1f0d610bb0fa87ad8272,24-01-2025,2025-01-24 04:06:47.000 UTC,275,25451130,0x827922686190790b37229fd06084350E74485b72,6080650,186915382125292990896,11334110406701657,2219587119650286722130
0xdc98dbffcc648d6088a2ff8f7dc01aef050e58fc,0x2dcf7187fbe33e8e0b7e113cfe789f04e59fc8002ca35b9acccdc435012bd193,31-05-2025,2025-05-31 15:43:57.000 UTC,961,30958445,0x46A15B0b27311cedF172AB29E4f4766fbE7F4364,391943,12066364433334973419222,324594807688210747,275654066288727615
0x38f6d2d9ea493c3c6ee865b5b952b5fe9e3e61fc,0x3b5d1dbfea7504c36152f0525bf24cf3c3e8675493794ab62a6d067658c254ad,03-06-2025,2025-06-03 11:13:03.000 UTC,1057,31079918,0x827922686190790b37229fd06084350E74485b72,15498189,29774928145,526860,962197
0x8fd1b615c006ebeb8a7cfb00a1dd809f31943b08,0x58d134891cea2ede49324105cc72a46ac14e738281be7d93e37dc22586cb7326,10-01-2025,2025-01-10 11:32:55.000 UTC,532,24859714,0x827922686190790b37229fd06084350E74485b72,5351475,3052574232811954200440,598471547970445448464,1326707252799384277
0xdc98dbffcc648d6088a2ff8f7dc01aef050e58fc,0x8ef8cee246f79e01c0dc4265c0e1e64038aa379ba44f6039e9aabd7f3771fcd1,15-01-2025,2025-01-15 16:50:03.000 UTC,434,25085228,0x827922686190790b37229fd06084350E74485b72,5611982,370195340186127964875,185407455783164817064,281314683684427835
0x38f6d2d9ea493c3c6ee865b5b952b5fe9e3e61fc,0xa52df2d55b526558bf6f53228ec960f058e91394ca0ad41c66a6fca1dc2e97b4,08-01-2025,2025-01-08 21:15:43.000 UTC,418,24790798,0x827922686190790b37229fd06084350E74485b72,5264968,1451061278511212370356,111023080476267613426,353819203237470063
0x2791dc5e14f7680d9d969acc26059ba56403b6d5,0x5f456ae03b053be1820d1c75bc79d03afc2e359585da0d0f001bbf5f3c2f7df6,16-12-2024,2024-12-16 09:35:25.000 UTC,448,23776189,0x827922686190790b37229fd06084350E74485b72,4085834,6829330302086243903,121757961399987784,3604572507085340
0x9eb86e93a809a41ab0e7cc0ba6f62561fda3015c,0xb1960a990554cc95c403c965b4be0363e25b7b4eaaaacf203b07015b79079377,10-06-2025,2025-06-10 18:17:39.000 UTC,956,31395056,0x827922686190790b37229fd06084350E74485b72,16104119,22179635571,1107247,877
0x8fd1b615c006ebeb8a7cfb00a1dd809f31943b08,0x1402d4952b486bae1d81d75cde0c631aee85788f4c4ca5661d90ad367f458d2d,18-01-2025,2025-01-18 08:05:41.000 UTC,519,25199097,0x827922686190790b37229fd06084350E74485b72,5771296,269743849820736529,1907041206,55062631095806003437447
0x2791dc5e14f7680d9d969acc26059ba56403b6d5,0xebeef201bf02ea9859f9bf3c7d3e2f3c426273d674427db9899047df6a5af8b2,13-12-2024,2024-12-13 06:18:47.000 UTC,363,23640690,0x827922686190790b37229fd06084350E74485b72,3935165,10867860699494027232,1378522352999787996,4301215502151288
0x095d0de0ecfd6832f1a7961ae26d285d68655d60,0xfaa8b7b7994947a477843c1c1745ac159e63afc9d29e790f21c93f758de0fb69,23-04-2025,2025-04-23 05:17:03.000 UTC,260,29298038,0x827922686190790b37229fd06084350E74485b72,11782404,121132122770522794494412,110906432688162461238,54696600654119600457439
0x38f6d2d9ea493c3c6ee865b5b952b5fe9e3e61fc,0x8c88697001ba394c402b52f75545176fefffe3dd3dd411f752486ae192182a99,11-06-2025,2025-06-11 05:02:13.000 UTC,292,31414393,0x827922686190790b37229fd06084350E74485b72,16146368,23225043571,922522,238304
0x9eb86e93a809a41ab0e7cc0ba6f62561fda3015c,0xf3fdf945135dbe06c640bd5a2f42c4f4444eab31e8542d5606e9d2f42d14255a,07-12-2024,2024-12-07 06:18:09.000 UTC,66,23381471,0x827922686190790b37229fd06084350E74485b72,3613085,137393361900513974,749119932,20071237621909570001024
0x9eb86e93a809a41ab0e7cc0ba6f62561fda3015c,0x9d0ccbbe7ca538482eb586717cde94d4b1c1fc32aa3d225f56deb8b9e09ed03e,02-01-2025,2025-01-02 22:55:59.000 UTC,402,24534606,0x827922686190790b37229fd06084350E74485b72,4998431,1914973549619959919528,146241957311781464,2158548599259027840447
0x2791dc5e14f7680d9d969acc26059ba56403b6d5,0x77ff066f77a7eaf4bcce657cafa011200d95b8c683da9c6bce6cea913c9c03ee,30-12-2024,2024-12-30 05:43:57.000 UTC,1429,24374045,0x827922686190790b37229fd06084350E74485b72,4808073,7662323636725368887,5770818988419218856,1379900822230986
0x2791dc5e14f7680d9d969acc26059ba56403b6d5,0xe342476dda58e3962c1340ba2d31c1a5c9d75edd0f03c90326afd0ef76531c07,19-12-2024,2024-12-19 08:58:09.000 UTC,360,23904671,0x827922686190790b37229fd06084350E74485b72,4248345,3976540522961499021,2164137065738580112,1617427193653868
0x8fd1b615c006ebeb8a7cfb00a1dd809f31943b08,0x84afd0d7d808905b36ceee8e1b6e6afa65120b1361dc1e19249a95693695b2df,06-01-2025,2025-01-06 14:34:03.000 UTC,341,24692348,0x827922686190790b37229fd06084350E74485b72,5150846,2866633838032707939517,70824874528701338,9506468045725029805217
0x8fd1b615c006ebeb8a7cfb00a1dd809f31943b08,0x48145eab7df62e4c3fb03419c903e7bf8c7286c9e45ba5b1e14f6349959e42a8,13-02-2025,2025-02-13 14:26:17.000 UTC,370,26333715,0x827922686190790b37229fd06084350E74485b72,7253989,2238548431003824,236713489394899170,1093940222
0x38f6d2d9ea493c3c6ee865b5b952b5fe9e3e61fc,0x0c65985cca374526775a1f23acfe81c388560f1001f1e6c66f1ae3f875f05649,02-03-2025,2025-03-02 18:40:39.000 UTC,305,27075746,0x827922686190790b37229fd06084350E74485b72,8294535,18536535752617775256008,189062524618636326,121774933523203720441276
0x351f61e4c49cf11f24d9f2e737ca5eff81806355,0x54cf8fe7ed19adb66ef763c4ac4056cf753554c14962e06d40922f8f81d32414,07-12-2025,2025-12-07 13:10:45.000 UTC,675,39161849,0x827922686190790b37229fd06084350E74485b72,34305965,64601614123698357,55502215,62435731114955214488744
0x2791dc5e14f7680d9d969acc26059ba56403b6d5,0x5cdfa3ca16a205e4946f35c33d46c03abaf6e34992c6753751461bdc3e7c4026,07-01-2025,2025-01-07 01:38:07.000 UTC,479,24712270,0x827922686190790b37229fd06084350E74485b72,5175332,1948320370218310759292654,1936292241883767339983,48693347621750296744286
0xdc98dbffcc648d6088a2ff8f7dc01aef050e58fc,0xeb5a8aa341ef31ce46c362e41d56c6213e1ff25574d742b45160b202976a25e6,04-01-2025,2025-01-04 15:55:45.000 UTC,534,24608399,0x827922686190790b37229fd06084350E74485b72,5071961,943312398384619379765532,483048427576616818013,33750133824494919847807
0x9eb86e93a809a41ab0e7cc0ba6f62561fda3015c,0x7db33651419eb48f32ddf224e0d786c385e38cf8061739f8de60db23f7e9ad93,03-06-2025,2025-06-03 11:19:33.000 UTC,845,31080113,0x827922686190790b37229fd06084350E74485b72,15498508,27197273207,508702,851378
0x9eb86e93a809a41ab0e7cc0ba6f62561fda3015c,0x4e24b26b26ad6b45957d91feb2c466ee3afaba7c7ab605792c2d3ea282a65d46,12-12-2024,2024-12-12 01:24:23.000 UTC,324,23588658,0x827922686190790b37229fd06084350E74485b72,3870027,3325945205473014789137,168038200589768624171,1363589297748107105
0x9eb86e93a809a41ab0e7cc0ba6f62561fda3015c,0xa227e8482880a92b8e17ee6ac8f217d1c367b575bb4ee28c4ed772bc5170b0a7,10-01-2025,2025-01-10 00:41:17.000 UTC,379,24840165,0x827922686190790b37229fd06084350E74485b72,5327494,961693072019919859745,73233688556537054000,227029053273017845
0xdc98dbffcc648d6088a2ff8f7dc01aef050e58fc,0x359cf5ab0c9f8384415a971c1edef142ce959e0dcfd4aba63184e02d73c19650,15-05-2025,2025-05-15 16:03:29.000 UTC,376,30267831,0x46A15B0b27311cedF172AB29E4f4766fbE7F4364,380642,12396827275881931755830,231974958744739745,394856901968013999
0x2791dc5e14f7680d9d969acc26059ba56403b6d5,0xc68638556d2e6d854b89a7727f3ec848f2c118e6cf5e6a1e92046862105d99aa,14-01-2025,2025-01-14 20:31:05.000 UTC,448,25048659,0x827922686190790b37229fd06084350E74485b72,5566060,304951443038624142745,151362677981068446779,227742116411733099
0x38f6d2d9ea493c3c6ee865b5b952b5fe9e3e61fc,0x130f7ba015eeccc260fbbaf69874f9d7b31a132a49a1e09809f685cda9c73117,22-02-2025,2025-02-22 18:05:07.000 UTC,860,26729080,0x827922686190790b37229fd06084350E74485b72,7804473,19717095328238134037441,432412454632861430,87735169696856604553569
0x8508fd4238162cb3f3d485f432202af3b40f164e,0x7230d6d9955f133dd5c0e74e16453b96a3c6f4030cf078bcd77ca9e8fbbcef13,18-03-2025,2025-03-18 04:41:33.000 UTC,404,27741773,0x03a520b32C04BF3bEEf7BEb72E919cf822Ed34f1,2475685,62228959486242702299,94908893760369252320,35628096629070644
0x2791dc5e14f7680d9d969acc26059ba56403b6d5,0xbc888af60fdc663eadad4fdbef33915765ab13af1a6f035827c4966c6cd4deb5,19-05-2025,2025-05-19 06:13:05.000 UTC,406,30422919,0x03a520b32C04BF3bEEf7BEb72E919cf822Ed34f1,3057610,27899736603089224133,29951131625714774,43783785263243883616
0x095d0de0ecfd6832f1a7961ae26d285d68655d60,0x91a6fa4a33a1678503832fa6fb36315d37582510c77255b631db2e7212adb78f,06-03-2025,2025-03-06 02:22:41.000 UTC,397,27219207,0x827922686190790b37229fd06084350E74485b72,8515840,392932936038288292255292,352152192696224970149,152597703511453687798326
0x8508fd4238162cb3f3d485f432202af3b40f164e,0x60ba4ba26fe486e89ea8f3962a0939714cc8fdb80ac7aa3ccedfe0124b83644d,09-06-2025,2025-06-09 01:12:25.000 UTC,459,31321099,0x827922686190790b37229fd06084350E74485b72,15956546,12614794288,493161,137177
0x8fd1b615c006ebeb8a7cfb00a1dd809f31943b08,0x28dd0fe75ba9059b16f3007172d5fd0f87c795a58f7e70c3361751bcb329a9c1,24-12-2024,2024-12-24 18:08:35.000 UTC,345,24137184,0x827922686190790b37229fd06084350E74485b72,4559853,2631135002995999172303,2127031591442911407348,2733554875285509767
0xdc98dbffcc648d6088a2ff8f7dc01aef050e58fc,0x20ee00d03eed246d1bb4d0d2d3c1b0bb849ca874e57ccd478231c4bbcf2dda46,31-05-2025,2025-05-31 21:18:17.000 UTC,1377,30968475,0x46A15B0b27311cedF172AB29E4f4766fbE7F4364,392091,11966661320171527547074,151588471381286056,460860244262643638
0xdc98dbffcc648d6088a2ff8f7dc01aef050e58fc,0x0ce277c9a4aa74916744a811011cb4205394c58316eb0ac858efe981e0b92a88,09-07-2025,2025-07-09 04:04:35.000 UTC,842,32622264,0x46A15B0b27311cedF172AB29E4f4766fbE7F4364,432201,10539005109452182085576,364587651054866252,151185698289691064
0x38f6d2d9ea493c3c6ee865b5b952b5fe9e3e61fc,0xb442d495690fcf99530588da3994a40d3785b720a63d8f57a033c360720d33fb,08-01-2025,2025-01-08 04:55:59.000 UTC,292,24761406,0x827922686190790b37229fd06084350E74485b72,5227445,1530764132564955763511205,48232741056662606895,70682613340806237517063
0x2791dc5e14f7680d9d969acc26059ba56403b6d5,0x5008d80cfd0875ad972cbf6ed17eb867d4580e1b49f1d1bb9c0f50dc512022c5,09-01-2025,2025-01-09 02:59:37.000 UTC,432,24801115,0x827922686190790b37229fd06084350E74485b72,5277318,1610037064794795239699811,1236549980325221260661,46587728374230725689344
0x2791dc5e14f7680d9d969acc26059ba56403b6d5,0xee93bf66fa2f6e147c187b9dee0fa10de18d846135bca21299ad6f465fc9af69,10-01-2025,2025-01-10 19:45:31.000 UTC,386,24874492,0x827922686190790b37229fd06084350E74485b72,5369441,2011424278198645152921,83300280084511059501,546905008893147027
0x8508fd4238162cb3f3d485f432202af3b40f164e,0x86f0c4f7501be28b0a65adc26b9caa10227aecc981ebab9e38c4023b7f36c77f,24-05-2025,2025-05-24 12:32:07.000 UTC,858,30650290,0x827922686190790b37229fd06084350E74485b72,14609752,16678377235,568500,265011
0x9eb86e93a809a41ab0e7cc0ba6f62561fda3015c,0xa0e8eb9ad54ac62f55d8a7c74cd5d8cbbe10c3eae6ce0b51b2c2f63cfa5dc00f,04-01-2025,2025-01-04 12:45:59.000 UTC,483,24602706,0x827922686190790b37229fd06084350E74485b72,5064961,2190383899153438785035,528382144496953817210,124706109720151924
0x38f6d2d9ea493c3c6ee865b5b952b5fe9e3e61fc,0xcff8e795debafa1e521bade8c15c5dcd974fc22f1c1573a2bf3fbd7167c0d434,04-01-2025,2025-01-04 11:41:55.000 UTC,418,24600784,0x827922686190790b37229fd06084350E74485b72,5060854,11563898646930396146,1389571176561152904,2320275179798355
0x8508fd4238162cb3f3d485f432202af3b40f164e,0x3fff818337f2a46b3ff4c23939f8e5d67a707ba2e502e121dc6421ed12ae3b4b,06-03-2025,2025-03-06 00:33:51.000 UTC,293,27215942,0x827922686190790b37229fd06084350E74485b72,8510878,75421067448388951654224,0,100000000000000000000000
0xdc98dbffcc648d6088a2ff8f7dc01aef050e58fc,0x229464405301e6d22570625863edb723a551f15a3c36685a22a9aacae3d408c2,26-05-2025,2025-05-26 03:26:39.000 UTC,759,30720326,0x46A15B0b27311cedF172AB29E4f4766fbE7F4364,387467,12559947417029625513504,459414138087851030,153301465244329034
0x0b27b59171a4ffe19f23d54126cd797be17c6551,0x60c2b3149851fbe100e8ebe54d1882cf723b0ac42678347830d8a210ca5c8d62,10-07-2025,2025-07-10 11:53:31.000 UTC,1022,32679532,0x03a520b32C04BF3bEEf7BEb72E919cf822Ed34f1,3502887,5904181174994272451153,150773085267116374,140391464511421020857425
0xdc98dbffcc648d6088a2ff8f7dc01aef050e58fc,0xdd6fc9f5001969af362c85156a7f2fd57ec0436386a6d10de301cc2e381a06d7,09-06-2025,2025-06-09 16:16:07.000 UTC,726,31348210,0x827922686190790b37229fd06084350E74485b72,16008464,10326619887,334612,181538
0x8fd1b615c006ebeb8a7cfb00a1dd809f31943b08,0xc9bdf933fef18686f0a630ccd20c5205c3e658f08a242c545a9092a00f58a696,08-02-2025,2025-02-08 05:41:03.000 UTC,357,26101958,0x827922686190790b37229fd06084350E74485b72,6914072,1154777296993772,123616018225743418,559165542
0x095d0de0ecfd6832f1a7961ae26d285d68655d60,0x3c71c606a966e68c21f44a09ee49a9be9973bf6ca8de3807fbc3430485cd3f63,13-03-2025,2025-03-13 06:07:47.000 UTC,832,27528360,0x827922686190790b37229fd06084350E74485b72,8955520,46376744229476933,76717772,34937997341461114846251
0x9eb86e93a809a41ab0e7cc0ba6f62561fda3015c,0xdbb764eae426b98f270084ffb69ab533649010b09f301b1a2e6207bc220c1732,16-02-2025,2025-02-16 12:53:31.000 UTC,364,26460532,0x827922686190790b37229fd06084350E74485b72,7413106,6095603853,894221509,55259
0x0b27b59171a4ffe19f23d54126cd797be17c6551,0xba8755808ffa851923a51146276713543d45140217078dcf732bc4ec28c7157a,27-06-2025,2025-06-27 19:46:53.000 UTC,1934,32132133,0x03a520b32C04BF3bEEf7BEb72E919cf822Ed34f1,3434510,9065745315358690190270,276397537689046974,178490020034697270738321
0x9eb86e93a809a41ab0e7cc0ba6f62561fda3015c,0xdda7353d6adc05ca0a1cf9dcd1f6675e69e7b0cc1b40c247f814fda770373544,04-07-2025,2025-07-04 15:00:47.000 UTC,296,32425950,0x827922686190790b37229fd06084350E74485b72,18308966,56842971938,1942966,898305
0x2791dc5e14f7680d9d969acc26059ba56403b6d5,0x64e7371d412ed8d03a12fd13d92f2c1ced191aec08203ad46c53dc1bcbf99c78,04-01-2025,2025-01-04 14:30:09.000 UTC,451,24605831,0x827922686190790b37229fd06084350E74485b72,5068722,23260248820607146869393,241093946376527394,40551641484263704814668
0xdc98dbffcc648d6088a2ff8f7dc01aef050e58fc,0x8711978ba3b56b4e2a7e5be12cc0ecc650523d4d046baacaf8a46437ac042091,28-12-2024,2024-12-28 09:53:57.000 UTC,224,24295145,0x827922686190790b37229fd06084350E74485b72,4714222,2423802758450810925,3638397806337721008,822194614493759
0xdc98dbffcc648d6088a2ff8f7dc01aef050e58fc,0x0cc57d01b2ebb9aed2ca6b4571bd5961ca27ac3656d9549ef4bda8ae09119f2b,06-01-2025,2025-01-06 10:04:45.000 UTC,325,24684269,0x827922686190790b37229fd06084350E74485b72,5135940,14102633535011188092,0,4730687569567236
0x38f6d2d9ea493c3c6ee865b5b952b5fe9e3e61fc,0x6bb691a77357f53bc6ec4e14cc329eee3ac1895c03f8b28ee27371ef14d7211c,03-01-2025,2025-01-03 16:25:53.000 UTC,398,24566103,0x827922686190790b37229fd06084350E74485b72,5018989,36673295722065886936,853728435178354293,11753618797651288
0x38f6d2d9ea493c3c6ee865b5b952b5fe9e3e61fc,0xccfbf3b325e32e39761ab3856f01651dee299ba7d847e7f57f1a8f71369a03af,01-01-2025,2025-01-01 22:38:35.000 UTC,269,24490884,0x827922686190790b37229fd06084350E74485b72,4944960,525715904655191943,426556627,52838774052189353181436
0x095d0de0ecfd6832f1a7961ae26d285d68655d60,0xbc4df478ccbb9231c9fff791ec2a942ddc4dcb3b33995326af8ffe4900e7a678,14-04-2025,2025-04-14 02:52:25.000 UTC,411,28904899,0x827922686190790b37229fd06084350E74485b72,11132704,154250235030716306690495,54109849343061773369,75231925615306141650706
0x8508fd4238162cb3f3d485f432202af3b40f164e,0x06af637fce48d071b2218e81aafa480a3ca187149a5a1e4527c4cb7a94579e33,20-05-2025,2025-05-20 21:18:35.000 UTC,634,30493284,0x827922686190790b37229fd06084350E74485b72,14255129,282570488886281113760,135252276163857135,227161537853505339392
0x2791dc5e14f7680d9d969acc26059ba56403b6d5,0xeb2406d41d7b3e62686eb1ebff9d3bff012b414817259696077810d0db874d8c,21-12-2024,2024-12-21 09:07:19.000 UTC,709,23991346,0x827922686190790b37229fd06084350E74485b72,4367617,7432309279899037161,4151646848304509849,2944043258295180
0xdc98dbffcc648d6088a2ff8f7dc01aef050e58fc,0xcc61ed02b26c46b52b4befa5f81311a3be32257e9734d2bdc4da67cded59aa95,26-05-2025,2025-05-26 12:38:43.000 UTC,1017,30736888,0x46A15B0b27311cedF172AB29E4f4766fbE7F4364,387668,12554917711731489159109,170735031079182230,470528096256656050
0x9eb86e93a809a41ab0e7cc0ba6f62561fda3015c,0x48449be65bee47d77ce952b0a559005ba90796b8e39bb7b45157f812ee8c61a8,02-01-2025,2025-01-02 08:30:01.000 UTC,338,24508627,0x827922686190790b37229fd06084350E74485b72,4966251,3279805746483673148681,94574383059904326501,1103959442770783300
0x9eb86e93a809a41ab0e7cc0ba6f62561fda3015c,0xab10cef2910b9ce16a4d895968bdb583eae58e5f9bd381ad80a60e9ba4993f27,05-01-2025,2025-01-05 02:29:31.000 UTC,390,24627412,0x827922686190790b37229fd06084350E74485b72,5091454,1350675019218890039992,73694377540489410,1739749550493780923953
0x8508fd4238162cb3f3d485f432202af3b40f164e,0xedfa62675064c31703ee9e6beee6bd4ecb50f626491fd87cf92ec49cd00cc0a8,23-05-2025,2025-05-23 00:39:29.000 UTC,1186,30585711,0x827922686190790b37229fd06084350E74485b72,14466149,16831291891,677339,163625
0x2791dc5e14f7680d9d969acc26059ba56403b6d5,0xea95cd577742c4f70e19b9e9f5e824877d2e7675c0c6fbeb4858e1cb1474a5d9,13-01-2025,2025-01-13 10:55:33.000 UTC,405,24988193,0x827922686190790b37229fd06084350E74485b72,5493868,16535404573016297931744,382295836552738711,17663975220958101989517
0x8508fd4238162cb3f3d485f432202af3b40f164e,0x79275c59fabb77b0f8c48502404e5ba0ee77894e67366350dfb279c7387ee8df,21-04-2025,2025-04-21 07:39:51.000 UTC,262,29215922,0x827922686190790b37229fd06084350E74485b72,11631155,107010462069154,17594195645930437541,14959
0xdc98dbffcc648d6088a2ff8f7dc01aef050e58fc,0x3d499a2d70ff4f2502b38d3e83c4ddbba7b1be9f86c795ee2d72be17180f2628,22-05-2025,2025-05-22 11:38:19.000 UTC,347,30562276,0x827922686190790b37229fd06084350E74485b72,14409230,14547351660193780,1138398112,19506182311387164792
0xdc98dbffcc648d6088a2ff8f7dc01aef050e58fc,0xfdfd4d411e9d14bad5ba695f0ebbe5130b207593d0dad97fb85dcf0b5b501796,10-01-2025,2025-01-10 14:06:21.000 UTC,390,24864317,0x827922686190790b37229fd06084350E74485b72,5356570,512608771051380896,271922192,35230488956248418670988
0x2791dc5e14f7680d9d969acc26059ba56403b6d5,0xf877a9492a8739b245aaf2d277caa3053a22631716802db7532b5cc0389ab572,31-12-2024,2024-12-31 03:14:15.000 UTC,388,24412754,0x827922686190790b37229fd06084350E74485b72,4844950,6430478050217467834,2598682034858712323,3472225276031517
0x38f6d2d9ea493c3c6ee865b5b952b5fe9e3e61fc,0xdf870130f8b2f4a9599cf6c05cc9d15d59de5da62f6a684e8c2dbe8f964bf3fa,02-07-2025,2025-07-02 08:06:51.000 UTC,477,32327132,0x46A15B0b27311cedF172AB29E4f4766fbE7F4364,424294,12081688631,315549,288484
0x9eb86e93a809a41ab0e7cc0ba6f62561fda3015c,0x4a617d4145cbd08174a2fbe7d793e20d269feadb9a7046b047fb84e7e5e8ff46,05-01-2025,2025-01-05 03:20:29.000 UTC,252,24628941,0x827922686190790b37229fd06084350E74485b72,5092629,1942919346027081235386,522457354097415966416,41042654216037164
0x2791dc5e14f7680d9d969acc26059ba56403b6d5,0x10f8c8ac1927a8a272555bb95c66a13a3d256f15b855a4f7aa7fbcd3fff49881,03-01-2025,2025-01-03 00:40:01.000 UTC,389,24537727,0x827922686190790b37229fd06084350E74485b72,5001343,2929357693837818111282,88687045735883535690,946315339447411047
0xdc98dbffcc648d6088a2ff8f7dc01aef050e58fc,0x4d22c0fe3c3b7e6dc228ae4f153e243d29bd5cefb0d549fffb1d9a9e207f3742,22-05-2025,2025-05-22 16:51:33.000 UTC,624,30571673,0x827922686190790b37229fd06084350E74485b72,14433222,14444129619845922,6652252,1642191239642294690761
0x38f6d2d9ea493c3c6ee865b5b952b5fe9e3e61fc,0xd761eac9c26c5a0c676b17f7615cc2e2b5293a59c1587337fe4920f342a54e1c,22-01-2025,2025-01-22 04:31:37.000 UTC,167,25365475,0x827922686190790b37229fd06084350E74485b72,5967940,270149330983328114,2219347823,50440813250378206955835
0x9eb86e93a809a41ab0e7cc0ba6f62561fda3015c,0x0a614f99245cea067b0a3555b7183d525a4a59812cc8d10df690cea885535036,09-03-2025,2025-03-09 21:31:19.000 UTC,308,27383266,0x03a520b32C04BF3bEEf7BEb72E919cf822Ed34f1,2272198,319212801,259130728,375156
0x38f6d2d9ea493c3c6ee865b5b952b5fe9e3e61fc,0x05bdcb7756b0ef322d0b82158316ff31d15180e07c4c583e96b92415f6a4e6a8,14-07-2025,2025-07-14 04:35:47.000 UTC,151,32839200,0x46A15B0b27311cedF172AB29E4f4766fbE7F4364,439677,28735250533,1343959,91945
0x8fd1b615c006ebeb8a7cfb00a1dd809f31943b08,0x72f3ac5acab8c4d0c1842f0789746695122e52450a5536b30d1bb564e172fe61,08-01-2025,2025-01-08 20:14:21.000 UTC,316,24788957,0x827922686190790b37229fd06084350E74485b72,5262292,31912717208880053526262,442020881873574478,50028336071251778792450
0x8810de2baa17067ddcfbd9e8f29c55f070a55f0b,0x40d03cc4dd0ead6e9b50cd0fbcdaeea4c8fb36147d9542f936ab3ea3065d5ccc,13-07-2025,2025-07-13 23:10:09.000 UTC,818,32829431,0x03a520b32C04BF3bEEf7BEb72E919cf822Ed34f1,3520824,4962620829845331468254,127410047452613166,117816313894659385916625
0x8508fd4238162cb3f3d485f432202af3b40f164e,0x6f586571a6fcc66de70ebfcc6f67eb566952aa21f3f6a90abfa32414079dc56c,28-03-2025,2025-03-28 06:29:37.000 UTC,387,28177015,0x827922686190790b37229fd06084350E74485b72,9957856,148377789529964441726069,675696803837985133097,38430862877782961687740
0x38f6d2d9ea493c3c6ee865b5b952b5fe9e3e61fc,0x8220dc2b43590edab5cc4e3bcdcaea83bbb2cd978ed387e8b706a9ad3964a5d8,07-01-2025,2025-01-07 17:47:03.000 UTC,455,24741338,0x827922686190790b37229fd06084350E74485b72,5201668,1592576209615380186088940,457258754710843074285,66162498928226022195200
0x9eb86e93a809a41ab0e7cc0ba6f62561fda3015c,0xc37942da9ecfbee67f33f41d1970d1e253b1d841695ee08d8498c6b2e39a6a6d,11-07-2025,2025-07-11 11:10:21.000 UTC,545,32721437,0x827922686190790b37229fd06084350E74485b72,18974486,58973101013,579132,2370382
0x8fd1b615c006ebeb8a7cfb00a1dd809f31943b08,0x929978028c859e5e03ccd25c41e323581e27b6f646408ce934ddd6e44bdb974a,01-01-2025,2025-01-01 10:36:23.000 UTC,265,24469218,0x827922686190790b37229fd06084350E74485b72,4922757,12492899030923138211219,237812884929758000,16219144755347405068635
0x9eb86e93a809a41ab0e7cc0ba6f62561fda3015c,0x12e97df4ead678783032ac46d6d2c7875822588becc8c1f9d8f868893307f3c3,02-02-2025,2025-02-02 16:02:31.000 UTC,496,25861402,0x827922686190790b37229fd06084350E74485b72,6603313,54907547999465778,287573273,16003256648988365563982
0x2791dc5e14f7680d9d969acc26059ba56403b6d5,0x89b878899c4626c8b65ac86295168d114d04bb263f4c9ac481e4e1f9748ad144,04-01-2025,2025-01-04 21:30:07.000 UTC,607,24618430,0x827922686190790b37229fd06084350E74485b72,5083103,2607016925886262431125,570526668038209639724,217750130993769376
0x9eb86e93a809a41ab0e7cc0ba6f62561fda3015c,0x5f050888cbc7992585de80de584abad82069b216bc55fe2cc55cbf8c85cf4079,01-01-2025,2025-01-01 07:49:35.000 UTC,223,24464214,0x827922686190790b37229fd06084350E74485b72,4918299,4250841967315926550616,473455394651567381,566805727989424330235
0x8fd1b615c006ebeb8a7cfb00a1dd809f31943b08,0xc6d8f8398ea8e19452359ed433c78c685ccf22c0aadf5f9ee0894983ff3b1726,01-01-2025,2025-01-01 11:41:49.000 UTC,357,24471181,0x827922686190790b37229fd06084350E74485b72,4924260,12351044365560218038041,6548343114199951,28804230774618447355538
0x8fd1b615c006ebeb8a7cfb00a1dd809f31943b08,0x0f5ad6da3cfac6ad097d1da1729394fe041a5b14f8712226e02dea6e2cebd2a7,04-01-2025,2025-01-04 22:34:35.000 UTC,350,24620364,0x827922686190790b37229fd06084350E74485b72,5084929,5174494043501817822574,1222945021166904674953,2101775595709612942
0x8508fd4238162cb3f3d485f432202af3b40f164e,0x0f96d0f08d221f984a78413033efcf6b2633f324436680edad71a96bbcda46f3,13-04-2025,2025-04-13 03:58:55.000 UTC,462,28863694,0x827922686190790b37229fd06084350E74485b72,11061678,147909131385128,50120281465334893927,7377
0x9eb86e93a809a41ab0e7cc0ba6f62561fda3015c,0xdfad336c71713c97b932dfaec5ac26fd7d9da0a7d463ac1596376b24fd2022ef,03-06-2025,2025-06-03 11:32:49.000 UTC,2486,31080511,0x827922686190790b37229fd06084350E74485b72,15499269,27102607664,746292,608647
0xdc98dbffcc648d6088a2ff8f7dc01aef050e58fc,0xdb203e8b761fbd8cc321a93e96c8ee0504db40be8ec4e61dc39e016fdd1e8a4d,11-01-2025,2025-01-11 10:56:53.000 UTC,347,24901833,0x827922686190790b37229fd06084350E74485b72,5395711,1266411729706287991321,411113679472363099828,5547536159509542
0x8508fd4238162cb3f3d485f432202af3b40f164e,0x869ab3083f9924d430656f264c05f665df556749a90d61d6ec56360c4625ded9,31-03-2025,2025-03-31 06:15:53.000 UTC,235,28306203,0x827922686190790b37229fd06084350E74485b72,10164618,382578312856115,43088234510991838482,66021
0xdc98dbffcc648d6088a2ff8f7dc01aef050e58fc,0xe7724393ef7397ce9048e83ceb9182e14527a6ab6d243ed6cdde7c53d6621f48,12-01-2025,2025-01-12 06:53:57.000 UTC,287,24937745,0x827922686190790b37229fd06084350E74485b72,5431293,4022893927289255471,1289890610790947480,43551957140460
0x8508fd4238162cb3f3d485f432202af3b40f164e,0x0f5c3baa46ee20b6cc768ca31a0c48818c4ad57c184c6ef163328c076ed40748,06-04-2025,2025-04-06 20:05:41.000 UTC,538,28590297,0x827922686190790b37229fd06084350E74485b72,10633087,254770760304723,81014118049124654958,18235
0xdc98dbffcc648d6088a2ff8f7dc01aef050e58fc,0xfb31168e3219fb6594e033bcea11202e7444ff67e3a4e660e1eb2bd6c7f79451,30-05-2025,2025-05-30 11:33:43.000 UTC,640,30907738,0x827922686190790b37229fd06084350E74485b72,15138611,6212147872,95143,215593
0x8fd1b615c006ebeb8a7cfb00a1dd809f31943b08,0xc616ea38da31a23d7c468b7a6011be7e588c11344c1444fc4bb0f8bc9ad53bbd,03-01-2025,2025-01-03 07:29:45.000 UTC,395,24550019,0x827922686190790b37229fd06084350E74485b72,5010952,1010227075789284147227,76055077188195691,255333215155929398577
0x2791dc5e14f7680d9d969acc26059ba56403b6d5,0x41060d625ffbf4fd57b26d8e17681900195947399e513f71eed32c6860bba057,21-12-2024,2024-12-21 00:38:43.000 UTC,352,23976088,0x827922686190790b37229fd06084350E74485b72,4349702,3993964704343135305,771842082509774465,2757517579166504
0x38f6d2d9ea493c3c6ee865b5b952b5fe9e3e61fc,0x77d5f89a8ee8b0b1664026724141af2b92785a7b33281cf4b29ea81e54ab3198,22-05-2025,2025-05-22 17:10:37.000 UTC,528,30572245,0x827922686190790b37229fd06084350E74485b72,14434726,8284111465,381848,31995
0xdc98dbffcc648d6088a2ff8f7dc01aef050e58fc,0x62e4891d1abff9c8ffe59fc19c6eaac7f51ca70a2d13e895ee3552aea95ac83c,09-06-2025,2025-06-09 12:36:49.000 UTC,259,31341631,0x827922686190790b37229fd06084350E74485b72,15994117,10333655692,101223,415705
0x0b27b59171a4ffe19f23d54126cd797be17c6551,0x36f8d122325c11922eec10b53864bcd12ac3b37e0d2dfe84e6d716fc08a97f01,28-08-2025,2025-08-28 22:23:45.000 UTC,180,34815239,0x03a520b32C04BF3bEEf7BEb72E919cf822Ed34f1,3824828,738459979907111034654,12245875825292758,26621160935742442818613
0x0b27b59171a4ffe19f23d54126cd797be17c6551,0x85f8a5abf285d5be39c057da42228ee1d49d03437686a179bd0ea904458fba5e,19-05-2025,2025-05-19 07:54:33.000 UTC,660,30425963,0x03a520b32C04BF3bEEf7BEb72E919cf822Ed34f1,3058176,14949011935731766501069,737200921207867904,177900905662845365300279
0x9eb86e93a809a41ab0e7cc0ba6f62561fda3015c,0x5248113579f4a3babfbebbbb2dbfc11c15271a65cd13fbc10e812497b294442e,05-03-2025,2025-03-05 05:58:53.000 UTC,270,27182493,0x827922686190790b37229fd06084350E74485b72,8459267,2209528261,19480447,351020
0xdc98dbffcc648d6088a2ff8f7dc01aef050e58fc,0x2317dc98a5ea5b1c9de1d4527c1fa9c1dd5c567ad6e539979285d9f421af1d8e,05-07-2025,2025-07-05 04:07:05.000 UTC,441,32449539,0x46A15B0b27311cedF172AB29E4f4766fbE7F4364,428323,10624186183501154529900,495638809405440035,11282211375409145
0x2791dc5e14f7680d9d969acc26059ba56403b6d5,0x3986c29b572d0c7e99f081ab98905c9029525559e1372c18233d8b1937f79c1d,12-12-2024,2024-12-12 01:25:19.000 UTC,278,23588686,0x827922686190790b37229fd06084350E74485b72,3870062,2730574853489269317536,246340616905137685350,1067523289918186422
0xdc98dbffcc648d6088a2ff8f7dc01aef050e58fc,0x237ba30e67812c7182b5f876af86a23ab4a9f9329640ba31aefa77475cbe5c7d,07-01-2025,2025-01-07 11:11:27.000 UTC,432,24729470,0x827922686190790b37229fd06084350E74485b72,5188172,2343434400307321697623,199064079012801336293,546976881290376621
0x8fd1b615c006ebeb8a7cfb00a1dd809f31943b08,0x287188b75c7e16e1384320290ca5e22835964b2f8cf531ae0234352b36fe2c8e,24-02-2025,2025-02-24 08:52:35.000 UTC,456,26798904,0x827922686190790b37229fd06084350E74485b72,7895936,63004552418796428507013,93210512646726945594,8406710987692869383221
0x38f6d2d9ea493c3c6ee865b5b952b5fe9e3e61fc,0x800d991556030952ee01c33d525b69026e64f78331ae3883798dc6779d819a8e,06-01-2025,2025-01-06 18:39:17.000 UTC,331,24699705,0x827922686190790b37229fd06084350E74485b72,5161241,1822165891066016763874,174428954650252966608,413611647509684289
0xdc98dbffcc648d6088a2ff8f7dc01aef050e58fc,0x7a1224e23fed6097643797a1137f5e0800da68c696be2a736e1ae23739f4a5f9,30-01-2025,2025-01-30 02:56:19.000 UTC,341,25708216,0x03a520b32C04BF3bEEf7BEb72E919cf822Ed34f1,1983456,11112065260558048944124,866009772240400410,121925317304755738663675
0x0b27b59171a4ffe19f23d54126cd797be17c6551,0x3464c6d7c62f8e5a308e0b173c959fe77d3fa4df1a6629f8d33e9eaf758a1198,20-09-2025,2025-09-20 19:43:33.000 UTC,731,35804033,0x03a520b32C04BF3bEEf7BEb72E919cf822Ed34f1,3931520,3881012373364614314159,124718818944357883,71446646842041457900051
0x9eb86e93a809a41ab0e7cc0ba6f62561fda3015c,0x2de1254d1fb19e17fc120eea7a42405e2180a859db3713d4f92f0feb410298da,03-01-2025,2025-01-03 01:41:11.000 UTC,431,24539562,0x827922686190790b37229fd06084350E74485b72,5003015,641071952233765590782461,459407624722350807488,20269027222333279682300
0x8fd1b615c006ebeb8a7cfb00a1dd809f31943b08,0x2094403d24710ad47684f9e444d3cbbbc059d1867d0e4ac86d5da3968460dcf8,10-01-2025,2025-01-10 02:39:11.000 UTC,330,24843702,0x827922686190790b37229fd06084350E74485b72,5331961,3176225502649601513381,737308889516402267021,1258971999810207814
0x2791dc5e14f7680d9d969acc26059ba56403b6d5,0x0a914764e9b8e1868ae8b0a28af16a184dcad774a7c9a6d68e9fda48c18c2a9c,16-12-2024,2024-12-16 15:28:39.000 UTC,496,23786786,0x827922686190790b37229fd06084350E74485b72,4101670,3342973174194068071125,290195909348004924462,1634451374181352467
0x2791dc5e14f7680d9d969acc26059ba56403b6d5,0x4e1c640c1fa508a6d46e22431b73452d0c357f605506b2d3f724901bcf42a3b1,12-01-2025,2025-01-12 16:15:51.000 UTC,988,24954602,0x827922686190790b37229fd06084350E74485b72,5453206,1733921350138547190970,125141692455037951469,395467015471375192
0x8fd1b615c006ebeb8a7cfb00a1dd809f31943b08,0x601262671c9982a35ed1ce6a38326cde862a2f5eb45d72171fc8f540bec633eb,19-12-2024,2024-12-19 03:46:49.000 UTC,325,23895331,0x827922686190790b37229fd06084350E74485b72,4241890,11650288476960764320,2299661578058254780,16383488401954355
0xdc98dbffcc648d6088a2ff8f7dc01aef050e58fc,0x01e4a8a05286b482ac348b0886833aa63ae54a16204a8f506f7577d869ae84da,09-01-2025,2025-01-09 11:28:57.000 UTC,385,24816395,0x827922686190790b37229fd06084350E74485b72,5297161,21158058024676746235113,941334699561934553,926632493161734350502
0x19d36b9ee92a53ec1900447eba958f0030c688be,0x77808d626ec34016031cd2d848159d052b72c2599fb8e24e981eb9e06e1361bb,21-05-2025,2025-05-21 18:18:03.000 UTC,215,30531068,0x827922686190790b37229fd06084350E74485b72,14338293,279037264444863771,430469601,902783062192874969599002
0x0b27b59171a4ffe19f23d54126cd797be17c6551,0xdfb652d5f3c0072cb5370379c40b3b28e5c1e1b02dd9fcaa663b765e056fc11e,30-07-2025,2025-07-30 10:15:31.000 UTC,315,33540592,0x03a520b32C04BF3bEEf7BEb72E919cf822Ed34f1,3640262,1820177838037517251224,60072794861938621,33358339136878731390223
0x38f6d2d9ea493c3c6ee865b5b952b5fe9e3e61fc,0xe3b7f64d44a3b4ff15a848308a8ac86774231aa730becb467637c4d69fff4afa,09-01-2025,2025-01-09 16:55:55.000 UTC,434,24826204,0x827922686190790b37229fd06084350E74485b72,5311208,1259080554851790470,153392841,46205834238236848998551
0x38f6d2d9ea493c3c6ee865b5b952b5fe9e3e61fc,0xdbca42bf62c253791468e3249a64842c94fd20d89a52849c8145ccab7a9460a1,08-01-2025,2025-01-08 18:12:51.000 UTC,328,24785312,0x827922686190790b37229fd06084350E74485b72,5257627,1488318677751005393164114,3090295467098067717763,3109513178152922894322
0x0b27b59171a4ffe19f23d54126cd797be17c6551,0xa92b0573535cf03a4edb1ef6a397fca420c66b8e22426ee99ff86fb5ca390d7a,11-10-2025,2025-10-11 15:27:33.000 UTC,379,36703553,0x03a520b32C04BF3bEEf7BEb72E919cf822Ed34f1,4040830,2728329144567071821401,56332576964425677,78783538506720862276103
0x8fd1b615c006ebeb8a7cfb00a1dd809f31943b08,0x583e5c83ef07758dbc778573b41bbf980c365f8db6fa02b203369a4ba13a8bb9,29-12-2024,2024-12-29 04:14:07.000 UTC,301,24328150,0x827922686190790b37229fd06084350E74485b72,4740824,8233821941263882655,2691623357325527015,12736805957559696
0x9eb86e93a809a41ab0e7cc0ba6f62561fda3015c,0x26fb48a2850e00621c8c62c6206a1c2aa8c67da632bc215d0b408a7abae007d6,23-02-2025,2025-02-23 23:58:13.000 UTC,309,26782873,0x827922686190790b37229fd06084350E74485b72,7869372,4696108346,16810741,737412
0x8fd1b615c006ebeb8a7cfb00a1dd809f31943b08,0xe9745b10c76895b1969fafa97ed2e97336c5a6184839363af12999dc5dc11568,27-01-2025,2025-01-27 05:09:13.000 UTC,360,25582603,0x827922686190790b37229fd06084350E74485b72,6233318,812612787628148454,5636032566,179357552775761889634281
0xdc98dbffcc648d6088a2ff8f7dc01aef050e58fc,0x5fff236a3c80a46be37300028f004ffabb9598f390b3ea85d37bdee4b985a9f1,14-01-2025,2025-01-14 16:07:11.000 UTC,489,25040742,0x827922686190790b37229fd06084350E74485b72,5555285,441936314828654802480164,671314753755708400940,6314510104826201719408
0x095d0de0ecfd6832f1a7961ae26d285d68655d60,0x4d5ac37f3656fa8d39957832828bd36bef9a1521a1635e8cfe0fe80584253ee9,25-03-2025,2025-03-25 00:03:55.000 UTC,708,28035844,0x03a520b32C04BF3bEEf7BEb72E919cf822Ed34f1,2625474,9122842396502034208812,186032424336629374,259107254852811709835920
0x8810de2baa17067ddcfbd9e8f29c55f070a55f0b,0x88e2711ed83cf4b45a7798019960a65bddeac2524ba869cece9e2b4610e3c53a,25-03-2025,2025-03-25 20:53:53.000 UTC,465,28073343,0x827922686190790b37229fd06084350E74485b72,9787735,130421630779639702,83531852,58727093102237678289697
0x38f6d2d9ea493c3c6ee865b5b952b5fe9e3e61fc,0xb69183d4ba8350d2bda8bacf647eac3375558dc877f48362b14a2835b6baa66f,09-01-2025,2025-01-09 04:27:57.000 UTC,314,24803765,0x827922686190790b37229fd06084350E74485b72,5280797,1323501562005953855567,176442377421646313921,240983876871432462
0x9eb86e93a809a41ab0e7cc0ba6f62561fda3015c,0x5d34b79980264753db4a8899af14f31f26dab5043df7ebe4872b47fa4eebba6b,18-02-2025,2025-02-18 14:40:39.000 UTC,563,26550146,0x827922686190790b37229fd06084350E74485b72,7540894,5785822471,722161399,180007
0x9eb86e93a809a41ab0e7cc0ba6f62561fda3015c,0x4ced4d7311b48cb604d2ef8d5a2c43edd9338e70a37812e2513dba1a7f838403,13-12-2024,2024-12-13 00:13:21.000 UTC,548,23629727,0x827922686190790b37229fd06084350E74485b72,3923662,2105232819137097189478,1610719520773812303486,582172843810633243
0x8810de2baa17067ddcfbd9e8f29c55f070a55f0b,0x3d3382eef441f7b3bd4e40088e393a4cdd0807d5e01b6324ad506965d47b0ac2,26-03-2025,2025-03-26 16:26:35.000 UTC,477,28108524,0x827922686190790b37229fd06084350E74485b72,9843843,127599044082203823,29823118,61027197436224271276057
0x095d0de0ecfd6832f1a7961ae26d285d68655d60,0xbe85f0ff15525c412aac1eb6160d0ae87125070222d94ba110572c663e79d63d,25-05-2025,2025-05-25 16:40:21.000 UTC,1744,30700937,0x03a520b32C04BF3bEEf7BEb72E919cf822Ed34f1,3094446,5379383623792604811048,78690354885261072,205625340141460114067015
0x2791dc5e14f7680d9d969acc26059ba56403b6d5,0x79fbb96d2268d89b478c804077e5183f07e36954f2379e501568bd39fd7b2af0,10-01-2025,2025-01-10 18:19:41.000 UTC,866,24871917,0x827922686190790b37229fd06084350E74485b72,5365473,2214844460367358538897,391715966867176551478,308502888757486695
0x8508fd4238162cb3f3d485f432202af3b40f164e,0xbf0471eaa78287dc0e14e3de2c2c42304582554cc9e7cd853a66dbde5704a570,10-03-2025,2025-03-10 13:38:59.000 UTC,518,27412296,0x03a520b32C04BF3bEEf7BEb72E919cf822Ed34f1,2281366,8973535732507362927234,571663305386098165,83181705924500230530376
0xdc98dbffcc648d6088a2ff8f7dc01aef050e58fc,0x9a3acbb342f67145dd874db87e5662cf68c0fd217aea9082c79bfbc4b5e6aaab,01-04-2025,2025-04-01 19:28:59.000 UTC,423,28373196,0x03a520b32C04BF3bEEf7BEb72E919cf822Ed34f1,2756115,13931442010633564081994,664696235509768693,246911922717278301110261
0x38f6d2d9ea493c3c6ee865b5b952b5fe9e3e61fc,0x08de5872e210563ee2774d98a5e9842d51d11a50d26d98fd9da9d218f7c888af,08-01-2025,2025-01-08 14:21:47.000 UTC,459,24778380,0x827922686190790b37229fd06084350E74485b72,5249378,1544247739820538868613,335806593132959220889,147814385777896474
0x9eb86e93a809a41ab0e7cc0ba6f62561fda3015c,0x86b58bbca75c2cbdfe82ea1e8199266c8b27d64ef6deaeaf586bf5a89e8619af,01-01-2025,2025-01-01 09:55:53.000 UTC,243,24468003,0x827922686190790b37229fd06084350E74485b72,4921774,4411418483515729654000,329071149715737005,1446214260497365627472
0x0b27b59171a4ffe19f23d54126cd797be17c6551,0xc479ca00eb810108fd90e170ed8a63bde66e847c585b136e7ba1d8134e8a4e64,01-06-2025,2025-06-01 05:34:17.000 UTC,125,30983355,0x03a520b32C04BF3bEEf7BEb72E919cf822Ed34f1,3131032,13695536366233938838,18950912435538129,32907091807054522649
0x8810de2baa17067ddcfbd9e8f29c55f070a55f0b,0x444059ad0cb93a9f5fd777cca8c3d7e6a3286894f8dded0a3159e07fa3d5cc5c,17-07-2025,2025-07-17 20:06:27.000 UTC,578,32996720,0x03a520b32C04BF3bEEf7BEb72E919cf822Ed34f1,3547303,4410653234931765174486,93141250726090486,125734842738721798729615
0x351f61e4c49cf11f24d9f2e737ca5eff81806355,0xfdbc0ce11cb72d36e9cc0bc0315f86605b8468c9c2a58b3b198b328e5dae10b0,28-08-2025,2025-08-28 15:14:19.000 UTC,1951,34802356,0x827922686190790b37229fd06084350E74485b72,23888288,463884965430489900,188496356,191590030218017013101030
0x2791dc5e14f7680d9d969acc26059ba56403b6d5,0x222a25818f24149ee20f8df368bd44980811a80cfbeabb9ca60114f1523a4ebd,05-01-2025,2025-01-05 14:13:01.000 UTC,658,24648517,0x827922686190790b37229fd06084350E74485b72,5107765,2524069899660850122739,603315456444486956502,166409417783167720
0x38f6d2d9ea493c3c6ee865b5b952b5fe9e3e61fc,0xdf4629e289e9ca0ef37eb48c682dd619fdbb2da03d39816bd87287d5c8694f40,04-01-2025,2025-01-04 21:31:19.000 UTC,550,24618466,0x827922686190790b37229fd06084350E74485b72,5083154,2001944019744177229640,438110869109675612486,167211638794134190
0x095d0de0ecfd6832f1a7961ae26d285d68655d60,0x3a880d1d1a46b3f3f16fe01ca69d0dbfa8036cc09a7d6deeec2a42739031b657,27-06-2025,2025-06-27 19:48:11.000 UTC,500,32132172,0x03a520b32C04BF3bEEf7BEb72E919cf822Ed34f1,3434517,3480831477704133106268,29665104017758242,190790642240759681522492
0x8fd1b615c006ebeb8a7cfb00a1dd809f31943b08,0x1eb26de9f30a52a7df144bbf523f6ca56c452809485425b1b586b7ae712745e9,27-12-2024,2024-12-27 22:22:49.000 UTC,329,24274411,0x827922686190790b37229fd06084350E74485b72,4695643,10278286314238790499,760478236668726684,18770676630476997
0x095d0de0ecfd6832f1a7961ae26d285d68655d60,0x221671454e772a27b72c305007b33e77f1455740ff9155310ebf59b95a11012f,10-06-2025,2025-06-10 13:29:27.000 UTC,818,31386410,0x827922686190790b37229fd06084350E74485b72,16086067,116123009184361777127590,735368559576191663439,106734003466634780936377
0x38f6d2d9ea493c3c6ee865b5b952b5fe9e3e61fc,0xcfdc25c7c7d91ce9552d65265c5812862b478de485c192a70a39f9c5ede80dc1,02-06-2025,2025-06-02 06:12:43.000 UTC,203,31027708,0x827922686190790b37229fd06084350E74485b72,15388425,30289474500,1224923,288409
0x9eb86e93a809a41ab0e7cc0ba6f62561fda3015c,0xd41686102d2f21d36f41ebd9ceb947584dd52c0a37d574b70d05d6613ab06754,26-02-2025,2025-02-26 09:41:05.000 UTC,503,26886759,0x827922686190790b37229fd06084350E74485b72,8036332,3969478170,77243771,577241
0x8508fd4238162cb3f3d485f432202af3b40f164e,0x338b45921df1664a24a40554d8bad8f6845045a0b93c8b6995d0d72395c4550b,24-04-2025,2025-04-24 03:00:13.000 UTC,991,29337133,0x03a520b32C04BF3bEEf7BEb72E919cf822Ed34f1,2923723,43426141467006969696,63457742511348703135,25947067189133043
0xdc98dbffcc648d6088a2ff8f7dc01aef050e58fc,0x84bb7121eb1818a4a4f7919b9fdff026237f6e455ad59d509766f462ffc83b9e,31-05-2025,2025-05-31 16:56:13.000 UTC,1047,30960613,0x46A15B0b27311cedF172AB29E4f4766fbE7F4364,391985,12062573366313399371792,474835247378048228,110122064511662561
0x2791dc5e14f7680d9d969acc26059ba56403b6d5,0xba0a558612ffd5d3b0502cb534777baa904e01a10fbf338c3c672b578f3ec1e8,09-01-2025,2025-01-09 10:32:47.000 UTC,460,24814710,0x827922686190790b37229fd06084350E74485b72,5294910,1752779013299753244677,183298561328376679891,369548097015188230
0xdc98dbffcc648d6088a2ff8f7dc01aef050e58fc,0x8f20aca34884e6e69898de0e967446020be24f104d998d671252d561a93777eb,25-03-2025,2025-03-25 20:35:13.000 UTC,322,28072783,0x03a520b32C04BF3bEEf7BEb72E919cf822Ed34f1,2641217,15191190811688568983573,921772810451941605,218641107130167608821747
0x9eb86e93a809a41ab0e7cc0ba6f62561fda3015c,0x909322c158401e6c29af9428906f331401045094c5a7fffcd9b51b2cfd32d3ef,27-02-2025,2025-02-27 02:41:27.000 UTC,292,26917370,0x827922686190790b37229fd06084350E74485b72,8077723,3744055021,474713828,80696
0x8810de2baa17067ddcfbd9e8f29c55f070a55f0b,0x40d71282d23a4ad59132d31037095ab76e4d3644ac0f39f095dda964c0a48f2d,21-08-2025,2025-08-21 00:46:01.000 UTC,382,34473907,0x03a520b32C04BF3bEEf7BEb72E919cf822Ed34f1,3785737,873981577530929520164,23376818705980852,19850181581879983648777
0x9eb86e93a809a41ab0e7cc0ba6f62561fda3015c,0xfae1648b9fe4be0b66e82edd0bd0472ff02ee5f337052dab8ac15375b0fbafab,05-01-2025,2025-01-05 18:08:55.000 UTC,407,24655594,0x827922686190790b37229fd06084350E74485b72,5115480,1199056787767248476315,18781446938502422,1895020900843456947945
0x38f6d2d9ea493c3c6ee865b5b952b5fe9e3e61fc,0x86594bd280b0d7d89fc802f46459926267b06133d4265cd3a327d42fd6d74a5a,21-06-2025,2025-06-21 12:00:55.000 UTC,272,31858954,0x827922686190790b37229fd06084350E74485b72,17080404,36225084809,891321,919841
0x8fd1b615c006ebeb8a7cfb00a1dd809f31943b08,0x213b0fa2bb5b336d1bfdf6c436199ed16a7000b39149aeb34112a496652085d3,30-01-2025,2025-01-30 01:20:33.000 UTC,544,25705343,0x827922686190790b37229fd06084350E74485b72,6389549,820229412797349275,5540871555,186623040790799287576659
0xdc98dbffcc648d6088a2ff8f7dc01aef050e58fc,0x0502c9e7fad10fa7744b053614a5e10f8cc5bd506ef991eb507c22c15fc825dd,03-07-2025,2025-07-03 15:15:13.000 UTC,729,32383183,0x46A15B0b27311cedF172AB29E4f4766fbE7F4364,426542,10899288926544428729368,135496188593917,572024601293053723
0xdc98dbffcc648d6088a2ff8f7dc01aef050e58fc,0x781cd4fab7a2c4dbcf345058e968a64e4decd04c0e88a20d41a4044beee53412,08-07-2025,2025-07-08 04:18:15.000 UTC,301,32579474,0x46A15B0b27311cedF172AB29E4f4766fbE7F4364,431224,10562502668335092590510,160432645586385957,377657261048776363
0x8fd1b615c006ebeb8a7cfb00a1dd809f31943b08,0x09915d2142b780fa392c84e673fd255d6da1f0d631f8f7b5558792c6adc66142,21-12-2024,2024-12-21 22:56:17.000 UTC,376,24016215,0x827922686190790b37229fd06084350E74485b72,4349624,9061687152168354598,18651557436714268889,491914093519275
0x2791dc5e14f7680d9d969acc26059ba56403b6d5,0x5aede86d73107ecb4632b28f9e317566382fef180451ddadd9ff13b962ccb483,12-02-2025,2025-02-12 21:30:35.000 UTC,364,26303244,0x827922686190790b37229fd06084350E74485b72,7207786,5913133284548494941014,524251618473974083,78877106108015626327118
0x9eb86e93a809a41ab0e7cc0ba6f62561fda3015c,0x7f9336bb90d0b8ee7c16d8e8b3c9ab19077e5c1cbc3441da915dbbde207e8c76,11-12-2024,2024-12-11 22:57:43.000 UTC,263,23584258,0x827922686190790b37229fd06084350E74485b72,3862779,590453681027052717737,26798398134480227249,248187799776648010
0x095d0de0ecfd6832f1a7961ae26d285d68655d60,0x01b99b268b78b6fc9a67fafe91e44491367a84c3bbbcaf4f971fb880676be88d,19-04-2025,2025-04-19 21:35:47.000 UTC,450,29154600,0x827922686190790b37229fd06084350E74485b72,11543016,136050819357935497250646,143520626231932868096,59433421444320141358684
0x9eb86e93a809a41ab0e7cc0ba6f62561fda3015c,0x3f066ec7cde13e8c4b341e87550f882cfe6410a829a8805ddae09f40b7d274cd,27-02-2025,2025-02-27 05:31:35.000 UTC,254,26922474,0x827922686190790b37229fd06084350E74485b72,8084493,3710372780,471859741,80675
0x0b27b59171a4ffe19f23d54126cd797be17c6551,0x521278e33fa20da19d59d340fb0a832f1046b91cc882538b409120dc3914dabe,18-11-2025,2025-11-18 11:27:59.000 UTC,1208,38337966,0x03a520b32C04BF3bEEf7BEb72E919cf822Ed34f1,4201239,1523699854595252800840,34617252178712796,39450916063195059574316
0x38f6d2d9ea493c3c6ee865b5b952b5fe9e3e61fc,0x6d6315c342aa1c8b093567ee7a509ab6b1d046a248796c3a06bb1be9d50d0a74,14-07-2025,2025-07-14 10:38:33.000 UTC,613,32850083,0x46A15B0b27311cedF172AB29E4f4766fbE7F4364,440463,28705906690,1381458,52800
0xdc98dbffcc648d6088a2ff8f7dc01aef050e58fc,0x338d107a47d349b52b1b662556ccd0a6e31dffd70e6bcae38d03387095c16ff8,21-12-2024,2024-12-21 15:58:35.000 UTC,501,24003684,0x827922686190790b37229fd06084350E74485b72,4350749,4248112417768572043,6278292444803338630,2081066193147368
0x38f6d2d9ea493c3c6ee865b5b952b5fe9e3e61fc,0x6ef5ea66adc931447b41664161a11599b442620cc02bf8319af3e8071d97ada5,08-12-2024,2024-12-08 02:34:37.000 UTC,230,23417965,0x827922686190790b37229fd06084350E74485b72,3650781,330403610095706682,0,299999999999999999609800
0x095d0de0ecfd6832f1a7961ae26d285d68655d60,0xf32cf74dd4c197d1491bd3d7dc9d57e57a4e5658476eac7fb7349d7923de0573,01-05-2025,2025-05-01 06:57:21.000 UTC,706,29646647,0x827922686190790b37229fd06084350E74485b72,12515097,90573951337230354897953,27163018279551760888,50860578210807352243896
0xdc98dbffcc648d6088a2ff8f7dc01aef050e58fc,0xd759d125cd1f2e3c677bb041a03ca829159d449111538013a82facbc11d39004,30-05-2025,2025-05-30 21:40:35.000 UTC,260,30925944,0x46A15B0b27311cedF172AB29E4f4766fbE7F4364,391318,1330633736062177,27191069683102506829,56865679
0x38f6d2d9ea493c3c6ee865b5b952b5fe9e3e61fc,0xfe1ed3aeabdaafc3abddaca6254b8593040e7922d2a5336c52d5bd87e950d885,06-01-2025,2025-01-06 10:20:47.000 UTC,221,24684750,0x827922686190790b37229fd06084350E74485b72,5142949,1931792539522538953660,532136940345992772675,43183979429981038
0x8fd1b615c006ebeb8a7cfb00a1dd809f31943b08,0x3976c125bba4f872417f26035f2e96192a15eb03ff608ee5de01599c4941b23d,15-12-2024,2024-12-15 05:38:03.000 UTC,737,23725868,0x827922686190790b37229fd06084350E74485b72,3972922,6205004098063088211,8509202685285903731,3840733176124079
0x9eb86e93a809a41ab0e7cc0ba6f62561fda3015c,0xcbdc4bb66641ff3c8fbe3095d59e7366efcfb03e6d4bbaf9e6eac7e2d31092ef,29-12-2024,2024-12-29 13:36:41.000 UTC,309,24345027,0x827922686190790b37229fd06084350E74485b72,4780665,628308183294891416784,240694625625139482669,353054587857542265
0xdc98dbffcc648d6088a2ff8f7dc01aef050e58fc,0x4081038b345ca818935b3605790062a865a7732171368fdcb8c1a0ebcbc5d011,05-07-2025,2025-07-05 08:19:15.000 UTC,310,32457104,0x46A15B0b27311cedF172AB29E4f4766fbE7F4364,428508,10600615575677060634756,7286236294068369,548650681125095296
0x9eb86e93a809a41ab0e7cc0ba6f62561fda3015c,0xfd569d5968b0ebad3cf51738e37bd0c879306ae5f83d3dfc7bc14e4dcfefb95f,15-07-2025,2025-07-15 23:36:25.000 UTC,713,32916619,0x46A15B0b27311cedF172AB29E4f4766fbE7F4364,443805,17062191894,359374,493774
0xdc98dbffcc648d6088a2ff8f7dc01aef050e58fc,0x55d0b5ae7af697afcd1724a9fd1605d98a9adb1c79670a4172a996ffbb91d26c,04-01-2025,2025-01-04 21:30:39.000 UTC,319,24618446,0x827922686190790b37229fd06084350E74485b72,5083129,2514041213338586762652,550179610463863080372,209984368759750539
0x38f6d2d9ea493c3c6ee865b5b952b5fe9e3e61fc,0x708f11f8eaaa07ea4c7a40eff9795ac00e85e37338ed326646a7aa586233966c,20-01-2025,2025-01-20 03:37:31.000 UTC,191,25277452,0x827922686190790b37229fd06084350E74485b72,5864813,6885587058911702999870,309560259966863337,14872290037872319491882
0x38f6d2d9ea493c3c6ee865b5b952b5fe9e3e61fc,0xfbcafe3a40b77402f881d0bcca81669a15077ae56da1cc903750aca0fd559855,08-07-2025,2025-07-08 12:44:41.000 UTC,720,32594667,0x827922686190790b37229fd06084350E74485b72,18646708,33660222532,1615056,66823
0xdc98dbffcc648d6088a2ff8f7dc01aef050e58fc,0xa93a132cf8fe906df27a2a7056aa54e14b0781d193ee0b4cd900e537811e964b,28-12-2024,2024-12-28 17:57:47.000 UTC,421,24309660,0x827922686190790b37229fd06084350E74485b72,4740859,1507876877496671195,1112607872984643055,1704130454642240
0x38f6d2d9ea493c3c6ee865b5b952b5fe9e3e61fc,0xe792e5a62cf5a2c4dc54545c45c363885c587326d9a6231bd09ba35eea680f3c,13-01-2025,2025-01-13 07:12:55.000 UTC,613,24981514,0x827922686190790b37229fd06084350E74485b72,5484257,739576418165210164,501573827,51750428337970346997140
0x2791dc5e14f7680d9d969acc26059ba56403b6d5,0xa3eb6c8d8a03c5dc337e6a00f150925d1460edd39ca4be5fbc48906e656fc952,06-01-2025,2025-01-06 22:35:13.000 UTC,580,24706783,0x827922686190790b37229fd06084350E74485b72,5169725,22036325241931294092999,784249427895836906,7864149783346965123126
0x8fd1b615c006ebeb8a7cfb00a1dd809f31943b08,0x0ff2d63b1f86f008457bff7ffd881af0e589bf9f5366f9353de9c6f06f7e819d,22-12-2024,2024-12-22 00:26:15.000 UTC,433,24018914,0x827922686190790b37229fd06084350E74485b72,4372613,10612643551907888857,9071382812661912318,599284003634401
0x8fd1b615c006ebeb8a7cfb00a1dd809f31943b08,0x8448b623724831a4cf4dbed2d21450ba0cc525c4d23ab3431a62b2fd08b7de21,16-12-2024,2024-12-16 00:00:27.000 UTC,627,23758940,0x827922686190790b37229fd06084350E74485b72,4055444,15067808379358443659,13131359787732290960,14296664012431607
0x8fd1b615c006ebeb8a7cfb00a1dd809f31943b08,0x74042663b0c125d006fb93d32b023fc4e6bc733b4109ac97a7ba8ee5f1030686,11-01-2025,2025-01-11 00:45:03.000 UTC,565,24883478,0x827922686190790b37229fd06084350E74485b72,5379063,2719134449812824189082,213799259949045389522,1456457426451355800
0x38f6d2d9ea493c3c6ee865b5b952b5fe9e3e61fc,0x3053433017a28d6d416743e547cbdee62fb3bf0997b31d193de0a02223b728a2,24-01-2025,2025-01-24 02:24:55.000 UTC,523,25448074,0x827922686190790b37229fd06084350E74485b72,6077714,8092545552996640002517,823754055441263127,69404711390417063484549
0x38f6d2d9ea493c3c6ee865b5b952b5fe9e3e61fc,0x33bceab98dcc7f5df702517ac04d0ff62707ffcb6b4a8f59b9ff2ccf14953101,29-05-2025,2025-05-29 01:28:15.000 UTC,655,30846374,0x827922686190790b37229fd06084350E74485b72,15009937,28422446681,485681,935950
0x095d0de0ecfd6832f1a7961ae26d285d68655d60,0xadb1e76e135c8a17a3bf10fac88335abfd348e5a7df1a1047456e0b47708e551,17-06-2025,2025-06-17 05:15:01.000 UTC,839,31673977,0x03a520b32C04BF3bEEf7BEb72E919cf822Ed34f1,3296703,1089128817815123142956,75326055920346330,15807361833318400749082
0xdc98dbffcc648d6088a2ff8f7dc01aef050e58fc,0x54ef2f921c251e4c4bab9e55e9197017489ff8b1948b6b0fbcaf5a58e769d4ee,12-01-2025,2025-01-12 21:27:37.000 UTC,467,24963955,0x827922686190790b37229fd06084350E74485b72,5459599,8714669318511940592,1590126127793433182,1184188717889193
0xdc98dbffcc648d6088a2ff8f7dc01aef050e58fc,0xa4015cb3150939fb570f18a7bd5854d96e69d2c0601decd844c4f0c29751c28b,01-06-2025,2025-06-01 03:30:17.000 UTC,1011,30979635,0x46A15B0b27311cedF172AB29E4f4766fbE7F4364,392249,11952197433536573742603,413306781769286669,172013717857460087
0xdc98dbffcc648d6088a2ff8f7dc01aef050e58fc,0x1966c2b5b590f18a01b68183af7d7b3049715c040b5c24771a04cfc5865fe88b,12-06-2025,2025-06-12 08:52:29.000 UTC,476,31464501,0x46A15B0b27311cedF172AB29E4f4766fbE7F4364,404048,11330345031060850778961,35367514957325674,555732255833462250
0x8508fd4238162cb3f3d485f432202af3b40f164e,0x723d17363b9e3a48121b8bea7b18cebd640cc225bd131851f00fe95a6635f34e,31-05-2025,2025-05-31 11:38:09.000 UTC,885,30951071,0x827922686190790b37229fd06084350E74485b72,15233955,14885345910,308615,435793
0x9eb86e93a809a41ab0e7cc0ba6f62561fda3015c,0xa34b0ba3b3e0de069b7dc9e50f604d62442b2ad6374507781c165326883c0434,20-02-2025,2025-02-20 10:08:39.000 UTC,248,26628386,0x827922686190790b37229fd06084350E74485b72,7654841,5347680467,766460139,67047
0x8508fd4238162cb3f3d485f432202af3b40f164e,0x37afa108ad851c5d2fcbf140154792b3d27769bab7c7fdaabce70529fa2be4d0,02-04-2025,2025-04-02 15:07:53.000 UTC,888,28408563,0x827922686190790b37229fd06084350E74485b72,10349203,319420379861508,89728003190729845747,26537
0x9eb86e93a809a41ab0e7cc0ba6f62561fda3015c,0xdf466087d5ac2432ca70dbb6521c390e635180bcc48454dcc2c37da511beb2e4,11-06-2025,2025-06-11 08:22:19.000 UTC,1234,31420396,0x827922686190790b37229fd06084350E74485b72,16158361,21792476650,930878,158125
0x0b27b59171a4ffe19f23d54126cd797be17c6551,0x10a9a902ec3c7ad5496250f3002045e8d8892055033d1518a2627c4457c23abb,18-07-2025,2025-07-18 23:01:19.000 UTC,422,33045166,0x03a520b32C04BF3bEEf7BEb72E919cf822Ed34f1,3556374,4174806342232051413591,101340651657998344,103306787487194726312575
0x351f61e4c49cf11f24d9f2e737ca5eff81806355,0xf1e22471bc8beb46bd26e61f7dcfc3a2c2c0d40b2d0c600df3fe7cfdcc878e46,08-10-2025,2025-10-08 19:12:49.000 UTC,1342,36580711,0x827922686190790b37229fd06084350E74485b72,28164406,177245906429826280,10189242,68925094334787699634802
0x9eb86e93a809a41ab0e7cc0ba6f62561fda3015c,0x9bbd569bb95b1956e404476d66154c4c698cc1111d5b6c0de9abbadc7bd12880,13-12-2024,2024-12-13 07:32:17.000 UTC,398,23642895,0x827922686190790b37229fd06084350E74485b72,3940550,2032123191878216125910,1224649652343058208900,747333651024868298
0x38f6d2d9ea493c3c6ee865b5b952b5fe9e3e61fc,0x45ae0f9d50e3ac9dd230e89d343a7eb5bd5c7e2c0af46aa5997c87b5c664977c,14-01-2025,2025-01-14 18:05:57.000 UTC,415,25044305,0x827922686190790b37229fd06084350E74485b72,5559515,1050566716371235800645797,1811436782895401947545,10487744736424218537540
0xdc98dbffcc648d6088a2ff8f7dc01aef050e58fc,0x9c68497e7534352d32c4c4a3aa16d13ddc6b191e3fb753f6556b8900ef1f1a67,17-01-2025,2025-01-17 21:35:25.000 UTC,325,25180189,0x03a520b32C04BF3bEEf7BEb72E919cf822Ed34f1,1831586,137956695822333615277,8474314859460316,1455873475486871093131
0x38f6d2d9ea493c3c6ee865b5b952b5fe9e3e61fc,0x64d37a36f098c4ba68c0188a1c9998f4acdab9071e126a8f9f17550f817f5a5f,06-02-2025,2025-02-06 07:11:17.000 UTC,203,26018265,0x827922686190790b37229fd06084350E74485b72,6784975,6778545354200993727506,382921572877124886,99060441876994067401715
0xdc98dbffcc648d6088a2ff8f7dc01aef050e58fc,0xd4101777a2e666251b74b6c2fa153dc661920a716b9d2f08d74ec89b8f42bb81,08-01-2025,2025-01-08 07:17:35.000 UTC,410,24765654,0x827922686190790b37229fd06084350E74485b72,5233071,2132909567019209003436,283283474569855965767,392399545956784470
0x9eb86e93a809a41ab0e7cc0ba6f62561fda3015c,0x3f7a235bcacbd2b114fe0b6d594b028d57314d04afc7e169071abca21b3ec8ec,07-01-2025,2025-01-07 01:03:25.000 UTC,325,24711229,0x827922686190790b37229fd06084350E74485b72,5174166,1517086796410247173241,103114556820389891388,383726716109966137
0x38f6d2d9ea493c3c6ee865b5b952b5fe9e3e61fc,0x9790651c1b624ad00f4b2ff6f17b4eac9be3a44b9f792601a8f7ab812ab3cc29,03-06-2025,2025-06-03 16:47:29.000 UTC,786,31089951,0x827922686190790b37229fd06084350E74485b72,15518505,29265035509,382558,1081288
0x8fd1b615c006ebeb8a7cfb00a1dd809f31943b08,0x1bd10ce36985d6eb648418a1ec3df54a30c47584455ca7a781b4395c05d94156,24-12-2024,2024-12-24 23:40:17.000 UTC,690,24147135,0x827922686190790b37229fd06084350E74485b72,4559853,7279089352729757015,5654387904696323949,7762624263198808
0x8810de2baa17067ddcfbd9e8f29c55f070a55f0b,0x317bb8182158a10ac49e945b926d5022b37c51f85224112332c54c374c80d106,10-05-2025,2025-05-10 04:27:41.000 UTC,453,30030957,0x827922686190790b37229fd06084350E74485b72,13279463,59465650687615332,17517430,30793241926552881634621
0x38f6d2d9ea493c3c6ee865b5b952b5fe9e3e61fc,0x4698a140189042edab79b19c77bc8dacabb79fc0ec4121ada24263eff79eaaa9,24-02-2025,2025-02-24 23:57:03.000 UTC,295,26826038,0x827922686190790b37229fd06084350E74485b72,7942243,243921701766781036,974804320,90852717250027938161451
0x9eb86e93a809a41ab0e7cc0ba6f62561fda3015c,0xc7d243150c1451f2529dbd43a0e2f89931111cfe26e42d6bea1bb5fbbd208cc1,20-05-2025,2025-05-20 14:54:33.000 UTC,2048,30481763,0x827922686190790b37229fd06084350E74485b72,14228749,29385344411,377266,1092790
0x095d0de0ecfd6832f1a7961ae26d285d68655d60,0xcbafacb4bd12bde80ad0cc2a057932dbb96f0796ef6e1cbfaa9531ff87dcd8d1,13-05-2025,2025-05-13 05:49:45.000 UTC,328,30163019,0x03a520b32C04BF3bEEf7BEb72E919cf822Ed34f1,2997300,2320969514071558833912,55178490971476466,69808792676385638923120
0x8508fd4238162cb3f3d485f432202af3b40f164e,0x015983974423a2bde3ad01d8ea728006d36b209e56ce89041f90d21d44d2b78a,09-06-2025,2025-06-09 13:02:15.000 UTC,1124,31342394,0x827922686190790b37229fd06084350E74485b72,15995792,12563088375,345987,282082
0x38f6d2d9ea493c3c6ee865b5b952b5fe9e3e61fc,0x3901c0c89949c748e534c1973672c2d71d5efdf180ed967ffef16d0b48b76096,10-01-2025,2025-01-10 03:42:51.000 UTC,333,24845612,0x827922686190790b37229fd06084350E74485b72,5334384,1162144174709817860816,87616344365652366747,277108426552591249
0x2791dc5e14f7680d9d969acc26059ba56403b6d5,0x701250829d2465aa91f9064bb84e9052d0dc6155f5c24b7dd253d52af18ff72d,10-01-2025,2025-01-10 22:33:31.000 UTC,422,24879532,0x827922686190790b37229fd06084350E74485b72,5375316,1958352246835410775483,424064991520003985560,196297781162892306
0xdc98dbffcc648d6088a2ff8f7dc01aef050e58fc,0xbf586543e18ae69860172f75e43347a26aa687266555a51eb5532aecb547d727,03-01-2025,2025-01-03 04:36:45.000 UTC,392,24544829,0x827922686190790b37229fd06084350E74485b72,5007270,2651022643937315645126,214459703462087273646,666236281405809331
0x2791dc5e14f7680d9d969acc26059ba56403b6d5,0xe3576cb24e5a08e883c9760c6997e55dd5b1baa18e43e0163d0b74a515d6c4c1,03-01-2025,2025-01-03 22:28:33.000 UTC,536,24576983,0x827922686190790b37229fd06084350E74485b72,5043600,2886540506993178538623,630664636300325022130,237151548801335453
0xdc98dbffcc648d6088a2ff8f7dc01aef050e58fc,0x63287966376edb37073cba52f6d69c1fa6538de19f42e4a656436fd0ad0f09f0,14-07-2025,2025-07-14 10:45:57.000 UTC,740,32850305,0x827922686190790b37229fd06084350E74485b72,19315017,8689877770689039,16503251,879714395453543166388
0x8508fd4238162cb3f3d485f432202af3b40f164e,0x26e277c1a9541df3c54a695ddf6ce4d138e166d0b1664464884880e0e39ae07c,30-05-2025,2025-05-30 16:16:01.000 UTC,671,30916207,0x827922686190790b37229fd06084350E74485b72,15157199,226043287710645978183,107941851633574322,180879318225568285223
0x8810de2baa17067ddcfbd9e8f29c55f070a55f0b,0x3aa8ba5e10d80560bdbde305248201d1ccdf53e0a27ac9e54de1223346ba93f2,18-07-2025,2025-07-18 18:17:23.000 UTC,952,33036648,0x03a520b32C04BF3bEEf7BEb72E919cf822Ed34f1,3555074,3926645450706030312104,107202401987712206,87641442181169496981490
0x38f6d2d9ea493c3c6ee865b5b952b5fe9e3e61fc,0x1f5371564e5ce1faadf3d6416d89acb5529593a5850b0d9df7c5c7a9160d8561,17-07-2025,2025-07-17 17:00:05.000 UTC,1044,32991129,0x46A15B0b27311cedF172AB29E4f4766fbE7F4364,446394,28511406569,74766,1351464
0x8508fd4238162cb3f3d485f432202af3b40f164e,0x2a58c727e79d1ef0cbcc630d562bfeb1a37a053fc9b021ff66d699ef6ac49171,29-04-2025,2025-04-29 20:36:05.000 UTC,589,29584809,0x03a520b32C04BF3bEEf7BEb72E919cf822Ed34f1,2949048,30871890636691892545,32610486380732375530,25525094409308723
0x38f6d2d9ea493c3c6ee865b5b952b5fe9e3e61fc,0xbd26db60fa18c767c87b173879e35fcc89c858f970231f79840cbdcb8edb7f15,03-06-2025,2025-06-03 14:44:17.000 UTC,623,31086255,0x46A15B0b27311cedF172AB29E4f4766fbE7F4364,395229,5673511013,8819,275035
0x8508fd4238162cb3f3d485f432202af3b40f164e,0x7a011caf9f9707d72cb453688ec5591da1733d6c01d3467671c6b9af8a1f1a7e,21-05-2025,2025-05-21 16:23:43.000 UTC,676,30527638,0x827922686190790b37229fd06084350E74485b72,14329360,19887816033,550236,443995
0x2791dc5e14f7680d9d969acc26059ba56403b6d5,0x3d1e3f93504206446dd1bdd0511be93b6f8603e8e5cdb689ace3cfbe332f2871,17-01-2025,2025-01-17 21:14:03.000 UTC,566,25179548,0x827922686190790b37229fd06084350E74485b72,5744497,26663487600204190914051,534961177036985925,33001912177525633314842
0x8508fd4238162cb3f3d485f432202af3b40f164e,0x175632b76d5960c4f29d72c1c4958fa9facba578e012909ccbb2200a72ea53d0,09-04-2025,2025-04-09 05:21:03.000 UTC,129,28693358,0x827922686190790b37229fd06084350E74485b72,10787691,215717258449229,79643831684865851681,11334
0x351f61e4c49cf11f24d9f2e737ca5eff81806355,0x5c7a21ef108659c760d0ed14736aca2583026609cc8b186a94e9cca13de0d9e9,02-09-2025,2025-09-02 21:32:05.000 UTC,212,35029689,0x827922686190790b37229fd06084350E74485b72,24446430,328802902441355444,33230926,164665130657053752045605
0x095d0de0ecfd6832f1a7961ae26d285d68655d60,0x6c5e0e15495fe55a68f3d05280cfa9cd27cda95d4e4b8a1dba3ebdb893057082,07-02-2025,2025-02-07 09:14:09.000 UTC,360,26065151,0x03a520b32C04BF3bEEf7BEb72E919cf822Ed34f1,2050680,7808465903068472982602,86308289074690649,200777614125174968228445
0x9eb86e93a809a41ab0e7cc0ba6f62561fda3015c,0x239e04999c3f5080f0d2a6d59b7206ceae1636197b5ea73c6bd78cdf6bca7ab0,03-03-2025,2025-03-03 01:08:13.000 UTC,424,27087373,0x827922686190790b37229fd06084350E74485b72,8311826,2838743819,307703600,134015
0x2791dc5e14f7680d9d969acc26059ba56403b6d5,0x9ae04b23826e554b375c92e25e8e1807d73f5d37c6d6deea4b5b8024fff7a746,13-12-2024,2024-12-13 05:04:25.000 UTC,490,23638459,0x827922686190790b37229fd06084350E74485b72,3935165,3472402564925478970232,448460201744865024975,1369882644972250782
0xdc98dbffcc648d6088a2ff8f7dc01aef050e58fc,0x858c785e1c71d7dab85166a411c311d833f6ae1db36272b48bf0665b4ad31013,16-01-2025,2025-01-16 18:33:49.000 UTC,321,25131541,0x827922686190790b37229fd06084350E74485b72,5677403,121602377183249485900204,836257490015146228935,26604044663053160401805
0x8fd1b615c006ebeb8a7cfb00a1dd809f31943b08,0xe11a4bda174461f234b5a25c2bf235270d4b136669b956a7879f8a82d2339eaa,21-12-2024,2024-12-21 05:24:27.000 UTC,361,23984660,0x827922686190790b37229fd06084350E74485b72,4349624,7370894689592480815,6677884196678667100,6976293314761177
0x2791dc5e14f7680d9d969acc26059ba56403b6d5,0x83ba928afe278536b74002be47053c6535043fda8382f66c7212ad0429749a8d,15-07-2025,2025-07-15 12:28:59.000 UTC,293,32896596,0x03a520b32C04BF3bEEf7BEb72E919cf822Ed34f1,3528772,112927168662188005755,102203136819400027,210993782197107146540
0x9eb86e93a809a41ab0e7cc0ba6f62561fda3015c,0xde50aabe395f02db24653a4c53fc30794d36c6cc6fff8752a557f8c7e246f82f,15-12-2024,2024-12-15 08:46:19.000 UTC,228,23731516,0x827922686190790b37229fd06084350E74485b72,4037084,1803891441710127999982,900350941680810716442,776762431715167878
0x8508fd4238162cb3f3d485f432202af3b40f164e,0x2632a2655bb3ae25f354721a34b4bcc815aae3b81a3ef3ab4dec23e8214318a7,28-06-2025,2025-06-28 15:12:01.000 UTC,371,32167087,0x03a520b32C04BF3bEEf7BEb72E919cf822Ed34f1,3439231,225866103060502977337,62318080911923387,260486670762320992247
0x8fd1b615c006ebeb8a7cfb00a1dd809f31943b08,0x5cd56082905dae9d48976d35f67573c5d12a930a085e6cb5a875a754e67f3616,13-12-2024,2024-12-13 02:58:57.000 UTC,350,23634695,0x827922686190790b37229fd06084350E74485b72,3915693,9591911428590723842,4152388758593455919,2186828900913787
0xdc98dbffcc648d6088a2ff8f7dc01aef050e58fc,0x953fe8b858b15824c08d852214bb2225b90198ecd4809ab27be2eae9d48d7f67,07-01-2025,2025-01-07 02:54:05.000 UTC,657,24714549,0x827922686190790b37229fd06084350E74485b72,5174111,17056898929837086182,3608279801187480113,1716591192173512
0x38f6d2d9ea493c3c6ee865b5b952b5fe9e3e61fc,0xeba32edec0aa8f000c56e39ff298d81ba73a8893cb7268a524e53f63493fbe4e,09-01-2025,2025-01-09 16:26:23.000 UTC,760,24825318,0x827922686190790b37229fd06084350E74485b72,5309798,1143115275088849854141336,595546451444604122451,37954902370600506262719
0x8fd1b615c006ebeb8a7cfb00a1dd809f31943b08,0x593bbdcde75a8ca955367c6c3ca3d879f5ed63d8a80ef56922246f69ae1c6f25,24-12-2024,2024-12-24 00:01:43.000 UTC,478,24104578,0x827922686190790b37229fd06084350E74485b72,4523250,2662566452757920969244,2414464612225293552584,2543450696151696724
0x8508fd4238162cb3f3d485f432202af3b40f164e,0xd776242e6d5af61756dff4496da0d940040669e3aec61da5151cd44b2c79b190,22-05-2025,2025-05-22 13:38:57.000 UTC,1598,30565895,0x827922686190790b37229fd06084350E74485b72,14418788,18381248707,818315,100069
0x351f61e4c49cf11f24d9f2e737ca5eff81806355,0x7fe1aa102ca13febc712c50263fd70c5ed373a80141b096249a8d9f2f4cd2f65,10-12-2025,2025-12-10 20:41:53.000 UTC,238,39304983,0x827922686190790b37229fd06084350E74485b72,34817857,58519372540605438,61675319,47890382574514449836758
0x095d0de0ecfd6832f1a7961ae26d285d68655d60,0x9641f781ede9fe4108fbf38a65931e36dd8041d4638b42a8928aa69afab9050d,04-06-2025,2025-06-04 07:39:51.000 UTC,434,31116722,0x03a520b32C04BF3bEEf7BEb72E919cf822Ed34f1,3166659,213569183333613223039,316438854143345216,488785010687333376221
0x351f61e4c49cf11f24d9f2e737ca5eff81806355,0x18e1705bb449bfd355d0aadf1b21fda56c246fb1b701b30d4ed186f4b352a965,14-08-2025,2025-08-14 03:16:45.000 UTC,696,34176029,0x827922686190790b37229fd06084350E74485b72,22326349,1222814369501981128,724868576,345658552350389420275163
0x38f6d2d9ea493c3c6ee865b5b952b5fe9e3e61fc,0x0dc7cb9329f037c0a80be19346cf156e0bb0f71c2e906697fabc6552a4c60552,06-06-2025,2025-06-06 20:45:29.000 UTC,830,31226691,0x46A15B0b27311cedF172AB29E4f4766fbE7F4364,398192,5468565995,217406,55874
0x38f6d2d9ea493c3c6ee865b5b952b5fe9e3e61fc,0x001a48f976dff7481f03bcaf156080defdb53a51e4162adbc262a1781a2656d9,01-03-2025,2025-03-01 19:34:27.000 UTC,339,27034160,0x827922686190790b37229fd06084350E74485b72,8233279,19347051969625015666036,102670790923073027,147813224767223000245684
0xdc98dbffcc648d6088a2ff8f7dc01aef050e58fc,0x4c201dd54b91163badd5fd941ff017e7157225ad03b33865bd21e1f2330a1680,26-05-2025,2025-05-26 10:49:23.000 UTC,304,30733608,0x46A15B0b27311cedF172AB29E4f4766fbE7F4364,387624,1563859534901855,30620162940853637750,69756508
0x8fd1b615c006ebeb8a7cfb00a1dd809f31943b08,0xcfa4e8ee0e2efbf124f81ce2b77694e839052399a8be7e072eebcb731e320bcb,09-01-2025,2025-01-09 13:22:29.000 UTC,970,24819801,0x827922686190790b37229fd06084350E74485b72,5302221,27815766478114476229072,884798334642826355,17961533665942642834281
0x351f61e4c49cf11f24d9f2e737ca5eff81806355,0x15a4bea085147458a58488dec62014a638541933df24cfa8e4b5a2f4851ef1f4,04-09-2025,2025-09-04 04:54:43.000 UTC,137,35086168,0x827922686190790b37229fd06084350E74485b72,24584973,291414321005386413,19371999,153564799050683270979893
0xdc98dbffcc648d6088a2ff8f7dc01aef050e58fc,0x57b3eb985c517fdf5139d73f21ebb8abe6fb50dbfca9203777e7a2f207e005e2,05-07-2025,2025-07-05 03:15:37.000 UTC,899,32447995,0x46A15B0b27311cedF172AB29E4f4766fbE7F4364,428278,10628337393805465851791,108154896651326709,438724703612669696
0x9eb86e93a809a41ab0e7cc0ba6f62561fda3015c,0x9ab5bd4780f9df41ad20edcf7b91c5e4082c86b7460a6414f7b03e0edc893bd7,08-02-2025,2025-02-08 05:34:09.000 UTC,319,26101751,0x827922686190790b37229fd06084350E74485b72,6913842,5987490655122994492196,46722561151278662,90339087987577470697977
0x095d0de0ecfd6832f1a7961ae26d285d68655d60,0x3a9fc15fbcbb4f00178873afb2ae95f633b9a1dc25192e2fd2fc8ab0beda387b,07-02-2025,2025-02-07 16:12:19.000 UTC,397,26077696,0x03a520b32C04BF3bEEf7BEb72E919cf822Ed34f1,2052533,7663556197885119041624,89120973449843188,198150071331978871957217
0x9eb86e93a809a41ab0e7cc0ba6f62561fda3015c,0x08ceb22a63b8899b7a265649d201e5b4f0003f8a772778ff1050ba8163e60400,25-02-2025,2025-02-25 12:11:49.000 UTC,303,26848081,0x827922686190790b37229fd06084350E74485b72,7975766,4180428180,151007265,529673
0xdc98dbffcc648d6088a2ff8f7dc01aef050e58fc,0xc78cb5de6e010282a7b0315db6ab14c5d45a0fd59a508d9bd399f8d0b53d1883,20-04-2025,2025-04-20 15:18:37.000 UTC,541,29186485,0x03a520b32C04BF3bEEf7BEb72E919cf822Ed34f1,2906460,11981742365735736968638,486666861105794038,238729676235582199562233
0xdc98dbffcc648d6088a2ff8f7dc01aef050e58fc,0x5bc839182bfafc9f212cb961b1e23a81cc03536cbddab6e289ff54dde1cb3aa3,10-01-2025,2025-01-10 10:37:41.000 UTC,464,24858057,0x827922686190790b37229fd06084350E74485b72,5349505,1572133064126664558911,412838429905331558293,77163232972753584
0x0b27b59171a4ffe19f23d54126cd797be17c6551,0x1eafc18b2e4fe1340545fb83c12e2c77c523cbda5003bf31076ce4a2c9b13a4d,12-12-2025,2025-12-12 09:22:49.000 UTC,662,39371011,0x03a520b32C04BF3bEEf7BEb72E919cf822Ed34f1,4282866,801317107638303486656,16933553682023285,22951863161702034173367
0xdc98dbffcc648d6088a2ff8f7dc01aef050e58fc,0x6aedf5b9c122166791d98b1b3754d6b13d542de386b8815afe487a15348b8ea5,23-05-2025,2025-05-23 05:13:57.000 UTC,940,30593945,0x46A15B0b27311cedF172AB29E4f4766fbE7F4364,385736,12947233303033970342300,563904027384982194,58786156940076177
0x8810de2baa17067ddcfbd9e8f29c55f070a55f0b,0xade2f99112b11974763c54ca4d1f891085dc6dec63891dc80d5490b7cd93b427,20-08-2025,2025-08-20 18:39:25.000 UTC,271,34462909,0x03a520b32C04BF3bEEf7BEb72E919cf822Ed34f1,3784441,897732057402175218619,23400933963862397,20990859033611495979518
0x2791dc5e14f7680d9d969acc26059ba56403b6d5,0x71537c9e21e1940620c0e17d93ba611b469fda8e289c1c1edf25703390db1216,24-12-2024,2024-12-24 22:11:11.000 UTC,267,24144462,0x827922686190790b37229fd06084350E74485b72,4559882,7532627237438138335,2940997929637620518,4057259293749062
0x2791dc5e14f7680d9d969acc26059ba56403b6d5,0xad47092f73db27eaef163607200c3b9fb6af4633de66cfd837b283667e31a8df,18-01-2025,2025-01-18 21:26:19.000 UTC,443,25223116,0x827922686190790b37229fd06084350E74485b72,5804956,133231400247245044974080,530408527903745037186,13105873437173547144069
0xdc98dbffcc648d6088a2ff8f7dc01aef050e58fc,0x013198092e4fe339816e37069fb1ab90b1b4253e77daf2b7c68eaf1bcceea6cc,11-01-2025,2025-01-11 06:45:53.000 UTC,356,24894303,0x827922686190790b37229fd06084350E74485b72,5388681,1288874514891245712410,425254377188226517078,3225297856942256
0xdc98dbffcc648d6088a2ff8f7dc01aef050e58fc,0x3ce85435197814b2b7f7d87b9776d45e008ad7fb196fcbc16a754c2707e01ad6,29-05-2025,2025-05-29 01:50:37.000 UTC,499,30847045,0x827922686190790b37229fd06084350E74485b72,15011461,6541098510,129848,197266
0x8508fd4238162cb3f3d485f432202af3b40f164e,0x3b5059b2b81bd368814a0bc274f1b6494c45cc2779617c70f5f21ea01a548c3b,06-06-2025,2025-06-06 08:46:37.000 UTC,756,31205125,0x827922686190790b37229fd06084350E74485b72,15746331,12772428111,232660,406031
0x38f6d2d9ea493c3c6ee865b5b952b5fe9e3e61fc,0x253e5bbcbff0e08ea645e7f8dd26ecb7f0856264ef2aa170dfbbe826140b3e00,06-06-2025,2025-06-06 08:20:53.000 UTC,1361,31204353,0x827922686190790b37229fd06084350E74485b72,15744906,26484064855,1127607,195986
0x9eb86e93a809a41ab0e7cc0ba6f62561fda3015c,0x0c21dae60f2cb277fa0050d63e1c669d53fd05fe9c37d25ae9f81525b8e5aac7,08-01-2025,2025-01-08 01:27:41.000 UTC,303,24755157,0x827922686190790b37229fd06084350E74485b72,5219453,1154720953942381021957,99800606821209439,1241312354503335831222
0x095d0de0ecfd6832f1a7961ae26d285d68655d60,0xe4fe1990795ce8833cb5e4ef5935e57cde768ba962400a854ce509b9f74eb08a,20-01-2025,2025-01-20 05:10:39.000 UTC,284,25280246,0x03a520b32C04BF3bEEf7BEb72E919cf822Ed34f1,1856733,2529838579128199055342,138681168364521779,40973148424456176550429
0x2791dc5e14f7680d9d969acc26059ba56403b6d5,0x31f27c32fd54d771171c37d760c0cef227f633960de9ba64d7a21663747de277,01-01-2025,2025-01-01 23:05:57.000 UTC,589,24491705,0x827922686190790b37229fd06084350E74485b72,4941022,8544091241205466974,1124489858232148675,7791838462307413
0x8810de2baa17067ddcfbd9e8f29c55f070a55f0b,0x29709b87850616951071d1b4d9c2f84f5dad25dad2b8eedd4c6233788c1a859f,03-04-2025,2025-04-03 16:21:27.000 UTC,429,28453970,0x03a520b32C04BF3bEEf7BEb72E919cf822Ed34f1,2781543,228135089522990068902,3637472655508323,6011787068132403095834
0x8508fd4238162cb3f3d485f432202af3b40f164e,0x94ed8912670fedcddce5962dcac282ae5ac9125c7b79139bcc538c118b245cbc,15-05-2025,2025-05-15 23:11:27.000 UTC,115,30280670,0x827922686190790b37229fd06084350E74485b72,13791924,190764023019205288446,121842138952208169,181946008955315667385
0x38f6d2d9ea493c3c6ee865b5b952b5fe9e3e61fc,0xe0c021b0c8cd87bd68a9a77d010c3464ed04834f91582f5e2d6a9a629d23fa01,11-06-2025,2025-06-11 04:43:01.000 UTC,420,31413817,0x46A15B0b27311cedF172AB29E4f4766fbE7F4364,402708,5410483935,76405,194171
0x8810de2baa17067ddcfbd9e8f29c55f070a55f0b,0x6b405457a07ef8c9e8aec3b3d3b3af1d1d6a9768aaf45e12d2858f84fab8fae9,17-07-2025,2025-07-17 00:20:25.000 UTC,271,32961139,0x03a520b32C04BF3bEEf7BEb72E919cf822Ed34f1,3541123,4763994916593112261316,119137421208885660,116072279961816936876998
0x9eb86e93a809a41ab0e7cc0ba6f62561fda3015c,0x33d1cba4ce5a0db9b6a6051c817f7217eb8329820ba92d3e5d9b0fb5a9af77a5,08-12-2024,2024-12-08 22:10:07.000 UTC,271,23453230,0x827922686190790b37229fd06084350E74485b72,3686347,3449506977397100,233126576814513411,1243390603
0x9eb86e93a809a41ab0e7cc0ba6f62561fda3015c,0xb5c14c209efe65249e26b8e04479b4f1b353456a00b3bba9fb522a90f3589e3f,07-01-2025,2025-01-07 16:51:47.000 UTC,365,24739680,0x827922686190790b37229fd06084350E74485b72,5198924,1432717595382772197015,63256070779633208688,412187894327172353
0xdc98dbffcc648d6088a2ff8f7dc01aef050e58fc,0xb99a97b0ac8d928c63535cf594e2be3c21125ed9e57f883363bee7b81f636f84,14-01-2025,2025-01-14 03:59:21.000 UTC,314,25018907,0x827922686190790b37229fd06084350E74485b72,5526219,7890191819638494649,2369717874145507807,299858842226764
0x38f6d2d9ea493c3c6ee865b5b952b5fe9e3e61fc,0x073a906a66cfa55b63e87919f8169027e4b0093ab3d21d898c085c24820abf2e,29-12-2024,2024-12-29 08:06:31.000 UTC,412,24335122,0x827922686190790b37229fd06084350E74485b72,4772984,584946024276304627,1000000000,47640142876988048187566
0x8fd1b615c006ebeb8a7cfb00a1dd809f31943b08,0xac1fad9da9db69878ea74ebfc8fafcb67e7eddf9cb56f94eaa8086d8e181e29e,20-12-2024,2024-12-20 10:09:13.000 UTC,354,23950003,0x827922686190790b37229fd06084350E74485b72,4320917,1408864165398966609789,541476882580879557707,337882415969004672
0x9eb86e93a809a41ab0e7cc0ba6f62561fda3015c,0xe352847b063c6ab8a1f66524815991af59de506d8a829a99bf8060bce649b9ee,08-01-2025,2025-01-08 04:57:49.000 UTC,341,24761461,0x827922686190790b37229fd06084350E74485b72,5227535,676257676803522265611462,22948261269814041210,31189622360072119123968
0x8810de2baa17067ddcfbd9e8f29c55f070a55f0b,0xb9b449bfc40215865194b32027e039304c598d0e107626c32630a71095a0cbc5,27-03-2025,2025-03-27 07:40:29.000 UTC,426,28135941,0x03a520b32C04BF3bEEf7BEb72E919cf822Ed34f1,2667161,250406478292481291759,4480697744415822,6105209402814267948413
0x0b27b59171a4ffe19f23d54126cd797be17c6551,0x3fcdc9681741a1c84a5928ef68d2a7006e57565aa866fe567cdee9cc8181a712,16-06-2025,2025-06-16 15:45:39.000 UTC,453,31649696,0x03a520b32C04BF3bEEf7BEb72E919cf822Ed34f1,3296702,11873914358698374322694,334784400231058566,248413995733278972995031
0x095d0de0ecfd6832f1a7961ae26d285d68655d60,0x7067ddfb06ba78be321185f65c48a559fa71ba5e58325219c85fc71fb76cc595,27-05-2025,2025-05-27 13:51:15.000 UTC,449,30782264,0x03a520b32C04BF3bEEf7BEb72E919cf822Ed34f1,3106180,228239154969142301161,378979792155617454,466061678954515674866
0xdc98dbffcc648d6088a2ff8f7dc01aef050e58fc,0xddc4aecc1c672fcfc696d96986f28c86a21adec4a5a0d9178e460f64bccc131c,14-01-2025,2025-01-14 21:11:05.000 UTC,243,25049859,0x827922686190790b37229fd06084350E74485b72,5567905,190880520881066810227435,474072707909491914060,16054938518272785131121
0x9eb86e93a809a41ab0e7cc0ba6f62561fda3015c,0xcc6f256cbf25747bcb64a14d6bffbbe3387c994b5baa361bb6e283c222ab9366,02-01-2025,2025-01-02 02:15:03.000 UTC,427,24497378,0x827922686190790b37229fd06084350E74485b72,4953964,540425970872637830871389,143000612119559849025,22162021098280993375513
0x8810de2baa17067ddcfbd9e8f29c55f070a55f0b,0x9141ca12bc86f0a4fde1099985ca158ced4fde3f59d5d5aea3ff82888869d6fe,01-06-2025,2025-06-01 14:13:37.000 UTC,546,30998935,0x03a520b32C04BF3bEEf7BEb72E919cf822Ed34f1,3151664,31459289334692804,1237374797,696656304667234632878
0x2791dc5e14f7680d9d969acc26059ba56403b6d5,0x42228b2e589b3fd34943200308addd7dc46698c9e6a3d4713ba5d01aa5b3d7e0,27-12-2024,2024-12-27 13:20:59.000 UTC,505,24258156,0x827922686190790b37229fd06084350E74485b72,4691678,6500766504348929735,2186710507961521352,3936213878043258
0x38f6d2d9ea493c3c6ee865b5b952b5fe9e3e61fc,0x7ff37a381d8cad7115f2ad242958acee36ad85142232cec05fc11e45fc468d26,08-01-2025,2025-01-08 06:11:45.000 UTC,312,24763679,0x827922686190790b37229fd06084350E74485b72,5217348,11343128564314061664,1216383747676275893,2405965406569255
0x095d0de0ecfd6832f1a7961ae26d285d68655d60,0x4e4610cf5ed9d9c3ac5b0fe5d135772115c0f53ae97e9196a3ff0050155bf7a6,15-05-2025,2025-05-15 12:16:59.000 UTC,227,30261036,0x03a520b32C04BF3bEEf7BEb72E919cf822Ed34f1,3032299,6289495783993882604659,59832660909995096,234280266772985242993059
0x8fd1b615c006ebeb8a7cfb00a1dd809f31943b08,0x3afb50ea269400d5f3e2e12198b1752491e3a7d65ffb5127be1c5184076619d9,06-01-2025,2025-01-06 18:57:35.000 UTC,405,24700254,0x827922686190790b37229fd06084350E74485b72,5161973,2720884003462042741705,60244657037831199,9351562638001600359981
0xdc98dbffcc648d6088a2ff8f7dc01aef050e58fc,0xec8dbbcc7ed83b5639fc891a48f27ad7b4000d8061c601322de3a880d14cb8ba,27-12-2024,2024-12-27 19:02:15.000 UTC,314,24268394,0x827922686190790b37229fd06084350E74485b72,4695656,2345157953510531171,589806236483876691,3841912500759308
0x9eb86e93a809a41ab0e7cc0ba6f62561fda3015c,0xb051b20cde69c4a12fe2bd101bf8d95ee672ecf7d4b442e8f3554fbb588fb9bb,04-01-2025,2025-01-04 14:08:15.000 UTC,406,24605174,0x827922686190790b37229fd06084350E74485b72,5067913,1467787370231595319360,89350639133273212,1800878908193916394241
0x8810de2baa17067ddcfbd9e8f29c55f070a55f0b,0x1b314a0e25d34f502c9f97930f7eb1dd1c08df72dd9d40cd1f58b3d8af72a5dc,13-03-2025,2025-03-13 06:04:47.000 UTC,422,27528270,0x827922686190790b37229fd06084350E74485b72,8955405,174350644138877226,130046760,77659841379952668773189
0x2791dc5e14f7680d9d969acc26059ba56403b6d5,0x0d899aec1c4f61f1188e03fd9aa72a6e4bc2aae1f3d1a0bf9cacac425ffb4d7c,16-01-2025,2025-01-16 06:45:03.000 UTC,850,25110278,0x827922686190790b37229fd06084350E74485b72,5647758,13693819800608587517434,152767128281668807,24061628866104800291119
0x9eb86e93a809a41ab0e7cc0ba6f62561fda3015c,0xbce04848496c478035576a104f2456374c49e4b90e5dbe4cf5010d926f9c07b3,25-02-2025,2025-02-25 19:00:23.000 UTC,227,26860338,0x827922686190790b37229fd06084350E74485b72,7994378,4057273307,487260600,126322
0x38f6d2d9ea493c3c6ee865b5b952b5fe9e3e61fc,0x814e769b4e29f4612c083fa767a68156454ccefb9f291c60caaabb7f39dde2b0,03-06-2025,2025-06-03 16:25:13.000 UTC,498,31089283,0x46A15B0b27311cedF172AB29E4f4766fbE7F4364,395314,5665505177,12497,271016
0x38f6d2d9ea493c3c6ee865b5b952b5fe9e3e61fc,0xe176c850162755bf7e8644a06ef24737bef4bace9525a2bfbcb34479b871afb1,03-06-2025,2025-06-03 14:20:15.000 UTC,1132,31085534,0x46A15B0b27311cedF172AB29E4f4766fbE7F4364,395203,5675250641,182189,101506
0x9eb86e93a809a41ab0e7cc0ba6f62561fda3015c,0xa2c2a8dc4b829499600366074c0833e24b099476c27d640af077cd13bf470199,01-03-2025,2025-03-01 06:41:51.000 UTC,232,27010982,0x827922686190790b37229fd06084350E74485b72,8199566,3106840130,252916395,234570
0x9eb86e93a809a41ab0e7cc0ba6f62561fda3015c,0x05367a0d872758cf5982c13b65cd82da8ab93e850240f096bddc683a0373dca1,01-03-2025,2025-03-01 13:51:49.000 UTC,372,27023881,0x827922686190790b37229fd06084350E74485b72,8218293,3096586631,371379089,91908
0x2791dc5e14f7680d9d969acc26059ba56403b6d5,0x1512c3f6b20eab56b40126b597164b0dd4922684fb7e802ff5e89bc86bdcfd88,14-12-2024,2024-12-14 01:32:51.000 UTC,463,23675312,0x827922686190790b37229fd06084350E74485b72,3975597,11574884085683688539,3167747347462698879,3797400944194541
0x9eb86e93a809a41ab0e7cc0ba6f62561fda3015c,0xc8194e45307a2567cd47d90f2eaaed68b4645d2ffac17125f217da2101b66561,04-01-2025,2025-01-04 14:59:33.000 UTC,565,24606713,0x827922686190790b37229fd06084350E74485b72,5069739,1444150969333417080318,166316946983318825,1239572376915321556905
0x9eb86e93a809a41ab0e7cc0ba6f62561fda3015c,0x1ff1ae069034537f4f441d1f840b474f97092f8157831e56ae1ab63782fbd26b,25-02-2025,2025-02-25 14:02:03.000 UTC,466,26851388,0x827922686190790b37229fd06084350E74485b72,7981050,4175145624,543132112,87360
0xdc98dbffcc648d6088a2ff8f7dc01aef050e58fc,0x268324f480432578139d693379c7e8e2a5c3e8ef32f653edc0176e4e666233a4,03-07-2025,2025-07-03 13:32:35.000 UTC,743,32380104,0x46A15B0b27311cedF172AB29E4f4766fbE7F4364,426370,10955109418442024686592,118130592697403459,445022247820518656
0xdc98dbffcc648d6088a2ff8f7dc01aef050e58fc,0x460f062a5a6948820baff2593c3ba49cee7882c5dfa10a9bef80926c47524360,14-07-2025,2025-07-14 23:49:51.000 UTC,493,32873822,0x46A15B0b27311cedF172AB29E4f4766fbE7F4364,441703,14957156043,73241,674983
0x2791dc5e14f7680d9d969acc26059ba56403b6d5,0x6ce3ea4389b6c52b0104e4f3c50f8d680d262eaf3c17fe8b4b5841db538b19d3,15-12-2024,2024-12-15 19:15:01.000 UTC,257,23750377,0x827922686190790b37229fd06084350E74485b72,4055282,3624948957355685413945,1217032584985737497944,1052876912257389347
0x9eb86e93a809a41ab0e7cc0ba6f62561fda3015c,0xae124106005a540cc18c6f9162968819e1ae3645b9e2c53ffe97dc6f862c75ef,18-12-2024,2024-12-18 19:40:55.000 UTC,379,23880754,0x827922686190790b37229fd06084350E74485b72,4227499,1323854040358176506950,616467631820684051049,612883922284940495
0x38f6d2d9ea493c3c6ee865b5b952b5fe9e3e61fc,0xb96632dbc2c29a46ff2739da9164b12f84acfe2ade6df25ccfdd57a38a338901,17-01-2025,2025-01-17 21:14:35.000 UTC,481,25179564,0x827922686190790b37229fd06084350E74485b72,5744542,13691192416130451880024,274692362821918017,49284514788564283559872
0x2791dc5e14f7680d9d969acc26059ba56403b6d5,0xe0207a0f4e212ab5c5ca1bbaf592b407d509777a78c96e7e0abc8251d3a2b92d,27-12-2024,2024-12-27 01:07:57.000 UTC,262,24236165,0x827922686190790b37229fd06084350E74485b72,4666404,5706395250546041285,3874095905350613320,1612412668835875
0x9eb86e93a809a41ab0e7cc0ba6f62561fda3015c,0x1d15f2e7f1eb4d9c18a03df214123b7b2ce0977d4ac35403b2bef228cb17e52b,04-03-2025,2025-03-04 07:15:07.000 UTC,493,27141580,0x827922686190790b37229fd06084350E74485b72,8396189,2476273383,249460983,129012
0x9eb86e93a809a41ab0e7cc0ba6f62561fda3015c,0x1a9ebf74b0aa660988e4293379ef47e34870d35293203deb184321f2432af88d,13-05-2025,2025-05-13 05:39:15.000 UTC,214,30162704,0x827922686190790b37229fd06084350E74485b72,13551139,10389674836,265319,254124
0x38f6d2d9ea493c3c6ee865b5b952b5fe9e3e61fc,0xf2ae12222d8084b01c97d49004940c337a3bf94432b7ef0a55468ec244e53053,12-07-2025,2025-07-12 19:55:31.000 UTC,467,32780392,0x46A15B0b27311cedF172AB29E4f4766fbE7F4364,437250,28752399820,1426553,10110
0x38f6d2d9ea493c3c6ee865b5b952b5fe9e3e61fc,0x515de203b1f90b10b83ff393a3133b1e89c8039a4d4d6a633f0140c93e0e8528,07-01-2025,2025-01-07 02:54:25.000 UTC,342,24714559,0x827922686190790b37229fd06084350E74485b72,5174147,12454729365835757649,2633704952517163982,1254504350419895
0x9eb86e93a809a41ab0e7cc0ba6f62561fda3015c,0xf5bb94f49eb3167d6f9e3f5f47cca2717bfb6e7cdffe1fd6d7344af41abd8061,08-02-2025,2025-02-08 05:32:09.000 UTC,320,26101691,0x827922686190790b37229fd06084350E74485b72,6913771,1626409228,461078766,564188
0x9eb86e93a809a41ab0e7cc0ba6f62561fda3015c,0x7c38d10f47ac4054a5a081cda37b87431f2088f5a91cfb4fe2950e5a62ddb8c4,09-01-2025,2025-01-09 18:14:45.000 UTC,472,24828569,0x827922686190790b37229fd06084350E74485b72,5314372,513492654499133799656065,542103302630946937138,11972324862663141826708
0x2791dc5e14f7680d9d969acc26059ba56403b6d5,0xa03e40d24082afc54b5fd26beceb0cdf1ad5cdd06e507e20eaf935ca00a61f41,06-01-2025,2025-01-06 05:04:39.000 UTC,511,24675266,0x827922686190790b37229fd06084350E74485b72,5133664,1439777708322837104,639208159,45175875398042837796323
0x8fd1b615c006ebeb8a7cfb00a1dd809f31943b08,0x3e44a3513ad9def0aad36de105a498682ac17a0d5e5db0056a37c8b9e5b9b33f,12-02-2025,2025-02-12 17:24:33.000 UTC,409,26295863,0x827922686190790b37229fd06084350E74485b72,7195549,2311417604152263,336869281112736338,885322111
0x8810de2baa17067ddcfbd9e8f29c55f070a55f0b,0xe27e99ee8652242bbd294094f7447dfb9d5edf9a11cbcfcfd816d98f3e9f37e8,21-05-2025,2025-05-21 06:37:45.000 UTC,762,30510059,0x03a520b32C04BF3bEEf7BEb72E919cf822Ed34f1,3070204,10757420836247832968196,391549848279352512,179453760124884760986923
0xdc98dbffcc648d6088a2ff8f7dc01aef050e58fc,0x3c60232c0b1b0f9e568d781f582f709c983e9d2e779d0f91f38611145c292c0b,10-01-2025,2025-01-10 04:39:01.000 UTC,370,24847297,0x827922686190790b37229fd06084350E74485b72,5334372,5154124005299912716,916170919037446642,711751299957182
0x8fd1b615c006ebeb8a7cfb00a1dd809f31943b08,0x90fd0f6e8ef0507b3605e4dd96c0366410207c6d89af83dbe5cf1bf8426fda61,14-12-2024,2024-12-14 10:47:47.000 UTC,323,23691960,0x827922686190790b37229fd06084350E74485b72,3972922,7285615541211027828,3205719455844401524,8887146566988416
0x9eb86e93a809a41ab0e7cc0ba6f62561fda3015c,0x2cbcd2e5599316ad4a5ea0b9b0ea0eb471121ec022afaf87fca043e6201541a5,27-12-2024,2024-12-27 17:58:47.000 UTC,412,24266490,0x827922686190790b37229fd06084350E74485b72,4704685,697553262917271141613,415857461787679522295,237829839476523691
0x351f61e4c49cf11f24d9f2e737ca5eff81806355,0xe4b9d34b052e76d45a516d432c10484f15fc52c4f0eec957c973209f66851920,08-10-2025,2025-10-08 15:50:49.000 UTC,819,36574651,0x827922686190790b37229fd06084350E74485b72,28148456,182156888707078357,12233250,72591037674253143395572
0x8508fd4238162cb3f3d485f432202af3b40f164e,0xf01d11c92f0b549cbb9f2030e52a5d3d37eec722809ab947eed59747c618d172,10-06-2025,2025-06-10 01:24:05.000 UTC,476,31364649,0x827922686190790b37229fd06084350E74485b72,16042407,12517932384,463088,162463
0x095d0de0ecfd6832f1a7961ae26d285d68655d60,0x910a0378b13e51e02edb9329a66de46aeb0cc57254c050eceb2d8fdc3e120cba,15-04-2025,2025-04-15 20:01:35.000 UTC,382,28978974,0x827922686190790b37229fd06084350E74485b72,11273530,143155124731870226975464,89247520458926862905,65604527289132779112451
0x38f6d2d9ea493c3c6ee865b5b952b5fe9e3e61fc,0x435760ef17a56d5ff15132eb0cae28cdc26b72cf09dadbd80803fb71ff510c5a,05-01-2025,2025-01-05 17:50:11.000 UTC,646,24655032,0x827922686190790b37229fd06084350E74485b72,5114834,18399098136117510720653,475551525237144013,17084056740380284209532
0x38f6d2d9ea493c3c6ee865b5b952b5fe9e3e61fc,0xfa12db736139aebc11d7cf4b10267df0787a10b7eb6aaeb63c43822a1bacdebf,05-01-2025,2025-01-05 23:50:49.000 UTC,361,24665851,0x827922686190790b37229fd06084350E74485b72,5108867,17201260334825989748,2326766080889506261,3131978953316654
0x38f6d2d9ea493c3c6ee865b5b952b5fe9e3e61fc,0xb12255b35f6b6a43e465a8217b4c51f8569b8a35110d7f771cc12967900310e6,04-01-2025,2025-01-04 07:28:33.000 UTC,470,24593183,0x827922686190790b37229fd06084350E74485b72,5055052,10123712851335718790,1744211726569992082,1406747885722794
0xdc98dbffcc648d6088a2ff8f7dc01aef050e58fc,0x9d3c536c819a8a9e872997136cd89b86fb28c25a1c1460438bd35bd8f067168f,06-06-2025,2025-06-06 08:21:41.000 UTC,1989,31204377,0x827922686190790b37229fd06084350E74485b72,15744970,10565340549,448683,79342
0x8810de2baa17067ddcfbd9e8f29c55f070a55f0b,0x72e38260fefc3d0e4b60a509a81a09e13722bd516d3f86de6ad7ab94c334feee,31-05-2025,2025-05-31 03:36:35.000 UTC,1623,30936624,0x03a520b32C04BF3bEEf7BEb72E919cf822Ed34f1,3136280,21746536251844109,837228237,492709254650622909945
0x9eb86e93a809a41ab0e7cc0ba6f62561fda3015c,0x3d085e3ace3568ffdc306d44ec172bc87caba04d98267b3223f18e27a516f948,09-01-2025,2025-01-09 01:39:57.000 UTC,1337,24798725,0x827922686190790b37229fd06084350E74485b72,5274277,1191527320463361207230,342373479590020480494,21393611677613280
0x38f6d2d9ea493c3c6ee865b5b952b5fe9e3e61fc,0x6dee9dc5fa75bd22e541a365fff371d54c07ad60aaefe218bb3e563ec7fed28c,05-06-2025,2025-06-05 06:39:07.000 UTC,634,31158100,0x46A15B0b27311cedF172AB29E4f4766fbE7F4364,396702,5647767142,51000,231512
0xdc98dbffcc648d6088a2ff8f7dc01aef050e58fc,0xc87494715cb7f30ef5985bdc258979a3c0849c36e26a0df17cdf74609df8d1ad,10-07-2025,2025-07-10 17:23:09.000 UTC,742,32689421,0x46A15B0b27311cedF172AB29E4f4766fbE7F4364,434366,15405323734,582108,187847
0x38f6d2d9ea493c3c6ee865b5b952b5fe9e3e61fc,0xf159da9389410f78ae44e04e9f463ce37550538b5bbc71ba79d3f07b775e4f62,06-01-2025,2025-01-06 04:49:01.000 UTC,327,24674797,0x827922686190790b37229fd06084350E74485b72,5133300,1927667872165090904091,456119344867162533615,128431228540228337
0x38f6d2d9ea493c3c6ee865b5b952b5fe9e3e61fc,0x54a7f2275c8734e0c3cd3d056fdb92abb085c086d6246c1128888c4ac8ac6780,22-06-2025,2025-06-22 17:05:35.000 UTC,493,31911294,0x827922686190790b37229fd06084350E74485b72,17202334,36219777379,1362397,447867
0x9eb86e93a809a41ab0e7cc0ba6f62561fda3015c,0xa4fbfe6ae6e9a17c71c392084a17abc7b253bd9f4fc9f7480c96915fc2a86a9c,13-12-2024,2024-12-13 20:31:27.000 UTC,461,23666270,0x827922686190790b37229fd06084350E74485b72,3971934,1927174834621897616149,1467101929325170807234,516802176384165671
0xdc98dbffcc648d6088a2ff8f7dc01aef050e58fc,0xa17f2083ca1860e1e3ab93e1c7ad7df4bc0b3ce531a08b9e706fb603c308bea2,08-01-2025,2025-01-08 05:22:05.000 UTC,931,24762189,0x827922686190790b37229fd06084350E74485b72,5228592,837438118600258571568566,83578733666130364199,37399912487773944825457
0xdc98dbffcc648d6088a2ff8f7dc01aef050e58fc,0x6929e87d81b6ef20f72e7a6804f0528bc45d7012ae1765a486f9f49d2dfd83cb,27-05-2025,2025-05-27 09:23:11.000 UTC,484,30774222,0x46A15B0b27311cedF172AB29E4f4766fbE7F4364,388197,1479785105331667,28352242154431727013,67452380
0xdc98dbffcc648d6088a2ff8f7dc01aef050e58fc,0x2675407419f363cbc75ebd4892a733dbdb195cdbd62bfacdbcfa5705571a5c05,16-06-2025,2025-06-16 14:18:13.000 UTC,482,31647073,0x46A15B0b27311cedF172AB29E4f4766fbE7F4364,408165,11166167020417781577282,260265322220375104,299245629479735178
0xdc98dbffcc648d6088a2ff8f7dc01aef050e58fc,0x350cdd4e8c402914ace984c18927510676fdbfbff53bfec9ee7478b1d7e0c407,04-07-2025,2025-07-04 17:24:55.000 UTC,559,32430274,0x46A15B0b27311cedF172AB29E4f4766fbE7F4364,427881,10845484738063714962758,376538451892404842,154172612257374285
0x9eb86e93a809a41ab0e7cc0ba6f62561fda3015c,0xdcc4e7c93a6018183fba24afd21c2b952dc0082a40eb3170774c067004d19aaf,29-05-2025,2025-05-29 13:11:59.000 UTC,496,30867486,0x827922686190790b37229fd06084350E74485b72,15053882,33531961522,1626972,47367
0x2791dc5e14f7680d9d969acc26059ba56403b6d5,0x20f828fac37675aadb5e755c3642231fa0f3e992145bd6d707236b93c873681f,15-12-2024,2024-12-15 02:55:29.000 UTC,258,23720991,0x827922686190790b37229fd06084350E74485b72,4023750,8721636103517995345,1579056137072846070,3379819862306663
0x8fd1b615c006ebeb8a7cfb00a1dd809f31943b08,0x4b00f5dba7061cfefb934853e9a8e89908393d0f6e71d42a4199043af78f9533,11-02-2025,2025-02-11 01:41:29.000 UTC,323,26224371,0x827922686190790b37229fd06084350E74485b72,7090874,2374672075596937,438956129902181729,657661628
0x8fd1b615c006ebeb8a7cfb00a1dd809f31943b08,0x0fe1361b956663c54468bfd7b6505fb3763fd8620526adeea8447dab4b6982f3,19-12-2024,2024-12-19 22:29:13.000 UTC,472,23929003,0x827922686190790b37229fd06084350E74485b72,4293414,1432347256029816870417,692828299138516571817,292291494651644895
0x2791dc5e14f7680d9d969acc26059ba56403b6d5,0x7c9caa7e3b0f690bd1312598a765da36da5e2b3e4665cba300fdeaeb3b695de2,09-01-2025,2025-01-09 03:58:47.000 UTC,438,24802890,0x827922686190790b37229fd06084350E74485b72,5279591,1595924928891077123007248,3531241458607443294479,1614766653527685915691
0x0b27b59171a4ffe19f23d54126cd797be17c6551,0x87456214233a09ada5b91ac28236e5e67fe0cbd5eec51662581cf5280338c6d5,23-08-2025,2025-08-23 06:06:47.000 UTC,260,34569930,0x03a520b32C04BF3bEEf7BEb72E919cf822Ed34f1,3798156,848251545824212117886,18292209325187900,23924215156642127452643
0x2791dc5e14f7680d9d969acc26059ba56403b6d5,0x665f86fd545e9e7ead5f312a0c43522f5c157bb2fe2e06c0b0c8e77841141fdc,19-01-2025,2025-01-19 09:32:11.000 UTC,545,25244892,0x827922686190790b37229fd06084350E74485b72,5834475,196349053689594470108653,481743774023595758582,26304052954862158017095
0xdc98dbffcc648d6088a2ff8f7dc01aef050e58fc,0x5606cd5fa7ca45ec80b2f0149c3b073d8fbbb05cacae5555307ebbdf173874d1,29-05-2025,2025-05-29 13:14:27.000 UTC,332,30867560,0x827922686190790b37229fd06084350E74485b72,15054043,6286317327,299263,14645
0x9eb86e93a809a41ab0e7cc0ba6f62561fda3015c,0x3f1b1b2d4de8eed40546919b69a5f193d0e14dd23feb4142ac9a00a8262d6749,27-12-2024,2024-12-27 02:56:27.000 UTC,512,24239420,0x827922686190790b37229fd06084350E74485b72,4672485,741395424058355251617,250075787600628708518,433800506724469565
0x8508fd4238162cb3f3d485f432202af3b40f164e,0x648210738bb817117a7e15da05b2d7f691b776fd12c717a468617c973a83c773,12-04-2025,2025-04-12 09:19:21.000 UTC,641,28830107,0x827922686190790b37229fd06084350E74485b72,11003344,118002674178523264078648,486987049150377373937,33677376195472262021327
0x2791dc5e14f7680d9d969acc26059ba56403b6d5,0x1a607c3956f7d8779eaaf93626bbf1b53e8eb764fd416160af18f9018ed3fc8b,12-12-2024,2024-12-12 06:38:19.000 UTC,341,23598076,0x827922686190790b37229fd06084350E74485b72,3882262,3656175400095415062543,1648494790208419070144,802726820669152519
0x9eb86e93a809a41ab0e7cc0ba6f62561fda3015c,0x603c1b9ba8e939a7015c3b09885e2132d21783311c44b556366ba680f226fc52,23-12-2024,2024-12-23 14:25:47.000 UTC,540,24087300,0x827922686190790b37229fd06084350E74485b72,4501511,942415170677471977953,354584951320996890973,506064344642842278
0x2791dc5e14f7680d9d969acc26059ba56403b6d5,0x8dd752736e5859b5a1f0a5447528eb753f9f024922e21d8b78fae79c195025ba,17-01-2025,2025-01-17 12:32:17.000 UTC,350,25163895,0x827922686190790b37229fd06084350E74485b72,5721522,344732133568487425,3986781,27442267966027726029717
0x2791dc5e14f7680d9d969acc26059ba56403b6d5,0x766635462c6e33e550b8e04d2898fb86685041568ca06cd5ae6fb23f03bda80c,09-01-2025,2025-01-09 23:14:03.000 UTC,944,24837548,0x827922686190790b37229fd06084350E74485b72,5313343,8261920379248238929,1260675431448701167,1344263123568887
0x8508fd4238162cb3f3d485f432202af3b40f164e,0x42a0ff2d8bb234a7d273341b80a77971869cc2ae0d2269e8ff7477544b1e676b,22-04-2025,2025-04-22 19:52:07.000 UTC,795,29281090,0x03a520b32C04BF3bEEf7BEb72E919cf822Ed34f1,2915604,4663302350055322371844,223714067344830073,59091658395612342080738
0x0b27b59171a4ffe19f23d54126cd797be17c6551,0xbfdc399ca7525d43b87b128ef6a2e52044d344bc34c0f0cbd1c168663ac1066c,17-05-2025,2025-05-17 06:24:45.000 UTC,202,30336869,0x03a520b32C04BF3bEEf7BEb72E919cf822Ed34f1,3044078,7366856532388765916098,80697237071770619,229083823514785673462693
0x8810de2baa17067ddcfbd9e8f29c55f070a55f0b,0x72424a1f82d76ac075abc8b614fd59ce8e144d90cfc9307c0dd4dfd62d9aa95d,22-04-2025,2025-04-22 19:55:51.000 UTC,456,29281202,0x03a520b32C04BF3bEEf7BEb72E919cf822Ed34f1,2915622,199249959604973527199,2311775465827389,5635752438951435108525
0x38f6d2d9ea493c3c6ee865b5b952b5fe9e3e61fc,0x221a4b72fa01ee5a669ff12845b15f8752b8aaae2c756a6f15660dffd2f5636f,12-06-2025,2025-06-12 09:49:21.000 UTC,1023,31466207,0x827922686190790b37229fd06084350E74485b72,16257015,22277077915,918956,194345
0x095d0de0ecfd6832f1a7961ae26d285d68655d60,0x1c827aab81b3b733f969a21d0899d76c910c70a2d130cdf105e7507cdf9f9f4d,28-06-2025,2025-06-28 16:10:25.000 UTC,734,32168839,0x03a520b32C04BF3bEEf7BEb72E919cf822Ed34f1,3439900,3336223401123687396017,482777324883247,212378767975201437203670
0x8fd1b615c006ebeb8a7cfb00a1dd809f31943b08,0x557461757b67a376ec5ef77d6ef28cad84f733ccd1315e89d863275e0c9ceb8f,10-12-2024,2024-12-10 02:08:45.000 UTC,189,23503589,0x827922686190790b37229fd06084350E74485b72,3755681,292776095143981910,2158172921,247573243715947332996859
0xdc98dbffcc648d6088a2ff8f7dc01aef050e58fc,0xe7f97760cf5861dbd3dd3e21d90054975d63625afe06e2a3416bb95bf0ad5e28,09-01-2025,2025-01-09 08:27:41.000 UTC,531,24810957,0x827922686190790b37229fd06084350E74485b72,5289768,1747595855997941971677,334952170561487422999,216454614801625535
0xdc98dbffcc648d6088a2ff8f7dc01aef050e58fc,0x9abfc184e6c816173f9d8c65937dac73a345622fff2dce38b754caf57e825451,01-06-2025,2025-06-01 06:46:11.000 UTC,565,30985512,0x827922686190790b37229fd06084350E74485b72,15301647,13061184234,633151,18999
0x2791dc5e14f7680d9d969acc26059ba56403b6d5,0x112f0eb9533307d46687ad30a0232f3d873b962b2e90c95914ab962ac7751b14,11-02-2025,2025-02-11 06:52:59.000 UTC,382,26233716,0x827922686190790b37229fd06084350E74485b72,7105939,325760149171923980,1249628012,99111726672117615318534
0x8fd1b615c006ebeb8a7cfb00a1dd809f31943b08,0x5786046e4255bfbc34dca202900e383c414a100ed9d0c8af8e16c3148c709fbe,01-01-2025,2025-01-01 08:35:03.000 UTC,230,24465578,0x827922686190790b37229fd06084350E74485b72,4919210,12868684984566029911202,293234356837754824,13933492032235852074895
0xdc98dbffcc648d6088a2ff8f7dc01aef050e58fc,0xbcb298a214e0e57ce1eeeb46caac8eac42b3983ee06643f9f846b0fa19d0c55e,27-05-2025,2025-05-27 15:27:11.000 UTC,491,30785142,0x46A15B0b27311cedF172AB29E4f4766fbE7F4364,388497,12344210911886638096704,404841389796160780,202027578577526080
0x8508fd4238162cb3f3d485f432202af3b40f164e,0xf76bdf90d9e0bdbc2afd66ae6ab6e2f548f7a96bd6d30c9e19efa9cb307443cd,12-04-2025,2025-04-12 09:03:31.000 UTC,372,28829632,0x827922686190790b37229fd06084350E74485b72,11002487,153100464329973,38511124081697061735,14788
0xdc98dbffcc648d6088a2ff8f7dc01aef050e58fc,0xebf9de643c3ccdb28dbedd7159a8711c38b34ee372525f48c750ae3053fff186,30-05-2025,2025-05-30 23:08:17.000 UTC,486,30928575,0x46A15B0b27311cedF172AB29E4f4766fbE7F4364,391374,12105576901958551601693,441475929205350581,149003407359096953
0x9eb86e93a809a41ab0e7cc0ba6f62561fda3015c,0xc26aa61296a6c685abdf49d9c4dd14b2f75b56853f6d27707a5ce403e6d506e9,02-06-2025,2025-06-02 05:08:51.000 UTC,491,31025792,0x827922686190790b37229fd06084350E74485b72,15384754,28814401564,1008351,431517
0x2791dc5e14f7680d9d969acc26059ba56403b6d5,0x55ee0d09d7e3b5a86961742af3d82327b873b9135763632f8498c2ffe2751d40,20-12-2024,2024-12-20 07:39:31.000 UTC,1105,23945512,0x827922686190790b37229fd06084350E74485b72,4309963,11680223552108793254,1824392724207008229,7680475430059217
0x095d0de0ecfd6832f1a7961ae26d285d68655d60,0x63d7c924c790d8ac9f0c946184bbd3bf206a2137761adbc7238cd086e3e370de,14-05-2025,2025-05-14 00:02:55.000 UTC,255,30195814,0x827922686190790b37229fd06084350E74485b72,13614956,5465477370236710,1103079,2708959054575879543746
0x8fd1b615c006ebeb8a7cfb00a1dd809f31943b08,0xdc86305eb7b6e16b584f61ec725a9757a11f7b0affa78a2d4ceb849bc9bff1ff,24-12-2024,2024-12-24 13:14:09.000 UTC,447,24128351,0x827922686190790b37229fd06084350E74485b72,4536857,8049072353559698949,10412692285775492152,4846823280803383
0x2791dc5e14f7680d9d969acc26059ba56403b6d5,0xe1a1e7a457ecef15e94c39ccf9f1e414e3ad6f9ebe7c929f2211662bc6dd7959,04-01-2025,2025-01-04 21:29:19.000 UTC,395,24618406,0x827922686190790b37229fd06084350E74485b72,5083074,1489654014194750017,87588309,54989238365922172141860
0x2791dc5e14f7680d9d969acc26059ba56403b6d5,0x0bf4e76a9fd68d50f2a6c3ede48052645e57ca5ec933b3f5d3a28706ee052056,19-05-2025,2025-05-19 06:13:53.000 UTC,686,30422943,0x03a520b32C04BF3bEEf7BEb72E919cf822Ed34f1,3057610,19379947678641625537,20804904794627696,30413458006646296701
0x0b27b59171a4ffe19f23d54126cd797be17c6551,0xbe3373ca1b8e79b700662b60d6a97ce099a12e808d81a742245687cb557f2cbe,23-05-2025,2025-05-23 22:01:59.000 UTC,646,30624186,0x03a520b32C04BF3bEEf7BEb72E919cf822Ed34f1,3086387,96530876628392948999,150364656155678413,209967280032072233287
0xdc98dbffcc648d6088a2ff8f7dc01aef050e58fc,0x4f15ffc0e235342b7b40a1d247a3eee19ab17100ca189c651fb439eb9d253153,15-01-2025,2025-01-15 19:00:47.000 UTC,370,25089150,0x827922686190790b37229fd06084350E74485b72,5618174,363428415806110688536,142836506330858755443,321793688979543212
0xdc98dbffcc648d6088a2ff8f7dc01aef050e58fc,0x139a80461a5e0add4757ebd820c18c8408e305f6eb43e6006548b2047e58553e,20-06-2025,2025-06-20 05:50:53.000 UTC,290,31804653,0x827922686190790b37229fd06084350E74485b72,16972639,11328483918266737,984293826,8346172606813030059
0x8810de2baa17067ddcfbd9e8f29c55f070a55f0b,0xe1b542128a2716909a004899182e6ea045089a54741a45dc2853cd6fd3008fec,13-05-2025,2025-05-13 16:53:13.000 UTC,1263,30182923,0x827922686190790b37229fd06084350E74485b72,13588852,76997563949977577,27128113456970041388067,335913855
0x095d0de0ecfd6832f1a7961ae26d285d68655d60,0x4cb2c8bffa08368f2fbe77edbcce538043a930c2e2ac1dc847271cdd6855dabe,02-07-2025,2025-07-02 10:15:53.000 UTC,468,32331003,0x03a520b32C04BF3bEEf7BEb72E919cf822Ed34f1,3464512,215780317268356230617,258456573760759980,444794156664651926799
0x8fd1b615c006ebeb8a7cfb00a1dd809f31943b08,0x40088befdd0e42af2df3bc56bb9e8553efecc9780b5d46c198c0ce1d85be2406,26-12-2024,2024-12-26 19:16:51.000 UTC,631,24225632,0x827922686190790b37229fd06084350E74485b72,4639903,4558328048240075599,703082452117807679,7311566371076747
0x8fd1b615c006ebeb8a7cfb00a1dd809f31943b08,0x223d864dbef83a5c71c33ec93cd5dc7a056455699939b2d962639e5d88aafe44,30-12-2024,2024-12-30 10:06:21.000 UTC,295,24381917,0x827922686190790b37229fd06084350E74485b72,4770202,9735897016931403304,13384930465358391939,4665536836314087
0x38f6d2d9ea493c3c6ee865b5b952b5fe9e3e61fc,0xdf574d60981fe4544395824ad4a75277eb8fa886e4435da6e235e777564d31b6,02-01-2025,2025-01-02 08:48:41.000 UTC,416,24509187,0x827922686190790b37229fd06084350E74485b72,4966962,2006678060530586570532939,3435270201881306872213,15329305617730432517004
0x8fd1b615c006ebeb8a7cfb00a1dd809f31943b08,0xd5493c481e0d578087a804079c80ca65d9820f29c70c2f3c0aba1a475cf293bf,02-01-2025,2025-01-02 08:28:31.000 UTC,292,24508582,0x827922686190790b37229fd06084350E74485b72,4966193,6469079165064692662089,176615234565375893478,4614102037972180142
0x8fd1b615c006ebeb8a7cfb00a1dd809f31943b08,0x048bd5a00dd3a37b9962e10d59253b394637071d4f487baa27f696ac23d89a87,13-12-2024,2024-12-13 13:30:03.000 UTC,376,23653628,0x827922686190790b37229fd06084350E74485b72,3941488,9925664755524197790,15199815640543642634,5267663746678900
0xdc98dbffcc648d6088a2ff8f7dc01aef050e58fc,0xea7b1ff2b10cd73bd7ce9f2620cfcd80d924652b8ceb5a0c176d45e285c1a891,25-03-2025,2025-03-25 09:33:41.000 UTC,768,28052937,0x03a520b32C04BF3bEEf7BEb72E919cf822Ed34f1,2631039,15612239592014996937492,857581217434576729,244204338293049610551998
0x8fd1b615c006ebeb8a7cfb00a1dd809f31943b08,0xb66d60846c8c5f7f90cb29557e504c4c3be924814bf7fdcba6262306e54d5d2b,16-12-2024,2024-12-16 06:07:43.000 UTC,414,23769958,0x827922686190790b37229fd06084350E74485b72,4055444,7601714199935752129,3131536571596496856,9635402220546063
0xdc98dbffcc648d6088a2ff8f7dc01aef050e58fc,0x02bf4414bbeea044ccf9085d095d4f4ffce895783bf60bfd833e1927d9c3c7f3,03-01-2025,2025-01-03 20:29:39.000 UTC,586,24573416,0x827922686190790b37229fd06084350E74485b72,5039689,2592424260400928657232,229120439201331337730,616949370307995025
0x38f6d2d9ea493c3c6ee865b5b952b5fe9e3e61fc,0xcbe940746d85fd04442ba115d17bb9a8709ca5848059e44e97c0e036b21fc826,06-06-2025,2025-06-06 14:07:33.000 UTC,2342,31214753,0x827922686190790b37229fd06084350E74485b72,15765775,25598383233,560821,719157
0xdc98dbffcc648d6088a2ff8f7dc01aef050e58fc,0xdeef73a381f725e5a319a2e8dbd80d70245e21f8904e8cd91dcb561a335a5644,16-07-2025,2025-07-16 09:35:55.000 UTC,367,32934604,0x46A15B0b27311cedF172AB29E4f4766fbE7F4364,444335,10432519399032293785052,16384326477161449,529913282675264812
0xdc98dbffcc648d6088a2ff8f7dc01aef050e58fc,0xc05f12795fe4b779b6aba349994226a3eceba3d386da807cc7c871489c50c3ca,02-01-2025,2025-01-02 08:30:49.000 UTC,326,24508651,0x827922686190790b37229fd06084350E74485b72,4966275,1102727503529671872776190,23309973476108963840,53238176664973399897082
0x8810de2baa17067ddcfbd9e8f29c55f070a55f0b,0xd8275e46f0fadd7de442d823269dd41794d0012d7bd4506325d031bc97987c92,28-03-2025,2025-03-28 16:27:59.000 UTC,271,28194966,0x827922686190790b37229fd06084350E74485b72,9989577,109986341560743510,94345116,49378174415224346275961
0x0b27b59171a4ffe19f23d54126cd797be17c6551,0x406bd41b103d589e16db63af1f523259e6e14531b5951b7c534a3d08802327c8,27-05-2025,2025-05-27 14:04:25.000 UTC,792,30782659,0x03a520b32C04BF3bEEf7BEb72E919cf822Ed34f1,3106364,13199709440640680645264,566700493220528854,183881004334849395170848
0x8508fd4238162cb3f3d485f432202af3b40f164e,0xd54d2805954678a707f366305127a0d3aebfb8ebb260378df871cce3578b3310,06-06-2025,2025-06-06 03:54:25.000 UTC,1264,31196359,0x827922686190790b37229fd06084350E74485b72,15728741,12939252126,505743,140954
0xdc98dbffcc648d6088a2ff8f7dc01aef050e58fc,0x1c785491d89f5cec0ae0c2f7263538f1f908c8c3e8a8dac0b3551facc77aa7bb,09-01-2025,2025-01-09 04:00:27.000 UTC,863,24802940,0x827922686190790b37229fd06084350E74485b72,5279651,748655034640214346393113,1656520083531541493926,757493766183998932406
0x2791dc5e14f7680d9d969acc26059ba56403b6d5,0xd2691be7deef1d1dbe442a94535cee5b4d31227b25b0b1c690da7491f49566d8,14-01-2025,2025-01-14 06:59:23.000 UTC,299,25024308,0x827922686190790b37229fd06084350E74485b72,5535088,1449728484368625775468,119426027524277428860,318246255110147518
0xdc98dbffcc648d6088a2ff8f7dc01aef050e58fc,0xf751053fd804044bfca97ab19f4da5c95ba395e705ec42e4bb79da188a793c22,20-05-2025,2025-05-20 02:00:23.000 UTC,1118,30458538,0x46A15B0b27311cedF172AB29E4f4766fbE7F4364,383642,13040602069429680736354,4785190418462771,678501257594110746
0xdc98dbffcc648d6088a2ff8f7dc01aef050e58fc,0xef90abdb1e17ccdfd07c4fa4ad982a2c66ab9c0386e7987d0ca6661ed853ab00,26-05-2025,2025-05-26 17:54:33.000 UTC,625,30746363,0x46A15B0b27311cedF172AB29E4f4766fbE7F4364,387788,1536948886381158,30990663766222821017,66569572
0x38f6d2d9ea493c3c6ee865b5b952b5fe9e3e61fc,0x6e425d90ed19231d9f6209df4c6b665ec87dd6c5c8417f3755ccce8c10c1b0a1,08-07-2025,2025-07-08 12:26:57.000 UTC,547,32594135,0x46A15B0b27311cedF172AB29E4f4766fbE7F4364,431574,11897785708,125034,470037
0x9eb86e93a809a41ab0e7cc0ba6f62561fda3015c,0xc233793534a197bd92b3c66b9f15af1d254aad41f3dfe46df0512feb6e4f5bb0,11-12-2024,2024-12-11 09:33:13.000 UTC,308,23560123,0x827922686190790b37229fd06084350E74485b72,3832063,2928523400829905485785,1207031311064667123427,693629492404767802
0x38f6d2d9ea493c3c6ee865b5b952b5fe9e3e61fc,0x46ce7c06ea0d8c511e0d616489134c2d94ce5f61b5d76ace9762e0671cbaef3c,13-01-2025,2025-01-13 13:24:29.000 UTC,378,24992661,0x827922686190790b37229fd06084350E74485b72,5499089,1257198749132639621143827,2551031615547744735148,8453135946004960148256
0x38f6d2d9ea493c3c6ee865b5b952b5fe9e3e61fc,0xbf40d496b295fa1fce7ca3b838e0e5b479ee8fbf229cd5e3ab5831de9d928ec4,03-06-2025,2025-06-03 04:06:33.000 UTC,1427,31067123,0x46A15B0b27311cedF172AB29E4f4766fbE7F4364,394787,5750660783,48149,239574
0x2791dc5e14f7680d9d969acc26059ba56403b6d5,0x3cad1c28abf97bc4fcc32d346356734e547ffc0ac82d666649dd5773472ec6c8,13-12-2024,2024-12-13 20:30:57.000 UTC,659,23666255,0x827922686190790b37229fd06084350E74485b72,3971902,3184376464379253359789,1181593600713177802035,845615023376086242
0x8508fd4238162cb3f3d485f432202af3b40f164e,0xd8dd4fb7c5b95dbf5fc494c77b9788a3fa8f3c542b59a388699a61d095bd9691,13-04-2025,2025-04-13 09:21:37.000 UTC,367,28873375,0x827922686190790b37229fd06084350E74485b72,11076948,147082195017716,55905982743554661823,3866
0x38f6d2d9ea493c3c6ee865b5b952b5fe9e3e61fc,0x04cae4afa969f2e787088fabbaa12f1f54ea2d9594559c3c529cede80144bc86,03-03-2025,2025-03-03 15:31:05.000 UTC,225,27113259,0x827922686190790b37229fd06084350E74485b72,8353952,205036781839718966,899487794,71832178061288913074508
0x095d0de0ecfd6832f1a7961ae26d285d68655d60,0xab615a3f74c4bfa9f6e3eabd85f49a9643dbd065c59d4386e65781a862a5fac1,17-07-2025,2025-07-17 11:33:45.000 UTC,318,32981339,0x03a520b32C04BF3bEEf7BEb72E919cf822Ed34f1,3544507,1927176448639404428501,2846436946413250,136713045356589757284999
0xdc98dbffcc648d6088a2ff8f7dc01aef050e58fc,0x54e5927d62c9584b007b058b54a952fe73df1b63dc30163a1a50f57c3291ebf5,12-01-2025,2025-01-12 15:28:53.000 UTC,296,24953193,0x827922686190790b37229fd06084350E74485b72,5451546,1211975409692962470621,188586882307452715329,192167306689822278
0x8508fd4238162cb3f3d485f432202af3b40f164e,0xa01a0fa654b1585031c8e51079bbee32a565c9bf2c6b2316dc24e5daece23664,09-03-2025,2025-03-09 05:21:15.000 UTC,284,27354164,0x827922686190790b37229fd06084350E74485b72,8712109,69970671035722619680102,370267958315854077657,77619493928201336530037
0x9eb86e93a809a41ab0e7cc0ba6f62561fda3015c,0x8227c415128ca2f4011336f533e8d44db8e60380ebcc9ad2281b1746e06d2c7c,05-01-2025,2025-01-05 04:17:43.000 UTC,326,24630658,0x827922686190790b37229fd06084350E74485b72,5093870,1859215071494802731390,89853517724370553999,534394519788598542
0x38f6d2d9ea493c3c6ee865b5b952b5fe9e3e61fc,0x80298d35a7371bd2d1aa7d549990dbb500a819f931fac68a4d51f7c1c4544195,09-01-2025,2025-01-09 01:58:09.000 UTC,327,24799271,0x827922686190790b37229fd06084350E74485b72,5274966,1499331112758253434,570767150,50446783764674482532362
0x2791dc5e14f7680d9d969acc26059ba56403b6d5,0xd4cbd1a9c1650c30bf347bd503fe38d28579ace5b25c3e70067158eb018de452,06-01-2025,2025-01-06 12:03:43.000 UTC,450,24687838,0x827922686190790b37229fd06084350E74485b72,5145539,2467683359411684569815,52574909038474902034,768060326311989694
0x9eb86e93a809a41ab0e7cc0ba6f62561fda3015c,0x8f3a0d393163544bdb977d1a8d7c8b62fb3a62ca45f81c783ee8e073ba8fec80,19-02-2025,2025-02-19 13:39:03.000 UTC,242,26591498,0x827922686190790b37229fd06084350E74485b72,7601701,5495547562,123819630,754845
0x8508fd4238162cb3f3d485f432202af3b40f164e,0xf2311f8a71b08c248858a585c1b49b9d24c43e3edcd9fa641582a30b6170bc40,02-04-2025,2025-04-02 13:14:49.000 UTC,287,28405171,0x827922686190790b37229fd06084350E74485b72,10342303,324810514050227,143067804707928602749,1644
0x38f6d2d9ea493c3c6ee865b5b952b5fe9e3e61fc,0x26af36dd53b01402a105b6de28bb0b9c136a9d0e8830590befd76cd42f899619,04-01-2025,2025-01-04 03:16:29.000 UTC,445,24585621,0x827922686190790b37229fd06084350E74485b72,5047502,22874943871299208301,3132303581615748522,4140050198754774
0x8508fd4238162cb3f3d485f432202af3b40f164e,0xb31121b57b2326f7a59206ef316a02a13ef0ec699cce98fd5cbce0f5a2ca9b7f,08-05-2025,2025-05-08 13:05:33.000 UTC,491,29960093,0x03a520b32C04BF3bEEf7BEb72E919cf822Ed34f1,2985052,4135712621607884723606,197854703708600449,51731271550745674151131
0xdc98dbffcc648d6088a2ff8f7dc01aef050e58fc,0x0b9c29310a3297f41d049898aabc2f7e2e6ed57504f18e0143a34a3a8afb3efc,09-01-2025,2025-01-09 01:47:31.000 UTC,299,24798952,0x827922686190790b37229fd06084350E74485b72,5274576,788448467483806495611853,347700353582645968826,28612448036580088504939
0x38f6d2d9ea493c3c6ee865b5b952b5fe9e3e61fc,0x74ce8a3f89bde7fc224faa7f6088f18df5fbe31dcd85f99545ea6882ef135806,07-01-2025,2025-01-07 01:03:01.000 UTC,358,24711217,0x827922686190790b37229fd06084350E74485b72,5174147,1700067306120887362897,116520557434474679773,428976470491784082
0x8810de2baa17067ddcfbd9e8f29c55f070a55f0b,0xc84b58cc2887bd8c2e5e0f43a518f0d4f1d3ab89a6960d7732f6f1e607c198d7,29-03-2025,2025-03-29 17:08:43.000 UTC,458,28239388,0x827922686190790b37229fd06084350E74485b72,10059073,106048111497413837,88391508,48676639365081882114561
0x9eb86e93a809a41ab0e7cc0ba6f62561fda3015c,0xd3de9057ac64c07b04c22d405e6f3d5a79b4ecc2a77cbf25a26f1162134eb50c,07-12-2024,2024-12-07 06:22:09.000 UTC,253,23381591,0x827922686190790b37229fd06084350E74485b72,3613085,64435661075122483,382400723,8958382869047715960919
0x38f6d2d9ea493c3c6ee865b5b952b5fe9e3e61fc,0x41c51310d8e99d883c9ca671d2e42b863b19d6e8286d979b76965e2b53106e63,08-02-2025,2025-02-08 00:52:33.000 UTC,404,26093303,0x827922686190790b37229fd06084350E74485b72,6901578,6603270142528196879809,341617313875168789,102941025949061139935609
0x2791dc5e14f7680d9d969acc26059ba56403b6d5,0xaae7da89582a73a4406bdc3a5e4047ecfb6b5d688970846e1872c63309633a90,13-12-2024,2024-12-13 07:31:43.000 UTC,371,23642878,0x827922686190790b37229fd06084350E74485b72,3940533,3295759148506631950966,513204572131273731984,1301075871747122576
0x8fd1b615c006ebeb8a7cfb00a1dd809f31943b08,0xffa0f23b03c2ec0fb43e944d24ed43f633913168ae9c16b2f6680ba38ef5a27d,01-01-2025,2025-01-01 10:20:11.000 UTC,316,24468732,0x827922686190790b37229fd06084350E74485b72,4922355,12629046143336370903346,465814700535067629,3112616929052591964120
0x9eb86e93a809a41ab0e7cc0ba6f62561fda3015c,0x4ed06228eedd519ae821508f4777eaa960d6b2ede4c2cdcd2bebf10ccb357c1a,06-01-2025,2025-01-06 12:04:09.000 UTC,363,24687851,0x827922686190790b37229fd06084350E74485b72,5145549,1741411257206358391829,40829588503556353033,537778653001978564
0x095d0de0ecfd6832f1a7961ae26d285d68655d60,0xce90ca2c45791142541c0ad5858c668ec97855e2d6f532fe5026b057b590a0f2,24-01-2025,2025-01-24 05:25:27.000 UTC,339,25453490,0x827922686190790b37229fd06084350E74485b72,6085254,4492519045220032465907,216823637815901198,105977144261997795671004
0x2791dc5e14f7680d9d969acc26059ba56403b6d5,0xe8c9790a9b67f4f4ff3fa7bdc0ee3035639e8ef1d5c08ecc795ddc7ad2a66ac0,18-12-2024,2024-12-18 09:31:53.000 UTC,557,23862483,0x827922686190790b37229fd06084350E74485b72,4199432,7149118274190936465,3817199355957089890,2964048343757492
0x2791dc5e14f7680d9d969acc26059ba56403b6d5,0x946e6045e306a955fa3729de23b0f06c7fd76baae2df58f506979391fca70a72,19-01-2025,2025-01-19 20:17:11.000 UTC,447,25264242,0x827922686190790b37229fd06084350E74485b72,5859520,192645206305454559670951,622189156854864041827,22462806871870891269565
0x9eb86e93a809a41ab0e7cc0ba6f62561fda3015c,0xaf329836c4811810973112d123883dc7ea215b6785d3327b29e8ce95d84357fb,01-06-2025,2025-06-01 22:53:41.000 UTC,445,31014537,0x827922686190790b37229fd06084350E74485b72,15361675,29182496572,1251703,205796
0x2791dc5e14f7680d9d969acc26059ba56403b6d5,0xe49ef24787f2f884263fc0a0a2fdb1a9593764a999e67448341380ce03096edd,09-01-2025,2025-01-09 01:58:43.000 UTC,458,24799288,0x827922686190790b37229fd06084350E74485b72,5274987,1167065844598146659,444280013,39267322475067345495946
0x38f6d2d9ea493c3c6ee865b5b952b5fe9e3e61fc,0xf1b1d552d9088243018697edddd4459c5500225e9882742b242c2dc79cf8c853,02-01-2025,2025-01-02 20:49:23.000 UTC,339,24530808,0x827922686190790b37229fd06084350E74485b72,4994941,1647166597405039831456,289219388767309474611,215230504718555049
0xdc98dbffcc648d6088a2ff8f7dc01aef050e58fc,0x1629715443f711de6d6853a0c21f3b8a0c76970c0ddd99963ac8a623ffba97e4,03-07-2025,2025-07-03 14:59:41.000 UTC,905,32382717,0x46A15B0b27311cedF172AB29E4f4766fbE7F4364,426521,10902912353582291787179,167783246745350510,387413785753042152
0xdc98dbffcc648d6088a2ff8f7dc01aef050e58fc,0x08ece17e20c6fa82664de98aa2c6092c45e8c38de6894e4b3a5c2b1909a8f6ea,03-06-2025,2025-06-03 03:47:05.000 UTC,588,31066539,0x827922686190790b37229fd06084350E74485b72,15474554,11991219422,585177,13796
0xdc98dbffcc648d6088a2ff8f7dc01aef050e58fc,0x4f023ba4463b04fc099dffccd0d84baa466297f13c460da671a509f14d8917a7,14-01-2025,2025-01-14 13:40:09.000 UTC,296,25036331,0x827922686190790b37229fd06084350E74485b72,5550167,966396580729197415381,213724030971116516384,99402295542478277
0x8810de2baa17067ddcfbd9e8f29c55f070a55f0b,0xcacfd370287a4b8f77e0cad1d82ab2c97ecbca647f995cc7a52b51c97641470a,28-08-2025,2025-08-28 04:23:07.000 UTC,182,34782820,0x03a520b32C04BF3bEEf7BEb72E919cf822Ed34f1,3821305,709985884351020064350,17414004408887129,16975563252584330848815
0x9eb86e93a809a41ab0e7cc0ba6f62561fda3015c,0xf5e5fc9f174d27461e02604bd7ee8e6b6de81804806a3a60d542986a10b8d8b9,05-03-2025,2025-03-05 00:28:09.000 UTC,202,27172571,0x827922686190790b37229fd06084350E74485b72,8443984,2235946336,276078195,60931
0x8fd1b615c006ebeb8a7cfb00a1dd809f31943b08,0xde316cb4d5edbe7c3eeb2979c200fc0af48b594997b8f4fb5a1ac52138ad63f5,07-01-2025,2025-01-07 11:28:59.000 UTC,581,24729996,0x827922686190790b37229fd06084350E74485b72,5188516,33548281002097118450732,1154372583548882217,13151875828838938420240
0x9eb86e93a809a41ab0e7cc0ba6f62561fda3015c,0xfd3526472e229aadad9c150d0e4a33d2aec5118e2e714f59d79ed917c97b9025,08-02-2025,2025-02-08 05:23:25.000 UTC,231,26101429,0x827922686190790b37229fd06084350E74485b72,6913447,1087770483,495615738,529035
0x8508fd4238162cb3f3d485f432202af3b40f164e,0xfeaed7e27f9c822a441f674f5825af8c15827e105ee2c46310143e3b85369368,17-06-2025,2025-06-17 05:25:35.000 UTC,339,31674294,0x03a520b32C04BF3bEEf7BEb72E919cf822Ed34f1,3280465,144234299701005214843,57725377530898861,138542376978379591710
0xdc98dbffcc648d6088a2ff8f7dc01aef050e58fc,0xdbe6b30eaeb5898f52aa21427b4732ea990798cf267bf422ce8f4095d4c15ca2,15-07-2025,2025-07-15 12:27:33.000 UTC,837,32896553,0x46A15B0b27311cedF172AB29E4f4766fbE7F4364,443137,14953739282,486624,260854
0x2791dc5e14f7680d9d969acc26059ba56403b6d5,0x34c784eea00a19d152ea974ae5202bbd94c24786f26742edd8a0b78def96c3ce,28-12-2024,2024-12-28 07:17:45.000 UTC,292,24290459,0x827922686190790b37229fd06084350E74485b72,4720605,4264221726915932777,2508742753322682044,1488329967975067
0x351f61e4c49cf11f24d9f2e737ca5eff81806355,0xa53dd0c7a0b0b8f8ad3511cde859101e4eebda68464de305bbb0deae94e0b24d,22-10-2025,2025-10-22 19:38:53.000 UTC,1456,37186293,0x827922686190790b37229fd06084350E74485b72,29612276,134713083550260659,213241374,74133554568199454761316
0xdc98dbffcc648d6088a2ff8f7dc01aef050e58fc,0xa44216d475c0a699e2dccb065ea6d1a5bedac96915562db5f0fd58873c1927d7,25-12-2024,2024-12-25 09:27:25.000 UTC,289,24164749,0x827922686190790b37229fd06084350E74485b72,4559928,2248348720502125998,1269652702185014311,2815596808236488
0x38f6d2d9ea493c3c6ee865b5b952b5fe9e3e61fc,0x22bb2a76a4df06c8653145ad1bff6f8e3c15706d8b950aabedb21bce5bf2465b,11-01-2025,2025-01-11 03:25:19.000 UTC,464,24888286,0x827922686190790b37229fd06084350E74485b72,5383644,1008463746093842995449163,209579728338269866767,37924907047353513554971
0x2791dc5e14f7680d9d969acc26059ba56403b6d5,0xaf2e93d338f1a77f2ab42f74764e328c3a6801be7574e00e95b802236bd7e422,31-05-2025,2025-05-31 03:39:45.000 UTC,1250,30936719,0x03a520b32C04BF3bEEf7BEb72E919cf822Ed34f1,3136288,39606482769058008594,42576152983363405,62261154773607941358
0xdc98dbffcc648d6088a2ff8f7dc01aef050e58fc,0x28843c6aa3b8b378c657a14ba3c444a5a14ac397c963d8c3c744615cde2d8278,12-05-2025,2025-05-12 08:39:57.000 UTC,594,30124925,0x46A15B0b27311cedF172AB29E4f4766fbE7F4364,377864,13035598766185703959890,554841890716607770,73407496239914120
0xdc98dbffcc648d6088a2ff8f7dc01aef050e58fc,0x24d0008079bcf2af60ae8b1e6de8d0867a9a1911ebefbfcb369784f6670f1581,30-05-2025,2025-05-30 01:28:33.000 UTC,2867,30889583,0x827922686190790b37229fd06084350E74485b72,15098404,13383832963698970,867134831,163385599804407282391
0x8508fd4238162cb3f3d485f432202af3b40f164e,0x08e7bb04ad74f7fe99e92ca0af1963c7b823f57b96a9e14c13f56d661edeb6d5,08-07-2025,2025-07-08 15:35:33.000 UTC,243,32599793,0x03a520b32C04BF3bEEf7BEb72E919cf822Ed34f1,3492954,199506398897460595803,92670214507993807,168364842999276554859
0xdc98dbffcc648d6088a2ff8f7dc01aef050e58fc,0x83e59c6cb9e80ba32e946b229e33f3080c09df57e1b2a6cf39c9dcfc73e346d8,24-05-2025,2025-05-24 18:51:25.000 UTC,1124,30661669,0x827922686190790b37229fd06084350E74485b72,14631930,3690455475,1326,183411
0x38f6d2d9ea493c3c6ee865b5b952b5fe9e3e61fc,0x4627c44be076c3f0b85f9bd7d4968c5aa5d26ac6fd12ec5fc161241f4c730832,05-01-2025,2025-01-05 03:06:29.000 UTC,430,24628521,0x827922686190790b37229fd06084350E74485b72,5092362,1711125633569715244720033,54125291992782653719,78231851732278219179544
0xdc98dbffcc648d6088a2ff8f7dc01aef050e58fc,0xe4676031fc8379f7f9b71b7426f861c172541b4c4805ddf98ed9f028ee58b81c,09-01-2025,2025-01-09 03:45:23.000 UTC,440,24802488,0x827922686190790b37229fd06084350E74485b72,5279074,22815864591668995667079,807743689719946960,10399822812834841531696
0x351f61e4c49cf11f24d9f2e737ca5eff81806355,0x574aed14a715aeb1325d7e434a0de99418746331a438ae46ee7ec6b281347616,08-10-2025,2025-10-08 23:22:25.000 UTC,71,36588199,0x827922686190790b37229fd06084350E74485b72,28175154,561846948489149311,361053723,161823278847469657862382
0x8508fd4238162cb3f3d485f432202af3b40f164e,0x62ff72ed6185f35160a43a1e251401f88de8d703594ae56a7f5e23293a55fb2a,08-05-2025,2025-05-08 01:03:21.000 UTC,478,29938427,0x03a520b32C04BF3bEEf7BEb72E919cf822Ed34f1,2982193,4322501016176058167036,217580240462645136,51372851224259917285611
0xdc98dbffcc648d6088a2ff8f7dc01aef050e58fc,0x21ebbc9b3601074cb322e98151ceb777ed1e954fbf2e5e40f94db610bf593b36,09-01-2025,2025-01-09 10:33:13.000 UTC,409,24814723,0x827922686190790b37229fd06084350E74485b72,5294924,1730604697777032146913,180979660826422090260,364872963389181867
0x0b27b59171a4ffe19f23d54126cd797be17c6551,0xcd9b646dbd7c679174cdd35b6f47f9453a86b02d3442a13142a26aee067083a3,31-07-2025,2025-07-31 08:04:23.000 UTC,115,33579858,0x03a520b32C04BF3bEEf7BEb72E919cf822Ed34f1,3647553,1566915324258552241900,62611877635327136,23653445447242787449733
0x0b27b59171a4ffe19f23d54126cd797be17c6551,0x0830eabdc7f99a13a9f3b78fe074fe8314c73d964a8280a7642c72cabba5bc26,09-08-2025,2025-08-09 05:04:23.000 UTC,285,33963258,0x03a520b32C04BF3bEEf7BEb72E919cf822Ed34f1,3707787,1410144801117060953301,55365381264499377,21405838847008413218932
0xdc98dbffcc648d6088a2ff8f7dc01aef050e58fc,0xc79564213f99fae02521207fe6efceb7271db7cb4957ae34d754442aafa656bd,09-01-2025,2025-01-09 08:25:45.000 UTC,560,24810899,0x827922686190790b37229fd06084350E74485b72,5289684,555477545015925426,700799684,31913113715191996887990
0x2791dc5e14f7680d9d969acc26059ba56403b6d5,0x1283078430f42a04d7e0afd78a4c999e0757af9e8193fc32d2f25b104c722b67,09-01-2025,2025-01-09 17:44:33.000 UTC,386,24827663,0x827922686190790b37229fd06084350E74485b72,5313297,908425984014351276,1469991194,13006840625963786204505
0x8508fd4238162cb3f3d485f432202af3b40f164e,0x8fab05aba99031d90e545c2f8e25cc94c05c63f376ed9c7e9771958c1e15a160,24-03-2025,2025-03-24 21:46:19.000 UTC,394,28031716,0x827922686190790b37229fd06084350E74485b72,9717498,438830512662210,78114026654880881747,60492
0x095d0de0ecfd6832f1a7961ae26d285d68655d60,0xec4f2622494ce68f761d8af6014075374a85aded98a6a6243f8517b2e0c4cd13,30-06-2025,2025-06-30 14:40:51.000 UTC,490,32252552,0x03a520b32C04BF3bEEf7BEb72E919cf822Ed34f1,3456225,3015700261433871234027,27488489984335410,166663364331442605776111
0x8fd1b615c006ebeb8a7cfb00a1dd809f31943b08,0xa9e847bc3cf916d6bcf566dd54784c2c8eac6f236b693657117d8c200d7bf888,26-12-2024,2024-12-26 12:56:25.000 UTC,362,24214219,0x827922686190790b37229fd06084350E74485b72,4639903,4438627804161976511,3116677354061447715,4999466843968057
0x2791dc5e14f7680d9d969acc26059ba56403b6d5,0x6a663c63020ac527fbde8ee05b020dd33e12e7d3c300daca04497c3742f4d7f8,16-12-2024,2024-12-16 12:21:19.000 UTC,255,23781166,0x827922686190790b37229fd06084350E74485b72,4089705,11070037541898663439,3521026825919365303,3383146818065478
0x9eb86e93a809a41ab0e7cc0ba6f62561fda3015c,0x528e4d6218137d18a671bf6304e87d1a60df96172c119c9ca609a8541987fad2,28-02-2025,2025-02-28 19:40:33.000 UTC,282,26991143,0x827922686190790b37229fd06084350E74485b72,8175345,3174951876,60028467,473659
0x8508fd4238162cb3f3d485f432202af3b40f164e,0xc0a69e3b6faa09b5280dac169680a8cad5f84d9bb8fd4ec0778f0981c983a907,29-04-2025,2025-04-29 00:41:05.000 UTC,503,29548959,0x03a520b32C04BF3bEEf7BEb72E919cf822Ed34f1,2945348,31846053376898731168,32479898645481253956,27270879625069275
0x8fd1b615c006ebeb8a7cfb00a1dd809f31943b08,0x18ae4c6b6ce172f9f1de70056999446d053fba32cce3f9b9cb444eef9ac9343a,07-01-2025,2025-01-07 16:10:51.000 UTC,456,24738452,0x827922686190790b37229fd06084350E74485b72,5197171,33275735524789865825958,321037797132453538,61398134671516249358336
0x9eb86e93a809a41ab0e7cc0ba6f62561fda3015c,0x33b8ff2aedb5ee118046c6e3eac6575458aab5c8a7234519071f430952eb4f62,26-02-2025,2025-02-26 21:41:49.000 UTC,475,26908381,0x827922686190790b37229fd06084350E74485b72,8066920,3751809143,297234463,292603
0x8508fd4238162cb3f3d485f432202af3b40f164e,0xe1a1025efb14848290764d51c042d5145fc2d47fc5654e949631cdc64aae4ce3,19-03-2025,2025-03-19 21:08:31.000 UTC,706,27814582,0x827922686190790b37229fd06084350E74485b72,9400004,176924164727423094442079,773871052694587562891,47183279752485514795531
0x8fd1b615c006ebeb8a7cfb00a1dd809f31943b08,0x361334fab40d4198c2ca953ab618331284864816a1acdf6e6af314643e1bbe29,25-12-2024,2024-12-25 02:53:29.000 UTC,377,24152931,0x827922686190790b37229fd06084350E74485b72,4559853,7478264750357080109,10575481510164611939,3900822906251044
0xdc98dbffcc648d6088a2ff8f7dc01aef050e58fc,0xf665cfdaaf189c0058abbd3d78b06843d53425ee03fafce15b308e546162ee77,12-06-2025,2025-06-12 14:17:19.000 UTC,480,31474246,0x827922686190790b37229fd06084350E74485b72,16275477,9592397222,437783,41524
0x9eb86e93a809a41ab0e7cc0ba6f62561fda3015c,0xfc2cba4c39b5087101f707b0c44ae5da8a37616786e17cd492efe77ecce5129a,09-01-2025,2025-01-09 00:28:19.000 UTC,352,24796576,0x827922686190790b37229fd06084350E74485b72,5271531,1195712865011897839153,131287796096159301969,249208248149501849
0x095d0de0ecfd6832f1a7961ae26d285d68655d60,0xcdd8d924a08c5ef7e5a56f2f860e9e62f492bebb9b949336ca41eb3895cc650f,18-04-2025,2025-04-18 15:52:17.000 UTC,308,29101095,0x827922686190790b37229fd06084350E74485b72,11474985,31569266396810956,43595995,29968882976916224988128
0x2791dc5e14f7680d9d969acc26059ba56403b6d5,0x99d506fd2aa689ff7df1d6f4280be7b39b9030cd74ba09492376fd09f435c054,25-12-2024,2024-12-25 22:45:27.000 UTC,379,24188690,0x827922686190790b37229fd06084350E74485b72,4606999,5837591408693930661,4709305604293144755,985534104981830
0x8810de2baa17067ddcfbd9e8f29c55f070a55f0b,0x6b98b4a6b6d947f681fdec63d7f0c01d2ac510e99f61eee0ff9690a2fba7b955,01-06-2025,2025-06-01 09:55:05.000 UTC,1243,30991179,0x03a520b32C04BF3bEEf7BEb72E919cf822Ed34f1,3149052,32033285905262651,1221422875,731880120545961244847
0x095d0de0ecfd6832f1a7961ae26d285d68655d60,0x84b5e794d632ec143930ed8f670405571c826d8a96d19d7b24508f3d3043b28e,17-04-2025,2025-04-17 06:41:09.000 UTC,383,29041361,0x827922686190790b37229fd06084350E74485b72,11383842,141092144696689047604343,147550933955105538048,60738607408719099300716
0x9eb86e93a809a41ab0e7cc0ba6f62561fda3015c,0xc8f89e121ef45657903a2345f26d348ece2e641289f611d643cfa519d6f1aa75,02-01-2025,2025-01-02 18:59:39.000 UTC,459,24527516,0x827922686190790b37229fd06084350E74485b72,4991145,2023172985739078764358,213300755380626144,1868655617118850082979
0x8810de2baa17067ddcfbd9e8f29c55f070a55f0b,0x0966fe6e98eb1e6a935bbc0a6a6f906685c127e452653e9f59ce09cfd1a15452,21-08-2025,2025-08-21 04:40:47.000 UTC,1524,34480950,0x03a520b32C04BF3bEEf7BEb72E919cf822Ed34f1,3786369,838967436272697834463,17085057540987653,24405518428371640364831
0x2791dc5e14f7680d9d969acc26059ba56403b6d5,0xd264a3f0eb3c1206c6843f6a02e522d89cdc3886e08e61db89f083372c1f19d7,09-01-2025,2025-01-09 07:24:33.000 UTC,449,24809063,0x827922686190790b37229fd06084350E74485b72,5287018,1037876706222572813,271631315,34969937081946708348914
0x8810de2baa17067ddcfbd9e8f29c55f070a55f0b,0xaa336da6a9e0ee5589415b8f1663f4e7c69ab491fdd3c866e367d781a791e071,27-07-2025,2025-07-27 10:13:05.000 UTC,602,33410919,0x03a520b32C04BF3bEEf7BEb72E919cf822Ed34f1,3616688,1809086862314342091823,83701406242569746,23088727755851210318025
0x8810de2baa17067ddcfbd9e8f29c55f070a55f0b,0xebd0e0c34e2034ca9d24fa2326ded8d8820965448e71d2a8ccac6ff861134e94,17-05-2025,2025-05-17 06:02:11.000 UTC,419,30336192,0x03a520b32C04BF3bEEf7BEb72E919cf822Ed34f1,3032543,5578765306022148453945,244156825355141736,109823328653144718218578
0x2791dc5e14f7680d9d969acc26059ba56403b6d5,0xc2d4f8018aae7f536297f56fcb4ea992777dd6b6194a08445a620499511c54a5,26-12-2024,2024-12-26 16:33:51.000 UTC,234,24220742,0x827922686190790b37229fd06084350E74485b72,4636817,2483497802104047898,1036494091364552323,1279317515470473
0x9eb86e93a809a41ab0e7cc0ba6f62561fda3015c,0x1a6bb72b3f172d1edadc1a831af37ec962991698fa139542da36ceb91317d14e,30-12-2024,2024-12-30 02:43:37.000 UTC,697,24368635,0x827922686190790b37229fd06084350E74485b72,4808082,612437079161948052416,192132161470727361031,388593379123050132
0x0b27b59171a4ffe19f23d54126cd797be17c6551,0x411add4c4f91a7548447b14cdeda5607c75c7efcef57955577f8334d6c5efeb7,19-11-2025,2025-11-19 23:12:49.000 UTC,640,38402311,0x03a520b32C04BF3bEEf7BEb72E919cf822Ed34f1,4207516,1189840324189214954058,21390035787368944,39997816136356451244579
0x38f6d2d9ea493c3c6ee865b5b952b5fe9e3e61fc,0x3a0a0e0297328d472db96bf0c86056b7a23890fc2e5f9f45c89673b6483050a5,14-01-2025,2025-01-14 21:08:01.000 UTC,263,25049767,0x827922686190790b37229fd06084350E74485b72,5567680,136825911695534222416217,441644184421441225349,9393275310580283031496
0x095d0de0ecfd6832f1a7961ae26d285d68655d60,0x1672e1f2ce2c829a35cdd6c1f19080aebd86eaa78920b367912cd19018cdcc34,25-02-2025,2025-02-25 11:30:17.000 UTC,595,26846835,0x03a520b32C04BF3bEEf7BEb72E919cf822Ed34f1,2157788,13432335773566789612317,288623313208134495,327974198211205284442192
0x9eb86e93a809a41ab0e7cc0ba6f62561fda3015c,0x4e5fd6a1500d2c16c761d1bd79ff16031d57a5d2dda1f8a5c94d3e845e0de079,25-02-2025,2025-02-25 21:00:11.000 UTC,253,26863932,0x827922686190790b37229fd06084350E74485b72,8000037,4028549912,50198628,620337
0x9eb86e93a809a41ab0e7cc0ba6f62561fda3015c,0x61eb0a582ff3a2b1f1ff479fef0dc8d2ef58fe8952a70538f25e43e70823e745,01-01-2025,2025-01-01 07:35:47.000 UTC,252,24463800,0x827922686190790b37229fd06084350E74485b72,4918119,646402350424180258449212,897732877974819955671,11246433897385517115003
0x38f6d2d9ea493c3c6ee865b5b952b5fe9e3e61fc,0x0ea70ede6c8c3c54123246cfe1f31ba2dbf6048b9e7a680b041c9a5b5defaeb6,02-03-2025,2025-03-02 18:42:17.000 UTC,508,27075795,0x827922686190790b37229fd06084350E74485b72,8294632,210627316550179450,851289044,78820428796335149134077
0x8508fd4238162cb3f3d485f432202af3b40f164e,0x2131b63a319a54fe1f6eae808a41994f7bdba514564e94b3f778bdaaa3bd6ec3,04-04-2025,2025-04-04 09:22:39.000 UTC,548,28484606,0x827922686190790b37229fd06084350E74485b72,10489791,295313815824610,34508714495922043268,46511
0x8fd1b615c006ebeb8a7cfb00a1dd809f31943b08,0x5b1d2a591bd2cdb1ff2b5941180648e7235fae2bc79f3299b0e6ff543a210f75,27-12-2024,2024-12-27 15:32:41.000 UTC,555,24262107,0x827922686190790b37229fd06084350E74485b72,4695643,6945404020314544956,5575222386752326878,7417408032102839
0x8810de2baa17067ddcfbd9e8f29c55f070a55f0b,0x7fe7491c96c8600ebbd38cf27a7c43a25fdc9d66cb043b8af6d9872fbca9fd6b,07-04-2025,2025-04-07 04:58:29.000 UTC,409,28606281,0x827922686190790b37229fd06084350E74485b72,10657520,86683522304154049,33039416,51123458933758497847739
0x0b27b59171a4ffe19f23d54126cd797be17c6551,0xbab9b7265a33220f4d81e6f039067c33c6a6716154771b5bfe638ee170c92720,28-06-2025,2025-06-28 16:09:19.000 UTC,537,32168806,0x03a520b32C04BF3bEEf7BEb72E919cf822Ed34f1,3439893,8781696458608400220536,206894336350811130,224794293345306543112640
0xdc98dbffcc648d6088a2ff8f7dc01aef050e58fc,0xabc65cdebdf450432b701f4f9275113d28fc8a234f143e2bf6250edf439d3115,04-01-2025,2025-01-04 16:02:11.000 UTC,577,24608592,0x827922686190790b37229fd06084350E74485b72,5072257,2575970831141430032010,97591281304766892317,766252390276232958
0x9eb86e93a809a41ab0e7cc0ba6f62561fda3015c,0x189befe52d68936996800d98c5d1f4655437156b5c161ce39baf09f4561f9f1f,09-01-2025,2025-01-09 11:38:53.000 UTC,555,24816693,0x827922686190790b37229fd06084350E74485b72,5297604,7935936462019199103457,184835527843734853,8468074875977785132485
0x8fd1b615c006ebeb8a7cfb00a1dd809f31943b08,0x98402c59bd4753cde1288b3b9706394bde00e81a5732fa7057b00bcb1da2b5b7,27-12-2024,2024-12-27 07:22:25.000 UTC,436,24247399,0x827922686190790b37229fd06084350E74485b72,4666399,6681185469124238909,4014558766574429075,8245867934981792
0x9eb86e93a809a41ab0e7cc0ba6f62561fda3015c,0x6e582ccacf605d3455067f7b1b2806598e7764a8dc65aa351f46153beb3e1047,27-02-2025,2025-02-27 05:18:25.000 UTC,424,26922079,0x827922686190790b37229fd06084350E74485b72,8083927,3717676473,82865265,537564
0x9eb86e93a809a41ab0e7cc0ba6f62561fda3015c,0x5a2f9e092e345e9e4fad39020f4016658c6e50c5296c5d50998b01a00c737621,01-01-2025,2025-01-01 07:37:55.000 UTC,327,24463864,0x827922686190790b37229fd06084350E74485b72,4918148,4049442527830258730319,292491255115165372138,1047603477608442652
0x9eb86e93a809a41ab0e7cc0ba6f62561fda3015c,0x133dc6ae2fd7cb6f1eae693daf6ab62edeffbfc78eb53d01eeab12e59cc8be03,02-01-2025,2025-01-02 01:41:59.000 UTC,335,24496386,0x827922686190790b37229fd06084350E74485b72,4952684,545935807304765089121563,842621168483895203263,7135308018196901554812
0x9eb86e93a809a41ab0e7cc0ba6f62561fda3015c,0x0bed23a089b36831f0c6283d0ff483740d47858237751ab844b1aacd3a19d49d,03-02-2025,2025-02-03 04:40:31.000 UTC,301,25884142,0x827922686190790b37229fd06084350E74485b72,6626826,51419597251072763,216504837,17898594454067069452922
0x38f6d2d9ea493c3c6ee865b5b952b5fe9e3e61fc,0x8a4eb24107fbdd267fb530b325a09df9b80b2e0169d497c45d7625cc7fd54a36,02-01-2025,2025-01-02 12:27:37.000 UTC,446,24515755,0x827922686190790b37229fd06084350E74485b72,4975601,1745229633527276108333,181105484254421707479,395050414544270313
0x2791dc5e14f7680d9d969acc26059ba56403b6d5,0x797f802f0b1333a4907f1fe1982e8087f82ba7ae572250c6bf4d6c6802cc35cf,18-12-2024,2024-12-18 11:02:11.000 UTC,340,23865192,0x827922686190790b37229fd06084350E74485b72,4199432,7885908313387215937,1416699084553589153,5316104580589609
0x2791dc5e14f7680d9d969acc26059ba56403b6d5,0xb62d9820a990c31b088f8db520ef5f6727691ecffe7bde9f90479757965cafce,06-01-2025,2025-01-06 20:36:19.000 UTC,891,24703216,0x827922686190790b37229fd06084350E74485b72,5165347,22440711580860947562007,527423173193733353,23502554399137175809132
0x38f6d2d9ea493c3c6ee865b5b952b5fe9e3e61fc,0x7d8ad2dd0d356752d18e73bce9533cbfe971d446d31c946b421cb7c48b6b0207,12-01-2025,2025-01-12 17:19:17.000 UTC,185,24956505,0x827922686190790b37229fd06084350E74485b72,5455168,457511018163177882991,15963632532900554125,247096005232747571
0x095d0de0ecfd6832f1a7961ae26d285d68655d60,0x415d376e961cd208cd89cac0ee2defa892037ba86b28c5345f8147ca00a3ee8a,23-04-2025,2025-04-23 12:33:39.000 UTC,936,29311136,0x827922686190790b37229fd06084350E74485b72,11809372,118136007564618801224332,96006978623345173918,54786059825354765665987
0x0b27b59171a4ffe19f23d54126cd797be17c6551,0xfd8f37efbf0faf2a21b4c184011d40158ba2caaab005497103f4c6da2f496963,24-09-2025,2025-09-24 12:14:05.000 UTC,576,35963349,0x03a520b32C04BF3bEEf7BEb72E919cf822Ed34f1,3952076,3634248951581327145118,109609597296092245,70773181128324338359200
0x2791dc5e14f7680d9d969acc26059ba56403b6d5,0x0ff266af8eb962d91cc078b2e5f83e6ecc0de4b9394b04e726a847d235c042bf,11-01-2025,2025-01-11 14:05:03.000 UTC,305,24907478,0x827922686190790b37229fd06084350E74485b72,5402388,1128409830440360337226560,2193907546456807601877,9734969462702804904015
0x2791dc5e14f7680d9d969acc26059ba56403b6d5,0xd616034f95ee0c4d015e2b6dd401a9dd21274a6b96bf051d5816b0a89ce7f99c,18-01-2025,2025-01-18 21:04:27.000 UTC,555,25222460,0x827922686190790b37229fd06084350E74485b72,5804072,8413959792920963643404,648061844992704183,21919623318663586980837
0xdc98dbffcc648d6088a2ff8f7dc01aef050e58fc,0x3201a363af2d6a3e808eed2f2989e41bb593779b0d80489aca868a83df9d4c49,30-05-2025,2025-05-30 11:39:45.000 UTC,465,30907919,0x46A15B0b27311cedF172AB29E4f4766fbE7F4364,390983,12215207432646016690080,376605871307480018,226205338548131008
0x095d0de0ecfd6832f1a7961ae26d285d68655d60,0x4d36084ac438dd8efa83a4c1d4b967c607606761ba8c717ef31c0f742c5ebdce,12-06-2025,2025-06-12 08:29:27.000 UTC,784,31463810,0x03a520b32C04BF3bEEf7BEb72E919cf822Ed34f1,3240472,4101929593652131419776,44142840794370243,186480308633346373864523
0x2791dc5e14f7680d9d969acc26059ba56403b6d5,0xaa8852ab95d6da726f49ca0af6ea033bbd29912fa12d15a5cc06bfdb394e4bba,13-01-2025,2025-01-13 00:48:21.000 UTC,526,24969977,0x827922686190790b37229fd06084350E74485b72,5468229,16779994626911550467454,329386239244513949,21095521978476079055814
0x8810de2baa17067ddcfbd9e8f29c55f070a55f0b,0x170826092033cc46a75e2544bbb503f1739a165fb9ec17444bff1050ef6860c0,01-06-2025,2025-06-01 09:17:11.000 UTC,527,30990042,0x827922686190790b37229fd06084350E74485b72,15309938,86103939617937308,111845320,37170510636060096910904
0xdc98dbffcc648d6088a2ff8f7dc01aef050e58fc,0xefa56e7a09c2c68525afd4192f920f3e93c122bda2d6f68bb291ea6cb10f62f2,01-06-2025,2025-06-01 04:56:23.000 UTC,118,30982218,0x827922686190790b37229fd06084350E74485b72,15295840,618400558,19920,10986
0x2791dc5e14f7680d9d969acc26059ba56403b6d5,0xb3321b735442b7c000d5ea05b9ff60a6cc8fb8d1e6f623e71ebb4f32fe5d9042,05-01-2025,2025-01-05 03:46:29.000 UTC,715,24629721,0x827922686190790b37229fd06084350E74485b72,5093234,1478882057470945554,29892698,54866142012004814070051
0x2791dc5e14f7680d9d969acc26059ba56403b6d5,0x13d6e0ab6a71bc3115ed4f4659ba9f3810ebc6ed748df5e8b59f800642efcf82,12-12-2024,2024-12-12 12:20:13.000 UTC,415,23608333,0x827922686190790b37229fd06084350E74485b72,3882262,12448619381810333921,939879667686795678,4999821860015301
0x38f6d2d9ea493c3c6ee865b5b952b5fe9e3e61fc,0x3553a5f0581a9cd65a4ce89265a496f3408c103ced9d198aba0c5f60196659eb,23-05-2025,2025-05-23 00:40:19.000 UTC,1100,30585736,0x827922686190790b37229fd06084350E74485b72,14466205,8153740253,252758,154799
0x8508fd4238162cb3f3d485f432202af3b40f164e,0x155129055b63283243401e24823068bab3114e94e479ff215caed8e64a7d5a26,05-06-2025,2025-06-05 15:45:23.000 UTC,895,31174488,0x827922686190790b37229fd06084350E74485b72,15682913,12965973248,354004,294199
0x095d0de0ecfd6832f1a7961ae26d285d68655d60,0x0ba85d90ef4823c9d90d5235fe0fa928a52e1a316aa7a70fbb9bbf63b91175dc,07-02-2025,2025-02-07 22:55:41.000 UTC,345,26089797,0x827922686190790b37229fd06084350E74485b72,6895404,89861918658520267,213445006,49324798928628598078520
0xdc98dbffcc648d6088a2ff8f7dc01aef050e58fc,0x9deb53bef6ce14e27c285ee4b5eb5cef9da23c9c99593a7fa26efaa32d2e8a7d,01-06-2025,2025-06-01 22:40:45.000 UTC,443,31014149,0x827922686190790b37229fd06084350E74485b72,15360880,12449734415,25311,597959
0x38f6d2d9ea493c3c6ee865b5b952b5fe9e3e61fc,0x4bac67483a8f900b448e44dbce1ea5a8b3a07fc37cf33fac2aaefdf1b052f19f,04-01-2025,2025-01-04 16:02:53.000 UTC,506,24608613,0x827922686190790b37229fd06084350E74485b72,5072311,2092720055188410142617,79283208151671187621,622503844019299256
0x9eb86e93a809a41ab0e7cc0ba6f62561fda3015c,0x6692883a3902351e243c5e5053295afa4d56d93984a6239b21f0cab760606fb4,20-12-2024,2024-12-20 23:26:31.000 UTC,364,23973922,0x827922686190790b37229fd06084350E74485b72,4349725,1092538007194959117342,432422882971210610762,574711729437000912
0x9eb86e93a809a41ab0e7cc0ba6f62561fda3015c,0x8396d706d43c6e351152a066f4d1aaf8366fdb83a986bb5744998ac8cd79df53,22-01-2025,2025-01-22 02:16:23.000 UTC,448,25361418,0x03a520b32C04BF3bEEf7BEb72E919cf822Ed34f1,1892904,69642299632876404464,16278367560002275,1007666987725793032172
0x8508fd4238162cb3f3d485f432202af3b40f164e,0x1e3a30c50568748e969140f59141649df0728ea680fb101afb92bd5be85ea933,14-05-2025,2025-05-14 03:08:51.000 UTC,109,30201392,0x03a520b32C04BF3bEEf7BEb72E919cf822Ed34f1,3024682,83166116268486051714,113644957342272477,202468538315420688516
0x9eb86e93a809a41ab0e7cc0ba6f62561fda3015c,0xc6c0f069db435111b238018c581e57875ee1898811cb835cd6379b2032ab6b36,01-02-2025,2025-02-01 00:21:53.000 UTC,426,25789983,0x827922686190790b37229fd06084350E74485b72,6504831,58789038057746076,328201121,16032255930120020567377
0x095d0de0ecfd6832f1a7961ae26d285d68655d60,0x88d3d88ff8f627ab28a7081cb1e80e751a210eccedf6f19d1e1536f3a452ccab,25-06-2025,2025-06-25 17:26:55.000 UTC,449,32041534,0x03a520b32C04BF3bEEf7BEb72E919cf822Ed34f1,3411081,4266110232675779235576,45784467328157770,204283851440718897789824
0x0b27b59171a4ffe19f23d54126cd797be17c6551,0x1eb6f6b7f6ee7ab22b59fb441bfc7ebd0e83521a58c051e68081aee069d2bb1c,27-07-2025,2025-07-27 10:12:55.000 UTC,313,33410914,0x03a520b32C04BF3bEEf7BEb72E919cf822Ed34f1,3616687,2056079119957138326743,95129049506355137,26241001487595712005943
0x38f6d2d9ea493c3c6ee865b5b952b5fe9e3e61fc,0xea0d7078b06e433d3e87230afa49e660887e6c1c7045db2d68b2701622005426,05-01-2025,2025-01-05 17:51:17.000 UTC,318,24655065,0x827922686190790b37229fd06084350E74485b72,5108867,24484122125091382391,5393478741973536912,2166106819695816
0x8508fd4238162cb3f3d485f432202af3b40f164e,0xe984878b4132fc240e083e9995b935c8746ade6d6414468a67620804bf734338,28-04-2025,2025-04-28 06:09:43.000 UTC,315,29515618,0x03a520b32C04BF3bEEf7BEb72E919cf822Ed34f1,2941405,35399477673901945680,40872688800512962101,26775483566035163
0x9eb86e93a809a41ab0e7cc0ba6f62561fda3015c,0xfd0c6cbb959651c3709f4bb49022658c2b48afe059531d98062ef41d8b2cd87a,07-01-2025,2025-01-07 21:23:15.000 UTC,1444,24747824,0x827922686190790b37229fd06084350E74485b72,5210414,1352437109587654124658,254179023899533396914,166575083110470933
0xdc98dbffcc648d6088a2ff8f7dc01aef050e58fc,0xbe61281d51eafd986acd0c2756bacf84a2c597d49035aa53709647b5aba87f45,07-06-2025,2025-06-07 02:20:03.000 UTC,1067,31236728,0x827922686190790b37229fd06084350E74485b72,15811505,10508346297,256294,269100
0x9eb86e93a809a41ab0e7cc0ba6f62561fda3015c,0x2f376c595adf5eabaf7239724618f87c4ea06f58b7e7198795ab5331a4c5c5dc,12-12-2024,2024-12-12 02:21:43.000 UTC,288,23590378,0x827922686190790b37229fd06084350E74485b72,3872231,2168496838450269719724,1768116424557683557238,561593477071809091
0x38f6d2d9ea493c3c6ee865b5b952b5fe9e3e61fc,0xa75c5c47586393e329ed16da971ac63ab29cab07e66d8b703367ade60f65641d,20-01-2025,2025-01-20 06:13:59.000 UTC,436,25282146,0x827922686190790b37229fd06084350E74485b72,5864813,19906200139518830338462,295348624221579122,81279537668964411947071
0x8810de2baa17067ddcfbd9e8f29c55f070a55f0b,0x5e3378c0e02ce9b8d01403bc69f4ac8424c637b8de0d99ec40cd3b7d3303f7a6,30-07-2025,2025-07-30 03:47:03.000 UTC,779,33528938,0x03a520b32C04BF3bEEf7BEb72E919cf822Ed34f1,3638352,1637126334458927276888,59488791623659976,27443517154151090235884
0x38f6d2d9ea493c3c6ee865b5b952b5fe9e3e61fc,0x31e1ee692aecac0b6e112d0eb5321ca5b48baf5cab67f4ed1a4b4e2681cff3de,01-01-2025,2025-01-01 22:38:07.000 UTC,653,24490870,0x827922686190790b37229fd06084350E74485b72,4944948,1534333608320808859428174,1411066358668393341050,40191385009910672864216
0x8fd1b615c006ebeb8a7cfb00a1dd809f31943b08,0x3fd70254cd3eac01ae2072c24040440868ecb320e5a743cfa85489838ec9295e,05-01-2025,2025-01-05 20:05:55.000 UTC,335,24659104,0x827922686190790b37229fd06084350E74485b72,5118196,3312854976436361401134,56278742687333352,12320655734667665834863
0x9eb86e93a809a41ab0e7cc0ba6f62561fda3015c,0x55586822d8ec8453a49217a31a0fdebc7bf9527e0693ea74b9c8ab9cd64c696a,02-01-2025,2025-01-02 08:50:27.000 UTC,418,24509240,0x827922686190790b37229fd06084350E74485b72,4967045,703762845762029555214584,1022905680311995819970,9768268031932626337551
0x8fd1b615c006ebeb8a7cfb00a1dd809f31943b08,0xfd21b5fc6d12536fab90a13398b0f1398c78162b77713cb335ef343cc4d46a53,08-12-2024,2024-12-08 19:42:25.000 UTC,163,23448799,0x827922686190790b37229fd06084350E74485b72,3682011,373566174975757471,812851786,239778258596329485146121
0x2791dc5e14f7680d9d969acc26059ba56403b6d5,0x5163078b6e075d43a309abe53826830c5be60dc1119349d5c57225c1ac3e653b,04-01-2025,2025-01-04 05:57:09.000 UTC,205,24590441,0x827922686190790b37229fd06084350E74485b72,5054416,2826810225923759448066,43390339928218549874,916094490464713301
0xdc98dbffcc648d6088a2ff8f7dc01aef050e58fc,0x5ae5389dbf88395fafb07d2bc07ee14c875b4e2ba938cf464621f0198011df62,16-01-2025,2025-01-16 13:27:19.000 UTC,348,25122346,0x827922686190790b37229fd06084350E74485b72,5664355,366045684358398123822,128158998293436847829,335932521709210268
0x2791dc5e14f7680d9d969acc26059ba56403b6d5,0xd0934e8704895a056cc18083f2baef0f6b3532d890ae63f2f06cd8d9762bfbbb,10-01-2025,2025-01-10 12:38:37.000 UTC,442,24861685,0x827922686190790b37229fd06084350E74485b72,5353645,2287020699974726526144,394963393466984087641,327126933976170251
0xdc98dbffcc648d6088a2ff8f7dc01aef050e58fc,0x994e811005c31dd9d02b3429edeaa8c00829758b9bbcda2b0678cca8080d59b6,27-01-2025,2025-01-27 16:31:11.000 UTC,608,25603062,0x03a520b32C04BF3bEEf7BEb72E919cf822Ed34f1,1958931,11641137313571044873445,841457090861698667,131752450258572462192970
0x8508fd4238162cb3f3d485f432202af3b40f164e,0xff91e17b33701bd424c1108dcabe4a70e283dd109587d4aef1b8af48271690a9,01-06-2025,2025-06-01 01:45:55.000 UTC,1687,30976504,0x827922686190790b37229fd06084350E74485b72,15285660,14853001325,706126,35496
0x9eb86e93a809a41ab0e7cc0ba6f62561fda3015c,0xdfd5f02e416390c4a55ac8dda0375f8e794daed39d09aba3f3291706bd695ff7,24-12-2024,2024-12-24 12:47:03.000 UTC,900,24127538,0x827922686190790b37229fd06084350E74485b72,4548219,857381053726863548183,286052002130222429824,509445973616374645
0x9eb86e93a809a41ab0e7cc0ba6f62561fda3015c,0x4691d8a7253bcbcaad8bbf57014232db697eaf4fa0192495b4b75025b031c0ea,06-01-2025,2025-01-06 15:08:31.000 UTC,591,24693382,0x827922686190790b37229fd06084350E74485b72,5151869,1052606745596303839180,35971408698389231,1447164455466959400696
0x8810de2baa17067ddcfbd9e8f29c55f070a55f0b,0x9e2f63a2449d2bdcd8cb4f30ee2630248694fcc7406c3e8eb22f063d95e49bc3,18-07-2025,2025-07-18 14:27:31.000 UTC,763,33029752,0x03a520b32C04BF3bEEf7BEb72E919cf822Ed34f1,3553150,4047618597742044432220,110047429413905234,90571399486168626303733
0x8508fd4238162cb3f3d485f432202af3b40f164e,0xa16c1985dc4f6d3a6307273483cbc9eab59681bfb096e0082230631a442fa1c0,02-06-2025,2025-06-02 22:28:43.000 UTC,862,31056988,0x827922686190790b37229fd06084350E74485b72,15452406,13968170509,530266,167657
0x0b27b59171a4ffe19f23d54126cd797be17c6551,0x13a8694c34ee415611b2be82412bef42822c9bb8603789babbf17feb93393836,07-07-2025,2025-07-07 02:56:37.000 UTC,212,32533825,0x03a520b32C04BF3bEEf7BEb72E919cf822Ed34f1,3486450,6648880794816626120625,204647008604031616,130026264111242280680671
0x38f6d2d9ea493c3c6ee865b5b952b5fe9e3e61fc,0xd22352526eae085885d247a3d46d9b4686fcb929cd7ce204cc78166f8fe68940,14-07-2025,2025-07-14 23:49:31.000 UTC,89,32873812,0x46A15B0b27311cedF172AB29E4f4766fbE7F4364,441702,28661953084,136683,1297120
0x2791dc5e14f7680d9d969acc26059ba56403b6d5,0x23971d423ef4533e9325db30a053e99c7b5d4d06167326483d16b3a1082a7346,02-01-2025,2025-01-02 13:35:27.000 UTC,434,24517790,0x827922686190790b37229fd06084350E74485b72,4978147,2352007224962068557290383,3666213184477557834691,25375816018072566480795
0x8508fd4238162cb3f3d485f432202af3b40f164e,0x14a2690db50505ea2c155efd20430174a4aaa7bcf3d9d52f493a44a28e4cd419,07-04-2025,2025-04-07 12:18:07.000 UTC,261,28619470,0x827922686190790b37229fd06084350E74485b72,10675658,235309015980449,109152815657352941142,4385
0x8fd1b615c006ebeb8a7cfb00a1dd809f31943b08,0xd64ed1309d8ce6ca89690f2dae4f25ad85f310d1492e24598b4e9dbdef45511d,29-12-2024,2024-12-29 21:50:59.000 UTC,388,24359856,0x827922686190790b37229fd06084350E74485b72,4770202,13057913918965255660,2974890064649334597,22091771866424677
0xdc98dbffcc648d6088a2ff8f7dc01aef050e58fc,0xc35a45c52355ba75e7bddac8cded247a103e334e951d67a97f93c57610b7ad90,09-07-2025,2025-07-09 06:21:53.000 UTC,668,32626383,0x46A15B0b27311cedF172AB29E4f4766fbE7F4364,432294,1384786816,37686,31546
0x2791dc5e14f7680d9d969acc26059ba56403b6d5,0x37bf2e81cfb4892078527cbdf58bfc9189d8049775ab3e8d66f43bfe7808828b,18-01-2025,2025-01-18 08:36:07.000 UTC,357,25200010,0x827922686190790b37229fd06084350E74485b72,5772592,163020522853633058,690923873,14925219795328441643091
0x9eb86e93a809a41ab0e7cc0ba6f62561fda3015c,0xc4057488dfe0ad9c23a55faa4fca97cdb7ad3e651247d3d84a8d456e08b6703e,06-06-2025,2025-06-06 07:15:27.000 UTC,460,31202390,0x827922686190790b37229fd06084350E74485b72,15740881,23915235995,567843,627858
0x8508fd4238162cb3f3d485f432202af3b40f164e,0xc7a228a59eea78be2535269c0012b7ed26d0fd72f716ac11284ccf9dd9a85ff4,10-06-2025,2025-06-10 16:37:51.000 UTC,383,31392062,0x827922686190790b37229fd06084350E74485b72,16097698,12506209812,77473,547956
0x9eb86e93a809a41ab0e7cc0ba6f62561fda3015c,0x25fd337a0a34b5f6c3078c1eac74db8b3ef105f2e2eee6d729731fc10e31348e,17-02-2025,2025-02-17 00:57:57.000 UTC,171,26482265,0x827922686190790b37229fd06084350E74485b72,7441769,6071585905,22137030,952980
0x8508fd4238162cb3f3d485f432202af3b40f164e,0xc8c9f5575701d70ab85dd1932f1eb93b7d1e4ecdbc782b3abc72ff1640338a13,06-05-2025,2025-05-06 18:20:07.000 UTC,483,29883130,0x827922686190790b37229fd06084350E74485b72,12987397,24065678530748900421,16114340893101900,41671378315262097881
0x2791dc5e14f7680d9d969acc26059ba56403b6d5,0xcffe8e924f641ef21718d543dc5bb243dd6e0d8da562fd383c668738065df376,24-12-2024,2024-12-24 18:09:31.000 UTC,262,24137212,0x827922686190790b37229fd06084350E74485b72,4559882,1417997277444875212934,674492294644492455387,658450305451968570
0x38f6d2d9ea493c3c6ee865b5b952b5fe9e3e61fc,0xacf788a91c9ce868e7cc6f4c5edd2da50fd31abdfee04b1f430f3bcdfd56187c,09-07-2025,2025-07-09 13:47:13.000 UTC,340,32639743,0x46A15B0b27311cedF172AB29E4f4766fbE7F4364,432621,29011042013,1279105,170730
0xdc98dbffcc648d6088a2ff8f7dc01aef050e58fc,0x0ac68f710add34fc3c59882e4b4f7f2a41d1e4334d61973062b9fbe21dcc3c88,15-12-2024,2024-12-15 19:22:51.000 UTC,507,23750612,0x827922686190790b37229fd06084350E74485b72,4055550,362968997644011520117,352403329078910826017,319733772182494561
0x38f6d2d9ea493c3c6ee865b5b952b5fe9e3e61fc,0xd24088cb468726d44a387b01b367706f84a1696ba48159338bf057aa45bb4bcc,24-05-2025,2025-05-24 12:31:53.000 UTC,507,30650283,0x827922686190790b37229fd06084350E74485b72,14609729,29884970197,1022186,471324
0xdc98dbffcc648d6088a2ff8f7dc01aef050e58fc,0x5325faf57f21fcf1353187e853d9d90e02937d60f6098cb710c325254f8ec21d,27-05-2025,2025-05-27 15:42:07.000 UTC,801,30785590,0x46A15B0b27311cedF172AB29E4f4766fbE7F4364,388510,12341208416701693105112,202655127749036420,424161258769861962
0xdc98dbffcc648d6088a2ff8f7dc01aef050e58fc,0x1f74a25e37554971ff57add5fd440226846c9b2b615111d8ea7fa426ea7b833c,27-05-2025,2025-05-27 18:04:33.000 UTC,742,30789863,0x46A15B0b27311cedF172AB29E4f4766fbE7F4364,388651,12328985202594467688730,189195391453197836,438318079880548839
0xdc98dbffcc648d6088a2ff8f7dc01aef050e58fc,0xc073cfac8015589f7b027f2804800a4682e7353a132abd5780e75f4b58db4d02,21-06-2025,2025-06-21 12:30:01.000 UTC,781,31859827,0x827922686190790b37229fd06084350E74485b72,17081809,10858576527337195,78643307,1031330216851733694844
0x8fd1b615c006ebeb8a7cfb00a1dd809f31943b08,0x9e4c20233491598499cc0aa5dbd5f2bfa8895440477e0a5667f0a1c88ec2559b,10-05-2025,2025-05-10 05:22:53.000 UTC,693,30032613,0x827922686190790b37229fd06084350E74485b72,13282591,719780023005725123,2189101174,357596698191456115542263
0x2791dc5e14f7680d9d969acc26059ba56403b6d5,0x0c40c3f1466bd073a5437545add3a0ba5a922d571409337b2ca74f798f7bbfcc,12-01-2025,2025-01-12 13:00:05.000 UTC,461,24948729,0x827922686190790b37229fd06084350E74485b72,5446747,1764027161762785270256,189732117063522668190,351952647820999604
0x8810de2baa17067ddcfbd9e8f29c55f070a55f0b,0x226f84fe5a902de57c53e4ed290d180cfa95fe9c5a420d85b7d03c5b71457d7f,25-05-2025,2025-05-25 09:14:57.000 UTC,1223,30687575,0x03a520b32C04BF3bEEf7BEb72E919cf822Ed34f1,3092884,26489910991965799,1048404304,584441198582766987319
0x38f6d2d9ea493c3c6ee865b5b952b5fe9e3e61fc,0x1e68aa3121a4bec6a5aaea559cc934b9fa64037d99fab801febdcaa563ca1440,14-07-2025,2025-07-14 08:29:55.000 UTC,267,32846224,0x827922686190790b37229fd06084350E74485b72,19303609,39508413989,933543,1041822
0x2791dc5e14f7680d9d969acc26059ba56403b6d5,0x980260e72e6a2093652f607eb643e7517d367824b6ccb79a78786fab738deb0f,14-12-2024,2024-12-14 05:39:25.000 UTC,282,23682709,0x827922686190790b37229fd06084350E74485b72,3989233,2950750977576237903999,924283261885736444144,890313943542304497
0x2791dc5e14f7680d9d969acc26059ba56403b6d5,0xab66a10d5abcf37ef68177a51c51cecd5c8483a57228961fabe4eb693c6b5ed7,01-06-2025,2025-06-01 15:40:35.000 UTC,470,31001544,0x03a520b32C04BF3bEEf7BEb72E919cf822Ed34f1,3152570,36607679776370946508,42715907742231576,53068069375371115178
0x38f6d2d9ea493c3c6ee865b5b952b5fe9e3e61fc,0x6212d7b1f02094a7dd5e518a545a93f7197f7b0a89e44245fe284a8c9f158708,04-01-2025,2025-01-04 08:35:41.000 UTC,357,24595197,0x827922686190790b37229fd06084350E74485b72,5058299,2149146824472067741592,18879137758358519984,713159856898354221
0x9eb86e93a809a41ab0e7cc0ba6f62561fda3015c,0x3e8c54b467bd42b551d3f67eb6bdf180db7c6c604f3e30a5727f36242556e362,04-01-2025,2025-01-04 09:27:55.000 UTC,281,24596764,0x827922686190790b37229fd06084350E74485b72,5059761,2211724506386726597267,521184169847471362470,140578114257418154
0x8fd1b615c006ebeb8a7cfb00a1dd809f31943b08,0x8d9217d1bd71f6864c2f937fc2b2640db9a96c61d45fa3ad3d580746772587de,01-01-2025,2025-01-01 16:13:13.000 UTC,582,24479323,0x827922686190790b37229fd06084350E74485b72,4932126,11908413156638625806455,346457864997520358,8516156366549498553482
0x2791dc5e14f7680d9d969acc26059ba56403b6d5,0x863ce287c95080d3a1e4a0b0c42c6f6534c33d0447617d2e23d10b0befbc83c1,05-01-2025,2025-01-05 08:24:53.000 UTC,730,24638073,0x827922686190790b37229fd06084350E74485b72,5099143,1466170031906215863,3305423741,8158320064736293074323
0x9eb86e93a809a41ab0e7cc0ba6f62561fda3015c,0xc2b68683c512fa0ca24edc594b0b7baecbc5d58ffc56c20090ea7e9acd8c152a,11-03-2025,2025-03-11 18:31:29.000 UTC,357,27464271,0x03a520b32C04BF3bEEf7BEb72E919cf822Ed34f1,2307880,307498471,251891522,358547
0xdc98dbffcc648d6088a2ff8f7dc01aef050e58fc,0x97821559687e67bf3f172f8693094869607140bc716fc52d4a557761ea9f451d,01-01-2025,2025-01-01 21:36:55.000 UTC,331,24489034,0x827922686190790b37229fd06084350E74485b72,4942959,913760808254540470,1310102670,49584985199856144941096
0x8508fd4238162cb3f3d485f432202af3b40f164e,0xdf688a98dd3e1147b1f1c6dc4d6b966a71eea9b963035ac4ab0b9c4be8b65a07,10-05-2025,2025-05-10 05:42:59.000 UTC,950,30033216,0x03a520b32C04BF3bEEf7BEb72E919cf822Ed34f1,2997481,3941298211469380855682,154350402786884152,60005423343075962718204
0x9eb86e93a809a41ab0e7cc0ba6f62561fda3015c,0xcdb461ed5df75fab686eae3542a1ecf12fc5a4730dbe259c0028a1616d7673ec,19-12-2024,2024-12-19 11:21:27.000 UTC,480,23908970,0x827922686190790b37229fd06084350E74485b72,4266442,1227663343108179272243,704809632358557473312,473255396673036910
0x095d0de0ecfd6832f1a7961ae26d285d68655d60,0xc9873f54249ccca20586bdb7e7133ed3057e21d110b0381ebcab6feb7502182f,22-01-2025,2025-01-22 04:48:37.000 UTC,296,25365985,0x827922686190790b37229fd06084350E74485b72,5968612,111489209092427979,1075716438,27213236307043247439156
0x38f6d2d9ea493c3c6ee865b5b952b5fe9e3e61fc,0xe0c7d5ccb0623b5e1bc204c2470b11a816d1e51b1fb12a607ef793c2db829fbc,03-06-2025,2025-06-03 04:13:39.000 UTC,341,31067336,0x827922686190790b37229fd06084350E74485b72,15476048,29878180482,7431,1487846
0xdc98dbffcc648d6088a2ff8f7dc01aef050e58fc,0x58eb015f4dc2fa741df1dca821ffc6d78ef00f21a9fa5c88ee8a5d591c6a18eb,30-05-2025,2025-05-30 10:53:43.000 UTC,409,30906538,0x46A15B0b27311cedF172AB29E4f4766fbE7F4364,390958,12223348714305881742775,52011663667981972,583970199118611460
0xdc98dbffcc648d6088a2ff8f7dc01aef050e58fc,0xbf894d482b7a262b22ca3f4be166bbb51c7972b8876102a426953077283cec09,15-12-2024,2024-12-15 07:08:11.000 UTC,149,23728572,0x827922686190790b37229fd06084350E74485b72,4033861,252174570644921470,1319758530,40714438054741955905267
0x0b27b59171a4ffe19f23d54126cd797be17c6551,0xc88c69617cdc03d1b2446f995ee1028e827cdb0c0e78ad03ea050c4d81aef7cb,24-11-2025,2025-11-24 08:02:41.000 UTC,1416,38591007,0x03a520b32C04BF3bEEf7BEb72E919cf822Ed34f1,4225346,1091374207918290927609,16802006137050186,42227246591193758224592
0x2791dc5e14f7680d9d969acc26059ba56403b6d5,0xd6c93fdd62501cbc02a93dddc4a0f3afb2d54ba1fb761d0a8e5f02a080919260,16-12-2024,2024-12-16 11:31:43.000 UTC,383,23779678,0x827922686190790b37229fd06084350E74485b72,4089705,8347287863297430323,3297590797333496830,2080339822273690
0xdc98dbffcc648d6088a2ff8f7dc01aef050e58fc,0x015ac17630e783d08bfd30c0198b573827c2c498cdc1992604a1ee7a152bb26d,14-01-2025,2025-01-14 04:22:33.000 UTC,295,25019603,0x827922686190790b37229fd06084350E74485b72,5530047,1026590775958660143158,26934539263614229937,276259119863975172
0x8fd1b615c006ebeb8a7cfb00a1dd809f31943b08,0xc80ecfc6c991d13c343cde4467d5b16fcee11138403f4dd33214c92b3c8cc093,16-12-2024,2024-12-16 01:56:09.000 UTC,175,23762411,0x827922686190790b37229fd06084350E74485b72,4055444,22289466627965038473,14966151087158229223,24219988617763038
0x38f6d2d9ea493c3c6ee865b5b952b5fe9e3e61fc,0x77c1cf6f391969afc6a68cedb327ffcdfaeebd93f3584492bed9223040c1e5d2,04-01-2025,2025-01-04 18:17:53.000 UTC,338,24612663,0x827922686190790b37229fd06084350E74485b72,5077154,2045818977006298832009,413697850570247353995,211336135224091279
0xdc98dbffcc648d6088a2ff8f7dc01aef050e58fc,0xad15d275998343971e2f1958fc3379f7342702ae3d1419906f4a2aaa778f9da8,22-05-2025,2025-05-22 10:51:23.000 UTC,830,30560868,0x46A15B0b27311cedF172AB29E4f4766fbE7F4364,385173,12995492422152263636342,210301652752712761,450097798677674589
0x8508fd4238162cb3f3d485f432202af3b40f164e,0x52f2d73cab1e34bdb3f752fa9b6f35b4a6e776820903fd9d092e1ec06692e34c,27-05-2025,2025-05-27 09:05:27.000 UTC,697,30773690,0x827922686190790b37229fd06084350E74485b72,14862535,16311283403,797003,17643
0xdc98dbffcc648d6088a2ff8f7dc01aef050e58fc,0x6215b1677b999440057be1a23c1de2d31045c3461446286e844b8a661d936250,05-07-2025,2025-07-05 02:59:01.000 UTC,2445,32447497,0x46A15B0b27311cedF172AB29E4f4766fbE7F4364,428257,10632403688907832802620,111408353371660277,435397785034725190
0x095d0de0ecfd6832f1a7961ae26d285d68655d60,0x49d2ae0b8b5ddb2a0ca512dd7855a17cabef653a3156f6cbde71aa589834ac1c,01-03-2025,2025-03-01 19:29:39.000 UTC,757,27034016,0x827922686190790b37229fd06084350E74485b72,8233106,64798625111476434,138281689,40529795357251731304268
0x38f6d2d9ea493c3c6ee865b5b952b5fe9e3e61fc,0xfc84c005c30d31f0c2a7001969e3e94cadb951250f66f7c95011936d573ff895,01-07-2025,2025-07-01 20:08:15.000 UTC,510,32305574,0x46A15B0b27311cedF172AB29E4f4766fbE7F4364,423627,12098159173,226363,378596
0x8810de2baa17067ddcfbd9e8f29c55f070a55f0b,0xe4d8bd3a1cb0297649306d078c1ddaca61b12768ce5bc39cb09a72a6deb50263,23-08-2025,2025-08-23 18:09:11.000 UTC,149,34591602,0x03a520b32C04BF3bEEf7BEb72E919cf822Ed34f1,3800029,763123394691534852111,19529166382679484,17695299943945084618800
0x9eb86e93a809a41ab0e7cc0ba6f62561fda3015c,0xebf3a60112c538f77eeb670a03a300bee9ebb99979347234b44e0615b72e64d2,08-02-2025,2025-02-08 05:27:47.000 UTC,288,26101560,0x03a520b32C04BF3bEEf7BEb72E919cf822Ed34f1,2055922,8340003012013,91352295876926834,282766
0x2791dc5e14f7680d9d969acc26059ba56403b6d5,0x2d75ae208956b352e2e2050f0f9141edfc6eb13a43488ce2d11422814a584451,09-01-2025,2025-01-09 04:27:09.000 UTC,432,24803741,0x827922686190790b37229fd06084350E74485b72,5280764,1831515577644988821626,230806632621933780895,346843323115930587
0x9eb86e93a809a41ab0e7cc0ba6f62561fda3015c,0xd8b1659cff0fe83bd63bf9962973c3d671e4490db8091a920b89052040b866f3,07-01-2025,2025-01-07 00:20:23.000 UTC,423,24709938,0x827922686190790b37229fd06084350E74485b72,5172530,1576634457083801648173,133354206313303803360,370889893680041512
0xdc98dbffcc648d6088a2ff8f7dc01aef050e58fc,0x5a0eb2b006cc25dafbb907f09c7157092ed0f212537bcfb4e3d729f02efe0493,09-07-2025,2025-07-09 13:47:25.000 UTC,292,32639749,0x46A15B0b27311cedF172AB29E4f4766fbE7F4364,432622,15778352535,695672,92856
0xdc98dbffcc648d6088a2ff8f7dc01aef050e58fc,0xe9a512a8e10cf73dae9bf0ed5e9c1cd592e11488e78a569f33cb6960284ee41e,05-01-2025,2025-01-05 08:44:47.000 UTC,326,24638670,0x827922686190790b37229fd06084350E74485b72,5099771,2467915338348788571196,149460653513437415056,663213697539209947
0x351f61e4c49cf11f24d9f2e737ca5eff81806355,0x54f99347ceb1d4b955337e2b5c42cc258219348a2afb5bd2d195a668b89a33fe,10-08-2025,2025-08-10 06:59:47.000 UTC,1296,34009920,0x827922686190790b37229fd06084350E74485b72,21925097,173938579709796557,97655572,45992183601485142141189
0x0b27b59171a4ffe19f23d54126cd797be17c6551,0xf022c7dfab90b194d196db8b66c3b9892e9935e32455526f3077e2e7062e3c71,21-10-2025,2025-10-21 18:32:51.000 UTC,411,37141112,0x03a520b32C04BF3bEEf7BEb72E919cf822Ed34f1,4082653,1825794634855069451149,36279341419282171,54805945632449786885953
0x8508fd4238162cb3f3d485f432202af3b40f164e,0xac75f0331b8bdde29a0b33543dc6f7dd3845c64ced822c1b532fca6cdbdf341d,01-04-2025,2025-04-01 22:25:09.000 UTC,152,28378481,0x827922686190790b37229fd06084350E74485b72,10292841,35352795630169479745,25408084950847784,57590754127573870668
0x9eb86e93a809a41ab0e7cc0ba6f62561fda3015c,0xf6c03fb16fe09ee580f5cc93a6607ea5985620b6d37c3db8ad6a75625e5c957f,01-06-2025,2025-06-01 04:33:25.000 UTC,320,30981529,0x827922686190790b37229fd06084350E74485b72,15294987,30863648331,1437285,103914
0x38f6d2d9ea493c3c6ee865b5b952b5fe9e3e61fc,0x5eafe240989e1bf28d4a675d6f0604712162d990814328cd9842d897677e3d8b,05-06-2025,2025-06-05 08:01:59.000 UTC,748,31160586,0x46A15B0b27311cedF172AB29E4f4766fbE7F4364,396738,5549962415,137268,140215
0x2791dc5e14f7680d9d969acc26059ba56403b6d5,0x9c2e0501231fc2d96b8a97af90d5939390c43cde77ca0d252ffc986af63014b3,08-01-2025,2025-01-08 23:06:59.000 UTC,228,24794136,0x827922686190790b37229fd06084350E74485b72,5268900,1907205769254700275874,315400784135244341877,284524178762959080
0x2791dc5e14f7680d9d969acc26059ba56403b6d5,0x226cb3cc78dff876e7eb0a0f6189e15a6b6bd26c0fb92766445da80e1d049904,07-01-2025,2025-01-07 21:22:03.000 UTC,354,24747788,0x827922686190790b37229fd06084350E74485b72,5210349,2180593072443100802954,410630125405143753586,267671323061050835
0x8fd1b615c006ebeb8a7cfb00a1dd809f31943b08,0x9cffd112b48b7f8f254f5ccdda1c45a0f41074a95175f5186dc6fa5071d68262,28-12-2024,2024-12-28 05:46:07.000 UTC,1061,24287710,0x827922686190790b37229fd06084350E74485b72,4717816,6999410434012748380,9071724747790883512,3862028763243955
0x2791dc5e14f7680d9d969acc26059ba56403b6d5,0xd688f34396454b91709c4c46ae9f94e255552982e94200e44d8e0ed2da668efb,14-12-2024,2024-12-14 12:59:39.000 UTC,309,23695916,0x827922686190790b37229fd06084350E74485b72,3999107,5727262422181783460,188705535202802264,2767185619560382
0x38f6d2d9ea493c3c6ee865b5b952b5fe9e3e61fc,0xa31e0a24acfa3f6a89bda6aff173e6a7178a6ac0894127552384af38bfa2503a,31-05-2025,2025-05-31 11:53:21.000 UTC,637,30951527,0x827922686190790b37229fd06084350E74485b72,15234898,25305755765,24304,1243264
0x2791dc5e14f7680d9d969acc26059ba56403b6d5,0x702b5680a517cdd0364b3cd6f9959b8cbc13990880ecfdf3d04035170f9ec0ad,13-12-2024,2024-12-13 07:04:49.000 UTC,267,23642071,0x827922686190790b37229fd06084350E74485b72,3939279,3396073505178095118077,152013029744221923866,1526215580614643209
0x095d0de0ecfd6832f1a7961ae26d285d68655d60,0xce95d373751a311c97fcf825af1a9067f9c56a605f4741ece8b97f2eb3b576f7,20-01-2025,2025-01-20 05:04:57.000 UTC,178,25280075,0x03a520b32C04BF3bEEf7BEb72E919cf822Ed34f1,1856733,4463955859247763806714,244705974205463938,72298022288919681016213
0xdc98dbffcc648d6088a2ff8f7dc01aef050e58fc,0xd5cda73ca79f7837c9e54ff8ea01138476d021f6367c970c3418ec3f9a8c4632,08-07-2025,2025-07-08 10:48:33.000 UTC,1760,32591183,0x46A15B0b27311cedF172AB29E4f4766fbE7F4364,431493,10557858822299001263249,68687373872266280,478662672889243252
0x2791dc5e14f7680d9d969acc26059ba56403b6d5,0x5bb913d4bd781daf295253cee9cf96a915a41026caf7b08d99c42bb60fdcdf9d,18-12-2024,2024-12-18 16:19:21.000 UTC,355,23874707,0x827922686190790b37229fd06084350E74485b72,4213796,8604615188964184049,1324750998890597829,5865161625064776
0xdc98dbffcc648d6088a2ff8f7dc01aef050e58fc,0x8b57fd94c4651387e026396ed16542fb3c8b335b080f132db1a68ab236d19181,04-01-2025,2025-01-04 20:51:31.000 UTC,451,24617272,0x827922686190790b37229fd06084350E74485b72,5081626,2529431130302205130395,117652776601099545228,726663830706091403
0x2791dc5e14f7680d9d969acc26059ba56403b6d5,0x16a17931556ce3c8e12ea2244fa5fd589d10fc2d4416141c9b71e227cbea83d4,29-12-2024,2024-12-29 00:52:53.000 UTC,502,24322113,0x827922686190790b37229fd06084350E74485b72,4760158,6445093571756571694,2455344773083969092,3613636918239137
0x9eb86e93a809a41ab0e7cc0ba6f62561fda3015c,0x3ecc19443ff77f28fd11beb1d07c486e0b4093b23c28fdd2b689f14f6f74b3f0,01-06-2025,2025-06-01 08:06:55.000 UTC,238,30987934,0x827922686190790b37229fd06084350E74485b72,15305902,30466219380,51367,1473820
0x38f6d2d9ea493c3c6ee865b5b952b5fe9e3e61fc,0x681dc06d90fc5615b77165ce46e36ed4f1552e801bded6260094900a23d15ad6,02-01-2025,2025-01-02 20:15:09.000 UTC,306,24529781,0x827922686190790b37229fd06084350E74485b72,4993687,1657428177181964639789,125255588006881109960,432969921772361570
0x9eb86e93a809a41ab0e7cc0ba6f62561fda3015c,0xf9c3e5f4c16dec7a9f33ff5ed1de503e5a9e60c14afaf9a01a98a49997beac38,14-02-2025,2025-02-14 23:24:31.000 UTC,291,26393062,0x827922686190790b37229fd06084350E74485b72,7340659,6143560020,81473109,898859
0x9eb86e93a809a41ab0e7cc0ba6f62561fda3015c,0x08bab67271cdc824d8972f099132bbbcb4c87311b5fb5f9a090240518d01f062,15-12-2024,2024-12-15 17:43:49.000 UTC,286,23747641,0x827922686190790b37229fd06084350E74485b72,4052597,1754879979632098313555,898249667968293954857,749144721547939672
0x095d0de0ecfd6832f1a7961ae26d285d68655d60,0x462bbf74994f496396cedc43dae26cb5bbcd7f2b6a56e8636ab8cf2a32ddb6e8,09-04-2025,2025-04-09 17:10:55.000 UTC,777,28714654,0x827922686190790b37229fd06084350E74485b72,10818130,212069829099520658869856,31448224455315747122,94949652208651159711848
0x9eb86e93a809a41ab0e7cc0ba6f62561fda3015c,0xee747ef4040b50c3675de037edfa25e1812d19f48020c868fb05dc920171d672,02-01-2025,2025-01-02 12:57:23.000 UTC,466,24516648,0x827922686190790b37229fd06084350E74485b72,4976651,3050924733859608820342,284063661298427837609,731036832594178186
0x8fd1b615c006ebeb8a7cfb00a1dd809f31943b08,0x789e181407b5e70496c099683a36a04d9277fc94e4704f2d9f6544ce4aed76c6,28-12-2024,2024-12-28 14:06:13.000 UTC,447,24302713,0x827922686190790b37229fd06084350E74485b72,4672489,15112195946783350931,6677322053405027503,3331321772463866
0x2791dc5e14f7680d9d969acc26059ba56403b6d5,0x39f9ac4caee144261aecdca32c6fe5d0f92822e000005f33e872d4f08319aad6,09-01-2025,2025-01-09 06:53:43.000 UTC,526,24808138,0x827922686190790b37229fd06084350E74485b72,5285836,1058513228428598310,2761088197,201269837288997854009
0x8508fd4238162cb3f3d485f432202af3b40f164e,0x47ba617356a9104dc4a7aaad1e989364d5665b58961e4d297c0a43113efe84f0,09-04-2025,2025-04-09 20:16:37.000 UTC,470,28720225,0x827922686190790b37229fd06084350E74485b72,10825432,194105590634129,37805975516397962862,24161
0x095d0de0ecfd6832f1a7961ae26d285d68655d60,0xc32e035abc32ebfecc72509594ac53eb10667f68b7e42cc40639e1bb9cfe0210,09-03-2025,2025-03-09 17:57:09.000 UTC,399,27376841,0x827922686190790b37229fd06084350E74485b72,8744617,51489054403324219,78377485,36916249931273987548381
0x9eb86e93a809a41ab0e7cc0ba6f62561fda3015c,0xc0ee0ef9d0f8c9dcdeeb6d495c3052361a7dbe5956914718b6143dac9c8d562e,04-01-2025,2025-01-04 11:40:27.000 UTC,451,24600740,0x827922686190790b37229fd06084350E74485b72,5062896,619979505091340693157232,1086804390761391663990,4549418489708220639144
0xdc98dbffcc648d6088a2ff8f7dc01aef050e58fc,0x4333b61df447316a8a53a11b7f50437a979088b1385ace16c1a2f90b2d300bb9,13-12-2024,2024-12-13 01:54:23.000 UTC,523,23632758,0x827922686190790b37229fd06084350E74485b72,3928080,384825387771644641,715000291,245870890224982267508544
0x8fd1b615c006ebeb8a7cfb00a1dd809f31943b08,0xf505da98dcec27a9c9a1783f4827011e82d533c87f3940e776e19e45ee46cb64,31-12-2024,2024-12-31 07:23:37.000 UTC,178,24420235,0x827922686190790b37229fd06084350E74485b72,4770202,5945337514181417524,4503273915898084080,6662598431238717
0x38f6d2d9ea493c3c6ee865b5b952b5fe9e3e61fc,0x3c6e42d3a36726e1c255fbb1765662b5f9f4f03f3c66a73d4f9467693d9a53d4,09-01-2025,2025-01-09 02:51:37.000 UTC,384,24800875,0x827922686190790b37229fd06084350E74485b72,5277057,1455821982400080764,1269763531,37112286704618342004973
0x095d0de0ecfd6832f1a7961ae26d285d68655d60,0x3499197fba08dc724f7c168750fdec8870b4033855a623e3df129b834f504f5c,21-07-2025,2025-07-21 18:11:55.000 UTC,441,33166084,0x03a520b32C04BF3bEEf7BEb72E919cf822Ed34f1,3579740,1548987240190400030673,6369566729376275,69427789616316167349215
0x38f6d2d9ea493c3c6ee865b5b952b5fe9e3e61fc,0xa420d25f4851d57d3be4026a38ab259ca245ad0784f64de7e2c260dace47e210,16-01-2025,2025-01-16 21:22:11.000 UTC,611,25136592,0x827922686190790b37229fd06084350E74485b72,5685363,437041153796578631,1061071482,35694729504818061112811
0x9eb86e93a809a41ab0e7cc0ba6f62561fda3015c,0xcd7a1055d02f6130e13fa7b7a7a95b4b146a0294457c27d602beba8c42933f65,04-03-2025,2025-03-04 06:50:33.000 UTC,270,27140843,0x827922686190790b37229fd06084350E74485b72,8395017,2542241526,341741752,29932
0x9eb86e93a809a41ab0e7cc0ba6f62561fda3015c,0x862f93ca5833fcd45a06491b81e4bee13044779c09d6379d86e488a44f6add49,07-12-2024,2024-12-07 17:18:55.000 UTC,301,23401294,0x827922686190790b37229fd06084350E74485b72,3633533,676247790542112710,4364595525,87804762836162216038798
0xdc98dbffcc648d6088a2ff8f7dc01aef050e58fc,0xe28c7d46901812b967950a711f55838e6eecf8edd8e1bcaa1aacd053b096edf7,11-06-2025,2025-06-11 16:38:47.000 UTC,784,31435290,0x46A15B0b27311cedF172AB29E4f4766fbE7F4364,403334,11335944495193967089221,21641036931851736,571209940535694591
0x095d0de0ecfd6832f1a7961ae26d285d68655d60,0xb40c52316df9736ffa12f129467a64ef1a2cf7eeb48d3605647aa394f24f5452,25-06-2025,2025-06-25 10:51:11.000 UTC,1011,32029662,0x03a520b32C04BF3bEEf7BEb72E919cf822Ed34f1,3406853,4451696135450197595732,10098831734066769,230924963693194891445224
0x8fd1b615c006ebeb8a7cfb00a1dd809f31943b08,0x28bec0390fc05d49ab82bcd780be411a42ba41093361c1e0f2acc3408a44b9f0,12-12-2024,2024-12-12 01:34:09.000 UTC,253,23588951,0x827922686190790b37229fd06084350E74485b72,3870399,6720769545749374665998,4054582164067785806035,2436426979510826273
0xdc98dbffcc648d6088a2ff8f7dc01aef050e58fc,0xad1714ff701d433c6a90c0ceea9b8568c90a6409dc5e3a1d51c5151c4ce3b9d3,13-01-2025,2025-01-13 11:31:37.000 UTC,329,24989275,0x827922686190790b37229fd06084350E74485b72,5495681,1062226107964416636157,188600276434281013109,148654142416503780
0x8fd1b615c006ebeb8a7cfb00a1dd809f31943b08,0xec1349363dfde6f63810ccae9306964270cb049c1ae716bdd31a3788d7384fdd,09-01-2025,2025-01-09 23:20:47.000 UTC,350,24837750,0x827922686190790b37229fd06084350E74485b72,5324799,3204381641456497142479,481638997074478512372,1520792505891446431
0xdc98dbffcc648d6088a2ff8f7dc01aef050e58fc,0xe3ec18ec2fe5cd1252542ed2cf1b6c1d9e24e9f0520593274a240b0c14f9abda,14-07-2025,2025-07-14 10:38:55.000 UTC,196,32850094,0x46A15B0b27311cedF172AB29E4f4766fbE7F4364,440465,15170229017,730060,27903
0x8fd1b615c006ebeb8a7cfb00a1dd809f31943b08,0xf93b0cfb9aef867798a9d70617f0a7f499bc95092758cd6cddff03421b42709e,16-12-2024,2024-12-16 15:48:25.000 UTC,624,23787379,0x827922686190790b37229fd06084350E74485b72,4102569,3072672648428399546113,2866718550295452569709,2836191909984414197
0x8508fd4238162cb3f3d485f432202af3b40f164e,0xcef7d684bf388417cc989cd47869a8d2940c6774236fcf171a68ef628a7dbfce,02-06-2025,2025-06-02 11:53:31.000 UTC,593,31037932,0x827922686190790b37229fd06084350E74485b72,15409321,14127250698,314336,392070
0x2791dc5e14f7680d9d969acc26059ba56403b6d5,0x3ad8a2bae845581d2902736a513767317666e9ac199fd2e7a8e297fd2c0676de,04-01-2025,2025-01-04 15:54:37.000 UTC,460,24608365,0x827922686190790b37229fd06084350E74485b72,5071893,2080747612393655158207477,499253882744217326532,87221387855154104594970
0x8fd1b615c006ebeb8a7cfb00a1dd809f31943b08,0x0c49f08b785ccc5dc0343b843a3445b63c52051ec1ccd0cd7f3b990dc069a99a,24-12-2024,2024-12-24 09:05:03.000 UTC,486,24120878,0x827922686190790b37229fd06084350E74485b72,4536857,8042866115813031287,10603298226212200075,4661976863554525
0xdc98dbffcc648d6088a2ff8f7dc01aef050e58fc,0xfeb580037c11228f050f266df51d4d09ad9504b94b1d7437022cb57389c27b6a,14-01-2025,2025-01-14 17:14:35.000 UTC,340,25042764,0x827922686190790b37229fd06084350E74485b72,5557466,946584585660691602571,5926208874118905795,273629652342883023
0x351f61e4c49cf11f24d9f2e737ca5eff81806355,0x3799003ccb1a5b212f2528545ce880a8fa9a8c6d75cda4574b330b706e4bccbb,29-08-2025,2025-08-29 21:26:03.000 UTC,141,34856708,0x827922686190790b37229fd06084350E74485b72,24034244,406098672692361903,193309236,164125443947275604579271
0xdc98dbffcc648d6088a2ff8f7dc01aef050e58fc,0x8dcf0936ca08344328a442d6f1f0a2ef2b6d5d8094fe0106beedb7599a9cbdb5,09-01-2025,2025-01-09 16:31:29.000 UTC,529,24825471,0x827922686190790b37229fd06084350E74485b72,5310054,1678329140357858210898,512570387734237447671,18429688987856139
0x2791dc5e14f7680d9d969acc26059ba56403b6d5,0x80788fe01f0421140b5d8c52c2c36bc3c0bb260cc8bffdf836fe77f1e233c177,09-03-2025,2025-03-09 05:05:15.000 UTC,205,27353684,0x827922686190790b37229fd06084350E74485b72,8660628,16324058871405820,32006518,3256860143499998371144
0x8508fd4238162cb3f3d485f432202af3b40f164e,0xb00d6117d26031dd602c60266284db8cc98354894cff7acbec81ca9bfd252065,09-03-2025,2025-03-09 05:22:41.000 UTC,271,27354207,0x03a520b32C04BF3bEEf7BEb72E919cf822Ed34f1,2263246,9208631996223515925269,239208709206154833,155326940932289842845152
0x2791dc5e14f7680d9d969acc26059ba56403b6d5,0x633c42b1fc56772e9890364ea89a94a05e417ce9679dc5807d2db2a17e12fb92,09-01-2025,2025-01-09 18:09:39.000 UTC,345,24828416,0x827922686190790b37229fd06084350E74485b72,5314195,1348207508044914648470606,1423326577973901823444,31434097697735377584561
0x2791dc5e14f7680d9d969acc26059ba56403b6d5,0xc3054c43883e21b6523720e54a4244c5651671d3262e57071d76ed78bbf268a6,13-01-2025,2025-01-13 21:50:11.000 UTC,668,25007832,0x827922686190790b37229fd06084350E74485b72,5515178,1551008435224330195281,499080083177680302230,27569540337075855
0x9eb86e93a809a41ab0e7cc0ba6f62561fda3015c,0xecb7b50a81d13f5e31893f98e45422aeeb89abfcbb41389fb2c43e38b7eef9f5,10-06-2025,2025-06-10 16:03:43.000 UTC,1256,31391038,0x827922686190790b37229fd06084350E74485b72,16095434,22518002491,733418,392149
0xdc98dbffcc648d6088a2ff8f7dc01aef050e58fc,0xebcf856b2a9af6d16b57e374104b190ac248c328d033898f6501bd322307d018,12-06-2025,2025-06-12 09:28:35.000 UTC,609,31465584,0x46A15B0b27311cedF172AB29E4f4766fbE7F4364,404068,11322128344210520365245,59013522835394351,529192496376034482
0x9eb86e93a809a41ab0e7cc0ba6f62561fda3015c,0x997e0c670e52125ed69d40fdd13e8fcba66782de9d7027a9c5f7893b5a5262a9,07-01-2025,2025-01-07 04:51:45.000 UTC,425,24718079,0x827922686190790b37229fd06084350E74485b72,5180182,1500662414434896945490,370615816349952243957,94963219522177452
0x9eb86e93a809a41ab0e7cc0ba6f62561fda3015c,0xb0de5abb12ab327d51efb7b2ffa4443948caf0c5152d0e8b6e790a4addf51b83,03-03-2025,2025-03-03 17:42:15.000 UTC,250,27117194,0x827922686190790b37229fd06084350E74485b72,8359708,2708538174,39685287,404887
0x9eb86e93a809a41ab0e7cc0ba6f62561fda3015c,0x0a6ba44ecab7d88087701e58c85c6409b712b180836b4116ae811177517b9531,01-01-2025,2025-01-01 18:46:31.000 UTC,389,24483922,0x827922686190790b37229fd06084350E74485b72,4936865,3320060472876369601948,130249746085168136,1809480705802539211436
0x38f6d2d9ea493c3c6ee865b5b952b5fe9e3e61fc,0xebde53504532996d154d6d9a10d83cf37af6f08141638d990cf4542c23763202,29-12-2024,2024-12-29 14:48:41.000 UTC,424,24347187,0x827922686190790b37229fd06084350E74485b72,4782980,560758402546124627,834411603,48628616342640717733158
0x9eb86e93a809a41ab0e7cc0ba6f62561fda3015c,0xb69f77c77791bdac97e81e6d76a17df48c1ba26fbedfc8a22c5e6c15ffe971b6,02-01-2025,2025-01-02 00:48:19.000 UTC,362,24494776,0x827922686190790b37229fd06084350E74485b72,4949787,563317870295086324145610,385078773464881205178,17696411706575287239590
0xdc98dbffcc648d6088a2ff8f7dc01aef050e58fc,0x88984c90c66f28fbecb3af73828f68cf219a6d79a237461dac68ffe6a51af035,31-05-2025,2025-05-31 16:41:45.000 UTC,515,30960179,0x46A15B0b27311cedF172AB29E4f4766fbE7F4364,391972,12064897608738101118831,744519861732654,631943639712365037
0x9eb86e93a809a41ab0e7cc0ba6f62561fda3015c,0x6f387a118ad059d428a5d32687b9162aceaf5ebcb8b0ec2a2338e9fed0157b6b,31-01-2025,2025-01-31 03:32:37.000 UTC,317,25752505,0x827922686190790b37229fd06084350E74485b72,6452807,60824861419211688,382071238,14866634050007535304774
0x095d0de0ecfd6832f1a7961ae26d285d68655d60,0x6ee69d2ffef200aeabc6d2d02e4a1b536a5c59590308ac5e16cf55ef0fc5e277,24-04-2025,2025-04-24 15:40:37.000 UTC,2333,29359945,0x827922686190790b37229fd06084350E74485b72,11909942,111220044098008031265112,8168203111622895724,60110322791612746734222
0x8508fd4238162cb3f3d485f432202af3b40f164e,0x292cfd2a4d74c443759601aa20de45086314c992d61189804494a4acd6eed2c6,05-06-2025,2025-06-05 06:04:41.000 UTC,880,31157067,0x827922686190790b37229fd06084350E74485b72,15648496,13300408732,131711,533643
0x095d0de0ecfd6832f1a7961ae26d285d68655d60,0xcdf9b0ad836260d0cd475076ef1b53078ad4e37e4b4e1cee2f80b005b6c724f2,20-05-2025,2025-05-20 08:26:19.000 UTC,122,30470116,0x03a520b32C04BF3bEEf7BEb72E919cf822Ed34f1,3064981,5794674898916464817443,86922175808860502,213326185221011769552478
0xdc98dbffcc648d6088a2ff8f7dc01aef050e58fc,0x083f271a54ccc82f42c90f06b79321c60732e7fb312e1202a6846e45e83f7ede,01-01-2025,2025-01-01 20:35:37.000 UTC,409,24487195,0x827922686190790b37229fd06084350E74485b72,4940846,284882692308872135817,205319153896763737708,340531931116873663
0xdc98dbffcc648d6088a2ff8f7dc01aef050e58fc,0x5c54b16783f11b1e4d37238ca3e897c006038e04a8814b38245e3bec510bc08a,12-01-2025,2025-01-12 18:38:49.000 UTC,227,24958891,0x827922686190790b37229fd06084350E74485b72,5457453,1191803652435507919407,70201167597498667691,282832802306856379
0x38f6d2d9ea493c3c6ee865b5b952b5fe9e3e61fc,0x962b591739afcc0f1bbf70ecae151807b97c8a29c6cd0cf0e7a6f30d80833484,04-01-2025,2025-01-04 11:44:41.000 UTC,439,24600867,0x827922686190790b37229fd06084350E74485b72,5063015,1802253736494757848,798845233,57474149847385616912102
0xdc98dbffcc648d6088a2ff8f7dc01aef050e58fc,0x3adbc842e6c38ea259b8c50c04f60726cabfef5c1c6731d96fb9a1af78bbc315,12-01-2025,2025-01-12 09:15:19.000 UTC,379,24941986,0x827922686190790b37229fd06084350E74485b72,5440371,1236292006372855145678,94468876016583742265,283541721007708773
0x38f6d2d9ea493c3c6ee865b5b952b5fe9e3e61fc,0xa2a294394f135e4816d1ae8fe2a1179c0fa305768b290298eac1f93e399477f5,03-07-2025,2025-07-03 03:03:03.000 UTC,1578,32361218,0x827922686190790b37229fd06084350E74485b72,18170968,34321382018,1508770,206456
0x8fd1b615c006ebeb8a7cfb00a1dd809f31943b08,0x390d62641c5016bc6b2f880ac30c283d15f6a28a09ba090f2197c3f4c94387f0,13-12-2024,2024-12-13 05:44:31.000 UTC,236,23639662,0x827922686190790b37229fd06084350E74485b72,3931741,8424132211056217720,15649900220780829551,3037866416990535
0x2791dc5e14f7680d9d969acc26059ba56403b6d5,0xb1c24fed9d76c38a623361b4b730e020943bfa54a2c68057e1e552bb9a8d9ae2,16-12-2024,2024-12-16 21:39:51.000 UTC,541,23797922,0x827922686190790b37229fd06084350E74485b72,4114702,15271785380073311374,5055857719833768523,4536607282069219
0x8810de2baa17067ddcfbd9e8f29c55f070a55f0b,0x2775c52610f4263255f640d025a8533ae9bbf35f440e2270d271c5c19e21e521,11-05-2025,2025-05-11 18:21:53.000 UTC,576,30099183,0x03a520b32C04BF3bEEf7BEb72E919cf822Ed34f1,3008207,3427902349987364033132,32404429069860922,100015940845193012588044
0x0b27b59171a4ffe19f23d54126cd797be17c6551,0x7d50714021da38a7b14506d11ddca72625d9eb4df168b6fb042610251053c2d0,31-08-2025,2025-08-31 22:43:11.000 UTC,220,34945422,0x03a520b32C04BF3bEEf7BEb72E919cf822Ed34f1,3836008,5864750729144393873864,106292866015225841,196539849118928689064908
0x9eb86e93a809a41ab0e7cc0ba6f62561fda3015c,0x3f9f9ca5ba0e522b283c2bd4d19d9d53a19efbe911a206172d5a4816f82cd80d,10-12-2024,2024-12-10 11:02:21.000 UTC,534,23519597,0x827922686190790b37229fd06084350E74485b72,3778091,3245742759198486851725,1159323602182488847550,843303737509909126
0xdc98dbffcc648d6088a2ff8f7dc01aef050e58fc,0x6aff996e60e2a46acd954da94b6f4aaa76b1e6c75016566b8837d43137ed36a9,09-06-2025,2025-06-09 13:19:09.000 UTC,605,31342901,0x827922686190790b37229fd06084350E74485b72,15996875,10328477703,316791,199499
0xdc98dbffcc648d6088a2ff8f7dc01aef050e58fc,0xffaf63953ff6896038dbf70fcf7859f915de611c42b5ca30156a57e4168fdb86,29-12-2024,2024-12-29 07:46:31.000 UTC,284,24334522,0x827922686190790b37229fd06084350E74485b72,4772538,1004465669041289352,1729553954,48022714932520637828122
0xdc98dbffcc648d6088a2ff8f7dc01aef050e58fc,0x8da65fbe5d825c0aca6b05f5819c7636225ee178ce523c928cfd71a5ab69024f,27-05-2025,2025-05-27 03:45:25.000 UTC,802,30764089,0x827922686190790b37229fd06084350E74485b72,14800389,409283802,2891,17588
0x0b27b59171a4ffe19f23d54126cd797be17c6551,0xefa369d4c3b966caa4e55e0a8be0c61dc57179580196cbc173c07faf698a7ac4,13-07-2025,2025-07-13 05:53:43.000 UTC,390,32798338,0x03a520b32C04BF3bEEf7BEb72E919cf822Ed34f1,3517897,5557394506021518418376,123418529707300315,150942600737060418660115
0x095d0de0ecfd6832f1a7961ae26d285d68655d60,0x4b28cf106c3b81a371ae44e01fc31a84be59895d691bf355410f32c67f8aecfb,07-05-2025,2025-05-07 02:24:15.000 UTC,736,29897654,0x03a520b32C04BF3bEEf7BEb72E919cf822Ed34f1,2978264,115784973876696593549,205012953825661714,341324759042953963671
0x8fd1b615c006ebeb8a7cfb00a1dd809f31943b08,0xcb24357fe89420adca5fb5d897005acf767d1cc83f03f1366377dd8491e624d6,20-12-2024,2024-12-20 15:16:19.000 UTC,479,23959216,0x827922686190790b37229fd06084350E74485b72,4331808,1388655273284364278733,219842656972909583830,451921509320064050
0x8fd1b615c006ebeb8a7cfb00a1dd809f31943b08,0x8be631a7729241e32c2f4e1e8882f578ed2e86ac7aea882b95fa7b859e7841cb,28-12-2024,2024-12-28 16:20:41.000 UTC,387,24306747,0x827922686190790b37229fd06084350E74485b72,4740824,8644088632662949249,5376312071404990532,10775535059276627
0x2791dc5e14f7680d9d969acc26059ba56403b6d5,0x5cefbf76472ce24d86491e02e9d0f5037b074302a6dfd80a2dc09b75cae1f9ec,14-12-2024,2024-12-14 11:26:07.000 UTC,320,23693110,0x827922686190790b37229fd06084350E74485b72,3997058,8092320766811669659,3981904138231257359,1508411799947072
0x9eb86e93a809a41ab0e7cc0ba6f62561fda3015c,0x729949300c31032462d60d4ba5a008233dc92eb131e520d37c4384abb7ee264b,03-01-2025,2025-01-03 22:28:53.000 UTC,393,24576993,0x827922686190790b37229fd06084350E74485b72,5043632,2379760653188333543097,519989772733518776225,195456587711575633
0x8810de2baa17067ddcfbd9e8f29c55f070a55f0b,0xc0619f8cb31846ebb890469e22d9a92f68b69169326c723bd38d43fac8590ffd,18-11-2025,2025-11-18 13:38:31.000 UTC,722,38341882,0x03a520b32C04BF3bEEf7BEb72E919cf822Ed34f1,4201459,468049939941229648592,10633723403144181,12118527699741678971327
0x0b27b59171a4ffe19f23d54126cd797be17c6551,0xa808f6d6b38e41842d6d711bed066ad18bbd12f26ac20cf5fd6a58410a906d7b,13-08-2025,2025-08-13 10:55:21.000 UTC,148,34146587,0x03a520b32C04BF3bEEf7BEb72E919cf822Ed34f1,3741810,1149531954938624612011,38692665823640264,20687581717732534038404
0xdc98dbffcc648d6088a2ff8f7dc01aef050e58fc,0x597b5a4b99a4378efcef3fc9245ae8dd45d0054eba5f311c9d49689bac9af7bb,14-01-2025,2025-01-14 01:44:55.000 UTC,421,25014874,0x827922686190790b37229fd06084350E74485b72,5523861,1047377095599493139782,93111818516673514156,227119470394669839
0x8fd1b615c006ebeb8a7cfb00a1dd809f31943b08,0xafe04b7b576808a12c37eea0a27946cc5e5304f1093e13559f19d6ac05be6d9a,25-12-2024,2024-12-25 12:29:03.000 UTC,394,24170198,0x827922686190790b37229fd06084350E74485b72,4595213,2642810687617755852440,2084182066130183021969,2819285420165214869
0x38f6d2d9ea493c3c6ee865b5b952b5fe9e3e61fc,0x3d2f182fed9b6b0a28a74f4f60afab2eee863c6f8cdd1ee81a452063fab68d39,01-06-2025,2025-06-01 10:47:45.000 UTC,464,30992759,0x46A15B0b27311cedF172AB29E4f4766fbE7F4364,392501,3260074808,151441,11341
0x8508fd4238162cb3f3d485f432202af3b40f164e,0x670fdf1d400b24e2b2b353e7e377b102f221e1dbdcee65a4e7ad1aaad855b068,10-06-2025,2025-06-10 16:19:33.000 UTC,345,31391513,0x827922686190790b37229fd06084350E74485b72,16096560,12510802730,297351,328170
0x095d0de0ecfd6832f1a7961ae26d285d68655d60,0xbfa690aac144724b18157ab0a558dcca9e7a22e9cdc116c13b4b8ca56436ce62,07-05-2025,2025-05-07 12:22:59.000 UTC,407,29915616,0x03a520b32C04BF3bEEf7BEb72E919cf822Ed34f1,2979798,109743950411683714338,207681174534665853,302438891787448434628
0xdc98dbffcc648d6088a2ff8f7dc01aef050e58fc,0x95ad408eb116d6552cf768aaadcb5ecf5598d59466f87d34e6204dbe9a928a4a,08-07-2025,2025-07-08 17:47:19.000 UTC,475,32603746,0x46A15B0b27311cedF172AB29E4f4766fbE7F4364,431803,10541245713223719031160,219888191866791452,310983778570458871
0x2791dc5e14f7680d9d969acc26059ba56403b6d5,0x2b00987cab437af4853d9488f830e3c7e8c9414550cd1ea859e2085d428d7286,15-01-2025,2025-01-15 16:17:17.000 UTC,335,25084245,0x827922686190790b37229fd06084350E74485b72,5610694,150761417358399267527377,401561946491860073478,19149206500170248384655
0x351f61e4c49cf11f24d9f2e737ca5eff81806355,0x904a70e0c7e57450050f0022093181e1b8b7b9550b7b36d2168fcb0d61300fcb,18-08-2025,2025-08-18 05:59:27.000 UTC,208,34353710,0x827922686190790b37229fd06084350E74485b72,22734292,995357363456685038,58516976,414042124274394832673910
0x38f6d2d9ea493c3c6ee865b5b952b5fe9e3e61fc,0x90297d0004458a58e245cf64f96759bfa2ec6aa790d38dbee3b5829258965135,02-06-2025,2025-06-02 02:43:29.000 UTC,265,31021431,0x827922686190790b37229fd06084350E74485b72,15376575,30827682925,35303,1508100
0x9eb86e93a809a41ab0e7cc0ba6f62561fda3015c,0x3a1ea3db40584cd5d81339f2dafccd04d7d2cab8aee2cc1c47d4280063929cd7,03-01-2025,2025-01-03 12:30:01.000 UTC,586,24559027,0x827922686190790b37229fd06084350E74485b72,5018979,2515475114847957153700,100749221805031847761,754362716995486059
0x2791dc5e14f7680d9d969acc26059ba56403b6d5,0x5e793e0a395b7839f3e796095eedef0089ab354872aad54d5b28fe42e58c90cd,26-12-2024,2024-12-26 11:02:29.000 UTC,227,24210801,0x827922686190790b37229fd06084350E74485b72,4636817,6451971019459757243,4161509554330119311,2051038428749017
0xdc98dbffcc648d6088a2ff8f7dc01aef050e58fc,0x450a58f01476616433ca2145d17c04be59f3861a17195b48aafc9941125466ae,29-12-2024,2024-12-29 13:57:19.000 UTC,333,24345646,0x827922686190790b37229fd06084350E74485b72,4770214,2572966234835804846,2492014640048590834,2311649487747653
0xdc98dbffcc648d6088a2ff8f7dc01aef050e58fc,0xfcd82cb81d6b9b89afce89aba91df7fb40d23d0821ccbb29f46e54776c267ae4,12-01-2025,2025-01-12 17:08:03.000 UTC,223,24956168,0x827922686190790b37229fd06084350E74485b72,5453238,7585686009512174091,2627071678883282927,0
0x9eb86e93a809a41ab0e7cc0ba6f62561fda3015c,0x5b176b09988cb0124e5f31021d29b078d05e734be55bc1c034ab46fcda4d2b77,09-01-2025,2025-01-09 05:54:27.000 UTC,368,24806360,0x827922686190790b37229fd06084350E74485b72,5283712,1107086550425874877523,54218507563789382167,292768507892701802
0x38f6d2d9ea493c3c6ee865b5b952b5fe9e3e61fc,0x9040821dd4723298dfcf5e3776281936cc14d8832da9e4a3dce288f559885e4f,04-01-2025,2025-01-04 09:28:03.000 UTC,684,24596768,0x827922686190790b37229fd06084350E74485b72,5059763,2082398954276244046696,487555578905738568791,136102900722654178
0x8810de2baa17067ddcfbd9e8f29c55f070a55f0b,0xf5d7bb63b80c44045f2ef37c89aff1645485af0c1c2b317211852900f266b159,09-05-2025,2025-05-09 10:53:31.000 UTC,531,29999332,0x827922686190790b37229fd06084350E74485b72,13219223,60138437461940319,21683189,32049488086144116399477
0xdc98dbffcc648d6088a2ff8f7dc01aef050e58fc,0xc362a0ef248c87999d2e3f752356b0229f5547733a0a6ce2b19ff7aff76182de,05-06-2025,2025-06-05 06:19:33.000 UTC,777,31157513,0x827922686190790b37229fd06084350E74485b72,15649376,11436122460,118070,453963
0x8fd1b615c006ebeb8a7cfb00a1dd809f31943b08,0x018238eccd3b6ef6a9b56502c9a055383d1da0d9caf81d696ed1f72ec5dfccc7,01-03-2025,2025-03-01 21:54:59.000 UTC,296,27038376,0x827922686190790b37229fd06084350E74485b72,8239466,53564161297053898823868,143789200927118842203,3999166608490296528789
0x38f6d2d9ea493c3c6ee865b5b952b5fe9e3e61fc,0xa8997228e74ede40b00650ac79ced8fccaf7d379f3bb15d92d2007a39671ed6c,07-06-2025,2025-06-07 04:18:17.000 UTC,498,31240275,0x827922686190790b37229fd06084350E74485b72,15818425,24502850217,1196233,27825
0x8508fd4238162cb3f3d485f432202af3b40f164e,0x345c1703bbd2ebe2159ae0da4ef05196128183c5cb43b1116ef925d8281dbbcc,02-04-2025,2025-04-02 12:25:13.000 UTC,515,28403683,0x827922686190790b37229fd06084350E74485b72,10338985,335147626169711,102410940113144849733,24527
0x38f6d2d9ea493c3c6ee865b5b952b5fe9e3e61fc,0xefb988c00b41e529fd7e950437809746c937abb637ffc87af5799f21e156d2d0,07-07-2025,2025-07-07 12:23:13.000 UTC,782,32550823,0x46A15B0b27311cedF172AB29E4f4766fbE7F4364,430395,11903254083,443719,151241
0x8508fd4238162cb3f3d485f432202af3b40f164e,0xd7a93560af14048961c54d516b348e62e5c2b51420ea81a25add0dd145e26351,21-05-2025,2025-05-21 06:44:51.000 UTC,119,30510272,0x827922686190790b37229fd06084350E74485b72,14268502,19823254729645269612,17035845267148321,6754410855254662994
0xdc98dbffcc648d6088a2ff8f7dc01aef050e58fc,0x45bc70812daae4b2c015d699d07772ffb77c2ade8989b9a1d54c99f0fe5f4287,08-01-2025,2025-01-08 19:09:13.000 UTC,471,24787003,0x827922686190790b37229fd06084350E74485b72,5259713,623933748227566123,422908497,43298146662800117605383
0x38f6d2d9ea493c3c6ee865b5b952b5fe9e3e61fc,0xf958b8428f417e3da98aab9317e2d8c65b629d9b052f7eeb2fe0d5f450632953,14-07-2025,2025-07-14 19:25:47.000 UTC,167,32865900,0x46A15B0b27311cedF172AB29E4f4766fbE7F4364,441386,28672505276,875804,557502
0x8fd1b615c006ebeb8a7cfb00a1dd809f31943b08,0x527db9857d4e66fb094b9113ac9c44f7f3037af06641bbcaaeb0d2b820bc4b40,12-01-2025,2025-01-12 18:17:51.000 UTC,510,24958262,0x827922686190790b37229fd06084350E74485b72,5456953,2371361075860247866799,688589724336296623449,787529791225553851
0x0b27b59171a4ffe19f23d54126cd797be17c6551,0x1c987b23ac6eaeb09ade570a2ff7e0cf59dfcc50875d3b7efa3adaf1aeb7f274,20-07-2025,2025-07-20 17:16:17.000 UTC,488,33121215,0x03a520b32C04BF3bEEf7BEb72E919cf822Ed34f1,3570988,3791875850591673016742,100543462143199846,85477493348480846647306
0x9eb86e93a809a41ab0e7cc0ba6f62561fda3015c,0x8950b32b1465f23de3d69df46a360e97a75bd52e92f4b72c758d0f0789c214ab,01-01-2025,2025-01-01 20:07:53.000 UTC,413,24486363,0x827922686190790b37229fd06084350E74485b72,4939861,3208882639892222360427,104671640597960944,1846663849546116175846
0xdc98dbffcc648d6088a2ff8f7dc01aef050e58fc,0x540e45cc5e8c580f2d2ff8b8f33ea3fafc64620027442701b33c8c3a1af09592,02-06-2025,2025-06-02 11:53:55.000 UTC,425,31037944,0x827922686190790b37229fd06084350E74485b72,15409334,12237576270,271668,340250
0x9eb86e93a809a41ab0e7cc0ba6f62561fda3015c,0x3bc2b830c7aabf55b2be2ce049e0f5717ffad7f8d5b1179db7494c911e5bc8cd,25-12-2024,2024-12-25 11:17:37.000 UTC,347,24168055,0x827922686190790b37229fd06084350E74485b72,4592623,805784673421281119489,510349201891855766874,260512500610430518
0x38f6d2d9ea493c3c6ee865b5b952b5fe9e3e61fc,0x1266a7e92d82a30b894837d65d57c5b23ffe562c81ff9b2bc0e52c9264382c39,01-06-2025,2025-06-01 06:46:33.000 UTC,435,30985523,0x46A15B0b27311cedF172AB29E4f4766fbE7F4364,392339,3266064398,123608,39558
0x9eb86e93a809a41ab0e7cc0ba6f62561fda3015c,0xc476ef96ec8efe6000568b42a8ad08800de64ad55c8cb9b2df3d7a53f37c53b5,26-12-2024,2024-12-26 04:29:55.000 UTC,243,24199024,0x827922686190790b37229fd06084350E74485b72,4627330,770852522532594806595,254921725422780902663,460094191254095073
0x095d0de0ecfd6832f1a7961ae26d285d68655d60,0x3efc60bf4db830c64ff89a7e04eb471b7dbd3a6b97f8249fb3c8d6bf6bb2061e,22-01-2025,2025-01-22 04:46:35.000 UTC,528,25365924,0x827922686190790b37229fd06084350E74485b72,5968612,20208451069439905,194983561,4932650960830424451543
0x38f6d2d9ea493c3c6ee865b5b952b5fe9e3e61fc,0x5036fd82df23f1c6e4652adf9927c840ba472eeaf23d30e8bb73ad1e86562b5f,09-12-2024,2024-12-09 03:24:41.000 UTC,260,23462667,0x827922686190790b37229fd06084350E74485b72,3698377,632308000630532717,1704836856,43757428613731452898651
0x19d36b9ee92a53ec1900447eba958f0030c688be,0x4f977b7fbdfa9dc866204ceb5aa3cf416a05df169f21ac24e3a29f54d89f668c,10-06-2025,2025-06-10 09:35:39.000 UTC,772,31379396,0x03a520b32C04BF3bEEf7BEb72E919cf822Ed34f1,3221038,28878398920100180780974,353617696462832237,642807403530763251492072
0x8fd1b615c006ebeb8a7cfb00a1dd809f31943b08,0x1726bd181359ef66c19c9afd9bef4c53bee449f0536e73defe1bd10bf9688507,21-02-2025,2025-02-21 19:18:03.000 UTC,527,26688068,0x827922686190790b37229fd06084350E74485b72,7751518,65088938617951054052672,107177240273252761536,8189212996296482226176
0x8810de2baa17067ddcfbd9e8f29c55f070a55f0b,0xebfee8f89264817c16e832255dbdf3afc1c079b6f5b3ea8d6766403807494c1e,27-03-2025,2025-03-27 15:56:25.000 UTC,383,28150819,0x03a520b32C04BF3bEEf7BEb72E919cf822Ed34f1,2673655,247616514633483420666,4172818025924550,6149904114035832840393
0xdc98dbffcc648d6088a2ff8f7dc01aef050e58fc,0x3826fb9cb670ec69cd04e76bfed58f072da01113ee18b7732c5435e5ddb8bca0,31-05-2025,2025-05-31 12:02:41.000 UTC,554,30951807,0x827922686190790b37229fd06084350E74485b72,15235450,6062682961,184715,118306
0x2791dc5e14f7680d9d969acc26059ba56403b6d5,0xa23d6e4f899d9abb99f0ea22fed607cc5a0f14ecea03f0ccc884037b3e8cfde3,10-01-2025,2025-01-10 09:42:11.000 UTC,1271,24856392,0x827922686190790b37229fd06084350E74485b72,5347745,2373772036030977210138,451793497356976918441,292104508457634715
0x2791dc5e14f7680d9d969acc26059ba56403b6d5,0x9fcc4253963f95f83bf164c2a84b435160594bb97d140636ebed57e17e225df7,08-01-2025,2025-01-08 18:17:35.000 UTC,453,24785454,0x827922686190790b37229fd06084350E74485b72,5257821,20866582873129090174746,354550002578634118,29288917983379749156093
0x2791dc5e14f7680d9d969acc26059ba56403b6d5,0x4365798ba4d662bd899fc511784135e295daefa0b967f816393168bbffac8f46,19-12-2024,2024-12-19 06:12:09.000 UTC,262,23899691,0x827922686190790b37229fd06084350E74485b72,4248345,4192144988455442464,331116005720348975,3081622207679836
0xdc98dbffcc648d6088a2ff8f7dc01aef050e58fc,0xe0e683704617b53b721231d02976a5363d5b51692d42173232a9d4ecae859ad4,02-01-2025,2025-01-02 01:53:41.000 UTC,563,24496737,0x827922686190790b37229fd06084350E74485b72,4953076,1154358616216090992347140,314905666738925337384,47129137880385331983202
0x0b27b59171a4ffe19f23d54126cd797be17c6551,0xf358de0e275810552b2e60800a3df86efdeccf2503fa472ed4cd8b7cb229394e,29-05-2025,2025-05-29 01:02:15.000 UTC,368,30845594,0x03a520b32C04BF3bEEf7BEb72E919cf822Ed34f1,3116818,12838825186615236914045,556756639311963571,174429567666796683234225
0x8810de2baa17067ddcfbd9e8f29c55f070a55f0b,0xd018c5be20a561bd1a4243d1a2aee90c6fc30b4aedc432d0ed80243255c7fa98,01-08-2025,2025-08-01 10:33:09.000 UTC,230,33627521,0x03a520b32C04BF3bEEf7BEb72E919cf822Ed34f1,3655980,1316914935874536509166,39817750979532757,26041859976236447081919
0x0b27b59171a4ffe19f23d54126cd797be17c6551,0x385d90ec1653058742e89e0827f159d2f65b81b1d1100d9d8b707a824daf8957,25-06-2025,2025-06-25 02:21:53.000 UTC,476,32014383,0x03a520b32C04BF3bEEf7BEb72E919cf822Ed34f1,3402056,10469182727576468219856,324327260398188793,205736120202054946820699
0x8fd1b615c006ebeb8a7cfb00a1dd809f31943b08,0x683d71d99d4519c26212e9c44ed991851c22c2adc1b45f653964ad3a1fb35693,25-12-2024,2024-12-25 06:50:51.000 UTC,354,24160052,0x827922686190790b37229fd06084350E74485b72,4559853,6628896262895678211,3649989973567257674,8383717313638557
0xdc98dbffcc648d6088a2ff8f7dc01aef050e58fc,0x977de8596063c981f5c5df593198d837d0af1153ee653f78601f34b167fbdc68,14-01-2025,2025-01-14 21:13:01.000 UTC,212,25049917,0x827922686190790b37229fd06084350E74485b72,5567996,223543905221735715675,153542863888260482722,127004929718122263
0x38f6d2d9ea493c3c6ee865b5b952b5fe9e3e61fc,0x81b847a9ab688878f21418e1cdfb7cc3221285af6224738c83e61e4ab5787e9a,09-01-2025,2025-01-09 07:32:15.000 UTC,519,24809294,0x827922686190790b37229fd06084350E74485b72,5287376,1230380042867924619391128,1110911203817451668637,31953407627976157167616
0xdc98dbffcc648d6088a2ff8f7dc01aef050e58fc,0x5e07c0a0bb68224d310e7f6e46574863e24ea1c08b0d8201f47babf9d02a7646,05-07-2025,2025-07-05 08:15:39.000 UTC,594,32456996,0x46A15B0b27311cedF172AB29E4f4766fbE7F4364,428503,10602138367790547788926,404208271685377790,110812308962977389
0x9eb86e93a809a41ab0e7cc0ba6f62561fda3015c,0x58ec510b437d00fc493c834e7fd5ffc9ea3efbedfd8269789c97ad01afa25c1d,27-02-2025,2025-02-27 19:11:53.000 UTC,281,26947083,0x827922686190790b37229fd06084350E74485b72,8119876,3574985412,374703677,170195
0x095d0de0ecfd6832f1a7961ae26d285d68655d60,0xd251bc5b688c0496d9d8a5ef6d1301cef22d685d1965b8e3ee74ab89e82123a0,15-05-2025,2025-05-15 12:57:05.000 UTC,533,30262239,0x03a520b32C04BF3bEEf7BEb72E919cf822Ed34f1,3032541,6109299697722427278481,80852732034357988,223289435934932328119396
0xdc98dbffcc648d6088a2ff8f7dc01aef050e58fc,0x603289e2a1f29887ee9373db1da8fa268a485d1f0633aba649a53170546152d5,14-12-2024,2024-12-14 10:26:55.000 UTC,317,23691334,0x827922686190790b37229fd06084350E74485b72,3996371,376101529263657428590,382359902419828643047,318308427624441156
0x9eb86e93a809a41ab0e7cc0ba6f62561fda3015c,0xaec19419c279ecddd7e57af313a110d2ea1a123a4f799e2f001d4e1594bd33a6,06-06-2025,2025-06-06 03:53:43.000 UTC,359,31196338,0x827922686190790b37229fd06084350E74485b72,15728707,24123028817,810536,395283
0x2791dc5e14f7680d9d969acc26059ba56403b6d5,0xa300b0ce2e23780e3a7200d590f6c73eea2cd800888c1a32d03894311942d454,30-12-2024,2024-12-30 19:54:23.000 UTC,401,24399558,0x827922686190790b37229fd06084350E74485b72,4844950,1329714561933761771431,709635978648566708374,539115391269449391
0x38f6d2d9ea493c3c6ee865b5b952b5fe9e3e61fc,0xb8a608fef87c98f220b99ba2cdfffde2527b42b9e495d06a5cd90ddcb2ba4799,01-07-2025,2025-07-01 08:04:55.000 UTC,472,32283874,0x46A15B0b27311cedF172AB29E4f4766fbE7F4364,422854,12119698020,595894,9753
0x2791dc5e14f7680d9d969acc26059ba56403b6d5,0x2fd4f2094a2e16112fcd4b8b8777e444dd7b07f72d2b9f96b41bb91a3bed3797,13-01-2025,2025-01-13 22:51:07.000 UTC,374,25009660,0x827922686190790b37229fd06084350E74485b72,5517516,1531795062261382055638,394725678215152048095,112346183097069577
0x8fd1b615c006ebeb8a7cfb00a1dd809f31943b08,0xdbf056f9296878546169f5928cb378a4112ca8a50eb829e2bd3495a3c1528901,12-12-2024,2024-12-12 12:29:13.000 UTC,467,23608603,0x827922686190790b37229fd06084350E74485b72,3872787,8754723357652061715,6525529150460084062,689793427706943
0x38f6d2d9ea493c3c6ee865b5b952b5fe9e3e61fc,0xb90b1f45a9a5b5e0d910a61a78c22b88371653deabc2b0c7ed37aa1ed8a4a2dc,02-01-2025,2025-01-02 08:48:59.000 UTC,307,24509196,0x827922686190790b37229fd06084350E74485b72,4966977,2029751429886370114,3972236245,17381144476853657363006
0x2791dc5e14f7680d9d969acc26059ba56403b6d5,0x3df6d2422c022ac7026c0bc5847b69e01d6bf35875a5def5fc26032cf7dfa919,11-01-2025,2025-01-11 00:47:25.000 UTC,314,24883549,0x827922686190790b37229fd06084350E74485b72,5379119,1918179124350185926885,207786361147064850267,391447823748495389
0x9eb86e93a809a41ab0e7cc0ba6f62561fda3015c,0x2ab4747d4f462fc4025d1dce6f2f464afa958ccb31d3d39a40878bd4cdc72ce7,07-01-2025,2025-01-07 02:42:39.000 UTC,163,24714206,0x827922686190790b37229fd06084350E74485b72,5176600,286181752652598447425,27443742660480352,282842891344732975287
0x38f6d2d9ea493c3c6ee865b5b952b5fe9e3e61fc,0xbc0924851a14cba4eb93cff4db3bf80ffdae6a7459a3216a6a1ae188a89d99ca,08-01-2025,2025-01-08 10:45:29.000 UTC,310,24771891,0x827922686190790b37229fd06084350E74485b72,5240541,1557858063926103586141,239925726714278651470,251591274922383711
0xdc98dbffcc648d6088a2ff8f7dc01aef050e58fc,0x6592755ac91b759bda2ba9b50c5ed6c9b6689587b8163031d31cc3e1f82f57f4,08-01-2025,2025-01-08 17:34:29.000 UTC,307,24784161,0x827922686190790b37229fd06084350E74485b72,5256296,630177169190967291,451314482,44055316922202122466016
0x8810de2baa17067ddcfbd9e8f29c55f070a55f0b,0xacab801ed58809eb7d96d5000a0d6eb77e4f6542d7baf17f1d4265ee8497ef93,05-06-2025,2025-06-05 06:44:41.000 UTC,1180,31158267,0x827922686190790b37229fd06084350E74485b72,15650698,84341614952115086,105150734,37580763288910410868262
0x2791dc5e14f7680d9d969acc26059ba56403b6d5,0x8f6520c779bd95a2597c561226bb0750d664e434ec63ae702b2a966927f89117,27-12-2024,2024-12-27 02:49:39.000 UTC,507,24239216,0x827922686190790b37229fd06084350E74485b72,4666404,6737921407343036233,6682463683449201943,38312838365616
0x8508fd4238162cb3f3d485f432202af3b40f164e,0x5d59e2facebd982d1b79abe4dd328658f8b15674ee49ac0440496dc3b71a890d,01-06-2025,2025-06-01 10:37:09.000 UTC,532,30992441,0x827922686190790b37229fd06084350E74485b72,15315264,14545134863,691769,34513
0x351f61e4c49cf11f24d9f2e737ca5eff81806355,0x283a271d020cc0fa9ed50772412a6e71c2eadb47c0309eb26ccd52ab7ea67483,25-08-2025,2025-08-25 11:29:23.000 UTC,562,34666008,0x827922686190790b37229fd06084350E74485b72,23523288,599838394260097754,241158320,228948226052149538971160
0x2791dc5e14f7680d9d969acc26059ba56403b6d5,0x5cf50789e7eaf81642cf58f434f87f8ba7aeb068abf6e71f58af80e61a67f9a0,28-12-2024,2024-12-28 03:35:01.000 UTC,368,24283777,0x827922686190790b37229fd06084350E74485b72,4720605,3939857128798953441,1771890262286088671,1940262544623661
0x9eb86e93a809a41ab0e7cc0ba6f62561fda3015c,0xfc9ffa4a7019ceeb19479bb2930889f2c7b8a04e8b872bd4d3ce4e2c8e98dcbc,02-01-2025,2025-01-02 06:38:15.000 UTC,529,24505274,0x827922686190790b37229fd06084350E74485b72,4963068,1291783450475979204445,85204173518701307,1414648497738599703503
0x095d0de0ecfd6832f1a7961ae26d285d68655d60,0xc3413e9f95ae091dd3c9ebee779616eb1c5bd54b87999cce531873cad7bba865,25-02-2025,2025-02-25 15:28:19.000 UTC,377,26853976,0x827922686190790b37229fd06084350E74485b72,7985027,73977534558020802,143325641,44394055663821406638572
0x8fd1b615c006ebeb8a7cfb00a1dd809f31943b08,0xa80d44c1b538fb162be8493cc6eeeb2fe3a051b8bc107020f8421fb9602d110c,28-12-2024,2024-12-28 22:50:17.000 UTC,260,24318435,0x827922686190790b37229fd06084350E74485b72,4740824,4203540724140002769,2667490865857419311,5186588142142661
0x9eb86e93a809a41ab0e7cc0ba6f62561fda3015c,0x44b45b14f9e37f08fdf420b4b053d8640f9a5bf2c49690d4bcf5a634139b934c,03-01-2025,2025-01-03 08:42:31.000 UTC,333,24552202,0x827922686190790b37229fd06084350E74485b72,5013274,2567500357195893795464,131076330913005347378,729566860902267965
0x9eb86e93a809a41ab0e7cc0ba6f62561fda3015c,0xee0b321dcaacf8d069db7c58f39c0b4087f0fdbfe7d5fdb30531ee168424d3ab,26-02-2025,2025-02-26 04:57:47.000 UTC,516,26878260,0x827922686190790b37229fd06084350E74485b72,8022951,3993751625,513061779,90859
0x2791dc5e14f7680d9d969acc26059ba56403b6d5,0x12bfa8daac33933163baba916e81fbad342479e1a4fe7bcb00a94a9b2d14b95a,03-01-2025,2025-01-03 12:29:25.000 UTC,512,24559009,0x827922686190790b37229fd06084350E74485b72,5018961,2882002517892055828735,107115886285130879924,874488983308516569
0xdc98dbffcc648d6088a2ff8f7dc01aef050e58fc,0xa4c7400e08ce155d1c61e0cc61e1a739286b8ef17029d7ae6e54e7c55fb528b4,24-04-2025,2025-04-24 18:14:15.000 UTC,664,29364554,0x827922686190790b37229fd06084350E74485b72,11921537,5630301864388857,18179442,679648150211451314924
0x8810de2baa17067ddcfbd9e8f29c55f070a55f0b,0x69177fe8365030762a7abc53c6eb08c04621e9a206ff4314b71fbbc626686198,27-05-2025,2025-05-27 17:46:29.000 UTC,1418,30789321,0x03a520b32C04BF3bEEf7BEb72E919cf822Ed34f1,3108107,24605248574017450,1057398669,499583161178983054510
0xdc98dbffcc648d6088a2ff8f7dc01aef050e58fc,0xe2a94a1a11437ca6a226490715d01c6de7c4ca47274f9fbfcf4cc2d65ca9bc3c,10-01-2025,2025-01-10 11:54:55.000 UTC,459,24860374,0x827922686190790b37229fd06084350E74485b72,5352205,1549657647127124719850,60539826604634001324,428600606485906621
0x38f6d2d9ea493c3c6ee865b5b952b5fe9e3e61fc,0x041487428c834bbdbf75ec3bbb3edcca93b890d088682a08393ed1a7169808e1,09-01-2025,2025-01-09 23:32:53.000 UTC,1229,24838113,0x827922686190790b37229fd06084350E74485b72,5313424,5874314059640750546,1776599449393385134,98256571434565
0x38f6d2d9ea493c3c6ee865b5b952b5fe9e3e61fc,0x5f1de55a38cf633ba4a908823b01943f83b12a382c77bdf4956a00a6b581f743,06-01-2025,2025-01-06 12:08:33.000 UTC,391,24687983,0x827922686190790b37229fd06084350E74485b72,5145735,1884670308968309661147,117851516442793517739,498531891806979760
0x2791dc5e14f7680d9d969acc26059ba56403b6d5,0x8c72454b053255c31699e05f98d8241224eb3ef6340f2baa94f87962a6bbea3f,07-01-2025,2025-01-07 11:16:01.000 UTC,391,24729607,0x827922686190790b37229fd06084350E74485b72,5188286,1340467359817969770,3076596232,4241870396274538136904
0xdc98dbffcc648d6088a2ff8f7dc01aef050e58fc,0xe6a1e3326c463e4f6fd18fa2353ac410a049386e123150be65a1028cb606811f,13-01-2025,2025-01-13 00:47:55.000 UTC,411,24969964,0x827922686190790b37229fd06084350E74485b72,5468211,19530806098711324796519,383383839703433933,24553795068082960068831
0x38f6d2d9ea493c3c6ee865b5b952b5fe9e3e61fc,0x440662800bd9e211fee7f01a6638810643b8bd7a06f6d5215eea65df7cdb84f3,02-01-2025,2025-01-02 00:42:25.000 UTC,437,24494599,0x827922686190790b37229fd06084350E74485b72,4949407,505608187492127790,1154423411,40935956655887689120523
0x8508fd4238162cb3f3d485f432202af3b40f164e,0x6a409a58156515d680d4136275ad6e99c15dfb30fa435c28d5777f557da341e7,18-03-2025,2025-03-18 15:03:07.000 UTC,417,27760420,0x827922686190790b37229fd06084350E74485b72,9315243,181779628623731830645711,919721673072114800667,42350557593024984508120
0x8508fd4238162cb3f3d485f432202af3b40f164e,0x42827d4f750bb9ca7a506baec3da76f4b51c15ecdb34e0cf71fb10e980a8a688,03-04-2025,2025-04-03 15:22:53.000 UTC,493,28452213,0x827922686190790b37229fd06084350E74485b72,10433297,305727915242740,48768428267735363478,43262
0x0b27b59171a4ffe19f23d54126cd797be17c6551,0x526d6fb3292a0221f87fcac03baa7237bc9a01e87381309efccfb7e9155593c6,21-09-2025,2025-09-21 20:39:01.000 UTC,506,35848897,0x03a520b32C04BF3bEEf7BEb72E919cf822Ed34f1,3936646,3771987237273857810270,105000070810609681,82409307916846887844590
0x8fd1b615c006ebeb8a7cfb00a1dd809f31943b08,0x4e6a68d9cc69e5b3a2859e6c390e655e788639f2464d73fa02fe4f7e9ac31043,14-02-2025,2025-02-14 18:43:15.000 UTC,1538,26384624,0x827922686190790b37229fd06084350E74485b72,7327577,707192831428433837,2945216989,248795018402406751329280
0x0b27b59171a4ffe19f23d54126cd797be17c6551,0x5ebb60694867189b7a4ef9501785361807d1a8d33c420b62c5745943021a63de,11-10-2025,2025-10-11 19:22:09.000 UTC,178,36710591,0x03a520b32C04BF3bEEf7BEb72E919cf822Ed34f1,4041721,2500231479711493979097,76306169633973136,48857033791792541053920
0x2791dc5e14f7680d9d969acc26059ba56403b6d5,0x0172e22f16789667e847cf2b5d1b02bbecf448d05df6f9c4f9fa825a2300ff24,21-12-2024,2024-12-21 22:11:15.000 UTC,426,24014864,0x827922686190790b37229fd06084350E74485b72,4402916,5738944617564023677,5062698741424331150,858596852445212
0x2791dc5e14f7680d9d969acc26059ba56403b6d5,0x98baea6d0572263edb898b58b4a68665e1d32f1dcbc8bfacbadde9b7cd4ab202,01-01-2025,2025-01-01 18:47:53.000 UTC,1952,24483963,0x827922686190790b37229fd06084350E74485b72,4936918,1271780294779495263839,611960474388381598930,576265788420523099
0x9eb86e93a809a41ab0e7cc0ba6f62561fda3015c,0xb031aea1384af566e8ca4518945e06db56b55a54b56e0a24512eb2424998f867,04-01-2025,2025-01-04 17:46:31.000 UTC,265,24611722,0x827922686190790b37229fd06084350E74485b72,5076099,2106432715458143836176,87934651169888027347,616988677817443465
0xdc98dbffcc648d6088a2ff8f7dc01aef050e58fc,0x30e21963b5646e0a5063547af032d53eb5cc54724cae623dfd722c882a43126d,23-05-2025,2025-05-23 10:51:11.000 UTC,712,30604062,0x46A15B0b27311cedF172AB29E4f4766fbE7F4364,385878,12925309977102242896696,168168445857111495,492742297575976704
0x2791dc5e14f7680d9d969acc26059ba56403b6d5,0xe0fe46b213b2febe0487f0ce9e58c2fd4693194d02fd9ca7d88689e7e2465e35,19-12-2024,2024-12-19 03:04:43.000 UTC,366,23894068,0x827922686190790b37229fd06084350E74485b72,4243124,8163076365751527264,3829915325385450330,3726009146496073
0xdc98dbffcc648d6088a2ff8f7dc01aef050e58fc,0xc925e406246c15cdf687f9492202d21ebd18bc67d73dc4a147a899036db2c5f2,03-06-2025,2025-06-03 00:47:47.000 UTC,703,31061160,0x827922686190790b37229fd06084350E74485b72,15462523,12011495545,53044,548080
0x2791dc5e14f7680d9d969acc26059ba56403b6d5,0x3f016cf7fbd1c50c42f67aa09f57d84c3f7654d05f0bce7b1b97481f39d5f09d,24-12-2024,2024-12-24 01:07:49.000 UTC,489,24106561,0x827922686190790b37229fd06084350E74485b72,4525977,1470396280908475502108,943410416142695021724,464525937383680081
0x2791dc5e14f7680d9d969acc26059ba56403b6d5,0xfc9e091eb6d2d799c3224696f7347e9c9b1542969a2b34fa0366b6e3c0aedcaa,14-01-2025,2025-01-14 16:19:59.000 UTC,397,25041126,0x827922686190790b37229fd06084350E74485b72,5555664,1308830261282813447137,210979119924102560832,201493184222452636
0x9eb86e93a809a41ab0e7cc0ba6f62561fda3015c,0x91f502b97b0c76b1111b6275d608e3e348c02af20755390e66aa5931fbe6d529,28-02-2025,2025-02-28 18:27:45.000 UTC,199,26988959,0x827922686190790b37229fd06084350E74485b72,8172845,3234138390,403261169,75744
0x8810de2baa17067ddcfbd9e8f29c55f070a55f0b,0x8d041b6a61f5c898707dffc1c55c73102fdb0b1d5b437f24f8533cc3c972de6b,14-05-2025,2025-05-14 03:55:13.000 UTC,67,30202783,0x827922686190790b37229fd06084350E74485b72,13629451,340705946926115425,177909901,156631733744974490508439
0xdc98dbffcc648d6088a2ff8f7dc01aef050e58fc,0xeebf347403c7545357f1afa9c09c343339f761fa30e50498d70d0c4bff442cfc,22-05-2025,2025-05-22 17:57:57.000 UTC,1350,30573665,0x827922686190790b37229fd06084350E74485b72,14438337,14302353263179822,1127442944,7291975753835074548
0x095d0de0ecfd6832f1a7961ae26d285d68655d60,0x26ca3b05ff2f622e27915fc034b54a399e3cb357733ffc39d9ead3a161cb3bad,25-02-2025,2025-02-25 17:35:33.000 UTC,445,26857793,0x03a520b32C04BF3bEEf7BEb72E919cf822Ed34f1,2160491,13190580289815572610552,301231088240940117,321740626724015228149141
0x9eb86e93a809a41ab0e7cc0ba6f62561fda3015c,0xba551955eab691c2ff33b4f5ebd711e185868d991f73db4d6ed049e3621c7243,18-12-2024,2024-12-18 03:11:09.000 UTC,454,23851061,0x827922686190790b37229fd06084350E74485b72,4187085,1387110080661023184111,605368563838612430277,671145935358601235
0x9eb86e93a809a41ab0e7cc0ba6f62561fda3015c,0x367587b09637f2db2cc8c9e133e03f4500fc0fdf6ec06bb63be9b46171b9008a,02-01-2025,2025-01-02 08:03:39.000 UTC,363,24507836,0x827922686190790b37229fd06084350E74485b72,4965293,2314331217915991741103,165070445697776030,2484999102664156281650
0x2791dc5e14f7680d9d969acc26059ba56403b6d5,0x7b202e1338a592deea39bbbb76717cdfba6c22f201497810ae44f68628089ee5,07-01-2025,2025-01-07 11:07:41.000 UTC,322,24729357,0x827922686190790b37229fd06084350E74485b72,5188096,2303043699629066974171,238864761921834109702,492463430965529233
0xdc98dbffcc648d6088a2ff8f7dc01aef050e58fc,0x903e0016e027aa67ff9a10d6b85764ccce2180341bae9c2b42f5a2679c7436b9,13-01-2025,2025-01-13 02:16:33.000 UTC,541,24972623,0x827922686190790b37229fd06084350E74485b72,5471827,1159096405576875496829,96632773940846356930,251759488879845773
0x0b27b59171a4ffe19f23d54126cd797be17c6551,0x7b1e159c9dce78e2578a0d6e87bfe6bac5f7725708535ede591baf2ab13d3783,27-07-2025,2025-07-27 06:49:07.000 UTC,574,33404800,0x03a520b32C04BF3bEEf7BEb72E919cf822Ed34f1,3615737,2156747188298838844140,84205862456947616,33608191177411535151470
0x38f6d2d9ea493c3c6ee865b5b952b5fe9e3e61fc,0xc45486ea95a74c15e1f6814387197cf7a2405664833ebf7adc78e105c6b8858e,06-01-2025,2025-01-06 06:17:07.000 UTC,934,24677440,0x827922686190790b37229fd06084350E74485b72,5135955,1923036421432260633950,16183397165607309967,626687192530503575
0x095d0de0ecfd6832f1a7961ae26d285d68655d60,0xec40829ae4022b89bb320322387f23c5f547ccb98a762da8fc3f1eac9eb77d13,13-05-2025,2025-05-13 21:58:53.000 UTC,513,30192093,0x03a520b32C04BF3bEEf7BEb72E919cf822Ed34f1,3023231,168262113818386092695,313759964409852907,470422801344562092237
0x9eb86e93a809a41ab0e7cc0ba6f62561fda3015c,0xe681d36bb17c85f0833347227fcba9b48c585204efd29963af1651701a5a321f,10-01-2025,2025-01-10 03:43:07.000 UTC,451,24845620,0x827922686190790b37229fd06084350E74485b72,5334390,942727046551037139651,71074053762782470870,224789328401150567
0xdc98dbffcc648d6088a2ff8f7dc01aef050e58fc,0x0e9dbf3ad9308242b791c762888ed08f36775e3b725241256c8b77dbae463eb8,03-01-2025,2025-01-03 22:48:31.000 UTC,269,24577582,0x827922686190790b37229fd06084350E74485b72,5044107,2558999735362769617815,197235850653523313910,647133338676094981
0x38f6d2d9ea493c3c6ee865b5b952b5fe9e3e61fc,0xd1db0ae0d710e88921351bc078332010d50fe944329285f2ad089bd49137a2b8,06-01-2025,2025-01-06 15:21:59.000 UTC,851,24693786,0x827922686190790b37229fd06084350E74485b72,5152349,18230697225822531153993,553271210489519744,12460555817447530800798
0x8508fd4238162cb3f3d485f432202af3b40f164e,0xd286dea491e700c3031d9f6cb33ed1f2e8c286394fd73e717ab82c93222e9084,22-05-2025,2025-05-22 16:38:03.000 UTC,584,30571268,0x827922686190790b37229fd06084350E74485b72,14432151,18165842057,627173,280761
0x2791dc5e14f7680d9d969acc26059ba56403b6d5,0x812b2974c991e154633d3d80087957a0defe4e0dd012f0103a2fc1ec7d269a75,15-12-2024,2024-12-15 01:54:47.000 UTC,276,23719170,0x827922686190790b37229fd06084350E74485b72,4023750,7865915704558170601,2039116305892800519,2653346695521112
0x0b27b59171a4ffe19f23d54126cd797be17c6551,0x8e81fd69e6f8879ec2327715d691f54c33c6180a67554c5a56e88ff353faa719,08-07-2025,2025-07-08 22:31:13.000 UTC,412,32612263,0x03a520b32C04BF3bEEf7BEb72E919cf822Ed34f1,3494736,6512733252549466294423,153956751938190696,165610117045202093881319
0x38f6d2d9ea493c3c6ee865b5b952b5fe9e3e61fc,0xbfd7e41df1cd6ada2c2fec7316e549d3bf90b2ec2e0312f5bc04a0a386dbb526,07-01-2025,2025-01-07 01:14:19.000 UTC,482,24711556,0x827922686190790b37229fd06084350E74485b72,5174670,1669168057230457336,3831465368,5824234239100169107773
0x38f6d2d9ea493c3c6ee865b5b952b5fe9e3e61fc,0xfaec13daed2a89fd9fcc0eae4f024d8972cbf0241512a622007e52adab2016c9,06-01-2025,2025-01-06 11:54:39.000 UTC,355,24687566,0x827922686190790b37229fd06084350E74485b72,5142949,10425136607307155966,2992487845275622084,95666270555040
0x19d36b9ee92a53ec1900447eba958f0030c688be,0xce9cd0e97409d0ee41d1a9ebc95c621f557ad4f60a3ea48cb9da62beefe82e5e,01-06-2025,2025-06-01 04:14:17.000 UTC,73,30980955,0x827922686190790b37229fd06084350E74485b72,15294027,251214857009766288,243497825,927740569679964353378282
0x38f6d2d9ea493c3c6ee865b5b952b5fe9e3e61fc,0xfc36a097e0b53d7d234e21f7b7db46a8376382d783daeb7c0db8b3d2f0ddbe97,05-06-2025,2025-06-05 10:51:21.000 UTC,635,31165667,0x46A15B0b27311cedF172AB29E4f4766fbE7F4364,396811,5547766724,223204,54038
0x2791dc5e14f7680d9d969acc26059ba56403b6d5,0x362dfca25a933fb0abfdac4cceb1dafbb4a6a3247faa97c4cd75c73d081eba05,20-12-2024,2024-12-20 05:37:03.000 UTC,534,23941838,0x827922686190790b37229fd06084350E74485b72,4309963,1684147784558205830750,882700530670786113332,704061180508538786
0xdc98dbffcc648d6088a2ff8f7dc01aef050e58fc,0x7e65e6b18fdbf2b6fa22b96e9ee10e854ff2f60045d8cf0e73f31a434ecf5fa6,13-01-2025,2025-01-13 17:51:31.000 UTC,291,25000672,0x827922686190790b37229fd06084350E74485b72,5507430,476763152865625431079132,133588369600469127304,17796593788306410046096
0x8508fd4238162cb3f3d485f432202af3b40f164e,0xabf6d7ed6b23656d82c24818fddddb490aea8890bdb0bdf2c41c6d96f07a8fad,12-06-2025,2025-06-12 04:07:59.000 UTC,563,31455966,0x03a520b32C04BF3bEEf7BEb72E919cf822Ed34f1,3239651,96443159242279152799,39406343489100448,90528682298924733093
0x8508fd4238162cb3f3d485f432202af3b40f164e,0x81bac361042c03ebd4ff0d6204dc6d245f1466593ea4cea6876e2f7f7c849e76,07-04-2025,2025-04-07 18:00:47.000 UTC,480,28629750,0x827922686190790b37229fd06084350E74485b72,10691076,226941450008951,95300605808508350056,6785
0x2791dc5e14f7680d9d969acc26059ba56403b6d5,0x95b2449037b6053128cc1c182ece4f5f8f9b373291158f9f4db56390c547db64,19-12-2024,2024-12-19 00:26:51.000 UTC,405,23889332,0x827922686190790b37229fd06084350E74485b72,4234097,8870119244114618314,3082801044828441490,4830322481213180
0xdc98dbffcc648d6088a2ff8f7dc01aef050e58fc,0x99963ef7df508175e58470e39fd07dd337fd8fc864bbc12625bc3d0704f020ae,08-01-2025,2025-01-08 21:14:59.000 UTC,395,24790776,0x827922686190790b37229fd06084350E74485b72,5264934,1973971017417022892685,151031763006841593803,481322782806896057
0x9eb86e93a809a41ab0e7cc0ba6f62561fda3015c,0x58bda8052d234d2cc84c6ed282fa9f0f10b6e0e10168fc03a71a77e74ab4685b,04-06-2025,2025-06-04 18:17:23.000 UTC,1102,31135848,0x827922686190790b37229fd06084350E74485b72,15606961,25432223357,1041504,229201
0x38f6d2d9ea493c3c6ee865b5b952b5fe9e3e61fc,0x4fa32ade34539125a5cad85b4b4eb682738a4cfe8ffd1b2e9e2454081b2fafe0,08-01-2025,2025-01-08 00:28:29.000 UTC,465,24753381,0x827922686190790b37229fd06084350E74485b72,5217256,1581174940278550402,203633606,61819397071311029458370
0x2791dc5e14f7680d9d969acc26059ba56403b6d5,0x8a3e88580f8e2e466e4440060510526653cba30ac5964733492a48ec381e413e,06-02-2025,2025-02-06 01:47:35.000 UTC,617,26008554,0x827922686190790b37229fd06084350E74485b72,6772558,306593803675115105,1501429551,73939913811070836422140
0x8810de2baa17067ddcfbd9e8f29c55f070a55f0b,0x7668cbf7f28bcf5c4c649acc2fc6eabd5ac1768f246111324e26472b994af215,11-05-2025,2025-05-11 05:53:53.000 UTC,117,30076743,0x03a520b32C04BF3bEEf7BEb72E919cf822Ed34f1,2997439,1642659947031304253536,11411673647799449,48706042737659515257866
0x8508fd4238162cb3f3d485f432202af3b40f164e,0xf5138068cd2bc5b7f61c7dc4bb2edec598514e183d3802fa113332c5184e5773,11-07-2025,2025-07-11 02:28:29.000 UTC,392,32705781,0x827922686190790b37229fd06084350E74485b72,18929506,162788103299902666686,64478734457318071,156959637087726940788
0x9eb86e93a809a41ab0e7cc0ba6f62561fda3015c,0x6deb4e2170ab0ec6f15d5c33886345a4b22a63a1b9785527eeb5e3ac00db6a66,05-06-2025,2025-06-05 07:04:31.000 UTC,440,31158862,0x827922686190790b37229fd06084350E74485b72,15651940,25386579270,359503,910121
0x095d0de0ecfd6832f1a7961ae26d285d68655d60,0x16c55f7537362fb8606b34da9d642699b635e3ad3357698c5c8c79fd992dd0fe,14-05-2025,2025-05-14 08:33:25.000 UTC,1435,30211129,0x03a520b32C04BF3bEEf7BEb72E919cf822Ed34f1,3025943,7517161291835909195295,2568908813561066,270445282608855840725316
0x8fd1b615c006ebeb8a7cfb00a1dd809f31943b08,0xa23587f1e8252837472a87481ad2589ae915d095ee77d4a8db929e85d9dfe8be,07-12-2024,2024-12-07 18:18:13.000 UTC,239,23403073,0x827922686190790b37229fd06084350E74485b72,3635474,487164609480246371,3040162383,481210619675529801288706
0x38f6d2d9ea493c3c6ee865b5b952b5fe9e3e61fc,0xe3b3622769a1b7a975058caa402b1334ea7a7ad573d52b7d4792e3d1b6f03660,09-01-2025,2025-01-09 05:33:47.000 UTC,312,24805740,0x827922686190790b37229fd06084350E74485b72,5282948,14999145456553751646848,307075639351263690,18023141295046596800908
0x8508fd4238162cb3f3d485f432202af3b40f164e,0xdff4e86a212d447b60d58698a3093c01a994915bd557ec0ac259e8a622515673,01-06-2025,2025-06-01 04:46:51.000 UTC,548,30981932,0x827922686190790b37229fd06084350E74485b72,15295752,14565574383,235394,493195
0xdc98dbffcc648d6088a2ff8f7dc01aef050e58fc,0x598604d51de4ef3b60a02f324b9423282a72c2e9308c873370f9c42926d4d430,30-05-2025,2025-05-30 21:28:59.000 UTC,660,30925596,0x827922686190790b37229fd06084350E74485b72,15177894,6096950831,248876,55689
0x9eb86e93a809a41ab0e7cc0ba6f62561fda3015c,0x1021b4abe0b6cc40814ad8c76d884f57d84a5f54a91389184231fb4649b95ecc,14-05-2025,2025-05-14 02:34:41.000 UTC,115,30200367,0x827922686190790b37229fd06084350E74485b72,13624543,10281080719,355802,158028
0x2791dc5e14f7680d9d969acc26059ba56403b6d5,0xb5d7b99c65224302cfab2830fc2a3b00b8f797eacfb18cd95af075149b5cc1ec,13-01-2025,2025-01-13 02:42:57.000 UTC,321,24973415,0x827922686190790b37229fd06084350E74485b72,5472896,403787400017280981,567524435,23193855153292587220633
0x8fd1b615c006ebeb8a7cfb00a1dd809f31943b08,0xdc103077406b603daa9a7333366e6fff0530e654fc0e13fb7986f2ca2551151b,05-01-2025,2025-01-05 10:38:03.000 UTC,484,24642068,0x827922686190790b37229fd06084350E74485b72,5102612,3477578249409882254515,53531157771175598,13340540865558722104066
0x9eb86e93a809a41ab0e7cc0ba6f62561fda3015c,0x8fcb9acb849a30ec4cb1b75908b47d2409837d16a990a685cf25bd2360de4813,02-01-2025,2025-01-02 10:45:43.000 UTC,391,24512698,0x827922686190790b37229fd06084350E74485b72,4971806,3174579181718657719293,10459031000357282338,1139642123902428119
0x8508fd4238162cb3f3d485f432202af3b40f164e,0xdb3b5722cad6a0e5b4b4a7c4e3aac373853cd3709d3a467bbc0748e8d4070208,04-07-2025,2025-07-04 15:29:37.000 UTC,1027,32426815,0x03a520b32C04BF3bEEf7BEb72E919cf822Ed34f1,3475955,207090594833696423472,84556358043778365,193453351199182141498
0xdc98dbffcc648d6088a2ff8f7dc01aef050e58fc,0xc371981c2187cc4f1f44287dc0ad8fdc31a0e0f99a2ebdccae2d7877fc9cc98e,01-06-2025,2025-06-01 04:57:17.000 UTC,260,30982245,0x827922686190790b37229fd06084350E74485b72,15295840,581173604,18722,10324
0x2791dc5e14f7680d9d969acc26059ba56403b6d5,0x03ba5ddbbe4ed19b222173065de6f5f8acf866e24810f84b0760c80abeb5077a,15-12-2024,2024-12-15 00:21:15.000 UTC,265,23716364,0x827922686190790b37229fd06084350E74485b72,4023750,2761716812387939856981,884672790480459385741,823626724204278353
0x9eb86e93a809a41ab0e7cc0ba6f62561fda3015c,0xfecdd8234f3c61283ab75efbf502464a3846c3f37eee393eeb6060538ff1eadf,10-12-2024,2024-12-10 06:35:29.000 UTC,235,23511591,0x827922686190790b37229fd06084350E74485b72,3767043,7060400314295762,350963290123545753,2991800599
0x38f6d2d9ea493c3c6ee865b5b952b5fe9e3e61fc,0x3e76ddb5ce3a4314cf21290530327ce6cb56f114e3943d6554557ebdd1543bc2,22-01-2025,2025-01-22 18:59:17.000 UTC,527,25391505,0x827922686190790b37229fd06084350E74485b72,6001729,8176677962056177955113,884395314575208143,65998707865209788582927
0x9eb86e93a809a41ab0e7cc0ba6f62561fda3015c,0x3c888147ad90cd9c4ea9984ab82bbf36b56f0d4194ce738f8b99b00ff961e5c9,10-12-2024,2024-12-10 04:55:45.000 UTC,309,23508599,0x827922686190790b37229fd06084350E74485b72,3762289,7467997715773268,281059617449081276,3489422518
0xdc98dbffcc648d6088a2ff8f7dc01aef050e58fc,0xc18088688d7f322e489d55407d17c637d982bd12c25467058e3c7490a4eda535,10-01-2025,2025-01-10 14:31:01.000 UTC,404,24865057,0x827922686190790b37229fd06084350E74485b72,5357526,626114556476132631890351,1388649404065960903762,2008049033070050571429
0x8fd1b615c006ebeb8a7cfb00a1dd809f31943b08,0x65e7c1d866f99992bbe170dd9de695ce6930332f8cad3d499c2b2e05445c7af3,10-12-2024,2024-12-10 15:46:31.000 UTC,456,23528122,0x827922686190790b37229fd06084350E74485b72,3790004,11339212897259929890165,2539007610807501846888,3609001428047918245
0x9eb86e93a809a41ab0e7cc0ba6f62561fda3015c,0xa27914a7766258b2a3d8ea5178194f5625fc1ada4d388e42e9fb2a0139e9d0dc,07-12-2024,2024-12-07 12:56:25.000 UTC,326,23393419,0x827922686190790b37229fd06084350E74485b72,3613085,2556399105728007,22277012,252701506230509509488
0x9eb86e93a809a41ab0e7cc0ba6f62561fda3015c,0xbd917d58a61a3ec078a2453935f8eabfa8fd4b649ceccca5e29df8be80e3cb19,27-02-2025,2025-02-27 13:56:57.000 UTC,514,26937635,0x827922686190790b37229fd06084350E74485b72,8106630,3641379457,388189103,168502
0xdc98dbffcc648d6088a2ff8f7dc01aef050e58fc,0xa9261da03d9daa3f5e6893e76afc72d5bccca6a180a5d5fe4770b2e640392446,23-05-2025,2025-05-23 14:46:51.000 UTC,563,30611132,0x46A15B0b27311cedF172AB29E4f4766fbE7F4364,386033,12711884307687787647614,222754387045439745,421557853159174835
0x095d0de0ecfd6832f1a7961ae26d285d68655d60,0xcee714c21ba942eda86861f042b2bcf68c254515e73e030ec2a2a4722a064e0d,17-02-2025,2025-02-17 16:33:07.000 UTC,403,26510320,0x827922686190790b37229fd06084350E74485b72,7482985,492755626017143731092352,105605103638105464554,187116894151107772140297
0x9eb86e93a809a41ab0e7cc0ba6f62561fda3015c,0x4b6f9618f46ab5d4f2df589200f1bc2788c50d6c2b3da22d154966dc2ae1566b,26-02-2025,2025-02-26 07:17:41.000 UTC,72,26882457,0x827922686190790b37229fd06084350E74485b72,8029540,3988394949,49485598,611610
0x0b27b59171a4ffe19f23d54126cd797be17c6551,0xac3a56d9220dad406fae6dd04e65187272bffa075920b94b5ad2d1b59690f283,13-07-2025,2025-07-13 23:09:49.000 UTC,623,32829421,0x03a520b32C04BF3bEEf7BEb72E919cf822Ed34f1,3520823,5457720836812227852407,140281503076557349,129420386831756631255119
0x2791dc5e14f7680d9d969acc26059ba56403b6d5,0xf0513418d8397a597a37fef117991c8e46a731152755e8d69d941db5e3db50ab,16-12-2024,2024-12-16 09:15:11.000 UTC,360,23775582,0x827922686190790b37229fd06084350E74485b72,4085834,8076938868426600722,640864449680088949,3892968419611451
0xdc98dbffcc648d6088a2ff8f7dc01aef050e58fc,0xc9994ee4379cd8072dc54beb61aee036812ba6ebf1defc6333ec7b40ed949847,05-07-2025,2025-07-05 06:45:43.000 UTC,1575,32454298,0x46A15B0b27311cedF172AB29E4f4766fbE7F4364,428448,10607592615735379238349,196213532490902056,340598615502382370
0xdc98dbffcc648d6088a2ff8f7dc01aef050e58fc,0x86674318c7a987cdf831ea2093c75246e1ccacf36df0e04b950003cd123f4fa7,14-01-2025,2025-01-14 21:07:31.000 UTC,593,25049752,0x827922686190790b37229fd06084350E74485b72,5567728,607541559076136517276545,638833000396905776562,14347219439420380074461
0xdc98dbffcc648d6088a2ff8f7dc01aef050e58fc,0x8ff1eb24fd348cd3eeabe9d06579baad580ebb93b38abc7075a609a11ad39cd0,05-03-2025,2025-03-05 23:46:29.000 UTC,259,27214521,0x827922686190790b37229fd06084350E74485b72,8508431,109608146031916052832541,670999534030963838267,127626107108033489979515
0xdc98dbffcc648d6088a2ff8f7dc01aef050e58fc,0x5f83ddf5fcd6bc3e222b3f080e8b67b8b8dc2770156fd9d1808065243b137cf8,14-01-2025,2025-01-14 01:59:47.000 UTC,544,25015320,0x827922686190790b37229fd06084350E74485b72,5524510,1036943246080966223723,295085936982203349609,50993481691576496
0x2791dc5e14f7680d9d969acc26059ba56403b6d5,0x87af9cb41a6427126bb50eb7749fdc53e5598a8f38c0c1e7115f165ce51d6f98,07-12-2024,2024-12-07 05:43:45.000 UTC,241,23380439,0x827922686190790b37229fd06084350E74485b72,3612198,133322122061173658,1382789842,29479929627007444093267
0x2791dc5e14f7680d9d969acc26059ba56403b6d5,0xe86ef6c9c241d80966f1f1af4ec25167087aca202f57a4a072e60baf8db0fe9d,14-12-2024,2024-12-14 21:02:55.000 UTC,503,23710414,0x827922686190790b37229fd06084350E74485b72,4016246,13870066727034381016,7532468251569275115,2147504995523163
0x2791dc5e14f7680d9d969acc26059ba56403b6d5,0xed3d1d40577061045fc451b3fb450aa4e5ee358147ce12813906399bce8a03bb,09-01-2025,2025-01-09 02:40:21.000 UTC,466,24800537,0x827922686190790b37229fd06084350E74485b72,5276542,1684158621323442748296100,3501522036755741886574,4776865284810620647679
0x9eb86e93a809a41ab0e7cc0ba6f62561fda3015c,0x21685fc25e432cbe635c9e65eb76daf9b249a5e41ac2c690bd9eb10f8375e554,09-01-2025,2025-01-09 08:28:41.000 UTC,478,24810987,0x827922686190790b37229fd06084350E74485b72,5289808,8014915847379374164516,54000452605752,17473241103411415698581
0x9eb86e93a809a41ab0e7cc0ba6f62561fda3015c,0xbd8131dc0a1a5ec302150e23a4f00a215b84859a096ce5eaa40ec01c5b648979,01-01-2025,2025-01-01 15:35:49.000 UTC,267,24478201,0x827922686190790b37229fd06084350E74485b72,4930904,3903135724151406653928,1084522971031163234645,52724169636598685
0x0b27b59171a4ffe19f23d54126cd797be17c6551,0xa7856c3d2782cb4784544a35395e31c00fae960add361f06ecf0594c78501f98,02-09-2025,2025-09-02 15:23:45.000 UTC,642,35018639,0x03a520b32C04BF3bEEf7BEb72E919cf822Ed34f1,3843531,5541286503089586964482,95703191170933636,188666450402303000696699
0x351f61e4c49cf11f24d9f2e737ca5eff81806355,0x1a01d05f18d30d61ebfbd21ad65f212fbd351badc343eb3eb21281a0c0ce7b85,10-10-2025,2025-10-10 10:25:01.000 UTC,481,36651277,0x827922686190790b37229fd06084350E74485b72,28335314,278541840739120329,566470884,119562490988438630504228
0x9eb86e93a809a41ab0e7cc0ba6f62561fda3015c,0x4c2c03e23e2a3d6d395a2768d2141eed7d1115804697416b71053d971b447349,11-12-2024,2024-12-11 07:00:57.000 UTC,850,23555555,0x827922686190790b37229fd06084350E74485b72,3826350,2962099690892303469097,1296984303271652588158,666198575439494829
0xdc98dbffcc648d6088a2ff8f7dc01aef050e58fc,0x9da070ed7b4907bceace729b253309b3d3aa8787baed5c5e155136489c150e08,04-01-2025,2025-01-04 04:47:41.000 UTC,471,24588357,0x827922686190790b37229fd06084350E74485b72,5047488,20650110683130350719,4416586645894524857,1880080426033992
0x0b27b59171a4ffe19f23d54126cd797be17c6551,0x2c77781ef18081968d9730c592a31c921b1c4ec19519fde242110cc8fa65329e,19-05-2025,2025-05-19 05:42:11.000 UTC,185,30421992,0x03a520b32C04BF3bEEf7BEb72E919cf822Ed34f1,3057450,104297099679454471812,163741836381159037,225238862176490448410
0x2791dc5e14f7680d9d969acc26059ba56403b6d5,0xe2e1bd341ee6fa8dbcc6a6f5f21a9910bcbe52b7e64d2c80ef48fb9d5c031767,06-01-2025,2025-01-06 10:24:37.000 UTC,472,24684865,0x827922686190790b37229fd06084350E74485b72,5143038,2474066493735684320371,632603589026781299179,111010703262305019
0x9eb86e93a809a41ab0e7cc0ba6f62561fda3015c,0x3c7cdc11cd7e039e7485fc77b2f11fe1dee811e45d9a483f4641c1995b61ec6c,06-02-2025,2025-02-06 05:25:43.000 UTC,233,26015098,0x827922686190790b37229fd06084350E74485b72,6763305,18773967598274654,14950507,9978060892583455227707
0x9eb86e93a809a41ab0e7cc0ba6f62561fda3015c,0x31427bcec0d38f09bf9d5284d7c95cb4fa1e1625ec7d7b1b23a06779828d281e,09-12-2024,2024-12-09 11:42:25.000 UTC,644,23477599,0x827922686190790b37229fd06084350E74485b72,3718608,3379672810950323,151830438799024072,1506395361
0x8fd1b615c006ebeb8a7cfb00a1dd809f31943b08,0xb5b749eafbf425e6d1ce5caca2275975b03fde0e29f9196635dad0490bcb4d4a,06-01-2025,2025-01-06 04:46:11.000 UTC,475,24674712,0x827922686190790b37229fd06084350E74485b72,5133234,4889800200524218343211,1271000264562310533949,1836075584830429813
0xdc98dbffcc648d6088a2ff8f7dc01aef050e58fc,0x0163ed17ec090e308bdb72163716abaf97658ab2075250ddeee5fa463692d9a8,13-01-2025,2025-01-13 10:21:37.000 UTC,276,24987175,0x827922686190790b37229fd06084350E74485b72,5492360,1080182543977693315963,324801069898261549613,51223059474933625
0x38f6d2d9ea493c3c6ee865b5b952b5fe9e3e61fc,0x1b2bd10e23fb1701dd524eb8ecbe1c94505ccf0b937aa8a9e750621df11af0c2,07-06-2025,2025-06-07 02:19:03.000 UTC,464,31236698,0x827922686190790b37229fd06084350E74485b72,15811450,25427634234,624365,646954
0x351f61e4c49cf11f24d9f2e737ca5eff81806355,0x92b8f5c92baf45298a63dfaed80a6220c59173feb3036cc406bb7805984b1b7c,01-06-2025,2025-06-01 04:43:29.000 UTC,214,30981831,0x827922686190790b37229fd06084350E74485b72,15295534,932648416543016080,224129745,818949648819559400718116
0x2791dc5e14f7680d9d969acc26059ba56403b6d5,0x45d068c62b097966848b926fab8fa3391915ff50132a4311b99fd4adbfe14140,16-12-2024,2024-12-16 03:10:41.000 UTC,289,23764647,0x827922686190790b37229fd06084350E74485b72,4073647,3620591891087264246890,167323495176835163436,1750678328944614566
0xdc98dbffcc648d6088a2ff8f7dc01aef050e58fc,0x9bee5a65a6048083174d57e4ae3697e5e3bb069942cba576ccac82c19af2f3fa,13-01-2025,2025-01-13 01:07:17.000 UTC,392,24970545,0x827922686190790b37229fd06084350E74485b72,5469022,1174802278295510387374,217685334860446564677,157093369118766557
0x8fd1b615c006ebeb8a7cfb00a1dd809f31943b08,0x66614ff820503b6b1590a1c899553173e6a3d4afd7c025eaa0d8cd486a348a97,20-12-2024,2024-12-20 03:22:33.000 UTC,379,23937803,0x827922686190790b37229fd06084350E74485b72,4279004,7514435543019400232,3044149683689305560,9413075538348424
0x38f6d2d9ea493c3c6ee865b5b952b5fe9e3e61fc,0xaf7d30b69fd59ed8a6189fdc19eb699459ed2d2d2af097c4cadb944a42bdefa6,13-01-2025,2025-01-13 13:55:09.000 UTC,334,24993581,0x827922686190790b37229fd06084350E74485b72,5500271,702036648657948694,1298480818,35892327494562417334149
0x2791dc5e14f7680d9d969acc26059ba56403b6d5,0xb79c79bcb66105ca57b61f44d2703d86cc75292945512099afda118d8193f5c4,09-01-2025,2025-01-09 03:38:45.000 UTC,715,24802289,0x827922686190790b37229fd06084350E74485b72,5278822,1119881343173730319,1612386602,19053621644534256863737
0x8508fd4238162cb3f3d485f432202af3b40f164e,0x76f4ad5c7eb1cc2ad0136d98a8d225b7a287f4a114657c0e3e6fb2865e0ec7e3,30-04-2025,2025-04-30 02:56:23.000 UTC,243,29596218,0x03a520b32C04BF3bEEf7BEb72E919cf822Ed34f1,2950142,30033537795805707445,32214604719067317778,24451025214739342
0xdc98dbffcc648d6088a2ff8f7dc01aef050e58fc,0x08c2ec29d9f1af83f21178072a38f529c09fccc73e3cb437c12a01d05a40b2bd,03-07-2025,2025-07-03 16:56:45.000 UTC,666,32386229,0x46A15B0b27311cedF172AB29E4f4766fbE7F4364,426641,10864499193100679025932,365709133360591348,167102585024087345
0xdc98dbffcc648d6088a2ff8f7dc01aef050e58fc,0xa0c9305df714b6f5acb8dc80c04aae5212535629a86bb30a53186748916b9f7d,04-01-2025,2025-01-04 23:31:05.000 UTC,397,24622059,0x827922686190790b37229fd06084350E74485b72,5086486,934951391541378538881694,102566425241240468240,41549626041923397802163
0x38f6d2d9ea493c3c6ee865b5b952b5fe9e3e61fc,0xce8660aff7576f82f3248b035b66d634fc2b1e607e201ac95fed6aa926f586d0,10-06-2025,2025-06-10 13:28:23.000 UTC,511,31386378,0x827922686190790b37229fd06084350E74485b72,16086003,23899305653,466185,728949
0x2791dc5e14f7680d9d969acc26059ba56403b6d5,0xc06edd19c88a4cfde9da5bc0e8d2b8e113c5f1034198e87fc61193607e5dbd81,03-01-2025,2025-01-03 22:13:01.000 UTC,631,24576517,0x827922686190790b37229fd06084350E74485b72,5043198,2905871145784269436581,463544138732455626126,448062387198655942
0x9eb86e93a809a41ab0e7cc0ba6f62561fda3015c,0x29296bfab49556cfb3e29d9da61bab66c1f36994e9df74103054e64f32e96abd,05-02-2025,2025-02-05 15:35:49.000 UTC,524,25990201,0x827922686190790b37229fd06084350E74485b72,6751659,4534881912620978739107,148498156172573315,79142836676886129585587
0x8fd1b615c006ebeb8a7cfb00a1dd809f31943b08,0x1aca7cc9a0a3e3dec29e5936c141734d7dd8d66857326d5abb5c015d05633bb1,22-12-2024,2024-12-22 07:47:57.000 UTC,336,24032165,0x827922686190790b37229fd06084350E74485b72,4409690,7714362245869496161,9767144034156286944,5191324673724397
0xdc98dbffcc648d6088a2ff8f7dc01aef050e58fc,0x05317980bdf75b679c4f8a6048cc46035af775de1341ca3bbf5093c6e6d6864a,10-04-2025,2025-04-10 03:29:21.000 UTC,442,28733207,0x827922686190790b37229fd06084350E74485b72,10846208,6439202194450001,361932136,41727743844699085562
0x8810de2baa17067ddcfbd9e8f29c55f070a55f0b,0xb46da0e3329fd8a45a1d62a6cab2e9abb2e3472750928d4dd5a1512e18ca2200,27-03-2025,2025-03-27 03:27:23.000 UTC,463,28128348,0x03a520b32C04BF3bEEf7BEb72E919cf822Ed34f1,2664722,260296385200570147169,3552958565567168,6439326130028685787550
0x8fd1b615c006ebeb8a7cfb00a1dd809f31943b08,0x3f54b4b6e07c5b88249645e017d7c8a0dfd7b38d4fafcc64ff46b21f5a2a3834,08-12-2024,2024-12-08 06:42:19.000 UTC,260,23425396,0x827922686190790b37229fd06084350E74485b72,3657842,362747816945061112,2033989400,278106524125243354491280
0xdc98dbffcc648d6088a2ff8f7dc01aef050e58fc,0xa7bd237b4d836e0dbe5cb3fe232723e9f59815df2ae3389da1bff66b8f3c03b0,16-07-2025,2025-07-16 19:30:39.000 UTC,1193,32952446,0x46A15B0b27311cedF172AB29E4f4766fbE7F4364,445090,10425211787868114168768,45282821223282291,497630311005012224
0x095d0de0ecfd6832f1a7961ae26d285d68655d60,0x05f163141d4eb1658e894ec9b8d8c901f10541403294b92e491a7dd7150af02b,03-04-2025,2025-04-03 17:09:47.000 UTC,459,28455420,0x827922686190790b37229fd06084350E74485b72,10439632,35037904244189536,55456547,29572186688668120029876
0xdc98dbffcc648d6088a2ff8f7dc01aef050e58fc,0x163835a31f5191acdc997d945ddf7a7ca3c46a538b8c8c24145e12cad3c2ccf2,09-01-2025,2025-01-09 03:38:29.000 UTC,463,24802281,0x827922686190790b37229fd06084350E74485b72,5278805,596526315353242598,858868705,33129606504819725854719
0xdc98dbffcc648d6088a2ff8f7dc01aef050e58fc,0x5598ee3f8db3d75c90fa9d7c594e48b5efe43827ff797405ba2cdc9d61b03252,13-07-2025,2025-07-13 19:36:25.000 UTC,112,32823019,0x827922686190790b37229fd06084350E74485b72,19237112,9246296323009959,40618604,908962934666604978614
0xdc98dbffcc648d6088a2ff8f7dc01aef050e58fc,0xc15b5e8855ba0d568895f61fba359c7bc2725afcc45331eddafd13f345d15596,04-01-2025,2025-01-04 06:08:09.000 UTC,538,24590771,0x827922686190790b37229fd06084350E74485b72,5054675,2555214426485419248403,123776903077972108676,728263600624603246
0x38f6d2d9ea493c3c6ee865b5b952b5fe9e3e61fc,0x22b1212d16160e3071129db761fc21386131a7e881f944119a8e8b1083ab4a53,04-03-2025,2025-03-04 02:48:39.000 UTC,976,27133586,0x827922686190790b37229fd06084350E74485b72,8383988,18519877044711329110390,349602660537778493,93436680388074602998367
0x8508fd4238162cb3f3d485f432202af3b40f164e,0xaa8ffeff910e8c9a9e692d1787b62eae2d0f5b6c52be1bb538df4117bf79a8e2,05-04-2025,2025-04-05 17:41:29.000 UTC,243,28542771,0x827922686190790b37229fd06084350E74485b72,10571565,267884231590868,80306029303551296123,20639
0x2791dc5e14f7680d9d969acc26059ba56403b6d5,0xb482262c76948973e953916e198f1216cb0be280b69f1626a4cef5e8e332b47e,09-01-2025,2025-01-09 04:11:19.000 UTC,440,24803266,0x827922686190790b37229fd06084350E74485b72,5280082,1108044904466598014,528500225,34777618576672645331641
0x38f6d2d9ea493c3c6ee865b5b952b5fe9e3e61fc,0x3a287c012b05dda011536f18180bfe825ddea7d9464d81240d32245765dbe70e,10-01-2025,2025-01-10 18:45:15.000 UTC,410,24872684,0x827922686190790b37229fd06084350E74485b72,5366666,521457269312321704696,133094558330850525780,194732933390217758
0x8fd1b615c006ebeb8a7cfb00a1dd809f31943b08,0xdb4e7dad67642429a06b024a2e6017691a82fcfce05291ea883579ec62012209,19-12-2024,2024-12-19 21:31:17.000 UTC,379,23927265,0x827922686190790b37229fd06084350E74485b72,4279004,8046609997016935364,3403499267083417498,9982717829996985
0x8508fd4238162cb3f3d485f432202af3b40f164e,0xcd5c0a0efe017324ac8445d34fcd4bdc2725f6f12ed8890f558df1961f9306d9,29-03-2025,2025-03-29 04:07:39.000 UTC,331,28215956,0x827922686190790b37229fd06084350E74485b72,10022715,399148010963943,1478723920090019631,95980
0x9eb86e93a809a41ab0e7cc0ba6f62561fda3015c,0x2c9117ee109926174aa96d1716b8d2dc8f157646c46dc548351298ae3351c487,03-02-2025,2025-02-03 19:30:53.000 UTC,386,25910853,0x827922686190790b37229fd06084350E74485b72,6656192,49632751344887686,252230532,14858391982364450466390
0x095d0de0ecfd6832f1a7961ae26d285d68655d60,0x12669d51f4d4863a0fa4a077c7c5ab655196281b1b1000d3291682ade5a5ae6b,25-04-2025,2025-04-25 12:26:55.000 UTC,549,29397334,0x827922686190790b37229fd06084350E74485b72,11992491,104877432145635384379661,67028237363432800140,53808459508360573467205
0xdc98dbffcc648d6088a2ff8f7dc01aef050e58fc,0xb10dcb9d05b91533f79549581ee3e043e406eb3d23967e370b5b8aea2fca890b,30-05-2025,2025-05-30 20:30:41.000 UTC,1442,30923847,0x46A15B0b27311cedF172AB29E4f4766fbE7F4364,391286,12139145931395750324393,401103659954160064,195214489600191255
0x9eb86e93a809a41ab0e7cc0ba6f62561fda3015c,0xf020609c3cf59565973d131dbca5ccd52d6b621b35255649cae546ebb14c7f2e,20-02-2025,2025-02-20 18:25:19.000 UTC,403,26643286,0x827922686190790b37229fd06084350E74485b72,7678514,5253989293,170724736,662484
0x095d0de0ecfd6832f1a7961ae26d285d68655d60,0x3b693bb50604ae18825d564332e789db3ef061423d227a113fbf76ef62771b62,07-04-2025,2025-04-07 22:29:43.000 UTC,469,28637818,0x03a520b32C04BF3bEEf7BEb72E919cf822Ed34f1,2834808,138805316992016871422,236530196265337875,424955746344641003012
0x2791dc5e14f7680d9d969acc26059ba56403b6d5,0x3f45bcf804f86bcf691827b0ac563f3dc8dfcada6d1e2971e4b0522b172483bd,05-01-2025,2025-01-05 14:54:35.000 UTC,439,24649764,0x827922686190790b37229fd06084350E74485b72,5109603,2470056382481385387001,450440766924704219570,321505245603501648
0x8508fd4238162cb3f3d485f432202af3b40f164e,0x6b92f0ed59056216a7c380720e072798e351d05acfc0455ecc7899711afeb786,09-05-2025,2025-05-09 12:11:05.000 UTC,752,30001659,0x827922686190790b37229fd06084350E74485b72,13223647,74931125981536183747933,242807972796883429983,27317241349915131557306
0x8508fd4238162cb3f3d485f432202af3b40f164e,0xd64665738f40b872d474c4ab2c51c8e53e92a03e8cec8b80413a5419742e5b1e,10-05-2025,2025-05-10 07:00:23.000 UTC,788,30035538,0x827922686190790b37229fd06084350E74485b72,13288598,70900987275309524187067,238693384364730454388,24772215625318304247561
0xdc98dbffcc648d6088a2ff8f7dc01aef050e58fc,0x793c8953a739c72a1583440037a9b3dafa01cc5751e6bb4451b1e4ebc93c4c01,02-01-2025,2025-01-02 18:51:09.000 UTC,385,24527261,0x827922686190790b37229fd06084350E74485b72,4990840,2705439969739448849392,36452059103646365695,925695644003893516
0x0b27b59171a4ffe19f23d54126cd797be17c6551,0xcfd50929f24e99ba5effc7937df3afb48f08b1fc1778e380125a916f8c375bc4,17-05-2025,2025-05-17 06:21:33.000 UTC,265,30336773,0x03a520b32C04BF3bEEf7BEb72E919cf822Ed34f1,3044078,1321792120368029698143,14479034799711273,41103174942303130986031
0x8508fd4238162cb3f3d485f432202af3b40f164e,0x39d32da9476c6ded82918763ab03c8e730e8d9ff749801b3b318a950edf9409c,08-04-2025,2025-04-08 15:59:29.000 UTC,228,28669311,0x827922686190790b37229fd06084350E74485b72,10753246,221014920698295,35695805588339592106,30185
0x9eb86e93a809a41ab0e7cc0ba6f62561fda3015c,0xedab4256b910ea6579f85e768f018f7d14ae9071607bf4a8f782d3971be232a0,11-06-2025,2025-06-11 17:55:21.000 UTC,1772,31437587,0x827922686190790b37229fd06084350E74485b72,16195191,21529481285,107805,969106
0x2791dc5e14f7680d9d969acc26059ba56403b6d5,0x92a06ad44656b1d3e980413ccdd7278f05eb093c431d94ba776eb6d0f65d33a0,17-01-2025,2025-01-17 13:11:53.000 UTC,519,25165083,0x827922686190790b37229fd06084350E74485b72,5723350,336751978524861492,815760473,13756950652383524799266
0x8fd1b615c006ebeb8a7cfb00a1dd809f31943b08,0x179326f82b3745bee4e1fca3cbdd9109eff07957de0bba9ad5b5e68a1e39f049,09-01-2025,2025-01-09 11:28:31.000 UTC,322,24816382,0x827922686190790b37229fd06084350E74485b72,5297142,28069888950859408138067,1248846205614742447,1229341140428470975686
0x8810de2baa17067ddcfbd9e8f29c55f070a55f0b,0x9fd91d75d56d6ad9e7e4d79f6bb73c705840fdbeafceded1586cd16b89b77a69,04-06-2025,2025-06-04 22:36:01.000 UTC,721,31143607,0x03a520b32C04BF3bEEf7BEb72E919cf822Ed34f1,3174601,29100061279900760,1070220229,690418508784929089153
0x8810de2baa17067ddcfbd9e8f29c55f070a55f0b,0x81dcccafc97d24035153c38af062b4bf90d4e7ef6b5c4c626fe5d5cca4bdadb2,31-07-2025,2025-07-31 00:13:35.000 UTC,194,33565734,0x03a520b32C04BF3bEEf7BEb72E919cf822Ed34f1,3645148,1421344194665346932940,60483608347803115,19668965602491133261864
0x095d0de0ecfd6832f1a7961ae26d285d68655d60,0x717de881d914760e5422112ff501838fdf2999c0d7970c64069b9aa52ee87a97,08-05-2025,2025-05-08 01:45:03.000 UTC,302,29939678,0x827922686190790b37229fd06084350E74485b72,13092528,87643929928840505289822,36629325846831383403,49047334014905414095747
0xdc98dbffcc648d6088a2ff8f7dc01aef050e58fc,0xc371fb77853de66e3876c68f4c797480462d91c54e6c19e95c53b7d91cc0c3a5,03-06-2025,2025-06-03 15:29:31.000 UTC,692,31087612,0x46A15B0b27311cedF172AB29E4f4766fbE7F4364,395281,11787039948004390147937,513195449322984774,53458072440270200
0x2791dc5e14f7680d9d969acc26059ba56403b6d5,0x6e00d967e452f4c801d4b7171a200a13284849e7bb1355e0f04483f067e5979c,15-12-2024,2024-12-15 03:19:19.000 UTC,179,23721706,0x827922686190790b37229fd06084350E74485b72,4023750,357038241734837465475,87156351513607850263,123898651865653309
0x0b27b59171a4ffe19f23d54126cd797be17c6551,0xb0bc4e5db2d368f4fb5ca7d759364b59204d01de635ad2b992ae9b89d55ab602,04-09-2025,2025-09-04 03:21:21.000 UTC,836,35083367,0x03a520b32C04BF3bEEf7BEb72E919cf822Ed34f1,3849911,5151039025120598757267,108970273567316448,148260143658952642972242
0x2791dc5e14f7680d9d969acc26059ba56403b6d5,0xcab89134e3c0c863e40f2aa15726654ecad5434443a437abd4e200da5f7ab53d,15-12-2024,2024-12-15 18:57:33.000 UTC,439,23749853,0x827922686190790b37229fd06084350E74485b72,4052550,18059918034206200648,5401209706449104593,5652983753957847
0x8508fd4238162cb3f3d485f432202af3b40f164e,0x6d931cc4bcc116180ef16a570796ad0c626df4ce9bdd0126b56f8a810b62fca0,29-05-2025,2025-05-29 01:20:03.000 UTC,535,30846128,0x827922686190790b37229fd06084350E74485b72,15009407,16204885329,191429,619313
0x2791dc5e14f7680d9d969acc26059ba56403b6d5,0x3a3c488cf3d6bef8656375d74acd5195e5ed069706582cfea3f0d384e14770b7,08-12-2024,2024-12-08 02:19:21.000 UTC,204,23417507,0x827922686190790b37229fd06084350E74485b72,3650357,645944968764286345,2238462709,603972927016730845245015
0x2791dc5e14f7680d9d969acc26059ba56403b6d5,0xaabe2de3caf76272928165394df6e95708f8973ae72a4a580f4b6aaf003e2921,09-01-2025,2025-01-09 20:53:51.000 UTC,239,24833342,0x827922686190790b37229fd06084350E74485b72,5319909,1334447467581506125309105,2677380898629912120033,8747159603265832634270
0x2791dc5e14f7680d9d969acc26059ba56403b6d5,0xe5990756c32c7e38f67d976841f29a83c77007992d7598af7dc8ddecb7100a1b,06-02-2025,2025-02-06 08:35:45.000 UTC,336,26020799,0x827922686190790b37229fd06084350E74485b72,6788799,351438383098672167,1805474047,79482363354024535877841
0x38f6d2d9ea493c3c6ee865b5b952b5fe9e3e61fc,0x2f3cf09a6475542eaf1880d7a6f8d151b7f4942b6774ac09e07e274c5a03197d,09-07-2025,2025-07-09 06:00:43.000 UTC,317,32625748,0x46A15B0b27311cedF172AB29E4f4766fbE7F4364,432229,17154384713,444632,413014
0x8fd1b615c006ebeb8a7cfb00a1dd809f31943b08,0x98c28b30d1d0308b87b27512dd42ba83e7f60a5804c732a170b2ce7b36076592,12-01-2025,2025-01-12 17:14:11.000 UTC,485,24956352,0x827922686190790b37229fd06084350E74485b72,5455037,2394065569696436959268,110373545244044890998,1270903629876964075
0x19d36b9ee92a53ec1900447eba958f0030c688be,0x1af6d052081d32e23262ecbc74b3c3f1e8c1503484b1be1f6addf0d7ef02e71b,19-05-2025,2025-05-19 04:58:03.000 UTC,81,30420668,0x03a520b32C04BF3bEEf7BEb72E919cf822Ed34f1,3057251,631344631013222695689,15120386478181721,9497787359943496536492
0x9eb86e93a809a41ab0e7cc0ba6f62561fda3015c,0x5d6113e38d8f8288cdc3dc822b9c681d7e503ce573f437dc1e9f89662a9eed06,11-12-2024,2024-12-11 18:07:41.000 UTC,289,23575557,0x827922686190790b37229fd06084350E74485b72,3853164,2873074003908021281459,822134432625668865173,854673658270555969
0x9eb86e93a809a41ab0e7cc0ba6f62561fda3015c,0xf0b9cc40373dcaaa52561fae1b0f8ac220d54ee48e11d1f1d645fc618801dff3,16-02-2025,2025-02-16 11:31:37.000 UTC,266,26458075,0x827922686190790b37229fd06084350E74485b72,7410787,6101685610,26581094,948586
0xdc98dbffcc648d6088a2ff8f7dc01aef050e58fc,0xaf32280411caf9142243c6c2671b60a00ce49e6e20abd6ec996ee99c86da1acb,15-01-2025,2025-01-15 22:02:55.000 UTC,255,25094614,0x827922686190790b37229fd06084350E74485b72,5626416,176762382553948547817092,389766518082019848705,16123695775492659734414
0x9eb86e93a809a41ab0e7cc0ba6f62561fda3015c,0xce872e1ec176903e58f8664f4cf606b74653192cce42b47ea74f1c9c8e40f53d,04-01-2025,2025-01-04 05:57:39.000 UTC,436,24590456,0x827922686190790b37229fd06084350E74485b72,5054427,2289397802655692447920,38616196012211151004,737826901302055229
0x2791dc5e14f7680d9d969acc26059ba56403b6d5,0x393f76f97632817a32c483a03e64f72c8862830da8b5851ad0eb2d90e615ee33,07-01-2025,2025-01-07 11:20:41.000 UTC,423,24729747,0x827922686190790b37229fd06084350E74485b72,5188378,1934268170338917418204198,3014008555287345627136,22450652312041636533907
0x2791dc5e14f7680d9d969acc26059ba56403b6d5,0xaff6a68456f11090abe40a74c3dda1a175c3773cff7678bcd48102197de58d58,26-12-2024,2024-12-26 12:48:01.000 UTC,291,24213967,0x827922686190790b37229fd06084350E74485b72,4636817,3561724914693325330,2141650569186224675,1266381015650754
0xdc98dbffcc648d6088a2ff8f7dc01aef050e58fc,0xe098b94963a847f2a153ed23c8a26d9c0ff35292a225fec9fda99d1117e74395,27-12-2024,2024-12-27 10:50:21.000 UTC,442,24253637,0x827922686190790b37229fd06084350E74485b72,4666416,2455086634605029669,632371600942734473,3809521188958644
0xdc98dbffcc648d6088a2ff8f7dc01aef050e58fc,0x792edc8a82be0d4782cf1c67723219ff1931d4faeb8c32b76c89e7d22676a9a3,12-01-2025,2025-01-12 23:42:47.000 UTC,326,24968010,0x827922686190790b37229fd06084350E74485b72,5465912,1190901536910427610899,58384182418330221832,292298533712645466
0x9eb86e93a809a41ab0e7cc0ba6f62561fda3015c,0x855cc7c073c7c8b2c0c12b07c7599040245e6563a5b1ff557e830a45dfa96140,09-01-2025,2025-01-09 02:53:47.000 UTC,3040,24800940,0x827922686190790b37229fd06084350E74485b72,5277135,607260533043950388206945,430207587502692302972,18265247514660447647409
0x8810de2baa17067ddcfbd9e8f29c55f070a55f0b,0xbe0caa049964c9767a98e91033954c4a323be791e4699ee7b04e7ef170c9226e,13-08-2025,2025-08-13 23:13:25.000 UTC,278,34168729,0x03a520b32C04BF3bEEf7BEb72E919cf822Ed34f1,3745523,1063308746577924267932,38941797644891556,17019064984294934296659
0x095d0de0ecfd6832f1a7961ae26d285d68655d60,0xeea94392a467f6c596faa923bc29d5cd6e9b303cdc458baaf88a0af796733b1e,27-02-2025,2025-02-27 05:59:31.000 UTC,519,26923312,0x827922686190790b37229fd06084350E74485b72,8085773,456046384391169047131264,581304795658278522261,156887782986390367129413
0xdc98dbffcc648d6088a2ff8f7dc01aef050e58fc,0x71e5c54b20b129d1394f979e62a1629686cb11d8d7b8c153b529b5326dcb880e,31-05-2025,2025-05-31 08:00:47.000 UTC,662,30944550,0x46A15B0b27311cedF172AB29E4f4766fbE7F4364,391683,12088949982846725031264,560189814115879104,17458508617713044
0xdc98dbffcc648d6088a2ff8f7dc01aef050e58fc,0xdcd6c50a46cab6b77c57526bcd91090b7d1b781786e54e6660102d534c7e3534,16-07-2025,2025-07-16 03:08:41.000 UTC,443,32922987,0x46A15B0b27311cedF172AB29E4f4766fbE7F4364,443968,10433746921072599531567,73682510469539087,466749574104804843
0x9eb86e93a809a41ab0e7cc0ba6f62561fda3015c,0x93574124ff9e87e09c35e0f970b0c0a0f57387c2c8ab1611095a078cb99021fa,04-03-2025,2025-03-04 09:00:31.000 UTC,488,27144742,0x827922686190790b37229fd06084350E74485b72,8400983,2456835889,73445915,335884
0x8508fd4238162cb3f3d485f432202af3b40f164e,0xb5cbf3c4fbf74224ac92b7747816a12b26a44651b2d440ded8d506bdc5f3da42,25-06-2025,2025-06-25 20:03:49.000 UTC,407,32046241,0x827922686190790b37229fd06084350E74485b72,17515909,29797110691,173789,1316642
0x095d0de0ecfd6832f1a7961ae26d285d68655d60,0xba8fe706a149c41b94e5ecc56193b4b1356494db752fad4ae4f9dc34413e0439,12-04-2025,2025-04-12 11:33:41.000 UTC,254,28834137,0x03a520b32C04BF3bEEf7BEb72E919cf822Ed34f1,2870943,133317695343768341985,212689886037810561,436122787536510739129
0xdc98dbffcc648d6088a2ff8f7dc01aef050e58fc,0xcfe543acfabd9bec66c22fd70d4a24eaeb5e1769d8e378afb3d21a188c9b3382,21-12-2024,2024-12-21 23:18:41.000 UTC,532,24016887,0x827922686190790b37229fd06084350E74485b72,4409807,309006858237584519014,250566047584932807546,311225899639414104
