sickle_address,tx_hash,block_date,block_time,log_index,block_number,address
0x095d0de0ecfd6832f1a7961ae26d285d68655d60,0xdf9700082545907b9c52c87214c601161103906446b1682cd163e831876787bd,08-05-2025,2025-05-08 13:05:49.000 UTC,405,29960101,0x869305781fff479f0311974d55FeeB6Fc9DE96a2
0x9eb86e93a809a41ab0e7cc0ba6f62561fda3015c,0x6c7652dd714d0770dbfdbb723fe8b5b3ba7f05a03d99404f6e7b5044aec3301b,20-12-2024,2024-12-20 03:56:05.000 UTC,381,23938809,0xBDA319Bc7Cc8F0829df39eC0FFF5D1E061FFadf7
0x2791dc5e14f7680d9d969acc26059ba56403b6d5,0x9371551ee850b45e67afc9139c0b7921c5ee36ce993463199be7bde3fcef32dc,02-01-2025,2025-01-02 20:09:45.000 UTC,309,24529619,0x0e956C897bBFCbd2155D3DfdD27c87fa5A0FaD39
0xdc98dbffcc648d6088a2ff8f7dc01aef050e58fc,0x5c7d5b321cde609b6dc1061cce102711e3af409f51810118a2c5609c468260d1,14-01-2025,2025-01-14 08:14:39.000 UTC,373,25026566,0xBDA319Bc7Cc8F0829df39eC0FFF5D1E061FFadf7
0xdc98dbffcc648d6088a2ff8f7dc01aef050e58fc,0x8cbafcb49b2a9d8c7508e14e24a7a5a3de693e681d1697d3098a30f1a0dd0dc6,23-05-2025,2025-05-23 02:32:01.000 UTC,1074,30589087,0xCFede447ca3b4885720B5a327e3BFb02078f06e8
0x2791dc5e14f7680d9d969acc26059ba56403b6d5,0xa0c577b1c4f914e8e4fbbcf8405b1aba00c21cf45e822ad0b21611643744592c,14-12-2024,2024-12-14 12:21:41.000 UTC,2534,23694777,0xBDA319Bc7Cc8F0829df39eC0FFF5D1E061FFadf7
0x8fd1b615c006ebeb8a7cfb00a1dd809f31943b08,0x56416bac47a4c0122bf5f782ff9325d532746d026035ff6c609572daf6b79c38,29-06-2025,2025-06-29 12:35:55.000 UTC,670,32205604,0xf2c38dE50A250C0060fB45eBE4504B67f6F1be3C
0x38f6d2d9ea493c3c6ee865b5b952b5fe9e3e61fc,0x7330316eaa0a483aefe3f9090e7823030fcf4a4f37e6137757d13ec7e25e8b74,14-01-2025,2025-01-14 21:03:31.000 UTC,159,25049632,0x0e956C897bBFCbd2155D3DfdD27c87fa5A0FaD39
0x2791dc5e14f7680d9d969acc26059ba56403b6d5,0xea5bfef74ed9115e0f189a4fb0843780b7888147a49e5151e7de03e84fa56e17,15-12-2024,2024-12-15 05:55:53.000 UTC,700,23726403,0xBDA319Bc7Cc8F0829df39eC0FFF5D1E061FFadf7
0x9eb86e93a809a41ab0e7cc0ba6f62561fda3015c,0x5f3ebe6dd1566587e7abd32ddd5a4808972d3c9e1dd7b9ca2b996c4be3f98471,03-06-2025,2025-06-03 16:34:05.000 UTC,702,31089549,0xc3f97660D0b47F0E05C3c513f73eeff7c1bd6c7a
0x8508fd4238162cb3f3d485f432202af3b40f164e,0xfdd53ace9f65afdfd31e512ac4cb0e1c6ee68be9f79bec093cb11c5492433529,03-06-2025,2025-06-03 14:08:07.000 UTC,1032,31085170,0xc3f97660D0b47F0E05C3c513f73eeff7c1bd6c7a
0x351f61e4c49cf11f24d9f2e737ca5eff81806355,0x45871fd97313c806cf7e034a150b4f88cc3f9123c5e9a7061118d9e4fbac6490,01-12-2025,2025-12-01 02:25:23.000 UTC,512,38883288,0x0e956C897bBFCbd2155D3DfdD27c87fa5A0FaD39
0x9eb86e93a809a41ab0e7cc0ba6f62561fda3015c,0xfce2a7c0920eb8f9ef6263f5164adbafa69f612bd63808d0fa708823d6015c31,09-12-2024,2024-12-09 16:03:47.000 UTC,881,23485440,0xdE8FF0D3e8ab225110B088a250b546015C567E27
0x9eb86e93a809a41ab0e7cc0ba6f62561fda3015c,0xf5531c40d93fe869bfedeb3084aa6b21ff9cc5713634a29513949eaa3b4a8060,21-12-2024,2024-12-21 06:58:41.000 UTC,367,23987487,0xBDA319Bc7Cc8F0829df39eC0FFF5D1E061FFadf7
0x2791dc5e14f7680d9d969acc26059ba56403b6d5,0x44f970a6a7642ac51f065336c0f97cfc351b3dcf1d44e01f13b93cc331a8f430,20-12-2024,2024-12-20 23:25:55.000 UTC,852,23973904,0xBDA319Bc7Cc8F0829df39eC0FFF5D1E061FFadf7
0x2791dc5e14f7680d9d969acc26059ba56403b6d5,0xcc105c68ae53979aa183d5f714676404919f7186873714182275372dfa506494,17-01-2025,2025-01-17 21:45:43.000 UTC,398,25180498,0x0e956C897bBFCbd2155D3DfdD27c87fa5A0FaD39
0xdc98dbffcc648d6088a2ff8f7dc01aef050e58fc,0x1bcc7035bfa636efee62527f819a1f1e7833e7acfdae8f7eaadb284529ae8cc4,14-12-2024,2024-12-14 17:31:23.000 UTC,169,23704068,0x0e956C897bBFCbd2155D3DfdD27c87fa5A0FaD39
0x38f6d2d9ea493c3c6ee865b5b952b5fe9e3e61fc,0xd496d638005dfc0d61ec3118fa017862e4ad771a8388196348d95177e5a1bca6,06-01-2025,2025-01-06 16:46:31.000 UTC,323,24696322,0x869305781fff479f0311974d55FeeB6Fc9DE96a2
0x38f6d2d9ea493c3c6ee865b5b952b5fe9e3e61fc,0xeb5930b18dbfb030b215af86901a15fe12b9502006483775046a8427ef71dec1,04-01-2025,2025-01-04 06:22:25.000 UTC,310,24591199,0xBDA319Bc7Cc8F0829df39eC0FFF5D1E061FFadf7
0xdc98dbffcc648d6088a2ff8f7dc01aef050e58fc,0x94eee2f5d98741a88d999982489525b83e858f14c1339449310d99333949438c,05-01-2025,2025-01-05 04:17:27.000 UTC,349,24630650,0xBDA319Bc7Cc8F0829df39eC0FFF5D1E061FFadf7
0x9eb86e93a809a41ab0e7cc0ba6f62561fda3015c,0x0301a3e65ca2a1942f0c13b6b6ebce0867cda6560cfdefde8402de23a641c343,02-01-2025,2025-01-02 12:47:13.000 UTC,583,24516343,0xCFede447ca3b4885720B5a327e3BFb02078f06e8
0x351f61e4c49cf11f24d9f2e737ca5eff81806355,0xa7fb5d32585ab160f35bbd1e48b4287423cf048235e2571782c4d2c6388d27b5,16-10-2025,2025-10-16 15:22:01.000 UTC,418,36919387,0x0e956C897bBFCbd2155D3DfdD27c87fa5A0FaD39
0x38f6d2d9ea493c3c6ee865b5b952b5fe9e3e61fc,0xc7cedcd56a57d452b862cdb930daaf030245234ea46eb6ffa06ac2f182f4c3d8,04-01-2025,2025-01-04 12:46:11.000 UTC,437,24602712,0xBDA319Bc7Cc8F0829df39eC0FFF5D1E061FFadf7
0x9eb86e93a809a41ab0e7cc0ba6f62561fda3015c,0xc1dd1ed257611d8754b7e68f25cf069549280961b6de8f2e2f75301136d3b832,17-02-2025,2025-02-17 12:39:35.000 UTC,1280,26503314,0x6399ed6725cC163D019aA64FF55b22149D7179A8
0x8fd1b615c006ebeb8a7cfb00a1dd809f31943b08,0xdde8afce1ddfd90ba046e718a87b626b814050b2ff730bbf4f9a8b13f5103278,19-12-2024,2024-12-19 01:15:09.000 UTC,455,23890781,0xBDA319Bc7Cc8F0829df39eC0FFF5D1E061FFadf7
0x8508fd4238162cb3f3d485f432202af3b40f164e,0x84713359c61f98c3aa6165ed0e3e1e2c5cbbc4ac0120dbe9f76bf19577702f20,09-03-2025,2025-03-09 18:15:47.000 UTC,351,27377400,0x2B74B62c564456C48055bd515A62594742b3f545
0x2791dc5e14f7680d9d969acc26059ba56403b6d5,0x47cbd667c3d43d58186fb8dacbaaa193a25b7f0ab02b66a4388cecade9eddae5,12-01-2025,2025-01-12 23:24:29.000 UTC,281,24967461,0xBDA319Bc7Cc8F0829df39eC0FFF5D1E061FFadf7
0x9eb86e93a809a41ab0e7cc0ba6f62561fda3015c,0x93855e526f086282f7144153f29fc5223729366abe5ace2d7ada52e33b2d85d3,16-12-2024,2024-12-16 00:22:03.000 UTC,317,23759588,0xCFede447ca3b4885720B5a327e3BFb02078f06e8
0x9eb86e93a809a41ab0e7cc0ba6f62561fda3015c,0x45fcd29ecdb2e2f67d0e239766f9ddd5d2bf5a9fdc627a07c6cf21ddc4fda305,12-12-2024,2024-12-12 10:44:41.000 UTC,252,23605467,0xCFede447ca3b4885720B5a327e3BFb02078f06e8
0x9eb86e93a809a41ab0e7cc0ba6f62561fda3015c,0xf40e3f33d866846db1491300189e285cd8fc8c5ff7661c991e29c7aab12de186,24-01-2025,2025-01-24 03:41:39.000 UTC,234,25450376,0x0e956C897bBFCbd2155D3DfdD27c87fa5A0FaD39
0x8508fd4238162cb3f3d485f432202af3b40f164e,0x50f00b59b84575162cc0a8a891a8bb5e8bb6cb28404d209c9a0c82bdd4073a2c,12-06-2025,2025-06-12 14:45:25.000 UTC,307,31475089,0xf2c38dE50A250C0060fB45eBE4504B67f6F1be3C
0x2791dc5e14f7680d9d969acc26059ba56403b6d5,0x81c81501fcea4ba050e74d9a5b5f1cb8386daf05db86e3a7354290b210de28df,04-01-2025,2025-01-04 08:35:05.000 UTC,420,24595179,0xBDA319Bc7Cc8F0829df39eC0FFF5D1E061FFadf7
0x8508fd4238162cb3f3d485f432202af3b40f164e,0x18f46c0df1416460bbe9e98bdb876dcbc06b0e0a74a410a7015c26bb1147abef,14-05-2025,2025-05-14 03:07:09.000 UTC,151,30201341,0x2BED28EDa5B8902FF20256ac001aa6A4bEb1cEc2
0xdc98dbffcc648d6088a2ff8f7dc01aef050e58fc,0x467fce2ef44d58487e91292afccbf30c140bbf252cf7eb38dcb7e413862ad999,03-01-2025,2025-01-03 22:28:45.000 UTC,354,24576989,0xBDA319Bc7Cc8F0829df39eC0FFF5D1E061FFadf7
0x9eb86e93a809a41ab0e7cc0ba6f62561fda3015c,0x9dcc156a23b569088058362e013750d573d714a0812a1510193383e461f100d4,26-02-2025,2025-02-26 03:09:45.000 UTC,304,26875019,0x6399ed6725cC163D019aA64FF55b22149D7179A8
0x8fd1b615c006ebeb8a7cfb00a1dd809f31943b08,0xbedb83856c0452dcb82c5b90a338706038c2f10c11e9e793d03880d4f1d3f87b,19-12-2024,2024-12-19 20:49:21.000 UTC,296,23926007,0x45F8b8eC9c92D09BA8495074436fD97073423041
0x095d0de0ecfd6832f1a7961ae26d285d68655d60,0xbfa32ceb086f9f18530f0f05f589c389145b1bef12e732c43e0f2ab47b5214ad,16-06-2025,2025-06-16 03:38:11.000 UTC,1894,31627872,0xf2c38dE50A250C0060fB45eBE4504B67f6F1be3C
0x38f6d2d9ea493c3c6ee865b5b952b5fe9e3e61fc,0xea2b4074c4287a471de804253f033f61ea1202a06bfd16f60b5957bc984cf243,14-12-2024,2024-12-14 06:27:03.000 UTC,273,23684138,0x0e956C897bBFCbd2155D3DfdD27c87fa5A0FaD39
0x8fd1b615c006ebeb8a7cfb00a1dd809f31943b08,0x85cf1e9c3d26275a210123cfb5189e295e1d4bbec2e9c788e637cde17c32e64f,09-01-2025,2025-01-09 02:59:49.000 UTC,436,24801121,0xB9E4E0368A9F281584C9adB685e6C9F4b9F37dBb
0x2791dc5e14f7680d9d969acc26059ba56403b6d5,0x976ed1c85a8bf5f835b93c4d2d757e533fd309131136d5a0ee9df24b31b9081a,18-01-2025,2025-01-18 22:27:33.000 UTC,101,25224953,0x869305781fff479f0311974d55FeeB6Fc9DE96a2
0x8fd1b615c006ebeb8a7cfb00a1dd809f31943b08,0x7ec342b716cc5d2872dc6722777058ff19d4387d0f67f374f26de5b90201bd2d,01-01-2025,2025-01-01 14:13:47.000 UTC,507,24475740,0xBDA319Bc7Cc8F0829df39eC0FFF5D1E061FFadf7
0x38f6d2d9ea493c3c6ee865b5b952b5fe9e3e61fc,0x1724c8f3d8b1a08cfca58b7c192565be434567f9bed1c655b95b8e35a90213a8,11-01-2025,2025-01-11 22:19:25.000 UTC,280,24922309,0xBDA319Bc7Cc8F0829df39eC0FFF5D1E061FFadf7
0x8508fd4238162cb3f3d485f432202af3b40f164e,0x4cff276e263a4477e1fb337db18d0747785f0f0d99223a43a5d8aee409c9766a,05-04-2025,2025-04-05 08:08:01.000 UTC,209,28525567,0x2B74B62c564456C48055bd515A62594742b3f545
0x38f6d2d9ea493c3c6ee865b5b952b5fe9e3e61fc,0xba339132d197cbc3329665079c4f21bf4f610988d4495d20d27196cb52e70437,06-06-2025,2025-06-06 04:29:07.000 UTC,484,31197400,0xc3f97660D0b47F0E05C3c513f73eeff7c1bd6c7a
0x38f6d2d9ea493c3c6ee865b5b952b5fe9e3e61fc,0x0b11575f52d9620bf590abf9b1b0410742f37dd41a5d6fadfe690e01a9f35805,26-12-2024,2024-12-26 12:58:03.000 UTC,257,24214268,0xCFede447ca3b4885720B5a327e3BFb02078f06e8
0x9eb86e93a809a41ab0e7cc0ba6f62561fda3015c,0x63c9c8ecdd933cc7efd30521174f23ba91c7ea7d243489e130671fdccf0f6a57,20-02-2025,2025-02-20 11:56:21.000 UTC,247,26631617,0x6399ed6725cC163D019aA64FF55b22149D7179A8
0x8fd1b615c006ebeb8a7cfb00a1dd809f31943b08,0xce8f98c48ebc068f9e9e8b8e8b2ea304918fe974ad9e2fdb303770c131aa5ecf,19-12-2024,2024-12-19 10:39:23.000 UTC,272,23907708,0xBDA319Bc7Cc8F0829df39eC0FFF5D1E061FFadf7
0x8508fd4238162cb3f3d485f432202af3b40f164e,0xf46a30f7de450b64919a35d0bf4301f94419d0f4821fde06ba99b080a456aef2,30-05-2025,2025-05-30 02:15:15.000 UTC,695,30890984,0xc3f97660D0b47F0E05C3c513f73eeff7c1bd6c7a
0x095d0de0ecfd6832f1a7961ae26d285d68655d60,0x371f0427889d57b10c745f40b1af465400c05007007b2d1d6d3a0974d949e1d2,12-03-2025,2025-03-12 14:05:49.000 UTC,262,27499501,0x869305781fff479f0311974d55FeeB6Fc9DE96a2
0x2791dc5e14f7680d9d969acc26059ba56403b6d5,0x2c8ca93dc3e3db8e3f64c27931292c490471760820fa066d66f9025beb5f3538,21-12-2024,2024-12-21 14:46:43.000 UTC,496,24001528,0xBDA319Bc7Cc8F0829df39eC0FFF5D1E061FFadf7
0x8fd1b615c006ebeb8a7cfb00a1dd809f31943b08,0x925705f97f51c6d84a4fed84d656c4e84bcc17cc68b3b18121f7ca7281002620,11-01-2025,2025-01-11 03:46:45.000 UTC,380,24888929,0xBDA319Bc7Cc8F0829df39eC0FFF5D1E061FFadf7
0x38f6d2d9ea493c3c6ee865b5b952b5fe9e3e61fc,0x95366ad82a5fa85eb16d6982af18aba0a802fce69eee7cd0c5ca26a2f7d683a7,05-01-2025,2025-01-05 04:17:51.000 UTC,294,24630662,0xBDA319Bc7Cc8F0829df39eC0FFF5D1E061FFadf7
0xdc98dbffcc648d6088a2ff8f7dc01aef050e58fc,0x0f7436b7318f51628105be7b970806824295848a8bda21970acf84dbaa838254,05-06-2025,2025-06-05 06:11:45.000 UTC,542,31157279,0xc3f97660D0b47F0E05C3c513f73eeff7c1bd6c7a
0xdc98dbffcc648d6088a2ff8f7dc01aef050e58fc,0xbabea3ffdb5a9fe5c754dd95446dbe495dc246b7e9014c6c6de15c69ee288bff,05-01-2025,2025-01-05 17:26:09.000 UTC,369,24654311,0xBDA319Bc7Cc8F0829df39eC0FFF5D1E061FFadf7
0x38f6d2d9ea493c3c6ee865b5b952b5fe9e3e61fc,0x35a08882da80ea6c2d9bc510056d4093c23ab2efb8b1dbcb4690f557fe819227,06-01-2025,2025-01-06 23:56:17.000 UTC,298,24709215,0xBDA319Bc7Cc8F0829df39eC0FFF5D1E061FFadf7
0x9eb86e93a809a41ab0e7cc0ba6f62561fda3015c,0x103869dcf012d029b1ce961017dd831e1e9d09d0166cdb1c7112dc3be6c49237,26-02-2025,2025-02-26 07:39:41.000 UTC,327,26883117,0x6399ed6725cC163D019aA64FF55b22149D7179A8
0x8508fd4238162cb3f3d485f432202af3b40f164e,0x6aed01d0939035f185384c5fa6bea1d81e0b937fb23517cc25281a4b582a9297,05-06-2025,2025-06-05 07:10:43.000 UTC,507,31159048,0xc3f97660D0b47F0E05C3c513f73eeff7c1bd6c7a
0xdc98dbffcc648d6088a2ff8f7dc01aef050e58fc,0x9cf43d0233bda1b9951d112bc7ff5beca7ff457f68717ac598323bc75087d057,17-12-2024,2024-12-17 06:32:27.000 UTC,367,23813900,0xBDA319Bc7Cc8F0829df39eC0FFF5D1E061FFadf7
0x9eb86e93a809a41ab0e7cc0ba6f62561fda3015c,0x4be32d93c842e5de3fd214cf74c5724da123826b2db8c26542a8442cb696dc37,16-06-2025,2025-06-16 15:24:45.000 UTC,1329,31649069,0xf2c38dE50A250C0060fB45eBE4504B67f6F1be3C
0x351f61e4c49cf11f24d9f2e737ca5eff81806355,0x8b4da1701250a80ebcb047d3cecd5b54c5db19c0912b255a0ef0d6925c96c487,12-12-2025,2025-12-12 08:57:49.000 UTC,682,39370261,0x0e956C897bBFCbd2155D3DfdD27c87fa5A0FaD39
0x9eb86e93a809a41ab0e7cc0ba6f62561fda3015c,0xf90bb085877e2ac9cd54150eb6b681e95c02f4851e0605e52168d3453602d890,29-05-2025,2025-05-29 01:48:03.000 UTC,1027,30846968,0xc3f97660D0b47F0E05C3c513f73eeff7c1bd6c7a
0xdc98dbffcc648d6088a2ff8f7dc01aef050e58fc,0x2f90cb8b7a0b9ce11ebff01d6f65648dc0ba5bf6db829a3d86d1a30a9d5b9d11,08-01-2025,2025-01-08 00:29:59.000 UTC,263,24753426,0xBDA319Bc7Cc8F0829df39eC0FFF5D1E061FFadf7
0x9eb86e93a809a41ab0e7cc0ba6f62561fda3015c,0xe7fbb2c30541cde50aafc933425efc40be91c05f77ac08bc798b6b366032d4a6,11-06-2025,2025-06-11 17:00:19.000 UTC,443,31435936,0xc3f97660D0b47F0E05C3c513f73eeff7c1bd6c7a
0xdc98dbffcc648d6088a2ff8f7dc01aef050e58fc,0xe1548f3089aee11d4c85cb08dd26156312c373f453f135ec0e0bb39b6c4a7154,28-12-2024,2024-12-28 18:29:45.000 UTC,395,24310619,0xCFede447ca3b4885720B5a327e3BFb02078f06e8
0x8508fd4238162cb3f3d485f432202af3b40f164e,0xaaa67954bedca0200cbac8488bc5c2690dcf6d6c5c1b311d909a0fa58a1fd59d,11-07-2025,2025-07-11 23:55:01.000 UTC,350,32744377,0x6205DfbE68444cFF504A20a712cEa794c6b6Cf04
0x8508fd4238162cb3f3d485f432202af3b40f164e,0x0ee156f3e17b90ef728039d908127e0ad70b39a8cf1133375b845dfcd7a523ad,08-05-2025,2025-05-08 16:29:29.000 UTC,520,29966211,0x869305781fff479f0311974d55FeeB6Fc9DE96a2
0x2791dc5e14f7680d9d969acc26059ba56403b6d5,0x3efd70cbc67857f42cd060569ba2cca83f34da411ce2140ac3e810590d8444fe,11-01-2025,2025-01-11 08:38:03.000 UTC,362,24897668,0xBDA319Bc7Cc8F0829df39eC0FFF5D1E061FFadf7
0xdc98dbffcc648d6088a2ff8f7dc01aef050e58fc,0x8af44ffed0e0c3f1ab1171615286c08dc5d138cfd4123a58eb1a3c326af7dd70,14-01-2025,2025-01-14 12:08:31.000 UTC,508,25033582,0xBDA319Bc7Cc8F0829df39eC0FFF5D1E061FFadf7
0x8508fd4238162cb3f3d485f432202af3b40f164e,0xa251939a69a76aa183571eeadf67c917e04e18f2d6961ae872e62da87480c143,01-04-2025,2025-04-01 15:56:29.000 UTC,260,28366821,0x2B74B62c564456C48055bd515A62594742b3f545
0x38f6d2d9ea493c3c6ee865b5b952b5fe9e3e61fc,0x71f22f3428919e4d0d76014b272a865106531f07aa3ab6e1bf67246560025241,08-01-2025,2025-01-08 15:44:59.000 UTC,343,24780876,0xBDA319Bc7Cc8F0829df39eC0FFF5D1E061FFadf7
0xdc98dbffcc648d6088a2ff8f7dc01aef050e58fc,0x2f10729e58a7eb0fb69ae104faf36ce7dae664154e358429d0a256ae2fae6e1b,10-01-2025,2025-01-10 10:10:23.000 UTC,351,24857238,0xB9E4E0368A9F281584C9adB685e6C9F4b9F37dBb
0x38f6d2d9ea493c3c6ee865b5b952b5fe9e3e61fc,0x7f2c6b2c90cb1db5a7edf17c4fa773c533d909cbb718f426d72a1ec7ff590853,05-03-2025,2025-03-05 06:46:57.000 UTC,354,27183935,0x0e956C897bBFCbd2155D3DfdD27c87fa5A0FaD39
0x38f6d2d9ea493c3c6ee865b5b952b5fe9e3e61fc,0x5fee685b85dcfb48c9276f1499bdb527525f801fa59293bcbff44ae6601de242,18-12-2024,2024-12-18 19:03:31.000 UTC,372,23879632,0xCFede447ca3b4885720B5a327e3BFb02078f06e8
0x38f6d2d9ea493c3c6ee865b5b952b5fe9e3e61fc,0xfbd4c0fc4448c43b67db8b563cfa12f566a71a57e1f5d08879fef6101e3c8a65,07-01-2025,2025-01-07 15:41:27.000 UTC,469,24737570,0x0e956C897bBFCbd2155D3DfdD27c87fa5A0FaD39
0xdc98dbffcc648d6088a2ff8f7dc01aef050e58fc,0x2a02f8f996ee330a41810258e3ff7fcdb4acb79b9c0aa84678462a0961871314,31-12-2024,2024-12-31 17:11:29.000 UTC,541,24437871,0xBDA319Bc7Cc8F0829df39eC0FFF5D1E061FFadf7
0x8508fd4238162cb3f3d485f432202af3b40f164e,0xdeff3c805b00dcc7d38ea6dcae00ffbe117fda3793235281b08f0195ef5aea15,13-03-2025,2025-03-13 22:15:59.000 UTC,202,27557406,0x2B74B62c564456C48055bd515A62594742b3f545
0xdc98dbffcc648d6088a2ff8f7dc01aef050e58fc,0x75fa3e9e927d807ad8e4166954c9c0a63f715582cacf1a7d3b86e748e040049c,17-07-2025,2025-07-17 05:22:59.000 UTC,406,32970216,0xCFede447ca3b4885720B5a327e3BFb02078f06e8
0x8fd1b615c006ebeb8a7cfb00a1dd809f31943b08,0xe6b742862a119d0aa0167b72371f97302f2047dab6fc4d377467ae13f3202ba7,07-01-2025,2025-01-07 02:15:31.000 UTC,275,24713392,0xAfabcBbab5e4261B1d655c906738176191819164
0x9eb86e93a809a41ab0e7cc0ba6f62561fda3015c,0xf26b10194deb732f5b12914cb2a5715679358c3a5b99ab6f9ec30d1788bd8977,09-06-2025,2025-06-09 12:35:55.000 UTC,749,31341604,0xc3f97660D0b47F0E05C3c513f73eeff7c1bd6c7a
0x9eb86e93a809a41ab0e7cc0ba6f62561fda3015c,0x46d01795ffba18662bc87c06046d21c4f9daa1c793c04889c28341022933f1a9,06-02-2025,2025-02-06 08:36:29.000 UTC,440,26020821,0xB9E4E0368A9F281584C9adB685e6C9F4b9F37dBb
0x9eb86e93a809a41ab0e7cc0ba6f62561fda3015c,0x5562889e0d352f8aaad5dd23b64d198cd0e9e4f87ea4d320b757316e4ba51311,04-01-2025,2025-01-04 05:51:01.000 UTC,234,24590257,0xBDA319Bc7Cc8F0829df39eC0FFF5D1E061FFadf7
0x2791dc5e14f7680d9d969acc26059ba56403b6d5,0xd4082693cb6a1f12563beb191939835c5b996ee75cdfd510300d0bac516b2ffb,02-01-2025,2025-01-02 22:21:27.000 UTC,337,24533570,0x869305781fff479f0311974d55FeeB6Fc9DE96a2
0xdc98dbffcc648d6088a2ff8f7dc01aef050e58fc,0x0de90c023e628a01054ae66066a9439f7e91d3c06a7c469b558bd1f64aefdfae,03-01-2025,2025-01-03 07:30:57.000 UTC,446,24550055,0x869305781fff479f0311974d55FeeB6Fc9DE96a2
0x38f6d2d9ea493c3c6ee865b5b952b5fe9e3e61fc,0xfadf3068ad1d21019645f6f72943bfcadfe3c87600dea87c7a0ca523d421c7c3,20-01-2025,2025-01-20 01:52:07.000 UTC,238,25274290,0xB9E4E0368A9F281584C9adB685e6C9F4b9F37dBb
0x351f61e4c49cf11f24d9f2e737ca5eff81806355,0xeceaf3d800a10ce873d8e214b7e139c53df405825f8d5fddc2f8e64731a15410,21-08-2025,2025-08-21 00:45:03.000 UTC,292,34473878,0x0e956C897bBFCbd2155D3DfdD27c87fa5A0FaD39
0x9eb86e93a809a41ab0e7cc0ba6f62561fda3015c,0x233ccaae9d7c7ab4c9d341900e2c7df447b25af254d241dbc86258d6f5699071,08-07-2025,2025-07-08 12:44:25.000 UTC,129,32594659,0xc3f97660D0b47F0E05C3c513f73eeff7c1bd6c7a
0x2791dc5e14f7680d9d969acc26059ba56403b6d5,0x4129aeb58d9695ec12d0413b0b29fc3f2aaf2043c11e73a1855b12988ef5cae7,26-12-2024,2024-12-26 09:22:49.000 UTC,327,24207811,0xBDA319Bc7Cc8F0829df39eC0FFF5D1E061FFadf7
0x9eb86e93a809a41ab0e7cc0ba6f62561fda3015c,0x81a778ab90d494fc84d898e3e357dbc55906210218eb47bef467cfb4090dc1c9,22-01-2025,2025-01-22 02:37:59.000 UTC,78,25362066,0xB9E4E0368A9F281584C9adB685e6C9F4b9F37dBb
0x2791dc5e14f7680d9d969acc26059ba56403b6d5,0x511255c5fc3560e860cf4da2de0c92fd5e0af97df1f305f093642ee93b282206,25-12-2024,2024-12-25 04:57:55.000 UTC,249,24156664,0xBDA319Bc7Cc8F0829df39eC0FFF5D1E061FFadf7
0x9eb86e93a809a41ab0e7cc0ba6f62561fda3015c,0x553891d92a7fa23b0489346f9c3bb18d34964b6fdf2080fc8b788ad2620b4851,22-05-2025,2025-05-22 13:57:49.000 UTC,1865,30566461,0xc3f97660D0b47F0E05C3c513f73eeff7c1bd6c7a
0xdc98dbffcc648d6088a2ff8f7dc01aef050e58fc,0xfdb9eefafd9d2ab71a0ec17328efe9dfa6f6b3bde8d9a4c5e51409d8ccb85d99,27-12-2024,2024-12-27 13:53:53.000 UTC,273,24259143,0xBDA319Bc7Cc8F0829df39eC0FFF5D1E061FFadf7
0x9eb86e93a809a41ab0e7cc0ba6f62561fda3015c,0x6bac24ff3862490f17d3daa9f6d5cf16013d692b1c8a87bfe6f44787ccc6324b,07-02-2025,2025-02-07 16:14:41.000 UTC,456,26077767,0x0e956C897bBFCbd2155D3DfdD27c87fa5A0FaD39
0x2791dc5e14f7680d9d969acc26059ba56403b6d5,0x796db73ebba9de9b021e49d59e009c308675c75c73ba84028bd3cfa61a979082,02-01-2025,2025-01-02 21:46:21.000 UTC,279,24532517,0x869305781fff479f0311974d55FeeB6Fc9DE96a2
0x8fd1b615c006ebeb8a7cfb00a1dd809f31943b08,0x3e36e445e72c040a12fc6a3c9221caf04e5e36c1316e8b6738da035ed419a216,06-01-2025,2025-01-06 09:47:27.000 UTC,429,24683750,0xBDA319Bc7Cc8F0829df39eC0FFF5D1E061FFadf7
0x8fd1b615c006ebeb8a7cfb00a1dd809f31943b08,0x3a80da6d90db33ebb60b517bfa0db993f70fd4e89bbf86f404470daaada2355c,02-01-2025,2025-01-02 03:07:57.000 UTC,338,24498965,0xAfabcBbab5e4261B1d655c906738176191819164
0x38f6d2d9ea493c3c6ee865b5b952b5fe9e3e61fc,0x8ef5e1379f7d58293a0b262e83c0c99a218777d1a426d2b28e24c50b74df193d,21-12-2024,2024-12-21 04:01:55.000 UTC,226,23982184,0xCFede447ca3b4885720B5a327e3BFb02078f06e8
0xdc98dbffcc648d6088a2ff8f7dc01aef050e58fc,0x7a19e2ec1dc899af3c0735d8009936667901fd376f319468573d2ec814a2e92e,29-05-2025,2025-05-29 16:14:13.000 UTC,297,30872953,0xc3f97660D0b47F0E05C3c513f73eeff7c1bd6c7a
0xdc98dbffcc648d6088a2ff8f7dc01aef050e58fc,0xe1daac0fd55a2e3f91c3816cd9374bb69510667b0321fc8ec68d40bd855c4371,03-01-2025,2025-01-03 22:19:57.000 UTC,232,24576725,0xBDA319Bc7Cc8F0829df39eC0FFF5D1E061FFadf7
0x38f6d2d9ea493c3c6ee865b5b952b5fe9e3e61fc,0x534b60573aff27e39259df7fee7b790707792caf6c33cc38840d4d61cd57148d,14-02-2025,2025-02-14 18:48:55.000 UTC,320,26384794,0x0e956C897bBFCbd2155D3DfdD27c87fa5A0FaD39
0x9eb86e93a809a41ab0e7cc0ba6f62561fda3015c,0x8f08d9138d252efce59b15b6ae2c7fe83d50bbb05e003aa3958183e654ff42e4,20-02-2025,2025-02-20 04:37:03.000 UTC,403,26618438,0x6399ed6725cC163D019aA64FF55b22149D7179A8
0x38f6d2d9ea493c3c6ee865b5b952b5fe9e3e61fc,0xaaa46ef192d7db509fd9e95a65b2f3d3e25ba2ff87f668428ed01345244f546a,27-01-2025,2025-01-27 20:01:11.000 UTC,302,25609362,0x0e956C897bBFCbd2155D3DfdD27c87fa5A0FaD39
0xdc98dbffcc648d6088a2ff8f7dc01aef050e58fc,0x7a3b8daf09d3d97d19dfccd8d3c0bb68996e74296492b2cb31aa95403da96022,13-01-2025,2025-01-13 23:16:27.000 UTC,381,25010420,0xBDA319Bc7Cc8F0829df39eC0FFF5D1E061FFadf7
0x38f6d2d9ea493c3c6ee865b5b952b5fe9e3e61fc,0x5179b44feec31c8443b681eacdcf021e57c11416bf7191989fa94cd1d1534314,04-07-2025,2025-07-04 01:57:59.000 UTC,1196,32402466,0xCFede447ca3b4885720B5a327e3BFb02078f06e8
0xdc98dbffcc648d6088a2ff8f7dc01aef050e58fc,0x09b97b9f3a502c432985ce8acd07d62ff0d3f20d327d6db0c226a37405e729ef,10-01-2025,2025-01-10 18:21:13.000 UTC,497,24871963,0xBDA319Bc7Cc8F0829df39eC0FFF5D1E061FFadf7
0x38f6d2d9ea493c3c6ee865b5b952b5fe9e3e61fc,0x01c609c7f1a592c7d7d2e4d539b14af820ec1975cf610fdc579a40bf57a5e752,12-12-2024,2024-12-12 23:55:21.000 UTC,208,23629187,0x0e956C897bBFCbd2155D3DfdD27c87fa5A0FaD39
0x8fd1b615c006ebeb8a7cfb00a1dd809f31943b08,0x0814f174b470ed7a36c232cc8b211d911375ee9681688793f1f100032a27ad7d,31-12-2024,2024-12-31 17:34:15.000 UTC,369,24438554,0xCFede447ca3b4885720B5a327e3BFb02078f06e8
0x2791dc5e14f7680d9d969acc26059ba56403b6d5,0xbf1dcc355384fd47ac7c7a00f49ceeab7c5da32220acf7275d2953ad4b4ef416,31-12-2024,2024-12-31 07:24:09.000 UTC,534,24420251,0xBDA319Bc7Cc8F0829df39eC0FFF5D1E061FFadf7
0x2791dc5e14f7680d9d969acc26059ba56403b6d5,0xad84a45c2ac8bc95974f84d9afb654af2a2966e8bda2dcf7f60652a511621b25,10-01-2025,2025-01-10 08:00:47.000 UTC,359,24853350,0x869305781fff479f0311974d55FeeB6Fc9DE96a2
0x9eb86e93a809a41ab0e7cc0ba6f62561fda3015c,0x9605f2ff482d5f6f1f7b7d74d9f9adef8d0b947cdbb13df2db0ff257a7a17380,05-01-2025,2025-01-05 07:19:15.000 UTC,295,24636104,0xC23924a846eca931Ec3014253E94f15b038bd0C8
0x38f6d2d9ea493c3c6ee865b5b952b5fe9e3e61fc,0xbe6baef9ab146527239b72a3d3f5c89ad34abb2136e9d8a35c847e0cc0218a89,14-01-2025,2025-01-14 18:58:59.000 UTC,335,25045896,0x869305781fff479f0311974d55FeeB6Fc9DE96a2
0x38f6d2d9ea493c3c6ee865b5b952b5fe9e3e61fc,0x83b5b85b1ba27a27873256ac897a346fc13f2dcb441b2942efd1bc4382cd6d8c,27-02-2025,2025-02-27 11:41:21.000 UTC,2514,26933567,0xB9E4E0368A9F281584C9adB685e6C9F4b9F37dBb
0x2791dc5e14f7680d9d969acc26059ba56403b6d5,0xdf98a37db3d26013645151a989c80b30cafd2c066ea9adb225ad2b28b98919cd,22-12-2024,2024-12-22 04:17:25.000 UTC,237,24025849,0xBDA319Bc7Cc8F0829df39eC0FFF5D1E061FFadf7
0xdc98dbffcc648d6088a2ff8f7dc01aef050e58fc,0x4e54a1639a81b8b1b41317925e7a80be460c33d6b992b68eceb44f8cf3352a3d,17-06-2025,2025-06-17 05:07:57.000 UTC,404,31673765,0x869305781fff479f0311974d55FeeB6Fc9DE96a2
0x2791dc5e14f7680d9d969acc26059ba56403b6d5,0x5319fea77d18bc5b5888e261e550e8b7797120047b065b05104e3885fc21c89a,20-12-2024,2024-12-20 22:13:03.000 UTC,315,23971718,0xBDA319Bc7Cc8F0829df39eC0FFF5D1E061FFadf7
0x8fd1b615c006ebeb8a7cfb00a1dd809f31943b08,0x2ccdf6f9a336ba40d8a21cb48d4d07e0eea9a63c1e15500e81eb9422108a0662,08-05-2025,2025-05-08 02:17:15.000 UTC,783,29940644,0x0e956C897bBFCbd2155D3DfdD27c87fa5A0FaD39
0x8fd1b615c006ebeb8a7cfb00a1dd809f31943b08,0x867cb2af5f42f4280cb3d080862e700691a3bb57f7eb20f3ed10e4dfdc5b9e29,31-12-2024,2024-12-31 01:05:49.000 UTC,211,24408901,0xBDA319Bc7Cc8F0829df39eC0FFF5D1E061FFadf7
0x2791dc5e14f7680d9d969acc26059ba56403b6d5,0xa1ea421aac593cecb5df5e5c69b64aba508229ef0ae04608463fc4fa9052f0b1,03-01-2025,2025-01-03 11:10:11.000 UTC,301,24556632,0x869305781fff479f0311974d55FeeB6Fc9DE96a2
0x38f6d2d9ea493c3c6ee865b5b952b5fe9e3e61fc,0x8ce4befd9d7a12534ce4867f6a18f805973010995a26ee5ffcfbe316cbcaed02,09-01-2025,2025-01-09 17:34:19.000 UTC,476,24827356,0x0e956C897bBFCbd2155D3DfdD27c87fa5A0FaD39
0x2791dc5e14f7680d9d969acc26059ba56403b6d5,0xda7f80e1443d8191c9be19338da853b42d2f4bc57a1c3a9c47acdda0e0d934fb,10-01-2025,2025-01-10 05:26:55.000 UTC,188,24848734,0x869305781fff479f0311974d55FeeB6Fc9DE96a2
0x9eb86e93a809a41ab0e7cc0ba6f62561fda3015c,0xc260abb2a35c85f2e8039a2f3e59963e931e6183048f4ca3a7c4968564857f3f,13-12-2024,2024-12-13 02:39:57.000 UTC,373,23634125,0xCFede447ca3b4885720B5a327e3BFb02078f06e8
0x38f6d2d9ea493c3c6ee865b5b952b5fe9e3e61fc,0xeceb54bbc6a4a182fa77d05231925d60e735647f135c906ccffc6c7802eecf90,14-12-2024,2024-12-14 06:47:47.000 UTC,344,23684760,0xCFede447ca3b4885720B5a327e3BFb02078f06e8
0x9eb86e93a809a41ab0e7cc0ba6f62561fda3015c,0x8fcbb1e41cb3cb7549f383270cdae8b4560c5a045a1d75c22da051bb16c570db,04-01-2025,2025-01-04 06:27:33.000 UTC,220,24591353,0xBDA319Bc7Cc8F0829df39eC0FFF5D1E061FFadf7
0x2791dc5e14f7680d9d969acc26059ba56403b6d5,0x1b15e89aab52be09062e1eed28528ce0ccc53c1aa2ce57f14ea6f1b3b47eb355,07-01-2025,2025-01-07 08:13:17.000 UTC,371,24724125,0xBDA319Bc7Cc8F0829df39eC0FFF5D1E061FFadf7
0x8508fd4238162cb3f3d485f432202af3b40f164e,0x526cc7126cf371f380c864ed722c0d3a59d1e6bcd4f2f4b3268c797bd690eb9e,05-04-2025,2025-04-05 16:20:35.000 UTC,146,28540344,0x2B74B62c564456C48055bd515A62594742b3f545
0x2791dc5e14f7680d9d969acc26059ba56403b6d5,0x24ead1425eeb05cbe0668baebba96d90e3082c9e06456932088add19caa82214,07-01-2025,2025-01-07 22:44:25.000 UTC,357,24750259,0x0e956C897bBFCbd2155D3DfdD27c87fa5A0FaD39
0x2791dc5e14f7680d9d969acc26059ba56403b6d5,0x064395bd440f3e66d86924ed249baeb695e8f4f6f9b96e1b718c0e2cd527a747,09-03-2025,2025-03-09 05:01:43.000 UTC,209,27353578,0x0e956C897bBFCbd2155D3DfdD27c87fa5A0FaD39
0x095d0de0ecfd6832f1a7961ae26d285d68655d60,0x7fd316ace929f8e8d606cc0e2eb14fc6c27230dfd4c898d69f7463d344f1bcb7,08-02-2025,2025-02-08 07:33:03.000 UTC,489,26105318,0x0e956C897bBFCbd2155D3DfdD27c87fa5A0FaD39
0x9eb86e93a809a41ab0e7cc0ba6f62561fda3015c,0x42b129be1d263b22b9c96161fca3e06efe54b126d84d7d9a473b7b888048e646,12-02-2025,2025-02-12 21:31:29.000 UTC,175,26303271,0xB9E4E0368A9F281584C9adB685e6C9F4b9F37dBb
0x2791dc5e14f7680d9d969acc26059ba56403b6d5,0x4bd14499b70c4fe4e1c3fd82ed1da9c86c7347f63a36c6a7e4d7e80dbfe66ccd,25-02-2025,2025-02-25 07:56:33.000 UTC,422,26840423,0x0e956C897bBFCbd2155D3DfdD27c87fa5A0FaD39
0x8fd1b615c006ebeb8a7cfb00a1dd809f31943b08,0xe367090eda2c08f9d8131e54a4f56476c8619e15a99fa73f8b7c996cec73a916,23-12-2024,2024-12-23 21:11:05.000 UTC,501,24099459,0xBDA319Bc7Cc8F0829df39eC0FFF5D1E061FFadf7
0x9eb86e93a809a41ab0e7cc0ba6f62561fda3015c,0xc3dd57d052156717573e26151a04a647733892b26481996b66ecb697e5c2326a,04-01-2025,2025-01-04 20:51:43.000 UTC,370,24617278,0xBDA319Bc7Cc8F0829df39eC0FFF5D1E061FFadf7
0x9eb86e93a809a41ab0e7cc0ba6f62561fda3015c,0xa4193703b4a99604349f7996de3a20964b5a94b6d52c022b258be31720b02a61,14-12-2024,2024-12-14 15:54:09.000 UTC,390,23701151,0xBDA319Bc7Cc8F0829df39eC0FFF5D1E061FFadf7
0x9eb86e93a809a41ab0e7cc0ba6f62561fda3015c,0x4952a5aa956ff3a61bf63be24d04d9cd6d7a5857bb56cba01717a1aefc0f8274,13-06-2025,2025-06-13 16:48:01.000 UTC,1340,31521967,0xc3f97660D0b47F0E05C3c513f73eeff7c1bd6c7a
0x9eb86e93a809a41ab0e7cc0ba6f62561fda3015c,0x26e5115620a402d7bef998a1484e4dfcb35066da58df06054e6c22a2e9e34458,18-12-2024,2024-12-18 02:05:49.000 UTC,569,23849101,0xCFede447ca3b4885720B5a327e3BFb02078f06e8
0xdc98dbffcc648d6088a2ff8f7dc01aef050e58fc,0x000f61105be98682a9ecc8f29250c2ce56f028bc8a0c170ce4e09ee65adc9ffd,17-01-2025,2025-01-17 11:54:19.000 UTC,336,25162756,0xBDA319Bc7Cc8F0829df39eC0FFF5D1E061FFadf7
0x2791dc5e14f7680d9d969acc26059ba56403b6d5,0xf1f3ddb67d2c9756deea9f9e453c95c9893696c0c1bd3df89f085913ba4aab4c,09-03-2025,2025-03-09 08:22:03.000 UTC,210,27359588,0x6205DfbE68444cFF504A20a712cEa794c6b6Cf04
0x38f6d2d9ea493c3c6ee865b5b952b5fe9e3e61fc,0x727983b55094847431d41db1703ebdc447a33775a626ab07b14b20462d4f3ef2,22-05-2025,2025-05-22 22:40:55.000 UTC,408,30582154,0xc3f97660D0b47F0E05C3c513f73eeff7c1bd6c7a
0x8508fd4238162cb3f3d485f432202af3b40f164e,0xa4d8065fa3cfb70bad049c70f8f4449f6d300f790189cfe3dc56147502c7ea0a,09-07-2025,2025-07-09 09:03:39.000 UTC,208,32631236,0xCFede447ca3b4885720B5a327e3BFb02078f06e8
0x2791dc5e14f7680d9d969acc26059ba56403b6d5,0x04573ec277508ec3b4aa08bf2e92b566dc2c79002049dda579d174c61b37c3df,29-12-2024,2024-12-29 06:48:09.000 UTC,238,24332771,0xBDA319Bc7Cc8F0829df39eC0FFF5D1E061FFadf7
0x8508fd4238162cb3f3d485f432202af3b40f164e,0xd1890196465f63e0d23c2c433ad6c3e51a6bf71bb19bfa754988ab6014c64b14,12-04-2025,2025-04-12 04:39:03.000 UTC,269,28821698,0x2B74B62c564456C48055bd515A62594742b3f545
0x19d36b9ee92a53ec1900447eba958f0030c688be,0x44b3cb6d5ffd5f95037b8ceb6352f2d6a8596ce79b7acb499491fea7fc66cf12,19-05-2025,2025-05-19 05:01:05.000 UTC,113,30420759,0x0e956C897bBFCbd2155D3DfdD27c87fa5A0FaD39
0x351f61e4c49cf11f24d9f2e737ca5eff81806355,0x8b0d2767c31ecbb93e9221c53a3a330480849f2438eb9f7df7a08886c290adf9,21-10-2025,2025-10-21 22:16:17.000 UTC,823,37147815,0x0e956C897bBFCbd2155D3DfdD27c87fa5A0FaD39
0x2791dc5e14f7680d9d969acc26059ba56403b6d5,0xa2bfe127c2ef6d53ff99bfca28f3aa7de49bcbc898d5c35e1f3e1b2456902618,27-12-2024,2024-12-27 07:28:49.000 UTC,324,24247591,0xBDA319Bc7Cc8F0829df39eC0FFF5D1E061FFadf7
0x38f6d2d9ea493c3c6ee865b5b952b5fe9e3e61fc,0x5c927a76697c2d79b581008dbc28d1a5ec34d0d03aa8cddf519a7dd38cff2bda,04-01-2025,2025-01-04 11:44:11.000 UTC,350,24600852,0x869305781fff479f0311974d55FeeB6Fc9DE96a2
0x9eb86e93a809a41ab0e7cc0ba6f62561fda3015c,0x473cad1fd9d867b1ba42435df710708a139f2cfd77b8e48681e99da6e123a4fd,29-12-2024,2024-12-29 16:15:15.000 UTC,186,24349784,0xBDA319Bc7Cc8F0829df39eC0FFF5D1E061FFadf7
0x8fd1b615c006ebeb8a7cfb00a1dd809f31943b08,0x0b324086d1df92c45976fe6264217117dca797b664ed64415339e387e5534bab,19-12-2024,2024-12-19 06:10:49.000 UTC,365,23899651,0xBDA319Bc7Cc8F0829df39eC0FFF5D1E061FFadf7
0xdc98dbffcc648d6088a2ff8f7dc01aef050e58fc,0x50505fcb8e3f399a774601d27f7fd971dff441d9a04f951ed7921a2696ad6a82,24-01-2025,2025-01-24 05:15:19.000 UTC,219,25453186,0x869305781fff479f0311974d55FeeB6Fc9DE96a2
0xdc98dbffcc648d6088a2ff8f7dc01aef050e58fc,0x66f5fa36d6491c3c7aea6c8f7ac1179f6e06eca884b022f37e7df54bc891ce03,13-12-2024,2024-12-13 00:21:59.000 UTC,536,23629986,0xBDA319Bc7Cc8F0829df39eC0FFF5D1E061FFadf7
0x8fd1b615c006ebeb8a7cfb00a1dd809f31943b08,0xa31e8bf5bd55fba540b1eb78460c2d0193ea4510938e1963e0a5b9c614b32d9c,23-12-2024,2024-12-23 18:16:29.000 UTC,586,24094221,0xBDA319Bc7Cc8F0829df39eC0FFF5D1E061FFadf7
0x8fd1b615c006ebeb8a7cfb00a1dd809f31943b08,0xfdac0d27a17b553d383a17a255df9c63f57703a9ccf4057fc6cf05af2755c267,04-01-2025,2025-01-04 14:26:29.000 UTC,294,24605721,0xBDA319Bc7Cc8F0829df39eC0FFF5D1E061FFadf7
0x8fd1b615c006ebeb8a7cfb00a1dd809f31943b08,0xd21d31bbdb93c56285ffe05a9a94727a3c51ef4caf93d82a4f749d9c4104b2a9,23-12-2024,2024-12-23 01:57:53.000 UTC,349,24064863,0xBDA319Bc7Cc8F0829df39eC0FFF5D1E061FFadf7
0x2791dc5e14f7680d9d969acc26059ba56403b6d5,0x7ca1461573960a4dc2a6897110f95264d6c59afb5f1d071de88f402fbb59d89b,08-01-2025,2025-01-08 10:17:35.000 UTC,324,24771054,0x869305781fff479f0311974d55FeeB6Fc9DE96a2
0xdc98dbffcc648d6088a2ff8f7dc01aef050e58fc,0x41fa030e52da1f4e7717d8ae58479d6c4052635bd524d42df96bcd99f282ef4f,09-01-2025,2025-01-09 21:46:21.000 UTC,524,24834917,0xBDA319Bc7Cc8F0829df39eC0FFF5D1E061FFadf7
0x2791dc5e14f7680d9d969acc26059ba56403b6d5,0x611651af89d1aac328673318d26530a743641e91c1b7d71338e2ec0c59cb971c,16-01-2025,2025-01-16 01:09:51.000 UTC,544,25100222,0x0e956C897bBFCbd2155D3DfdD27c87fa5A0FaD39
0xdc98dbffcc648d6088a2ff8f7dc01aef050e58fc,0x6d99f3ded53838d7373c8809bc95b260342f7674e50f703011dfc6aaa917cbf4,14-01-2025,2025-01-14 12:24:35.000 UTC,246,25034064,0x869305781fff479f0311974d55FeeB6Fc9DE96a2
0x9eb86e93a809a41ab0e7cc0ba6f62561fda3015c,0x5b7e5275406357e9b7fd45a6682433e219fe9efa43e05085001a5015ccc34933,19-02-2025,2025-02-19 10:14:21.000 UTC,196,26585357,0x6399ed6725cC163D019aA64FF55b22149D7179A8
0x8fd1b615c006ebeb8a7cfb00a1dd809f31943b08,0x2fded81e6b133d4ca75e8d54fe1a8792151923038e54d85e15c6668b6d3489bd,12-02-2025,2025-02-12 23:10:31.000 UTC,224,26306242,0xF33a96b5932D9E9B9A0eDA447AbD8C9d48d2e0c8
0x2791dc5e14f7680d9d969acc26059ba56403b6d5,0x428561e361ac7084585b4ce4fffb42ed6770ae21277e5c3d9726f68cd3f27684,09-01-2025,2025-01-09 05:31:23.000 UTC,130,24805668,0x869305781fff479f0311974d55FeeB6Fc9DE96a2
0xdc98dbffcc648d6088a2ff8f7dc01aef050e58fc,0x388ab7949d876d0fb500094520a85386bf2b6f50887ccc4bff46da198bc35fff,14-01-2025,2025-01-14 21:18:21.000 UTC,151,25050077,0xB9E4E0368A9F281584C9adB685e6C9F4b9F37dBb
0x38f6d2d9ea493c3c6ee865b5b952b5fe9e3e61fc,0xe5d3d36cb14e42da10e240bc804e088b4f4fb511b2fea9054beab77c1b6cab77,16-12-2024,2024-12-16 02:33:11.000 UTC,315,23763522,0xCFede447ca3b4885720B5a327e3BFb02078f06e8
0x8fd1b615c006ebeb8a7cfb00a1dd809f31943b08,0x192098a552e5d6698d8c7806ac8a207a6d3da95bcc1bf66f673a6ef79434c023,22-12-2024,2024-12-22 04:10:41.000 UTC,379,24025647,0xCFede447ca3b4885720B5a327e3BFb02078f06e8
0x2791dc5e14f7680d9d969acc26059ba56403b6d5,0x2d1d61af4aef912d0bfc3262650f456671087c036b90b61d1315bc6f0ed51f45,12-05-2025,2025-05-12 04:51:49.000 UTC,143,30118081,0x0e956C897bBFCbd2155D3DfdD27c87fa5A0FaD39
0xdc98dbffcc648d6088a2ff8f7dc01aef050e58fc,0x9e31080e1f3df97d2e518b2a2a01df9d197487df0e9e0d1996a46755fb95af7d,11-01-2025,2025-01-11 11:20:19.000 UTC,261,24902536,0xBDA319Bc7Cc8F0829df39eC0FFF5D1E061FFadf7
0x2791dc5e14f7680d9d969acc26059ba56403b6d5,0xb6321e24b7be40ca779f8d9264bc5172543206bdda2149815985ac0c39a665c5,05-06-2025,2025-06-05 02:17:43.000 UTC,1003,31150258,0xCFede447ca3b4885720B5a327e3BFb02078f06e8
0x2791dc5e14f7680d9d969acc26059ba56403b6d5,0xd584408adbf40c965cb3eebd82aba6971e9fc47522f6b294c8cb799bf814585a,07-06-2025,2025-06-07 04:46:55.000 UTC,422,31241134,0xCFede447ca3b4885720B5a327e3BFb02078f06e8
0x2791dc5e14f7680d9d969acc26059ba56403b6d5,0x6080ed1201dabd1f433007d84d706f608b7041a886c7b81bee4d43fb58c484f6,06-03-2025,2025-03-06 17:46:41.000 UTC,248,27246927,0x0e956C897bBFCbd2155D3DfdD27c87fa5A0FaD39
0x095d0de0ecfd6832f1a7961ae26d285d68655d60,0xac9399621b680ae99f6281c96439ecef66db8209aa53560fd1a5aada37be449d,13-03-2025,2025-03-13 06:23:09.000 UTC,336,27528821,0x869305781fff479f0311974d55FeeB6Fc9DE96a2
0x2791dc5e14f7680d9d969acc26059ba56403b6d5,0xe83bd24a858f7cb5b60581914e6463c27989149a237051ac7cd1cec514eb3aff,29-12-2024,2024-12-29 03:03:11.000 UTC,282,24326022,0xBDA319Bc7Cc8F0829df39eC0FFF5D1E061FFadf7
0x2791dc5e14f7680d9d969acc26059ba56403b6d5,0x688668b3154c783acf1944bbfeb60397d75f7b0d9e8fdeb5fe8d2fba34fc0913,03-01-2025,2025-01-03 11:11:55.000 UTC,1346,24556684,0xB9E4E0368A9F281584C9adB685e6C9F4b9F37dBb
0x9eb86e93a809a41ab0e7cc0ba6f62561fda3015c,0xd01bc91ceab0cc054db936c6ead6798ed2ba20eaee01276fd4d7f9e54381290b,01-06-2025,2025-06-01 12:35:35.000 UTC,1174,30995994,0xf2c38dE50A250C0060fB45eBE4504B67f6F1be3C
0x2791dc5e14f7680d9d969acc26059ba56403b6d5,0x6424df0e6869b5710b45068abf7ea3745f1e9ea6e1a880209c5eb699556c5bd6,02-01-2025,2025-01-02 10:18:27.000 UTC,386,24511880,0xBDA319Bc7Cc8F0829df39eC0FFF5D1E061FFadf7
0x38f6d2d9ea493c3c6ee865b5b952b5fe9e3e61fc,0x60a8a1dfed4886f727fdbd72deb9994aad64c3557712bf0e999315463b5b4249,06-01-2025,2025-01-06 15:22:39.000 UTC,579,24693806,0xBDA319Bc7Cc8F0829df39eC0FFF5D1E061FFadf7
0x2791dc5e14f7680d9d969acc26059ba56403b6d5,0x40e6837dfd84fbe058c672c4f05758b66b8ed94686731cf2b60430ab2df95d23,04-01-2025,2025-01-04 11:39:17.000 UTC,300,24600705,0x0e956C897bBFCbd2155D3DfdD27c87fa5A0FaD39
0x8810de2baa17067ddcfbd9e8f29c55f070a55f0b,0x44d35fc1fd9b25c466bd613a3542e9a8e217084132793790e67ec79dfa3efe07,25-03-2025,2025-03-25 19:49:21.000 UTC,526,28071407,0x0e956C897bBFCbd2155D3DfdD27c87fa5A0FaD39
0x8508fd4238162cb3f3d485f432202af3b40f164e,0xa092d106789c1660e867b8069480d59555838f4f22f444a20f3b4dedbd37c7a2,25-05-2025,2025-05-25 09:21:39.000 UTC,183,30687776,0x6205DfbE68444cFF504A20a712cEa794c6b6Cf04
0x8fd1b615c006ebeb8a7cfb00a1dd809f31943b08,0x9e0edccd227ea002431c03981a18f0e2b5615abc33fcde5c482ae92b057e47e8,06-04-2025,2025-04-06 20:32:01.000 UTC,514,28591087,0x0e956C897bBFCbd2155D3DfdD27c87fa5A0FaD39
0xdc98dbffcc648d6088a2ff8f7dc01aef050e58fc,0x324f7f1aa7e9fda038fcce35cadbd92872c8338075f0a08bc50a19d57cd65b97,08-01-2025,2025-01-08 02:27:59.000 UTC,284,24756966,0x0e956C897bBFCbd2155D3DfdD27c87fa5A0FaD39
0x2791dc5e14f7680d9d969acc26059ba56403b6d5,0xefcfe792a382d308dd4eee73158e0ad8caa00854d7f20c705b0d73014f654154,16-01-2025,2025-01-16 05:00:15.000 UTC,526,25107134,0xB9E4E0368A9F281584C9adB685e6C9F4b9F37dBb
0x2791dc5e14f7680d9d969acc26059ba56403b6d5,0xf76f4df2cf947175b1f904b9f6b7c817c6eee76b182d6f21954832e7f34b209d,31-12-2024,2024-12-31 00:25:45.000 UTC,332,24407699,0xBDA319Bc7Cc8F0829df39eC0FFF5D1E061FFadf7
0x8508fd4238162cb3f3d485f432202af3b40f164e,0x091a73c5e25b532ffd48a891a535248819b3b2780d3a839ed7f28a16bced4d91,02-06-2025,2025-06-02 05:09:03.000 UTC,641,31025798,0xc3f97660D0b47F0E05C3c513f73eeff7c1bd6c7a
0xdc98dbffcc648d6088a2ff8f7dc01aef050e58fc,0x9af8220c0ab8b4443ed9c2ed3a511bcc3491a263aa1884b11207f4bec27f530d,24-12-2024,2024-12-24 00:05:07.000 UTC,262,24104680,0xBDA319Bc7Cc8F0829df39eC0FFF5D1E061FFadf7
0x8508fd4238162cb3f3d485f432202af3b40f164e,0x679ccd31bd545e47b010b486fa4078008ba29b07f7bfa582f59ab19c4264c360,09-03-2025,2025-03-09 05:51:09.000 UTC,138,27355061,0xCFede447ca3b4885720B5a327e3BFb02078f06e8
0x8508fd4238162cb3f3d485f432202af3b40f164e,0xb072fde43fa4a2f5a9688ab3283a52fc96dee169f76252010ebc5cc452b57344,16-04-2025,2025-04-16 08:19:57.000 UTC,481,29001125,0x2B74B62c564456C48055bd515A62594742b3f545
0xdc98dbffcc648d6088a2ff8f7dc01aef050e58fc,0x1345387847eb4e10e8fd6c9942630acdb05e8282a97e1da74fe99e3da7cea8fd,12-01-2025,2025-01-12 21:21:35.000 UTC,558,24963774,0x0e956C897bBFCbd2155D3DfdD27c87fa5A0FaD39
0x38f6d2d9ea493c3c6ee865b5b952b5fe9e3e61fc,0x974fd13c8362d2942857d52d6e9730471e15d243d1c41b40669470c48f3a34ec,21-06-2025,2025-06-21 07:14:33.000 UTC,352,31850363,0xCFede447ca3b4885720B5a327e3BFb02078f06e8
0xdc98dbffcc648d6088a2ff8f7dc01aef050e58fc,0xf1df05db680f8d4c6205e98974a18200d11c461fcbf8955c8944053f197710c5,04-01-2025,2025-01-04 22:36:29.000 UTC,413,24620421,0xBDA319Bc7Cc8F0829df39eC0FFF5D1E061FFadf7
0x2791dc5e14f7680d9d969acc26059ba56403b6d5,0x1c576574b03c432243de327765e976cb66fa22a8971b715fe97b2fdd9ba9098f,18-12-2024,2024-12-18 19:42:53.000 UTC,267,23880813,0xBDA319Bc7Cc8F0829df39eC0FFF5D1E061FFadf7
0x8fd1b615c006ebeb8a7cfb00a1dd809f31943b08,0x72459b086cbac261d5453a4422d3214173603ea680f45b1b086a75cf2cc0d4ed,03-01-2025,2025-01-03 08:48:37.000 UTC,304,24552385,0xBDA319Bc7Cc8F0829df39eC0FFF5D1E061FFadf7
0x9eb86e93a809a41ab0e7cc0ba6f62561fda3015c,0xa8e8d4e9e51e4cfe7e6dd2941d6669276be431709ed0c345a54cb4be0055b20b,01-01-2025,2025-01-01 22:04:15.000 UTC,444,24489854,0x869305781fff479f0311974d55FeeB6Fc9DE96a2
0xdc98dbffcc648d6088a2ff8f7dc01aef050e58fc,0xe17dc4695dd3be019165e1aa4669228c299e2978dca35080e90faef1a5be1a3a,05-01-2025,2025-01-05 19:52:09.000 UTC,284,24658691,0xBDA319Bc7Cc8F0829df39eC0FFF5D1E061FFadf7
0x2791dc5e14f7680d9d969acc26059ba56403b6d5,0xc342b602ad78d5607bc836051fedbb53062b7169255d2a9c3cf35c8d91bef685,18-01-2025,2025-01-18 22:31:07.000 UTC,220,25225060,0x869305781fff479f0311974d55FeeB6Fc9DE96a2
0x8fd1b615c006ebeb8a7cfb00a1dd809f31943b08,0x6155f979148acadbb85dadabbcf8dea29b8d860c7b4989929fb8c6c726329514,03-01-2025,2025-01-03 00:44:21.000 UTC,369,24537857,0xAfabcBbab5e4261B1d655c906738176191819164
0x38f6d2d9ea493c3c6ee865b5b952b5fe9e3e61fc,0x0fe72b676964f07106505847387f1fbe9de061c5fb1b7e901d195e4dbb543b16,29-12-2024,2024-12-29 14:53:33.000 UTC,453,24347333,0xCFede447ca3b4885720B5a327e3BFb02078f06e8
0xdc98dbffcc648d6088a2ff8f7dc01aef050e58fc,0xfeb207a878a7832cb62d5af9e4cc5627b21ede7e9352772b24a064353b8f52af,03-07-2025,2025-07-03 03:03:29.000 UTC,427,32361231,0xc3f97660D0b47F0E05C3c513f73eeff7c1bd6c7a
0x2791dc5e14f7680d9d969acc26059ba56403b6d5,0xacbe33453cecec8acb034c9511f438613487e85a541032493bfb225202d3026e,19-12-2024,2024-12-19 11:21:03.000 UTC,437,23908958,0xBDA319Bc7Cc8F0829df39eC0FFF5D1E061FFadf7
0x2791dc5e14f7680d9d969acc26059ba56403b6d5,0xa5012cafdd3ad1f0853835d6c61217a68a85188b402289ef14b0b549abcc553e,02-01-2025,2025-01-02 08:22:07.000 UTC,323,24508390,0x0e956C897bBFCbd2155D3DfdD27c87fa5A0FaD39
0x38f6d2d9ea493c3c6ee865b5b952b5fe9e3e61fc,0xfaa684aceb9d36bec8217bb6284d1145016d1ceb88495245bf5ae9dc201c00ca,03-01-2025,2025-01-03 07:10:45.000 UTC,410,24549449,0x0e956C897bBFCbd2155D3DfdD27c87fa5A0FaD39
0x095d0de0ecfd6832f1a7961ae26d285d68655d60,0x2bad48f4611490fe7b1bda8660d1133e74cd7a872627c6c0c65d67dd78611117,11-05-2025,2025-05-11 05:01:59.000 UTC,9,30075186,0x869305781fff479f0311974d55FeeB6Fc9DE96a2
0x095d0de0ecfd6832f1a7961ae26d285d68655d60,0x78eda15d9f3776e4967c5083a23454f909a2ecc71409e0e2d29ef51be9f70934,19-06-2025,2025-06-19 04:22:43.000 UTC,1677,31758808,0x869305781fff479f0311974d55FeeB6Fc9DE96a2
0xdc98dbffcc648d6088a2ff8f7dc01aef050e58fc,0x3748f41cb8321fe7d808cbe8168f016891e6c0915a8c6df44ce03e6fe1e826c9,31-12-2024,2024-12-31 07:49:57.000 UTC,185,24421025,0x869305781fff479f0311974d55FeeB6Fc9DE96a2
0x8508fd4238162cb3f3d485f432202af3b40f164e,0x696149712f756936f0af79f69c6cf2dfe5fea8c8c9a5ba4ce47dd5b76c6f8a1c,15-07-2025,2025-07-15 18:50:05.000 UTC,612,32908029,0xc3f97660D0b47F0E05C3c513f73eeff7c1bd6c7a
0x095d0de0ecfd6832f1a7961ae26d285d68655d60,0x2a7365b87020b46b224425d1a263eff7ff29d35dd10e21b44facc8abb98bb3d9,23-04-2025,2025-04-23 01:28:57.000 UTC,388,29291195,0x869305781fff479f0311974d55FeeB6Fc9DE96a2
0xdc98dbffcc648d6088a2ff8f7dc01aef050e58fc,0xc377afdd6ad9c4bcf39d02da252b1bfa0395141b9099d430e3b322fbea7b8cdb,05-01-2025,2025-01-05 20:31:03.000 UTC,351,24659858,0xB9E4E0368A9F281584C9adB685e6C9F4b9F37dBb
0x8fd1b615c006ebeb8a7cfb00a1dd809f31943b08,0x8754871abf732282df0340304a95c8ea72694118379a4d910e4073ac2259ebab,07-01-2025,2025-01-07 00:38:47.000 UTC,215,24710490,0xBDA319Bc7Cc8F0829df39eC0FFF5D1E061FFadf7
0x351f61e4c49cf11f24d9f2e737ca5eff81806355,0x606ee52de4e4fdeccfbc686d482f5fc703404f450ef6fa1a9a924600590979a6,23-08-2025,2025-08-23 02:06:13.000 UTC,576,34562713,0x0e956C897bBFCbd2155D3DfdD27c87fa5A0FaD39
0x9eb86e93a809a41ab0e7cc0ba6f62561fda3015c,0x8fc06a192189aa98e4fb07702d738673a08cf502143925cfaedbf893ddcf751a,13-12-2024,2024-12-13 12:43:01.000 UTC,478,23652217,0xCFede447ca3b4885720B5a327e3BFb02078f06e8
0x8fd1b615c006ebeb8a7cfb00a1dd809f31943b08,0xebf452f9a4bc8057fa9e11b84007505fdc1f319978a510612287e4f8bf709e8f,19-12-2024,2024-12-19 12:48:15.000 UTC,292,23911574,0xBDA319Bc7Cc8F0829df39eC0FFF5D1E061FFadf7
0x8fd1b615c006ebeb8a7cfb00a1dd809f31943b08,0x21304f9485efdbaafe43594757c2d7350c8438a37a319ec9e6dfc89ec09c3c62,18-12-2024,2024-12-18 16:15:59.000 UTC,453,23874606,0xBDA319Bc7Cc8F0829df39eC0FFF5D1E061FFadf7
0xdc98dbffcc648d6088a2ff8f7dc01aef050e58fc,0x7b46c87ac2487fd61b336d3908d9f1552df8a3b2837dbc9403738106aa358ac1,31-12-2024,2024-12-31 18:41:51.000 UTC,290,24440582,0xCFede447ca3b4885720B5a327e3BFb02078f06e8
0xdc98dbffcc648d6088a2ff8f7dc01aef050e58fc,0x5f4b9312628ca1a6f87bf4f3850c5a7b714c66ce54d6c7d03b495bd2cc20bc1f,04-01-2025,2025-01-04 14:36:29.000 UTC,436,24606021,0xBDA319Bc7Cc8F0829df39eC0FFF5D1E061FFadf7
0x9eb86e93a809a41ab0e7cc0ba6f62561fda3015c,0xcc608db1f0d59d84e74188054a706fca2c1b3ee69b3dd2463f476ba5c55d3ac7,09-12-2024,2024-12-09 14:25:51.000 UTC,470,23482502,0xdE8FF0D3e8ab225110B088a250b546015C567E27
0x8fd1b615c006ebeb8a7cfb00a1dd809f31943b08,0x4f7198637edeb7e46b8c5d2d7ae2ec66c3e426ec66269d97099bdaa5836cc3b6,27-12-2024,2024-12-27 20:49:17.000 UTC,278,24271605,0xCFede447ca3b4885720B5a327e3BFb02078f06e8
0x095d0de0ecfd6832f1a7961ae26d285d68655d60,0xc4e3637dc4426875106d3091de9914caeb32203cf52ae23c8f6f513acad3a1bd,25-03-2025,2025-03-25 00:09:41.000 UTC,383,28036017,0x869305781fff479f0311974d55FeeB6Fc9DE96a2
0x8fd1b615c006ebeb8a7cfb00a1dd809f31943b08,0x3322bb7c8c203a6a677591619a363d661a06be37f755c76b124f6a83bb1963f8,15-12-2024,2024-12-15 07:10:05.000 UTC,375,23728629,0xBDA319Bc7Cc8F0829df39eC0FFF5D1E061FFadf7
0x9eb86e93a809a41ab0e7cc0ba6f62561fda3015c,0x36d6ced906dd7294b4edd8b690eba8d4e864a9685cbf62a1419f2a4cfdc8136e,01-01-2025,2025-01-01 08:50:59.000 UTC,213,24466056,0xBDA319Bc7Cc8F0829df39eC0FFF5D1E061FFadf7
0x8fd1b615c006ebeb8a7cfb00a1dd809f31943b08,0x51f731e93a1b8916eb5bda366ef469e5d9c5735006a20776c2fded93f978090e,04-01-2025,2025-01-04 12:37:21.000 UTC,490,24602447,0xBDA319Bc7Cc8F0829df39eC0FFF5D1E061FFadf7
0x8508fd4238162cb3f3d485f432202af3b40f164e,0x47976c967fbad7cf6f3a6efaff21e0fcffde917c1ae6c92073fcbf4b1ae68ef1,10-04-2025,2025-04-10 17:18:35.000 UTC,343,28758084,0x2B74B62c564456C48055bd515A62594742b3f545
0xdc98dbffcc648d6088a2ff8f7dc01aef050e58fc,0xe5c2e8fc352ae84c95e562a5cf96e1ee859dc673b8c511c9731787e613b2e33f,23-05-2025,2025-05-23 06:45:41.000 UTC,898,30596697,0x430C09546ae9249AB75B9A4ef7B5FD9a4006D6f3
0x2791dc5e14f7680d9d969acc26059ba56403b6d5,0x1c2e198af3ec6f832cec1730a18620abba1af2186c86d5e71bf65f45d9750ce9,14-12-2024,2024-12-14 18:19:23.000 UTC,234,23705508,0xBDA319Bc7Cc8F0829df39eC0FFF5D1E061FFadf7
0x095d0de0ecfd6832f1a7961ae26d285d68655d60,0xac1420ecee548f3b93555da4d263888c54f10c202ff486bc6ff6385445131ebb,13-04-2025,2025-04-13 23:31:57.000 UTC,710,28898885,0x869305781fff479f0311974d55FeeB6Fc9DE96a2
0x9eb86e93a809a41ab0e7cc0ba6f62561fda3015c,0xfc4a5ac12469323568eebd96df50c678801ec656b9036e235cdfe3c9aeaed280,28-12-2024,2024-12-28 18:00:25.000 UTC,343,24309739,0xCFede447ca3b4885720B5a327e3BFb02078f06e8
0x38f6d2d9ea493c3c6ee865b5b952b5fe9e3e61fc,0x0b0a4b1ea12e754f4d7b9ff91fceb00ea21906996e12e2659014dc17217311a0,06-01-2025,2025-01-06 22:02:51.000 UTC,203,24705812,0x869305781fff479f0311974d55FeeB6Fc9DE96a2
0x9eb86e93a809a41ab0e7cc0ba6f62561fda3015c,0x6deac8715bbd24b74f3a42c8f3a0bc06394fe8f67e6f671af8dd6074e8254c6a,07-01-2025,2025-01-07 14:31:01.000 UTC,305,24735457,0xBDA319Bc7Cc8F0829df39eC0FFF5D1E061FFadf7
0x2791dc5e14f7680d9d969acc26059ba56403b6d5,0xdd0e3c579df2b11238de8708c44e408d38ff590e7f3b02d05519d2f53fa3f1e1,24-12-2024,2024-12-24 15:01:07.000 UTC,366,24131560,0xBDA319Bc7Cc8F0829df39eC0FFF5D1E061FFadf7
0xdc98dbffcc648d6088a2ff8f7dc01aef050e58fc,0x68baa7eaa96079d5606374a6e80258d811a4c3a432ff385911f70722ba6dc38a,02-01-2025,2025-01-02 16:41:45.000 UTC,330,24523379,0x869305781fff479f0311974d55FeeB6Fc9DE96a2
0x2791dc5e14f7680d9d969acc26059ba56403b6d5,0x4a7ac35c8fefa36d96ed9e5f821c57fba2d0274ca1bbfef5225d04028ab7a42f,16-12-2024,2024-12-16 16:25:25.000 UTC,432,23788489,0xBDA319Bc7Cc8F0829df39eC0FFF5D1E061FFadf7
0xdc98dbffcc648d6088a2ff8f7dc01aef050e58fc,0x3a52f3150970d53b3df71a5c790b8ff4b08d2db7744e1a1b3d2f5c78eb4fb1a5,02-01-2025,2025-01-02 08:16:19.000 UTC,639,24508216,0x0e956C897bBFCbd2155D3DfdD27c87fa5A0FaD39
0x38f6d2d9ea493c3c6ee865b5b952b5fe9e3e61fc,0x38b96f5763f759d6f2051dcbf396a443c7273dcca310801a4cc8f9c025f404de,23-06-2025,2025-06-23 21:55:21.000 UTC,404,31963187,0xCFede447ca3b4885720B5a327e3BFb02078f06e8
0x9eb86e93a809a41ab0e7cc0ba6f62561fda3015c,0xc695421a2380684cbb4173fbccba81d85e5d633c3bcfabd208f1231357002f13,08-01-2025,2025-01-08 18:46:15.000 UTC,390,24786314,0xBDA319Bc7Cc8F0829df39eC0FFF5D1E061FFadf7
0x095d0de0ecfd6832f1a7961ae26d285d68655d60,0x3c99b3f304b0c578b352830177d1fbefb9ff2173805fce5d46d468d5de414026,28-03-2025,2025-03-28 15:21:19.000 UTC,273,28192966,0x869305781fff479f0311974d55FeeB6Fc9DE96a2
0x9eb86e93a809a41ab0e7cc0ba6f62561fda3015c,0x6432dedb88a11a554649e92687f3366935ecbe660563f430c36b9918273c1829,06-06-2025,2025-06-06 03:41:27.000 UTC,431,31195970,0xc3f97660D0b47F0E05C3c513f73eeff7c1bd6c7a
0x2791dc5e14f7680d9d969acc26059ba56403b6d5,0xfcb3415704aa2b4d7b384fc582d70c2195f3d8cdfbd3e6e9261e221e8013e568,22-12-2024,2024-12-22 06:59:03.000 UTC,348,24030698,0xBDA319Bc7Cc8F0829df39eC0FFF5D1E061FFadf7
0x8508fd4238162cb3f3d485f432202af3b40f164e,0x98417232101de95a2b0367531477de5ce0fd7b8dd597144c515d2cfefa4b7cee,03-06-2025,2025-06-03 04:56:51.000 UTC,221,31068632,0xc3f97660D0b47F0E05C3c513f73eeff7c1bd6c7a
0xdc98dbffcc648d6088a2ff8f7dc01aef050e58fc,0xffc15af150b4eeef8b217a9d2b0c311589ba84ba312fd615d4640119c104a9af,06-01-2025,2025-01-06 21:49:21.000 UTC,539,24705407,0x869305781fff479f0311974d55FeeB6Fc9DE96a2
0x38f6d2d9ea493c3c6ee865b5b952b5fe9e3e61fc,0xdd276840df7e41c8705f07b167c3cf52b7d18d5e3b6856dfe2faddd0b324bc9d,18-02-2025,2025-02-18 05:26:03.000 UTC,246,26533508,0xB9E4E0368A9F281584C9adB685e6C9F4b9F37dBb
0x2791dc5e14f7680d9d969acc26059ba56403b6d5,0x9e47f262cef38f36ee9fecd847a9d88189abe5f5f0766e7d774c9a4d6837a4f7,27-12-2024,2024-12-27 09:03:01.000 UTC,401,24250417,0xBDA319Bc7Cc8F0829df39eC0FFF5D1E061FFadf7
0x2791dc5e14f7680d9d969acc26059ba56403b6d5,0xe92936fb65f81439e092313e0444a8455c0817a0d26d47ab8f7bf632404474b8,02-01-2025,2025-01-02 11:52:21.000 UTC,456,24514697,0xBDA319Bc7Cc8F0829df39eC0FFF5D1E061FFadf7
0x2791dc5e14f7680d9d969acc26059ba56403b6d5,0x1cab448a6a78846f592854be55a61c3e557e7bdd4287d410e07999c8e61e787e,09-03-2025,2025-03-09 05:02:11.000 UTC,139,27353592,0xCFede447ca3b4885720B5a327e3BFb02078f06e8
0x38f6d2d9ea493c3c6ee865b5b952b5fe9e3e61fc,0x22f965600129caa37010276b54a69eaecbb8158ca64a36c0aa885eb533e0f4a4,02-01-2025,2025-01-02 13:00:49.000 UTC,280,24516751,0xBDA319Bc7Cc8F0829df39eC0FFF5D1E061FFadf7
0x2791dc5e14f7680d9d969acc26059ba56403b6d5,0x42f910b0b38a5f3feb5c2a947da974da443dd469b45a96a7f1d5eebc9c8a1676,18-01-2025,2025-01-18 22:18:47.000 UTC,139,25224690,0xCFede447ca3b4885720B5a327e3BFb02078f06e8
0x38f6d2d9ea493c3c6ee865b5b952b5fe9e3e61fc,0x9c1b52b0dda73e337c9aae9545f270375faa0279587f2a8923d32962e0c701b4,04-01-2025,2025-01-04 13:27:21.000 UTC,384,24603947,0x0e956C897bBFCbd2155D3DfdD27c87fa5A0FaD39
0x2791dc5e14f7680d9d969acc26059ba56403b6d5,0x0382ecc6b18717810ae03eb5c7a59c954dc682056fca07a2e8cfc9770d38bbba,12-12-2024,2024-12-12 06:08:13.000 UTC,438,23597173,0xBDA319Bc7Cc8F0829df39eC0FFF5D1E061FFadf7
0xdc98dbffcc648d6088a2ff8f7dc01aef050e58fc,0x7694321ca34a3811de77a5549d9675f44f67d1ffefbbc486d8506c918efbcd6e,12-01-2025,2025-01-12 02:36:07.000 UTC,323,24930010,0x869305781fff479f0311974d55FeeB6Fc9DE96a2
0x9eb86e93a809a41ab0e7cc0ba6f62561fda3015c,0x88b6f969d542055a4aa2c5a7fda0c65382f6a7bbcfcdd3a9fdb52b4bfc109bb7,28-02-2025,2025-02-28 09:49:03.000 UTC,138,26973398,0x6399ed6725cC163D019aA64FF55b22149D7179A8
0x8fd1b615c006ebeb8a7cfb00a1dd809f31943b08,0xeb3799f198baa5ec03d7b558e8b350ebf7b6fedc1e3acc964ed704025bf108e8,05-03-2025,2025-03-05 06:34:07.000 UTC,239,27183550,0xf2c38dE50A250C0060fB45eBE4504B67f6F1be3C
0x9eb86e93a809a41ab0e7cc0ba6f62561fda3015c,0x903eb2d6aac0b35f8303f4e2cf20f981b0d37fd50987192e983ae047b5245948,10-12-2024,2024-12-10 01:50:13.000 UTC,388,23503033,0xCFede447ca3b4885720B5a327e3BFb02078f06e8
0x2791dc5e14f7680d9d969acc26059ba56403b6d5,0x432327110dd3a6c02446ae8d4882c05027e91e4075895748f354f762b33706bc,13-12-2024,2024-12-13 09:55:45.000 UTC,390,23647199,0xBDA319Bc7Cc8F0829df39eC0FFF5D1E061FFadf7
0x9eb86e93a809a41ab0e7cc0ba6f62561fda3015c,0x0589cb8074fd285e3a854fe01ef8ca1afd02c7f14a6571218da95d65ad34ca20,14-12-2024,2024-12-14 05:35:31.000 UTC,550,23682592,0xCFede447ca3b4885720B5a327e3BFb02078f06e8
0x8fd1b615c006ebeb8a7cfb00a1dd809f31943b08,0xffdddfd38d5c21aa11861a491d2636f1b48f8e43e2ea76cf5f2ea978299e2b0d,06-01-2025,2025-01-06 10:16:51.000 UTC,240,24684632,0xAfabcBbab5e4261B1d655c906738176191819164
0x8fd1b615c006ebeb8a7cfb00a1dd809f31943b08,0xd27efb2b9c0d4cf1d5e7ba4700a77e6391b802045335857bce24018e9b3b57a1,28-12-2024,2024-12-28 07:22:13.000 UTC,435,24290593,0xBDA319Bc7Cc8F0829df39eC0FFF5D1E061FFadf7
0x2791dc5e14f7680d9d969acc26059ba56403b6d5,0x922b9a37c99b3684885f7077b4ac63f963874724b3df5952900cabbb84d0bc37,15-12-2024,2024-12-15 03:10:59.000 UTC,98,23721456,0x0e956C897bBFCbd2155D3DfdD27c87fa5A0FaD39
0x2791dc5e14f7680d9d969acc26059ba56403b6d5,0x1f3f434f475bc03b1dd0939d78f59d278d59ff5b8faadc1d042a5f1cb8f21a03,08-01-2025,2025-01-08 02:27:17.000 UTC,414,24756945,0x869305781fff479f0311974d55FeeB6Fc9DE96a2
0x8508fd4238162cb3f3d485f432202af3b40f164e,0x085852a2df0233ba36d46ad739ebaf23f01ad85d33cd8839f07fa6e949aa285c,01-06-2025,2025-06-01 21:54:09.000 UTC,637,31012751,0xc3f97660D0b47F0E05C3c513f73eeff7c1bd6c7a
0x2791dc5e14f7680d9d969acc26059ba56403b6d5,0x2d1b329a59a1ba56465b08091751ccede33c8f947454c38cb96e66775e2793f2,09-01-2025,2025-01-09 00:27:49.000 UTC,248,24796561,0xBDA319Bc7Cc8F0829df39eC0FFF5D1E061FFadf7
0x9eb86e93a809a41ab0e7cc0ba6f62561fda3015c,0x15956ab2165272ac6345612d650edc101e933b72b7dc91d3a397bff42778df63,31-05-2025,2025-05-31 02:52:13.000 UTC,1265,30935293,0xCFede447ca3b4885720B5a327e3BFb02078f06e8
0xdc98dbffcc648d6088a2ff8f7dc01aef050e58fc,0x74ed896cc6067a8574f27a75f22dc56dd52ecf0f52aba745fc4762e30d73c9b0,02-01-2025,2025-01-02 08:30:35.000 UTC,383,24508644,0xBDA319Bc7Cc8F0829df39eC0FFF5D1E061FFadf7
0x9eb86e93a809a41ab0e7cc0ba6f62561fda3015c,0xdea17f2995596c027168dff4ee3d2097c6a234ba28df6935467874feffd82329,12-07-2025,2025-07-12 01:14:59.000 UTC,251,32746776,0xCFede447ca3b4885720B5a327e3BFb02078f06e8
0x2791dc5e14f7680d9d969acc26059ba56403b6d5,0xd514dd3909aa700097965d2be2928e9146ab1f8301e853eaa31f37cb5d089c0d,08-01-2025,2025-01-08 14:20:45.000 UTC,197,24778349,0xBDA319Bc7Cc8F0829df39eC0FFF5D1E061FFadf7
0x2791dc5e14f7680d9d969acc26059ba56403b6d5,0x4e5363b1d757f79f29301ce8095ec43b22109ed8d34bb3e24a1a00ac5dc482fd,29-12-2024,2024-12-29 04:28:43.000 UTC,176,24328588,0xBDA319Bc7Cc8F0829df39eC0FFF5D1E061FFadf7
0xdc98dbffcc648d6088a2ff8f7dc01aef050e58fc,0xd7b606296a0a614a662d869d667d0e33cc6e051e3793bff652e785ebd5eaec12,16-01-2025,2025-01-16 00:24:07.000 UTC,530,25098850,0x0e956C897bBFCbd2155D3DfdD27c87fa5A0FaD39
0x8508fd4238162cb3f3d485f432202af3b40f164e,0x44fc1379723fd1013e50243a24cc7a51403b8b3fa6b4d8d2a54b66ead106137d,12-03-2025,2025-03-12 19:44:53.000 UTC,286,27509673,0x2B74B62c564456C48055bd515A62594742b3f545
0x095d0de0ecfd6832f1a7961ae26d285d68655d60,0xa53760b973899b4f4ca77815cdc42962edea588f2a7233d58bdd9555d1de6855,29-03-2025,2025-03-29 11:07:47.000 UTC,203,28228560,0x0e956C897bBFCbd2155D3DfdD27c87fa5A0FaD39
0x2791dc5e14f7680d9d969acc26059ba56403b6d5,0x2509ae4ec963b1fbfd7d4695184ab674f9b8b910a83bc0a597064b444cf1db95,30-12-2024,2024-12-30 08:42:17.000 UTC,317,24379395,0xBDA319Bc7Cc8F0829df39eC0FFF5D1E061FFadf7
0xdc98dbffcc648d6088a2ff8f7dc01aef050e58fc,0x72dc457486a1c2c1dc05e814902a859ef200403cdf646649c07bcc2094077334,15-12-2024,2024-12-15 19:08:15.000 UTC,206,23750174,0xCFede447ca3b4885720B5a327e3BFb02078f06e8
0x9eb86e93a809a41ab0e7cc0ba6f62561fda3015c,0xea73ad93f8d6e1b92a7e3494196f3f0cd4e8446ba4543c5e7b2a28e3165ee420,03-01-2025,2025-01-03 18:40:49.000 UTC,1014,24570151,0xBDA319Bc7Cc8F0829df39eC0FFF5D1E061FFadf7
0x2791dc5e14f7680d9d969acc26059ba56403b6d5,0xbc8cfb59ca0d642bbb76c67a775279412509fc5894288bbaacda148993338da4,23-01-2025,2025-01-23 00:45:11.000 UTC,425,25401882,0x0e956C897bBFCbd2155D3DfdD27c87fa5A0FaD39
0x2791dc5e14f7680d9d969acc26059ba56403b6d5,0x01cea6e92b447786b47379f64a03a7e40c0c83f2cf117ef01293447e564dbdf7,23-12-2024,2024-12-23 14:25:19.000 UTC,636,24087286,0xBDA319Bc7Cc8F0829df39eC0FFF5D1E061FFadf7
0xdc98dbffcc648d6088a2ff8f7dc01aef050e58fc,0xb58f9637a88980373610e605303cf108574c2df722188cff80aa734fd2d78bbb,14-01-2025,2025-01-14 19:34:55.000 UTC,258,25046974,0xCFede447ca3b4885720B5a327e3BFb02078f06e8
0x9eb86e93a809a41ab0e7cc0ba6f62561fda3015c,0x077d4d61448b22391ac6fbc8ea5b7c6d336840bea365e5cdb5580f82cd2c6746,19-12-2024,2024-12-19 02:46:49.000 UTC,342,23893531,0xBDA319Bc7Cc8F0829df39eC0FFF5D1E061FFadf7
0x9eb86e93a809a41ab0e7cc0ba6f62561fda3015c,0x3cf52f1df4defb9e6d3e1bc27815b80758287c0df4eea5490e3961b9a23a4d1e,09-01-2025,2025-01-09 01:41:11.000 UTC,360,24798762,0xC23924a846eca931Ec3014253E94f15b038bd0C8
0x8fd1b615c006ebeb8a7cfb00a1dd809f31943b08,0x73ea485921223eb449481202feb7c02e10f28c4aadc2d59683c9c680a8ea624c,11-12-2024,2024-12-11 22:05:59.000 UTC,326,23582706,0xBDA319Bc7Cc8F0829df39eC0FFF5D1E061FFadf7
0xdc98dbffcc648d6088a2ff8f7dc01aef050e58fc,0xd15a608f480a9f00a6a5d735c8a240334d948d7db64b73ce14a3ef3557e53308,02-01-2025,2025-01-02 00:04:51.000 UTC,396,24493472,0x0e956C897bBFCbd2155D3DfdD27c87fa5A0FaD39
0x9eb86e93a809a41ab0e7cc0ba6f62561fda3015c,0x8c2c0512775923f3e018850dd7d8f8eb16f29f891efa66884c142b1a74ad6750,27-05-2025,2025-05-27 09:02:57.000 UTC,436,30773615,0xc3f97660D0b47F0E05C3c513f73eeff7c1bd6c7a
0x2791dc5e14f7680d9d969acc26059ba56403b6d5,0x49fd99d3e6c721084ba4f82fc8c74b179376f5b5bc2bc48c33315589dcafca6c,14-01-2025,2025-01-14 19:00:45.000 UTC,339,25045949,0x869305781fff479f0311974d55FeeB6Fc9DE96a2
0xdc98dbffcc648d6088a2ff8f7dc01aef050e58fc,0xeeee59b4f36d24e111159a743de1268eb15ddc71c51d59cb18b1fd04781749f1,29-05-2025,2025-05-29 01:30:13.000 UTC,638,30846433,0xc3f97660D0b47F0E05C3c513f73eeff7c1bd6c7a
0xdc98dbffcc648d6088a2ff8f7dc01aef050e58fc,0x35e5ff177a9b4e58d148d92ea1b0daddd135d47c04efedf960f578d688dcbcce,18-12-2024,2024-12-18 21:46:55.000 UTC,366,23884534,0xBDA319Bc7Cc8F0829df39eC0FFF5D1E061FFadf7
0x8fd1b615c006ebeb8a7cfb00a1dd809f31943b08,0x3cf6508945c03a9fceb13ee1744d882fb011bebcbc48c2c5053e08c81e07a50c,03-01-2025,2025-01-03 20:19:57.000 UTC,502,24573125,0xBDA319Bc7Cc8F0829df39eC0FFF5D1E061FFadf7
0x38f6d2d9ea493c3c6ee865b5b952b5fe9e3e61fc,0x833287bfdee6c1bd06fe143ff220d5fa3d3ca42201c9d7ae02338f0bda45ecd9,24-12-2024,2024-12-24 15:07:07.000 UTC,443,24131740,0xCFede447ca3b4885720B5a327e3BFb02078f06e8
0x9eb86e93a809a41ab0e7cc0ba6f62561fda3015c,0xb60878344acc440bda8ab4bcb32651efc5665f19d9fce4bc0f693a7befea019c,30-05-2025,2025-05-30 10:24:05.000 UTC,389,30905649,0xc3f97660D0b47F0E05C3c513f73eeff7c1bd6c7a
0x351f61e4c49cf11f24d9f2e737ca5eff81806355,0x02ee7c44608004c15be2b8cd6802f570065891d2cb567eee87eb43e3bf8f7726,22-08-2025,2025-08-22 00:58:37.000 UTC,289,34517485,0x0e956C897bBFCbd2155D3DfdD27c87fa5A0FaD39
0x38f6d2d9ea493c3c6ee865b5b952b5fe9e3e61fc,0xe6fdced48f8313e70bf5b6613d61a7cfb5ab59b3701afa6e5568b831bf94c51b,22-05-2025,2025-05-22 05:47:33.000 UTC,710,30551753,0xc3f97660D0b47F0E05C3c513f73eeff7c1bd6c7a
0x351f61e4c49cf11f24d9f2e737ca5eff81806355,0x691199c2d7dbddd189654de1d6b3bc7384a2b10476a298d6941ed544f1aa6cdc,04-09-2025,2025-09-04 03:08:29.000 UTC,251,35082981,0x0e956C897bBFCbd2155D3DfdD27c87fa5A0FaD39
0x38f6d2d9ea493c3c6ee865b5b952b5fe9e3e61fc,0x8d22784a97157317c23c64bebc942e1100c308b87641f9f44c391f75fe929de3,11-05-2025,2025-05-11 00:58:31.000 UTC,41,30067882,0xf2c38dE50A250C0060fB45eBE4504B67f6F1be3C
0x8fd1b615c006ebeb8a7cfb00a1dd809f31943b08,0x4cf4ff1214ab436fda227b66cae6423b9f316b48021777cebaab650bf2c69957,04-01-2025,2025-01-04 23:23:41.000 UTC,413,24621837,0xAfabcBbab5e4261B1d655c906738176191819164
0xdc98dbffcc648d6088a2ff8f7dc01aef050e58fc,0x3645214e0af9adc0d13648f46fa996b05f14fb205a2761d6381fc28baaa92d87,07-07-2025,2025-07-07 15:33:11.000 UTC,457,32556522,0xf2c38dE50A250C0060fB45eBE4504B67f6F1be3C
0x2791dc5e14f7680d9d969acc26059ba56403b6d5,0xb270d6f44c65308be429fa6c7cd64f37a7c1bd3b0dba8869a59bfb02dd297fe1,29-12-2024,2024-12-29 22:29:17.000 UTC,329,24361005,0xBDA319Bc7Cc8F0829df39eC0FFF5D1E061FFadf7
0x9eb86e93a809a41ab0e7cc0ba6f62561fda3015c,0x5e5dad79f3cb0aeb533d7ef2cd9de285baef3ff1730bb23940937827e57e6214,30-01-2025,2025-01-30 14:03:59.000 UTC,322,25728246,0xB9E4E0368A9F281584C9adB685e6C9F4b9F37dBb
0x8fd1b615c006ebeb8a7cfb00a1dd809f31943b08,0x44f2fba0aaa0993a8e2333dca199abade13516c1d9b135d32315b28896548aa6,10-01-2025,2025-01-10 18:14:23.000 UTC,356,24871758,0xBDA319Bc7Cc8F0829df39eC0FFF5D1E061FFadf7
0x9eb86e93a809a41ab0e7cc0ba6f62561fda3015c,0xd12e16c56a2daedbfa49fa6178158b8175c9d075751681302d872aaff13783fc,10-06-2025,2025-06-10 16:18:41.000 UTC,467,31391487,0xc3f97660D0b47F0E05C3c513f73eeff7c1bd6c7a
0x8fd1b615c006ebeb8a7cfb00a1dd809f31943b08,0x169de59615c0e39ad7dec64c178d212f1822ec741fad2dc2598ec71c50705ca6,17-06-2025,2025-06-17 11:22:41.000 UTC,710,31685007,0xf2c38dE50A250C0060fB45eBE4504B67f6F1be3C
0x9eb86e93a809a41ab0e7cc0ba6f62561fda3015c,0x2226fcd577d9c0ea1dd18e25380067a5b2e566058263dccd2d87c6a21f7759a0,09-01-2025,2025-01-09 02:54:21.000 UTC,217,24800957,0xB9E4E0368A9F281584C9adB685e6C9F4b9F37dBb
0x8508fd4238162cb3f3d485f432202af3b40f164e,0xf0d13228a3bbba5d439c995c133421e2efde1474c476a79fd5fb4fa0c756d67e,22-04-2025,2025-04-22 13:48:59.000 UTC,366,29270196,0x2B74B62c564456C48055bd515A62594742b3f545
0x2791dc5e14f7680d9d969acc26059ba56403b6d5,0x2e51c4d58a8b1e0d6e92754c77805baaaa1574aaa82b4634ac9cd87b5d904a33,14-12-2024,2024-12-14 10:58:23.000 UTC,797,23692278,0xBDA319Bc7Cc8F0829df39eC0FFF5D1E061FFadf7
0xdc98dbffcc648d6088a2ff8f7dc01aef050e58fc,0x79bfb270dee334689dacd3c7a5e11df1f44062c330879751f3c925bc5fcfbb35,02-01-2025,2025-01-02 22:34:57.000 UTC,388,24533975,0x869305781fff479f0311974d55FeeB6Fc9DE96a2
0x8508fd4238162cb3f3d485f432202af3b40f164e,0x9bc629153cdd31ad85e8dd49b350e5c654824a74dbc731260610a60eb83a165f,06-06-2025,2025-06-06 07:16:01.000 UTC,533,31202407,0xc3f97660D0b47F0E05C3c513f73eeff7c1bd6c7a
0x9eb86e93a809a41ab0e7cc0ba6f62561fda3015c,0xc6071072d71be45eb361dfe5413851ecd9718e30e7c4ee4001cbd3e2fd038f2d,23-12-2024,2024-12-23 04:17:37.000 UTC,363,24069055,0xBDA319Bc7Cc8F0829df39eC0FFF5D1E061FFadf7
0x8fd1b615c006ebeb8a7cfb00a1dd809f31943b08,0x1280d63d8de8db4c9427966960f7195f62d061378ce9b3ac92b7fab641400023,10-12-2024,2024-12-10 02:55:03.000 UTC,322,23504978,0xBDA319Bc7Cc8F0829df39eC0FFF5D1E061FFadf7
0x2791dc5e14f7680d9d969acc26059ba56403b6d5,0x3ed8bb13518a5e45132cc2cc421729e7d7108bfa21083a73251c33a26784b908,04-01-2025,2025-01-04 11:15:09.000 UTC,389,24599981,0xBDA319Bc7Cc8F0829df39eC0FFF5D1E061FFadf7
0x38f6d2d9ea493c3c6ee865b5b952b5fe9e3e61fc,0x301eeaab79eaf1e335d60484eac320116ef77cff093548e7afc7a9af3dfbe834,01-06-2025,2025-06-01 05:04:23.000 UTC,61,30982458,0xc3f97660D0b47F0E05C3c513f73eeff7c1bd6c7a
0x9eb86e93a809a41ab0e7cc0ba6f62561fda3015c,0xc9ea513a1f427efbdcd0185c80cd2ee8d883662ff59dda44459c0e31ec91f7c2,04-01-2025,2025-01-04 04:44:49.000 UTC,289,24588271,0xBDA319Bc7Cc8F0829df39eC0FFF5D1E061FFadf7
0x38f6d2d9ea493c3c6ee865b5b952b5fe9e3e61fc,0x2ea05e99541b52b7e69ab77a02c5b1520cea935450be5590b495abbeff1460bc,01-01-2025,2025-01-01 05:08:19.000 UTC,231,24459376,0xCFede447ca3b4885720B5a327e3BFb02078f06e8
0x38f6d2d9ea493c3c6ee865b5b952b5fe9e3e61fc,0x8f910146a3767e2e14bb7733597bf1f2c5aec7e68412b550530491fc8c9acc05,20-01-2025,2025-01-20 01:50:45.000 UTC,408,25274249,0xCFede447ca3b4885720B5a327e3BFb02078f06e8
0x2791dc5e14f7680d9d969acc26059ba56403b6d5,0x970800667b19dd6e7de6915f3be5bf7423bffdbad4d6c388635cf18087a94f27,06-01-2025,2025-01-06 15:20:35.000 UTC,557,24693744,0xB9E4E0368A9F281584C9adB685e6C9F4b9F37dBb
0x38f6d2d9ea493c3c6ee865b5b952b5fe9e3e61fc,0x44086534a7627284441413417574ff3517da1295f477b19851420871f6be00f1,13-01-2025,2025-01-13 21:20:19.000 UTC,514,25006936,0x869305781fff479f0311974d55FeeB6Fc9DE96a2
0x38f6d2d9ea493c3c6ee865b5b952b5fe9e3e61fc,0x4b4e6f2271aea3e2bf2653808de0f3c1f32e9e9b64fe057798273ea04a02ed45,10-06-2025,2025-06-10 22:44:45.000 UTC,361,31403069,0xCFede447ca3b4885720B5a327e3BFb02078f06e8
0x8508fd4238162cb3f3d485f432202af3b40f164e,0x952b64fb708cc31fbf44c59e9302b7d8c6c038bd15efec59f9df135301c41c53,24-04-2025,2025-04-24 15:40:45.000 UTC,1212,29359949,0x869305781fff479f0311974d55FeeB6Fc9DE96a2
0x8fd1b615c006ebeb8a7cfb00a1dd809f31943b08,0x75e200769294551306e0c44e410728b0bdecf0606fde9670e4e243b1273f8dcd,27-12-2024,2024-12-27 12:28:27.000 UTC,424,24256580,0xBDA319Bc7Cc8F0829df39eC0FFF5D1E061FFadf7
0xdc98dbffcc648d6088a2ff8f7dc01aef050e58fc,0x3b3f1884a18bb0c4d8128f3aaf928cd510b64797b39a95d8cb6d04e5e85d39c8,09-01-2025,2025-01-09 06:53:29.000 UTC,3258,24808131,0x0e956C897bBFCbd2155D3DfdD27c87fa5A0FaD39
0x8508fd4238162cb3f3d485f432202af3b40f164e,0x94c1f2a4d3bc92d86373259988dacce6e963a6191066cf497cdac2a55a03f825,09-06-2025,2025-06-09 16:15:51.000 UTC,432,31348202,0xc3f97660D0b47F0E05C3c513f73eeff7c1bd6c7a
0x9eb86e93a809a41ab0e7cc0ba6f62561fda3015c,0x08f8db9f3fefdeb3a082e549559aab397b6bd01963faa194be2084885f357d87,05-01-2025,2025-01-05 03:07:39.000 UTC,259,24628556,0x869305781fff479f0311974d55FeeB6Fc9DE96a2
0x351f61e4c49cf11f24d9f2e737ca5eff81806355,0x13953df1097e3334dcc778f52fbc44a2bcd81d634aa16652af591ece1c69a095,05-09-2025,2025-09-05 06:06:29.000 UTC,383,35131521,0x0e956C897bBFCbd2155D3DfdD27c87fa5A0FaD39
0x2791dc5e14f7680d9d969acc26059ba56403b6d5,0xe39d75a30a85eaead1c453c81a5793761278a62e338aeedea59d6de673652dc5,11-01-2025,2025-01-11 08:19:37.000 UTC,252,24897115,0xBDA319Bc7Cc8F0829df39eC0FFF5D1E061FFadf7
0x9eb86e93a809a41ab0e7cc0ba6f62561fda3015c,0xfa336177f983832541aabf330c60609e082f9055458ffc2d189596b6b06bda23,08-02-2025,2025-02-08 14:10:09.000 UTC,366,26117231,0xB9E4E0368A9F281584C9adB685e6C9F4b9F37dBb
0x9eb86e93a809a41ab0e7cc0ba6f62561fda3015c,0x38631d669a578393049f9e65916273c49e84f700e2ef3d81d938c1f080817045,02-06-2025,2025-06-02 02:43:37.000 UTC,204,31021435,0xc3f97660D0b47F0E05C3c513f73eeff7c1bd6c7a
0x8fd1b615c006ebeb8a7cfb00a1dd809f31943b08,0xcfe7a14a5ca3bd66efa04f053adc5c37a3003e32834fe81afbc5eb8fb310a65b,01-01-2025,2025-01-01 00:16:27.000 UTC,225,24450620,0xCFede447ca3b4885720B5a327e3BFb02078f06e8
0xdc98dbffcc648d6088a2ff8f7dc01aef050e58fc,0xfb051fdcf2cd90ecb3afea005687991b94cfe011637df0c66d511e913697758f,07-01-2025,2025-01-07 01:32:49.000 UTC,418,24712111,0xB9E4E0368A9F281584C9adB685e6C9F4b9F37dBb
0x9eb86e93a809a41ab0e7cc0ba6f62561fda3015c,0x2d4a5435dd57e523a4b383f85d2fc34b27787383f49c1d33b1b715bd46b682fa,21-05-2025,2025-05-21 10:26:01.000 UTC,775,30516907,0xc3f97660D0b47F0E05C3c513f73eeff7c1bd6c7a
0x8508fd4238162cb3f3d485f432202af3b40f164e,0xf0853ca9d7352a2010bcfacbcf8cab463530591baea64a1abcc7b994b9ab0461,10-06-2025,2025-06-10 17:23:47.000 UTC,3342,31393440,0xc3f97660D0b47F0E05C3c513f73eeff7c1bd6c7a
0x2791dc5e14f7680d9d969acc26059ba56403b6d5,0xd99b147638458aabff5fe974b44f74661b256317c5e13f63674baa2d77f9c76e,03-01-2025,2025-01-03 03:40:47.000 UTC,379,24543150,0x0e956C897bBFCbd2155D3DfdD27c87fa5A0FaD39
0x2791dc5e14f7680d9d969acc26059ba56403b6d5,0x4b09eea8940150ef1fe9d34cae6491d1d142f1c923e8d8e4c1f0b6ddff2fa9a4,10-01-2025,2025-01-10 11:35:31.000 UTC,356,24859792,0xBDA319Bc7Cc8F0829df39eC0FFF5D1E061FFadf7
0x9eb86e93a809a41ab0e7cc0ba6f62561fda3015c,0xd7077a55f2a2f309d6d36f38ad225428cf7705db147fd3004e0a5ab05ed9bfce,14-05-2025,2025-05-14 19:46:55.000 UTC,109,30231334,0xc3f97660D0b47F0E05C3c513f73eeff7c1bd6c7a
0xdc98dbffcc648d6088a2ff8f7dc01aef050e58fc,0x63884ffbb22fa16dddf4243e72cefc1aa632ca489f159960a2b823068e15e006,18-07-2025,2025-07-18 02:50:33.000 UTC,841,33008843,0x430C09546ae9249AB75B9A4ef7B5FD9a4006D6f3
0x2791dc5e14f7680d9d969acc26059ba56403b6d5,0xbcc81f0303d0df94226b22e8bc9b34caabfd9a7ae5c508ebc560447b63b5bbcc,16-12-2024,2024-12-16 10:29:41.000 UTC,259,23777817,0xBDA319Bc7Cc8F0829df39eC0FFF5D1E061FFadf7
0x8508fd4238162cb3f3d485f432202af3b40f164e,0xee78407cc0458b960614aa618e04b03f964d7a5497867d58c47d8b94898be9bf,05-06-2025,2025-06-05 08:01:19.000 UTC,337,31160566,0xc3f97660D0b47F0E05C3c513f73eeff7c1bd6c7a
0x9eb86e93a809a41ab0e7cc0ba6f62561fda3015c,0xe5fda692acc251bb4cba9ffc40d9a4f4c65bc2a912dfc37233518c88148b3f9e,03-06-2025,2025-06-03 12:38:49.000 UTC,551,31082491,0xc3f97660D0b47F0E05C3c513f73eeff7c1bd6c7a
0x8810de2baa17067ddcfbd9e8f29c55f070a55f0b,0x668e2746bc89ae5b175f96820e2e17f6a4ce31ea12dd8bedd427eb41e6b03085,29-03-2025,2025-03-29 11:07:21.000 UTC,209,28228547,0x0e956C897bBFCbd2155D3DfdD27c87fa5A0FaD39
0x9eb86e93a809a41ab0e7cc0ba6f62561fda3015c,0xea29999f73ae2d1a63429e8d5814569deb63475997dca8e330e2d42e823c8308,04-01-2025,2025-01-04 06:46:23.000 UTC,268,24591918,0x869305781fff479f0311974d55FeeB6Fc9DE96a2
0xdc98dbffcc648d6088a2ff8f7dc01aef050e58fc,0x6745c741865f59b8d5892ae86b9d18d0acbe43c69c63553b0e13a2bdfe2887a0,09-01-2025,2025-01-09 04:10:45.000 UTC,253,24803249,0xB9E4E0368A9F281584C9adB685e6C9F4b9F37dBb
0x8508fd4238162cb3f3d485f432202af3b40f164e,0xf5a376cb5f4579b6c6b853617060022fc1b5d1dd623231e65ec59b763f5f1335,22-06-2025,2025-06-22 01:21:37.000 UTC,197,31882975,0x6205DfbE68444cFF504A20a712cEa794c6b6Cf04
0x8fd1b615c006ebeb8a7cfb00a1dd809f31943b08,0xcc84d470410a2146661976bb1f8b331625f1be4979f32963e1603ad0d2898151,17-12-2024,2024-12-17 18:49:05.000 UTC,377,23835999,0xBDA319Bc7Cc8F0829df39eC0FFF5D1E061FFadf7
0x2791dc5e14f7680d9d969acc26059ba56403b6d5,0x9fd53d478af8d38e772d830794f8f52ffe9ae2c7699edd1e36435131f53baa6e,04-07-2025,2025-07-04 22:47:49.000 UTC,658,32439961,0xf2c38dE50A250C0060fB45eBE4504B67f6F1be3C
0x8fd1b615c006ebeb8a7cfb00a1dd809f31943b08,0xc1ef3cd184679795994ee11629cb498368c0c0d7bbdee63fee992c66d4a747a2,12-12-2024,2024-12-12 22:37:43.000 UTC,388,23626858,0xCFede447ca3b4885720B5a327e3BFb02078f06e8
0x38f6d2d9ea493c3c6ee865b5b952b5fe9e3e61fc,0xfa109bc4a8314ce646554e762b0469c008c0cac2483faaae1a1d7b5e4e262a04,01-01-2025,2025-01-01 23:25:21.000 UTC,268,24492287,0x869305781fff479f0311974d55FeeB6Fc9DE96a2
0xdc98dbffcc648d6088a2ff8f7dc01aef050e58fc,0xe5bf7218f88956b297dbcdd1c36802ebb49029bca6773d32fe5f66a6bfc873c0,12-01-2025,2025-01-12 04:48:03.000 UTC,308,24933968,0xB9E4E0368A9F281584C9adB685e6C9F4b9F37dBb
0x38f6d2d9ea493c3c6ee865b5b952b5fe9e3e61fc,0x4b78bd1c5e37736969c52ae232314892527596bc56a332b66ce954e437a878b2,04-01-2025,2025-01-04 05:40:45.000 UTC,1018,24589949,0xBDA319Bc7Cc8F0829df39eC0FFF5D1E061FFadf7
0x8fd1b615c006ebeb8a7cfb00a1dd809f31943b08,0xb0046588fc3aede689a302007d5999244136d9486f022b39a4d915b730ff89a0,01-01-2025,2025-01-01 21:47:19.000 UTC,373,24489346,0xBDA319Bc7Cc8F0829df39eC0FFF5D1E061FFadf7
0x8fd1b615c006ebeb8a7cfb00a1dd809f31943b08,0xd72c4ff3e9b1fc132bad8fb66fe169bf07e91cc0f79fc4473479f9103f6e3f27,21-12-2024,2024-12-21 00:23:29.000 UTC,430,23975631,0xBDA319Bc7Cc8F0829df39eC0FFF5D1E061FFadf7
0x9eb86e93a809a41ab0e7cc0ba6f62561fda3015c,0x9fd1a303030ad6b525ead0fcd4de9a6509b15d26491b28b4e52967d849d643c6,28-02-2025,2025-02-28 20:20:53.000 UTC,303,26992353,0x6399ed6725cC163D019aA64FF55b22149D7179A8
0x2791dc5e14f7680d9d969acc26059ba56403b6d5,0x5fd1f3607efc8daf8530ef74ac6bad70bfc5caa0734117a176bb65588997355d,22-12-2024,2024-12-22 10:22:59.000 UTC,310,24036816,0xBDA319Bc7Cc8F0829df39eC0FFF5D1E061FFadf7
0x8508fd4238162cb3f3d485f432202af3b40f164e,0x32a84d97682d96862018aecc183a05f15f452937cf874dd5c78d45436688d0ad,30-04-2025,2025-04-30 21:46:43.000 UTC,443,29630128,0x6205DfbE68444cFF504A20a712cEa794c6b6Cf04
0xdc98dbffcc648d6088a2ff8f7dc01aef050e58fc,0xf4dec52cd77c3cb4c665ca0cb76f38d3d2827e8d05b8e996fa931024c67eb56e,16-12-2024,2024-12-16 00:59:37.000 UTC,544,23760715,0xCFede447ca3b4885720B5a327e3BFb02078f06e8
0xdc98dbffcc648d6088a2ff8f7dc01aef050e58fc,0xf05be9e915f843d2853a173a797ba7accaa7cc52d8ac945e8edd8fa46713f2b1,31-12-2024,2024-12-31 13:49:31.000 UTC,418,24431812,0x869305781fff479f0311974d55FeeB6Fc9DE96a2
0xdc98dbffcc648d6088a2ff8f7dc01aef050e58fc,0xfd1111828d7fc7620d5ee6fb0ba981b890406fb8d9f62b15a70c1a3dc2df0460,08-01-2025,2025-01-08 23:16:51.000 UTC,547,24794432,0xBDA319Bc7Cc8F0829df39eC0FFF5D1E061FFadf7
0x095d0de0ecfd6832f1a7961ae26d285d68655d60,0x42d813c5f98ac0394b9fc39e161cb86c9bf8b25f8925deee08238433a3c66092,18-03-2025,2025-03-18 19:27:33.000 UTC,242,27768353,0x869305781fff479f0311974d55FeeB6Fc9DE96a2
0x38f6d2d9ea493c3c6ee865b5b952b5fe9e3e61fc,0x59d082a8be76eb408f660f5743982d96be0ccb4f4ac5bafec205f1a0e320f088,02-01-2025,2025-01-02 13:50:01.000 UTC,516,24518227,0x0e956C897bBFCbd2155D3DfdD27c87fa5A0FaD39
0x9eb86e93a809a41ab0e7cc0ba6f62561fda3015c,0x1dc071c15adede7b4841e7ff0d06fae8c9d803717fbea0367d5b309fd087b0c7,21-02-2025,2025-02-21 00:56:19.000 UTC,365,26655016,0x6399ed6725cC163D019aA64FF55b22149D7179A8
0xdc98dbffcc648d6088a2ff8f7dc01aef050e58fc,0xf860a6087074c85ad14611a28cbd782621cbf1022ef289f5c09e20d72540a07b,27-05-2025,2025-05-27 03:43:47.000 UTC,228,30764040,0xc3f97660D0b47F0E05C3c513f73eeff7c1bd6c7a
0x38f6d2d9ea493c3c6ee865b5b952b5fe9e3e61fc,0x7a527d5999e53e917e63bc41f92c8b0c51b72a367073ede823eb9221e1ea7437,19-06-2025,2025-06-19 17:20:23.000 UTC,452,31782138,0xc3f97660D0b47F0E05C3c513f73eeff7c1bd6c7a
0x9eb86e93a809a41ab0e7cc0ba6f62561fda3015c,0x3fb285e19676b1147fc9db905911712a11e8390bb7c92de2902ba5ab7b00f526,23-02-2025,2025-02-23 10:41:41.000 UTC,3238,26758977,0x6399ed6725cC163D019aA64FF55b22149D7179A8
0x8508fd4238162cb3f3d485f432202af3b40f164e,0xf74282e7f6434b70d6cc40719e17a7ceb8d6eb8ee7f84b9ba34cebb4c937262d,02-04-2025,2025-04-02 01:03:33.000 UTC,428,28383233,0x2B74B62c564456C48055bd515A62594742b3f545
0x8508fd4238162cb3f3d485f432202af3b40f164e,0x35a45837c42f619760ab9e1bf1f4abc1bffb235eabe85c19c1a4bb097a28c270,08-05-2025,2025-05-08 00:44:25.000 UTC,395,29937859,0x6205DfbE68444cFF504A20a712cEa794c6b6Cf04
0xdc98dbffcc648d6088a2ff8f7dc01aef050e58fc,0x2638c11f76bba89a3ffcbcb01b80a3dace1d3b606d95b22ba3a03f7f16c0ee01,29-12-2024,2024-12-29 20:41:51.000 UTC,363,24357782,0x0e956C897bBFCbd2155D3DfdD27c87fa5A0FaD39
0x8508fd4238162cb3f3d485f432202af3b40f164e,0x93cce2eddb56941605551a7f4bb7c88cbcffafc2981822936e0d3709f70ed807,10-03-2025,2025-03-10 20:02:13.000 UTC,189,27423793,0x2B74B62c564456C48055bd515A62594742b3f545
0x8fd1b615c006ebeb8a7cfb00a1dd809f31943b08,0x7da29d541b65ad4c9c4506a31c434e3e1edc582ff00bb7cbbc00ad2df30d9765,13-12-2024,2024-12-13 03:23:47.000 UTC,641,23635440,0xCFede447ca3b4885720B5a327e3BFb02078f06e8
0x9eb86e93a809a41ab0e7cc0ba6f62561fda3015c,0xb647e7b81ddfda429035440a14daa74c04a6d9c899082c01f8bf7e7b309f3b0f,16-06-2025,2025-06-16 05:31:27.000 UTC,2632,31631270,0xCFede447ca3b4885720B5a327e3BFb02078f06e8
0x9eb86e93a809a41ab0e7cc0ba6f62561fda3015c,0xb0e6f5485d1fda07a08ce70d2ae1de0ab9dce24bd09ed3b754563a24ceecbf78,15-12-2024,2024-12-15 16:12:17.000 UTC,10402,23744895,0xBDA319Bc7Cc8F0829df39eC0FFF5D1E061FFadf7
0x9eb86e93a809a41ab0e7cc0ba6f62561fda3015c,0x406d01092f35d07e41b3c86fe2e12f85415296ad49d27b18d41a6ee20a558098,10-12-2024,2024-12-10 14:20:59.000 UTC,381,23525556,0xBDA319Bc7Cc8F0829df39eC0FFF5D1E061FFadf7
0x8508fd4238162cb3f3d485f432202af3b40f164e,0x8c02c5f3790c7075cbab1090d71c6577f125bacc9f6aad5f20dff1b86ff2c4f7,11-07-2025,2025-07-11 11:10:41.000 UTC,578,32721447,0xc3f97660D0b47F0E05C3c513f73eeff7c1bd6c7a
0x9eb86e93a809a41ab0e7cc0ba6f62561fda3015c,0x118abe637d9049e0fb2a6957ca29b74dde1c5686d6dd16b068ea2b4bdbda698b,10-05-2025,2025-05-10 23:40:19.000 UTC,157,30065536,0xCFede447ca3b4885720B5a327e3BFb02078f06e8
0x9eb86e93a809a41ab0e7cc0ba6f62561fda3015c,0xed0b91426dd80994fc7f58d2a119d87a54cd9cb08f146e0bd380f7c9de6e2e4b,11-06-2025,2025-06-11 04:48:53.000 UTC,620,31413993,0xc3f97660D0b47F0E05C3c513f73eeff7c1bd6c7a
0xdc98dbffcc648d6088a2ff8f7dc01aef050e58fc,0x187381640a061caccdd7811741bb3653e2adf32beb775ec2ea4fe9375fe6650b,03-06-2025,2025-06-03 16:40:53.000 UTC,396,31089753,0xc3f97660D0b47F0E05C3c513f73eeff7c1bd6c7a
0x8810de2baa17067ddcfbd9e8f29c55f070a55f0b,0x53fdfae2b1916fc74c8ac98b02cdbb40c71498ada8ba3d0ab3e0bb718b0239c1,08-05-2025,2025-05-08 20:24:15.000 UTC,451,29973254,0x0e956C897bBFCbd2155D3DfdD27c87fa5A0FaD39
0x8508fd4238162cb3f3d485f432202af3b40f164e,0x360e871a588e7f54d7c745a07aea1ba2fc6db7cde52ee8b924a31f7a1fc4928f,22-06-2025,2025-06-22 04:47:33.000 UTC,321,31889153,0x6205DfbE68444cFF504A20a712cEa794c6b6Cf04
0xdc98dbffcc648d6088a2ff8f7dc01aef050e58fc,0x2e7b924f53d6031111586ec78dcdfb7f0230fafefad5af579291e6caef277a44,29-12-2024,2024-12-29 19:10:07.000 UTC,229,24355030,0x869305781fff479f0311974d55FeeB6Fc9DE96a2
0x9eb86e93a809a41ab0e7cc0ba6f62561fda3015c,0x987532bc5c3085a825ff8ec26199f2bf6cd2f215c7851be42474594c1d33cd9c,26-02-2025,2025-02-26 13:10:53.000 UTC,148,26893053,0x6399ed6725cC163D019aA64FF55b22149D7179A8
0x2791dc5e14f7680d9d969acc26059ba56403b6d5,0x71767250460066a65f8460a596b84482955e101d3b2609ef7db81f85560e6874,12-06-2025,2025-06-12 23:18:39.000 UTC,1472,31490486,0xCFede447ca3b4885720B5a327e3BFb02078f06e8
0x351f61e4c49cf11f24d9f2e737ca5eff81806355,0x1d43e10211deef7181c1dcb1ec7b13ff55a92e0796809f2143245b8b0103c5c4,04-11-2025,2025-11-04 23:33:37.000 UTC,251,37754935,0x0e956C897bBFCbd2155D3DfdD27c87fa5A0FaD39
0x9eb86e93a809a41ab0e7cc0ba6f62561fda3015c,0x4dfffff41e033f4d4bcb269da8913a6e9609694f948a76ecc8c92919229c066b,06-01-2025,2025-01-06 15:32:01.000 UTC,504,24694087,0x869305781fff479f0311974d55FeeB6Fc9DE96a2
0x095d0de0ecfd6832f1a7961ae26d285d68655d60,0xa0f6f96e22dfcc2bbd12d3aac2099a502dfdcb054d6ed12df92e80e9223eb686,25-03-2025,2025-03-25 01:08:23.000 UTC,639,28037778,0x869305781fff479f0311974d55FeeB6Fc9DE96a2
0x9eb86e93a809a41ab0e7cc0ba6f62561fda3015c,0x1b593aa3581fe59fcc8cbfb716d916e3e097f23b205fbf8ffc84d4004c0669bd,01-01-2025,2025-01-01 07:27:31.000 UTC,127,24463552,0xBDA319Bc7Cc8F0829df39eC0FFF5D1E061FFadf7
0xdc98dbffcc648d6088a2ff8f7dc01aef050e58fc,0xb106bdc3aaf96ff2eb65108326e5afeca3c0c8a8c25e1719f3670fe3a3536e4b,08-01-2025,2025-01-08 22:41:57.000 UTC,427,24793385,0xBDA319Bc7Cc8F0829df39eC0FFF5D1E061FFadf7
0x38f6d2d9ea493c3c6ee865b5b952b5fe9e3e61fc,0x40af9acee2bd553d533b9fec330fba5a0301d5f9a094f4eb21cafbee94bb3ef7,09-12-2024,2024-12-09 22:42:21.000 UTC,155,23497397,0x0e956C897bBFCbd2155D3DfdD27c87fa5A0FaD39
0x9eb86e93a809a41ab0e7cc0ba6f62561fda3015c,0x4208102bbf7defba0515f28b150fbd330e4d2e2113544a0a9ccd11b1b2a6b424,25-12-2024,2024-12-25 10:43:13.000 UTC,296,24167023,0xBDA319Bc7Cc8F0829df39eC0FFF5D1E061FFadf7
0xdc98dbffcc648d6088a2ff8f7dc01aef050e58fc,0x482fa379edd9ed2102269118471984a6777461691b197fe7c1e27be2280c7444,17-01-2025,2025-01-17 00:21:31.000 UTC,330,25141972,0xBDA319Bc7Cc8F0829df39eC0FFF5D1E061FFadf7
0x095d0de0ecfd6832f1a7961ae26d285d68655d60,0xf61150406e5691a36b019c4236a9129cbf6e6055916a6701c5d63741d2f72b67,24-04-2025,2025-04-24 16:07:05.000 UTC,538,29360739,0x869305781fff479f0311974d55FeeB6Fc9DE96a2
0x8508fd4238162cb3f3d485f432202af3b40f164e,0x9fcf17cc34d92fa739aebc9915184672c1bbfcb4abc3d4e85df60c7b41be1822,20-04-2025,2025-04-20 07:07:53.000 UTC,261,29171763,0x2B74B62c564456C48055bd515A62594742b3f545
0xdc98dbffcc648d6088a2ff8f7dc01aef050e58fc,0x851987b1e18ffcd8fc509350834e6d00d73667f2f93d1b5e78d0c4c3a7456db0,11-01-2025,2025-01-11 07:14:21.000 UTC,317,24895157,0xBDA319Bc7Cc8F0829df39eC0FFF5D1E061FFadf7
0x2791dc5e14f7680d9d969acc26059ba56403b6d5,0xac03d8b48fa8ce9ceeac19e1302e5336abc5ca9975961b5322575debca6122ec,09-03-2025,2025-03-09 05:02:43.000 UTC,203,27353608,0xf2c38dE50A250C0060fB45eBE4504B67f6F1be3C
0x8508fd4238162cb3f3d485f432202af3b40f164e,0xf2f3b903cf7400df0c4d1e95362b3c4e3ffb69864c26c38ed1919c84fe517be4,07-06-2025,2025-06-07 08:32:39.000 UTC,846,31247906,0x6205DfbE68444cFF504A20a712cEa794c6b6Cf04
0xdc98dbffcc648d6088a2ff8f7dc01aef050e58fc,0x27adba358a57f4d6ebb6dcb691306d7a442268d52349f96897a98f4081cff83c,14-01-2025,2025-01-14 17:26:41.000 UTC,319,25043127,0xBDA319Bc7Cc8F0829df39eC0FFF5D1E061FFadf7
0x8fd1b615c006ebeb8a7cfb00a1dd809f31943b08,0x2d9973bfbdde6ec7b863c812fe35bc5610bb138fbf907244d43df85ce89f342e,05-02-2025,2025-02-05 00:52:33.000 UTC,180,25963703,0x0e956C897bBFCbd2155D3DfdD27c87fa5A0FaD39
0x8810de2baa17067ddcfbd9e8f29c55f070a55f0b,0xda7d72b779a4f95c5c9ae4b1cb022491abfcaf94145097537ec6d22ffce1c087,17-04-2025,2025-04-17 05:51:25.000 UTC,243,29039869,0x0e956C897bBFCbd2155D3DfdD27c87fa5A0FaD39
0x8508fd4238162cb3f3d485f432202af3b40f164e,0x75af149150b262ce9a5212ddd59d21b4080b50608acc0f8f9d59a9a82a110bb5,02-06-2025,2025-06-02 03:57:13.000 UTC,310,31023643,0xc3f97660D0b47F0E05C3c513f73eeff7c1bd6c7a
0x38f6d2d9ea493c3c6ee865b5b952b5fe9e3e61fc,0xadf2f3ba2dcc7e4703991dcc766864db115c7c7ad2cea83fc30ee684d57def93,07-01-2025,2025-01-07 14:30:39.000 UTC,369,24735446,0xBDA319Bc7Cc8F0829df39eC0FFF5D1E061FFadf7
0xdc98dbffcc648d6088a2ff8f7dc01aef050e58fc,0xbbf0bd1008d9a014616a27be81ebd48da9733f009d6fa3804a1f64635169ef4a,01-01-2025,2025-01-01 22:49:53.000 UTC,424,24491223,0x869305781fff479f0311974d55FeeB6Fc9DE96a2
0x095d0de0ecfd6832f1a7961ae26d285d68655d60,0xdfb5487ffdfa3f41773d71c3f2d0bdee8bdfc3e2c8e903902ac8c04c42ff68bf,12-04-2025,2025-04-12 09:45:55.000 UTC,473,28830904,0x869305781fff479f0311974d55FeeB6Fc9DE96a2
0x38f6d2d9ea493c3c6ee865b5b952b5fe9e3e61fc,0x44e452999b338cad37d152d664d78085e093171d3a0f5858df1afb1df5317ac2,05-06-2025,2025-06-05 07:22:19.000 UTC,310,31159396,0xc3f97660D0b47F0E05C3c513f73eeff7c1bd6c7a
0x8fd1b615c006ebeb8a7cfb00a1dd809f31943b08,0x0f116495e6bb78ebf8510faac045d5760592ecedb8f159bf2aae7bf163051731,05-01-2025,2025-01-05 02:03:27.000 UTC,394,24626630,0xB9E4E0368A9F281584C9adB685e6C9F4b9F37dBb
0x8fd1b615c006ebeb8a7cfb00a1dd809f31943b08,0xde79e67aaaca137cd3387f527737ae10d8d9511980ac0a3201c4bc56e48870fb,22-12-2024,2024-12-22 03:14:59.000 UTC,328,24023976,0xBDA319Bc7Cc8F0829df39eC0FFF5D1E061FFadf7
0x9eb86e93a809a41ab0e7cc0ba6f62561fda3015c,0xae48b957a513bcdbc3bcc8191c8339a44e0985ba10710f96c1dbbdb59534e243,22-06-2025,2025-06-22 23:30:55.000 UTC,1205,31922854,0xf2c38dE50A250C0060fB45eBE4504B67f6F1be3C
0x38f6d2d9ea493c3c6ee865b5b952b5fe9e3e61fc,0x4d81b4666b3f392524f526034d3c04fb8e7b6e488897c02b6e04a523cbaaebde,09-01-2025,2025-01-09 21:40:53.000 UTC,277,24834753,0xB9E4E0368A9F281584C9adB685e6C9F4b9F37dBb
0x8fd1b615c006ebeb8a7cfb00a1dd809f31943b08,0x87387c4c0adbf18e81d079319d432a8f3698778284c93c3a0344437063c85db4,02-03-2025,2025-03-02 18:29:17.000 UTC,307,27075405,0x0e956C897bBFCbd2155D3DfdD27c87fa5A0FaD39
0x9eb86e93a809a41ab0e7cc0ba6f62561fda3015c,0xcbba44f5aaf5b23861a8679ec6f4fde283be5d033ba0ad0d8deda3390f57087e,06-01-2025,2025-01-06 21:56:47.000 UTC,290,24705630,0xC23924a846eca931Ec3014253E94f15b038bd0C8
0xdc98dbffcc648d6088a2ff8f7dc01aef050e58fc,0xc1f9098bcf2c2db80c680285f032b5c64d43f689892e007f22734183c64bc580,09-01-2025,2025-01-09 12:53:51.000 UTC,262,24818942,0x0e956C897bBFCbd2155D3DfdD27c87fa5A0FaD39
0x9eb86e93a809a41ab0e7cc0ba6f62561fda3015c,0xcebc25561d9950ebdfbb15e825d0ac02e68ba9154cb2f7af0b71c094e7e41a42,30-05-2025,2025-05-30 21:27:15.000 UTC,514,30925544,0xc3f97660D0b47F0E05C3c513f73eeff7c1bd6c7a
0xdc98dbffcc648d6088a2ff8f7dc01aef050e58fc,0xdfd84a479f1817f4961ea28ccc408542e90ed77d72cc2b7311e6007a929f62c8,03-06-2025,2025-06-03 02:54:39.000 UTC,286,31064966,0xc3f97660D0b47F0E05C3c513f73eeff7c1bd6c7a
0x9eb86e93a809a41ab0e7cc0ba6f62561fda3015c,0x13c42db4c688f67876c058a8cf4e6e67ae2016617c5ac76f480ff95137b92935,18-02-2025,2025-02-18 08:12:19.000 UTC,543,26538496,0x6399ed6725cC163D019aA64FF55b22149D7179A8
0x9eb86e93a809a41ab0e7cc0ba6f62561fda3015c,0x7abc8efc6e6813fee0ed0d92ea3948da2b1e9e5fcad8eeefe0599117f58ef2cc,02-01-2025,2025-01-02 14:32:51.000 UTC,540,24519512,0xBDA319Bc7Cc8F0829df39eC0FFF5D1E061FFadf7
0xdc98dbffcc648d6088a2ff8f7dc01aef050e58fc,0x2d43ed0a7525534aef317fe956a7ec599eb90db0d3d8d08c3f81cb930d17a7d3,08-01-2025,2025-01-08 10:45:09.000 UTC,298,24771881,0xBDA319Bc7Cc8F0829df39eC0FFF5D1E061FFadf7
0x38f6d2d9ea493c3c6ee865b5b952b5fe9e3e61fc,0xb6cc3b38ea64b6381552d4e3acbdc72c22069f1f17c9c17c6afdebfebc707f19,01-06-2025,2025-06-01 04:33:37.000 UTC,574,30981535,0xc3f97660D0b47F0E05C3c513f73eeff7c1bd6c7a
0xdc98dbffcc648d6088a2ff8f7dc01aef050e58fc,0x2708756f20ec50e8f56e526e3877b09be3fb34a0ce7c26c23ebd5cfec12c1b72,14-01-2025,2025-01-14 10:27:47.000 UTC,350,25030560,0x869305781fff479f0311974d55FeeB6Fc9DE96a2
0x2791dc5e14f7680d9d969acc26059ba56403b6d5,0x861930b12030305ff528d5880c5c45ee3f7d2ef9a2241ddd65868c3a8f014bbf,05-01-2025,2025-01-05 01:24:39.000 UTC,270,24625466,0x0e956C897bBFCbd2155D3DfdD27c87fa5A0FaD39
0x38f6d2d9ea493c3c6ee865b5b952b5fe9e3e61fc,0xe821417e34fbe29500b680aed221811c976149b72de7e17a9a8b2fdcbd5f8817,14-12-2024,2024-12-14 16:17:13.000 UTC,276,23701843,0xCFede447ca3b4885720B5a327e3BFb02078f06e8
0x351f61e4c49cf11f24d9f2e737ca5eff81806355,0x2c17f5d095de9c1c1c3791bc0ed23218f8f0c6c139f1955e3d56b7cc33052a74,03-11-2025,2025-11-03 17:19:41.000 UTC,146,37700517,0x0e956C897bBFCbd2155D3DfdD27c87fa5A0FaD39
0x38f6d2d9ea493c3c6ee865b5b952b5fe9e3e61fc,0x1c892650d1a9b56e7759cfd2ccd8318042a323d735f3b9a869b2a913bd19c396,08-01-2025,2025-01-08 21:41:35.000 UTC,353,24791574,0xBDA319Bc7Cc8F0829df39eC0FFF5D1E061FFadf7
0x38f6d2d9ea493c3c6ee865b5b952b5fe9e3e61fc,0x9760ca82b6b2b118ab796f5921927403d3fa42d8e41ffb6ffe84a2150c39f20c,17-12-2024,2024-12-17 21:13:07.000 UTC,491,23840320,0xCFede447ca3b4885720B5a327e3BFb02078f06e8
0x2791dc5e14f7680d9d969acc26059ba56403b6d5,0xe4553b6a87e59c69993bf9e813a3b3fe19127ab025029513ccc4c427c1984448,17-12-2024,2024-12-17 18:59:19.000 UTC,372,23836306,0xBDA319Bc7Cc8F0829df39eC0FFF5D1E061FFadf7
0x8fd1b615c006ebeb8a7cfb00a1dd809f31943b08,0x9cd43cc66fb51e47eef6ab997a22b8e77148288a0c913f40bc45a79184b2836f,15-12-2024,2024-12-15 06:07:57.000 UTC,291,23726765,0xCFede447ca3b4885720B5a327e3BFb02078f06e8
0x38f6d2d9ea493c3c6ee865b5b952b5fe9e3e61fc,0xb85c9750922a4f7b48645ea841042d01619798208c48237da9e4b63d15cb1752,02-01-2025,2025-01-02 00:41:17.000 UTC,380,24494565,0x869305781fff479f0311974d55FeeB6Fc9DE96a2
0x8fd1b615c006ebeb8a7cfb00a1dd809f31943b08,0xd9722065532ef3d2a84f0d7626a361091f42106bd7a95b1fc4060f0f5f3e99b8,17-02-2025,2025-02-17 15:29:33.000 UTC,271,26508413,0xF33a96b5932D9E9B9A0eDA447AbD8C9d48d2e0c8
0xdc98dbffcc648d6088a2ff8f7dc01aef050e58fc,0x3e18eb19ebacb41cee35abb6f0e1f0666f4ac7bcaf67ebb3a17c28a47bbd5518,04-01-2025,2025-01-04 12:45:43.000 UTC,352,24602698,0xBDA319Bc7Cc8F0829df39eC0FFF5D1E061FFadf7
0x8fd1b615c006ebeb8a7cfb00a1dd809f31943b08,0x8a3ecc4334a2c12f4ed7ac856ce81d633259278bc64e50e0d0d4f934867273ee,08-01-2025,2025-01-08 21:13:45.000 UTC,364,24790739,0xBDA319Bc7Cc8F0829df39eC0FFF5D1E061FFadf7
0x2791dc5e14f7680d9d969acc26059ba56403b6d5,0x78eab93421c4b0d694ec3f1251e4f52ad0038f11f0ee329f15aa0aec59e068f6,24-12-2024,2024-12-24 06:10:05.000 UTC,267,24115629,0xBDA319Bc7Cc8F0829df39eC0FFF5D1E061FFadf7
0x095d0de0ecfd6832f1a7961ae26d285d68655d60,0x5ff4dfae8d781095508f8e302a722faa0cc15f23ace9f6aa499a66549a7ad188,06-02-2025,2025-02-06 08:44:11.000 UTC,131,26021052,0xB9E4E0368A9F281584C9adB685e6C9F4b9F37dBb
0x9eb86e93a809a41ab0e7cc0ba6f62561fda3015c,0xac9b01871adb3b989f0fee424a3bd918f55340423bf5b7f3b1863d5097065394,03-06-2025,2025-06-03 14:07:11.000 UTC,883,31085142,0xc3f97660D0b47F0E05C3c513f73eeff7c1bd6c7a
0xdc98dbffcc648d6088a2ff8f7dc01aef050e58fc,0x345d0ea68191f7d054b7b0ecc96c748d1cdd632fc3356cd8ba517cc7f4a357db,07-01-2025,2025-01-07 08:34:13.000 UTC,252,24724753,0xCFede447ca3b4885720B5a327e3BFb02078f06e8
0x8508fd4238162cb3f3d485f432202af3b40f164e,0xb77e8df1691c991a0369bc3479236227fbe8660dacef3e514a88461433f74b66,29-05-2025,2025-05-29 01:28:45.000 UTC,664,30846389,0xc3f97660D0b47F0E05C3c513f73eeff7c1bd6c7a
0x9eb86e93a809a41ab0e7cc0ba6f62561fda3015c,0x931e88331f5791982eea347abf1968fcf7bacd57c702eb56347469a6c6a6c857,19-12-2024,2024-12-19 07:42:17.000 UTC,648,23902395,0xCFede447ca3b4885720B5a327e3BFb02078f06e8
0x2791dc5e14f7680d9d969acc26059ba56403b6d5,0xaa1984f341fe171ff2052de03a1d2f9ff462205d7546f59b7566cfac53e435d2,24-12-2024,2024-12-24 06:54:59.000 UTC,505,24116976,0xBDA319Bc7Cc8F0829df39eC0FFF5D1E061FFadf7
0x9eb86e93a809a41ab0e7cc0ba6f62561fda3015c,0xc1b295651df8610a65bc95d903c7a7607ea1b7c9f6d8bbfeb5f1479df8b1ccac,04-01-2025,2025-01-04 16:09:27.000 UTC,435,24608810,0xC23924a846eca931Ec3014253E94f15b038bd0C8
0x8810de2baa17067ddcfbd9e8f29c55f070a55f0b,0xb3976259495e79317ee164e8faabb3032cc93024575a33d11e0e1f215010e043,12-04-2025,2025-04-12 18:24:45.000 UTC,626,28846469,0x0e956C897bBFCbd2155D3DfdD27c87fa5A0FaD39
0x19d36b9ee92a53ec1900447eba958f0030c688be,0xd78e6b8236dcb003c1c1b5c4d407947ad7d6465769bcf64d2734d5664b46f1d3,06-06-2025,2025-06-06 14:43:19.000 UTC,267,31215826,0x0e956C897bBFCbd2155D3DfdD27c87fa5A0FaD39
0x9eb86e93a809a41ab0e7cc0ba6f62561fda3015c,0x05f270b4a19fb0680f739450c340ebff08f5d339d18821bee9c17c7090ca9c92,18-02-2025,2025-02-18 08:54:49.000 UTC,287,26539771,0x6399ed6725cC163D019aA64FF55b22149D7179A8
0x2791dc5e14f7680d9d969acc26059ba56403b6d5,0x1e9b8b0cb607440a9566bbbf2f19cf46d100ae420c2326aec630ab9527ca7ea9,18-01-2025,2025-01-18 16:35:49.000 UTC,246,25214401,0x0e956C897bBFCbd2155D3DfdD27c87fa5A0FaD39
0x2791dc5e14f7680d9d969acc26059ba56403b6d5,0x7d8ca39630014feb77ba1ddd7e3edc0e70b4b5e19c70af1f5ed8cc25b7d46b90,18-01-2025,2025-01-18 22:21:15.000 UTC,287,25224764,0xB9E4E0368A9F281584C9adB685e6C9F4b9F37dBb
0x8508fd4238162cb3f3d485f432202af3b40f164e,0x9ea89108b9043c4d132a1fc28910dddda3b3cc5047d29411d6429ac7d3a51dbe,04-04-2025,2025-04-04 16:48:31.000 UTC,411,28497982,0x2B74B62c564456C48055bd515A62594742b3f545
0xdc98dbffcc648d6088a2ff8f7dc01aef050e58fc,0x3e1959e30dd433ba589f3cfdbb1430f2bb7b810c860bf0a5877155854f65e9e8,11-01-2025,2025-01-11 05:54:33.000 UTC,129,24892763,0xBDA319Bc7Cc8F0829df39eC0FFF5D1E061FFadf7
0x9eb86e93a809a41ab0e7cc0ba6f62561fda3015c,0xd207956ecaf20f0831f40ccd67062559ef5bff845f763fcabc49d0660bdbd0fa,07-01-2025,2025-01-07 23:05:21.000 UTC,392,24750887,0xBDA319Bc7Cc8F0829df39eC0FFF5D1E061FFadf7
0x9eb86e93a809a41ab0e7cc0ba6f62561fda3015c,0xe9b5286d22dba32a50191a8441e08ce95bc17ffaada955a82a67e3108edbb65b,29-05-2025,2025-05-29 01:18:49.000 UTC,434,30846091,0xc3f97660D0b47F0E05C3c513f73eeff7c1bd6c7a
0x2791dc5e14f7680d9d969acc26059ba56403b6d5,0x6fca25e8cece4e36d26651320c0a5c4a71a928977650a014e56d0777a47e9831,05-01-2025,2025-01-05 07:50:15.000 UTC,312,24637034,0xBDA319Bc7Cc8F0829df39eC0FFF5D1E061FFadf7
0x8508fd4238162cb3f3d485f432202af3b40f164e,0x61f7e95ee3b8cb53c0a91f11fcad825ab8883c29184dfb57007c2182fa59fca5,26-06-2025,2025-06-26 13:27:29.000 UTC,530,32077551,0x6205DfbE68444cFF504A20a712cEa794c6b6Cf04
0x8fd1b615c006ebeb8a7cfb00a1dd809f31943b08,0xf0396445cc025f2be70926744b641af649fa1328d2901820a70abe1405e5eca6,26-12-2024,2024-12-26 22:38:21.000 UTC,395,24231677,0xBDA319Bc7Cc8F0829df39eC0FFF5D1E061FFadf7
0x38f6d2d9ea493c3c6ee865b5b952b5fe9e3e61fc,0x8d00f55f79e1981fb2f48200b70edfd0fa72f43f26d312266c0e824ed7774a58,30-01-2025,2025-01-30 01:24:23.000 UTC,192,25705458,0xB9E4E0368A9F281584C9adB685e6C9F4b9F37dBb
0xdc98dbffcc648d6088a2ff8f7dc01aef050e58fc,0x31f23cf0ed473a91da05166cae2c2f0136c1ef64e62fe71c4b169ff87767078d,13-01-2025,2025-01-13 03:03:17.000 UTC,297,24974025,0x869305781fff479f0311974d55FeeB6Fc9DE96a2
0x9eb86e93a809a41ab0e7cc0ba6f62561fda3015c,0x4cc6f8e73b584fd98bf1dbec44e85d81c317771b77ca3494c81646dd73064861,19-05-2025,2025-05-19 04:24:47.000 UTC,469,30419670,0xc3f97660D0b47F0E05C3c513f73eeff7c1bd6c7a
0x8fd1b615c006ebeb8a7cfb00a1dd809f31943b08,0xec86cf23839f841169ca11ef8f7bc064cfecf091ef29ab929ce2d1e961868fb6,07-02-2025,2025-02-07 16:10:23.000 UTC,327,26077638,0x0e956C897bBFCbd2155D3DfdD27c87fa5A0FaD39
0x8fd1b615c006ebeb8a7cfb00a1dd809f31943b08,0x8f67431bd634526dd773f89dfe8832c3863aef4e87adbb9af9cb7c518ae421f3,22-12-2024,2024-12-22 19:26:55.000 UTC,252,24053134,0xBDA319Bc7Cc8F0829df39eC0FFF5D1E061FFadf7
0x38f6d2d9ea493c3c6ee865b5b952b5fe9e3e61fc,0x46371a7d58e8e96f183e5bfe0511c56c0c389e98f47565b02c85a61bd248820b,21-02-2025,2025-02-21 20:11:13.000 UTC,381,26689663,0x0e956C897bBFCbd2155D3DfdD27c87fa5A0FaD39
0x8810de2baa17067ddcfbd9e8f29c55f070a55f0b,0x1bde968f3fb533c35f2c7abce7ce4822a294924a838a5f10f5f06b2b37554891,14-05-2025,2025-05-14 03:48:53.000 UTC,91,30202593,0xaDEfE661847835C6566b1caAbECfcF09C586F300
0x8fd1b615c006ebeb8a7cfb00a1dd809f31943b08,0x438115677475a394582cb2cf8f1a5cc3572042357848fcaeb92ebb88f21feee8,15-12-2024,2024-12-15 02:25:03.000 UTC,194,23720078,0xBDA319Bc7Cc8F0829df39eC0FFF5D1E061FFadf7
0x2791dc5e14f7680d9d969acc26059ba56403b6d5,0xd0163a67c2461a0202751baf7a9dcf94bf3196221016be353ab7bc458a98bb3f,08-01-2025,2025-01-08 02:28:07.000 UTC,246,24756970,0x0e956C897bBFCbd2155D3DfdD27c87fa5A0FaD39
0x095d0de0ecfd6832f1a7961ae26d285d68655d60,0x34e39fbd5cd4588433559ddce5da27a6e2166b428dda5fe7d16db613f9420ad5,28-03-2025,2025-03-28 06:28:25.000 UTC,292,28176979,0x869305781fff479f0311974d55FeeB6Fc9DE96a2
0x8fd1b615c006ebeb8a7cfb00a1dd809f31943b08,0xce23ce39257330d46a46d829c9a891865931fe3d1341d528992f8a7c03515335,08-05-2025,2025-05-08 21:24:33.000 UTC,577,29975063,0x0e956C897bBFCbd2155D3DfdD27c87fa5A0FaD39
0xdc98dbffcc648d6088a2ff8f7dc01aef050e58fc,0xff08fda93f6c37f37cbd26279b2352b6f7fdb937c75a74328dea0571b56c18cd,10-01-2025,2025-01-10 18:43:25.000 UTC,215,24872629,0x869305781fff479f0311974d55FeeB6Fc9DE96a2
0x9eb86e93a809a41ab0e7cc0ba6f62561fda3015c,0xbe7bd2dabd09c8a04fe02385d2e15b90fbd591cfe388b41d669c86f669080462,13-05-2025,2025-05-13 18:10:39.000 UTC,608,30185246,0xc3f97660D0b47F0E05C3c513f73eeff7c1bd6c7a
0x38f6d2d9ea493c3c6ee865b5b952b5fe9e3e61fc,0x9459892f673584c8e93eb61cbdc4311fa98cf6cba6da52e3307b2401def28f94,10-06-2025,2025-06-10 18:04:15.000 UTC,357,31394654,0xc3f97660D0b47F0E05C3c513f73eeff7c1bd6c7a
0xdc98dbffcc648d6088a2ff8f7dc01aef050e58fc,0x34fe1f34668f75bb9ef467821ded099979f54f936baf83f12565a8c13c14ef51,03-01-2025,2025-01-03 12:29:53.000 UTC,434,24559023,0xBDA319Bc7Cc8F0829df39eC0FFF5D1E061FFadf7
0x38f6d2d9ea493c3c6ee865b5b952b5fe9e3e61fc,0x9a5afbdabefad9ec176ed0632b885e1c3687f61fa462515e704c1c4667eb0270,12-06-2025,2025-06-12 10:56:01.000 UTC,731,31468207,0xCFede447ca3b4885720B5a327e3BFb02078f06e8
0x9eb86e93a809a41ab0e7cc0ba6f62561fda3015c,0x487147f96231b1b1635d47af64c1ed4ab648c853681d0e7d2f1acad623c63333,24-12-2024,2024-12-24 21:37:49.000 UTC,144,24143461,0xCFede447ca3b4885720B5a327e3BFb02078f06e8
0xdc98dbffcc648d6088a2ff8f7dc01aef050e58fc,0xa3e461a9bc7f8f224e0f05e1014a7ced66a5f85b74ac7db4401bb644e85542db,15-12-2024,2024-12-15 03:09:41.000 UTC,138,23721417,0xBDA319Bc7Cc8F0829df39eC0FFF5D1E061FFadf7
0x2791dc5e14f7680d9d969acc26059ba56403b6d5,0x6c03d319de4ec13f1d33f9db6309efe9ab851efcf406d817e72853ef22bb5dd5,20-01-2025,2025-01-20 05:56:09.000 UTC,137,25281611,0xf2c38dE50A250C0060fB45eBE4504B67f6F1be3C
0x38f6d2d9ea493c3c6ee865b5b952b5fe9e3e61fc,0xd37021bc60774026c4f47de5d17618cb502ad08cb0135c2a812c58eb163bd09a,19-05-2025,2025-05-19 05:38:31.000 UTC,267,30421882,0xCFede447ca3b4885720B5a327e3BFb02078f06e8
0x9eb86e93a809a41ab0e7cc0ba6f62561fda3015c,0xec500245286abe0fbf1ddc19c726bb10e0e0b44ea5702c0ee17d153a4716b706,03-03-2025,2025-03-03 11:13:09.000 UTC,486,27105521,0x6399ed6725cC163D019aA64FF55b22149D7179A8
0xdc98dbffcc648d6088a2ff8f7dc01aef050e58fc,0xdaafc44df296c02966e7cb03dd1c96f407ead0fa7d070b7c3aa0425e80c0b93d,09-01-2025,2025-01-09 09:52:05.000 UTC,240,24813489,0x869305781fff479f0311974d55FeeB6Fc9DE96a2
0x8fd1b615c006ebeb8a7cfb00a1dd809f31943b08,0x056258af9962d7c559c85b8bb5531dd565ca4e5deb510a738bb93e222a727f4d,26-02-2025,2025-02-26 19:01:53.000 UTC,328,26903583,0x0e956C897bBFCbd2155D3DfdD27c87fa5A0FaD39
0x9eb86e93a809a41ab0e7cc0ba6f62561fda3015c,0xf9d141f6752bcd79970bae591a809b380fdb4375f68e45a496e34c1a394b9de5,23-05-2025,2025-05-23 19:29:05.000 UTC,822,30619599,0xc3f97660D0b47F0E05C3c513f73eeff7c1bd6c7a
0x8508fd4238162cb3f3d485f432202af3b40f164e,0x810f59612ee8025fa36789bfdc2af6b9a37966c7b3acd44d2ac7061858ffb6b1,31-05-2025,2025-05-31 00:34:43.000 UTC,1201,30931168,0xc3f97660D0b47F0E05C3c513f73eeff7c1bd6c7a
0x9eb86e93a809a41ab0e7cc0ba6f62561fda3015c,0xd7704a1c44edb311234d67c5ec5666da37aaeb5f86be2008193a1bb59f1ffeed,07-01-2025,2025-01-07 02:40:55.000 UTC,126,24714154,0xC23924a846eca931Ec3014253E94f15b038bd0C8
0x095d0de0ecfd6832f1a7961ae26d285d68655d60,0xeac6033f52d5ab1e129c20f6548b71a9671632b01e99864641e27e7b09aeced5,09-04-2025,2025-04-09 19:17:39.000 UTC,335,28718456,0x869305781fff479f0311974d55FeeB6Fc9DE96a2
0x9eb86e93a809a41ab0e7cc0ba6f62561fda3015c,0x5be9919674bc7e6f9eaff7131ce99bf90e7f4ee762ea4fce4e660f1f84caf1c6,24-01-2025,2025-01-24 04:07:53.000 UTC,304,25451163,0xB9E4E0368A9F281584C9adB685e6C9F4b9F37dBb
0x8508fd4238162cb3f3d485f432202af3b40f164e,0x9135f883755bde536b12f5842d1ef59526c41ae892833a6e4687896db20b0b1b,20-03-2025,2025-03-20 01:12:09.000 UTC,589,27821891,0x2B74B62c564456C48055bd515A62594742b3f545
0xdc98dbffcc648d6088a2ff8f7dc01aef050e58fc,0x5a749c21a5cbf3ac16021d6fe6a4eabc818bed360f5655d6b8e8c0984e7d0514,10-01-2025,2025-01-10 11:26:23.000 UTC,626,24859518,0xCFede447ca3b4885720B5a327e3BFb02078f06e8
0x9eb86e93a809a41ab0e7cc0ba6f62561fda3015c,0xdd2f3fb73818094cabd7a57e72e0a15cb2ee9f24daeed55cff0a1e809a83f2c5,02-03-2025,2025-03-02 07:46:57.000 UTC,499,27056135,0x6399ed6725cC163D019aA64FF55b22149D7179A8
0x9eb86e93a809a41ab0e7cc0ba6f62561fda3015c,0x9e75ffdbf02426940d4d47565542691d6c60b90d28816925650f026bc478943a,28-02-2025,2025-02-28 14:26:23.000 UTC,264,26981718,0x6399ed6725cC163D019aA64FF55b22149D7179A8
0x9eb86e93a809a41ab0e7cc0ba6f62561fda3015c,0x988ad55331e2782714a93ea7a78f5e064b0af7d62403b0eef418b341c7a56ff6,08-01-2025,2025-01-08 16:23:15.000 UTC,509,24782024,0x869305781fff479f0311974d55FeeB6Fc9DE96a2
0x2791dc5e14f7680d9d969acc26059ba56403b6d5,0x0d3d37b449093203e05a7c06bea01ff849d7ec9ce77a954c0ad3fd37af2795e3,08-02-2025,2025-02-08 07:32:13.000 UTC,289,26105293,0x0e956C897bBFCbd2155D3DfdD27c87fa5A0FaD39
0xdc98dbffcc648d6088a2ff8f7dc01aef050e58fc,0x5dd7a5d0afedc4e1b16f0fa74834b4850494dda5d2731b5eb4701d7b9a94dc07,07-01-2025,2025-01-07 12:10:07.000 UTC,423,24731230,0xBDA319Bc7Cc8F0829df39eC0FFF5D1E061FFadf7
0x8508fd4238162cb3f3d485f432202af3b40f164e,0x39d10927a0899efd9cfce4bc8b0e3cd2da42a20b20c027ba1b7c263c487440e4,04-06-2025,2025-06-04 00:18:51.000 UTC,285,31103492,0x6205DfbE68444cFF504A20a712cEa794c6b6Cf04
0x2791dc5e14f7680d9d969acc26059ba56403b6d5,0xa0ad317871e55f2b88caca0110fa14d6aeaa82c79a317abaf803cf3852c37832,20-01-2025,2025-01-20 00:36:41.000 UTC,127,25272027,0xf2c38dE50A250C0060fB45eBE4504B67f6F1be3C
0x8810de2baa17067ddcfbd9e8f29c55f070a55f0b,0xa99fe9e182c7831565942a7235378bc4521d47201b7d7862799a83779bbc8565,01-05-2025,2025-05-01 21:11:33.000 UTC,619,29672273,0x0e956C897bBFCbd2155D3DfdD27c87fa5A0FaD39
0x2791dc5e14f7680d9d969acc26059ba56403b6d5,0x3f760819036e53cf0f2c244d6da8766accc446ddbd64ab2959bdee8b920f81f5,12-12-2024,2024-12-12 04:40:35.000 UTC,227,23594544,0xBDA319Bc7Cc8F0829df39eC0FFF5D1E061FFadf7
0x9eb86e93a809a41ab0e7cc0ba6f62561fda3015c,0xabfeca01b2935fbf53bd7cea9da00a2d30f8fff67520def233e0c49fc680971f,02-01-2025,2025-01-02 08:22:37.000 UTC,472,24508405,0x869305781fff479f0311974d55FeeB6Fc9DE96a2
0x2791dc5e14f7680d9d969acc26059ba56403b6d5,0xcbc0e258afeb81f9d294f8fba1a2b5919c547e47017b3ae526f5c0aa2d74b245,21-12-2024,2024-12-21 03:06:09.000 UTC,373,23980511,0xBDA319Bc7Cc8F0829df39eC0FFF5D1E061FFadf7
0x095d0de0ecfd6832f1a7961ae26d285d68655d60,0x9f78fb986ea51924800309472675e607479b47d396db8874e62a24db3f4fc224,22-01-2025,2025-01-22 04:49:49.000 UTC,274,25366021,0x0e956C897bBFCbd2155D3DfdD27c87fa5A0FaD39
0x2791dc5e14f7680d9d969acc26059ba56403b6d5,0x30b118fd690185d7bf8a9e5d2119a76fcc6ec3acf19bc5db8c87d397cda6c171,28-02-2025,2025-02-28 04:28:35.000 UTC,2527,26963784,0x0e956C897bBFCbd2155D3DfdD27c87fa5A0FaD39
0x2791dc5e14f7680d9d969acc26059ba56403b6d5,0xbd46e2af6d2ce08ef1cd7e9be9386f27e8be8efa4330daa1ebee61b27465a7b3,08-01-2025,2025-01-08 03:00:11.000 UTC,516,24757932,0xBDA319Bc7Cc8F0829df39eC0FFF5D1E061FFadf7
0x9eb86e93a809a41ab0e7cc0ba6f62561fda3015c,0x7ffe0dc138150cb798d8085e762fd68d78e299e4320db2c1e7c3a577695f7559,02-03-2025,2025-03-02 14:47:49.000 UTC,179,27068761,0x6399ed6725cC163D019aA64FF55b22149D7179A8
0x9eb86e93a809a41ab0e7cc0ba6f62561fda3015c,0x23e42abd684c782e8134ece3b6ef782d62e4d83feac7cc69fec7281f624b3c81,06-06-2025,2025-06-06 12:45:35.000 UTC,635,31212294,0xc3f97660D0b47F0E05C3c513f73eeff7c1bd6c7a
0x2791dc5e14f7680d9d969acc26059ba56403b6d5,0x1a627442e147b947d5fabf43eb34d421401e907e930385a862c1b80494de1228,16-12-2024,2024-12-16 10:15:01.000 UTC,332,23777377,0xBDA319Bc7Cc8F0829df39eC0FFF5D1E061FFadf7
0xdc98dbffcc648d6088a2ff8f7dc01aef050e58fc,0x25d8ec0999cf83fb2f2b3e1fa4fccb5f0a671a7b44f967eaa49ac05bb5157cb0,29-12-2024,2024-12-29 11:17:47.000 UTC,319,24340860,0x869305781fff479f0311974d55FeeB6Fc9DE96a2
0x38f6d2d9ea493c3c6ee865b5b952b5fe9e3e61fc,0x3189ef4a045e7c1560e82a913e178e83678f44f28deddcc24771a57858bfe4bc,12-06-2025,2025-06-12 05:14:19.000 UTC,682,31457956,0xc3f97660D0b47F0E05C3c513f73eeff7c1bd6c7a
0x8508fd4238162cb3f3d485f432202af3b40f164e,0xf863d71d40b72e83bd7db0ef7979509ad316490d00b065420baa33b946bdcaf4,06-06-2025,2025-06-06 07:04:23.000 UTC,704,31202058,0x6205DfbE68444cFF504A20a712cEa794c6b6Cf04
0x351f61e4c49cf11f24d9f2e737ca5eff81806355,0x257a8e4f19c0b87b79b2e79c8851b0b816a2db9dd28ba6bf4140ce6e0a3e0679,19-10-2025,2025-10-19 07:30:45.000 UTC,257,37034849,0x0e956C897bBFCbd2155D3DfdD27c87fa5A0FaD39
0x9eb86e93a809a41ab0e7cc0ba6f62561fda3015c,0x11e9d4de51dc732d6afdb2ca5cfb7c19cfee0387751dc4d22b35e33ef6af95f5,02-07-2025,2025-07-02 07:12:35.000 UTC,1489,32325504,0xf2c38dE50A250C0060fB45eBE4504B67f6F1be3C
0x38f6d2d9ea493c3c6ee865b5b952b5fe9e3e61fc,0x5b7e33f1e91f6bbcfca03639ea8e460fe0d1fc82c0dd13b1741fe8241638323a,08-12-2024,2024-12-08 06:27:57.000 UTC,169,23424965,0x0e956C897bBFCbd2155D3DfdD27c87fa5A0FaD39
0x2791dc5e14f7680d9d969acc26059ba56403b6d5,0x3b4eeccfd75f52bc59a3f38603210b485377cf26b3354746ca71861f68eb6a27,11-01-2025,2025-01-11 12:36:23.000 UTC,358,24904818,0xBDA319Bc7Cc8F0829df39eC0FFF5D1E061FFadf7
0x2791dc5e14f7680d9d969acc26059ba56403b6d5,0x4509d32b3fcfae5427926c6d98a7146a10f98939bcae5130294f660ccf3abdf1,27-05-2025,2025-05-27 03:20:21.000 UTC,456,30763337,0xCFede447ca3b4885720B5a327e3BFb02078f06e8
0x38f6d2d9ea493c3c6ee865b5b952b5fe9e3e61fc,0x23dd91be17cf85019990718854841c520392e434947d6493a2c95e6c7a3b9af6,28-12-2024,2024-12-28 07:33:31.000 UTC,268,24290932,0xCFede447ca3b4885720B5a327e3BFb02078f06e8
0x2791dc5e14f7680d9d969acc26059ba56403b6d5,0xe494984966fdee36ac63512a56ceaf4e89009f389f7e2c1c678cb7a539837c4f,09-01-2025,2025-01-09 05:33:11.000 UTC,276,24805722,0xB9E4E0368A9F281584C9adB685e6C9F4b9F37dBb
0x8508fd4238162cb3f3d485f432202af3b40f164e,0xe90b79e870c7b7c4dc542151ba34d49cc941b020faa229b07e486891232a918f,03-04-2025,2025-04-03 01:17:11.000 UTC,573,28426842,0x2B74B62c564456C48055bd515A62594742b3f545
0x38f6d2d9ea493c3c6ee865b5b952b5fe9e3e61fc,0xb4ce804a3785190b134bbba9aeb1aa380f02a2918f20d82397316fa3ad5bfe4e,26-02-2025,2025-02-26 19:44:11.000 UTC,321,26904852,0x0e956C897bBFCbd2155D3DfdD27c87fa5A0FaD39
0xdc98dbffcc648d6088a2ff8f7dc01aef050e58fc,0x0731c7a3e70c325f636198b11dc8f84381df5fb404d5916adeab03458003dc88,11-05-2025,2025-05-11 04:12:01.000 UTC,98,30073687,0x430C09546ae9249AB75B9A4ef7B5FD9a4006D6f3
0x38f6d2d9ea493c3c6ee865b5b952b5fe9e3e61fc,0xcfd5fee1b0698005e2542b4121e7571a22c1032595de8325475c4da43e3cf520,07-01-2025,2025-01-07 08:53:37.000 UTC,310,24725335,0x0e956C897bBFCbd2155D3DfdD27c87fa5A0FaD39
0x8810de2baa17067ddcfbd9e8f29c55f070a55f0b,0xf83766348524cf1acb78db699568c66553fccfc85035f1c08ff58bccfbb30ca3,11-05-2025,2025-05-11 05:46:23.000 UTC,234,30076518,0x0e956C897bBFCbd2155D3DfdD27c87fa5A0FaD39
0x9eb86e93a809a41ab0e7cc0ba6f62561fda3015c,0xd09ae8a27a545024b8bb5b4e138287af68a1519de8290bc30644217d7063aeb8,03-06-2025,2025-06-03 13:18:03.000 UTC,521,31083668,0xc3f97660D0b47F0E05C3c513f73eeff7c1bd6c7a
0x2791dc5e14f7680d9d969acc26059ba56403b6d5,0x7d8e127357bd0d15f0d4e05d284bb80ed2c2c33c10a31fc0a144e5d02a974a86,26-12-2024,2024-12-26 19:07:49.000 UTC,174,24225361,0xBDA319Bc7Cc8F0829df39eC0FFF5D1E061FFadf7
0x38f6d2d9ea493c3c6ee865b5b952b5fe9e3e61fc,0xb8f8ef8d7f379e037ca66867fa3260aaad1e0601dd49201056a69c0483afd162,22-01-2025,2025-01-22 20:14:59.000 UTC,290,25393776,0x0e956C897bBFCbd2155D3DfdD27c87fa5A0FaD39
0xdc98dbffcc648d6088a2ff8f7dc01aef050e58fc,0x4ebecd8236724934671528b23c87ec1abe2c4a19d57d532c47a89ea472df1c7c,12-01-2025,2025-01-12 04:04:05.000 UTC,850,24932649,0xBDA319Bc7Cc8F0829df39eC0FFF5D1E061FFadf7
0x2791dc5e14f7680d9d969acc26059ba56403b6d5,0x9cad673c3ea2dae940a62fb5043e787c969a3a24fc2c2b4bcd1c42022f8c59fa,05-01-2025,2025-01-05 01:56:11.000 UTC,315,24626412,0xBDA319Bc7Cc8F0829df39eC0FFF5D1E061FFadf7
0xdc98dbffcc648d6088a2ff8f7dc01aef050e58fc,0x710ae39ab9d8bca30e3a58834080635d9a679161df135f5b6db288a9a1aec8a0,04-01-2025,2025-01-04 21:14:39.000 UTC,312,24617966,0xB9E4E0368A9F281584C9adB685e6C9F4b9F37dBb
0x9eb86e93a809a41ab0e7cc0ba6f62561fda3015c,0xc4e507fef4dc7ae83f477cac0d66f810910c2688392248477b2b4ed08e53575c,07-01-2025,2025-01-07 02:44:39.000 UTC,164,24714266,0x869305781fff479f0311974d55FeeB6Fc9DE96a2
0x8fd1b615c006ebeb8a7cfb00a1dd809f31943b08,0xab0c1f5af06f9752eb1fdab93dcc015c562c6b05a64d876b1d15354bfd5dfc57,12-12-2024,2024-12-12 02:38:05.000 UTC,412,23590869,0x45F8b8eC9c92D09BA8495074436fD97073423041
0x38f6d2d9ea493c3c6ee865b5b952b5fe9e3e61fc,0xc46c1bbdb6db9a4995757578c44a8b0d705c1e154e3ca0ff71e2b9488fe5167e,09-01-2025,2025-01-09 04:24:31.000 UTC,437,24803662,0x869305781fff479f0311974d55FeeB6Fc9DE96a2
0x9eb86e93a809a41ab0e7cc0ba6f62561fda3015c,0x9eb889868fb5e23159790b4b762f435890c4d9a4dd7219265df5bd78c888b70e,13-12-2024,2024-12-13 21:38:45.000 UTC,284,23668289,0xBDA319Bc7Cc8F0829df39eC0FFF5D1E061FFadf7
0x2791dc5e14f7680d9d969acc26059ba56403b6d5,0x38e479f65e29870c9d7e722d5a7a0e8a3537821a9acce88257dcfbb262b8ab03,02-01-2025,2025-01-02 08:29:51.000 UTC,518,24508622,0xBDA319Bc7Cc8F0829df39eC0FFF5D1E061FFadf7
0x8508fd4238162cb3f3d485f432202af3b40f164e,0x8b1c76586a7c0233fdd71c4b9439bac0d42ce3d6c95c337102cc7ee61736c1a3,23-05-2025,2025-05-23 08:56:51.000 UTC,1094,30600632,0xc3f97660D0b47F0E05C3c513f73eeff7c1bd6c7a
0x8508fd4238162cb3f3d485f432202af3b40f164e,0x9fb5dfe90edab8740ef756395e6080326fa9f90af4fb6e1b2a2c27db7ac4ad6c,05-06-2025,2025-06-05 07:31:37.000 UTC,479,31159675,0xc3f97660D0b47F0E05C3c513f73eeff7c1bd6c7a
0x351f61e4c49cf11f24d9f2e737ca5eff81806355,0x3482f36e0207c52b47e1c9bd838022691ff735dd0259e4ff9795b0b6c326225a,14-08-2025,2025-08-14 00:57:27.000 UTC,338,34171850,0x0e956C897bBFCbd2155D3DfdD27c87fa5A0FaD39
0x2791dc5e14f7680d9d969acc26059ba56403b6d5,0x472815db1c3e0c0cbc88c85701e6ab9f392ce466f4564ff0a3eea545e8b22d56,12-12-2024,2024-12-12 16:33:03.000 UTC,356,23615918,0xBDA319Bc7Cc8F0829df39eC0FFF5D1E061FFadf7
0xdc98dbffcc648d6088a2ff8f7dc01aef050e58fc,0xaa8865390afb245ba8eb3e2beee450c7c7ce0ac853aed4a59dafb119e8092683,11-01-2025,2025-01-11 10:37:31.000 UTC,313,24901252,0xBDA319Bc7Cc8F0829df39eC0FFF5D1E061FFadf7
0x2791dc5e14f7680d9d969acc26059ba56403b6d5,0x9878f519ab01c5858e25e2cc87993f4405f03a19688b76f09dc2885d708f4b89,02-01-2025,2025-01-02 06:54:39.000 UTC,212,24505766,0x0e956C897bBFCbd2155D3DfdD27c87fa5A0FaD39
0x351f61e4c49cf11f24d9f2e737ca5eff81806355,0x5df8ac29a96f56f4450c5fba9bda832874e69dfe96f1eae00220c2820f90f803,02-09-2025,2025-09-02 15:03:25.000 UTC,220,35018029,0x0e956C897bBFCbd2155D3DfdD27c87fa5A0FaD39
0x2791dc5e14f7680d9d969acc26059ba56403b6d5,0xf6b57b1650517dc74ac4f56089d034280def8d2e056c0f840e6918674b46e0f4,12-12-2024,2024-12-12 03:18:51.000 UTC,420,23592092,0xBDA319Bc7Cc8F0829df39eC0FFF5D1E061FFadf7
0x38f6d2d9ea493c3c6ee865b5b952b5fe9e3e61fc,0x521cfad2364b1733365bca1e695def199688bd1d7ee9358bd38f3aecb2ce0614,22-01-2025,2025-01-22 04:32:49.000 UTC,287,25365511,0x0e956C897bBFCbd2155D3DfdD27c87fa5A0FaD39
0x9eb86e93a809a41ab0e7cc0ba6f62561fda3015c,0x53f23c7b2fd19d4d0f88733714fcde80a5c3c6bb1a0b467e7fcd5fec097c7846,15-12-2024,2024-12-15 12:11:19.000 UTC,229,23737666,0xBDA319Bc7Cc8F0829df39eC0FFF5D1E061FFadf7
0x8fd1b615c006ebeb8a7cfb00a1dd809f31943b08,0x588f3ad2e404485c52402fec3df6de43da9837dc3370fe0c4bd3500931f7db09,06-06-2025,2025-06-06 13:44:13.000 UTC,574,31214053,0xf2c38dE50A250C0060fB45eBE4504B67f6F1be3C
0x2791dc5e14f7680d9d969acc26059ba56403b6d5,0x670bd4220309f6409ef320d30eccded0bde17cdac43b7ef32e56dc4f3ca8ff75,15-01-2025,2025-01-15 03:06:19.000 UTC,528,25060516,0xBDA319Bc7Cc8F0829df39eC0FFF5D1E061FFadf7
0x8508fd4238162cb3f3d485f432202af3b40f164e,0x6dadba5a8c58b506452d2fd34851d15544c6254219aa6f96995c9626c4dfc328,18-05-2025,2025-05-18 12:38:41.000 UTC,985,30391287,0x6205DfbE68444cFF504A20a712cEa794c6b6Cf04
0x351f61e4c49cf11f24d9f2e737ca5eff81806355,0xdf9a00eea5f1ab18683376a7c74ccfadb61aac6437409f35637982e4263a3c71,27-08-2025,2025-08-27 18:35:13.000 UTC,190,34765183,0x0e956C897bBFCbd2155D3DfdD27c87fa5A0FaD39
0x2791dc5e14f7680d9d969acc26059ba56403b6d5,0xe9ffc5d1b20173cef18bcc20c2040e5418c764452fdd02cda72ba981ef24988d,29-12-2024,2024-12-29 08:08:17.000 UTC,370,24335175,0xBDA319Bc7Cc8F0829df39eC0FFF5D1E061FFadf7
0x8508fd4238162cb3f3d485f432202af3b40f164e,0xbc3564c74d83ccafc6e1837e58bb0bdd2725cebb98f0d2b70b8b2e8f9883847b,02-07-2025,2025-07-02 09:10:15.000 UTC,380,32329034,0x6205DfbE68444cFF504A20a712cEa794c6b6Cf04
0x095d0de0ecfd6832f1a7961ae26d285d68655d60,0x21d2110c0b0e48a4984f200361856eb12ac1e11d6ac938217f4f4c8add9094e0,12-02-2025,2025-02-12 21:30:15.000 UTC,371,26303234,0xB9E4E0368A9F281584C9adB685e6C9F4b9F37dBb
0x9eb86e93a809a41ab0e7cc0ba6f62561fda3015c,0xa2f17797b55d7733869eb8efbd1320e9ee08a734ee65863cd665301c69a33607,15-12-2024,2024-12-15 10:03:39.000 UTC,245,23733836,0xCFede447ca3b4885720B5a327e3BFb02078f06e8
0x2791dc5e14f7680d9d969acc26059ba56403b6d5,0x783fc33ef5b7749eef038da1a02d97ebd142f9e8a1f9807c80b9d87ad1a55951,17-01-2025,2025-01-17 10:18:19.000 UTC,396,25159876,0xB9E4E0368A9F281584C9adB685e6C9F4b9F37dBb
0x095d0de0ecfd6832f1a7961ae26d285d68655d60,0x44072f709b07cb1c3535ebcd8d43d351c1ac068a00db635e8288c00eb92851bc,11-05-2025,2025-05-11 04:54:47.000 UTC,56,30074970,0x6205DfbE68444cFF504A20a712cEa794c6b6Cf04
0x8fd1b615c006ebeb8a7cfb00a1dd809f31943b08,0x1fb9dd36c183892843cae7026aa375dbed43672b50ec54fb4906a249fe7af007,15-12-2024,2024-12-15 16:30:49.000 UTC,217,23745451,0xBDA319Bc7Cc8F0829df39eC0FFF5D1E061FFadf7
0x9eb86e93a809a41ab0e7cc0ba6f62561fda3015c,0x7ac373cf8cf597b311a91e6af28b8b6b30a4de8a6fe5738df38392a8f3eaffd9,07-01-2025,2025-01-07 17:51:55.000 UTC,237,24741484,0x869305781fff479f0311974d55FeeB6Fc9DE96a2
0x8fd1b615c006ebeb8a7cfb00a1dd809f31943b08,0x302484ed682ce3995bf215d3077fd1d408d2bffaefedb6e190261575103adcc6,05-01-2025,2025-01-05 17:20:21.000 UTC,475,24654137,0xB9E4E0368A9F281584C9adB685e6C9F4b9F37dBb
0x9eb86e93a809a41ab0e7cc0ba6f62561fda3015c,0x47f84f075e3369e51e8b57c6aa6a408731618b9fc0b562681fa2a91f25ec1b37,10-12-2024,2024-12-10 12:01:11.000 UTC,384,23521362,0xBDA319Bc7Cc8F0829df39eC0FFF5D1E061FFadf7
0x8fd1b615c006ebeb8a7cfb00a1dd809f31943b08,0x825b71adccea93cb503f5951c0ff1c1970d4553f56f98ab93c0ec87d9be2f851,12-12-2024,2024-12-12 17:23:37.000 UTC,476,23617435,0x45F8b8eC9c92D09BA8495074436fD97073423041
0xdc98dbffcc648d6088a2ff8f7dc01aef050e58fc,0xeec59a1750f93e53eba604a2bdcb68a4b276b8d7ffccc199fc883c70f4b60049,04-01-2025,2025-01-04 05:26:17.000 UTC,287,24589515,0xBDA319Bc7Cc8F0829df39eC0FFF5D1E061FFadf7
0x8fd1b615c006ebeb8a7cfb00a1dd809f31943b08,0xfcd2cbb30b7c69785dafb7c71308bf8b13e278edbf7b2be0cd3ba0e09a2ddb7e,13-12-2024,2024-12-13 20:58:53.000 UTC,292,23667093,0xBDA319Bc7Cc8F0829df39eC0FFF5D1E061FFadf7
0x9eb86e93a809a41ab0e7cc0ba6f62561fda3015c,0xca27215de201f6fdb5f18977df6828b14d441a454e3ec51871d793f54073eae4,01-01-2025,2025-01-01 11:03:43.000 UTC,495,24470038,0xC23924a846eca931Ec3014253E94f15b038bd0C8
0x8508fd4238162cb3f3d485f432202af3b40f164e,0x603bb9434fe7f22642be1156e6a648d54f8a2a5075bdaa6c7c409806d2a44261,22-05-2025,2025-05-22 05:12:33.000 UTC,665,30550703,0x6205DfbE68444cFF504A20a712cEa794c6b6Cf04
0x2791dc5e14f7680d9d969acc26059ba56403b6d5,0x98e67692453564cf2ae7653f72d881b1a9236c7e827461a12e5cd5ae790c6e33,20-12-2024,2024-12-20 21:05:57.000 UTC,617,23969705,0xBDA319Bc7Cc8F0829df39eC0FFF5D1E061FFadf7
0x9eb86e93a809a41ab0e7cc0ba6f62561fda3015c,0x8a42f935be90dd5fd89703383cb4f8b0dd6f8a202f583e633b1753cb8c29bb20,22-05-2025,2025-05-22 09:03:37.000 UTC,863,30557635,0xc3f97660D0b47F0E05C3c513f73eeff7c1bd6c7a
0x8508fd4238162cb3f3d485f432202af3b40f164e,0xa59b9d8199c02c79d165a4c8a44fcffda7a0f08c961b1812e9c5a188fa450847,06-06-2025,2025-06-06 19:00:19.000 UTC,613,31223536,0x6205DfbE68444cFF504A20a712cEa794c6b6Cf04
0xdc98dbffcc648d6088a2ff8f7dc01aef050e58fc,0xeaabe90c47760baf7c083942cf764dc21c23425377068992625099cc609de373,11-01-2025,2025-01-11 08:20:25.000 UTC,612,24897139,0xBDA319Bc7Cc8F0829df39eC0FFF5D1E061FFadf7
0x38f6d2d9ea493c3c6ee865b5b952b5fe9e3e61fc,0x9d86aaa4d92e84d293b804e67762d9b56681b2a15b70a8d8332bf08f1560e525,27-05-2025,2025-05-27 20:35:03.000 UTC,597,30794378,0xCFede447ca3b4885720B5a327e3BFb02078f06e8
0x38f6d2d9ea493c3c6ee865b5b952b5fe9e3e61fc,0x1cd3a65b45236bb064f88fa23b451f2ce531695b6bbe47aca76d94b941d00a30,10-01-2025,2025-01-10 04:45:49.000 UTC,231,24847501,0xBDA319Bc7Cc8F0829df39eC0FFF5D1E061FFadf7
0x9eb86e93a809a41ab0e7cc0ba6f62561fda3015c,0x3f866c16807242c2fc28b4e9469c64e5a096ca441299826b7ae0ed71ce01f414,20-02-2025,2025-02-20 16:14:41.000 UTC,324,26639367,0x6399ed6725cC163D019aA64FF55b22149D7179A8
0x9eb86e93a809a41ab0e7cc0ba6f62561fda3015c,0xb045e7116d05d3d46d6f97f56b4e7052d4654ae2c4d8c9565f6e82ac56b13dc0,19-06-2025,2025-06-19 17:19:43.000 UTC,483,31782118,0xc3f97660D0b47F0E05C3c513f73eeff7c1bd6c7a
0x8508fd4238162cb3f3d485f432202af3b40f164e,0x25993edea6aa6f655689e861495f84ab6e1189668f41d562a3a8e05f68e6794d,03-06-2025,2025-06-03 12:39:01.000 UTC,6733,31082497,0xc3f97660D0b47F0E05C3c513f73eeff7c1bd6c7a
0x9eb86e93a809a41ab0e7cc0ba6f62561fda3015c,0xbdb3984dee4ff02f56ba935f7ce5f1a95fd57efae9d8abf3007987a07605519d,17-05-2025,2025-05-17 08:54:27.000 UTC,1428,30341360,0xc3f97660D0b47F0E05C3c513f73eeff7c1bd6c7a
0x8fd1b615c006ebeb8a7cfb00a1dd809f31943b08,0xb311618eb008e190f5c14a0775e92d233a481d86e6ce069ddc0af4fe367bd67d,23-12-2024,2024-12-23 03:56:39.000 UTC,227,24068426,0x45F8b8eC9c92D09BA8495074436fD97073423041
0x8508fd4238162cb3f3d485f432202af3b40f164e,0x41eb50fe6630e07ad37d9ddd179a1d9620797ecff517b34558c8c49682ad7d2c,25-05-2025,2025-05-25 21:30:07.000 UTC,715,30709630,0xc3f97660D0b47F0E05C3c513f73eeff7c1bd6c7a
0x2791dc5e14f7680d9d969acc26059ba56403b6d5,0xd82a4fea907f002eb3e5472832182413314daa206177e7aad825bfade3e8524a,14-12-2024,2024-12-14 10:48:47.000 UTC,200,23691990,0xBDA319Bc7Cc8F0829df39eC0FFF5D1E061FFadf7
0x2791dc5e14f7680d9d969acc26059ba56403b6d5,0x1724bcf1c8fdbb4aff583ab5648a52890ee2a52ed4c697e2b9ac3ac61ad9c758,03-01-2025,2025-01-03 06:56:43.000 UTC,130,24549028,0xB9E4E0368A9F281584C9adB685e6C9F4b9F37dBb
0xdc98dbffcc648d6088a2ff8f7dc01aef050e58fc,0x3cfb6e6ffc3593e416bfdf4721717b1eb5bfd872b15770ef1979331c80bd3e9c,11-01-2025,2025-01-11 03:34:35.000 UTC,252,24888564,0x0e956C897bBFCbd2155D3DfdD27c87fa5A0FaD39
0x9eb86e93a809a41ab0e7cc0ba6f62561fda3015c,0x10e507b93b03eeaf05d69f949a99e05715146b75ce10b93b3b166e833f5b0a6b,04-01-2025,2025-01-04 17:55:41.000 UTC,351,24611997,0xC23924a846eca931Ec3014253E94f15b038bd0C8
0x9eb86e93a809a41ab0e7cc0ba6f62561fda3015c,0xf1cf88be3c83636dbbd2d6ea799d07151c68092164ecf7bc97472dab8fbb9731,27-12-2024,2024-12-27 11:20:07.000 UTC,481,24254530,0xCFede447ca3b4885720B5a327e3BFb02078f06e8
0x2791dc5e14f7680d9d969acc26059ba56403b6d5,0x409dcad701724b82f2ca4ff2dd1b3c3320fcf34f2fe7c6c4a513d032b040ad1f,27-12-2024,2024-12-27 04:56:05.000 UTC,506,24243009,0xBDA319Bc7Cc8F0829df39eC0FFF5D1E061FFadf7
0x9eb86e93a809a41ab0e7cc0ba6f62561fda3015c,0x06c335c832b9bb5bc14fede4d25bc5f776f05bda0225b80e88fa8ee3adc0e9c8,13-12-2024,2024-12-13 18:40:01.000 UTC,366,23662927,0xBDA319Bc7Cc8F0829df39eC0FFF5D1E061FFadf7
0x351f61e4c49cf11f24d9f2e737ca5eff81806355,0x68120b063d289d71a5da998c6996115fd1e348a53609c9728e6fc3f4bcd5f471,21-08-2025,2025-08-21 02:34:41.000 UTC,471,34477167,0x0e956C897bBFCbd2155D3DfdD27c87fa5A0FaD39
0x38f6d2d9ea493c3c6ee865b5b952b5fe9e3e61fc,0x8d7cc363a0b1c239fe91cd86410f3f7e1186fce30c779735272b955ba6aaf6fa,05-01-2025,2025-01-05 22:12:45.000 UTC,315,24662909,0xB9E4E0368A9F281584C9adB685e6C9F4b9F37dBb
0x8508fd4238162cb3f3d485f432202af3b40f164e,0xa04d21e66cadc4b4b6593a24edf42bb059a9ff4daa3e090980aa6dfce8344248,10-04-2025,2025-04-10 20:05:31.000 UTC,129,28763092,0x2B74B62c564456C48055bd515A62594742b3f545
0xdc98dbffcc648d6088a2ff8f7dc01aef050e58fc,0x258a2b20e991806835d30d160848eb48eafe242f921cf930b54c33d1f0b5be39,03-06-2025,2025-06-03 06:46:15.000 UTC,2129,31071914,0xf2c38dE50A250C0060fB45eBE4504B67f6F1be3C
0x2791dc5e14f7680d9d969acc26059ba56403b6d5,0xf3df5746e87b7794032e64307e9d46e5fe6841a9b81cc9472141d043de487547,14-01-2025,2025-01-14 06:07:27.000 UTC,309,25022750,0xBDA319Bc7Cc8F0829df39eC0FFF5D1E061FFadf7
0xdc98dbffcc648d6088a2ff8f7dc01aef050e58fc,0x23dd085461edac56b83de2e2d0d435262ce6bafd0f5355111d78da8bdbfdc048,10-06-2025,2025-06-10 12:29:35.000 UTC,334,31384614,0x430C09546ae9249AB75B9A4ef7B5FD9a4006D6f3
0x8508fd4238162cb3f3d485f432202af3b40f164e,0x2581631f724ec5dc4412521338deb67d512436ad3abf6dc0fedc2ef383382a4a,07-07-2025,2025-07-07 17:52:41.000 UTC,572,32560707,0x6205DfbE68444cFF504A20a712cEa794c6b6Cf04
0x2791dc5e14f7680d9d969acc26059ba56403b6d5,0x4d271e7e427f04240f7f1d360dbe28013782e899df1a61d773f384341836d88b,13-12-2024,2024-12-13 12:51:43.000 UTC,307,23652478,0xBDA319Bc7Cc8F0829df39eC0FFF5D1E061FFadf7
0x8fd1b615c006ebeb8a7cfb00a1dd809f31943b08,0xca36a1f2e0cff2137b9ffa1548f95bc5a14b71c4164bd936866783e72fe8a0b9,25-12-2024,2024-12-25 11:42:13.000 UTC,308,24168793,0xCFede447ca3b4885720B5a327e3BFb02078f06e8
0x9eb86e93a809a41ab0e7cc0ba6f62561fda3015c,0x31ceec2acd23f131ab262019429089f13207f0e11807b1b041ede30a1cc3393b,08-12-2024,2024-12-08 02:27:07.000 UTC,237,23417740,0x0e956C897bBFCbd2155D3DfdD27c87fa5A0FaD39
0x9eb86e93a809a41ab0e7cc0ba6f62561fda3015c,0xeb1105fc07f8a4fb2110a83fc2924ae87298e37890c73443123b9a3be9c07f0d,10-12-2024,2024-12-10 01:39:35.000 UTC,199,23502714,0x41b2126661C673C2beDd208cC72E85DC51a5320a
0x8810de2baa17067ddcfbd9e8f29c55f070a55f0b,0x2ab6d61aca871cc13ac0316d1c1e9a3f0639113775c88026ee1d90dc8ec240a9,19-03-2025,2025-03-19 22:09:59.000 UTC,333,27816426,0x0e956C897bBFCbd2155D3DfdD27c87fa5A0FaD39
0x9eb86e93a809a41ab0e7cc0ba6f62561fda3015c,0x33311215ae8077a79aab25a68d5965a695ac08b8a6c5df4fe7c549722ec2c508,09-01-2025,2025-01-09 02:44:11.000 UTC,370,24800652,0xC23924a846eca931Ec3014253E94f15b038bd0C8
0x8fd1b615c006ebeb8a7cfb00a1dd809f31943b08,0x2a33b27ef641afb72f51ed73920a7168d9111f33459e52c967978ec77cee8ad9,05-01-2025,2025-01-05 00:28:57.000 UTC,276,24623795,0xBDA319Bc7Cc8F0829df39eC0FFF5D1E061FFadf7
0x38f6d2d9ea493c3c6ee865b5b952b5fe9e3e61fc,0x451b7091b51da81d866b67dd4bb017cbaa553c2c7c76cf0ae47402e307aa2d17,30-05-2025,2025-05-30 21:34:03.000 UTC,567,30925748,0xc3f97660D0b47F0E05C3c513f73eeff7c1bd6c7a
0x095d0de0ecfd6832f1a7961ae26d285d68655d60,0xf4c2489674718748cb463cd262904156634cb8e06d452c139d06b57916e2da71,28-02-2025,2025-02-28 05:17:01.000 UTC,291,26965237,0x0e956C897bBFCbd2155D3DfdD27c87fa5A0FaD39
0x38f6d2d9ea493c3c6ee865b5b952b5fe9e3e61fc,0xe5d936247fa897347b4368ffc54f8eb8146e90373540e3bb590082d05c413612,24-12-2024,2024-12-24 18:38:19.000 UTC,297,24138076,0xCFede447ca3b4885720B5a327e3BFb02078f06e8
0x8508fd4238162cb3f3d485f432202af3b40f164e,0xd87fe3db07e2427f89307ea1a738bb68a5951714301c7c2b0f54947a95230d06,31-03-2025,2025-03-31 09:56:15.000 UTC,509,28312814,0x2B74B62c564456C48055bd515A62594742b3f545
0x095d0de0ecfd6832f1a7961ae26d285d68655d60,0xe5bb9a5a638513a62ab6d1127c244c4515cbb6d1886da3c93cd4c284f70aed02,18-03-2025,2025-03-18 11:35:25.000 UTC,233,27754189,0x0e956C897bBFCbd2155D3DfdD27c87fa5A0FaD39
0xdc98dbffcc648d6088a2ff8f7dc01aef050e58fc,0xd475fdecbb95aec30d69beb4ff47cddf4d2b064be035ed07bdfef65241245fe3,27-05-2025,2025-05-27 03:46:43.000 UTC,265,30764128,0xc3f97660D0b47F0E05C3c513f73eeff7c1bd6c7a
0xdc98dbffcc648d6088a2ff8f7dc01aef050e58fc,0x51293d2015a8de6ec3beb1cfc5a29377870bd68c5fee55b8351e86fcaa1c9a7c,06-01-2025,2025-01-06 02:43:07.000 UTC,447,24671020,0xBDA319Bc7Cc8F0829df39eC0FFF5D1E061FFadf7
0x9eb86e93a809a41ab0e7cc0ba6f62561fda3015c,0x70ccf055746ba72859378fa2f2a82cfb57431fa138ee807623945852cc99f69b,13-12-2024,2024-12-13 08:50:33.000 UTC,279,23645243,0xBDA319Bc7Cc8F0829df39eC0FFF5D1E061FFadf7
0x38f6d2d9ea493c3c6ee865b5b952b5fe9e3e61fc,0x372c18fac7d317e6618e04009f437b3f844d5909672730d445b97ccfa6691f39,12-01-2025,2025-01-12 01:34:57.000 UTC,279,24928175,0x869305781fff479f0311974d55FeeB6Fc9DE96a2
0x2791dc5e14f7680d9d969acc26059ba56403b6d5,0x5c1ee5cdbe1f7d171dd1586f88f44a0055a3f1d38456a3746b7f84a9ef874e25,07-02-2025,2025-02-07 16:12:53.000 UTC,226,26077713,0xB9E4E0368A9F281584C9adB685e6C9F4b9F37dBb
0x095d0de0ecfd6832f1a7961ae26d285d68655d60,0xa24c665383830f0bfb2bef8cb1b77fb6a018834153110f754038bcd5aa7decab,15-07-2025,2025-07-15 06:00:59.000 UTC,505,32884956,0xCFede447ca3b4885720B5a327e3BFb02078f06e8
0xdc98dbffcc648d6088a2ff8f7dc01aef050e58fc,0x90b193223192286204f82bdc60eca7b61b09c352f9793da5bd5ac6ddc17b646f,04-01-2025,2025-01-04 08:10:13.000 UTC,712,24594433,0xB9E4E0368A9F281584C9adB685e6C9F4b9F37dBb
0x8508fd4238162cb3f3d485f432202af3b40f164e,0xf9ecec76f0048059f4015f9241cc9915f7dbcd882a018230818faed8838ccf40,09-04-2025,2025-04-09 23:03:11.000 UTC,340,28725222,0x6205DfbE68444cFF504A20a712cEa794c6b6Cf04
0x351f61e4c49cf11f24d9f2e737ca5eff81806355,0x04cdfa02d54ef4b8e853a55da57fa716cf81832cebcfb9a57104c262b20d9914,21-09-2025,2025-09-21 09:03:39.000 UTC,113,35828036,0x0e956C897bBFCbd2155D3DfdD27c87fa5A0FaD39
0x2791dc5e14f7680d9d969acc26059ba56403b6d5,0x376ec1631f4fde288301bc5baf548dc224ce783686207b0ee01fa4316cb6f970,23-12-2024,2024-12-23 22:27:39.000 UTC,518,24101756,0xBDA319Bc7Cc8F0829df39eC0FFF5D1E061FFadf7
0x8fd1b615c006ebeb8a7cfb00a1dd809f31943b08,0xdde6d669f8f45b1931d4749b2736a25eb8074a0bc52099f5c7ee6ab18863234c,09-02-2025,2025-02-09 13:54:33.000 UTC,215,26159963,0xF33a96b5932D9E9B9A0eDA447AbD8C9d48d2e0c8
0x2791dc5e14f7680d9d969acc26059ba56403b6d5,0xb431d4980243498ef92092053ed772ad37a3a770a28493ef32b183635ce41a79,15-01-2025,2025-01-15 19:51:59.000 UTC,515,25090686,0xB9E4E0368A9F281584C9adB685e6C9F4b9F37dBb
0x8508fd4238162cb3f3d485f432202af3b40f164e,0x3c829bf064357b6c249120610b4a0d5aeb520ca406ca22bd48701387281b2282,12-03-2025,2025-03-12 12:57:39.000 UTC,342,27497456,0x2B74B62c564456C48055bd515A62594742b3f545
0x8fd1b615c006ebeb8a7cfb00a1dd809f31943b08,0x8c0bb8181a61978e568724c092b2c2401b386793eccf31c498a819388d618cd8,14-12-2024,2024-12-14 12:57:21.000 UTC,230,23695847,0xBDA319Bc7Cc8F0829df39eC0FFF5D1E061FFadf7
0x8fd1b615c006ebeb8a7cfb00a1dd809f31943b08,0x4fcdc8dc9eb067ccf8664f4b8678b0124012f01cd13a5a278f5137b6ec323f1d,23-12-2024,2024-12-23 12:09:55.000 UTC,204,24083224,0xBDA319Bc7Cc8F0829df39eC0FFF5D1E061FFadf7
0x9eb86e93a809a41ab0e7cc0ba6f62561fda3015c,0x28486e5ae41b0084f2aa5472d49c4cf6b7fea2c43331e7d5b015bd39f864ae24,31-01-2025,2025-01-31 17:02:49.000 UTC,383,25776811,0xB9E4E0368A9F281584C9adB685e6C9F4b9F37dBb
0x2791dc5e14f7680d9d969acc26059ba56403b6d5,0x245d7475997bb236cc9f0704a51c7af0b63a5ea7895ec5178a3b22bc8f4b4628,16-12-2024,2024-12-16 10:58:07.000 UTC,260,23778670,0xBDA319Bc7Cc8F0829df39eC0FFF5D1E061FFadf7
0x2791dc5e14f7680d9d969acc26059ba56403b6d5,0x4ffeca80dbbe19b1779551ac68cdf0c90b4383dcd34c27ba85b42c859af3cd39,19-12-2024,2024-12-19 01:40:39.000 UTC,329,23891546,0xBDA319Bc7Cc8F0829df39eC0FFF5D1E061FFadf7
0x2791dc5e14f7680d9d969acc26059ba56403b6d5,0x017d494a44e01846b514bb53c60a9949884287e0f58d6b70825e77f15fe6ed4a,14-12-2024,2024-12-14 04:12:21.000 UTC,501,23680097,0xBDA319Bc7Cc8F0829df39eC0FFF5D1E061FFadf7
0xdc98dbffcc648d6088a2ff8f7dc01aef050e58fc,0xd1e335c9d029608564478e49486338d4e98bfe1da7744d25e55687b052b46930,12-01-2025,2025-01-12 20:12:55.000 UTC,507,24961714,0xBDA319Bc7Cc8F0829df39eC0FFF5D1E061FFadf7
0x38f6d2d9ea493c3c6ee865b5b952b5fe9e3e61fc,0x5f7e2258ef9a152b4fe09aee3f76e1b24c5d3ea45f29a5974029206959e10611,31-05-2025,2025-05-31 11:38:01.000 UTC,605,30951067,0xc3f97660D0b47F0E05C3c513f73eeff7c1bd6c7a
0x8810de2baa17067ddcfbd9e8f29c55f070a55f0b,0xdbe26f43410bed9cbbffa3def25a7986650b93ef62b133a6c450316fa46f9e5c,01-05-2025,2025-05-01 23:12:21.000 UTC,789,29675897,0x0e956C897bBFCbd2155D3DfdD27c87fa5A0FaD39
0x8508fd4238162cb3f3d485f432202af3b40f164e,0x417e71a3b54f4541b4261240ee6266ecfa35f2fd5f564b95f1fa2ae47f1a7688,03-06-2025,2025-06-03 13:40:11.000 UTC,470,31084332,0xc3f97660D0b47F0E05C3c513f73eeff7c1bd6c7a
0x9eb86e93a809a41ab0e7cc0ba6f62561fda3015c,0x9b336efb4b4cca39842de09f71805f9897dff39370f1341deba0110a45fbb2d4,09-06-2025,2025-06-09 13:00:45.000 UTC,956,31342349,0xc3f97660D0b47F0E05C3c513f73eeff7c1bd6c7a
0x2791dc5e14f7680d9d969acc26059ba56403b6d5,0x5fa87bd8c99aafdbb9e0ca4ab2f8d56022a02197e2c3a6cfa86da8e98304c6e1,12-12-2024,2024-12-12 19:17:25.000 UTC,291,23620849,0xBDA319Bc7Cc8F0829df39eC0FFF5D1E061FFadf7
0x8fd1b615c006ebeb8a7cfb00a1dd809f31943b08,0xec1bf6095a73672d72371d275e0d791997c6cdea1620bac9ea26fc33a44440d3,05-01-2025,2025-01-05 07:56:15.000 UTC,279,24637214,0xBDA319Bc7Cc8F0829df39eC0FFF5D1E061FFadf7
0x9eb86e93a809a41ab0e7cc0ba6f62561fda3015c,0xf3cad043a3ce98de167f79a7c8b3d47f544082336b651a9cd226ee48fdaaabf0,29-06-2025,2025-06-29 23:52:01.000 UTC,339,32225887,0xCFede447ca3b4885720B5a327e3BFb02078f06e8
0x38f6d2d9ea493c3c6ee865b5b952b5fe9e3e61fc,0x4ea9942150997dd3b2e671cd6990c054b43ad7b064a46b580ad0737d2fc328c7,09-01-2025,2025-01-09 04:12:29.000 UTC,566,24803301,0xB9E4E0368A9F281584C9adB685e6C9F4b9F37dBb
0xdc98dbffcc648d6088a2ff8f7dc01aef050e58fc,0x6accbf94d5ba7fd6bdbf716672e0574d36eea45380b69c58e6d3de410374946f,03-01-2025,2025-01-03 13:44:45.000 UTC,390,24561269,0xB9E4E0368A9F281584C9adB685e6C9F4b9F37dBb
0x8fd1b615c006ebeb8a7cfb00a1dd809f31943b08,0xba735824981e5b2ed92decf9ce0e60d1f6c45ea350bc6b090eeea5a84c34ef8c,04-01-2025,2025-01-04 09:47:07.000 UTC,331,24597340,0xAfabcBbab5e4261B1d655c906738176191819164
0x38f6d2d9ea493c3c6ee865b5b952b5fe9e3e61fc,0x8b6324b68808e4dd36a948bddac849a75f47c2c93ea5bb7e31ae765c036669ea,03-06-2025,2025-06-03 00:45:45.000 UTC,728,31061099,0xc3f97660D0b47F0E05C3c513f73eeff7c1bd6c7a
0x9eb86e93a809a41ab0e7cc0ba6f62561fda3015c,0x06677abb6ea537ec25098ae549e32c322af199712febe138b0dc621ffd0c5838,16-12-2024,2024-12-16 10:54:27.000 UTC,259,23778560,0xCFede447ca3b4885720B5a327e3BFb02078f06e8
0x8fd1b615c006ebeb8a7cfb00a1dd809f31943b08,0xaea9bbc56a43cc5e3fb8391920222fc497a74e8d2922e2947ff75ac48c9fb2bb,23-12-2024,2024-12-23 06:25:09.000 UTC,301,24072881,0xCFede447ca3b4885720B5a327e3BFb02078f06e8
0x8fd1b615c006ebeb8a7cfb00a1dd809f31943b08,0x941d4cd05cbd41acfe5c97f7ec7466e3bb304e09689a750117db6d50c04b00b6,02-01-2025,2025-01-02 11:49:59.000 UTC,575,24514626,0xBDA319Bc7Cc8F0829df39eC0FFF5D1E061FFadf7
0x38f6d2d9ea493c3c6ee865b5b952b5fe9e3e61fc,0x809980d466d013c5f8c6acf0eabde9e0ea1959a5d3b67f73f9235c39707f388f,08-01-2025,2025-01-08 10:51:59.000 UTC,458,24772086,0x0e956C897bBFCbd2155D3DfdD27c87fa5A0FaD39
0x38f6d2d9ea493c3c6ee865b5b952b5fe9e3e61fc,0xfef784c39fdfaf845f395d315de262134d6dc5581cbd5e9ff0b42218aa8191e0,04-01-2025,2025-01-04 11:40:07.000 UTC,414,24600730,0xB9E4E0368A9F281584C9adB685e6C9F4b9F37dBb
0x9eb86e93a809a41ab0e7cc0ba6f62561fda3015c,0xd9292dd4e0dc2924e06d13908a28924e386053453cb259238f73fcef63399a1d,07-06-2025,2025-06-07 04:18:29.000 UTC,958,31240281,0xc3f97660D0b47F0E05C3c513f73eeff7c1bd6c7a
0x9eb86e93a809a41ab0e7cc0ba6f62561fda3015c,0x32869030a1a827d9a730d60562e65b79eabcfa8ba3f59ac67504bd9502d6b1bc,01-01-2025,2025-01-01 20:00:35.000 UTC,510,24486144,0xBDA319Bc7Cc8F0829df39eC0FFF5D1E061FFadf7
0x38f6d2d9ea493c3c6ee865b5b952b5fe9e3e61fc,0x077a205ea7a39ddb5528b4b20f5176fad33f4ec16d15435e78af728c1aea1b9e,13-01-2025,2025-01-13 18:28:33.000 UTC,383,25001783,0x869305781fff479f0311974d55FeeB6Fc9DE96a2
0xdc98dbffcc648d6088a2ff8f7dc01aef050e58fc,0xf2ca56780168d3b3692571a50a3b49920d52ecfff430a48dbfcc644a7da1175e,15-06-2025,2025-06-15 15:10:49.000 UTC,1045,31605451,0xf2c38dE50A250C0060fB45eBE4504B67f6F1be3C
0x8810de2baa17067ddcfbd9e8f29c55f070a55f0b,0x9a544d89ac5eec8b175435665678c9d10c2fc34da7ceaa022e25def3c4d0fffb,09-03-2025,2025-03-09 13:48:25.000 UTC,281,27369379,0x0e956C897bBFCbd2155D3DfdD27c87fa5A0FaD39
0x8508fd4238162cb3f3d485f432202af3b40f164e,0xaaf0af35e3513f9bee81c42afbed0edbe191c74eb785172bb4627ef5ce0bfdc6,19-04-2025,2025-04-19 14:42:21.000 UTC,119,29142197,0x2B74B62c564456C48055bd515A62594742b3f545
0x8508fd4238162cb3f3d485f432202af3b40f164e,0xefa6c2090210cb7c9ac79aedfbaf46052b194f83cc1e6f7b4e6edd83f483009c,03-06-2025,2025-06-03 03:46:51.000 UTC,662,31066532,0xc3f97660D0b47F0E05C3c513f73eeff7c1bd6c7a
0xdc98dbffcc648d6088a2ff8f7dc01aef050e58fc,0x9a03c648cfe3dcb2cc453b43a253009a1da44d61f6c492930fcaa26c05d3d0bf,06-01-2025,2025-01-06 03:28:19.000 UTC,229,24672376,0x0e956C897bBFCbd2155D3DfdD27c87fa5A0FaD39
0x38f6d2d9ea493c3c6ee865b5b952b5fe9e3e61fc,0xc47b70aa01f0239b363d18d285c38840694bf528ce00f9484a96aed1deb34d78,07-06-2025,2025-06-07 01:21:33.000 UTC,445,31234973,0xc3f97660D0b47F0E05C3c513f73eeff7c1bd6c7a
0x9eb86e93a809a41ab0e7cc0ba6f62561fda3015c,0x16595d170406ee648a23d970bc7815b552b128ba91ae539f0f9af554a548dac4,12-12-2024,2024-12-12 21:56:19.000 UTC,226,23625616,0xBDA319Bc7Cc8F0829df39eC0FFF5D1E061FFadf7
0x2791dc5e14f7680d9d969acc26059ba56403b6d5,0xc195bce5a3e08d62a03e463e4a10dbae9fcdd7d4c96ffd4db5fc91addbcf639b,09-01-2025,2025-01-09 12:43:11.000 UTC,116,24818622,0xCFede447ca3b4885720B5a327e3BFb02078f06e8
0x38f6d2d9ea493c3c6ee865b5b952b5fe9e3e61fc,0x594369235f44455b626e646713c97ebd19df3b8046f5e75cdc85ced305e96081,05-01-2025,2025-01-05 23:24:53.000 UTC,340,24665073,0x869305781fff479f0311974d55FeeB6Fc9DE96a2
0x9eb86e93a809a41ab0e7cc0ba6f62561fda3015c,0xbe2e79ef1f64d44037b6d3c202c8b6d4a6d0e14bb9776eb8c0923190f69565f9,05-02-2025,2025-02-05 21:21:45.000 UTC,176,26000579,0xB9E4E0368A9F281584C9adB685e6C9F4b9F37dBb
0x095d0de0ecfd6832f1a7961ae26d285d68655d60,0xf3e93489a50efebece19e1a7899ca3a98ed2ec74917c588372c9073e8bca0a4a,13-04-2025,2025-04-13 22:02:57.000 UTC,581,28896215,0x869305781fff479f0311974d55FeeB6Fc9DE96a2
0x2791dc5e14f7680d9d969acc26059ba56403b6d5,0x80dec04fa32f50d256a4e4d15395d96a35d722b056d6686c40a2d8bb006733c7,11-03-2025,2025-03-11 06:51:17.000 UTC,197,27443265,0xCFede447ca3b4885720B5a327e3BFb02078f06e8
0x8fd1b615c006ebeb8a7cfb00a1dd809f31943b08,0xd8366e6e3003093d6eb239ba5302ae4585fb289949c930d76275b9cb2f29466c,29-12-2024,2024-12-29 18:57:23.000 UTC,361,24354648,0x45F8b8eC9c92D09BA8495074436fD97073423041
0xdc98dbffcc648d6088a2ff8f7dc01aef050e58fc,0xd05fa3238770f8e216394e78ed4399cf96760f646ffa6ddca0ebf0365d0b7051,14-01-2025,2025-01-14 07:20:39.000 UTC,309,25024946,0xBDA319Bc7Cc8F0829df39eC0FFF5D1E061FFadf7
0x8508fd4238162cb3f3d485f432202af3b40f164e,0xd6b751c37ddebf41982f1a1d856601e7b40735ea4ef19fcb7820d88d96f09f3b,27-05-2025,2025-05-27 19:27:51.000 UTC,759,30792362,0x6205DfbE68444cFF504A20a712cEa794c6b6Cf04
0x9eb86e93a809a41ab0e7cc0ba6f62561fda3015c,0xe3a91a723cb4e79efd20dcd755a0073f050533782a933d8c97094f24d5092536,23-12-2024,2024-12-23 17:54:29.000 UTC,269,24093561,0xBDA319Bc7Cc8F0829df39eC0FFF5D1E061FFadf7
0x2791dc5e14f7680d9d969acc26059ba56403b6d5,0x6eace9816d68cd324e34c65234bf8e16138476d3a6534275e11b09b0a96f4b2e,17-12-2024,2024-12-17 08:58:33.000 UTC,410,23818283,0xBDA319Bc7Cc8F0829df39eC0FFF5D1E061FFadf7
0x38f6d2d9ea493c3c6ee865b5b952b5fe9e3e61fc,0xd8cc72e17e352f5418a0078403039b48b1d5630545575c08aed8fbb731095baf,27-12-2024,2024-12-27 03:19:23.000 UTC,717,24240108,0xCFede447ca3b4885720B5a327e3BFb02078f06e8
0x2791dc5e14f7680d9d969acc26059ba56403b6d5,0xc6d9c62cbd168f91f7b0af8e9756de78a3051b8f88149bb2cb1e5554f64bcd9c,29-12-2024,2024-12-29 13:36:33.000 UTC,188,24345023,0xBDA319Bc7Cc8F0829df39eC0FFF5D1E061FFadf7
0x38f6d2d9ea493c3c6ee865b5b952b5fe9e3e61fc,0xe2288d0c2e1c3c828114c7b445df5b906dc6254095066256debbbde878533909,02-01-2025,2025-01-02 14:18:37.000 UTC,411,24519085,0xBDA319Bc7Cc8F0829df39eC0FFF5D1E061FFadf7
0x2791dc5e14f7680d9d969acc26059ba56403b6d5,0x1258fbf655263c6dee39778b0c13dbc64ea3becac5d972a38da172c8c7ccdf48,12-01-2025,2025-01-12 21:21:53.000 UTC,462,24963783,0x0e956C897bBFCbd2155D3DfdD27c87fa5A0FaD39
0x095d0de0ecfd6832f1a7961ae26d285d68655d60,0x0e58764061c09e98f9f25b2a689d26e1fb0da4e2c4858aec20ef4fd934a32211,18-02-2025,2025-02-18 05:40:19.000 UTC,106,26533936,0xB9E4E0368A9F281584C9adB685e6C9F4b9F37dBb
0x38f6d2d9ea493c3c6ee865b5b952b5fe9e3e61fc,0xf94976e20e2396abcb1163d89fee9506a3066995ca2c009bc782ab97945e84bc,10-01-2025,2025-01-10 01:00:05.000 UTC,177,24840729,0x0e956C897bBFCbd2155D3DfdD27c87fa5A0FaD39
0x8508fd4238162cb3f3d485f432202af3b40f164e,0x32c15a9e24c63f1d91f74adfc989071446477310322ba9ac608ede3de2267eb0,02-04-2025,2025-04-02 00:46:33.000 UTC,509,28382723,0x2B74B62c564456C48055bd515A62594742b3f545
0xdc98dbffcc648d6088a2ff8f7dc01aef050e58fc,0x5c25e0d1fb7a10441f96d6c347416ed6db02d9c16be59ad7e9d0eb77c0e41cc9,21-05-2025,2025-05-21 01:16:13.000 UTC,222,30500413,0xCFede447ca3b4885720B5a327e3BFb02078f06e8
0x9eb86e93a809a41ab0e7cc0ba6f62561fda3015c,0xb0206cc58a95981626cfcc7a176c278f857e85b42f9ed378dbe52a0243d53043,01-01-2025,2025-01-01 18:57:03.000 UTC,409,24484238,0xBDA319Bc7Cc8F0829df39eC0FFF5D1E061FFadf7
0x9eb86e93a809a41ab0e7cc0ba6f62561fda3015c,0x99e397593ba340a3d96666f5230b6c06eedf1f957685ab799b76605837275efc,21-02-2025,2025-02-21 17:29:23.000 UTC,394,26684808,0x6399ed6725cC163D019aA64FF55b22149D7179A8
0x2791dc5e14f7680d9d969acc26059ba56403b6d5,0x7e1f0d984da8492b8c50bd2b20b3c1238fc3174882d911b061a437beee0076ff,08-01-2025,2025-01-08 02:28:17.000 UTC,162,24756975,0xB9E4E0368A9F281584C9adB685e6C9F4b9F37dBb
0x2791dc5e14f7680d9d969acc26059ba56403b6d5,0x49d0ca7b8d96faafa318896ddcc1139650de78993dd5933a76308f13faa7432d,08-01-2025,2025-01-08 08:10:23.000 UTC,276,24767238,0xB9E4E0368A9F281584C9adB685e6C9F4b9F37dBb
0xdc98dbffcc648d6088a2ff8f7dc01aef050e58fc,0x27b3efc85d8fe1e5efb11be889bf100395342b202ad54638ad3d0a8e849c5f3c,04-01-2025,2025-01-04 10:13:39.000 UTC,199,24598136,0xBDA319Bc7Cc8F0829df39eC0FFF5D1E061FFadf7
0x2791dc5e14f7680d9d969acc26059ba56403b6d5,0xc07fb5f3167e257058c8de11526774d4273592ec72a8cba6b281ea7183d78bef,14-01-2025,2025-01-14 16:36:49.000 UTC,185,25041631,0xBDA319Bc7Cc8F0829df39eC0FFF5D1E061FFadf7
0xdc98dbffcc648d6088a2ff8f7dc01aef050e58fc,0x3f9bd1bcd743497ef1d73e11ddfde7056f57112361aa727dd6cf9eb40dfe8f51,19-06-2025,2025-06-19 17:23:15.000 UTC,263,31782224,0xc3f97660D0b47F0E05C3c513f73eeff7c1bd6c7a
0x2791dc5e14f7680d9d969acc26059ba56403b6d5,0x7ef269b76d4c7e51988ce994e813da869978bdad7c9d2595fc11a9d635515076,14-12-2024,2024-12-14 00:53:55.000 UTC,350,23674144,0xBDA319Bc7Cc8F0829df39eC0FFF5D1E061FFadf7
0x2791dc5e14f7680d9d969acc26059ba56403b6d5,0x45527ee56ceff8c473e4c0674ca614790187430e7dd9b099fcea95e7da11d9bc,03-03-2025,2025-03-03 21:04:55.000 UTC,399,27123274,0x0e956C897bBFCbd2155D3DfdD27c87fa5A0FaD39
0x095d0de0ecfd6832f1a7961ae26d285d68655d60,0x67e632f4c33f38b6277d06ba8a74029a62cda04371547c467c7663e0e6c00a14,05-02-2025,2025-02-05 21:14:37.000 UTC,257,26000365,0x0e956C897bBFCbd2155D3DfdD27c87fa5A0FaD39
0x351f61e4c49cf11f24d9f2e737ca5eff81806355,0x9662ad02a8830c5afd0f997425508b185fd258311e32c64df2b885711c5c33b0,23-08-2025,2025-08-23 02:50:45.000 UTC,603,34564049,0x0e956C897bBFCbd2155D3DfdD27c87fa5A0FaD39
0x351f61e4c49cf11f24d9f2e737ca5eff81806355,0x02e9ad2b2cf91b1cb4d09d1e79e0830e7f8be2d53b0f374f28f6619bb7258b88,04-09-2025,2025-09-04 04:09:35.000 UTC,493,35084814,0x0e956C897bBFCbd2155D3DfdD27c87fa5A0FaD39
0x8508fd4238162cb3f3d485f432202af3b40f164e,0xc3a3a6bf679f14595f98ee617744eaafe890af971e4993b86e9bab95263fc3af,03-07-2025,2025-07-03 18:34:55.000 UTC,832,32389174,0xc3f97660D0b47F0E05C3c513f73eeff7c1bd6c7a
0x2791dc5e14f7680d9d969acc26059ba56403b6d5,0x52809de33261d5aea89c1b55dc24adf4f1a7d2999532e64d7a6ee951e485815a,02-02-2025,2025-02-02 16:01:05.000 UTC,260,25861359,0x0e956C897bBFCbd2155D3DfdD27c87fa5A0FaD39
0x9eb86e93a809a41ab0e7cc0ba6f62561fda3015c,0xbd9fc91a51273ff30356121d1b0f6afe2b82ccd9b41f4a6bf98d2d10e5852c7c,20-02-2025,2025-02-20 15:02:19.000 UTC,428,26637196,0x6399ed6725cC163D019aA64FF55b22149D7179A8
0x9eb86e93a809a41ab0e7cc0ba6f62561fda3015c,0x71abc4b769d97124f6aae8f0712e5a11af71522895e3b38457d45e9454282595,27-02-2025,2025-02-27 05:46:41.000 UTC,207,26922927,0x6399ed6725cC163D019aA64FF55b22149D7179A8
0x095d0de0ecfd6832f1a7961ae26d285d68655d60,0xab2e569f8eecbffc0431e4baf8d3d19eb37ed4e4adf6e4fc05e4dbcbaaa6608c,09-05-2025,2025-05-09 06:40:25.000 UTC,508,29991739,0x0e956C897bBFCbd2155D3DfdD27c87fa5A0FaD39
0x9eb86e93a809a41ab0e7cc0ba6f62561fda3015c,0xd841b6220846ca3fde72c2e9c7b7887babdd8411ce9895575d960f96e810e911,23-02-2025,2025-02-23 06:38:13.000 UTC,161,26751673,0x6399ed6725cC163D019aA64FF55b22149D7179A8
0x2791dc5e14f7680d9d969acc26059ba56403b6d5,0x56606699f528adb2c3c7d0b2e8128e0b78ee903b4f7de614e1994ad17a7c9bd5,02-01-2025,2025-01-02 13:50:11.000 UTC,801,24518232,0x0e956C897bBFCbd2155D3DfdD27c87fa5A0FaD39
0x8fd1b615c006ebeb8a7cfb00a1dd809f31943b08,0x72a1c6697e0d411d559be3ba236f9ad114f30fc2aa57bdd1a5e3db9cd17af2a4,09-01-2025,2025-01-09 20:52:59.000 UTC,222,24833316,0xB9E4E0368A9F281584C9adB685e6C9F4b9F37dBb
0x38f6d2d9ea493c3c6ee865b5b952b5fe9e3e61fc,0xa6cbd57b5a59c3474234f7a3222efb6ea284488c83f745024d2ba3a4ad54afbb,09-01-2025,2025-01-09 21:39:11.000 UTC,238,24834702,0x0e956C897bBFCbd2155D3DfdD27c87fa5A0FaD39
0x9eb86e93a809a41ab0e7cc0ba6f62561fda3015c,0xb5dc8d12dddac6ed9ef3873ada7e473f3dad3c3a90bbe59397c21ec1504a826a,20-05-2025,2025-05-20 09:28:35.000 UTC,412,30471984,0xc3f97660D0b47F0E05C3c513f73eeff7c1bd6c7a
0x2791dc5e14f7680d9d969acc26059ba56403b6d5,0x01da58b49c45f503767b8bb9fb894d802a0af865effae60968d9f0382e655f2a,08-12-2024,2024-12-08 19:53:27.000 UTC,268,23449130,0x0e956C897bBFCbd2155D3DfdD27c87fa5A0FaD39
0x8fd1b615c006ebeb8a7cfb00a1dd809f31943b08,0x8bc023b3f425b9c83eeb971da7592c8531d04b4bda2c232a79e94efa224f123d,16-12-2024,2024-12-16 22:11:39.000 UTC,229,23798876,0xBDA319Bc7Cc8F0829df39eC0FFF5D1E061FFadf7
0xdc98dbffcc648d6088a2ff8f7dc01aef050e58fc,0xe8f372055c63ae60c88d68f5793b7337690e4784a36074d9938802c1fc1ef66e,02-01-2025,2025-01-02 07:30:53.000 UTC,294,24506853,0x869305781fff479f0311974d55FeeB6Fc9DE96a2
0xdc98dbffcc648d6088a2ff8f7dc01aef050e58fc,0x76e32190912346919f7a2bcc10a348cd5c64c0936057dc514c97d4e90add2ddf,13-01-2025,2025-01-13 20:09:37.000 UTC,338,25004815,0x869305781fff479f0311974d55FeeB6Fc9DE96a2
0x9eb86e93a809a41ab0e7cc0ba6f62561fda3015c,0xaabe46a846dc6e76defd744ec569fdb2abf86ace137140b284fd08d142fdab20,17-02-2025,2025-02-17 01:31:29.000 UTC,191,26483271,0x6399ed6725cC163D019aA64FF55b22149D7179A8
0xdc98dbffcc648d6088a2ff8f7dc01aef050e58fc,0x9d172f611951e8a11e1b8b40d404f9b91950dd9189c79994151fde571bfaeeca,12-01-2025,2025-01-12 20:05:07.000 UTC,173,24961480,0xBDA319Bc7Cc8F0829df39eC0FFF5D1E061FFadf7
0xdc98dbffcc648d6088a2ff8f7dc01aef050e58fc,0x13cd7d0eca42e75b28afb5ccb42c0f686ad3163a6d5b0f2bf8a9caf128c451b7,07-01-2025,2025-01-07 19:21:21.000 UTC,544,24744167,0xB9E4E0368A9F281584C9adB685e6C9F4b9F37dBb
0x9eb86e93a809a41ab0e7cc0ba6f62561fda3015c,0xf2ba976613d33e2c33a715b2f93f000af9eb3ca81b15afb9bbb3d9c48ede41e4,20-02-2025,2025-02-20 11:48:05.000 UTC,235,26631369,0x6399ed6725cC163D019aA64FF55b22149D7179A8
0x9eb86e93a809a41ab0e7cc0ba6f62561fda3015c,0xf8bf89a9402ed593aa81c26beb236b6eb3d5c68d629d4960000fa2628f0299a2,01-06-2025,2025-06-01 04:46:29.000 UTC,331,30981921,0xc3f97660D0b47F0E05C3c513f73eeff7c1bd6c7a
0x2791dc5e14f7680d9d969acc26059ba56403b6d5,0x9f7d15027c040080fdb204e46b5d443966e17ba8753dd092641b9a9d9c061a42,08-01-2025,2025-01-08 23:20:19.000 UTC,298,24794536,0xB9E4E0368A9F281584C9adB685e6C9F4b9F37dBb
0x9eb86e93a809a41ab0e7cc0ba6f62561fda3015c,0xd3cb2e1a5e8a2adcc6a7882c6a0e49be45b38608021135a02fa735b072485c0b,08-01-2025,2025-01-08 04:27:27.000 UTC,308,24760550,0xB9E4E0368A9F281584C9adB685e6C9F4b9F37dBb
0x38f6d2d9ea493c3c6ee865b5b952b5fe9e3e61fc,0x858a3c71a6e43b1563f0af97b59c74af789f4e1faabe5a80804d47999bb1de88,22-01-2025,2025-01-22 00:01:07.000 UTC,393,25357360,0xB9E4E0368A9F281584C9adB685e6C9F4b9F37dBb
0xdc98dbffcc648d6088a2ff8f7dc01aef050e58fc,0x6d3831092c50d33db6d526a70af362e5ec2bb40220031a34932b681e854b3fae,03-06-2025,2025-06-03 11:39:15.000 UTC,885,31080704,0xc3f97660D0b47F0E05C3c513f73eeff7c1bd6c7a
0x9eb86e93a809a41ab0e7cc0ba6f62561fda3015c,0xa57cb86961c256381c8fe497004794c315932ae5f7d705efa3c03e29cc398c78,09-01-2025,2025-01-09 09:25:39.000 UTC,419,24812696,0xBDA319Bc7Cc8F0829df39eC0FFF5D1E061FFadf7
0x2791dc5e14f7680d9d969acc26059ba56403b6d5,0xc0bc2fec0c8cba7d6119cec48c38ecefc7342cde88df6f4b30196a361c8557c5,17-01-2025,2025-01-17 02:32:39.000 UTC,284,25145906,0xB9E4E0368A9F281584C9adB685e6C9F4b9F37dBb
0x9eb86e93a809a41ab0e7cc0ba6f62561fda3015c,0xd43b0993a3c175184a0c0474707a11b4100c6afadafd256b029793e1aab8c08d,30-12-2024,2024-12-30 20:06:15.000 UTC,186,24399914,0xBDA319Bc7Cc8F0829df39eC0FFF5D1E061FFadf7
0x8508fd4238162cb3f3d485f432202af3b40f164e,0xbb038277a938257d19651f486dd56d19355d4aa54bf604c383b6b3127d3bad43,01-04-2025,2025-04-01 21:24:21.000 UTC,250,28376657,0x2B74B62c564456C48055bd515A62594742b3f545
0x9eb86e93a809a41ab0e7cc0ba6f62561fda3015c,0x30882c9aa09d20c951be6436fb0c6a5bd54dabf26d4d3e42d803bce5df1d873c,16-05-2025,2025-05-16 13:05:23.000 UTC,610,30305688,0xc3f97660D0b47F0E05C3c513f73eeff7c1bd6c7a
0x38f6d2d9ea493c3c6ee865b5b952b5fe9e3e61fc,0xc7d442814c164673dbaa0958391c6a4f68df6927a8ec35790ae1cfc289add9a9,06-01-2025,2025-01-06 22:35:35.000 UTC,301,24706794,0xB9E4E0368A9F281584C9adB685e6C9F4b9F37dBb
0x8fd1b615c006ebeb8a7cfb00a1dd809f31943b08,0xd5d6c781d79ba4e032264657af1eb6c9060f24b49397f8ae073e576b778c9d6f,16-01-2025,2025-01-16 22:58:29.000 UTC,117,25139481,0xf2c38dE50A250C0060fB45eBE4504B67f6F1be3C
0x8fd1b615c006ebeb8a7cfb00a1dd809f31943b08,0xc803e2a8c2534419f724c15a4e226f1708e04e40c58419889aacba55658ed7a1,24-12-2024,2024-12-24 22:53:03.000 UTC,147,24145718,0xCFede447ca3b4885720B5a327e3BFb02078f06e8
0x9eb86e93a809a41ab0e7cc0ba6f62561fda3015c,0x6c6f57129782cf029ab50ef7825eb2b6f000e5fc6a1c8c529882abe11e1cf6a6,04-01-2025,2025-01-04 10:13:49.000 UTC,3593,24598141,0xBDA319Bc7Cc8F0829df39eC0FFF5D1E061FFadf7
0x9eb86e93a809a41ab0e7cc0ba6f62561fda3015c,0xb404be1d07d4eaa8de62901bf8ffbd566a8d0784739f3d9fe8b1bc16a72a5897,21-02-2025,2025-02-21 18:29:01.000 UTC,362,26686597,0x6399ed6725cC163D019aA64FF55b22149D7179A8
0x2791dc5e14f7680d9d969acc26059ba56403b6d5,0x12a1faa0723095bb3fa8d2eda5e926f66a41df4abe3613fe9337e248c8de4658,24-12-2024,2024-12-24 02:15:31.000 UTC,340,24108592,0xBDA319Bc7Cc8F0829df39eC0FFF5D1E061FFadf7
0x8508fd4238162cb3f3d485f432202af3b40f164e,0xd8b23121cf709c6d23025731a9943ccd2b322b18b8c5e16967316654f6bf2d7e,09-03-2025,2025-03-09 05:51:39.000 UTC,219,27355076,0xf2c38dE50A250C0060fB45eBE4504B67f6F1be3C
0x2791dc5e14f7680d9d969acc26059ba56403b6d5,0xeafd0d59e691f888bda9f2c0b3669b03812777f2a651dfbf74cab15d7cc64a4c,16-12-2024,2024-12-16 23:05:21.000 UTC,280,23800487,0xBDA319Bc7Cc8F0829df39eC0FFF5D1E061FFadf7
0x9eb86e93a809a41ab0e7cc0ba6f62561fda3015c,0x522e6bfcb33b83526c3927f479f97f543e4b19b4fd70abda4923942b278c0f97,08-01-2025,2025-01-08 21:15:51.000 UTC,353,24790802,0xBDA319Bc7Cc8F0829df39eC0FFF5D1E061FFadf7
0x9eb86e93a809a41ab0e7cc0ba6f62561fda3015c,0xd6de18fc05c1ea5b20709797f16e6e75aa2245cde9fe8d76ecc56420576880a9,15-05-2025,2025-05-15 12:50:31.000 UTC,328,30262042,0xc3f97660D0b47F0E05C3c513f73eeff7c1bd6c7a
0x9eb86e93a809a41ab0e7cc0ba6f62561fda3015c,0x5b8cb7dcb65ac770fec238a2213829544bfac72afb07a7fd54a8469654e40aa5,02-01-2025,2025-01-02 16:28:27.000 UTC,478,24522980,0xBDA319Bc7Cc8F0829df39eC0FFF5D1E061FFadf7
0xdc98dbffcc648d6088a2ff8f7dc01aef050e58fc,0x707ca2eb1900f637e16ca35fa58a2b51ca8504aec2d4b8502c94f8664be2b16a,09-01-2025,2025-01-09 00:27:37.000 UTC,287,24796555,0xBDA319Bc7Cc8F0829df39eC0FFF5D1E061FFadf7
0xdc98dbffcc648d6088a2ff8f7dc01aef050e58fc,0x8f93f1599316447609bc790a2cda6f7e2d5033df1b836ce6607538e1ff1144aa,09-07-2025,2025-07-09 06:07:53.000 UTC,76,32625963,0x869305781fff479f0311974d55FeeB6Fc9DE96a2
0x38f6d2d9ea493c3c6ee865b5b952b5fe9e3e61fc,0xc68852e39f871a108186c86fbae3a77b7a420d3a5e238ae94795727d0db97107,09-01-2025,2025-01-09 13:25:07.000 UTC,457,24819880,0xB9E4E0368A9F281584C9adB685e6C9F4b9F37dBb
0x2791dc5e14f7680d9d969acc26059ba56403b6d5,0xb0645024ac33cce6018839b11729b729013fa22c5b7b392fe3199b4e57b38dea,21-12-2024,2024-12-21 10:36:39.000 UTC,675,23994026,0xBDA319Bc7Cc8F0829df39eC0FFF5D1E061FFadf7
0xdc98dbffcc648d6088a2ff8f7dc01aef050e58fc,0x7362959e412b1ef0ba2e7ebf11457b1efac0060122df6df3883695d85008edce,02-01-2025,2025-01-02 05:51:37.000 UTC,260,24503875,0xBDA319Bc7Cc8F0829df39eC0FFF5D1E061FFadf7
0x351f61e4c49cf11f24d9f2e737ca5eff81806355,0xa4e76ead16287a1d46fe5bf22a915a9fff0903a0ed8553b21527382db989e123,08-10-2025,2025-10-08 00:43:55.000 UTC,76,36547444,0x0e956C897bBFCbd2155D3DfdD27c87fa5A0FaD39
0x9eb86e93a809a41ab0e7cc0ba6f62561fda3015c,0xaf7476441c96278d51b4f75154a2e6fa12cd9d860cdf5449af662de830c7d412,27-12-2024,2024-12-27 06:57:23.000 UTC,193,24246648,0xCFede447ca3b4885720B5a327e3BFb02078f06e8
0x351f61e4c49cf11f24d9f2e737ca5eff81806355,0x06f16d45163452831aa7fb16cef9f3bdb0c4ed1900e9293060c723ab15fb0945,20-10-2025,2025-10-20 19:15:21.000 UTC,728,37099187,0x0e956C897bBFCbd2155D3DfdD27c87fa5A0FaD39
0x38f6d2d9ea493c3c6ee865b5b952b5fe9e3e61fc,0x7f15eb5cf8db6df7e5ba08c2b8422bd50563385c7f83e8a9972c22427a43d676,15-12-2024,2024-12-15 19:28:57.000 UTC,329,23750795,0x0e956C897bBFCbd2155D3DfdD27c87fa5A0FaD39
0xdc98dbffcc648d6088a2ff8f7dc01aef050e58fc,0x6de5163947f1113e43add37d52cf02e8a3c9decffa75c139764a8bd4319d6440,07-01-2025,2025-01-07 00:19:39.000 UTC,215,24709916,0xBDA319Bc7Cc8F0829df39eC0FFF5D1E061FFadf7
0x38f6d2d9ea493c3c6ee865b5b952b5fe9e3e61fc,0x54c1a1d33b099cbc843836e179007523b054e73f748565d6ad3dfbe0ab525ede,01-02-2025,2025-02-01 00:20:01.000 UTC,242,25789927,0x0e956C897bBFCbd2155D3DfdD27c87fa5A0FaD39
0x9eb86e93a809a41ab0e7cc0ba6f62561fda3015c,0x1b78bb5994b7858f6e5600b1e7d07fba11fd021778d4447405750a50c0e563cb,28-06-2025,2025-06-28 17:22:29.000 UTC,396,32171001,0xCFede447ca3b4885720B5a327e3BFb02078f06e8
0x38f6d2d9ea493c3c6ee865b5b952b5fe9e3e61fc,0xe4b216fbdbe7948d0bcfd3cf124064e336ef2bca2817782b8048b87a624d6384,07-01-2025,2025-01-07 09:12:13.000 UTC,307,24725893,0xB9E4E0368A9F281584C9adB685e6C9F4b9F37dBb
0xdc98dbffcc648d6088a2ff8f7dc01aef050e58fc,0xd07881b860333eeea75008847be56c0f62997501c549a5f8ea9edcc47febaaac,07-06-2025,2025-06-07 01:23:19.000 UTC,888,31235026,0xc3f97660D0b47F0E05C3c513f73eeff7c1bd6c7a
0x9eb86e93a809a41ab0e7cc0ba6f62561fda3015c,0xaf33e70e82cf3f418bffac828ed2812519c3e21b4ed6c64e865a3f5f0a7eb814,22-05-2025,2025-05-22 17:57:39.000 UTC,413,30573656,0xc3f97660D0b47F0E05C3c513f73eeff7c1bd6c7a
0x9eb86e93a809a41ab0e7cc0ba6f62561fda3015c,0x31635b1d594711a1cad6890b3e9e9ff51dd435edfdcbb865ea4eaa537ab73e39,05-07-2025,2025-07-05 12:58:11.000 UTC,309,32465472,0xf2c38dE50A250C0060fB45eBE4504B67f6F1be3C
0xdc98dbffcc648d6088a2ff8f7dc01aef050e58fc,0x52c18bf243d66fc94653a09bd45c83c07eff07ff5a9398763a256d284507dc04,18-07-2025,2025-07-18 05:18:17.000 UTC,216,33013275,0xf2c38dE50A250C0060fB45eBE4504B67f6F1be3C
0xdc98dbffcc648d6088a2ff8f7dc01aef050e58fc,0x69b9411f0492af1a73306a2348095294a62861da0b72c4dc1a0e9dc4b16a2b00,02-01-2025,2025-01-02 14:57:45.000 UTC,393,24520259,0x0e956C897bBFCbd2155D3DfdD27c87fa5A0FaD39
0x8508fd4238162cb3f3d485f432202af3b40f164e,0x5d5bfcc493fdb7ddfefe1df42ea549535ee63c6d2fdc513de47e13a9d7a8d569,13-03-2025,2025-03-13 10:07:03.000 UTC,355,27535538,0x2B74B62c564456C48055bd515A62594742b3f545
0xdc98dbffcc648d6088a2ff8f7dc01aef050e58fc,0x9b7722fb31e07932fcd1ebf11b8b9aadcf41578b6214ccabc8b7b4b3f34fcbca,13-01-2025,2025-01-13 01:58:11.000 UTC,515,24972072,0xBDA319Bc7Cc8F0829df39eC0FFF5D1E061FFadf7
0x2791dc5e14f7680d9d969acc26059ba56403b6d5,0x90fe544c97d6fee59aca1f3166e7cba4c4605d92ee3832a556225362192b60c6,27-12-2024,2024-12-27 19:18:43.000 UTC,389,24268888,0xBDA319Bc7Cc8F0829df39eC0FFF5D1E061FFadf7
0xdc98dbffcc648d6088a2ff8f7dc01aef050e58fc,0xb194ab9d46d97dd91a4831adace5804adb4931b2e8ed29c0c70dd9c2a4815b02,27-05-2025,2025-05-27 09:08:19.000 UTC,962,30773776,0xc3f97660D0b47F0E05C3c513f73eeff7c1bd6c7a
0x8fd1b615c006ebeb8a7cfb00a1dd809f31943b08,0xd30148d357314450cf3db3d621be5cf98a841d55aedd38a280b14b557b63beed,19-12-2024,2024-12-19 21:41:55.000 UTC,364,23927584,0xCFede447ca3b4885720B5a327e3BFb02078f06e8
0x38f6d2d9ea493c3c6ee865b5b952b5fe9e3e61fc,0x1b08b0bac413760ea29fe06d773011a5ddc90edbe7fb125e69aa8ca6394aafa4,03-01-2025,2025-01-03 23:31:09.000 UTC,272,24578861,0xB9E4E0368A9F281584C9adB685e6C9F4b9F37dBb
0x2791dc5e14f7680d9d969acc26059ba56403b6d5,0xc57fd0401956b2d1974b83d623378d3cabd8b7a9399b2da1f2540dc96270e031,12-01-2025,2025-01-12 23:27:45.000 UTC,338,24967559,0xBDA319Bc7Cc8F0829df39eC0FFF5D1E061FFadf7
0x9eb86e93a809a41ab0e7cc0ba6f62561fda3015c,0xb7f8a7f7bd54f9354f28a3946f5e61f124b6a156797118fd74829430fdc6eccd,09-01-2025,2025-01-09 03:17:59.000 UTC,275,24801666,0xC23924a846eca931Ec3014253E94f15b038bd0C8
0x8fd1b615c006ebeb8a7cfb00a1dd809f31943b08,0x7aa493beb3ceda0fcd7f6f3671817a1d13b82055fb91d3e1df8fc813badbbaca,04-01-2025,2025-01-04 01:39:37.000 UTC,261,24582715,0xAfabcBbab5e4261B1d655c906738176191819164
0x2791dc5e14f7680d9d969acc26059ba56403b6d5,0xf87b6f82ee882f6d61ceccd329d84a4a94a9fa6471090781a681d708f0d91fa3,02-01-2025,2025-01-02 18:48:59.000 UTC,492,24527196,0x0e956C897bBFCbd2155D3DfdD27c87fa5A0FaD39
0x9eb86e93a809a41ab0e7cc0ba6f62561fda3015c,0xcfe5ec0e29c34890c183135e28ce653e2c8d651e93e6163203e70836542cff1b,02-06-2025,2025-06-02 14:54:01.000 UTC,1669,31043347,0xc3f97660D0b47F0E05C3c513f73eeff7c1bd6c7a
0xdc98dbffcc648d6088a2ff8f7dc01aef050e58fc,0xd1f43a64e308a6ac039ae8ac3ba8dbad10139d252517a0ad6ba9b4129ce5186c,28-12-2024,2024-12-28 03:13:09.000 UTC,524,24283121,0xBDA319Bc7Cc8F0829df39eC0FFF5D1E061FFadf7
0x9eb86e93a809a41ab0e7cc0ba6f62561fda3015c,0xefcf74cb20050d5b1b4c49950bd38a04d9d4ade41347354b923dd45a6d8b89a7,03-01-2025,2025-01-03 00:04:53.000 UTC,311,24536673,0xC23924a846eca931Ec3014253E94f15b038bd0C8
0x38f6d2d9ea493c3c6ee865b5b952b5fe9e3e61fc,0x68f0dd39e85a0b459abe65362b51fb7782a011c38a1d8864d2e1eda8d0673660,20-01-2025,2025-01-20 06:29:03.000 UTC,274,25282598,0xf2c38dE50A250C0060fB45eBE4504B67f6F1be3C
0xdc98dbffcc648d6088a2ff8f7dc01aef050e58fc,0x50d6c2d971a0ebf1354154ede43ab809fe63c8c47b6e887c8a5c95b98dc99525,14-01-2025,2025-01-14 14:00:29.000 UTC,453,25036941,0xBDA319Bc7Cc8F0829df39eC0FFF5D1E061FFadf7
0x9eb86e93a809a41ab0e7cc0ba6f62561fda3015c,0x453cb04dd533b7c14dc254b07ea5c1de5630114ce466e1e987420f294ceb8b7f,12-12-2024,2024-12-12 16:33:15.000 UTC,561,23615924,0xBDA319Bc7Cc8F0829df39eC0FFF5D1E061FFadf7
0xdc98dbffcc648d6088a2ff8f7dc01aef050e58fc,0x6e516007e6b4f3c4419e60ce9dfb9402679e731600aa8a8066b623d7e6309e97,08-01-2025,2025-01-08 07:37:01.000 UTC,152,24766237,0xB9E4E0368A9F281584C9adB685e6C9F4b9F37dBb
0x8fd1b615c006ebeb8a7cfb00a1dd809f31943b08,0x3c369fa2a47e2261e44b9b4ef95fc371a806141c1c4177d97a5d25d227169b5e,08-12-2024,2024-12-08 22:38:41.000 UTC,330,23454087,0xBDA319Bc7Cc8F0829df39eC0FFF5D1E061FFadf7
0x8810de2baa17067ddcfbd9e8f29c55f070a55f0b,0x02cc483189cf88ab75110c42efb45da16a181e1d6d1fd890cbf53aaf7d857980,14-05-2025,2025-05-14 03:50:53.000 UTC,69,30202653,0xf2c38dE50A250C0060fB45eBE4504B67f6F1be3C
0x38f6d2d9ea493c3c6ee865b5b952b5fe9e3e61fc,0xcf74942d76e5c6081de741fc62ede28b6ac46e988577f27edd0e2d2bfed7c029,09-01-2025,2025-01-09 02:07:47.000 UTC,605,24799560,0xB9E4E0368A9F281584C9adB685e6C9F4b9F37dBb
0x8810de2baa17067ddcfbd9e8f29c55f070a55f0b,0xbe92ab8ea3bcdbce39fb517e3acf200af12250ce938cfb2604b061316116cb08,27-03-2025,2025-03-27 14:25:19.000 UTC,407,28148086,0x0e956C897bBFCbd2155D3DfdD27c87fa5A0FaD39
0x8508fd4238162cb3f3d485f432202af3b40f164e,0x65d4b57e3e70114a089022e86685b5f288e6fdcc9089e4f3a57946e3b9f417e8,11-06-2025,2025-06-11 04:56:11.000 UTC,701,31414212,0xc3f97660D0b47F0E05C3c513f73eeff7c1bd6c7a
0xdc98dbffcc648d6088a2ff8f7dc01aef050e58fc,0x002d797645c214bf2594e70973bff03559002ffd9592ace1d54038d80b6a1b78,17-01-2025,2025-01-17 21:33:23.000 UTC,287,25180128,0xf2c38dE50A250C0060fB45eBE4504B67f6F1be3C
0xdc98dbffcc648d6088a2ff8f7dc01aef050e58fc,0x4b526d33a62388543d855a7cfede7491b095b8127d1b432a71f9f6871f225cf5,12-01-2025,2025-01-12 13:00:25.000 UTC,400,24948739,0xBDA319Bc7Cc8F0829df39eC0FFF5D1E061FFadf7
0x8fd1b615c006ebeb8a7cfb00a1dd809f31943b08,0x5100e00586dffd4623e83285968020fe2c8656daade54efcd40f5b62f2d53141,16-12-2024,2024-12-16 08:14:19.000 UTC,224,23773756,0xBDA319Bc7Cc8F0829df39eC0FFF5D1E061FFadf7
0x2791dc5e14f7680d9d969acc26059ba56403b6d5,0x8df40a9bd02220dcb929c71c4f461a3a2a6f311628f5ed28b496a263de3491ce,02-01-2025,2025-01-02 22:22:51.000 UTC,348,24533612,0x0e956C897bBFCbd2155D3DfdD27c87fa5A0FaD39
0xdc98dbffcc648d6088a2ff8f7dc01aef050e58fc,0x158085af2d3c3459d72f1afe9c6987e8e0a7b0991005fa782c8ebb3401572d51,02-01-2025,2025-01-02 21:48:09.000 UTC,433,24532571,0x0e956C897bBFCbd2155D3DfdD27c87fa5A0FaD39
0x38f6d2d9ea493c3c6ee865b5b952b5fe9e3e61fc,0x1c733fa3ec291f5a0063f33daca2766a55395c3ef0043f5861da3c788c31a42d,06-06-2025,2025-06-06 13:56:53.000 UTC,671,31214433,0xCFede447ca3b4885720B5a327e3BFb02078f06e8
0x38f6d2d9ea493c3c6ee865b5b952b5fe9e3e61fc,0xbd54f91107adb41711681eb52b4c735372170ee5112cdd37b4cbd26181bb8e8c,09-01-2025,2025-01-09 11:30:19.000 UTC,366,24816436,0xB9E4E0368A9F281584C9adB685e6C9F4b9F37dBb
0x2791dc5e14f7680d9d969acc26059ba56403b6d5,0x09b7adcf1e831f76662cee75212e9e3d7ab2a70b23a11ffff5b64bf4c96653a2,12-01-2025,2025-01-12 20:12:27.000 UTC,342,24961700,0xBDA319Bc7Cc8F0829df39eC0FFF5D1E061FFadf7
0x38f6d2d9ea493c3c6ee865b5b952b5fe9e3e61fc,0x578bbbb205264872e76a55f4830e954868f236193ce74db6001aff34e4585e52,13-01-2025,2025-01-13 02:42:01.000 UTC,267,24973387,0x0e956C897bBFCbd2155D3DfdD27c87fa5A0FaD39
0x2791dc5e14f7680d9d969acc26059ba56403b6d5,0xcde1000c95c109c4fea529fa4f57558d6622b6c1b693fb90a0bf2ea41eae9e39,16-01-2025,2025-01-16 00:33:11.000 UTC,359,25099122,0xB9E4E0368A9F281584C9adB685e6C9F4b9F37dBb
0x2791dc5e14f7680d9d969acc26059ba56403b6d5,0x71ac7857bae77116c56af5498295df81838611394e193c2af715d886bcd0783c,13-01-2025,2025-01-13 00:05:25.000 UTC,264,24968689,0x869305781fff479f0311974d55FeeB6Fc9DE96a2
0x38f6d2d9ea493c3c6ee865b5b952b5fe9e3e61fc,0x5cb7d5fcb584dbdf0f931a902d7c304778fb7578cd5d54dfe0733bc355abbe6b,29-12-2024,2024-12-29 13:42:11.000 UTC,170,24345192,0x0e956C897bBFCbd2155D3DfdD27c87fa5A0FaD39
0x38f6d2d9ea493c3c6ee865b5b952b5fe9e3e61fc,0x11aa5c39c233a03e0327a8fb273891dccdb841075aed4e4b6dd9d2df24a42a94,15-12-2024,2024-12-15 01:40:33.000 UTC,296,23718743,0xCFede447ca3b4885720B5a327e3BFb02078f06e8
0x2791dc5e14f7680d9d969acc26059ba56403b6d5,0x6e4bda1b86f5cf3c758fe9a1b43939c6cf81510bfd210675db235723d259212b,14-12-2024,2024-12-14 03:07:19.000 UTC,280,23678146,0xBDA319Bc7Cc8F0829df39eC0FFF5D1E061FFadf7
0x8508fd4238162cb3f3d485f432202af3b40f164e,0x017599787762e73c1aac6f2996d4368394e1deea642c588a0fdddc3221886483,30-06-2025,2025-06-30 21:15:15.000 UTC,258,32264384,0x6205DfbE68444cFF504A20a712cEa794c6b6Cf04
0x9eb86e93a809a41ab0e7cc0ba6f62561fda3015c,0x23c8545fd2cc8a4cc445aaec56f5a62c0bc664d357609913469420c87bced9ad,03-01-2025,2025-01-03 07:03:39.000 UTC,852,24549236,0xC23924a846eca931Ec3014253E94f15b038bd0C8
0x8508fd4238162cb3f3d485f432202af3b40f164e,0xb1c897207afbd5a5ea699280bfa79a39f42b0bc729e8be0fbf908a9575eae4a6,02-07-2025,2025-07-02 18:38:41.000 UTC,542,32346087,0xf2c38dE50A250C0060fB45eBE4504B67f6F1be3C
0x38f6d2d9ea493c3c6ee865b5b952b5fe9e3e61fc,0x3c6b9ec9dc7f898f3d13b97c0c42fc4410e5978f309205f5c5681defcf26e959,06-01-2025,2025-01-06 04:55:55.000 UTC,513,24675004,0x0e956C897bBFCbd2155D3DfdD27c87fa5A0FaD39
0xdc98dbffcc648d6088a2ff8f7dc01aef050e58fc,0x151fa584305512cd498b0e35237f264996fd1aa59b266f6f0bd98d774f42cf51,15-01-2025,2025-01-15 20:50:09.000 UTC,324,25092431,0x869305781fff479f0311974d55FeeB6Fc9DE96a2
0x2791dc5e14f7680d9d969acc26059ba56403b6d5,0xe830d42edc78af51118e89ec579795056cda883b5e3566b643ffdfccac66f4da,01-01-2025,2025-01-01 11:25:11.000 UTC,327,24470682,0xBDA319Bc7Cc8F0829df39eC0FFF5D1E061FFadf7
0x2791dc5e14f7680d9d969acc26059ba56403b6d5,0xe7db6ba726467bcc8abc153426386869ee96d97079e60bbc48ae437eb9cd2623,12-12-2024,2024-12-12 09:01:51.000 UTC,272,23602382,0xBDA319Bc7Cc8F0829df39eC0FFF5D1E061FFadf7
0xdc98dbffcc648d6088a2ff8f7dc01aef050e58fc,0x8ae392a818274cb0951a3784f0aa3dc703d85fa377625803d629ff202b472cbf,20-06-2025,2025-06-20 07:04:41.000 UTC,291,31806867,0x430C09546ae9249AB75B9A4ef7B5FD9a4006D6f3
0x8fd1b615c006ebeb8a7cfb00a1dd809f31943b08,0x5d2e17f4e8ae1ab0ca4039f6a4c1d19393de11951d7060cf3d2e2552a2918316,18-12-2024,2024-12-18 10:34:21.000 UTC,514,23864357,0xBDA319Bc7Cc8F0829df39eC0FFF5D1E061FFadf7
0x8508fd4238162cb3f3d485f432202af3b40f164e,0xb4c7d6f4a839a7d9fca2357bbba04b4e3b22011f70ae80f8e12b28dc6fe5d7ed,04-04-2025,2025-04-04 21:33:17.000 UTC,184,28506525,0x2B74B62c564456C48055bd515A62594742b3f545
0x8fd1b615c006ebeb8a7cfb00a1dd809f31943b08,0x67235e2344d25a32338cf6ccecb4bedb4102c3e7b45b83bdae0a948807805587,16-12-2024,2024-12-16 10:45:39.000 UTC,282,23778296,0xBDA319Bc7Cc8F0829df39eC0FFF5D1E061FFadf7
0x8810de2baa17067ddcfbd9e8f29c55f070a55f0b,0xc4ecf2bf0b19c0db9eaa054d809096fab6c9f193c91196208b1426b850576103,28-03-2025,2025-03-28 06:00:33.000 UTC,173,28176143,0x0e956C897bBFCbd2155D3DfdD27c87fa5A0FaD39
0x9eb86e93a809a41ab0e7cc0ba6f62561fda3015c,0xe4a53e17b643d943dd53466f4c747253f9c79db390499da5ab3d5a9258d0c66b,17-12-2024,2024-12-17 22:26:03.000 UTC,454,23842508,0xCFede447ca3b4885720B5a327e3BFb02078f06e8
0x2791dc5e14f7680d9d969acc26059ba56403b6d5,0xe55ac9f14da5566cdfbf9f4dde3a941d8f5338a68841e6ad32443a645083b050,17-01-2025,2025-01-17 21:46:15.000 UTC,222,25180514,0xCFede447ca3b4885720B5a327e3BFb02078f06e8
0x095d0de0ecfd6832f1a7961ae26d285d68655d60,0x2601c282cf6f4ff1cb2d28e9a29b75c41b8d36943fda31dc7212a5b17501ae5b,06-02-2025,2025-02-06 03:31:01.000 UTC,658,26011657,0x0e956C897bBFCbd2155D3DfdD27c87fa5A0FaD39
0xdc98dbffcc648d6088a2ff8f7dc01aef050e58fc,0x33d0b552e3c2c65837627624346b9b1c9788cdb3bf4ca5ba3a920d70c72d305a,09-04-2025,2025-04-09 20:42:49.000 UTC,367,28721011,0x430C09546ae9249AB75B9A4ef7B5FD9a4006D6f3
0x8810de2baa17067ddcfbd9e8f29c55f070a55f0b,0x02417d65d8779840f039f4c260bf4c617195ec9abd2a4f6c4dab61c1b2ddb3ad,18-04-2025,2025-04-18 15:52:07.000 UTC,197,29101090,0x0e956C897bBFCbd2155D3DfdD27c87fa5A0FaD39
0x9eb86e93a809a41ab0e7cc0ba6f62561fda3015c,0x453b386f41f98228d79ab43c9aabf581f51a374548a7e7a9cf9271f372c40c3d,16-12-2024,2024-12-16 18:25:15.000 UTC,515,23792084,0xBDA319Bc7Cc8F0829df39eC0FFF5D1E061FFadf7
0x9eb86e93a809a41ab0e7cc0ba6f62561fda3015c,0x8e1a3e41c3cf391d43d5ef6f912aff7c809f2588767978787ac45c01022fcdea,14-12-2024,2024-12-14 10:21:37.000 UTC,549,23691175,0xBDA319Bc7Cc8F0829df39eC0FFF5D1E061FFadf7
0x8fd1b615c006ebeb8a7cfb00a1dd809f31943b08,0x900a8980bcd099907b2e1358be7ff89da66b3642c80cb61b23377c6a0c19dfbe,09-01-2025,2025-01-09 00:26:31.000 UTC,385,24796522,0xBDA319Bc7Cc8F0829df39eC0FFF5D1E061FFadf7
0x8fd1b615c006ebeb8a7cfb00a1dd809f31943b08,0x95d0ae62d927ee1c8bc550aad8753ceb5fac57386c19ca694ff21e47296c7138,01-01-2025,2025-01-01 21:24:47.000 UTC,398,24488670,0xAfabcBbab5e4261B1d655c906738176191819164
0x2791dc5e14f7680d9d969acc26059ba56403b6d5,0xc1d2d6efa91efeaf136873bc2eaa5f1cdd1d25cf772ea07ba0d8d907a76e8b9e,26-12-2024,2024-12-26 20:32:01.000 UTC,403,24227887,0xBDA319Bc7Cc8F0829df39eC0FFF5D1E061FFadf7
0x8508fd4238162cb3f3d485f432202af3b40f164e,0xb3b18a89f866f5f93e89ab8bc11231bc3f02aa03e4707db760e7d75964fc3c90,27-03-2025,2025-03-27 15:10:53.000 UTC,827,28149453,0x2B74B62c564456C48055bd515A62594742b3f545
0x9eb86e93a809a41ab0e7cc0ba6f62561fda3015c,0xa83f1477fcbff402be8c338493bfb5f53b855bc7ffbe6ecb7d54902ae4d2880e,20-12-2024,2024-12-20 05:37:41.000 UTC,420,23941857,0xBDA319Bc7Cc8F0829df39eC0FFF5D1E061FFadf7
0x2791dc5e14f7680d9d969acc26059ba56403b6d5,0x703351d20a9a5b8688f0aca77ea805a22d7e2b2619a8f298c47238761bce6def,05-03-2025,2025-03-05 06:38:15.000 UTC,427,27183674,0x0e956C897bBFCbd2155D3DfdD27c87fa5A0FaD39
0x8fd1b615c006ebeb8a7cfb00a1dd809f31943b08,0x89f54691bed0799482f2fd91502f5dee54a2614aee7bca0b32e0536bccd07071,09-01-2025,2025-01-09 06:16:53.000 UTC,344,24807033,0xBDA319Bc7Cc8F0829df39eC0FFF5D1E061FFadf7
0x8508fd4238162cb3f3d485f432202af3b40f164e,0xe1b01143bf0512119c2b6a0034f4a42bea2324940acbe14d1346a7547cc10b72,03-04-2025,2025-04-03 10:57:55.000 UTC,381,28444264,0x2B74B62c564456C48055bd515A62594742b3f545
0x8508fd4238162cb3f3d485f432202af3b40f164e,0x0d83f8f7ef6a272d55f7deaaea802c7f248811ec71c3fd01260049b113761d9d,03-06-2025,2025-06-03 03:31:43.000 UTC,555,31066078,0xc3f97660D0b47F0E05C3c513f73eeff7c1bd6c7a
0x9eb86e93a809a41ab0e7cc0ba6f62561fda3015c,0xb81d89f55a8e215dde31d8636fa2ac43fe0f38aef3f3ba91b066634b2bfaf244,06-01-2025,2025-01-06 03:39:53.000 UTC,641,24672723,0xC23924a846eca931Ec3014253E94f15b038bd0C8
0x8508fd4238162cb3f3d485f432202af3b40f164e,0x4f557ff8e98ac543dd8fe28940c386ec1693bbe53b49768ee51f3c5c58ab4425,11-04-2025,2025-04-11 12:57:49.000 UTC,272,28793461,0x2B74B62c564456C48055bd515A62594742b3f545
0x2791dc5e14f7680d9d969acc26059ba56403b6d5,0xfd2f9b74553c4ee3c55d820d3155e4dd4f49facf5b6843e97244a33e29ec29e8,12-12-2024,2024-12-12 04:39:09.000 UTC,299,23594501,0x0e956C897bBFCbd2155D3DfdD27c87fa5A0FaD39
0x8fd1b615c006ebeb8a7cfb00a1dd809f31943b08,0x24a2d45ab47ae39d232485efdfb36e5422674d3557a06709eb414d172f746db7,13-01-2025,2025-01-13 06:49:35.000 UTC,552,24980814,0xBDA319Bc7Cc8F0829df39eC0FFF5D1E061FFadf7
0xdc98dbffcc648d6088a2ff8f7dc01aef050e58fc,0xf4a2179e73b68da7d7c462764785ad6e8f2451d650af7602730d51a51ae38544,02-06-2025,2025-06-02 08:18:11.000 UTC,430,31031472,0xc3f97660D0b47F0E05C3c513f73eeff7c1bd6c7a
0xdc98dbffcc648d6088a2ff8f7dc01aef050e58fc,0xf35661e0628d51f1aff7d21499f62e183622eca08f58f40c8d00a4adc6c859ca,04-04-2025,2025-04-04 00:37:09.000 UTC,260,28468841,0x430C09546ae9249AB75B9A4ef7B5FD9a4006D6f3
0x9eb86e93a809a41ab0e7cc0ba6f62561fda3015c,0x0d2eb11362821e08c000744169a07c1e203e53a6e341a062f330951b4ea5b912,26-01-2025,2025-01-26 10:23:29.000 UTC,299,25548831,0x0e956C897bBFCbd2155D3DfdD27c87fa5A0FaD39
0x2791dc5e14f7680d9d969acc26059ba56403b6d5,0x3e92ba7b5d84466da4373b33e9780a2f0e304f09ca8a590b9de3cc55468fd60f,16-12-2024,2024-12-16 16:08:47.000 UTC,634,23787990,0xBDA319Bc7Cc8F0829df39eC0FFF5D1E061FFadf7
0x8508fd4238162cb3f3d485f432202af3b40f164e,0x1788b89084773b7183bf19fd77d0111295412d51b47bcc71a1817579d6cdf8c7,26-05-2025,2025-05-26 04:22:41.000 UTC,614,30722007,0xc3f97660D0b47F0E05C3c513f73eeff7c1bd6c7a
0x2791dc5e14f7680d9d969acc26059ba56403b6d5,0xf5eb711e0f9d300dcd31f233e21933161ffaa698902e394911c21f5b79f9d672,16-07-2025,2025-07-16 06:56:49.000 UTC,46,32929831,0xf2c38dE50A250C0060fB45eBE4504B67f6F1be3C
0x8fd1b615c006ebeb8a7cfb00a1dd809f31943b08,0x4a7347db99d705bd2a4bdfe59a3d7c452537ac00685a336df16399b01884bcd0,08-01-2025,2025-01-08 00:27:25.000 UTC,404,24753349,0xBDA319Bc7Cc8F0829df39eC0FFF5D1E061FFadf7
0x8fd1b615c006ebeb8a7cfb00a1dd809f31943b08,0x380a720843b695601e8e84297b1f30c348e71baec9616486a03787de3bfd09b7,15-12-2024,2024-12-15 03:00:01.000 UTC,389,23721127,0x45F8b8eC9c92D09BA8495074436fD97073423041
0x8fd1b615c006ebeb8a7cfb00a1dd809f31943b08,0x0abbea543a447f531797ecddddc89104a00ab9b99b65e46389e68a02df8e7e76,08-01-2025,2025-01-08 10:37:17.000 UTC,355,24771645,0xBDA319Bc7Cc8F0829df39eC0FFF5D1E061FFadf7
0x9eb86e93a809a41ab0e7cc0ba6f62561fda3015c,0x3997ee0d51f8aa84e0ed2edb73fce541c40e9809c8bb74a47cb26401282506d1,02-01-2025,2025-01-02 06:45:57.000 UTC,333,24505505,0x869305781fff479f0311974d55FeeB6Fc9DE96a2
0x9eb86e93a809a41ab0e7cc0ba6f62561fda3015c,0xe7b28c8206542c98443d04cd83e12b1005c3ebceff8f895c6de62ff521ebb7b5,19-02-2025,2025-02-19 21:28:33.000 UTC,507,26605583,0x6399ed6725cC163D019aA64FF55b22149D7179A8
0x2791dc5e14f7680d9d969acc26059ba56403b6d5,0x0f3f83c68394e015406d05e28feaa53b3c9bda1965878ceb3da848636b89f8f1,18-01-2025,2025-01-18 04:49:59.000 UTC,369,25193226,0x0e956C897bBFCbd2155D3DfdD27c87fa5A0FaD39
0x8fd1b615c006ebeb8a7cfb00a1dd809f31943b08,0x6dc4b2f8769e25480c7853454a4581297c6bed3d93bb67306ec668c75ef14c5f,11-05-2025,2025-05-11 00:18:41.000 UTC,156,30066687,0x0e956C897bBFCbd2155D3DfdD27c87fa5A0FaD39
0x9eb86e93a809a41ab0e7cc0ba6f62561fda3015c,0xc01c88c40e52323179adae1c23f58da3f48ed5abf273370de37505a1e9eed49b,03-01-2025,2025-01-03 22:48:51.000 UTC,351,24577592,0xBDA319Bc7Cc8F0829df39eC0FFF5D1E061FFadf7
0x2791dc5e14f7680d9d969acc26059ba56403b6d5,0x333a2dcdfd9b7a1c4a3e66fcc48e8d0901c52af46e62a6407323cf2b9c107a2d,14-01-2025,2025-01-14 20:46:35.000 UTC,221,25049124,0xf2c38dE50A250C0060fB45eBE4504B67f6F1be3C
0x38f6d2d9ea493c3c6ee865b5b952b5fe9e3e61fc,0x643ba525553d444a9cc4217c741248465610532e320e2288b847afdc8a80cf6c,31-12-2024,2024-12-31 03:04:59.000 UTC,286,24412476,0x869305781fff479f0311974d55FeeB6Fc9DE96a2
0x2791dc5e14f7680d9d969acc26059ba56403b6d5,0x8815d8ae54b49835fcec052402f0f036aebf57b522815c614898943f4c5bc455,08-01-2025,2025-01-08 02:02:23.000 UTC,382,24756198,0x0e956C897bBFCbd2155D3DfdD27c87fa5A0FaD39
0x8fd1b615c006ebeb8a7cfb00a1dd809f31943b08,0x3a0ca683c75d7aaef830546563e08e3a7e6ac134e425888787c6cf8dfce56571,29-05-2025,2025-05-29 09:09:05.000 UTC,601,30860199,0xCFede447ca3b4885720B5a327e3BFb02078f06e8
0x38f6d2d9ea493c3c6ee865b5b952b5fe9e3e61fc,0x7e70dc10c0d3ee7ab0c17282fa864bbe71c9f93cb5df08848aabd78cfab284a4,11-05-2025,2025-05-11 00:58:05.000 UTC,100,30067869,0xCFede447ca3b4885720B5a327e3BFb02078f06e8
0xdc98dbffcc648d6088a2ff8f7dc01aef050e58fc,0xf51a73fb08d0e5b135fc12558bbeda40ed9e5563cf27e1791f234306a93f4c4f,24-12-2024,2024-12-24 03:07:51.000 UTC,887,24110162,0xBDA319Bc7Cc8F0829df39eC0FFF5D1E061FFadf7
0x38f6d2d9ea493c3c6ee865b5b952b5fe9e3e61fc,0xf6a60913a803ba17e42f9267e06d293dc22c6614f6633d6c5b650ccd6e3bcb23,31-12-2024,2024-12-31 07:33:39.000 UTC,268,24420536,0x869305781fff479f0311974d55FeeB6Fc9DE96a2
0x38f6d2d9ea493c3c6ee865b5b952b5fe9e3e61fc,0xba60fb162cbd853a9883a75cc529b53bf6c86585330015a1253a4c893eaabcf9,04-01-2025,2025-01-04 17:11:43.000 UTC,309,24610678,0xBDA319Bc7Cc8F0829df39eC0FFF5D1E061FFadf7
0x8508fd4238162cb3f3d485f432202af3b40f164e,0x6e12cd5fc93a70c2ec02c98ca247fd85234c1dc7143848f1debcfa2b095a0e36,15-05-2025,2025-05-15 23:13:53.000 UTC,41,30280743,0x6205DfbE68444cFF504A20a712cEa794c6b6Cf04
0x8508fd4238162cb3f3d485f432202af3b40f164e,0x25de2a503dd5a6ec6edf9daebe68d79fd6b53520172a216672edda4f6aae5bef,09-07-2025,2025-07-09 19:29:25.000 UTC,478,32650009,0x6205DfbE68444cFF504A20a712cEa794c6b6Cf04
0x38f6d2d9ea493c3c6ee865b5b952b5fe9e3e61fc,0xb77d1b41edc1ad73fb3672438798d4c4f6fb7c4658692bd1d16086ad51472a24,05-01-2025,2025-01-05 00:22:19.000 UTC,273,24623596,0xB9E4E0368A9F281584C9adB685e6C9F4b9F37dBb
0x2791dc5e14f7680d9d969acc26059ba56403b6d5,0x3f5f9cedeedb20662cb1f827da042e7f1514f68df66d6d023d7d2762a362a5b6,21-12-2024,2024-12-21 06:58:23.000 UTC,457,23987478,0xBDA319Bc7Cc8F0829df39eC0FFF5D1E061FFadf7
0x38f6d2d9ea493c3c6ee865b5b952b5fe9e3e61fc,0x88adc3f4413554c9c3687d3b8e64bed8dcbd8e839cd67f46655a41d15ed6079d,23-01-2025,2025-01-23 00:52:03.000 UTC,321,25402088,0x0e956C897bBFCbd2155D3DfdD27c87fa5A0FaD39
0x8810de2baa17067ddcfbd9e8f29c55f070a55f0b,0x08b19f4cea804f0aa4d0ae98b7f41db6a835c1a117d86923c13df09ead17aa5e,03-04-2025,2025-04-03 08:15:55.000 UTC,359,28439404,0x0e956C897bBFCbd2155D3DfdD27c87fa5A0FaD39
0x8fd1b615c006ebeb8a7cfb00a1dd809f31943b08,0x21e2345acbe811d3e69d97b63f67f17636b0c193a11ac6e005a3ca3530af0ad3,11-12-2024,2024-12-11 07:00:25.000 UTC,349,23555539,0xBDA319Bc7Cc8F0829df39eC0FFF5D1E061FFadf7
0x8fd1b615c006ebeb8a7cfb00a1dd809f31943b08,0xf5c859a14deffd471640b095abccdb761ca687df270fb5b9cee25c09b5f10dab,03-01-2025,2025-01-03 03:32:09.000 UTC,462,24542891,0xAfabcBbab5e4261B1d655c906738176191819164
0xdc98dbffcc648d6088a2ff8f7dc01aef050e58fc,0xd8cd6b26861d40ac32375366770c2748c6191dfbebb9094549ad16773f31d0b1,08-01-2025,2025-01-08 15:28:05.000 UTC,352,24780369,0xB9E4E0368A9F281584C9adB685e6C9F4b9F37dBb
0x8fd1b615c006ebeb8a7cfb00a1dd809f31943b08,0x08a79629eba1ae7fc61f6922dac3caa4fcbaf6155561c88e1b4a1987e929951e,19-12-2024,2024-12-19 00:55:05.000 UTC,590,23890179,0xBDA319Bc7Cc8F0829df39eC0FFF5D1E061FFadf7
0xdc98dbffcc648d6088a2ff8f7dc01aef050e58fc,0x8a4542743509a1c306193fe407e4fb09464ccfdc3fc9c3ee1dfaaf4f435729a2,01-01-2025,2025-01-01 23:25:53.000 UTC,403,24492303,0x869305781fff479f0311974d55FeeB6Fc9DE96a2
0x8fd1b615c006ebeb8a7cfb00a1dd809f31943b08,0xc2c8efbf013b9958819e0052657dcb392433ddcfef69b95111204a52c62fab76,13-01-2025,2025-01-13 21:42:09.000 UTC,348,25007591,0xBDA319Bc7Cc8F0829df39eC0FFF5D1E061FFadf7
0x9eb86e93a809a41ab0e7cc0ba6f62561fda3015c,0xe9030cb1be0d554688535595c878caa21e9e5267f48c9df91b337a2a29612d3e,03-02-2025,2025-02-03 04:39:41.000 UTC,383,25884117,0xB9E4E0368A9F281584C9adB685e6C9F4b9F37dBb
0x9eb86e93a809a41ab0e7cc0ba6f62561fda3015c,0xe0a1d3edf2fb7c229dad4b3a5e76e6375536b6c493468847816495119264f186,05-03-2025,2025-03-05 06:16:17.000 UTC,344,27183015,0xf2c38dE50A250C0060fB45eBE4504B67f6F1be3C
0x38f6d2d9ea493c3c6ee865b5b952b5fe9e3e61fc,0x7aca095e33930a7c6f5226edcf71f92da43544211580bc938f89e523d90bbe3a,02-01-2025,2025-01-02 22:24:39.000 UTC,370,24533666,0xBDA319Bc7Cc8F0829df39eC0FFF5D1E061FFadf7
0x2791dc5e14f7680d9d969acc26059ba56403b6d5,0xf345fed693455a4a65ae5da0dbe989311a09e6cee3be71d8337a3ebf87882bb2,13-12-2024,2024-12-13 03:30:17.000 UTC,791,23635635,0xBDA319Bc7Cc8F0829df39eC0FFF5D1E061FFadf7
0x2791dc5e14f7680d9d969acc26059ba56403b6d5,0x71d6062ef86ed3a7039884f1e3a3f6e72db0df5ef905d984620d2123df81f409,15-12-2024,2024-12-15 10:01:33.000 UTC,169,23733773,0xBDA319Bc7Cc8F0829df39eC0FFF5D1E061FFadf7
0xdc98dbffcc648d6088a2ff8f7dc01aef050e58fc,0x9127448ccdac71bf235c9c75aa788f67d78755641b38ff2f936535fa5c6f4405,04-01-2025,2025-01-04 09:24:15.000 UTC,307,24596654,0xBDA319Bc7Cc8F0829df39eC0FFF5D1E061FFadf7
0x9eb86e93a809a41ab0e7cc0ba6f62561fda3015c,0x422264cdda8a8a89d71c567b4d554e4f2d3c6a0aaec9cfe1e47b683c950619d7,25-02-2025,2025-02-25 06:47:47.000 UTC,232,26838360,0x6399ed6725cC163D019aA64FF55b22149D7179A8
0x2791dc5e14f7680d9d969acc26059ba56403b6d5,0x2036c660be79dffa496fcea5a85893acb5ff640482e4e38d8767fb163dde4aeb,20-03-2025,2025-03-20 06:46:05.000 UTC,151,27831909,0x0e956C897bBFCbd2155D3DfdD27c87fa5A0FaD39
0x2791dc5e14f7680d9d969acc26059ba56403b6d5,0xe36d1896de343ffc345034605c2bd51c0940a66afcc8d0ba31bc3c7ac68cb3cb,06-02-2025,2025-02-06 05:33:29.000 UTC,113,26015331,0x0e956C897bBFCbd2155D3DfdD27c87fa5A0FaD39
0xdc98dbffcc648d6088a2ff8f7dc01aef050e58fc,0x21456352216ba0818e051171d072f6000346962f3fc506e1d2e0c6de7474968f,05-01-2025,2025-01-05 07:50:25.000 UTC,246,24637039,0xBDA319Bc7Cc8F0829df39eC0FFF5D1E061FFadf7
0x9eb86e93a809a41ab0e7cc0ba6f62561fda3015c,0x4de789bc21b2ff92ad25ef879fdb9d2d76592b36f03ddad40a47147033663daf,08-01-2025,2025-01-08 21:16:37.000 UTC,270,24790825,0xC23924a846eca931Ec3014253E94f15b038bd0C8
0xdc98dbffcc648d6088a2ff8f7dc01aef050e58fc,0xaacbe4a0ac01acf7c7887441f0d6c9b13cfc2b050211cff5da4b7d442b27723f,01-06-2025,2025-06-01 22:54:11.000 UTC,247,31014552,0xc3f97660D0b47F0E05C3c513f73eeff7c1bd6c7a
0xdc98dbffcc648d6088a2ff8f7dc01aef050e58fc,0xf4fba61ece5aac18da0391dbc02153290c7852b87c56f8db5f06db14a2c21594,12-01-2025,2025-01-12 16:16:31.000 UTC,262,24954622,0xBDA319Bc7Cc8F0829df39eC0FFF5D1E061FFadf7
0x8508fd4238162cb3f3d485f432202af3b40f164e,0x0e932169a7737e0842177e2e46205488dabde63e00720f83cca59f4f27fc91aa,02-06-2025,2025-06-02 14:55:25.000 UTC,238,31043389,0x6205DfbE68444cFF504A20a712cEa794c6b6Cf04
0x9eb86e93a809a41ab0e7cc0ba6f62561fda3015c,0xcfd878c9a521223ad305854e20b9a76ca1d94e814689670e6622535030599144,28-02-2025,2025-02-28 13:19:15.000 UTC,228,26979704,0x6399ed6725cC163D019aA64FF55b22149D7179A8
0xdc98dbffcc648d6088a2ff8f7dc01aef050e58fc,0x2248260c9c4de9a7aa527ed473086de71f518f4e8fd2fdeb45bb5d9ee0cb4132,02-01-2025,2025-01-02 22:23:43.000 UTC,339,24533638,0xBDA319Bc7Cc8F0829df39eC0FFF5D1E061FFadf7
0x351f61e4c49cf11f24d9f2e737ca5eff81806355,0xd564d630bfec26318797836ccbd11ce4ed9cb7dc739def4d30e8aef0c23be1d8,12-12-2025,2025-12-12 06:34:45.000 UTC,553,39365969,0x0e956C897bBFCbd2155D3DfdD27c87fa5A0FaD39
0xdc98dbffcc648d6088a2ff8f7dc01aef050e58fc,0x5322a1bb2d102c683be1209e050752647d2b7c43a1df4d4fe0703213c6be8e6c,09-01-2025,2025-01-09 02:53:29.000 UTC,2657,24800931,0x869305781fff479f0311974d55FeeB6Fc9DE96a2
0x9eb86e93a809a41ab0e7cc0ba6f62561fda3015c,0x51ebea55bb9065e25bcadee3cc06457fad9b1e5edaf81177f4764e906d978473,01-01-2025,2025-01-01 20:05:31.000 UTC,1399,24486292,0x869305781fff479f0311974d55FeeB6Fc9DE96a2
0x8fd1b615c006ebeb8a7cfb00a1dd809f31943b08,0x10775b8d82e09bf45552f46e21534aadd093a2f00b883d03bedb6409ff5fad11,28-02-2025,2025-02-28 05:06:13.000 UTC,473,26964913,0x0e956C897bBFCbd2155D3DfdD27c87fa5A0FaD39
0x38f6d2d9ea493c3c6ee865b5b952b5fe9e3e61fc,0x4f039198b2d6885c7ff186b6cffcf4a2503bf0b14ab65f95ac32b62c94d3825f,31-01-2025,2025-01-31 17:10:09.000 UTC,337,25777031,0xB9E4E0368A9F281584C9adB685e6C9F4b9F37dBb
0x9eb86e93a809a41ab0e7cc0ba6f62561fda3015c,0x0c8f2f23e31a3d529df99de609f9e2e2cd447a48c84d602481657bcd5f9b33ed,02-01-2025,2025-01-02 06:17:39.000 UTC,404,24504656,0x869305781fff479f0311974d55FeeB6Fc9DE96a2
0x8fd1b615c006ebeb8a7cfb00a1dd809f31943b08,0x207acaaf323419be71dcb31734c95e92963abb74d3b7a7dbbaf0929cc9c9c3ec,16-12-2024,2024-12-16 01:54:43.000 UTC,187,23762368,0x0e956C897bBFCbd2155D3DfdD27c87fa5A0FaD39
0xdc98dbffcc648d6088a2ff8f7dc01aef050e58fc,0xb04830692e693474237164afd4409c4ce11b32863ee29b92e6a72681071d0bd7,29-12-2024,2024-12-29 16:35:11.000 UTC,330,24350382,0xCFede447ca3b4885720B5a327e3BFb02078f06e8
0xdc98dbffcc648d6088a2ff8f7dc01aef050e58fc,0x2eebb017eb2adf1d8197f6d541811a76ebe7a61897da726d846bf61dd335f7e5,03-01-2025,2025-01-03 07:16:55.000 UTC,764,24549634,0xBDA319Bc7Cc8F0829df39eC0FFF5D1E061FFadf7
0xdc98dbffcc648d6088a2ff8f7dc01aef050e58fc,0xa797acd59818a60b28f815d0bc5661e729b2426e511b53f428bd78b2a8c3a986,02-06-2025,2025-06-02 22:29:23.000 UTC,388,31057008,0xc3f97660D0b47F0E05C3c513f73eeff7c1bd6c7a
0xdc98dbffcc648d6088a2ff8f7dc01aef050e58fc,0xecf3242642b99763e785116c4794e3e84a0a61c627f3889b3808a53496633675,02-01-2025,2025-01-02 11:53:05.000 UTC,307,24514719,0xBDA319Bc7Cc8F0829df39eC0FFF5D1E061FFadf7
0x9eb86e93a809a41ab0e7cc0ba6f62561fda3015c,0x7b45ff7dc1c896d52f440a7ea47299f1e1bd5621110e551d91e4da5c66d8fb01,24-01-2025,2025-01-24 03:40:17.000 UTC,201,25450335,0xB9E4E0368A9F281584C9adB685e6C9F4b9F37dBb
0x38f6d2d9ea493c3c6ee865b5b952b5fe9e3e61fc,0x620f972ae3946caed4487f07ec3a85d44019b9c914086e7741b051060adf2aa9,21-12-2024,2024-12-21 10:42:31.000 UTC,219,23994202,0xCFede447ca3b4885720B5a327e3BFb02078f06e8
0xdc98dbffcc648d6088a2ff8f7dc01aef050e58fc,0x04c1a3fb952b7709f2a4754aa9d34b46acf1b34c2b70e21e64d33f07d249f76c,15-01-2025,2025-01-15 23:17:07.000 UTC,194,25096840,0x869305781fff479f0311974d55FeeB6Fc9DE96a2
0x351f61e4c49cf11f24d9f2e737ca5eff81806355,0xc51776616cb5a919efd8afa740946ade856c2d305ef8797b83725473c9d88a33,22-08-2025,2025-08-22 19:16:03.000 UTC,537,34550408,0x0e956C897bBFCbd2155D3DfdD27c87fa5A0FaD39
0x2791dc5e14f7680d9d969acc26059ba56403b6d5,0x3e9621e8b769c06d19096288b252d1622296acc2f94d77ac52aebc234bf964d4,12-12-2024,2024-12-12 15:56:19.000 UTC,390,23614816,0xBDA319Bc7Cc8F0829df39eC0FFF5D1E061FFadf7
0x9eb86e93a809a41ab0e7cc0ba6f62561fda3015c,0x70c325006e892011cb0b847fee35a2d49478e8dac2d5975390b85c68d3425c4b,14-12-2024,2024-12-14 12:23:47.000 UTC,127,23694840,0xCFede447ca3b4885720B5a327e3BFb02078f06e8
0x8fd1b615c006ebeb8a7cfb00a1dd809f31943b08,0x038b8f6d2b5f7ae99dd74c2f41b11b62c120c60f9a063e028c5f3a7b8665ca97,06-01-2025,2025-01-06 02:09:17.000 UTC,310,24670005,0xBDA319Bc7Cc8F0829df39eC0FFF5D1E061FFadf7
0x9eb86e93a809a41ab0e7cc0ba6f62561fda3015c,0x1313addad83c1753bbee78f5ea9c6a426ec81349cd81f90af98c5ae849bf73ce,21-12-2024,2024-12-21 14:47:09.000 UTC,347,24001541,0xBDA319Bc7Cc8F0829df39eC0FFF5D1E061FFadf7
0xdc98dbffcc648d6088a2ff8f7dc01aef050e58fc,0x9acd5192f0052c9cf70ce6fc28c67ca1ef9b1c4a79cf98c4cf1bdf808ff06ece,03-06-2025,2025-06-03 13:29:55.000 UTC,354,31084024,0xc3f97660D0b47F0E05C3c513f73eeff7c1bd6c7a
0x8508fd4238162cb3f3d485f432202af3b40f164e,0xfd2d3f1e2bf48381296151cff4604e8da0e807727a8ce41c36b901f4f86324ca,03-07-2025,2025-07-03 19:13:07.000 UTC,346,32390320,0xCFede447ca3b4885720B5a327e3BFb02078f06e8
0x8fd1b615c006ebeb8a7cfb00a1dd809f31943b08,0x90bcdbce25d39bb24fd19e33e1f0a1ca849abbbd20700e2ff22fa926f464edcc,20-12-2024,2024-12-20 17:58:49.000 UTC,260,23964091,0xBDA319Bc7Cc8F0829df39eC0FFF5D1E061FFadf7
0x8fd1b615c006ebeb8a7cfb00a1dd809f31943b08,0x707de9775b6d5b4ca78d7a0130e1fc61f2857c1feb6cb2ec08b0b6b46a36ba35,01-01-2025,2025-01-01 14:39:23.000 UTC,287,24476508,0xBDA319Bc7Cc8F0829df39eC0FFF5D1E061FFadf7
0x38f6d2d9ea493c3c6ee865b5b952b5fe9e3e61fc,0xd48c59880cbc5e4ae94787d3ac55a8ee8e437fabf43a71568d339e3e3c06c7db,03-01-2025,2025-01-03 17:19:53.000 UTC,258,24567723,0x869305781fff479f0311974d55FeeB6Fc9DE96a2
0x9eb86e93a809a41ab0e7cc0ba6f62561fda3015c,0xb941a39202a37ef91821132e0458c8b5d49c8c1d71173a4fb3cb40e6f1c872ac,04-03-2025,2025-03-04 17:51:27.000 UTC,297,27160670,0x6399ed6725cC163D019aA64FF55b22149D7179A8
0x38f6d2d9ea493c3c6ee865b5b952b5fe9e3e61fc,0x270e81a04a66e014130b645e76ada99519d713ce12c4f2f26213ec5bd424f382,07-01-2025,2025-01-07 21:05:47.000 UTC,247,24747300,0xCFede447ca3b4885720B5a327e3BFb02078f06e8
0x8508fd4238162cb3f3d485f432202af3b40f164e,0x52f5487f9b1cd07ca578ab4240fd3895a8beba05473c4d2cfa412358fa87c4c6,04-06-2025,2025-06-04 18:47:29.000 UTC,579,31136751,0x6205DfbE68444cFF504A20a712cEa794c6b6Cf04
0x8fd1b615c006ebeb8a7cfb00a1dd809f31943b08,0x6b59edbad0376be747fb5801f98ef6f61f9748bbad0a63bbe5c43d624c712d7d,09-05-2025,2025-05-09 11:55:53.000 UTC,494,30001203,0x0e956C897bBFCbd2155D3DfdD27c87fa5A0FaD39
0xdc98dbffcc648d6088a2ff8f7dc01aef050e58fc,0x23e21fcd21f6e3c1cf4bd9568d36714a06d9a0b3b98d01dc8590fdea4f210265,09-04-2025,2025-04-09 14:41:25.000 UTC,303,28710169,0x430C09546ae9249AB75B9A4ef7B5FD9a4006D6f3
0xdc98dbffcc648d6088a2ff8f7dc01aef050e58fc,0x247865957b1dd7f2af11d48621a0878af22ab870a9afe39aef3348d6c94bda39,03-06-2025,2025-06-03 12:39:21.000 UTC,4419,31082507,0xc3f97660D0b47F0E05C3c513f73eeff7c1bd6c7a
0x2791dc5e14f7680d9d969acc26059ba56403b6d5,0x7b07a8b4b039f0721468178f3fc5c3b6dc9c58a965a6dec1bd6a6819565ddd67,19-12-2024,2024-12-19 03:36:53.000 UTC,314,23895033,0xBDA319Bc7Cc8F0829df39eC0FFF5D1E061FFadf7
0x9eb86e93a809a41ab0e7cc0ba6f62561fda3015c,0x8dd86b350a68e30c77cfb7dc5a7ac5ef15bdb0be10ed821e3be2f70c71a9d7b9,02-01-2025,2025-01-02 13:36:27.000 UTC,289,24517820,0xBDA319Bc7Cc8F0829df39eC0FFF5D1E061FFadf7
0x2791dc5e14f7680d9d969acc26059ba56403b6d5,0xe7e688ba9b35b5536541f156abebf25a7654ff5a3d783d5dff370d82cd31f645,11-01-2025,2025-01-11 22:25:21.000 UTC,585,24922487,0xBDA319Bc7Cc8F0829df39eC0FFF5D1E061FFadf7
0x8fd1b615c006ebeb8a7cfb00a1dd809f31943b08,0xeafbd1fc0bb4726fa78ca9e85a2f6bb795bb268b6a4a021ecaf50597268be716,14-12-2024,2024-12-14 14:40:49.000 UTC,381,23698951,0x0e956C897bBFCbd2155D3DfdD27c87fa5A0FaD39
0x38f6d2d9ea493c3c6ee865b5b952b5fe9e3e61fc,0x93dd76e7273e0ffa2f6cdce8d3dfef26595e96b243bac526de0fe1e2564fa3ca,08-01-2025,2025-01-08 19:07:57.000 UTC,320,24786965,0x869305781fff479f0311974d55FeeB6Fc9DE96a2
0x2791dc5e14f7680d9d969acc26059ba56403b6d5,0xfd44fc6d6b2e59f460b472836c88cdfe4372cc64d9f84a9b10841bd43eae270b,05-01-2025,2025-01-05 05:18:13.000 UTC,460,24632473,0xBDA319Bc7Cc8F0829df39eC0FFF5D1E061FFadf7
0x8810de2baa17067ddcfbd9e8f29c55f070a55f0b,0xe24b47664c892bf63d3de6c047c5af9c35c3fdf0053023e1a65d0813253b6534,11-05-2025,2025-05-11 05:58:29.000 UTC,32,30076881,0xaDEfE661847835C6566b1caAbECfcF09C586F300
0x9eb86e93a809a41ab0e7cc0ba6f62561fda3015c,0xda759d1a7322bfe45c66779a477d9893ac1924cfcc4ce4f67283a1b363ca7407,15-12-2024,2024-12-15 03:58:45.000 UTC,320,23722889,0xBDA319Bc7Cc8F0829df39eC0FFF5D1E061FFadf7
0xdc98dbffcc648d6088a2ff8f7dc01aef050e58fc,0x51fdf00567bffa30669c3b81fe0477711f7dd5053d7d5011000e909e7a37debc,31-12-2024,2024-12-31 04:23:11.000 UTC,818,24414822,0xBDA319Bc7Cc8F0829df39eC0FFF5D1E061FFadf7
0x8508fd4238162cb3f3d485f432202af3b40f164e,0x32b74b696cf8fc3ea5a1df22db843168e06446e2837fd6158db7f09511593991,03-06-2025,2025-06-03 15:30:13.000 UTC,586,31087633,0xc3f97660D0b47F0E05C3c513f73eeff7c1bd6c7a
0x8810de2baa17067ddcfbd9e8f29c55f070a55f0b,0xe4d229afbf87d36f054d519b112d5ef76761bfefed846c69582cd48001084469,12-03-2025,2025-03-12 14:01:47.000 UTC,271,27499380,0x0e956C897bBFCbd2155D3DfdD27c87fa5A0FaD39
0x8508fd4238162cb3f3d485f432202af3b40f164e,0x674dc2e97f9ff27ba23c08b7397b9bd55afd8b756903cac982541df386d69e69,13-04-2025,2025-04-13 22:19:21.000 UTC,128,28896707,0x2B74B62c564456C48055bd515A62594742b3f545
0x351f61e4c49cf11f24d9f2e737ca5eff81806355,0xaa17e23cb5a3b7227d34690c466cda871e02fbd39e02207d92c0f1d08c9aba85,02-09-2025,2025-09-02 02:42:35.000 UTC,376,34995804,0x0e956C897bBFCbd2155D3DfdD27c87fa5A0FaD39
0x38f6d2d9ea493c3c6ee865b5b952b5fe9e3e61fc,0x9af054a814310b6401535f60a8241d039890cb156849b71a50db1738d65ee207,01-06-2025,2025-06-01 01:53:07.000 UTC,796,30976720,0xc3f97660D0b47F0E05C3c513f73eeff7c1bd6c7a
0x2791dc5e14f7680d9d969acc26059ba56403b6d5,0x29eb0a916a7d9dcf4faf8342564f50be55b2dbdb29d34135d45ef89345d082c9,10-12-2024,2024-12-10 23:57:51.000 UTC,264,23542862,0xCFede447ca3b4885720B5a327e3BFb02078f06e8
0x8fd1b615c006ebeb8a7cfb00a1dd809f31943b08,0x7f1e32f1a1d161abbb838fc31fdb71550519d99de9a90bffe1a40dd175214c2d,01-01-2025,2025-01-01 03:32:05.000 UTC,282,24456489,0xBDA319Bc7Cc8F0829df39eC0FFF5D1E061FFadf7
0x2791dc5e14f7680d9d969acc26059ba56403b6d5,0x5b572eb67fc244e62f87a2c3b9e9ed0942c95438104c81e860c830dcdc5141a2,14-01-2025,2025-01-14 08:56:49.000 UTC,256,25027831,0xBDA319Bc7Cc8F0829df39eC0FFF5D1E061FFadf7
0x8fd1b615c006ebeb8a7cfb00a1dd809f31943b08,0x368f975ce6a9ad960c61d9f15162e58468e63682bf3aca3ad229cef3a0b1ac92,05-01-2025,2025-01-05 17:49:55.000 UTC,378,24655024,0xB9E4E0368A9F281584C9adB685e6C9F4b9F37dBb
0x8fd1b615c006ebeb8a7cfb00a1dd809f31943b08,0xbd42dd174c4d6a983f5390090093b2e5dd884db74b9195c489932ad94a960266,26-12-2024,2024-12-26 20:51:49.000 UTC,294,24228481,0xBDA319Bc7Cc8F0829df39eC0FFF5D1E061FFadf7
0x8fd1b615c006ebeb8a7cfb00a1dd809f31943b08,0x5deeb7c41b2c10691ab09e298931aa7a2c493c4ee0440fe8c9ad446912148f2e,09-01-2025,2025-01-09 09:18:25.000 UTC,364,24812479,0xBDA319Bc7Cc8F0829df39eC0FFF5D1E061FFadf7
0x2791dc5e14f7680d9d969acc26059ba56403b6d5,0xf4e49ee966f3f1a6d1d29cd8621839449ebcadb4b82926279eb492a1b37fa844,12-01-2025,2025-01-12 04:48:15.000 UTC,140,24933974,0xB9E4E0368A9F281584C9adB685e6C9F4b9F37dBb
0x351f61e4c49cf11f24d9f2e737ca5eff81806355,0x0a124b4a4643df26a7c10acc0d363ba7e6909506d3a4049547e3f85aa62481cf,18-11-2025,2025-11-18 02:46:37.000 UTC,770,38322325,0x0e956C897bBFCbd2155D3DfdD27c87fa5A0FaD39
0x2791dc5e14f7680d9d969acc26059ba56403b6d5,0xaaca469830c41c644da2ca5a74ef7fbfec42e9df2170b5321aedfa7488c610ae,13-01-2025,2025-01-13 08:26:05.000 UTC,456,24983709,0xBDA319Bc7Cc8F0829df39eC0FFF5D1E061FFadf7
0x8508fd4238162cb3f3d485f432202af3b40f164e,0xb15f00ae344f900de39ea1eff771bc7b1424a66feef6075ca1650a6a447ebb8e,27-03-2025,2025-03-27 17:53:35.000 UTC,492,28154334,0x2B74B62c564456C48055bd515A62594742b3f545
0x351f61e4c49cf11f24d9f2e737ca5eff81806355,0x510038f64c148a93bc243a581c2b638085ee255ce87064c752fd26d47ba8ba1f,27-11-2025,2025-11-27 20:32:21.000 UTC,25,38743097,0x0e956C897bBFCbd2155D3DfdD27c87fa5A0FaD39
0x9eb86e93a809a41ab0e7cc0ba6f62561fda3015c,0x685c61bd358085834aee750abb9d568029d8f3e6f2ad683b3f03eb049ac8bb44,13-02-2025,2025-02-13 21:06:21.000 UTC,202,26345717,0x6399ed6725cC163D019aA64FF55b22149D7179A8
0x38f6d2d9ea493c3c6ee865b5b952b5fe9e3e61fc,0x40444c74ebb5bae11bdd6fced781a57caa252f928d7618109c002f17dbdc6f7a,18-01-2025,2025-01-18 21:04:17.000 UTC,514,25222455,0xB9E4E0368A9F281584C9adB685e6C9F4b9F37dBb
0x9eb86e93a809a41ab0e7cc0ba6f62561fda3015c,0x5ea58519003fb246a7dc2d03234f380e8b4c91ec5af1e89fa500d54cbf4592f0,30-01-2025,2025-01-30 01:24:49.000 UTC,551,25705471,0xB9E4E0368A9F281584C9adB685e6C9F4b9F37dBb
0x2791dc5e14f7680d9d969acc26059ba56403b6d5,0xcb5f6ccdf8788657fc0f77589358c89e7d3086bcf3f24ea95ae744dd7037dd68,14-01-2025,2025-01-14 07:15:59.000 UTC,226,25024806,0xBDA319Bc7Cc8F0829df39eC0FFF5D1E061FFadf7
0x2791dc5e14f7680d9d969acc26059ba56403b6d5,0xf2af7a94567b026a7ecff74f9ce014785a82688a0138f4bbba409e209e9e166f,12-12-2024,2024-12-12 18:49:59.000 UTC,406,23620026,0xBDA319Bc7Cc8F0829df39eC0FFF5D1E061FFadf7
0x9eb86e93a809a41ab0e7cc0ba6f62561fda3015c,0xb712b2bae84792daf9c24ae7f05df84adbcc2097618a72b6db916fc44506b4b5,21-12-2024,2024-12-21 20:24:59.000 UTC,142,24011676,0xBDA319Bc7Cc8F0829df39eC0FFF5D1E061FFadf7
0x38f6d2d9ea493c3c6ee865b5b952b5fe9e3e61fc,0xfb865ed0212b0bb7938431ce13d0c6fa8dada9cc914631888b17af3e584dbf0d,31-05-2025,2025-05-31 00:32:53.000 UTC,464,30931113,0xc3f97660D0b47F0E05C3c513f73eeff7c1bd6c7a
0x2791dc5e14f7680d9d969acc26059ba56403b6d5,0x73dfcafd71d7fd7818b464aa1a6828528e1b4143bd9a4869f4b55abd29300e4a,31-12-2024,2024-12-31 17:26:55.000 UTC,356,24438334,0xBDA319Bc7Cc8F0829df39eC0FFF5D1E061FFadf7
0x2791dc5e14f7680d9d969acc26059ba56403b6d5,0x3d5f8f113fc63d96b15c692995afab5f4b30d09405ec350d1807792ad020304a,02-01-2025,2025-01-02 01:10:49.000 UTC,314,24495451,0xBDA319Bc7Cc8F0829df39eC0FFF5D1E061FFadf7
0x351f61e4c49cf11f24d9f2e737ca5eff81806355,0xb0c408670556ada566f06754d6cf80e4c29b88de16e5b987166c116f8cc30a37,23-08-2025,2025-08-23 08:48:37.000 UTC,549,34574785,0x0e956C897bBFCbd2155D3DfdD27c87fa5A0FaD39
0x2791dc5e14f7680d9d969acc26059ba56403b6d5,0x43372f07aeebdd8f42e4b2549209775e09ea3ef0591d59a15f90f443c26f3ce8,06-01-2025,2025-01-06 19:47:21.000 UTC,168,24701747,0x869305781fff479f0311974d55FeeB6Fc9DE96a2
0x8fd1b615c006ebeb8a7cfb00a1dd809f31943b08,0x04e7471a3a8f748bbeeb1cfb940aec0c1f64541735aadb33fb1cec0ac17ba6fc,02-01-2025,2025-01-02 01:57:07.000 UTC,318,24496840,0xAfabcBbab5e4261B1d655c906738176191819164
0x8508fd4238162cb3f3d485f432202af3b40f164e,0x4814e64068f7182f9309b0d70acc2638e11912efd24000af47979e074099b820,31-05-2025,2025-05-31 11:53:37.000 UTC,652,30951535,0xc3f97660D0b47F0E05C3c513f73eeff7c1bd6c7a
0x095d0de0ecfd6832f1a7961ae26d285d68655d60,0x0709e68cebfda71a359ee6cd103dad4cf8de5f593f507c3f85f65be83ad34597,11-05-2025,2025-05-11 05:03:27.000 UTC,107,30075230,0x869305781fff479f0311974d55FeeB6Fc9DE96a2
0x38f6d2d9ea493c3c6ee865b5b952b5fe9e3e61fc,0xeed339fc08a38b1498474f7d12ac89536e3691a6ff714995c92dd953176798dc,03-01-2025,2025-01-03 11:12:17.000 UTC,257,24556695,0xB9E4E0368A9F281584C9adB685e6C9F4b9F37dBb
0x095d0de0ecfd6832f1a7961ae26d285d68655d60,0xe4450779f037e6a39852430aed36a225acd47d7a8bc453f45ce2a801401f4c54,25-03-2025,2025-03-25 10:59:15.000 UTC,505,28055504,0x869305781fff479f0311974d55FeeB6Fc9DE96a2
0x8fd1b615c006ebeb8a7cfb00a1dd809f31943b08,0x6239d71892ed8aff4ad675a0c114a47385252f900055cfee73110219f0e69070,02-01-2025,2025-01-02 15:33:55.000 UTC,364,24521344,0xBDA319Bc7Cc8F0829df39eC0FFF5D1E061FFadf7
0xdc98dbffcc648d6088a2ff8f7dc01aef050e58fc,0x28f090252b6c0e68373e8fa761aa39e0847de0b81d1a5c8475e943f7ff4d710a,08-01-2025,2025-01-08 20:15:39.000 UTC,495,24788996,0xB9E4E0368A9F281584C9adB685e6C9F4b9F37dBb
0x095d0de0ecfd6832f1a7961ae26d285d68655d60,0x75bc039b2071f1eda0191ee1fcb12d9eff1eaa9f37bedc8b21222bd3ea0b4e2f,19-01-2025,2025-01-19 22:55:41.000 UTC,318,25268997,0xB9E4E0368A9F281584C9adB685e6C9F4b9F37dBb
0x9eb86e93a809a41ab0e7cc0ba6f62561fda3015c,0xc9fc207227df3643edf5d6a057ac9903e199111ddb6ccf7de6278e004eecb7d3,01-01-2025,2025-01-01 09:42:25.000 UTC,275,24467599,0xC23924a846eca931Ec3014253E94f15b038bd0C8
0x38f6d2d9ea493c3c6ee865b5b952b5fe9e3e61fc,0xb8db2bf838246c9c1a537a69fcc497053d7a3c40a02f95ddd57c3a238b49035e,07-01-2025,2025-01-07 07:36:55.000 UTC,219,24723034,0x869305781fff479f0311974d55FeeB6Fc9DE96a2
0x2791dc5e14f7680d9d969acc26059ba56403b6d5,0x16c07038db2cbbc0acc1cbde61286696f8e9fc1423cf271d986b23f9ca9971a9,12-01-2025,2025-01-12 03:38:39.000 UTC,170,24931886,0xBDA319Bc7Cc8F0829df39eC0FFF5D1E061FFadf7
0x9eb86e93a809a41ab0e7cc0ba6f62561fda3015c,0x6e0c19f2f3503f5ed14e87b4e0e69833a94b195558164223eb8ff3283bcd3dcd,17-12-2024,2024-12-17 16:47:05.000 UTC,298,23832339,0xBDA319Bc7Cc8F0829df39eC0FFF5D1E061FFadf7
0x2791dc5e14f7680d9d969acc26059ba56403b6d5,0xa37006559853388161badfad451a02d387cd6b000e3fa2fb4aa9aa8199feaf9e,10-01-2025,2025-01-10 07:35:05.000 UTC,100,24852579,0x0e956C897bBFCbd2155D3DfdD27c87fa5A0FaD39
0x9eb86e93a809a41ab0e7cc0ba6f62561fda3015c,0x640bc23e4ef1bf449200c7586bc3ecb9368a3afda8c57786ef151d6d6baa0a38,03-01-2025,2025-01-03 20:18:23.000 UTC,323,24573078,0xBDA319Bc7Cc8F0829df39eC0FFF5D1E061FFadf7
0xdc98dbffcc648d6088a2ff8f7dc01aef050e58fc,0x060e66f2c56d09294217cf041b29cd70ee358c8b289be69986c9525d20c0882b,13-01-2025,2025-01-13 13:58:13.000 UTC,266,24993673,0xB9E4E0368A9F281584C9adB685e6C9F4b9F37dBb
0x9eb86e93a809a41ab0e7cc0ba6f62561fda3015c,0x715033d3e5d09206ae63f4205581eab1cbd7e868d6ee9f99a97afe0d7085fae5,02-01-2025,2025-01-02 17:12:13.000 UTC,516,24524293,0x869305781fff479f0311974d55FeeB6Fc9DE96a2
0xdc98dbffcc648d6088a2ff8f7dc01aef050e58fc,0x7a4c465c897fcfc6c1a0cb3aef4d3e5a54423296b6c4192116b45841a15cac51,11-01-2025,2025-01-11 03:00:03.000 UTC,252,24887528,0xBDA319Bc7Cc8F0829df39eC0FFF5D1E061FFadf7
0xdc98dbffcc648d6088a2ff8f7dc01aef050e58fc,0xff7dca7929fbddf58cf9d9a03972fe101a210b639738bb883adde8b6c3c52e2d,04-07-2025,2025-07-04 19:43:39.000 UTC,416,32434436,0xf2c38dE50A250C0060fB45eBE4504B67f6F1be3C
0x9eb86e93a809a41ab0e7cc0ba6f62561fda3015c,0xbb677bb3e3c6745b5f58a76eaa72be23a1100d290a88f592d43ce28d3e2fc045,30-12-2024,2024-12-30 14:09:47.000 UTC,279,24389220,0xBDA319Bc7Cc8F0829df39eC0FFF5D1E061FFadf7
0x38f6d2d9ea493c3c6ee865b5b952b5fe9e3e61fc,0xf0d1e70c52140d8f6211f6816741c94b9feefa0ac86800e15ca75f9c6d8f4d62,20-05-2025,2025-05-20 08:14:03.000 UTC,437,30469748,0xCFede447ca3b4885720B5a327e3BFb02078f06e8
0x8fd1b615c006ebeb8a7cfb00a1dd809f31943b08,0xeea60d3658edbf9da7a35c1f0b5f65d0e27bed811c9d4767867e031060187837,16-12-2024,2024-12-16 07:21:27.000 UTC,597,23772170,0xCFede447ca3b4885720B5a327e3BFb02078f06e8
0x9eb86e93a809a41ab0e7cc0ba6f62561fda3015c,0x732040538cb46ae2c70e00e381b915f0b1c4baa244ec0f064f92e6c32ec23cce,28-02-2025,2025-02-28 11:30:43.000 UTC,114,26976448,0x6399ed6725cC163D019aA64FF55b22149D7179A8
0x9eb86e93a809a41ab0e7cc0ba6f62561fda3015c,0xeaad27d4c4c172062ab3c0c86297ce51e7706cbf5e71bf0ebebed06e8ad92d34,04-03-2025,2025-03-04 16:19:03.000 UTC,235,27157898,0x6399ed6725cC163D019aA64FF55b22149D7179A8
0x9eb86e93a809a41ab0e7cc0ba6f62561fda3015c,0xf5bf25219fd6c39b07a63137f829b81c87c4a5dc455ad68ceae1faabb31ea7af,02-01-2025,2025-01-02 01:42:31.000 UTC,305,24496402,0xC23924a846eca931Ec3014253E94f15b038bd0C8
0x9eb86e93a809a41ab0e7cc0ba6f62561fda3015c,0x32977c1e2414ae512e978d02d8aced3cfcfcb9f86263080729c31c4d87d337f3,20-12-2024,2024-12-20 04:05:43.000 UTC,326,23939098,0xCFede447ca3b4885720B5a327e3BFb02078f06e8
0x2791dc5e14f7680d9d969acc26059ba56403b6d5,0x22e5c3a6cb17c4f6bb25c613d0116f449c58269d7079ac0b8b35be75daafddbb,08-01-2025,2025-01-08 19:06:25.000 UTC,505,24786919,0x869305781fff479f0311974d55FeeB6Fc9DE96a2
0xdc98dbffcc648d6088a2ff8f7dc01aef050e58fc,0xf003e59fd1df370a9d9bb19a0d0515f3de9fade3cb2e97900fe843d97de666be,06-01-2025,2025-01-06 01:30:39.000 UTC,362,24668846,0xBDA319Bc7Cc8F0829df39eC0FFF5D1E061FFadf7
0x38f6d2d9ea493c3c6ee865b5b952b5fe9e3e61fc,0x72364399e10610d85cb0cc5114adcdcf02c41770ef0b7359ddcfc9deacc41628,30-05-2025,2025-05-30 12:40:13.000 UTC,632,30909733,0xc3f97660D0b47F0E05C3c513f73eeff7c1bd6c7a
0xdc98dbffcc648d6088a2ff8f7dc01aef050e58fc,0x98a93b63e7dcd9d83b5b3a61b023695662d1b2985e162a433406bcdffbe31da4,05-06-2025,2025-06-05 07:36:47.000 UTC,494,31159830,0xc3f97660D0b47F0E05C3c513f73eeff7c1bd6c7a
0x2791dc5e14f7680d9d969acc26059ba56403b6d5,0x5bebc2eb0654a17fea1a2ec0a7672cbdecc352efbd525bb345d17fdccbd467d7,13-01-2025,2025-01-13 17:43:29.000 UTC,418,25000431,0xB9E4E0368A9F281584C9adB685e6C9F4b9F37dBb
0x9eb86e93a809a41ab0e7cc0ba6f62561fda3015c,0x65ca6238b627d5469fd5b3c638848663c8154352e71e0901c37c11785086741e,10-01-2025,2025-01-10 02:57:15.000 UTC,282,24844244,0xBDA319Bc7Cc8F0829df39eC0FFF5D1E061FFadf7
0x9eb86e93a809a41ab0e7cc0ba6f62561fda3015c,0x74a2faefb264f7e63367c88634f5338668f1bc209ca226dcc6654a68f5d8640a,02-02-2025,2025-02-02 07:45:05.000 UTC,358,25846479,0x0e956C897bBFCbd2155D3DfdD27c87fa5A0FaD39
0x2791dc5e14f7680d9d969acc26059ba56403b6d5,0x697d965f4dd62a6253f87a51db721bc81673194970d83a582966e5409f76e9c7,10-01-2025,2025-01-10 21:32:35.000 UTC,254,24877704,0xBDA319Bc7Cc8F0829df39eC0FFF5D1E061FFadf7
0xdc98dbffcc648d6088a2ff8f7dc01aef050e58fc,0xdafd083ba0f359f3f0e5a941700ef26360bfb4aa0f3c288623324a2d1706ff31,09-01-2025,2025-01-09 16:27:53.000 UTC,810,24825363,0x0e956C897bBFCbd2155D3DfdD27c87fa5A0FaD39
0x8508fd4238162cb3f3d485f432202af3b40f164e,0xf91728b0c38a1a26a0daadf0309dea445c9f922531eef790fb9b676bcf8a2dca,24-04-2025,2025-04-24 23:17:45.000 UTC,146,29373659,0x2B74B62c564456C48055bd515A62594742b3f545
0xdc98dbffcc648d6088a2ff8f7dc01aef050e58fc,0xea4a2f637db26618474a1ab1bd46d5f5c3b2770a2646403c31e0bc87f108fdca,19-06-2025,2025-06-19 22:53:53.000 UTC,1170,31792143,0xCFede447ca3b4885720B5a327e3BFb02078f06e8
0x38f6d2d9ea493c3c6ee865b5b952b5fe9e3e61fc,0x739ca8427a893572ddce1f64e183f503ee53d974120abb893e810ec98cbcadc2,02-02-2025,2025-02-02 16:00:53.000 UTC,284,25861353,0x0e956C897bBFCbd2155D3DfdD27c87fa5A0FaD39
0x9eb86e93a809a41ab0e7cc0ba6f62561fda3015c,0xf16c19ce63c92272b86a1e4c09bd5c9a5094ad5ff40a1f0d610bb0fa87ad8272,24-01-2025,2025-01-24 04:06:47.000 UTC,233,25451130,0xB9E4E0368A9F281584C9adB685e6C9F4b9F37dBb
0x38f6d2d9ea493c3c6ee865b5b952b5fe9e3e61fc,0x3b5d1dbfea7504c36152f0525bf24cf3c3e8675493794ab62a6d067658c254ad,03-06-2025,2025-06-03 11:13:03.000 UTC,974,31079918,0xc3f97660D0b47F0E05C3c513f73eeff7c1bd6c7a
0x8fd1b615c006ebeb8a7cfb00a1dd809f31943b08,0x58d134891cea2ede49324105cc72a46ac14e738281be7d93e37dc22586cb7326,10-01-2025,2025-01-10 11:32:55.000 UTC,475,24859714,0xBDA319Bc7Cc8F0829df39eC0FFF5D1E061FFadf7
0xdc98dbffcc648d6088a2ff8f7dc01aef050e58fc,0x8ef8cee246f79e01c0dc4265c0e1e64038aa379ba44f6039e9aabd7f3771fcd1,15-01-2025,2025-01-15 16:50:03.000 UTC,343,25085228,0xBDA319Bc7Cc8F0829df39eC0FFF5D1E061FFadf7
0x38f6d2d9ea493c3c6ee865b5b952b5fe9e3e61fc,0xa52df2d55b526558bf6f53228ec960f058e91394ca0ad41c66a6fca1dc2e97b4,08-01-2025,2025-01-08 21:15:43.000 UTC,371,24790798,0xBDA319Bc7Cc8F0829df39eC0FFF5D1E061FFadf7
0x2791dc5e14f7680d9d969acc26059ba56403b6d5,0x5f456ae03b053be1820d1c75bc79d03afc2e359585da0d0f001bbf5f3c2f7df6,16-12-2024,2024-12-16 09:35:25.000 UTC,397,23776189,0xBDA319Bc7Cc8F0829df39eC0FFF5D1E061FFadf7
0x9eb86e93a809a41ab0e7cc0ba6f62561fda3015c,0xb1960a990554cc95c403c965b4be0363e25b7b4eaaaacf203b07015b79079377,10-06-2025,2025-06-10 18:17:39.000 UTC,915,31395056,0xc3f97660D0b47F0E05C3c513f73eeff7c1bd6c7a
0xdc98dbffcc648d6088a2ff8f7dc01aef050e58fc,0x226b5793bc09de94c2d4b3cd4a5cf4ec5b93812dba746b77f23e18a6e7501e64,13-06-2025,2025-06-13 12:00:25.000 UTC,430,31513339,0xf2c38dE50A250C0060fB45eBE4504B67f6F1be3C
0x2791dc5e14f7680d9d969acc26059ba56403b6d5,0xebeef201bf02ea9859f9bf3c7d3e2f3c426273d674427db9899047df6a5af8b2,13-12-2024,2024-12-13 06:18:47.000 UTC,317,23640690,0xBDA319Bc7Cc8F0829df39eC0FFF5D1E061FFadf7
0x095d0de0ecfd6832f1a7961ae26d285d68655d60,0xfaa8b7b7994947a477843c1c1745ac159e63afc9d29e790f21c93f758de0fb69,23-04-2025,2025-04-23 05:17:03.000 UTC,213,29298038,0x869305781fff479f0311974d55FeeB6Fc9DE96a2
0x38f6d2d9ea493c3c6ee865b5b952b5fe9e3e61fc,0x8c88697001ba394c402b52f75545176fefffe3dd3dd411f752486ae192182a99,11-06-2025,2025-06-11 05:02:13.000 UTC,229,31414393,0xc3f97660D0b47F0E05C3c513f73eeff7c1bd6c7a
0x38f6d2d9ea493c3c6ee865b5b952b5fe9e3e61fc,0x6e3c5d6762321fdb39e6d754c5b4716b666ada82d4c1fbba8fe337bd06ff9573,16-12-2024,2024-12-16 17:01:23.000 UTC,498,23789568,0xCFede447ca3b4885720B5a327e3BFb02078f06e8
0x9eb86e93a809a41ab0e7cc0ba6f62561fda3015c,0x9d0ccbbe7ca538482eb586717cde94d4b1c1fc32aa3d225f56deb8b9e09ed03e,02-01-2025,2025-01-02 22:55:59.000 UTC,356,24534606,0xC23924a846eca931Ec3014253E94f15b038bd0C8
0x2791dc5e14f7680d9d969acc26059ba56403b6d5,0x77ff066f77a7eaf4bcce657cafa011200d95b8c683da9c6bce6cea913c9c03ee,30-12-2024,2024-12-30 05:43:57.000 UTC,1383,24374045,0xBDA319Bc7Cc8F0829df39eC0FFF5D1E061FFadf7
0x9eb86e93a809a41ab0e7cc0ba6f62561fda3015c,0xec8c3e1a8541ead7d8fe14f15684072759257d6956fdef31ae0db54dcfd824f5,29-12-2024,2024-12-29 02:34:03.000 UTC,316,24325148,0xCFede447ca3b4885720B5a327e3BFb02078f06e8
0x2791dc5e14f7680d9d969acc26059ba56403b6d5,0xe342476dda58e3962c1340ba2d31c1a5c9d75edd0f03c90326afd0ef76531c07,19-12-2024,2024-12-19 08:58:09.000 UTC,309,23904671,0xBDA319Bc7Cc8F0829df39eC0FFF5D1E061FFadf7
0x38f6d2d9ea493c3c6ee865b5b952b5fe9e3e61fc,0x7212fdadb7fcd0b997d610c050f515b731f12cb590feb7b7abf3ed6092051e85,03-01-2025,2025-01-03 11:11:15.000 UTC,283,24556664,0x0e956C897bBFCbd2155D3DfdD27c87fa5A0FaD39
0x8fd1b615c006ebeb8a7cfb00a1dd809f31943b08,0x84afd0d7d808905b36ceee8e1b6e6afa65120b1361dc1e19249a95693695b2df,06-01-2025,2025-01-06 14:34:03.000 UTC,278,24692348,0xAfabcBbab5e4261B1d655c906738176191819164
0x8fd1b615c006ebeb8a7cfb00a1dd809f31943b08,0x48145eab7df62e4c3fb03419c903e7bf8c7286c9e45ba5b1e14f6349959e42a8,13-02-2025,2025-02-13 14:26:17.000 UTC,323,26333715,0xF33a96b5932D9E9B9A0eDA447AbD8C9d48d2e0c8
0x38f6d2d9ea493c3c6ee865b5b952b5fe9e3e61fc,0x0c65985cca374526775a1f23acfe81c388560f1001f1e6c66f1ae3f875f05649,02-03-2025,2025-03-02 18:40:39.000 UTC,209,27075746,0xB9E4E0368A9F281584C9adB685e6C9F4b9F37dBb
0x095d0de0ecfd6832f1a7961ae26d285d68655d60,0xda545dad9fd8afd3a134c242c715983bde798d3ced2cbb36dbbe8b99b8f943ae,13-05-2025,2025-05-13 05:51:57.000 UTC,68,30163085,0x0e956C897bBFCbd2155D3DfdD27c87fa5A0FaD39
0x351f61e4c49cf11f24d9f2e737ca5eff81806355,0x54cf8fe7ed19adb66ef763c4ac4056cf753554c14962e06d40922f8f81d32414,07-12-2025,2025-12-07 13:10:45.000 UTC,601,39161849,0x0e956C897bBFCbd2155D3DfdD27c87fa5A0FaD39
0x2791dc5e14f7680d9d969acc26059ba56403b6d5,0x5cdfa3ca16a205e4946f35c33d46c03abaf6e34992c6753751461bdc3e7c4026,07-01-2025,2025-01-07 01:38:07.000 UTC,380,24712270,0x869305781fff479f0311974d55FeeB6Fc9DE96a2
0xdc98dbffcc648d6088a2ff8f7dc01aef050e58fc,0xeb5a8aa341ef31ce46c362e41d56c6213e1ff25574d742b45160b202976a25e6,04-01-2025,2025-01-04 15:55:45.000 UTC,488,24608399,0x869305781fff479f0311974d55FeeB6Fc9DE96a2
0x9eb86e93a809a41ab0e7cc0ba6f62561fda3015c,0x7db33651419eb48f32ddf224e0d786c385e38cf8061739f8de60db23f7e9ad93,03-06-2025,2025-06-03 11:19:33.000 UTC,786,31080113,0xc3f97660D0b47F0E05C3c513f73eeff7c1bd6c7a
0x9eb86e93a809a41ab0e7cc0ba6f62561fda3015c,0x4e24b26b26ad6b45957d91feb2c466ee3afaba7c7ab605792c2d3ea282a65d46,12-12-2024,2024-12-12 01:24:23.000 UTC,224,23588658,0xBDA319Bc7Cc8F0829df39eC0FFF5D1E061FFadf7
0x9eb86e93a809a41ab0e7cc0ba6f62561fda3015c,0xa227e8482880a92b8e17ee6ac8f217d1c367b575bb4ee28c4ed772bc5170b0a7,10-01-2025,2025-01-10 00:41:17.000 UTC,331,24840165,0xBDA319Bc7Cc8F0829df39eC0FFF5D1E061FFadf7
0xdc98dbffcc648d6088a2ff8f7dc01aef050e58fc,0x4bcf9d9c4c9b5e5135b821137cfcaba8e2ee425bb6746b698c43173809973753,20-12-2024,2024-12-20 14:45:31.000 UTC,570,23958292,0xCFede447ca3b4885720B5a327e3BFb02078f06e8
0x2791dc5e14f7680d9d969acc26059ba56403b6d5,0xc68638556d2e6d854b89a7727f3ec848f2c118e6cf5e6a1e92046862105d99aa,14-01-2025,2025-01-14 20:31:05.000 UTC,392,25048659,0xBDA319Bc7Cc8F0829df39eC0FFF5D1E061FFadf7
0x38f6d2d9ea493c3c6ee865b5b952b5fe9e3e61fc,0x130f7ba015eeccc260fbbaf69874f9d7b31a132a49a1e09809f685cda9c73117,22-02-2025,2025-02-22 18:05:07.000 UTC,760,26729080,0xB9E4E0368A9F281584C9adB685e6C9F4b9F37dBb
0x095d0de0ecfd6832f1a7961ae26d285d68655d60,0x91a6fa4a33a1678503832fa6fb36315d37582510c77255b631db2e7212adb78f,06-03-2025,2025-03-06 02:22:41.000 UTC,250,27219207,0x869305781fff479f0311974d55FeeB6Fc9DE96a2
0x8508fd4238162cb3f3d485f432202af3b40f164e,0x60ba4ba26fe486e89ea8f3962a0939714cc8fdb80ac7aa3ccedfe0124b83644d,09-06-2025,2025-06-09 01:12:25.000 UTC,411,31321099,0xc3f97660D0b47F0E05C3c513f73eeff7c1bd6c7a
0x8fd1b615c006ebeb8a7cfb00a1dd809f31943b08,0x28dd0fe75ba9059b16f3007172d5fd0f87c795a58f7e70c3361751bcb329a9c1,24-12-2024,2024-12-24 18:08:35.000 UTC,301,24137184,0xBDA319Bc7Cc8F0829df39eC0FFF5D1E061FFadf7
0x38f6d2d9ea493c3c6ee865b5b952b5fe9e3e61fc,0xb442d495690fcf99530588da3994a40d3785b720a63d8f57a033c360720d33fb,08-01-2025,2025-01-08 04:55:59.000 UTC,207,24761406,0x869305781fff479f0311974d55FeeB6Fc9DE96a2
0x2791dc5e14f7680d9d969acc26059ba56403b6d5,0x5008d80cfd0875ad972cbf6ed17eb867d4580e1b49f1d1bb9c0f50dc512022c5,09-01-2025,2025-01-09 02:59:37.000 UTC,332,24801115,0x869305781fff479f0311974d55FeeB6Fc9DE96a2
0x38f6d2d9ea493c3c6ee865b5b952b5fe9e3e61fc,0xde3836575eb13b7f059b7e2946a3c7ef882aa2be9c58af0b57a9cd8212907f16,31-12-2024,2024-12-31 18:06:59.000 UTC,342,24439536,0xCFede447ca3b4885720B5a327e3BFb02078f06e8
0x38f6d2d9ea493c3c6ee865b5b952b5fe9e3e61fc,0xffbeb9093f2c546827973468626d8698308918b5a24044685a18885ed6f911b8,22-01-2025,2025-01-22 04:26:23.000 UTC,189,25365318,0xCFede447ca3b4885720B5a327e3BFb02078f06e8
0x9eb86e93a809a41ab0e7cc0ba6f62561fda3015c,0x18c1e61ed08d938d83ec5487d48e1ed226c145c1afe32a14eaa81f057e50eb70,01-01-2025,2025-01-01 12:59:07.000 UTC,216,24473500,0xCFede447ca3b4885720B5a327e3BFb02078f06e8
0x2791dc5e14f7680d9d969acc26059ba56403b6d5,0xee93bf66fa2f6e147c187b9dee0fa10de18d846135bca21299ad6f465fc9af69,10-01-2025,2025-01-10 19:45:31.000 UTC,336,24874492,0xBDA319Bc7Cc8F0829df39eC0FFF5D1E061FFadf7
0x8508fd4238162cb3f3d485f432202af3b40f164e,0x86f0c4f7501be28b0a65adc26b9caa10227aecc981ebab9e38c4023b7f36c77f,24-05-2025,2025-05-24 12:32:07.000 UTC,814,30650290,0xc3f97660D0b47F0E05C3c513f73eeff7c1bd6c7a
0x9eb86e93a809a41ab0e7cc0ba6f62561fda3015c,0xa0e8eb9ad54ac62f55d8a7c74cd5d8cbbe10c3eae6ce0b51b2c2f63cfa5dc00f,04-01-2025,2025-01-04 12:45:59.000 UTC,420,24602706,0xBDA319Bc7Cc8F0829df39eC0FFF5D1E061FFadf7
0x38f6d2d9ea493c3c6ee865b5b952b5fe9e3e61fc,0xcff8e795debafa1e521bade8c15c5dcd974fc22f1c1573a2bf3fbd7167c0d434,04-01-2025,2025-01-04 11:41:55.000 UTC,374,24600784,0xBDA319Bc7Cc8F0829df39eC0FFF5D1E061FFadf7
0xdc98dbffcc648d6088a2ff8f7dc01aef050e58fc,0xdd6fc9f5001969af362c85156a7f2fd57ec0436386a6d10de301cc2e381a06d7,09-06-2025,2025-06-09 16:16:07.000 UTC,663,31348210,0xc3f97660D0b47F0E05C3c513f73eeff7c1bd6c7a
0x8fd1b615c006ebeb8a7cfb00a1dd809f31943b08,0xc9bdf933fef18686f0a630ccd20c5205c3e658f08a242c545a9092a00f58a696,08-02-2025,2025-02-08 05:41:03.000 UTC,289,26101958,0xF33a96b5932D9E9B9A0eDA447AbD8C9d48d2e0c8
0x095d0de0ecfd6832f1a7961ae26d285d68655d60,0x3c71c606a966e68c21f44a09ee49a9be9973bf6ca8de3807fbc3430485cd3f63,13-03-2025,2025-03-13 06:07:47.000 UTC,786,27528360,0x0e956C897bBFCbd2155D3DfdD27c87fa5A0FaD39
0x9eb86e93a809a41ab0e7cc0ba6f62561fda3015c,0xdbb764eae426b98f270084ffb69ab533649010b09f301b1a2e6207bc220c1732,16-02-2025,2025-02-16 12:53:31.000 UTC,292,26460532,0x6399ed6725cC163D019aA64FF55b22149D7179A8
0x9eb86e93a809a41ab0e7cc0ba6f62561fda3015c,0xdda7353d6adc05ca0a1cf9dcd1f6675e69e7b0cc1b40c247f814fda770373544,04-07-2025,2025-07-04 15:00:47.000 UTC,252,32425950,0xc3f97660D0b47F0E05C3c513f73eeff7c1bd6c7a
0x9eb86e93a809a41ab0e7cc0ba6f62561fda3015c,0x02c07f4c2686c342b9a0e7d2df51ef5d627b357d4ffdd609e73cbfb5c5fdaeb7,17-12-2024,2024-12-17 05:07:07.000 UTC,1484,23811340,0xCFede447ca3b4885720B5a327e3BFb02078f06e8
0x2791dc5e14f7680d9d969acc26059ba56403b6d5,0x64e7371d412ed8d03a12fd13d92f2c1ced191aec08203ad46c53dc1bcbf99c78,04-01-2025,2025-01-04 14:30:09.000 UTC,393,24605831,0xB9E4E0368A9F281584C9adB685e6C9F4b9F37dBb
0xdc98dbffcc648d6088a2ff8f7dc01aef050e58fc,0x8711978ba3b56b4e2a7e5be12cc0ecc650523d4d046baacaf8a46437ac042091,28-12-2024,2024-12-28 09:53:57.000 UTC,172,24295145,0xBDA319Bc7Cc8F0829df39eC0FFF5D1E061FFadf7
0xdc98dbffcc648d6088a2ff8f7dc01aef050e58fc,0x0cc57d01b2ebb9aed2ca6b4571bd5961ca27ac3656d9549ef4bda8ae09119f2b,06-01-2025,2025-01-06 10:04:45.000 UTC,292,24684269,0xBDA319Bc7Cc8F0829df39eC0FFF5D1E061FFadf7
0x38f6d2d9ea493c3c6ee865b5b952b5fe9e3e61fc,0x6bb691a77357f53bc6ec4e14cc329eee3ac1895c03f8b28ee27371ef14d7211c,03-01-2025,2025-01-03 16:25:53.000 UTC,347,24566103,0xBDA319Bc7Cc8F0829df39eC0FFF5D1E061FFadf7
0x9eb86e93a809a41ab0e7cc0ba6f62561fda3015c,0x93db1d7827ff79bc38f53292cbf11b04f88591386b5aa123aa4a106bf0cc82c0,17-12-2024,2024-12-17 21:08:53.000 UTC,312,23840193,0xBDA319Bc7Cc8F0829df39eC0FFF5D1E061FFadf7
0x38f6d2d9ea493c3c6ee865b5b952b5fe9e3e61fc,0xccfbf3b325e32e39761ab3856f01651dee299ba7d847e7f57f1a8f71369a03af,01-01-2025,2025-01-01 22:38:35.000 UTC,222,24490884,0x0e956C897bBFCbd2155D3DfdD27c87fa5A0FaD39
0x095d0de0ecfd6832f1a7961ae26d285d68655d60,0xbc4df478ccbb9231c9fff791ec2a942ddc4dcb3b33995326af8ffe4900e7a678,14-04-2025,2025-04-14 02:52:25.000 UTC,356,28904899,0x869305781fff479f0311974d55FeeB6Fc9DE96a2
0x8508fd4238162cb3f3d485f432202af3b40f164e,0x06af637fce48d071b2218e81aafa480a3ca187149a5a1e4527c4cb7a94579e33,20-05-2025,2025-05-20 21:18:35.000 UTC,591,30493284,0x6205DfbE68444cFF504A20a712cEa794c6b6Cf04
0x2791dc5e14f7680d9d969acc26059ba56403b6d5,0xeb2406d41d7b3e62686eb1ebff9d3bff012b414817259696077810d0db874d8c,21-12-2024,2024-12-21 09:07:19.000 UTC,659,23991346,0xBDA319Bc7Cc8F0829df39eC0FFF5D1E061FFadf7
0x9eb86e93a809a41ab0e7cc0ba6f62561fda3015c,0x48449be65bee47d77ce952b0a559005ba90796b8e39bb7b45157f812ee8c61a8,02-01-2025,2025-01-02 08:30:01.000 UTC,293,24508627,0xBDA319Bc7Cc8F0829df39eC0FFF5D1E061FFadf7
0x9eb86e93a809a41ab0e7cc0ba6f62561fda3015c,0xab10cef2910b9ce16a4d895968bdb583eae58e5f9bd381ad80a60e9ba4993f27,05-01-2025,2025-01-05 02:29:31.000 UTC,331,24627412,0xC23924a846eca931Ec3014253E94f15b038bd0C8
0x38f6d2d9ea493c3c6ee865b5b952b5fe9e3e61fc,0xa406a99c72a0caaf69cc73be1b86a82a78188ef3e857910c8d72ae2925e72951,04-01-2025,2025-01-04 00:30:01.000 UTC,372,24580627,0x0e956C897bBFCbd2155D3DfdD27c87fa5A0FaD39
0x8508fd4238162cb3f3d485f432202af3b40f164e,0xedfa62675064c31703ee9e6beee6bd4ecb50f626491fd87cf92ec49cd00cc0a8,23-05-2025,2025-05-23 00:39:29.000 UTC,1135,30585711,0xc3f97660D0b47F0E05C3c513f73eeff7c1bd6c7a
0x2791dc5e14f7680d9d969acc26059ba56403b6d5,0xea95cd577742c4f70e19b9e9f5e824877d2e7675c0c6fbeb4858e1cb1474a5d9,13-01-2025,2025-01-13 10:55:33.000 UTC,357,24988193,0xB9E4E0368A9F281584C9adB685e6C9F4b9F37dBb
0x38f6d2d9ea493c3c6ee865b5b952b5fe9e3e61fc,0xee97fcda438aa77e695c28f42e2ca001a0d33f99b7b49e3bfd307e235d44c6c5,26-12-2024,2024-12-26 16:36:09.000 UTC,290,24220811,0xCFede447ca3b4885720B5a327e3BFb02078f06e8
0x8508fd4238162cb3f3d485f432202af3b40f164e,0x79275c59fabb77b0f8c48502404e5ba0ee77894e67366350dfb279c7387ee8df,21-04-2025,2025-04-21 07:39:51.000 UTC,215,29215922,0x2B74B62c564456C48055bd515A62594742b3f545
0xdc98dbffcc648d6088a2ff8f7dc01aef050e58fc,0x3d499a2d70ff4f2502b38d3e83c4ddbba7b1be9f86c795ee2d72be17180f2628,22-05-2025,2025-05-22 11:38:19.000 UTC,224,30562276,0x430C09546ae9249AB75B9A4ef7B5FD9a4006D6f3
0xdc98dbffcc648d6088a2ff8f7dc01aef050e58fc,0xfdfd4d411e9d14bad5ba695f0ebbe5130b207593d0dad97fb85dcf0b5b501796,10-01-2025,2025-01-10 14:06:21.000 UTC,340,24864317,0x0e956C897bBFCbd2155D3DfdD27c87fa5A0FaD39
0x2791dc5e14f7680d9d969acc26059ba56403b6d5,0xf877a9492a8739b245aaf2d277caa3053a22631716802db7532b5cc0389ab572,31-12-2024,2024-12-31 03:14:15.000 UTC,334,24412754,0xBDA319Bc7Cc8F0829df39eC0FFF5D1E061FFadf7
0x9eb86e93a809a41ab0e7cc0ba6f62561fda3015c,0x4a617d4145cbd08174a2fbe7d793e20d269feadb9a7046b047fb84e7e5e8ff46,05-01-2025,2025-01-05 03:20:29.000 UTC,203,24628941,0xBDA319Bc7Cc8F0829df39eC0FFF5D1E061FFadf7
0x2791dc5e14f7680d9d969acc26059ba56403b6d5,0x10f8c8ac1927a8a272555bb95c66a13a3d256f15b855a4f7aa7fbcd3fff49881,03-01-2025,2025-01-03 00:40:01.000 UTC,333,24537727,0xBDA319Bc7Cc8F0829df39eC0FFF5D1E061FFadf7
0xdc98dbffcc648d6088a2ff8f7dc01aef050e58fc,0x4d22c0fe3c3b7e6dc228ae4f153e243d29bd5cefb0d549fffb1d9a9e207f3742,22-05-2025,2025-05-22 16:51:33.000 UTC,570,30571673,0x430C09546ae9249AB75B9A4ef7B5FD9a4006D6f3
0x38f6d2d9ea493c3c6ee865b5b952b5fe9e3e61fc,0xd761eac9c26c5a0c676b17f7615cc2e2b5293a59c1587337fe4920f342a54e1c,22-01-2025,2025-01-22 04:31:37.000 UTC,114,25365475,0x0e956C897bBFCbd2155D3DfdD27c87fa5A0FaD39
0x8fd1b615c006ebeb8a7cfb00a1dd809f31943b08,0x72f3ac5acab8c4d0c1842f0789746695122e52450a5536b30d1bb564e172fe61,08-01-2025,2025-01-08 20:14:21.000 UTC,251,24788957,0xB9E4E0368A9F281584C9adB685e6C9F4b9F37dBb
0x9eb86e93a809a41ab0e7cc0ba6f62561fda3015c,0x6aa7022b3c1313a2d068731dde25ebe7c96448ac9ea6e2d8b10ee77b7728d3df,30-12-2024,2024-12-30 11:25:03.000 UTC,472,24384278,0xCFede447ca3b4885720B5a327e3BFb02078f06e8
0x8fd1b615c006ebeb8a7cfb00a1dd809f31943b08,0x46fa7acf934e26424c117721f998813aa022714922c3bf7545864c6c2855dd3d,01-01-2025,2025-01-01 08:22:37.000 UTC,88,24465205,0x0e956C897bBFCbd2155D3DfdD27c87fa5A0FaD39
0x8508fd4238162cb3f3d485f432202af3b40f164e,0x6f586571a6fcc66de70ebfcc6f67eb566952aa21f3f6a90abfa32414079dc56c,28-03-2025,2025-03-28 06:29:37.000 UTC,309,28177015,0x869305781fff479f0311974d55FeeB6Fc9DE96a2
0x38f6d2d9ea493c3c6ee865b5b952b5fe9e3e61fc,0x8220dc2b43590edab5cc4e3bcdcaea83bbb2cd978ed387e8b706a9ad3964a5d8,07-01-2025,2025-01-07 17:47:03.000 UTC,379,24741338,0x869305781fff479f0311974d55FeeB6Fc9DE96a2
0x9eb86e93a809a41ab0e7cc0ba6f62561fda3015c,0xc37942da9ecfbee67f33f41d1970d1e253b1d841695ee08d8498c6b2e39a6a6d,11-07-2025,2025-07-11 11:10:21.000 UTC,493,32721437,0xc3f97660D0b47F0E05C3c513f73eeff7c1bd6c7a
0x8fd1b615c006ebeb8a7cfb00a1dd809f31943b08,0x929978028c859e5e03ccd25c41e323581e27b6f646408ce934ddd6e44bdb974a,01-01-2025,2025-01-01 10:36:23.000 UTC,178,24469218,0xAfabcBbab5e4261B1d655c906738176191819164
0x9eb86e93a809a41ab0e7cc0ba6f62561fda3015c,0x12e97df4ead678783032ac46d6d2c7875822588becc8c1f9d8f868893307f3c3,02-02-2025,2025-02-02 16:02:31.000 UTC,449,25861402,0x0e956C897bBFCbd2155D3DfdD27c87fa5A0FaD39
0x2791dc5e14f7680d9d969acc26059ba56403b6d5,0x89b878899c4626c8b65ac86295168d114d04bb263f4c9ac481e4e1f9748ad144,04-01-2025,2025-01-04 21:30:07.000 UTC,557,24618430,0xBDA319Bc7Cc8F0829df39eC0FFF5D1E061FFadf7
0x8fd1b615c006ebeb8a7cfb00a1dd809f31943b08,0xc6d8f8398ea8e19452359ed433c78c685ccf22c0aadf5f9ee0894983ff3b1726,01-01-2025,2025-01-01 11:41:49.000 UTC,265,24471181,0xAfabcBbab5e4261B1d655c906738176191819164
0x8fd1b615c006ebeb8a7cfb00a1dd809f31943b08,0x0f5ad6da3cfac6ad097d1da1729394fe041a5b14f8712226e02dea6e2cebd2a7,04-01-2025,2025-01-04 22:34:35.000 UTC,298,24620364,0xBDA319Bc7Cc8F0829df39eC0FFF5D1E061FFadf7
0x8508fd4238162cb3f3d485f432202af3b40f164e,0x0f96d0f08d221f984a78413033efcf6b2633f324436680edad71a96bbcda46f3,13-04-2025,2025-04-13 03:58:55.000 UTC,392,28863694,0x2B74B62c564456C48055bd515A62594742b3f545
0x9eb86e93a809a41ab0e7cc0ba6f62561fda3015c,0xdfad336c71713c97b932dfaec5ac26fd7d9da0a7d463ac1596376b24fd2022ef,03-06-2025,2025-06-03 11:32:49.000 UTC,2430,31080511,0xc3f97660D0b47F0E05C3c513f73eeff7c1bd6c7a
0xdc98dbffcc648d6088a2ff8f7dc01aef050e58fc,0xdb203e8b761fbd8cc321a93e96c8ee0504db40be8ec4e61dc39e016fdd1e8a4d,11-01-2025,2025-01-11 10:56:53.000 UTC,304,24901833,0xBDA319Bc7Cc8F0829df39eC0FFF5D1E061FFadf7
0x8508fd4238162cb3f3d485f432202af3b40f164e,0x869ab3083f9924d430656f264c05f665df556749a90d61d6ec56360c4625ded9,31-03-2025,2025-03-31 06:15:53.000 UTC,184,28306203,0x2B74B62c564456C48055bd515A62594742b3f545
0x38f6d2d9ea493c3c6ee865b5b952b5fe9e3e61fc,0x0026a9abf45f6d6e5b80e5f229faf2ee60775144770ec04fc62da5d80d3c56a6,26-05-2025,2025-05-26 02:54:55.000 UTC,739,30719374,0xCFede447ca3b4885720B5a327e3BFb02078f06e8
0xdc98dbffcc648d6088a2ff8f7dc01aef050e58fc,0xe7724393ef7397ce9048e83ceb9182e14527a6ab6d243ed6cdde7c53d6621f48,12-01-2025,2025-01-12 06:53:57.000 UTC,233,24937745,0xBDA319Bc7Cc8F0829df39eC0FFF5D1E061FFadf7
0x8508fd4238162cb3f3d485f432202af3b40f164e,0x0f5c3baa46ee20b6cc768ca31a0c48818c4ad57c184c6ef163328c076ed40748,06-04-2025,2025-04-06 20:05:41.000 UTC,486,28590297,0x2B74B62c564456C48055bd515A62594742b3f545
0xdc98dbffcc648d6088a2ff8f7dc01aef050e58fc,0xfb31168e3219fb6594e033bcea11202e7444ff67e3a4e660e1eb2bd6c7f79451,30-05-2025,2025-05-30 11:33:43.000 UTC,578,30907738,0xc3f97660D0b47F0E05C3c513f73eeff7c1bd6c7a
0x8fd1b615c006ebeb8a7cfb00a1dd809f31943b08,0xc616ea38da31a23d7c468b7a6011be7e588c11344c1444fc4bb0f8bc9ad53bbd,03-01-2025,2025-01-03 07:29:45.000 UTC,350,24550019,0xAfabcBbab5e4261B1d655c906738176191819164
0x2791dc5e14f7680d9d969acc26059ba56403b6d5,0x41060d625ffbf4fd57b26d8e17681900195947399e513f71eed32c6860bba057,21-12-2024,2024-12-21 00:38:43.000 UTC,305,23976088,0xBDA319Bc7Cc8F0829df39eC0FFF5D1E061FFadf7
0x38f6d2d9ea493c3c6ee865b5b952b5fe9e3e61fc,0x77d5f89a8ee8b0b1664026724141af2b92785a7b33281cf4b29ea81e54ab3198,22-05-2025,2025-05-22 17:10:37.000 UTC,457,30572245,0xc3f97660D0b47F0E05C3c513f73eeff7c1bd6c7a
0xdc98dbffcc648d6088a2ff8f7dc01aef050e58fc,0x62e4891d1abff9c8ffe59fc19c6eaac7f51ca70a2d13e895ee3552aea95ac83c,09-06-2025,2025-06-09 12:36:49.000 UTC,200,31341631,0xc3f97660D0b47F0E05C3c513f73eeff7c1bd6c7a
0x9eb86e93a809a41ab0e7cc0ba6f62561fda3015c,0x5248113579f4a3babfbebbbb2dbfc11c15271a65cd13fbc10e812497b294442e,05-03-2025,2025-03-05 05:58:53.000 UTC,218,27182493,0x6399ed6725cC163D019aA64FF55b22149D7179A8
0x2791dc5e14f7680d9d969acc26059ba56403b6d5,0x3986c29b572d0c7e99f081ab98905c9029525559e1372c18233d8b1937f79c1d,12-12-2024,2024-12-12 01:25:19.000 UTC,214,23588686,0xBDA319Bc7Cc8F0829df39eC0FFF5D1E061FFadf7
0xdc98dbffcc648d6088a2ff8f7dc01aef050e58fc,0x237ba30e67812c7182b5f876af86a23ab4a9f9329640ba31aefa77475cbe5c7d,07-01-2025,2025-01-07 11:11:27.000 UTC,355,24729470,0xBDA319Bc7Cc8F0829df39eC0FFF5D1E061FFadf7
0x8fd1b615c006ebeb8a7cfb00a1dd809f31943b08,0x287188b75c7e16e1384320290ca5e22835964b2f8cf531ae0234352b36fe2c8e,24-02-2025,2025-02-24 08:52:35.000 UTC,380,26798904,0x869305781fff479f0311974d55FeeB6Fc9DE96a2
0x38f6d2d9ea493c3c6ee865b5b952b5fe9e3e61fc,0x800d991556030952ee01c33d525b69026e64f78331ae3883798dc6779d819a8e,06-01-2025,2025-01-06 18:39:17.000 UTC,283,24699705,0xBDA319Bc7Cc8F0829df39eC0FFF5D1E061FFadf7
0x9eb86e93a809a41ab0e7cc0ba6f62561fda3015c,0x2de1254d1fb19e17fc120eea7a42405e2180a859db3713d4f92f0feb410298da,03-01-2025,2025-01-03 01:41:11.000 UTC,382,24539562,0x869305781fff479f0311974d55FeeB6Fc9DE96a2
0x8fd1b615c006ebeb8a7cfb00a1dd809f31943b08,0x2094403d24710ad47684f9e444d3cbbbc059d1867d0e4ac86d5da3968460dcf8,10-01-2025,2025-01-10 02:39:11.000 UTC,264,24843702,0xBDA319Bc7Cc8F0829df39eC0FFF5D1E061FFadf7
0x8fd1b615c006ebeb8a7cfb00a1dd809f31943b08,0x73a49b4c1a016d16a48d007c812b0100de5f238be83c3a532eab16cd8a8a74c4,06-01-2025,2025-01-06 10:52:33.000 UTC,200,24685703,0xB9E4E0368A9F281584C9adB685e6C9F4b9F37dBb
0x2791dc5e14f7680d9d969acc26059ba56403b6d5,0x0a914764e9b8e1868ae8b0a28af16a184dcad774a7c9a6d68e9fda48c18c2a9c,16-12-2024,2024-12-16 15:28:39.000 UTC,452,23786786,0xBDA319Bc7Cc8F0829df39eC0FFF5D1E061FFadf7
0x2791dc5e14f7680d9d969acc26059ba56403b6d5,0x4e1c640c1fa508a6d46e22431b73452d0c357f605506b2d3f724901bcf42a3b1,12-01-2025,2025-01-12 16:15:51.000 UTC,941,24954602,0xBDA319Bc7Cc8F0829df39eC0FFF5D1E061FFadf7
0x8fd1b615c006ebeb8a7cfb00a1dd809f31943b08,0x601262671c9982a35ed1ce6a38326cde862a2f5eb45d72171fc8f540bec633eb,19-12-2024,2024-12-19 03:46:49.000 UTC,276,23895331,0xBDA319Bc7Cc8F0829df39eC0FFF5D1E061FFadf7
0xdc98dbffcc648d6088a2ff8f7dc01aef050e58fc,0x01e4a8a05286b482ac348b0886833aa63ae54a16204a8f506f7577d869ae84da,09-01-2025,2025-01-09 11:28:57.000 UTC,255,24816395,0xB9E4E0368A9F281584C9adB685e6C9F4b9F37dBb
0x19d36b9ee92a53ec1900447eba958f0030c688be,0x77808d626ec34016031cd2d848159d052b72c2599fb8e24e981eb9e06e1361bb,21-05-2025,2025-05-21 18:18:03.000 UTC,160,30531068,0x0e956C897bBFCbd2155D3DfdD27c87fa5A0FaD39
0x8fd1b615c006ebeb8a7cfb00a1dd809f31943b08,0x3e39c9154de94290e9b90327bbcffc9d8a57115d9bdb7ed6e0a63f7f598f78c5,27-12-2024,2024-12-27 01:47:45.000 UTC,782,24237359,0xCFede447ca3b4885720B5a327e3BFb02078f06e8
0x9eb86e93a809a41ab0e7cc0ba6f62561fda3015c,0x95ffe6757ac44296eaabec2819db65924e7e858e189f2bfb9b9980a3fee8748e,22-12-2024,2024-12-22 22:31:29.000 UTC,287,24058671,0xBDA319Bc7Cc8F0829df39eC0FFF5D1E061FFadf7
0x38f6d2d9ea493c3c6ee865b5b952b5fe9e3e61fc,0xe3b7f64d44a3b4ff15a848308a8ac86774231aa730becb467637c4d69fff4afa,09-01-2025,2025-01-09 16:55:55.000 UTC,384,24826204,0x0e956C897bBFCbd2155D3DfdD27c87fa5A0FaD39
0x9eb86e93a809a41ab0e7cc0ba6f62561fda3015c,0x634c3cfa030d5de10cec7440dcfaaef2bd2392ca61f998da8ddc2ca249032b60,10-07-2025,2025-07-10 07:34:13.000 UTC,150,32671753,0xCFede447ca3b4885720B5a327e3BFb02078f06e8
0x38f6d2d9ea493c3c6ee865b5b952b5fe9e3e61fc,0xdbca42bf62c253791468e3249a64842c94fd20d89a52849c8145ccab7a9460a1,08-01-2025,2025-01-08 18:12:51.000 UTC,280,24785312,0x869305781fff479f0311974d55FeeB6Fc9DE96a2
0x9eb86e93a809a41ab0e7cc0ba6f62561fda3015c,0xc6a51b1314cc0f2c056c7c8306f1d2e83f64006e63508a7dce6d571c24a74f02,10-01-2025,2025-01-10 06:49:11.000 UTC,737,24851202,0xB9E4E0368A9F281584C9adB685e6C9F4b9F37dBb
0x2791dc5e14f7680d9d969acc26059ba56403b6d5,0xc35655b18a0f0f10000266e6be59bcd7e0660d07291f45674c6ae6adb4511b37,03-01-2025,2025-01-03 13:50:27.000 UTC,355,24561440,0x869305781fff479f0311974d55FeeB6Fc9DE96a2
0x8fd1b615c006ebeb8a7cfb00a1dd809f31943b08,0x583e5c83ef07758dbc778573b41bbf980c365f8db6fa02b203369a4ba13a8bb9,29-12-2024,2024-12-29 04:14:07.000 UTC,249,24328150,0xBDA319Bc7Cc8F0829df39eC0FFF5D1E061FFadf7
0x9eb86e93a809a41ab0e7cc0ba6f62561fda3015c,0x26fb48a2850e00621c8c62c6206a1c2aa8c67da632bc215d0b408a7abae007d6,23-02-2025,2025-02-23 23:58:13.000 UTC,264,26782873,0x6399ed6725cC163D019aA64FF55b22149D7179A8
0x9eb86e93a809a41ab0e7cc0ba6f62561fda3015c,0xa3e4b37183f3ba882fe25f7b80a849b08a04f7f79a58aec1970beb25dcd1abc4,10-12-2024,2024-12-10 01:32:37.000 UTC,120,23502505,0x6399ed6725cC163D019aA64FF55b22149D7179A8
0x8fd1b615c006ebeb8a7cfb00a1dd809f31943b08,0xe9745b10c76895b1969fafa97ed2e97336c5a6184839363af12999dc5dc11568,27-01-2025,2025-01-27 05:09:13.000 UTC,256,25582603,0x0e956C897bBFCbd2155D3DfdD27c87fa5A0FaD39
0xdc98dbffcc648d6088a2ff8f7dc01aef050e58fc,0xbdf744646bfb3bef73a4fc991d0a2eb7053ed9fd5b2673f06f882571ac06746c,12-05-2025,2025-05-12 04:35:45.000 UTC,254,30117599,0xf2c38dE50A250C0060fB45eBE4504B67f6F1be3C
0xdc98dbffcc648d6088a2ff8f7dc01aef050e58fc,0x5fff236a3c80a46be37300028f004ffabb9598f390b3ea85d37bdee4b985a9f1,14-01-2025,2025-01-14 16:07:11.000 UTC,440,25040742,0x869305781fff479f0311974d55FeeB6Fc9DE96a2
0x8810de2baa17067ddcfbd9e8f29c55f070a55f0b,0x88e2711ed83cf4b45a7798019960a65bddeac2524ba869cece9e2b4610e3c53a,25-03-2025,2025-03-25 20:53:53.000 UTC,419,28073343,0x0e956C897bBFCbd2155D3DfdD27c87fa5A0FaD39
0x38f6d2d9ea493c3c6ee865b5b952b5fe9e3e61fc,0xb69183d4ba8350d2bda8bacf647eac3375558dc877f48362b14a2835b6baa66f,09-01-2025,2025-01-09 04:27:57.000 UTC,248,24803765,0xBDA319Bc7Cc8F0829df39eC0FFF5D1E061FFadf7
0x9eb86e93a809a41ab0e7cc0ba6f62561fda3015c,0x5d34b79980264753db4a8899af14f31f26dab5043df7ebe4872b47fa4eebba6b,18-02-2025,2025-02-18 14:40:39.000 UTC,508,26550146,0x6399ed6725cC163D019aA64FF55b22149D7179A8
0x9eb86e93a809a41ab0e7cc0ba6f62561fda3015c,0x4ced4d7311b48cb604d2ef8d5a2c43edd9338e70a37812e2513dba1a7f838403,13-12-2024,2024-12-13 00:13:21.000 UTC,488,23629727,0xBDA319Bc7Cc8F0829df39eC0FFF5D1E061FFadf7
0x8810de2baa17067ddcfbd9e8f29c55f070a55f0b,0x3d3382eef441f7b3bd4e40088e393a4cdd0807d5e01b6324ad506965d47b0ac2,26-03-2025,2025-03-26 16:26:35.000 UTC,398,28108524,0x0e956C897bBFCbd2155D3DfdD27c87fa5A0FaD39
0x8fd1b615c006ebeb8a7cfb00a1dd809f31943b08,0xd776d393c1b906e36443c3314ac42686d73df3146afd5cf29e5897d2fccb0ef2,28-12-2024,2024-12-28 09:31:53.000 UTC,374,24294483,0xCFede447ca3b4885720B5a327e3BFb02078f06e8
0x9eb86e93a809a41ab0e7cc0ba6f62561fda3015c,0xf0aa52845e63c65b8c5b4f8321734e7053762fe2610d075c9e703c101e773df7,28-12-2024,2024-12-28 00:49:11.000 UTC,513,24278802,0xCFede447ca3b4885720B5a327e3BFb02078f06e8
0x2791dc5e14f7680d9d969acc26059ba56403b6d5,0x79fbb96d2268d89b478c804077e5183f07e36954f2379e501568bd39fd7b2af0,10-01-2025,2025-01-10 18:19:41.000 UTC,820,24871917,0xBDA319Bc7Cc8F0829df39eC0FFF5D1E061FFadf7
0xdc98dbffcc648d6088a2ff8f7dc01aef050e58fc,0x1ae1afae6d75778330b96ddf2707442c816b6934805ef4692cdc8cdaab534eef,19-12-2024,2024-12-19 01:12:27.000 UTC,497,23890700,0xCFede447ca3b4885720B5a327e3BFb02078f06e8
0x38f6d2d9ea493c3c6ee865b5b952b5fe9e3e61fc,0x08de5872e210563ee2774d98a5e9842d51d11a50d26d98fd9da9d218f7c888af,08-01-2025,2025-01-08 14:21:47.000 UTC,398,24778380,0xBDA319Bc7Cc8F0829df39eC0FFF5D1E061FFadf7
0x9eb86e93a809a41ab0e7cc0ba6f62561fda3015c,0x86b58bbca75c2cbdfe82ea1e8199266c8b27d64ef6deaeaf586bf5a89e8619af,01-01-2025,2025-01-01 09:55:53.000 UTC,183,24468003,0xC23924a846eca931Ec3014253E94f15b038bd0C8
0x8fd1b615c006ebeb8a7cfb00a1dd809f31943b08,0x61ee432eceeb2cb8c3ee0f20c864b0556769e5c813187cb9442456933be8a87a,07-01-2025,2025-01-07 02:22:19.000 UTC,139,24713596,0xBDA319Bc7Cc8F0829df39eC0FFF5D1E061FFadf7
0xdc98dbffcc648d6088a2ff8f7dc01aef050e58fc,0xb23c1d52383b941ace12dd6d88384899b3dd5fcf02f9813a68ec3807d807452a,20-03-2025,2025-03-20 07:39:17.000 UTC,166,27833505,0xf2c38dE50A250C0060fB45eBE4504B67f6F1be3C
0x351f61e4c49cf11f24d9f2e737ca5eff81806355,0xfdbc0ce11cb72d36e9cc0bc0315f86605b8468c9c2a58b3b198b328e5dae10b0,28-08-2025,2025-08-28 15:14:19.000 UTC,1810,34802356,0x0e956C897bBFCbd2155D3DfdD27c87fa5A0FaD39
0x2791dc5e14f7680d9d969acc26059ba56403b6d5,0x222a25818f24149ee20f8df368bd44980811a80cfbeabb9ca60114f1523a4ebd,05-01-2025,2025-01-05 14:13:01.000 UTC,582,24648517,0xBDA319Bc7Cc8F0829df39eC0FFF5D1E061FFadf7
0x38f6d2d9ea493c3c6ee865b5b952b5fe9e3e61fc,0xdf4629e289e9ca0ef37eb48c682dd619fdbb2da03d39816bd87287d5c8694f40,04-01-2025,2025-01-04 21:31:19.000 UTC,496,24618466,0xBDA319Bc7Cc8F0829df39eC0FFF5D1E061FFadf7
0x8fd1b615c006ebeb8a7cfb00a1dd809f31943b08,0x1eb26de9f30a52a7df144bbf523f6ca56c452809485425b1b586b7ae712745e9,27-12-2024,2024-12-27 22:22:49.000 UTC,287,24274411,0xBDA319Bc7Cc8F0829df39eC0FFF5D1E061FFadf7
0x38f6d2d9ea493c3c6ee865b5b952b5fe9e3e61fc,0x42c39de9a0ef8ff4a8361d57d963805014175bb899636e00b2f9c2b1c294dea8,06-01-2025,2025-01-06 04:06:27.000 UTC,504,24673520,0xB9E4E0368A9F281584C9adB685e6C9F4b9F37dBb
0x095d0de0ecfd6832f1a7961ae26d285d68655d60,0x221671454e772a27b72c305007b33e77f1455740ff9155310ebf59b95a11012f,10-06-2025,2025-06-10 13:29:27.000 UTC,676,31386410,0x869305781fff479f0311974d55FeeB6Fc9DE96a2
0x38f6d2d9ea493c3c6ee865b5b952b5fe9e3e61fc,0xcfdc25c7c7d91ce9552d65265c5812862b478de485c192a70a39f9c5ede80dc1,02-06-2025,2025-06-02 06:12:43.000 UTC,159,31027708,0xc3f97660D0b47F0E05C3c513f73eeff7c1bd6c7a
0x9eb86e93a809a41ab0e7cc0ba6f62561fda3015c,0xd41686102d2f21d36f41ebd9ceb947584dd52c0a37d574b70d05d6613ab06754,26-02-2025,2025-02-26 09:41:05.000 UTC,435,26886759,0x6399ed6725cC163D019aA64FF55b22149D7179A8
0x9eb86e93a809a41ab0e7cc0ba6f62561fda3015c,0x0f159530b193c02c44557566e842d1de52726bc4159183fecf22de970e42eb85,31-12-2024,2024-12-31 13:45:13.000 UTC,543,24431683,0xCFede447ca3b4885720B5a327e3BFb02078f06e8
0x2791dc5e14f7680d9d969acc26059ba56403b6d5,0xba0a558612ffd5d3b0502cb534777baa904e01a10fbf338c3c672b578f3ec1e8,09-01-2025,2025-01-09 10:32:47.000 UTC,407,24814710,0xBDA319Bc7Cc8F0829df39eC0FFF5D1E061FFadf7
0x9eb86e93a809a41ab0e7cc0ba6f62561fda3015c,0x7cb0811888eb82a0b30209ad5b52145e80632144c1314d180a6a273a2f48fc7d,27-12-2024,2024-12-27 02:42:27.000 UTC,390,24239000,0xCFede447ca3b4885720B5a327e3BFb02078f06e8
0xdc98dbffcc648d6088a2ff8f7dc01aef050e58fc,0x480631f73cd8879b959d20fa46399454cdad6bd6820a1f234a2507093b7e9bb5,03-01-2025,2025-01-03 07:46:13.000 UTC,389,24550513,0x0e956C897bBFCbd2155D3DfdD27c87fa5A0FaD39
0x9eb86e93a809a41ab0e7cc0ba6f62561fda3015c,0x69f426021e7518d31d9232df9d304a7739fbb9b42f1057a888e35b4160b76499,07-01-2025,2025-01-07 02:38:51.000 UTC,157,24714092,0xCFede447ca3b4885720B5a327e3BFb02078f06e8
0x9eb86e93a809a41ab0e7cc0ba6f62561fda3015c,0x909322c158401e6c29af9428906f331401045094c5a7fffcd9b51b2cfd32d3ef,27-02-2025,2025-02-27 02:41:27.000 UTC,242,26917370,0x6399ed6725cC163D019aA64FF55b22149D7179A8
0x9eb86e93a809a41ab0e7cc0ba6f62561fda3015c,0xfae1648b9fe4be0b66e82edd0bd0472ff02ee5f337052dab8ac15375b0fbafab,05-01-2025,2025-01-05 18:08:55.000 UTC,362,24655594,0xC23924a846eca931Ec3014253E94f15b038bd0C8
0x38f6d2d9ea493c3c6ee865b5b952b5fe9e3e61fc,0x86594bd280b0d7d89fc802f46459926267b06133d4265cd3a327d42fd6d74a5a,21-06-2025,2025-06-21 12:00:55.000 UTC,207,31858954,0xc3f97660D0b47F0E05C3c513f73eeff7c1bd6c7a
0x8fd1b615c006ebeb8a7cfb00a1dd809f31943b08,0x213b0fa2bb5b336d1bfdf6c436199ed16a7000b39149aeb34112a496652085d3,30-01-2025,2025-01-30 01:20:33.000 UTC,355,25705343,0x0e956C897bBFCbd2155D3DfdD27c87fa5A0FaD39
0x8fd1b615c006ebeb8a7cfb00a1dd809f31943b08,0xeadbf9d1d123d2d6e181ab4addd6abdae52142dfaae5b36b67a8dff3c99e9ee5,14-12-2024,2024-12-14 05:13:53.000 UTC,216,23681943,0xCFede447ca3b4885720B5a327e3BFb02078f06e8
0x8fd1b615c006ebeb8a7cfb00a1dd809f31943b08,0x09915d2142b780fa392c84e673fd255d6da1f0d631f8f7b5558792c6adc66142,21-12-2024,2024-12-21 22:56:17.000 UTC,333,24016215,0xBDA319Bc7Cc8F0829df39eC0FFF5D1E061FFadf7
0x2791dc5e14f7680d9d969acc26059ba56403b6d5,0xc43c959112dd35b94f19cc39233756a415c032338c4df4895cda1d95138dc05d,09-01-2025,2025-01-09 21:49:19.000 UTC,472,24835006,0xCFede447ca3b4885720B5a327e3BFb02078f06e8
0x2791dc5e14f7680d9d969acc26059ba56403b6d5,0x5aede86d73107ecb4632b28f9e317566382fef180451ddadd9ff13b962ccb483,12-02-2025,2025-02-12 21:30:35.000 UTC,291,26303244,0xB9E4E0368A9F281584C9adB685e6C9F4b9F37dBb
0x9eb86e93a809a41ab0e7cc0ba6f62561fda3015c,0x7f9336bb90d0b8ee7c16d8e8b3c9ab19077e5c1cbc3441da915dbbde207e8c76,11-12-2024,2024-12-11 22:57:43.000 UTC,228,23584258,0xBDA319Bc7Cc8F0829df39eC0FFF5D1E061FFadf7
0x095d0de0ecfd6832f1a7961ae26d285d68655d60,0x01b99b268b78b6fc9a67fafe91e44491367a84c3bbbcaf4f971fb880676be88d,19-04-2025,2025-04-19 21:35:47.000 UTC,401,29154600,0x869305781fff479f0311974d55FeeB6Fc9DE96a2
0xdc98dbffcc648d6088a2ff8f7dc01aef050e58fc,0xbfe19065c89244ffac763259a3df8d26fd96cc1970571c43bc09e66f120d0464,06-01-2025,2025-01-06 18:52:49.000 UTC,270,24700111,0xB9E4E0368A9F281584C9adB685e6C9F4b9F37dBb
0x9eb86e93a809a41ab0e7cc0ba6f62561fda3015c,0x3f066ec7cde13e8c4b341e87550f882cfe6410a829a8805ddae09f40b7d274cd,27-02-2025,2025-02-27 05:31:35.000 UTC,206,26922474,0x6399ed6725cC163D019aA64FF55b22149D7179A8
0xdc98dbffcc648d6088a2ff8f7dc01aef050e58fc,0x338d107a47d349b52b1b662556ccd0a6e31dffd70e6bcae38d03387095c16ff8,21-12-2024,2024-12-21 15:58:35.000 UTC,458,24003684,0xBDA319Bc7Cc8F0829df39eC0FFF5D1E061FFadf7
0x8508fd4238162cb3f3d485f432202af3b40f164e,0xc0aacf5689f5f6fb9314ddef6b22eb50f1dea72b1e369bdae51545bdb83ce04e,25-06-2025,2025-06-25 16:28:53.000 UTC,624,32039793,0xf2c38dE50A250C0060fB45eBE4504B67f6F1be3C
0x095d0de0ecfd6832f1a7961ae26d285d68655d60,0xf32cf74dd4c197d1491bd3d7dc9d57e57a4e5658476eac7fb7349d7923de0573,01-05-2025,2025-05-01 06:57:21.000 UTC,651,29646647,0x869305781fff479f0311974d55FeeB6Fc9DE96a2
0x9eb86e93a809a41ab0e7cc0ba6f62561fda3015c,0x986dcd94b78a37c949070e61909436f18464e9a9f072e010dba729aba501e3b6,29-12-2024,2024-12-29 15:19:17.000 UTC,240,24348105,0xCFede447ca3b4885720B5a327e3BFb02078f06e8
0x38f6d2d9ea493c3c6ee865b5b952b5fe9e3e61fc,0xfe1ed3aeabdaafc3abddaca6254b8593040e7922d2a5336c52d5bd87e950d885,06-01-2025,2025-01-06 10:20:47.000 UTC,175,24684750,0xBDA319Bc7Cc8F0829df39eC0FFF5D1E061FFadf7
0x8fd1b615c006ebeb8a7cfb00a1dd809f31943b08,0x3976c125bba4f872417f26035f2e96192a15eb03ff608ee5de01599c4941b23d,15-12-2024,2024-12-15 05:38:03.000 UTC,690,23725868,0xBDA319Bc7Cc8F0829df39eC0FFF5D1E061FFadf7
0x9eb86e93a809a41ab0e7cc0ba6f62561fda3015c,0xcbdc4bb66641ff3c8fbe3095d59e7366efcfb03e6d4bbaf9e6eac7e2d31092ef,29-12-2024,2024-12-29 13:36:41.000 UTC,265,24345027,0xBDA319Bc7Cc8F0829df39eC0FFF5D1E061FFadf7
0xdc98dbffcc648d6088a2ff8f7dc01aef050e58fc,0x55d0b5ae7af697afcd1724a9fd1605d98a9adb1c79670a4172a996ffbb91d26c,04-01-2025,2025-01-04 21:30:39.000 UTC,278,24618446,0xBDA319Bc7Cc8F0829df39eC0FFF5D1E061FFadf7
0x38f6d2d9ea493c3c6ee865b5b952b5fe9e3e61fc,0x708f11f8eaaa07ea4c7a40eff9795ac00e85e37338ed326646a7aa586233966c,20-01-2025,2025-01-20 03:37:31.000 UTC,168,25277452,0xB9E4E0368A9F281584C9adB685e6C9F4b9F37dBb
0x38f6d2d9ea493c3c6ee865b5b952b5fe9e3e61fc,0xfbcafe3a40b77402f881d0bcca81669a15077ae56da1cc903750aca0fd559855,08-07-2025,2025-07-08 12:44:41.000 UTC,648,32594667,0xc3f97660D0b47F0E05C3c513f73eeff7c1bd6c7a
0xdc98dbffcc648d6088a2ff8f7dc01aef050e58fc,0xa93a132cf8fe906df27a2a7056aa54e14b0781d193ee0b4cd900e537811e964b,28-12-2024,2024-12-28 17:57:47.000 UTC,363,24309660,0xBDA319Bc7Cc8F0829df39eC0FFF5D1E061FFadf7
0x38f6d2d9ea493c3c6ee865b5b952b5fe9e3e61fc,0xe792e5a62cf5a2c4dc54545c45c363885c587326d9a6231bd09ba35eea680f3c,13-01-2025,2025-01-13 07:12:55.000 UTC,549,24981514,0x0e956C897bBFCbd2155D3DfdD27c87fa5A0FaD39
0x9eb86e93a809a41ab0e7cc0ba6f62561fda3015c,0x2bbb9c725d2625800de0626ade32d6974af4e20f50552f610646c50cf072a6aa,14-12-2024,2024-12-14 23:32:05.000 UTC,288,23714889,0xCFede447ca3b4885720B5a327e3BFb02078f06e8
0x2791dc5e14f7680d9d969acc26059ba56403b6d5,0xa3eb6c8d8a03c5dc337e6a00f150925d1460edd39ca4be5fbc48906e656fc952,06-01-2025,2025-01-06 22:35:13.000 UTC,488,24706783,0xB9E4E0368A9F281584C9adB685e6C9F4b9F37dBb
0x8fd1b615c006ebeb8a7cfb00a1dd809f31943b08,0x0ff2d63b1f86f008457bff7ffd881af0e589bf9f5366f9353de9c6f06f7e819d,22-12-2024,2024-12-22 00:26:15.000 UTC,398,24018914,0x45F8b8eC9c92D09BA8495074436fD97073423041
0x2791dc5e14f7680d9d969acc26059ba56403b6d5,0xe2c9f651c647f4f4e5b2011ad574af2f7363213166afb15f7100666a1bd894e9,08-01-2025,2025-01-08 01:43:53.000 UTC,301,24755643,0xB9E4E0368A9F281584C9adB685e6C9F4b9F37dBb
0x8fd1b615c006ebeb8a7cfb00a1dd809f31943b08,0x8448b623724831a4cf4dbed2d21450ba0cc525c4d23ab3431a62b2fd08b7de21,16-12-2024,2024-12-16 00:00:27.000 UTC,577,23758940,0xBDA319Bc7Cc8F0829df39eC0FFF5D1E061FFadf7
0x8fd1b615c006ebeb8a7cfb00a1dd809f31943b08,0x74042663b0c125d006fb93d32b023fc4e6bc733b4109ac97a7ba8ee5f1030686,11-01-2025,2025-01-11 00:45:03.000 UTC,515,24883478,0xBDA319Bc7Cc8F0829df39eC0FFF5D1E061FFadf7
0x38f6d2d9ea493c3c6ee865b5b952b5fe9e3e61fc,0x3053433017a28d6d416743e547cbdee62fb3bf0997b31d193de0a02223b728a2,24-01-2025,2025-01-24 02:24:55.000 UTC,386,25448074,0xB9E4E0368A9F281584C9adB685e6C9F4b9F37dBb
0x38f6d2d9ea493c3c6ee865b5b952b5fe9e3e61fc,0x33bceab98dcc7f5df702517ac04d0ff62707ffcb6b4a8f59b9ff2ccf14953101,29-05-2025,2025-05-29 01:28:15.000 UTC,585,30846374,0xc3f97660D0b47F0E05C3c513f73eeff7c1bd6c7a
0xdc98dbffcc648d6088a2ff8f7dc01aef050e58fc,0x54ef2f921c251e4c4bab9e55e9197017489ff8b1948b6b0fbcaf5a58e769d4ee,12-01-2025,2025-01-12 21:27:37.000 UTC,419,24963955,0xBDA319Bc7Cc8F0829df39eC0FFF5D1E061FFadf7
0x38f6d2d9ea493c3c6ee865b5b952b5fe9e3e61fc,0x0219bbeae15d2bd8b465a4acd73a6c124c8f46b12382393b186bb8b6a75a011d,05-03-2025,2025-03-05 06:53:09.000 UTC,456,27184121,0xCFede447ca3b4885720B5a327e3BFb02078f06e8
0x8508fd4238162cb3f3d485f432202af3b40f164e,0x723d17363b9e3a48121b8bea7b18cebd640cc225bd131851f00fe95a6635f34e,31-05-2025,2025-05-31 11:38:09.000 UTC,844,30951071,0xc3f97660D0b47F0E05C3c513f73eeff7c1bd6c7a
0x9eb86e93a809a41ab0e7cc0ba6f62561fda3015c,0xa34b0ba3b3e0de069b7dc9e50f604d62442b2ad6374507781c165326883c0434,20-02-2025,2025-02-20 10:08:39.000 UTC,201,26628386,0x6399ed6725cC163D019aA64FF55b22149D7179A8
0x8508fd4238162cb3f3d485f432202af3b40f164e,0x37afa108ad851c5d2fcbf140154792b3d27769bab7c7fdaabce70529fa2be4d0,02-04-2025,2025-04-02 15:07:53.000 UTC,819,28408563,0x2B74B62c564456C48055bd515A62594742b3f545
0x9eb86e93a809a41ab0e7cc0ba6f62561fda3015c,0xdf466087d5ac2432ca70dbb6521c390e635180bcc48454dcc2c37da511beb2e4,11-06-2025,2025-06-11 08:22:19.000 UTC,1190,31420396,0xc3f97660D0b47F0E05C3c513f73eeff7c1bd6c7a
0x9eb86e93a809a41ab0e7cc0ba6f62561fda3015c,0x7549416b2acd2f0e466f81755d14c0dded323f8da651183b6edd2d44c5ae36a3,13-12-2024,2024-12-13 16:09:49.000 UTC,453,23658421,0xCFede447ca3b4885720B5a327e3BFb02078f06e8
0x351f61e4c49cf11f24d9f2e737ca5eff81806355,0xf1e22471bc8beb46bd26e61f7dcfc3a2c2c0d40b2d0c600df3fe7cfdcc878e46,08-10-2025,2025-10-08 19:12:49.000 UTC,1272,36580711,0x0e956C897bBFCbd2155D3DfdD27c87fa5A0FaD39
0x9eb86e93a809a41ab0e7cc0ba6f62561fda3015c,0x9bbd569bb95b1956e404476d66154c4c698cc1111d5b6c0de9abbadc7bd12880,13-12-2024,2024-12-13 07:32:17.000 UTC,353,23642895,0xBDA319Bc7Cc8F0829df39eC0FFF5D1E061FFadf7
0x38f6d2d9ea493c3c6ee865b5b952b5fe9e3e61fc,0x45ae0f9d50e3ac9dd230e89d343a7eb5bd5c7e2c0af46aa5997c87b5c664977c,14-01-2025,2025-01-14 18:05:57.000 UTC,334,25044305,0x869305781fff479f0311974d55FeeB6Fc9DE96a2
0x38f6d2d9ea493c3c6ee865b5b952b5fe9e3e61fc,0x64d37a36f098c4ba68c0188a1c9998f4acdab9071e126a8f9f17550f817f5a5f,06-02-2025,2025-02-06 07:11:17.000 UTC,137,26018265,0xB9E4E0368A9F281584C9adB685e6C9F4b9F37dBb
0x38f6d2d9ea493c3c6ee865b5b952b5fe9e3e61fc,0x14faac4a2fd7e4a5c7203409f3467e6174573e4d38886c1b4a98519e7a502fbb,01-01-2025,2025-01-01 20:16:13.000 UTC,618,24486613,0xCFede447ca3b4885720B5a327e3BFb02078f06e8
0xdc98dbffcc648d6088a2ff8f7dc01aef050e58fc,0xd4101777a2e666251b74b6c2fa153dc661920a716b9d2f08d74ec89b8f42bb81,08-01-2025,2025-01-08 07:17:35.000 UTC,359,24765654,0xBDA319Bc7Cc8F0829df39eC0FFF5D1E061FFadf7
0x9eb86e93a809a41ab0e7cc0ba6f62561fda3015c,0x3f7a235bcacbd2b114fe0b6d594b028d57314d04afc7e169071abca21b3ec8ec,07-01-2025,2025-01-07 01:03:25.000 UTC,277,24711229,0xBDA319Bc7Cc8F0829df39eC0FFF5D1E061FFadf7
0x38f6d2d9ea493c3c6ee865b5b952b5fe9e3e61fc,0x9790651c1b624ad00f4b2ff6f17b4eac9be3a44b9f792601a8f7ab812ab3cc29,03-06-2025,2025-06-03 16:47:29.000 UTC,710,31089951,0xc3f97660D0b47F0E05C3c513f73eeff7c1bd6c7a
0x8fd1b615c006ebeb8a7cfb00a1dd809f31943b08,0x1bd10ce36985d6eb648418a1ec3df54a30c47584455ca7a781b4395c05d94156,24-12-2024,2024-12-24 23:40:17.000 UTC,637,24147135,0xBDA319Bc7Cc8F0829df39eC0FFF5D1E061FFadf7
0x9eb86e93a809a41ab0e7cc0ba6f62561fda3015c,0xd0a924515fa9527498c92604b35e67c3722751378ff24cc99703109abacd345c,21-06-2025,2025-06-21 04:26:11.000 UTC,246,31845312,0xCFede447ca3b4885720B5a327e3BFb02078f06e8
0x8810de2baa17067ddcfbd9e8f29c55f070a55f0b,0x317bb8182158a10ac49e945b926d5022b37c51f85224112332c54c374c80d106,10-05-2025,2025-05-10 04:27:41.000 UTC,393,30030957,0x0e956C897bBFCbd2155D3DfdD27c87fa5A0FaD39
0x38f6d2d9ea493c3c6ee865b5b952b5fe9e3e61fc,0x4698a140189042edab79b19c77bc8dacabb79fc0ec4121ada24263eff79eaaa9,24-02-2025,2025-02-24 23:57:03.000 UTC,245,26826038,0x0e956C897bBFCbd2155D3DfdD27c87fa5A0FaD39
0x2791dc5e14f7680d9d969acc26059ba56403b6d5,0x3a4c7bf017c29aa24c625d678328021cc03d785ae80c13fdfef98d0c07a3771c,07-01-2025,2025-01-07 06:57:17.000 UTC,839,24721845,0xB9E4E0368A9F281584C9adB685e6C9F4b9F37dBb
0x9eb86e93a809a41ab0e7cc0ba6f62561fda3015c,0xc7d243150c1451f2529dbd43a0e2f89931111cfe26e42d6bea1bb5fbbd208cc1,20-05-2025,2025-05-20 14:54:33.000 UTC,2004,30481763,0xc3f97660D0b47F0E05C3c513f73eeff7c1bd6c7a
0x8508fd4238162cb3f3d485f432202af3b40f164e,0x015983974423a2bde3ad01d8ea728006d36b209e56ce89041f90d21d44d2b78a,09-06-2025,2025-06-09 13:02:15.000 UTC,1083,31342394,0xc3f97660D0b47F0E05C3c513f73eeff7c1bd6c7a
0x38f6d2d9ea493c3c6ee865b5b952b5fe9e3e61fc,0x3901c0c89949c748e534c1973672c2d71d5efdf180ed967ffef16d0b48b76096,10-01-2025,2025-01-10 03:42:51.000 UTC,283,24845612,0xBDA319Bc7Cc8F0829df39eC0FFF5D1E061FFadf7
0x2791dc5e14f7680d9d969acc26059ba56403b6d5,0x5f9360253770a1236d0ca203c7e4bfe9d7885844781ac431d6204ee1104e5591,03-01-2025,2025-01-03 16:50:55.000 UTC,533,24566854,0x869305781fff479f0311974d55FeeB6Fc9DE96a2
0x2791dc5e14f7680d9d969acc26059ba56403b6d5,0x701250829d2465aa91f9064bb84e9052d0dc6155f5c24b7dd253d52af18ff72d,10-01-2025,2025-01-10 22:33:31.000 UTC,336,24879532,0xBDA319Bc7Cc8F0829df39eC0FFF5D1E061FFadf7
0xdc98dbffcc648d6088a2ff8f7dc01aef050e58fc,0xbf586543e18ae69860172f75e43347a26aa687266555a51eb5532aecb547d727,03-01-2025,2025-01-03 04:36:45.000 UTC,342,24544829,0xBDA319Bc7Cc8F0829df39eC0FFF5D1E061FFadf7
0x2791dc5e14f7680d9d969acc26059ba56403b6d5,0xe3576cb24e5a08e883c9760c6997e55dd5b1baa18e43e0163d0b74a515d6c4c1,03-01-2025,2025-01-03 22:28:33.000 UTC,489,24576983,0xBDA319Bc7Cc8F0829df39eC0FFF5D1E061FFadf7
0xdc98dbffcc648d6088a2ff8f7dc01aef050e58fc,0x63287966376edb37073cba52f6d69c1fa6538de19f42e4a656436fd0ad0f09f0,14-07-2025,2025-07-14 10:45:57.000 UTC,688,32850305,0x430C09546ae9249AB75B9A4ef7B5FD9a4006D6f3
0x8508fd4238162cb3f3d485f432202af3b40f164e,0x26e277c1a9541df3c54a695ddf6ce4d138e166d0b1664464884880e0e39ae07c,30-05-2025,2025-05-30 16:16:01.000 UTC,629,30916207,0x6205DfbE68444cFF504A20a712cEa794c6b6Cf04
0x38f6d2d9ea493c3c6ee865b5b952b5fe9e3e61fc,0x057574ce420f2b1396f8228c61cccf6a3cbf76352f2cd5ce759bcc718dff6e0e,23-12-2024,2024-12-23 02:17:47.000 UTC,512,24065460,0xCFede447ca3b4885720B5a327e3BFb02078f06e8
0x8508fd4238162cb3f3d485f432202af3b40f164e,0x7a011caf9f9707d72cb453688ec5591da1733d6c01d3467671c6b9af8a1f1a7e,21-05-2025,2025-05-21 16:23:43.000 UTC,621,30527638,0xc3f97660D0b47F0E05C3c513f73eeff7c1bd6c7a
0x9eb86e93a809a41ab0e7cc0ba6f62561fda3015c,0x033f165f1c41be24f0a312aa6c9cd45f362c041c44c3a6a54cb6f712a4da3b27,20-12-2024,2024-12-20 08:25:09.000 UTC,455,23946881,0xCFede447ca3b4885720B5a327e3BFb02078f06e8
0x2791dc5e14f7680d9d969acc26059ba56403b6d5,0x3d1e3f93504206446dd1bdd0511be93b6f8603e8e5cdb689ace3cfbe332f2871,17-01-2025,2025-01-17 21:14:03.000 UTC,511,25179548,0xB9E4E0368A9F281584C9adB685e6C9F4b9F37dBb
0x8508fd4238162cb3f3d485f432202af3b40f164e,0x175632b76d5960c4f29d72c1c4958fa9facba578e012909ccbb2200a72ea53d0,09-04-2025,2025-04-09 05:21:03.000 UTC,78,28693358,0x2B74B62c564456C48055bd515A62594742b3f545
0x351f61e4c49cf11f24d9f2e737ca5eff81806355,0x5c7a21ef108659c760d0ed14736aca2583026609cc8b186a94e9cca13de0d9e9,02-09-2025,2025-09-02 21:32:05.000 UTC,136,35029689,0x0e956C897bBFCbd2155D3DfdD27c87fa5A0FaD39
0x9eb86e93a809a41ab0e7cc0ba6f62561fda3015c,0x239e04999c3f5080f0d2a6d59b7206ceae1636197b5ea73c6bd78cdf6bca7ab0,03-03-2025,2025-03-03 01:08:13.000 UTC,379,27087373,0x6399ed6725cC163D019aA64FF55b22149D7179A8
0x2791dc5e14f7680d9d969acc26059ba56403b6d5,0x9ae04b23826e554b375c92e25e8e1807d73f5d37c6d6deea4b5b8024fff7a746,13-12-2024,2024-12-13 05:04:25.000 UTC,442,23638459,0xBDA319Bc7Cc8F0829df39eC0FFF5D1E061FFadf7
0x9eb86e93a809a41ab0e7cc0ba6f62561fda3015c,0x9dcf0ada331a75bbc213d75c131e66ef44501bdff321c507c53badca710a7b39,13-02-2025,2025-02-13 04:21:31.000 UTC,350,26315572,0xf2c38dE50A250C0060fB45eBE4504B67f6F1be3C
0xdc98dbffcc648d6088a2ff8f7dc01aef050e58fc,0x858c785e1c71d7dab85166a411c311d833f6ae1db36272b48bf0665b4ad31013,16-01-2025,2025-01-16 18:33:49.000 UTC,262,25131541,0x869305781fff479f0311974d55FeeB6Fc9DE96a2
0x9eb86e93a809a41ab0e7cc0ba6f62561fda3015c,0x2022a9bb8882e7d1f01095df53c051338c8ddb9a6a91dd5bbb0f91f92f36a014,13-07-2025,2025-07-13 14:26:05.000 UTC,639,32813709,0xf2c38dE50A250C0060fB45eBE4504B67f6F1be3C
0x8fd1b615c006ebeb8a7cfb00a1dd809f31943b08,0xe11a4bda174461f234b5a25c2bf235270d4b136669b956a7879f8a82d2339eaa,21-12-2024,2024-12-21 05:24:27.000 UTC,316,23984660,0xBDA319Bc7Cc8F0829df39eC0FFF5D1E061FFadf7
0x9eb86e93a809a41ab0e7cc0ba6f62561fda3015c,0xde50aabe395f02db24653a4c53fc30794d36c6cc6fff8752a557f8c7e246f82f,15-12-2024,2024-12-15 08:46:19.000 UTC,178,23731516,0xBDA319Bc7Cc8F0829df39eC0FFF5D1E061FFadf7
0x38f6d2d9ea493c3c6ee865b5b952b5fe9e3e61fc,0x72f22358b683a28eb702f94a98d9d56f27840482fbc376c1554613cd340fd3a6,04-01-2025,2025-01-04 11:08:33.000 UTC,286,24599783,0x0e956C897bBFCbd2155D3DfdD27c87fa5A0FaD39
0x8fd1b615c006ebeb8a7cfb00a1dd809f31943b08,0x5cd56082905dae9d48976d35f67573c5d12a930a085e6cb5a875a754e67f3616,13-12-2024,2024-12-13 02:58:57.000 UTC,315,23634695,0x45F8b8eC9c92D09BA8495074436fD97073423041
0xdc98dbffcc648d6088a2ff8f7dc01aef050e58fc,0x953fe8b858b15824c08d852214bb2225b90198ecd4809ab27be2eae9d48d7f67,07-01-2025,2025-01-07 02:54:05.000 UTC,606,24714549,0xBDA319Bc7Cc8F0829df39eC0FFF5D1E061FFadf7
0x38f6d2d9ea493c3c6ee865b5b952b5fe9e3e61fc,0xeba32edec0aa8f000c56e39ff298d81ba73a8893cb7268a524e53f63493fbe4e,09-01-2025,2025-01-09 16:26:23.000 UTC,708,24825318,0x869305781fff479f0311974d55FeeB6Fc9DE96a2
0x8fd1b615c006ebeb8a7cfb00a1dd809f31943b08,0x593bbdcde75a8ca955367c6c3ca3d879f5ed63d8a80ef56922246f69ae1c6f25,24-12-2024,2024-12-24 00:01:43.000 UTC,435,24104578,0xBDA319Bc7Cc8F0829df39eC0FFF5D1E061FFadf7
0x8508fd4238162cb3f3d485f432202af3b40f164e,0xd776242e6d5af61756dff4496da0d940040669e3aec61da5151cd44b2c79b190,22-05-2025,2025-05-22 13:38:57.000 UTC,1554,30565895,0xc3f97660D0b47F0E05C3c513f73eeff7c1bd6c7a
0x351f61e4c49cf11f24d9f2e737ca5eff81806355,0x7fe1aa102ca13febc712c50263fd70c5ed373a80141b096249a8d9f2f4cd2f65,10-12-2025,2025-12-10 20:41:53.000 UTC,135,39304983,0x0e956C897bBFCbd2155D3DfdD27c87fa5A0FaD39
0x8fd1b615c006ebeb8a7cfb00a1dd809f31943b08,0x225ec58a6e280a01382847d0b3a3a3d20b1205b716cbaad2d3a5dc9dc0e90f3a,11-05-2025,2025-05-11 00:19:51.000 UTC,122,30066722,0x0e956C897bBFCbd2155D3DfdD27c87fa5A0FaD39
0x351f61e4c49cf11f24d9f2e737ca5eff81806355,0x18e1705bb449bfd355d0aadf1b21fda56c246fb1b701b30d4ed186f4b352a965,14-08-2025,2025-08-14 03:16:45.000 UTC,615,34176029,0x0e956C897bBFCbd2155D3DfdD27c87fa5A0FaD39
0x38f6d2d9ea493c3c6ee865b5b952b5fe9e3e61fc,0x001a48f976dff7481f03bcaf156080defdb53a51e4162adbc262a1781a2656d9,01-03-2025,2025-03-01 19:34:27.000 UTC,252,27034160,0xB9E4E0368A9F281584C9adB685e6C9F4b9F37dBb
0x8fd1b615c006ebeb8a7cfb00a1dd809f31943b08,0xcfa4e8ee0e2efbf124f81ce2b77694e839052399a8be7e072eebcb731e320bcb,09-01-2025,2025-01-09 13:22:29.000 UTC,902,24819801,0xB9E4E0368A9F281584C9adB685e6C9F4b9F37dBb
0x351f61e4c49cf11f24d9f2e737ca5eff81806355,0x15a4bea085147458a58488dec62014a638541933df24cfa8e4b5a2f4851ef1f4,04-09-2025,2025-09-04 04:54:43.000 UTC,67,35086168,0x0e956C897bBFCbd2155D3DfdD27c87fa5A0FaD39
0x8fd1b615c006ebeb8a7cfb00a1dd809f31943b08,0xb89c662b37545a6436fc27f8dbf8521a996975dd36b002b569821f404d348c11,16-07-2025,2025-07-16 11:45:07.000 UTC,476,32938480,0xf2c38dE50A250C0060fB45eBE4504B67f6F1be3C
0x9eb86e93a809a41ab0e7cc0ba6f62561fda3015c,0x9ab5bd4780f9df41ad20edcf7b91c5e4082c86b7460a6414f7b03e0edc893bd7,08-02-2025,2025-02-08 05:34:09.000 UTC,272,26101751,0xB9E4E0368A9F281584C9adB685e6C9F4b9F37dBb
0x9eb86e93a809a41ab0e7cc0ba6f62561fda3015c,0x08ceb22a63b8899b7a265649d201e5b4f0003f8a772778ff1050ba8163e60400,25-02-2025,2025-02-25 12:11:49.000 UTC,255,26848081,0x6399ed6725cC163D019aA64FF55b22149D7179A8
0xdc98dbffcc648d6088a2ff8f7dc01aef050e58fc,0x5bc839182bfafc9f212cb961b1e23a81cc03536cbddab6e289ff54dde1cb3aa3,10-01-2025,2025-01-10 10:37:41.000 UTC,419,24858057,0xBDA319Bc7Cc8F0829df39eC0FFF5D1E061FFadf7
0x2791dc5e14f7680d9d969acc26059ba56403b6d5,0x71537c9e21e1940620c0e17d93ba611b469fda8e289c1c1edf25703390db1216,24-12-2024,2024-12-24 22:11:11.000 UTC,220,24144462,0xBDA319Bc7Cc8F0829df39eC0FFF5D1E061FFadf7
0x2791dc5e14f7680d9d969acc26059ba56403b6d5,0xad47092f73db27eaef163607200c3b9fb6af4633de66cfd837b283667e31a8df,18-01-2025,2025-01-18 21:26:19.000 UTC,383,25223116,0x869305781fff479f0311974d55FeeB6Fc9DE96a2
0xdc98dbffcc648d6088a2ff8f7dc01aef050e58fc,0x013198092e4fe339816e37069fb1ab90b1b4253e77daf2b7c68eaf1bcceea6cc,11-01-2025,2025-01-11 06:45:53.000 UTC,300,24894303,0xBDA319Bc7Cc8F0829df39eC0FFF5D1E061FFadf7
0x9eb86e93a809a41ab0e7cc0ba6f62561fda3015c,0xabc036e5202f150185e29bd25eead542119a8d570fd4ca13b1c535ea80855715,05-03-2025,2025-03-05 06:06:17.000 UTC,250,27182715,0x6399ed6725cC163D019aA64FF55b22149D7179A8
0xdc98dbffcc648d6088a2ff8f7dc01aef050e58fc,0x3ce85435197814b2b7f7d87b9776d45e008ad7fb196fcbc16a754c2707e01ad6,29-05-2025,2025-05-29 01:50:37.000 UTC,445,30847045,0xc3f97660D0b47F0E05C3c513f73eeff7c1bd6c7a
0x8508fd4238162cb3f3d485f432202af3b40f164e,0x3b5059b2b81bd368814a0bc274f1b6494c45cc2779617c70f5f21ea01a548c3b,06-06-2025,2025-06-06 08:46:37.000 UTC,712,31205125,0xc3f97660D0b47F0E05C3c513f73eeff7c1bd6c7a
0x38f6d2d9ea493c3c6ee865b5b952b5fe9e3e61fc,0x253e5bbcbff0e08ea645e7f8dd26ecb7f0856264ef2aa170dfbbe826140b3e00,06-06-2025,2025-06-06 08:20:53.000 UTC,1296,31204353,0xc3f97660D0b47F0E05C3c513f73eeff7c1bd6c7a
0x9eb86e93a809a41ab0e7cc0ba6f62561fda3015c,0x0c21dae60f2cb277fa0050d63e1c669d53fd05fe9c37d25ae9f81525b8e5aac7,08-01-2025,2025-01-08 01:27:41.000 UTC,258,24755157,0xC23924a846eca931Ec3014253E94f15b038bd0C8
0x2791dc5e14f7680d9d969acc26059ba56403b6d5,0x31f27c32fd54d771171c37d760c0cef227f633960de9ba64d7a21663747de277,01-01-2025,2025-01-01 23:05:57.000 UTC,539,24491705,0xBDA319Bc7Cc8F0829df39eC0FFF5D1E061FFadf7
0x8508fd4238162cb3f3d485f432202af3b40f164e,0x94ed8912670fedcddce5962dcac282ae5ac9125c7b79139bcc538c118b245cbc,15-05-2025,2025-05-15 23:11:27.000 UTC,36,30280670,0x6205DfbE68444cFF504A20a712cEa794c6b6Cf04
0x9eb86e93a809a41ab0e7cc0ba6f62561fda3015c,0x33d1cba4ce5a0db9b6a6051c817f7217eb8329820ba92d3e5d9b0fb5a9af77a5,08-12-2024,2024-12-08 22:10:07.000 UTC,218,23453230,0xF33a96b5932D9E9B9A0eDA447AbD8C9d48d2e0c8
0x9eb86e93a809a41ab0e7cc0ba6f62561fda3015c,0xb5c14c209efe65249e26b8e04479b4f1b353456a00b3bba9fb522a90f3589e3f,07-01-2025,2025-01-07 16:51:47.000 UTC,324,24739680,0xBDA319Bc7Cc8F0829df39eC0FFF5D1E061FFadf7
0xdc98dbffcc648d6088a2ff8f7dc01aef050e58fc,0xb99a97b0ac8d928c63535cf594e2be3c21125ed9e57f883363bee7b81f636f84,14-01-2025,2025-01-14 03:59:21.000 UTC,262,25018907,0xBDA319Bc7Cc8F0829df39eC0FFF5D1E061FFadf7
0x8fd1b615c006ebeb8a7cfb00a1dd809f31943b08,0xa2892cefec1b22afbfcb46405d173f3e98ec07f40702021beeaae0426893793a,03-01-2025,2025-01-03 16:09:39.000 UTC,448,24565616,0xBDA319Bc7Cc8F0829df39eC0FFF5D1E061FFadf7
0x8fd1b615c006ebeb8a7cfb00a1dd809f31943b08,0xac1fad9da9db69878ea74ebfc8fafcb67e7eddf9cb56f94eaa8086d8e181e29e,20-12-2024,2024-12-20 10:09:13.000 UTC,294,23950003,0x45F8b8eC9c92D09BA8495074436fD97073423041
0x9eb86e93a809a41ab0e7cc0ba6f62561fda3015c,0xa03d546c6d1e3620ae40d89e7be9e362127a0963488d9819f44612d963f679b5,26-12-2024,2024-12-26 04:34:43.000 UTC,601,24199168,0xCFede447ca3b4885720B5a327e3BFb02078f06e8
0x38f6d2d9ea493c3c6ee865b5b952b5fe9e3e61fc,0xe34984a8678882bf8ee35de3343538e5cd1aaa9468843f3fe9661feb20a11845,09-06-2025,2025-06-09 15:05:31.000 UTC,581,31346092,0xCFede447ca3b4885720B5a327e3BFb02078f06e8
0x9eb86e93a809a41ab0e7cc0ba6f62561fda3015c,0xe352847b063c6ab8a1f66524815991af59de506d8a829a99bf8060bce649b9ee,08-01-2025,2025-01-08 04:57:49.000 UTC,284,24761461,0x869305781fff479f0311974d55FeeB6Fc9DE96a2
0xdc98dbffcc648d6088a2ff8f7dc01aef050e58fc,0xddc4aecc1c672fcfc696d96986f28c86a21adec4a5a0d9178e460f64bccc131c,14-01-2025,2025-01-14 21:11:05.000 UTC,195,25049859,0x869305781fff479f0311974d55FeeB6Fc9DE96a2
0x2791dc5e14f7680d9d969acc26059ba56403b6d5,0x05e55a3b3deb334cbdabb63692c7ddc6e88f2b32830b30fdfbbecf75aac6812a,09-03-2025,2025-03-09 08:28:07.000 UTC,261,27359770,0xf2c38dE50A250C0060fB45eBE4504B67f6F1be3C
0x2791dc5e14f7680d9d969acc26059ba56403b6d5,0x42228b2e589b3fd34943200308addd7dc46698c9e6a3d4713ba5d01aa5b3d7e0,27-12-2024,2024-12-27 13:20:59.000 UTC,451,24258156,0xBDA319Bc7Cc8F0829df39eC0FFF5D1E061FFadf7
0x38f6d2d9ea493c3c6ee865b5b952b5fe9e3e61fc,0x7ff37a381d8cad7115f2ad242958acee36ad85142232cec05fc11e45fc468d26,08-01-2025,2025-01-08 06:11:45.000 UTC,266,24763679,0xBDA319Bc7Cc8F0829df39eC0FFF5D1E061FFadf7
0x8fd1b615c006ebeb8a7cfb00a1dd809f31943b08,0x3afb50ea269400d5f3e2e12198b1752491e3a7d65ffb5127be1c5184076619d9,06-01-2025,2025-01-06 18:57:35.000 UTC,327,24700254,0xAfabcBbab5e4261B1d655c906738176191819164
0xdc98dbffcc648d6088a2ff8f7dc01aef050e58fc,0xec8dbbcc7ed83b5639fc891a48f27ad7b4000d8061c601322de3a880d14cb8ba,27-12-2024,2024-12-27 19:02:15.000 UTC,267,24268394,0xBDA319Bc7Cc8F0829df39eC0FFF5D1E061FFadf7
0x9eb86e93a809a41ab0e7cc0ba6f62561fda3015c,0xb051b20cde69c4a12fe2bd101bf8d95ee672ecf7d4b442e8f3554fbb588fb9bb,04-01-2025,2025-01-04 14:08:15.000 UTC,347,24605174,0xC23924a846eca931Ec3014253E94f15b038bd0C8
0x8810de2baa17067ddcfbd9e8f29c55f070a55f0b,0x1b314a0e25d34f502c9f97930f7eb1dd1c08df72dd9d40cd1f58b3d8af72a5dc,13-03-2025,2025-03-13 06:04:47.000 UTC,367,27528270,0x0e956C897bBFCbd2155D3DfdD27c87fa5A0FaD39
0x2791dc5e14f7680d9d969acc26059ba56403b6d5,0x0d899aec1c4f61f1188e03fd9aa72a6e4bc2aae1f3d1a0bf9cacac425ffb4d7c,16-01-2025,2025-01-16 06:45:03.000 UTC,788,25110278,0xB9E4E0368A9F281584C9adB685e6C9F4b9F37dBb
0x9eb86e93a809a41ab0e7cc0ba6f62561fda3015c,0xbce04848496c478035576a104f2456374c49e4b90e5dbe4cf5010d926f9c07b3,25-02-2025,2025-02-25 19:00:23.000 UTC,180,26860338,0x6399ed6725cC163D019aA64FF55b22149D7179A8
0x9eb86e93a809a41ab0e7cc0ba6f62561fda3015c,0xa2c2a8dc4b829499600366074c0833e24b099476c27d640af077cd13bf470199,01-03-2025,2025-03-01 06:41:51.000 UTC,182,27010982,0x6399ed6725cC163D019aA64FF55b22149D7179A8
0x9eb86e93a809a41ab0e7cc0ba6f62561fda3015c,0x05367a0d872758cf5982c13b65cd82da8ab93e850240f096bddc683a0373dca1,01-03-2025,2025-03-01 13:51:49.000 UTC,312,27023881,0x6399ed6725cC163D019aA64FF55b22149D7179A8
0x2791dc5e14f7680d9d969acc26059ba56403b6d5,0x1512c3f6b20eab56b40126b597164b0dd4922684fb7e802ff5e89bc86bdcfd88,14-12-2024,2024-12-14 01:32:51.000 UTC,413,23675312,0xBDA319Bc7Cc8F0829df39eC0FFF5D1E061FFadf7
0x9eb86e93a809a41ab0e7cc0ba6f62561fda3015c,0xc8194e45307a2567cd47d90f2eaaed68b4645d2ffac17125f217da2101b66561,04-01-2025,2025-01-04 14:59:33.000 UTC,502,24606713,0xC23924a846eca931Ec3014253E94f15b038bd0C8
0x9eb86e93a809a41ab0e7cc0ba6f62561fda3015c,0xd9366d4775d4a9e43aa09394274a48aee66d2493afb6096884cc0ff802c97383,01-01-2025,2025-01-01 08:19:51.000 UTC,605,24465122,0xCFede447ca3b4885720B5a327e3BFb02078f06e8
0x9eb86e93a809a41ab0e7cc0ba6f62561fda3015c,0x1ff1ae069034537f4f441d1f840b474f97092f8157831e56ae1ab63782fbd26b,25-02-2025,2025-02-25 14:02:03.000 UTC,420,26851388,0x6399ed6725cC163D019aA64FF55b22149D7179A8
0x2791dc5e14f7680d9d969acc26059ba56403b6d5,0x6ce3ea4389b6c52b0104e4f3c50f8d680d262eaf3c17fe8b4b5841db538b19d3,15-12-2024,2024-12-15 19:15:01.000 UTC,202,23750377,0xBDA319Bc7Cc8F0829df39eC0FFF5D1E061FFadf7
0x9eb86e93a809a41ab0e7cc0ba6f62561fda3015c,0xae124106005a540cc18c6f9162968819e1ae3645b9e2c53ffe97dc6f862c75ef,18-12-2024,2024-12-18 19:40:55.000 UTC,326,23880754,0xBDA319Bc7Cc8F0829df39eC0FFF5D1E061FFadf7
0x38f6d2d9ea493c3c6ee865b5b952b5fe9e3e61fc,0xb96632dbc2c29a46ff2739da9164b12f84acfe2ade6df25ccfdd57a38a338901,17-01-2025,2025-01-17 21:14:35.000 UTC,390,25179564,0xB9E4E0368A9F281584C9adB685e6C9F4b9F37dBb
0x2791dc5e14f7680d9d969acc26059ba56403b6d5,0xe0207a0f4e212ab5c5ca1bbaf592b407d509777a78c96e7e0abc8251d3a2b92d,27-12-2024,2024-12-27 01:07:57.000 UTC,212,24236165,0xBDA319Bc7Cc8F0829df39eC0FFF5D1E061FFadf7
0x9eb86e93a809a41ab0e7cc0ba6f62561fda3015c,0x172386f1c17992527258b2259de9f389759b62f2e26ec7626cb91e5676a5aa3f,27-05-2025,2025-05-27 11:47:55.000 UTC,1163,30778564,0xf2c38dE50A250C0060fB45eBE4504B67f6F1be3C
0x9eb86e93a809a41ab0e7cc0ba6f62561fda3015c,0x1d15f2e7f1eb4d9c18a03df214123b7b2ce0977d4ac35403b2bef228cb17e52b,04-03-2025,2025-03-04 07:15:07.000 UTC,430,27141580,0x6399ed6725cC163D019aA64FF55b22149D7179A8
0x38f6d2d9ea493c3c6ee865b5b952b5fe9e3e61fc,0x515de203b1f90b10b83ff393a3133b1e89c8039a4d4d6a633f0140c93e0e8528,07-01-2025,2025-01-07 02:54:25.000 UTC,291,24714559,0xBDA319Bc7Cc8F0829df39eC0FFF5D1E061FFadf7
0x9eb86e93a809a41ab0e7cc0ba6f62561fda3015c,0xf5bb94f49eb3167d6f9e3f5f47cca2717bfb6e7cdffe1fd6d7344af41abd8061,08-02-2025,2025-02-08 05:32:09.000 UTC,272,26101691,0x6399ed6725cC163D019aA64FF55b22149D7179A8
0x9eb86e93a809a41ab0e7cc0ba6f62561fda3015c,0x7c38d10f47ac4054a5a081cda37b87431f2088f5a91cfb4fe2950e5a62ddb8c4,09-01-2025,2025-01-09 18:14:45.000 UTC,393,24828569,0x869305781fff479f0311974d55FeeB6Fc9DE96a2
0x2791dc5e14f7680d9d969acc26059ba56403b6d5,0xa03e40d24082afc54b5fd26beceb0cdf1ad5cdd06e507e20eaf935ca00a61f41,06-01-2025,2025-01-06 05:04:39.000 UTC,391,24675266,0x0e956C897bBFCbd2155D3DfdD27c87fa5A0FaD39
0x8fd1b615c006ebeb8a7cfb00a1dd809f31943b08,0x3e44a3513ad9def0aad36de105a498682ac17a0d5e5db0056a37c8b9e5b9b33f,12-02-2025,2025-02-12 17:24:33.000 UTC,328,26295863,0xF33a96b5932D9E9B9A0eDA447AbD8C9d48d2e0c8
0x8fd1b615c006ebeb8a7cfb00a1dd809f31943b08,0x0113221af1b04eedef5c3a8b9e8a4bd0b1272dbcc4cb0016f415037eb3f19290,04-01-2025,2025-01-04 21:43:13.000 UTC,498,24618823,0xBDA319Bc7Cc8F0829df39eC0FFF5D1E061FFadf7
0xdc98dbffcc648d6088a2ff8f7dc01aef050e58fc,0x3c60232c0b1b0f9e568d781f582f709c983e9d2e779d0f91f38611145c292c0b,10-01-2025,2025-01-10 04:39:01.000 UTC,323,24847297,0xBDA319Bc7Cc8F0829df39eC0FFF5D1E061FFadf7
0x8fd1b615c006ebeb8a7cfb00a1dd809f31943b08,0x90fd0f6e8ef0507b3605e4dd96c0366410207c6d89af83dbe5cf1bf8426fda61,14-12-2024,2024-12-14 10:47:47.000 UTC,278,23691960,0xBDA319Bc7Cc8F0829df39eC0FFF5D1E061FFadf7
0x9eb86e93a809a41ab0e7cc0ba6f62561fda3015c,0x2cbcd2e5599316ad4a5ea0b9b0ea0eb471121ec022afaf87fca043e6201541a5,27-12-2024,2024-12-27 17:58:47.000 UTC,349,24266490,0xBDA319Bc7Cc8F0829df39eC0FFF5D1E061FFadf7
0x351f61e4c49cf11f24d9f2e737ca5eff81806355,0xe4b9d34b052e76d45a516d432c10484f15fc52c4f0eec957c973209f66851920,08-10-2025,2025-10-08 15:50:49.000 UTC,741,36574651,0x0e956C897bBFCbd2155D3DfdD27c87fa5A0FaD39
0x8508fd4238162cb3f3d485f432202af3b40f164e,0xf01d11c92f0b549cbb9f2030e52a5d3d37eec722809ab947eed59747c618d172,10-06-2025,2025-06-10 01:24:05.000 UTC,432,31364649,0xc3f97660D0b47F0E05C3c513f73eeff7c1bd6c7a
0x8fd1b615c006ebeb8a7cfb00a1dd809f31943b08,0xa5c14f6bd54a7dd5f611d7caadd2aae42aef21b0843eca0d026c2a0681c2d01a,30-12-2024,2024-12-30 03:59:45.000 UTC,337,24370919,0xCFede447ca3b4885720B5a327e3BFb02078f06e8
0x095d0de0ecfd6832f1a7961ae26d285d68655d60,0x910a0378b13e51e02edb9329a66de46aeb0cc57254c050eceb2d8fdc3e120cba,15-04-2025,2025-04-15 20:01:35.000 UTC,316,28978974,0x869305781fff479f0311974d55FeeB6Fc9DE96a2
0x38f6d2d9ea493c3c6ee865b5b952b5fe9e3e61fc,0x1ec492825758f5ae54c63e4f4c187242b4167ee946340007999d82e26c04c520,02-06-2025,2025-06-02 14:48:03.000 UTC,629,31043168,0xf2c38dE50A250C0060fB45eBE4504B67f6F1be3C
0x38f6d2d9ea493c3c6ee865b5b952b5fe9e3e61fc,0x435760ef17a56d5ff15132eb0cae28cdc26b72cf09dadbd80803fb71ff510c5a,05-01-2025,2025-01-05 17:50:11.000 UTC,586,24655032,0xB9E4E0368A9F281584C9adB685e6C9F4b9F37dBb
0x38f6d2d9ea493c3c6ee865b5b952b5fe9e3e61fc,0xfa12db736139aebc11d7cf4b10267df0787a10b7eb6aaeb63c43822a1bacdebf,05-01-2025,2025-01-05 23:50:49.000 UTC,319,24665851,0xBDA319Bc7Cc8F0829df39eC0FFF5D1E061FFadf7
0x38f6d2d9ea493c3c6ee865b5b952b5fe9e3e61fc,0xb12255b35f6b6a43e465a8217b4c51f8569b8a35110d7f771cc12967900310e6,04-01-2025,2025-01-04 07:28:33.000 UTC,423,24593183,0xBDA319Bc7Cc8F0829df39eC0FFF5D1E061FFadf7
0xdc98dbffcc648d6088a2ff8f7dc01aef050e58fc,0x9d3c536c819a8a9e872997136cd89b86fb28c25a1c1460438bd35bd8f067168f,06-06-2025,2025-06-06 08:21:41.000 UTC,1938,31204377,0xc3f97660D0b47F0E05C3c513f73eeff7c1bd6c7a
0xdc98dbffcc648d6088a2ff8f7dc01aef050e58fc,0x8b8b997b10561cdc513882badbda3678fd08171b9d10462d3fe98ef24019abb1,29-12-2024,2024-12-29 01:49:35.000 UTC,529,24323814,0xCFede447ca3b4885720B5a327e3BFb02078f06e8
0x9eb86e93a809a41ab0e7cc0ba6f62561fda3015c,0x3d085e3ace3568ffdc306d44ec172bc87caba04d98267b3223f18e27a516f948,09-01-2025,2025-01-09 01:39:57.000 UTC,1292,24798725,0xBDA319Bc7Cc8F0829df39eC0FFF5D1E061FFadf7
0x9eb86e93a809a41ab0e7cc0ba6f62561fda3015c,0x99e0f2ef4619222f0164926785eb853ef995811c657a1edcb060a3220d8b130f,15-07-2025,2025-07-15 23:25:53.000 UTC,11,32916303,0xf2c38dE50A250C0060fB45eBE4504B67f6F1be3C
0x38f6d2d9ea493c3c6ee865b5b952b5fe9e3e61fc,0xf159da9389410f78ae44e04e9f463ce37550538b5bbc71ba79d3f07b775e4f62,06-01-2025,2025-01-06 04:49:01.000 UTC,268,24674797,0xBDA319Bc7Cc8F0829df39eC0FFF5D1E061FFadf7
0x38f6d2d9ea493c3c6ee865b5b952b5fe9e3e61fc,0x54a7f2275c8734e0c3cd3d056fdb92abb085c086d6246c1128888c4ac8ac6780,22-06-2025,2025-06-22 17:05:35.000 UTC,428,31911294,0xc3f97660D0b47F0E05C3c513f73eeff7c1bd6c7a
0x9eb86e93a809a41ab0e7cc0ba6f62561fda3015c,0xa4fbfe6ae6e9a17c71c392084a17abc7b253bd9f4fc9f7480c96915fc2a86a9c,13-12-2024,2024-12-13 20:31:27.000 UTC,412,23666270,0xBDA319Bc7Cc8F0829df39eC0FFF5D1E061FFadf7
0xdc98dbffcc648d6088a2ff8f7dc01aef050e58fc,0xa17f2083ca1860e1e3ab93e1c7ad7df4bc0b3ce531a08b9e706fb603c308bea2,08-01-2025,2025-01-08 05:22:05.000 UTC,873,24762189,0x869305781fff479f0311974d55FeeB6Fc9DE96a2
0x2791dc5e14f7680d9d969acc26059ba56403b6d5,0xb2dc68a794d0eda595fe452e42b23d81d42e2550a37b122e2476509fb735303e,03-01-2025,2025-01-03 04:19:45.000 UTC,308,24544319,0x869305781fff479f0311974d55FeeB6Fc9DE96a2
0x9eb86e93a809a41ab0e7cc0ba6f62561fda3015c,0xdcc4e7c93a6018183fba24afd21c2b952dc0082a40eb3170774c067004d19aaf,29-05-2025,2025-05-29 13:11:59.000 UTC,449,30867486,0xc3f97660D0b47F0E05C3c513f73eeff7c1bd6c7a
0x2791dc5e14f7680d9d969acc26059ba56403b6d5,0x20f828fac37675aadb5e755c3642231fa0f3e992145bd6d707236b93c873681f,15-12-2024,2024-12-15 02:55:29.000 UTC,213,23720991,0xBDA319Bc7Cc8F0829df39eC0FFF5D1E061FFadf7
0x38f6d2d9ea493c3c6ee865b5b952b5fe9e3e61fc,0x6f5a5bf2b6aef6c31508d58a0a8ec180e6050e8fbfeab96cc4ebc9b3c273f2cc,03-01-2025,2025-01-03 15:25:51.000 UTC,914,24564302,0xB9E4E0368A9F281584C9adB685e6C9F4b9F37dBb
0x8fd1b615c006ebeb8a7cfb00a1dd809f31943b08,0x4b00f5dba7061cfefb934853e9a8e89908393d0f6e71d42a4199043af78f9533,11-02-2025,2025-02-11 01:41:29.000 UTC,240,26224371,0xF33a96b5932D9E9B9A0eDA447AbD8C9d48d2e0c8
0x8fd1b615c006ebeb8a7cfb00a1dd809f31943b08,0x0fe1361b956663c54468bfd7b6505fb3763fd8620526adeea8447dab4b6982f3,19-12-2024,2024-12-19 22:29:13.000 UTC,389,23929003,0x45F8b8eC9c92D09BA8495074436fD97073423041
0x2791dc5e14f7680d9d969acc26059ba56403b6d5,0x7c9caa7e3b0f690bd1312598a765da36da5e2b3e4665cba300fdeaeb3b695de2,09-01-2025,2025-01-09 03:58:47.000 UTC,354,24802890,0x869305781fff479f0311974d55FeeB6Fc9DE96a2
0x2791dc5e14f7680d9d969acc26059ba56403b6d5,0x665f86fd545e9e7ead5f312a0c43522f5c157bb2fe2e06c0b0c8e77841141fdc,19-01-2025,2025-01-19 09:32:11.000 UTC,473,25244892,0x869305781fff479f0311974d55FeeB6Fc9DE96a2
0xdc98dbffcc648d6088a2ff8f7dc01aef050e58fc,0x5606cd5fa7ca45ec80b2f0149c3b073d8fbbb05cacae5555307ebbdf173874d1,29-05-2025,2025-05-29 13:14:27.000 UTC,262,30867560,0xc3f97660D0b47F0E05C3c513f73eeff7c1bd6c7a
0x9eb86e93a809a41ab0e7cc0ba6f62561fda3015c,0x3f1b1b2d4de8eed40546919b69a5f193d0e14dd23feb4142ac9a00a8262d6749,27-12-2024,2024-12-27 02:56:27.000 UTC,462,24239420,0xBDA319Bc7Cc8F0829df39eC0FFF5D1E061FFadf7
0xdc98dbffcc648d6088a2ff8f7dc01aef050e58fc,0x2b88f8391b4e811a5f88edfd23309b59b0ed5930e55d6065c34c182eaa7de874,30-12-2024,2024-12-30 13:14:25.000 UTC,438,24387559,0xCFede447ca3b4885720B5a327e3BFb02078f06e8
0x8508fd4238162cb3f3d485f432202af3b40f164e,0x648210738bb817117a7e15da05b2d7f691b776fd12c717a468617c973a83c773,12-04-2025,2025-04-12 09:19:21.000 UTC,572,28830107,0x869305781fff479f0311974d55FeeB6Fc9DE96a2
0x095d0de0ecfd6832f1a7961ae26d285d68655d60,0x175c11e20c7ae9c44329365b627e16837abddaa01155cfeab4d08546ce8ebb2f,19-06-2025,2025-06-19 09:55:55.000 UTC,533,31768804,0xf2c38dE50A250C0060fB45eBE4504B67f6F1be3C
0x2791dc5e14f7680d9d969acc26059ba56403b6d5,0x1a607c3956f7d8779eaaf93626bbf1b53e8eb764fd416160af18f9018ed3fc8b,12-12-2024,2024-12-12 06:38:19.000 UTC,292,23598076,0xBDA319Bc7Cc8F0829df39eC0FFF5D1E061FFadf7
0x9eb86e93a809a41ab0e7cc0ba6f62561fda3015c,0x603c1b9ba8e939a7015c3b09885e2132d21783311c44b556366ba680f226fc52,23-12-2024,2024-12-23 14:25:47.000 UTC,491,24087300,0xBDA319Bc7Cc8F0829df39eC0FFF5D1E061FFadf7
0x2791dc5e14f7680d9d969acc26059ba56403b6d5,0x8dd752736e5859b5a1f0a5447528eb753f9f024922e21d8b78fae79c195025ba,17-01-2025,2025-01-17 12:32:17.000 UTC,296,25163895,0x0e956C897bBFCbd2155D3DfdD27c87fa5A0FaD39
0x2791dc5e14f7680d9d969acc26059ba56403b6d5,0x766635462c6e33e550b8e04d2898fb86685041568ca06cd5ae6fb23f03bda80c,09-01-2025,2025-01-09 23:14:03.000 UTC,894,24837548,0xBDA319Bc7Cc8F0829df39eC0FFF5D1E061FFadf7
0x8fd1b615c006ebeb8a7cfb00a1dd809f31943b08,0xa9f2cc666b343d7653ae21da0565463ae9e307915090dcf154bb8025019848fb,02-01-2025,2025-01-02 05:57:53.000 UTC,182,24504063,0xCFede447ca3b4885720B5a327e3BFb02078f06e8
0x9eb86e93a809a41ab0e7cc0ba6f62561fda3015c,0x06fa2647a2f257e2663d2c1b5c4e8e3b012494702976bb8c9fbe4917dde35d82,14-12-2024,2024-12-14 01:20:41.000 UTC,371,23674947,0xBDA319Bc7Cc8F0829df39eC0FFF5D1E061FFadf7
0xdc98dbffcc648d6088a2ff8f7dc01aef050e58fc,0xae142bc10e2c735a8ce71a7d416b089f976c0e8d44d49f74d52c06b36a28effe,11-06-2025,2025-06-11 03:50:37.000 UTC,822,31412245,0xf2c38dE50A250C0060fB45eBE4504B67f6F1be3C
0x38f6d2d9ea493c3c6ee865b5b952b5fe9e3e61fc,0x221a4b72fa01ee5a669ff12845b15f8752b8aaae2c756a6f15660dffd2f5636f,12-06-2025,2025-06-12 09:49:21.000 UTC,947,31466207,0xc3f97660D0b47F0E05C3c513f73eeff7c1bd6c7a
0xdc98dbffcc648d6088a2ff8f7dc01aef050e58fc,0xe7f97760cf5861dbd3dd3e21d90054975d63625afe06e2a3416bb95bf0ad5e28,09-01-2025,2025-01-09 08:27:41.000 UTC,464,24810957,0xBDA319Bc7Cc8F0829df39eC0FFF5D1E061FFadf7
0xdc98dbffcc648d6088a2ff8f7dc01aef050e58fc,0xe157e371fe3b8b5e5e8d9f32d7dc9076a607856d767d3d7e3c7ecce3e4720a55,05-01-2025,2025-01-05 15:46:03.000 UTC,490,24651308,0xB9E4E0368A9F281584C9adB685e6C9F4b9F37dBb
0xdc98dbffcc648d6088a2ff8f7dc01aef050e58fc,0x9abfc184e6c816173f9d8c65937dac73a345622fff2dce38b754caf57e825451,01-06-2025,2025-06-01 06:46:11.000 UTC,502,30985512,0xc3f97660D0b47F0E05C3c513f73eeff7c1bd6c7a
0xdc98dbffcc648d6088a2ff8f7dc01aef050e58fc,0x3389c04479297da187cf01c50483b54ce6fed1e6c646148bdf560a45dec63946,07-01-2025,2025-01-07 14:14:37.000 UTC,296,24734965,0xB9E4E0368A9F281584C9adB685e6C9F4b9F37dBb
0x2791dc5e14f7680d9d969acc26059ba56403b6d5,0x112f0eb9533307d46687ad30a0232f3d873b962b2e90c95914ab962ac7751b14,11-02-2025,2025-02-11 06:52:59.000 UTC,235,26233716,0x0e956C897bBFCbd2155D3DfdD27c87fa5A0FaD39
0x2791dc5e14f7680d9d969acc26059ba56403b6d5,0x9254bdd0b3e5bf8a897b64cc37f4de8b0c3e06fa042528ca96b63dcfa839cd63,05-02-2025,2025-02-05 04:34:59.000 UTC,303,25970376,0xCFede447ca3b4885720B5a327e3BFb02078f06e8
0xdc98dbffcc648d6088a2ff8f7dc01aef050e58fc,0xaa4dbf2df747c7d2064300266541b5127234b319cc759ca09d5079ed55b2b9b2,20-01-2025,2025-01-20 03:40:55.000 UTC,214,25277554,0xf2c38dE50A250C0060fB45eBE4504B67f6F1be3C
0x8fd1b615c006ebeb8a7cfb00a1dd809f31943b08,0x3a40d111c04314611270c89e16302228861855bf1ab21b5e4ad03eeda28f787e,09-07-2025,2025-07-09 15:37:01.000 UTC,318,32643037,0xf2c38dE50A250C0060fB45eBE4504B67f6F1be3C
0xdc98dbffcc648d6088a2ff8f7dc01aef050e58fc,0x462c5ae0aea750b4302eae33ece490490aceeffcf4e9a092303412ec52df9931,13-01-2025,2025-01-13 18:40:39.000 UTC,192,25002146,0xCFede447ca3b4885720B5a327e3BFb02078f06e8
0x8508fd4238162cb3f3d485f432202af3b40f164e,0xf76bdf90d9e0bdbc2afd66ae6ab6e2f548f7a96bd6d30c9e19efa9cb307443cd,12-04-2025,2025-04-12 09:03:31.000 UTC,316,28829632,0x2B74B62c564456C48055bd515A62594742b3f545
0x9eb86e93a809a41ab0e7cc0ba6f62561fda3015c,0xc26aa61296a6c685abdf49d9c4dd14b2f75b56853f6d27707a5ce403e6d506e9,02-06-2025,2025-06-02 05:08:51.000 UTC,447,31025792,0xc3f97660D0b47F0E05C3c513f73eeff7c1bd6c7a
0x2791dc5e14f7680d9d969acc26059ba56403b6d5,0x55ee0d09d7e3b5a86961742af3d82327b873b9135763632f8498c2ffe2751d40,20-12-2024,2024-12-20 07:39:31.000 UTC,1051,23945512,0xBDA319Bc7Cc8F0829df39eC0FFF5D1E061FFadf7
0x095d0de0ecfd6832f1a7961ae26d285d68655d60,0x63d7c924c790d8ac9f0c946184bbd3bf206a2137761adbc7238cd086e3e370de,14-05-2025,2025-05-14 00:02:55.000 UTC,202,30195814,0x0e956C897bBFCbd2155D3DfdD27c87fa5A0FaD39
0x9eb86e93a809a41ab0e7cc0ba6f62561fda3015c,0x2a5b4ddcfb78d9455e8e7daae5611fd87ef64a8f51da172f98e23ff0c09730cb,11-12-2024,2024-12-11 22:47:07.000 UTC,306,23583940,0xBDA319Bc7Cc8F0829df39eC0FFF5D1E061FFadf7
0x8fd1b615c006ebeb8a7cfb00a1dd809f31943b08,0xdc86305eb7b6e16b584f61ec725a9757a11f7b0affa78a2d4ceb849bc9bff1ff,24-12-2024,2024-12-24 13:14:09.000 UTC,402,24128351,0xBDA319Bc7Cc8F0829df39eC0FFF5D1E061FFadf7
0x2791dc5e14f7680d9d969acc26059ba56403b6d5,0xe1a1e7a457ecef15e94c39ccf9f1e414e3ad6f9ebe7c929f2211662bc6dd7959,04-01-2025,2025-01-04 21:29:19.000 UTC,333,24618406,0x0e956C897bBFCbd2155D3DfdD27c87fa5A0FaD39
0x8fd1b615c006ebeb8a7cfb00a1dd809f31943b08,0x0f4628dc93f4bd2da3c1958ea96a706523792efd4c2fc7e2d254c065ffbc2d5a,04-01-2025,2025-01-04 18:00:55.000 UTC,330,24612154,0xBDA319Bc7Cc8F0829df39eC0FFF5D1E061FFadf7
0xdc98dbffcc648d6088a2ff8f7dc01aef050e58fc,0x1c01bfc9ae28d8fcf62df9c5d98fd3b01b33391b7a0eb349ab307a11bef4feb4,05-01-2025,2025-01-05 00:57:45.000 UTC,223,24624659,0xB9E4E0368A9F281584C9adB685e6C9F4b9F37dBb
0x9eb86e93a809a41ab0e7cc0ba6f62561fda3015c,0x83325a2894110b90555a3c89c939534c5fc8e1e166c213ca5061b341445b5a45,24-12-2024,2024-12-24 06:38:09.000 UTC,169,24116471,0xBDA319Bc7Cc8F0829df39eC0FFF5D1E061FFadf7
0x38f6d2d9ea493c3c6ee865b5b952b5fe9e3e61fc,0xaa5f66ab7714706c1a8825ad867679e765bdee882b9df5d6b4fb562e4247790d,03-01-2025,2025-01-03 21:18:27.000 UTC,240,24574880,0x869305781fff479f0311974d55FeeB6Fc9DE96a2
0xdc98dbffcc648d6088a2ff8f7dc01aef050e58fc,0x4f15ffc0e235342b7b40a1d247a3eee19ab17100ca189c651fb439eb9d253153,15-01-2025,2025-01-15 19:00:47.000 UTC,319,25089150,0xBDA319Bc7Cc8F0829df39eC0FFF5D1E061FFadf7
0xdc98dbffcc648d6088a2ff8f7dc01aef050e58fc,0x139a80461a5e0add4757ebd820c18c8408e305f6eb43e6006548b2047e58553e,20-06-2025,2025-06-20 05:50:53.000 UTC,233,31804653,0x430C09546ae9249AB75B9A4ef7B5FD9a4006D6f3
0x8810de2baa17067ddcfbd9e8f29c55f070a55f0b,0xe1b542128a2716909a004899182e6ea045089a54741a45dc2853cd6fd3008fec,13-05-2025,2025-05-13 16:53:13.000 UTC,1217,30182923,0xaDEfE661847835C6566b1caAbECfcF09C586F300
0xdc98dbffcc648d6088a2ff8f7dc01aef050e58fc,0xbe997b1938036c871d0f9be1f04a7e5109ef209f6f874e9d66181fa096b2dfe5,04-01-2025,2025-01-04 14:26:49.000 UTC,256,24605731,0xB9E4E0368A9F281584C9adB685e6C9F4b9F37dBb
0x8fd1b615c006ebeb8a7cfb00a1dd809f31943b08,0x40088befdd0e42af2df3bc56bb9e8553efecc9780b5d46c198c0ce1d85be2406,26-12-2024,2024-12-26 19:16:51.000 UTC,571,24225632,0xBDA319Bc7Cc8F0829df39eC0FFF5D1E061FFadf7
0x8fd1b615c006ebeb8a7cfb00a1dd809f31943b08,0x223d864dbef83a5c71c33ec93cd5dc7a056455699939b2d962639e5d88aafe44,30-12-2024,2024-12-30 10:06:21.000 UTC,242,24381917,0xBDA319Bc7Cc8F0829df39eC0FFF5D1E061FFadf7
0x38f6d2d9ea493c3c6ee865b5b952b5fe9e3e61fc,0xdf574d60981fe4544395824ad4a75277eb8fa886e4435da6e235e777564d31b6,02-01-2025,2025-01-02 08:48:41.000 UTC,318,24509187,0x869305781fff479f0311974d55FeeB6Fc9DE96a2
0x8fd1b615c006ebeb8a7cfb00a1dd809f31943b08,0xd5493c481e0d578087a804079c80ca65d9820f29c70c2f3c0aba1a475cf293bf,02-01-2025,2025-01-02 08:28:31.000 UTC,249,24508582,0xBDA319Bc7Cc8F0829df39eC0FFF5D1E061FFadf7
0x8fd1b615c006ebeb8a7cfb00a1dd809f31943b08,0x048bd5a00dd3a37b9962e10d59253b394637071d4f487baa27f696ac23d89a87,13-12-2024,2024-12-13 13:30:03.000 UTC,331,23653628,0xBDA319Bc7Cc8F0829df39eC0FFF5D1E061FFadf7
0x8fd1b615c006ebeb8a7cfb00a1dd809f31943b08,0xb66d60846c8c5f7f90cb29557e504c4c3be924814bf7fdcba6262306e54d5d2b,16-12-2024,2024-12-16 06:07:43.000 UTC,362,23769958,0xBDA319Bc7Cc8F0829df39eC0FFF5D1E061FFadf7
0xdc98dbffcc648d6088a2ff8f7dc01aef050e58fc,0x02bf4414bbeea044ccf9085d095d4f4ffce895783bf60bfd833e1927d9c3c7f3,03-01-2025,2025-01-03 20:29:39.000 UTC,516,24573416,0xBDA319Bc7Cc8F0829df39eC0FFF5D1E061FFadf7
0x38f6d2d9ea493c3c6ee865b5b952b5fe9e3e61fc,0x879593438d979bca5a859b69ed853dd599aad3d868423adc417a590c92845f5a,04-01-2025,2025-01-04 07:33:33.000 UTC,260,24593333,0x0e956C897bBFCbd2155D3DfdD27c87fa5A0FaD39
0x38f6d2d9ea493c3c6ee865b5b952b5fe9e3e61fc,0xcbe940746d85fd04442ba115d17bb9a8709ca5848059e44e97c0e036b21fc826,06-06-2025,2025-06-06 14:07:33.000 UTC,2271,31214753,0xc3f97660D0b47F0E05C3c513f73eeff7c1bd6c7a
0xdc98dbffcc648d6088a2ff8f7dc01aef050e58fc,0xc05f12795fe4b779b6aba349994226a3eceba3d386da807cc7c871489c50c3ca,02-01-2025,2025-01-02 08:30:49.000 UTC,276,24508651,0x869305781fff479f0311974d55FeeB6Fc9DE96a2
0x8810de2baa17067ddcfbd9e8f29c55f070a55f0b,0xd8275e46f0fadd7de442d823269dd41794d0012d7bd4506325d031bc97987c92,28-03-2025,2025-03-28 16:27:59.000 UTC,212,28194966,0x0e956C897bBFCbd2155D3DfdD27c87fa5A0FaD39
0x8508fd4238162cb3f3d485f432202af3b40f164e,0xd54d2805954678a707f366305127a0d3aebfb8ebb260378df871cce3578b3310,06-06-2025,2025-06-06 03:54:25.000 UTC,1213,31196359,0xc3f97660D0b47F0E05C3c513f73eeff7c1bd6c7a
0xdc98dbffcc648d6088a2ff8f7dc01aef050e58fc,0x1c785491d89f5cec0ae0c2f7263538f1f908c8c3e8a8dac0b3551facc77aa7bb,09-01-2025,2025-01-09 04:00:27.000 UTC,770,24802940,0x869305781fff479f0311974d55FeeB6Fc9DE96a2
0x2791dc5e14f7680d9d969acc26059ba56403b6d5,0xd2691be7deef1d1dbe442a94535cee5b4d31227b25b0b1c690da7491f49566d8,14-01-2025,2025-01-14 06:59:23.000 UTC,252,25024308,0xBDA319Bc7Cc8F0829df39eC0FFF5D1E061FFadf7
0x351f61e4c49cf11f24d9f2e737ca5eff81806355,0xb37a795eaaa6800be3481d965dee925aca84c07a86b0c251cbd9565be7b6d6cd,11-06-2025,2025-06-11 14:14:43.000 UTC,471,31430968,0x0e956C897bBFCbd2155D3DfdD27c87fa5A0FaD39
0x9eb86e93a809a41ab0e7cc0ba6f62561fda3015c,0xc233793534a197bd92b3c66b9f15af1d254aad41f3dfe46df0512feb6e4f5bb0,11-12-2024,2024-12-11 09:33:13.000 UTC,251,23560123,0xBDA319Bc7Cc8F0829df39eC0FFF5D1E061FFadf7
0xdc98dbffcc648d6088a2ff8f7dc01aef050e58fc,0xc5b809c46214fa59f625962b3783e23711da984414c090979043d3a2686e38d7,30-12-2024,2024-12-30 19:34:11.000 UTC,285,24398952,0x0e956C897bBFCbd2155D3DfdD27c87fa5A0FaD39
0x38f6d2d9ea493c3c6ee865b5b952b5fe9e3e61fc,0x46ce7c06ea0d8c511e0d616489134c2d94ce5f61b5d76ace9762e0671cbaef3c,13-01-2025,2025-01-13 13:24:29.000 UTC,267,24992661,0x869305781fff479f0311974d55FeeB6Fc9DE96a2
0x2791dc5e14f7680d9d969acc26059ba56403b6d5,0x3cad1c28abf97bc4fcc32d346356734e547ffc0ac82d666649dd5773472ec6c8,13-12-2024,2024-12-13 20:30:57.000 UTC,605,23666255,0xBDA319Bc7Cc8F0829df39eC0FFF5D1E061FFadf7
0xdc98dbffcc648d6088a2ff8f7dc01aef050e58fc,0x07b74bcb5ef9ba23a9329744a26c88af859f30ee082e785d1021e9f0f355e272,27-12-2024,2024-12-27 12:52:23.000 UTC,315,24257298,0xCFede447ca3b4885720B5a327e3BFb02078f06e8
0x8508fd4238162cb3f3d485f432202af3b40f164e,0xd8dd4fb7c5b95dbf5fc494c77b9788a3fa8f3c542b59a388699a61d095bd9691,13-04-2025,2025-04-13 09:21:37.000 UTC,318,28873375,0x2B74B62c564456C48055bd515A62594742b3f545
0x095d0de0ecfd6832f1a7961ae26d285d68655d60,0x520326c84f99bb24abafc497ecc263d7004924cb476d2c29cf1fb0f890dab242,16-07-2025,2025-07-16 04:48:47.000 UTC,500,32925990,0xf2c38dE50A250C0060fB45eBE4504B67f6F1be3C
0x38f6d2d9ea493c3c6ee865b5b952b5fe9e3e61fc,0x04cae4afa969f2e787088fabbaa12f1f54ea2d9594559c3c529cede80144bc86,03-03-2025,2025-03-03 15:31:05.000 UTC,151,27113259,0x0e956C897bBFCbd2155D3DfdD27c87fa5A0FaD39
0xdc98dbffcc648d6088a2ff8f7dc01aef050e58fc,0x15d924affcc56166083a820ae535c78e9cec70163b1ecaa6bb3520f02bc445b0,17-01-2025,2025-01-17 00:10:39.000 UTC,128,25141646,0xCFede447ca3b4885720B5a327e3BFb02078f06e8
0xdc98dbffcc648d6088a2ff8f7dc01aef050e58fc,0x54e5927d62c9584b007b058b54a952fe73df1b63dc30163a1a50f57c3291ebf5,12-01-2025,2025-01-12 15:28:53.000 UTC,243,24953193,0xBDA319Bc7Cc8F0829df39eC0FFF5D1E061FFadf7
0x8508fd4238162cb3f3d485f432202af3b40f164e,0xa01a0fa654b1585031c8e51079bbee32a565c9bf2c6b2316dc24e5daece23664,09-03-2025,2025-03-09 05:21:15.000 UTC,201,27354164,0x869305781fff479f0311974d55FeeB6Fc9DE96a2
0x8fd1b615c006ebeb8a7cfb00a1dd809f31943b08,0xad32aafcf4e87859bda404e40e9dfa055db9f50449835b98c6bd3da9400129bb,03-06-2025,2025-06-03 19:28:23.000 UTC,632,31094778,0xf2c38dE50A250C0060fB45eBE4504B67f6F1be3C
0x9eb86e93a809a41ab0e7cc0ba6f62561fda3015c,0x8227c415128ca2f4011336f533e8d44db8e60380ebcc9ad2281b1746e06d2c7c,05-01-2025,2025-01-05 04:17:43.000 UTC,276,24630658,0xBDA319Bc7Cc8F0829df39eC0FFF5D1E061FFadf7
0x38f6d2d9ea493c3c6ee865b5b952b5fe9e3e61fc,0x80298d35a7371bd2d1aa7d549990dbb500a819f931fac68a4d51f7c1c4544195,09-01-2025,2025-01-09 01:58:09.000 UTC,250,24799271,0x0e956C897bBFCbd2155D3DfdD27c87fa5A0FaD39
0x2791dc5e14f7680d9d969acc26059ba56403b6d5,0xd4cbd1a9c1650c30bf347bd503fe38d28579ace5b25c3e70067158eb018de452,06-01-2025,2025-01-06 12:03:43.000 UTC,403,24687838,0xBDA319Bc7Cc8F0829df39eC0FFF5D1E061FFadf7
0x9eb86e93a809a41ab0e7cc0ba6f62561fda3015c,0x8f3a0d393163544bdb977d1a8d7c8b62fb3a62ca45f81c783ee8e073ba8fec80,19-02-2025,2025-02-19 13:39:03.000 UTC,194,26591498,0x6399ed6725cC163D019aA64FF55b22149D7179A8
0x8508fd4238162cb3f3d485f432202af3b40f164e,0xf2311f8a71b08c248858a585c1b49b9d24c43e3edcd9fa641582a30b6170bc40,02-04-2025,2025-04-02 13:14:49.000 UTC,241,28405171,0x2B74B62c564456C48055bd515A62594742b3f545
0x38f6d2d9ea493c3c6ee865b5b952b5fe9e3e61fc,0x26af36dd53b01402a105b6de28bb0b9c136a9d0e8830590befd76cd42f899619,04-01-2025,2025-01-04 03:16:29.000 UTC,395,24585621,0xBDA319Bc7Cc8F0829df39eC0FFF5D1E061FFadf7
0xdc98dbffcc648d6088a2ff8f7dc01aef050e58fc,0x0b9c29310a3297f41d049898aabc2f7e2e6ed57504f18e0143a34a3a8afb3efc,09-01-2025,2025-01-09 01:47:31.000 UTC,223,24798952,0x869305781fff479f0311974d55FeeB6Fc9DE96a2
0x38f6d2d9ea493c3c6ee865b5b952b5fe9e3e61fc,0x74ce8a3f89bde7fc224faa7f6088f18df5fbe31dcd85f99545ea6882ef135806,07-01-2025,2025-01-07 01:03:01.000 UTC,314,24711217,0xBDA319Bc7Cc8F0829df39eC0FFF5D1E061FFadf7
0x8810de2baa17067ddcfbd9e8f29c55f070a55f0b,0xc84b58cc2887bd8c2e5e0f43a518f0d4f1d3ab89a6960d7732f6f1e607c198d7,29-03-2025,2025-03-29 17:08:43.000 UTC,399,28239388,0x0e956C897bBFCbd2155D3DfdD27c87fa5A0FaD39
0x9eb86e93a809a41ab0e7cc0ba6f62561fda3015c,0xd3de9057ac64c07b04c22d405e6f3d5a79b4ecc2a77cbf25a26f1162134eb50c,07-12-2024,2024-12-07 06:22:09.000 UTC,165,23381591,0x0e956C897bBFCbd2155D3DfdD27c87fa5A0FaD39
0x38f6d2d9ea493c3c6ee865b5b952b5fe9e3e61fc,0x41c51310d8e99d883c9ca671d2e42b863b19d6e8286d979b76965e2b53106e63,08-02-2025,2025-02-08 00:52:33.000 UTC,252,26093303,0xB9E4E0368A9F281584C9adB685e6C9F4b9F37dBb
0x2791dc5e14f7680d9d969acc26059ba56403b6d5,0xaae7da89582a73a4406bdc3a5e4047ecfb6b5d688970846e1872c63309633a90,13-12-2024,2024-12-13 07:31:43.000 UTC,314,23642878,0xBDA319Bc7Cc8F0829df39eC0FFF5D1E061FFadf7
0x8fd1b615c006ebeb8a7cfb00a1dd809f31943b08,0xffa0f23b03c2ec0fb43e944d24ed43f633913168ae9c16b2f6680ba38ef5a27d,01-01-2025,2025-01-01 10:20:11.000 UTC,186,24468732,0xAfabcBbab5e4261B1d655c906738176191819164
0x9eb86e93a809a41ab0e7cc0ba6f62561fda3015c,0x4ed06228eedd519ae821508f4777eaa960d6b2ede4c2cdcd2bebf10ccb357c1a,06-01-2025,2025-01-06 12:04:09.000 UTC,313,24687851,0xBDA319Bc7Cc8F0829df39eC0FFF5D1E061FFadf7
0x095d0de0ecfd6832f1a7961ae26d285d68655d60,0xce90ca2c45791142541c0ad5858c668ec97855e2d6f532fe5026b057b590a0f2,24-01-2025,2025-01-24 05:25:27.000 UTC,274,25453490,0xB9E4E0368A9F281584C9adB685e6C9F4b9F37dBb
0x2791dc5e14f7680d9d969acc26059ba56403b6d5,0xe8c9790a9b67f4f4ff3fa7bdc0ee3035639e8ef1d5c08ecc795ddc7ad2a66ac0,18-12-2024,2024-12-18 09:31:53.000 UTC,503,23862483,0xBDA319Bc7Cc8F0829df39eC0FFF5D1E061FFadf7
0x8fd1b615c006ebeb8a7cfb00a1dd809f31943b08,0xae36e7ab49977a6f79ab4b47e0bca20c186c83298822f9b3b53a7cc80d084485,25-12-2024,2024-12-25 18:09:13.000 UTC,497,24180403,0xCFede447ca3b4885720B5a327e3BFb02078f06e8
0x2791dc5e14f7680d9d969acc26059ba56403b6d5,0x946e6045e306a955fa3729de23b0f06c7fd76baae2df58f506979391fca70a72,19-01-2025,2025-01-19 20:17:11.000 UTC,376,25264242,0x869305781fff479f0311974d55FeeB6Fc9DE96a2
0x9eb86e93a809a41ab0e7cc0ba6f62561fda3015c,0xaf329836c4811810973112d123883dc7ea215b6785d3327b29e8ce95d84357fb,01-06-2025,2025-06-01 22:53:41.000 UTC,401,31014537,0xc3f97660D0b47F0E05C3c513f73eeff7c1bd6c7a
0x2791dc5e14f7680d9d969acc26059ba56403b6d5,0xe49ef24787f2f884263fc0a0a2fdb1a9593764a999e67448341380ce03096edd,09-01-2025,2025-01-09 01:58:43.000 UTC,375,24799288,0x0e956C897bBFCbd2155D3DfdD27c87fa5A0FaD39
0x38f6d2d9ea493c3c6ee865b5b952b5fe9e3e61fc,0xeec1715ba8da8fd856c4697b056bee2f87e14b9e5bd3a2aa970bedabb26f0d0a,02-01-2025,2025-01-02 00:00:27.000 UTC,482,24493340,0xCFede447ca3b4885720B5a327e3BFb02078f06e8
0x38f6d2d9ea493c3c6ee865b5b952b5fe9e3e61fc,0xf1b1d552d9088243018697edddd4459c5500225e9882742b242c2dc79cf8c853,02-01-2025,2025-01-02 20:49:23.000 UTC,291,24530808,0xBDA319Bc7Cc8F0829df39eC0FFF5D1E061FFadf7
0x8810de2baa17067ddcfbd9e8f29c55f070a55f0b,0xeb38fdf2f0d2ed49487acf846a804986e010bf1f224e32b5a8fefdbdbcb97b60,16-07-2025,2025-07-16 13:24:37.000 UTC,426,32941465,0xCFede447ca3b4885720B5a327e3BFb02078f06e8
0xdc98dbffcc648d6088a2ff8f7dc01aef050e58fc,0x08ece17e20c6fa82664de98aa2c6092c45e8c38de6894e4b3a5c2b1909a8f6ea,03-06-2025,2025-06-03 03:47:05.000 UTC,535,31066539,0xc3f97660D0b47F0E05C3c513f73eeff7c1bd6c7a
0xdc98dbffcc648d6088a2ff8f7dc01aef050e58fc,0x4f023ba4463b04fc099dffccd0d84baa466297f13c460da671a509f14d8917a7,14-01-2025,2025-01-14 13:40:09.000 UTC,253,25036331,0xBDA319Bc7Cc8F0829df39eC0FFF5D1E061FFadf7
0x2791dc5e14f7680d9d969acc26059ba56403b6d5,0xbe29b5b25ea329e2757715b652913b64738b180c3cddde6c9330eb04373c5bb3,18-06-2025,2025-06-18 04:19:39.000 UTC,535,31715516,0xCFede447ca3b4885720B5a327e3BFb02078f06e8
0x9eb86e93a809a41ab0e7cc0ba6f62561fda3015c,0xf5e5fc9f174d27461e02604bd7ee8e6b6de81804806a3a60d542986a10b8d8b9,05-03-2025,2025-03-05 00:28:09.000 UTC,148,27172571,0x6399ed6725cC163D019aA64FF55b22149D7179A8
0x9eb86e93a809a41ab0e7cc0ba6f62561fda3015c,0xc831f6e3d812ae409d21e505ea0ea82f02512668dfa3ab37da4bcf2dc25b0269,26-12-2024,2024-12-26 23:33:15.000 UTC,209,24233324,0xBDA319Bc7Cc8F0829df39eC0FFF5D1E061FFadf7
0x8fd1b615c006ebeb8a7cfb00a1dd809f31943b08,0xde316cb4d5edbe7c3eeb2979c200fc0af48b594997b8f4fb5a1ac52138ad63f5,07-01-2025,2025-01-07 11:28:59.000 UTC,486,24729996,0xB9E4E0368A9F281584C9adB685e6C9F4b9F37dBb
0x8508fd4238162cb3f3d485f432202af3b40f164e,0x494122ced62df2893060237dc99808cc1a8d93086b12bd47b085c0f465a98ca2,28-06-2025,2025-06-28 11:40:51.000 UTC,501,32160752,0xCFede447ca3b4885720B5a327e3BFb02078f06e8
0x2791dc5e14f7680d9d969acc26059ba56403b6d5,0x34c784eea00a19d152ea974ae5202bbd94c24786f26742edd8a0b78def96c3ce,28-12-2024,2024-12-28 07:17:45.000 UTC,247,24290459,0xBDA319Bc7Cc8F0829df39eC0FFF5D1E061FFadf7
0x351f61e4c49cf11f24d9f2e737ca5eff81806355,0xa53dd0c7a0b0b8f8ad3511cde859101e4eebda68464de305bbb0deae94e0b24d,22-10-2025,2025-10-22 19:38:53.000 UTC,1377,37186293,0x0e956C897bBFCbd2155D3DfdD27c87fa5A0FaD39
0xdc98dbffcc648d6088a2ff8f7dc01aef050e58fc,0xa44216d475c0a699e2dccb065ea6d1a5bedac96915562db5f0fd58873c1927d7,25-12-2024,2024-12-25 09:27:25.000 UTC,236,24164749,0xBDA319Bc7Cc8F0829df39eC0FFF5D1E061FFadf7
0x38f6d2d9ea493c3c6ee865b5b952b5fe9e3e61fc,0x22bb2a76a4df06c8653145ad1bff6f8e3c15706d8b950aabedb21bce5bf2465b,11-01-2025,2025-01-11 03:25:19.000 UTC,370,24888286,0x869305781fff479f0311974d55FeeB6Fc9DE96a2
0x38f6d2d9ea493c3c6ee865b5b952b5fe9e3e61fc,0x2519f566da4119dfdb479d2a2e46d4b99b68a17d7b183954014912e3a51dbe2d,19-12-2024,2024-12-19 20:00:21.000 UTC,479,23924537,0xCFede447ca3b4885720B5a327e3BFb02078f06e8
0x38f6d2d9ea493c3c6ee865b5b952b5fe9e3e61fc,0xaac11894e84f081536b706599c6e669e6f939044fca801b742aeb226f69a9a40,29-12-2024,2024-12-29 00:54:23.000 UTC,241,24322158,0xCFede447ca3b4885720B5a327e3BFb02078f06e8
0xdc98dbffcc648d6088a2ff8f7dc01aef050e58fc,0x24d0008079bcf2af60ae8b1e6de8d0867a9a1911ebefbfcb369784f6670f1581,30-05-2025,2025-05-30 01:28:33.000 UTC,2744,30889583,0x430C09546ae9249AB75B9A4ef7B5FD9a4006D6f3
0xdc98dbffcc648d6088a2ff8f7dc01aef050e58fc,0x83e59c6cb9e80ba32e946b229e33f3080c09df57e1b2a6cf39c9dcfc73e346d8,24-05-2025,2025-05-24 18:51:25.000 UTC,1058,30661669,0xc3f97660D0b47F0E05C3c513f73eeff7c1bd6c7a
0x38f6d2d9ea493c3c6ee865b5b952b5fe9e3e61fc,0x4627c44be076c3f0b85f9bd7d4968c5aa5d26ac6fd12ec5fc161241f4c730832,05-01-2025,2025-01-05 03:06:29.000 UTC,377,24628521,0x869305781fff479f0311974d55FeeB6Fc9DE96a2
0xdc98dbffcc648d6088a2ff8f7dc01aef050e58fc,0xe4676031fc8379f7f9b71b7426f861c172541b4c4805ddf98ed9f028ee58b81c,09-01-2025,2025-01-09 03:45:23.000 UTC,378,24802488,0xB9E4E0368A9F281584C9adB685e6C9F4b9F37dBb
0x351f61e4c49cf11f24d9f2e737ca5eff81806355,0x574aed14a715aeb1325d7e434a0de99418746331a438ae46ee7ec6b281347616,08-10-2025,2025-10-08 23:22:25.000 UTC,48,36588199,0x0e956C897bBFCbd2155D3DfdD27c87fa5A0FaD39
0xdc98dbffcc648d6088a2ff8f7dc01aef050e58fc,0x21ebbc9b3601074cb322e98151ceb777ed1e954fbf2e5e40f94db610bf593b36,09-01-2025,2025-01-09 10:33:13.000 UTC,338,24814723,0xBDA319Bc7Cc8F0829df39eC0FFF5D1E061FFadf7
0x9eb86e93a809a41ab0e7cc0ba6f62561fda3015c,0xb0d6b37054af7a1c5f8e767aab156370355cdfa95fa64fe5887a8f14c58a5776,16-12-2024,2024-12-16 08:41:31.000 UTC,544,23774572,0xBDA319Bc7Cc8F0829df39eC0FFF5D1E061FFadf7
0xdc98dbffcc648d6088a2ff8f7dc01aef050e58fc,0xc79564213f99fae02521207fe6efceb7271db7cb4957ae34d754442aafa656bd,09-01-2025,2025-01-09 08:25:45.000 UTC,514,24810899,0x0e956C897bBFCbd2155D3DfdD27c87fa5A0FaD39
0x2791dc5e14f7680d9d969acc26059ba56403b6d5,0x1283078430f42a04d7e0afd78a4c999e0757af9e8193fc32d2f25b104c722b67,09-01-2025,2025-01-09 17:44:33.000 UTC,300,24827663,0x0e956C897bBFCbd2155D3DfdD27c87fa5A0FaD39
0x8508fd4238162cb3f3d485f432202af3b40f164e,0x8fab05aba99031d90e545c2f8e25cc94c05c63f376ed9c7e9771958c1e15a160,24-03-2025,2025-03-24 21:46:19.000 UTC,344,28031716,0x2B74B62c564456C48055bd515A62594742b3f545
0x8fd1b615c006ebeb8a7cfb00a1dd809f31943b08,0xa9e847bc3cf916d6bcf566dd54784c2c8eac6f236b693657117d8c200d7bf888,26-12-2024,2024-12-26 12:56:25.000 UTC,307,24214219,0xBDA319Bc7Cc8F0829df39eC0FFF5D1E061FFadf7
0x2791dc5e14f7680d9d969acc26059ba56403b6d5,0x6a663c63020ac527fbde8ee05b020dd33e12e7d3c300daca04497c3742f4d7f8,16-12-2024,2024-12-16 12:21:19.000 UTC,212,23781166,0xBDA319Bc7Cc8F0829df39eC0FFF5D1E061FFadf7
0x9eb86e93a809a41ab0e7cc0ba6f62561fda3015c,0x528e4d6218137d18a671bf6304e87d1a60df96172c119c9ca609a8541987fad2,28-02-2025,2025-02-28 19:40:33.000 UTC,228,26991143,0x6399ed6725cC163D019aA64FF55b22149D7179A8
0x8fd1b615c006ebeb8a7cfb00a1dd809f31943b08,0x18ae4c6b6ce172f9f1de70056999446d053fba32cce3f9b9cb444eef9ac9343a,07-01-2025,2025-01-07 16:10:51.000 UTC,403,24738452,0xB9E4E0368A9F281584C9adB685e6C9F4b9F37dBb
0x9eb86e93a809a41ab0e7cc0ba6f62561fda3015c,0x33b8ff2aedb5ee118046c6e3eac6575458aab5c8a7234519071f430952eb4f62,26-02-2025,2025-02-26 21:41:49.000 UTC,390,26908381,0x6399ed6725cC163D019aA64FF55b22149D7179A8
0x8508fd4238162cb3f3d485f432202af3b40f164e,0xe1a1025efb14848290764d51c042d5145fc2d47fc5654e949631cdc64aae4ce3,19-03-2025,2025-03-19 21:08:31.000 UTC,637,27814582,0x869305781fff479f0311974d55FeeB6Fc9DE96a2
0x8fd1b615c006ebeb8a7cfb00a1dd809f31943b08,0x361334fab40d4198c2ca953ab618331284864816a1acdf6e6af314643e1bbe29,25-12-2024,2024-12-25 02:53:29.000 UTC,327,24152931,0xBDA319Bc7Cc8F0829df39eC0FFF5D1E061FFadf7
0x38f6d2d9ea493c3c6ee865b5b952b5fe9e3e61fc,0x1318943c3dfc13160a48c95f9573902dbcfd4ef3c1daaf76eebca4b5b7e519fc,30-12-2024,2024-12-30 00:43:31.000 UTC,379,24365032,0xCFede447ca3b4885720B5a327e3BFb02078f06e8
0xdc98dbffcc648d6088a2ff8f7dc01aef050e58fc,0xf665cfdaaf189c0058abbd3d78b06843d53425ee03fafce15b308e546162ee77,12-06-2025,2025-06-12 14:17:19.000 UTC,400,31474246,0xc3f97660D0b47F0E05C3c513f73eeff7c1bd6c7a
0x9eb86e93a809a41ab0e7cc0ba6f62561fda3015c,0xfc2cba4c39b5087101f707b0c44ae5da8a37616786e17cd492efe77ecce5129a,09-01-2025,2025-01-09 00:28:19.000 UTC,309,24796576,0xBDA319Bc7Cc8F0829df39eC0FFF5D1E061FFadf7
0x095d0de0ecfd6832f1a7961ae26d285d68655d60,0xcdd8d924a08c5ef7e5a56f2f860e9e62f492bebb9b949336ca41eb3895cc650f,18-04-2025,2025-04-18 15:52:17.000 UTC,258,29101095,0x0e956C897bBFCbd2155D3DfdD27c87fa5A0FaD39
0x2791dc5e14f7680d9d969acc26059ba56403b6d5,0x99d506fd2aa689ff7df1d6f4280be7b39b9030cd74ba09492376fd09f435c054,25-12-2024,2024-12-25 22:45:27.000 UTC,335,24188690,0xBDA319Bc7Cc8F0829df39eC0FFF5D1E061FFadf7
0x095d0de0ecfd6832f1a7961ae26d285d68655d60,0x84b5e794d632ec143930ed8f670405571c826d8a96d19d7b24508f3d3043b28e,17-04-2025,2025-04-17 06:41:09.000 UTC,327,29041361,0x869305781fff479f0311974d55FeeB6Fc9DE96a2
0x9eb86e93a809a41ab0e7cc0ba6f62561fda3015c,0xc8f89e121ef45657903a2345f26d348ece2e641289f611d643cfa519d6f1aa75,02-01-2025,2025-01-02 18:59:39.000 UTC,403,24527516,0xC23924a846eca931Ec3014253E94f15b038bd0C8
0x2791dc5e14f7680d9d969acc26059ba56403b6d5,0xd264a3f0eb3c1206c6843f6a02e522d89cdc3886e08e61db89f083372c1f19d7,09-01-2025,2025-01-09 07:24:33.000 UTC,329,24809063,0x0e956C897bBFCbd2155D3DfdD27c87fa5A0FaD39
0x2791dc5e14f7680d9d969acc26059ba56403b6d5,0xc2d4f8018aae7f536297f56fcb4ea992777dd6b6194a08445a620499511c54a5,26-12-2024,2024-12-26 16:33:51.000 UTC,177,24220742,0xBDA319Bc7Cc8F0829df39eC0FFF5D1E061FFadf7
0x9eb86e93a809a41ab0e7cc0ba6f62561fda3015c,0x1a6bb72b3f172d1edadc1a831af37ec962991698fa139542da36ceb91317d14e,30-12-2024,2024-12-30 02:43:37.000 UTC,643,24368635,0xBDA319Bc7Cc8F0829df39eC0FFF5D1E061FFadf7
0x38f6d2d9ea493c3c6ee865b5b952b5fe9e3e61fc,0x3a0a0e0297328d472db96bf0c86056b7a23890fc2e5f9f45c89673b6483050a5,14-01-2025,2025-01-14 21:08:01.000 UTC,201,25049767,0x869305781fff479f0311974d55FeeB6Fc9DE96a2
0x9eb86e93a809a41ab0e7cc0ba6f62561fda3015c,0x4e5fd6a1500d2c16c761d1bd79ff16031d57a5d2dda1f8a5c94d3e845e0de079,25-02-2025,2025-02-25 21:00:11.000 UTC,201,26863932,0x6399ed6725cC163D019aA64FF55b22149D7179A8
0x38f6d2d9ea493c3c6ee865b5b952b5fe9e3e61fc,0x0ea70ede6c8c3c54123246cfe1f31ba2dbf6048b9e7a680b041c9a5b5defaeb6,02-03-2025,2025-03-02 18:42:17.000 UTC,446,27075795,0x0e956C897bBFCbd2155D3DfdD27c87fa5A0FaD39
0x8508fd4238162cb3f3d485f432202af3b40f164e,0x2131b63a319a54fe1f6eae808a41994f7bdba514564e94b3f778bdaaa3bd6ec3,04-04-2025,2025-04-04 09:22:39.000 UTC,495,28484606,0x2B74B62c564456C48055bd515A62594742b3f545
0x8fd1b615c006ebeb8a7cfb00a1dd809f31943b08,0x5b1d2a591bd2cdb1ff2b5941180648e7235fae2bc79f3299b0e6ff543a210f75,27-12-2024,2024-12-27 15:32:41.000 UTC,512,24262107,0xBDA319Bc7Cc8F0829df39eC0FFF5D1E061FFadf7
0x8810de2baa17067ddcfbd9e8f29c55f070a55f0b,0x7fe7491c96c8600ebbd38cf27a7c43a25fdc9d66cb043b8af6d9872fbca9fd6b,07-04-2025,2025-04-07 04:58:29.000 UTC,331,28606281,0x0e956C897bBFCbd2155D3DfdD27c87fa5A0FaD39
0xdc98dbffcc648d6088a2ff8f7dc01aef050e58fc,0xabc65cdebdf450432b701f4f9275113d28fc8a234f143e2bf6250edf439d3115,04-01-2025,2025-01-04 16:02:11.000 UTC,488,24608592,0xBDA319Bc7Cc8F0829df39eC0FFF5D1E061FFadf7
0x9eb86e93a809a41ab0e7cc0ba6f62561fda3015c,0x189befe52d68936996800d98c5d1f4655437156b5c161ce39baf09f4561f9f1f,09-01-2025,2025-01-09 11:38:53.000 UTC,509,24816693,0xB9E4E0368A9F281584C9adB685e6C9F4b9F37dBb
0x8fd1b615c006ebeb8a7cfb00a1dd809f31943b08,0x98402c59bd4753cde1288b3b9706394bde00e81a5732fa7057b00bcb1da2b5b7,27-12-2024,2024-12-27 07:22:25.000 UTC,382,24247399,0xBDA319Bc7Cc8F0829df39eC0FFF5D1E061FFadf7
0x9eb86e93a809a41ab0e7cc0ba6f62561fda3015c,0x6e582ccacf605d3455067f7b1b2806598e7764a8dc65aa351f46153beb3e1047,27-02-2025,2025-02-27 05:18:25.000 UTC,356,26922079,0x6399ed6725cC163D019aA64FF55b22149D7179A8
0x9eb86e93a809a41ab0e7cc0ba6f62561fda3015c,0x6251a72585f6e834c68d3948cabf28e1fba2d9c3fc673a90b1f125d73936e28a,15-07-2025,2025-07-15 12:59:23.000 UTC,1675,32897508,0xCFede447ca3b4885720B5a327e3BFb02078f06e8
0x9eb86e93a809a41ab0e7cc0ba6f62561fda3015c,0x5a2f9e092e345e9e4fad39020f4016658c6e50c5296c5d50998b01a00c737621,01-01-2025,2025-01-01 07:37:55.000 UTC,272,24463864,0xBDA319Bc7Cc8F0829df39eC0FFF5D1E061FFadf7
0x38f6d2d9ea493c3c6ee865b5b952b5fe9e3e61fc,0x5e2312fcd0d2cceeaa15c8e4392c4b783644a97bfa85cfd4e030f13e51ea692d,15-12-2024,2024-12-15 03:41:41.000 UTC,267,23722377,0x0e956C897bBFCbd2155D3DfdD27c87fa5A0FaD39
0x9eb86e93a809a41ab0e7cc0ba6f62561fda3015c,0x0bed23a089b36831f0c6283d0ff483740d47858237751ab844b1aacd3a19d49d,03-02-2025,2025-02-03 04:40:31.000 UTC,245,25884142,0x0e956C897bBFCbd2155D3DfdD27c87fa5A0FaD39
0x38f6d2d9ea493c3c6ee865b5b952b5fe9e3e61fc,0x8a4eb24107fbdd267fb530b325a09df9b80b2e0169d497c45d7625cc7fd54a36,02-01-2025,2025-01-02 12:27:37.000 UTC,403,24515755,0xBDA319Bc7Cc8F0829df39eC0FFF5D1E061FFadf7
0x2791dc5e14f7680d9d969acc26059ba56403b6d5,0x797f802f0b1333a4907f1fe1982e8087f82ba7ae572250c6bf4d6c6802cc35cf,18-12-2024,2024-12-18 11:02:11.000 UTC,292,23865192,0xBDA319Bc7Cc8F0829df39eC0FFF5D1E061FFadf7
0x2791dc5e14f7680d9d969acc26059ba56403b6d5,0xb62d9820a990c31b088f8db520ef5f6727691ecffe7bde9f90479757965cafce,06-01-2025,2025-01-06 20:36:19.000 UTC,829,24703216,0xB9E4E0368A9F281584C9adB685e6C9F4b9F37dBb
0x38f6d2d9ea493c3c6ee865b5b952b5fe9e3e61fc,0x6377b68fb606c79e142e3e146a4f695200d34f7a1a04ec7412faa0c6fd556476,08-12-2024,2024-12-08 19:22:25.000 UTC,762,23448199,0x0e956C897bBFCbd2155D3DfdD27c87fa5A0FaD39
0x38f6d2d9ea493c3c6ee865b5b952b5fe9e3e61fc,0x7d8ad2dd0d356752d18e73bce9533cbfe971d446d31c946b421cb7c48b6b0207,12-01-2025,2025-01-12 17:19:17.000 UTC,138,24956505,0xBDA319Bc7Cc8F0829df39eC0FFF5D1E061FFadf7
0x38f6d2d9ea493c3c6ee865b5b952b5fe9e3e61fc,0x3ab401eaeebcef0f272dfa3812251272203c3466fd76e5d9c50bcb2c1194fcc4,30-12-2024,2024-12-30 13:57:35.000 UTC,466,24388854,0xCFede447ca3b4885720B5a327e3BFb02078f06e8
0x2791dc5e14f7680d9d969acc26059ba56403b6d5,0xd92ff14d5afa34b6295dfd252ffb2b946ea8719bbb0120ba0ef9040ac10c04ae,05-07-2025,2025-07-05 16:47:59.000 UTC,338,32472366,0xCFede447ca3b4885720B5a327e3BFb02078f06e8
0x095d0de0ecfd6832f1a7961ae26d285d68655d60,0x415d376e961cd208cd89cac0ee2defa892037ba86b28c5345f8147ca00a3ee8a,23-04-2025,2025-04-23 12:33:39.000 UTC,886,29311136,0x869305781fff479f0311974d55FeeB6Fc9DE96a2
0x2791dc5e14f7680d9d969acc26059ba56403b6d5,0x0ff266af8eb962d91cc078b2e5f83e6ecc0de4b9394b04e726a847d235c042bf,11-01-2025,2025-01-11 14:05:03.000 UTC,241,24907478,0x869305781fff479f0311974d55FeeB6Fc9DE96a2
0x2791dc5e14f7680d9d969acc26059ba56403b6d5,0xd616034f95ee0c4d015e2b6dd401a9dd21274a6b96bf051d5816b0a89ce7f99c,18-01-2025,2025-01-18 21:04:27.000 UTC,499,25222460,0xB9E4E0368A9F281584C9adB685e6C9F4b9F37dBb
0x9eb86e93a809a41ab0e7cc0ba6f62561fda3015c,0xc748cdf9120d4fa3ab1b999aec1ee358a7f6d292e4b25dce57e30878c74b7dfa,14-12-2024,2024-12-14 19:47:43.000 UTC,243,23708158,0xBDA319Bc7Cc8F0829df39eC0FFF5D1E061FFadf7
0x2791dc5e14f7680d9d969acc26059ba56403b6d5,0xaa8852ab95d6da726f49ca0af6ea033bbd29912fa12d15a5cc06bfdb394e4bba,13-01-2025,2025-01-13 00:48:21.000 UTC,470,24969977,0xB9E4E0368A9F281584C9adB685e6C9F4b9F37dBb
0x9eb86e93a809a41ab0e7cc0ba6f62561fda3015c,0xe7c89af61e0ef326ee6b13eb5a02d81936cfd0932d6ea3bc2f52c927f9ff36e2,05-02-2025,2025-02-05 00:14:03.000 UTC,319,25962548,0xCFede447ca3b4885720B5a327e3BFb02078f06e8
0xdc98dbffcc648d6088a2ff8f7dc01aef050e58fc,0xefa56e7a09c2c68525afd4192f920f3e93c122bda2d6f68bb291ea6cb10f62f2,01-06-2025,2025-06-01 04:56:23.000 UTC,55,30982218,0xc3f97660D0b47F0E05C3c513f73eeff7c1bd6c7a
0x38f6d2d9ea493c3c6ee865b5b952b5fe9e3e61fc,0x2bf04ed9364891f553e721fff936b3242d0ba48dea582e54401008be312cb6a9,20-12-2024,2024-12-20 13:47:23.000 UTC,439,23956548,0xCFede447ca3b4885720B5a327e3BFb02078f06e8
0xdc98dbffcc648d6088a2ff8f7dc01aef050e58fc,0x5d7993245a8be3965d902da156ba95fc0ae849bc2a54c0936fd2a78718544c53,05-01-2025,2025-01-05 05:42:01.000 UTC,281,24633187,0x0e956C897bBFCbd2155D3DfdD27c87fa5A0FaD39
0x2791dc5e14f7680d9d969acc26059ba56403b6d5,0xb3321b735442b7c000d5ea05b9ff60a6cc8fb8d1e6f623e71ebb4f32fe5d9042,05-01-2025,2025-01-05 03:46:29.000 UTC,635,24629721,0x0e956C897bBFCbd2155D3DfdD27c87fa5A0FaD39
0x38f6d2d9ea493c3c6ee865b5b952b5fe9e3e61fc,0xc8247b391b9aa8048c09c7aadf5e4280ef0c7e31b482a5d9d8939c62e3f2f45d,21-12-2024,2024-12-21 00:40:33.000 UTC,430,23976143,0xCFede447ca3b4885720B5a327e3BFb02078f06e8
0x2791dc5e14f7680d9d969acc26059ba56403b6d5,0x13d6e0ab6a71bc3115ed4f4659ba9f3810ebc6ed748df5e8b59f800642efcf82,12-12-2024,2024-12-12 12:20:13.000 UTC,372,23608333,0xBDA319Bc7Cc8F0829df39eC0FFF5D1E061FFadf7
0x38f6d2d9ea493c3c6ee865b5b952b5fe9e3e61fc,0x392a17f16b5542772c0d52d56cbe63a2d59b25e6cc79283824e8839e4d2abd09,13-01-2025,2025-01-13 06:30:19.000 UTC,256,24980236,0xf2c38dE50A250C0060fB45eBE4504B67f6F1be3C
0x38f6d2d9ea493c3c6ee865b5b952b5fe9e3e61fc,0x3553a5f0581a9cd65a4ce89265a496f3408c103ced9d198aba0c5f60196659eb,23-05-2025,2025-05-23 00:40:19.000 UTC,1037,30585736,0xc3f97660D0b47F0E05C3c513f73eeff7c1bd6c7a
0x8508fd4238162cb3f3d485f432202af3b40f164e,0x155129055b63283243401e24823068bab3114e94e479ff215caed8e64a7d5a26,05-06-2025,2025-06-05 15:45:23.000 UTC,844,31174488,0xc3f97660D0b47F0E05C3c513f73eeff7c1bd6c7a
0x2791dc5e14f7680d9d969acc26059ba56403b6d5,0xae3128f93baa44fa8b3d2535702895132b92be0ad1d7b259a38bcd23fca631de,14-06-2025,2025-06-14 18:09:41.000 UTC,583,31567617,0xCFede447ca3b4885720B5a327e3BFb02078f06e8
0x095d0de0ecfd6832f1a7961ae26d285d68655d60,0x0ba85d90ef4823c9d90d5235fe0fa928a52e1a316aa7a70fbb9bbf63b91175dc,07-02-2025,2025-02-07 22:55:41.000 UTC,295,26089797,0x0e956C897bBFCbd2155D3DfdD27c87fa5A0FaD39
0xdc98dbffcc648d6088a2ff8f7dc01aef050e58fc,0x1a00ad8c58c3d5ad62e2f8602c9a7d648cef4fe822103216154b1c8e4dacea58,09-01-2025,2025-01-09 06:20:21.000 UTC,486,24807137,0xCFede447ca3b4885720B5a327e3BFb02078f06e8
0xdc98dbffcc648d6088a2ff8f7dc01aef050e58fc,0x9deb53bef6ce14e27c285ee4b5eb5cef9da23c9c99593a7fa26efaa32d2e8a7d,01-06-2025,2025-06-01 22:40:45.000 UTC,392,31014149,0xc3f97660D0b47F0E05C3c513f73eeff7c1bd6c7a
0x9eb86e93a809a41ab0e7cc0ba6f62561fda3015c,0x6692883a3902351e243c5e5053295afa4d56d93984a6239b21f0cab760606fb4,20-12-2024,2024-12-20 23:26:31.000 UTC,319,23973922,0xBDA319Bc7Cc8F0829df39eC0FFF5D1E061FFadf7
0x8fd1b615c006ebeb8a7cfb00a1dd809f31943b08,0x4b5e901d780602e4fb09e55efa5b21b4729642691d77b3f751e4609819f0945a,08-12-2024,2024-12-08 06:40:03.000 UTC,510,23425328,0x0e956C897bBFCbd2155D3DfdD27c87fa5A0FaD39
0x9eb86e93a809a41ab0e7cc0ba6f62561fda3015c,0xc6c0f069db435111b238018c581e57875ee1898811cb835cd6379b2032ab6b36,01-02-2025,2025-02-01 00:21:53.000 UTC,374,25789983,0x0e956C897bBFCbd2155D3DfdD27c87fa5A0FaD39
0x8fd1b615c006ebeb8a7cfb00a1dd809f31943b08,0x9bf021870920ed9718ec64a60f90968b1b696d0dfc3136aa6f94c8267db52ea5,09-06-2025,2025-06-09 02:18:19.000 UTC,368,31323076,0xf2c38dE50A250C0060fB45eBE4504B67f6F1be3C
0x38f6d2d9ea493c3c6ee865b5b952b5fe9e3e61fc,0xea0d7078b06e433d3e87230afa49e660887e6c1c7045db2d68b2701622005426,05-01-2025,2025-01-05 17:51:17.000 UTC,269,24655065,0xBDA319Bc7Cc8F0829df39eC0FFF5D1E061FFadf7
0x9eb86e93a809a41ab0e7cc0ba6f62561fda3015c,0xfd0c6cbb959651c3709f4bb49022658c2b48afe059531d98062ef41d8b2cd87a,07-01-2025,2025-01-07 21:23:15.000 UTC,1402,24747824,0xBDA319Bc7Cc8F0829df39eC0FFF5D1E061FFadf7
0x2791dc5e14f7680d9d969acc26059ba56403b6d5,0x74b16123d07df53ad9ae0294d682cbf78f55b3a24ce583bff3195fe90737b062,14-01-2025,2025-01-14 20:47:07.000 UTC,167,25049140,0x0e956C897bBFCbd2155D3DfdD27c87fa5A0FaD39
0xdc98dbffcc648d6088a2ff8f7dc01aef050e58fc,0xbe61281d51eafd986acd0c2756bacf84a2c597d49035aa53709647b5aba87f45,07-06-2025,2025-06-07 02:20:03.000 UTC,1010,31236728,0xc3f97660D0b47F0E05C3c513f73eeff7c1bd6c7a
0x9eb86e93a809a41ab0e7cc0ba6f62561fda3015c,0x2f376c595adf5eabaf7239724618f87c4ea06f58b7e7198795ab5331a4c5c5dc,12-12-2024,2024-12-12 02:21:43.000 UTC,240,23590378,0xBDA319Bc7Cc8F0829df39eC0FFF5D1E061FFadf7
0x38f6d2d9ea493c3c6ee865b5b952b5fe9e3e61fc,0xa75c5c47586393e329ed16da971ac63ab29cab07e66d8b703367ade60f65641d,20-01-2025,2025-01-20 06:13:59.000 UTC,386,25282146,0xB9E4E0368A9F281584C9adB685e6C9F4b9F37dBb
0x38f6d2d9ea493c3c6ee865b5b952b5fe9e3e61fc,0xa3b8cb368bee1ddca7d809e559a6c769b3159094d0da1655c06befdd8b4495b9,16-12-2024,2024-12-16 08:07:19.000 UTC,207,23773546,0xCFede447ca3b4885720B5a327e3BFb02078f06e8
0x38f6d2d9ea493c3c6ee865b5b952b5fe9e3e61fc,0x31e1ee692aecac0b6e112d0eb5321ca5b48baf5cab67f4ed1a4b4e2681cff3de,01-01-2025,2025-01-01 22:38:07.000 UTC,533,24490870,0x869305781fff479f0311974d55FeeB6Fc9DE96a2
0x2791dc5e14f7680d9d969acc26059ba56403b6d5,0x5823f481a07829cf554041dcc919e589ccfd00d93e5456d1c502454fb59f103c,16-01-2025,2025-01-16 23:23:45.000 UTC,226,25140239,0xf2c38dE50A250C0060fB45eBE4504B67f6F1be3C
0x8fd1b615c006ebeb8a7cfb00a1dd809f31943b08,0x3fd70254cd3eac01ae2072c24040440868ecb320e5a743cfa85489838ec9295e,05-01-2025,2025-01-05 20:05:55.000 UTC,293,24659104,0xAfabcBbab5e4261B1d655c906738176191819164
0x9eb86e93a809a41ab0e7cc0ba6f62561fda3015c,0x55586822d8ec8453a49217a31a0fdebc7bf9527e0693ea74b9c8ab9cd64c696a,02-01-2025,2025-01-02 08:50:27.000 UTC,358,24509240,0x869305781fff479f0311974d55FeeB6Fc9DE96a2
0x2791dc5e14f7680d9d969acc26059ba56403b6d5,0x5163078b6e075d43a309abe53826830c5be60dc1119349d5c57225c1ac3e653b,04-01-2025,2025-01-04 05:57:09.000 UTC,158,24590441,0xBDA319Bc7Cc8F0829df39eC0FFF5D1E061FFadf7
0xdc98dbffcc648d6088a2ff8f7dc01aef050e58fc,0x5ae5389dbf88395fafb07d2bc07ee14c875b4e2ba938cf464621f0198011df62,16-01-2025,2025-01-16 13:27:19.000 UTC,252,25122346,0xBDA319Bc7Cc8F0829df39eC0FFF5D1E061FFadf7
0x2791dc5e14f7680d9d969acc26059ba56403b6d5,0xd0934e8704895a056cc18083f2baef0f6b3532d890ae63f2f06cd8d9762bfbbb,10-01-2025,2025-01-10 12:38:37.000 UTC,395,24861685,0xBDA319Bc7Cc8F0829df39eC0FFF5D1E061FFadf7
0x8508fd4238162cb3f3d485f432202af3b40f164e,0xff91e17b33701bd424c1108dcabe4a70e283dd109587d4aef1b8af48271690a9,01-06-2025,2025-06-01 01:45:55.000 UTC,1646,30976504,0xc3f97660D0b47F0E05C3c513f73eeff7c1bd6c7a
0x9eb86e93a809a41ab0e7cc0ba6f62561fda3015c,0xdfd5f02e416390c4a55ac8dda0375f8e794daed39d09aba3f3291706bd695ff7,24-12-2024,2024-12-24 12:47:03.000 UTC,851,24127538,0xBDA319Bc7Cc8F0829df39eC0FFF5D1E061FFadf7
0x8fd1b615c006ebeb8a7cfb00a1dd809f31943b08,0xdd4070b20d6e906fe6fbbde1d52da4809068f5ef966c69f42f42b8b2565654b0,16-12-2024,2024-12-16 17:40:05.000 UTC,599,23790729,0xCFede447ca3b4885720B5a327e3BFb02078f06e8
0x9eb86e93a809a41ab0e7cc0ba6f62561fda3015c,0x196205456b0cd4c5489c7f818f4547898836660ad463a9f212ac8b1a96767e08,16-12-2024,2024-12-16 01:45:47.000 UTC,308,23762100,0xBDA319Bc7Cc8F0829df39eC0FFF5D1E061FFadf7
0x9eb86e93a809a41ab0e7cc0ba6f62561fda3015c,0x4691d8a7253bcbcaad8bbf57014232db697eaf4fa0192495b4b75025b031c0ea,06-01-2025,2025-01-06 15:08:31.000 UTC,542,24693382,0xC23924a846eca931Ec3014253E94f15b038bd0C8
0x8508fd4238162cb3f3d485f432202af3b40f164e,0xa16c1985dc4f6d3a6307273483cbc9eab59681bfb096e0082230631a442fa1c0,02-06-2025,2025-06-02 22:28:43.000 UTC,818,31056988,0xc3f97660D0b47F0E05C3c513f73eeff7c1bd6c7a
0x2791dc5e14f7680d9d969acc26059ba56403b6d5,0x23971d423ef4533e9325db30a053e99c7b5d4d06167326483d16b3a1082a7346,02-01-2025,2025-01-02 13:35:27.000 UTC,341,24517790,0x869305781fff479f0311974d55FeeB6Fc9DE96a2
0x8fd1b615c006ebeb8a7cfb00a1dd809f31943b08,0xe63cc5a7a9dc3737cf9e0d809e6e9ef645f419f502f18833297a71500eeb7902,01-01-2025,2025-01-01 17:18:41.000 UTC,291,24481287,0xBDA319Bc7Cc8F0829df39eC0FFF5D1E061FFadf7
0x8508fd4238162cb3f3d485f432202af3b40f164e,0x14a2690db50505ea2c155efd20430174a4aaa7bcf3d9d52f493a44a28e4cd419,07-04-2025,2025-04-07 12:18:07.000 UTC,204,28619470,0x2B74B62c564456C48055bd515A62594742b3f545
0xdc98dbffcc648d6088a2ff8f7dc01aef050e58fc,0xb94a20dd27bb15071fab710860b3a752d2bde6c49a17972efece0e29d7932957,08-01-2025,2025-01-08 12:18:57.000 UTC,1089,24774695,0x0e956C897bBFCbd2155D3DfdD27c87fa5A0FaD39
0x8fd1b615c006ebeb8a7cfb00a1dd809f31943b08,0xd64ed1309d8ce6ca89690f2dae4f25ad85f310d1492e24598b4e9dbdef45511d,29-12-2024,2024-12-29 21:50:59.000 UTC,336,24359856,0xBDA319Bc7Cc8F0829df39eC0FFF5D1E061FFadf7
0x2791dc5e14f7680d9d969acc26059ba56403b6d5,0x37bf2e81cfb4892078527cbdf58bfc9189d8049775ab3e8d66f43bfe7808828b,18-01-2025,2025-01-18 08:36:07.000 UTC,304,25200010,0x0e956C897bBFCbd2155D3DfdD27c87fa5A0FaD39
0x8fd1b615c006ebeb8a7cfb00a1dd809f31943b08,0xce7eecd45491df2835a8e1d5d60fbd9b4dc1b8851f0c749b0a69030c53b6af37,06-01-2025,2025-01-06 07:05:13.000 UTC,582,24678883,0xBDA319Bc7Cc8F0829df39eC0FFF5D1E061FFadf7
0x9eb86e93a809a41ab0e7cc0ba6f62561fda3015c,0xc4057488dfe0ad9c23a55faa4fca97cdb7ad3e651247d3d84a8d456e08b6703e,06-06-2025,2025-06-06 07:15:27.000 UTC,408,31202390,0xc3f97660D0b47F0E05C3c513f73eeff7c1bd6c7a
0x8508fd4238162cb3f3d485f432202af3b40f164e,0xc7a228a59eea78be2535269c0012b7ed26d0fd72f716ac11284ccf9dd9a85ff4,10-06-2025,2025-06-10 16:37:51.000 UTC,342,31392062,0xc3f97660D0b47F0E05C3c513f73eeff7c1bd6c7a
0x9eb86e93a809a41ab0e7cc0ba6f62561fda3015c,0x25fd337a0a34b5f6c3078c1eac74db8b3ef105f2e2eee6d729731fc10e31348e,17-02-2025,2025-02-17 00:57:57.000 UTC,127,26482265,0x6399ed6725cC163D019aA64FF55b22149D7179A8
0x8508fd4238162cb3f3d485f432202af3b40f164e,0xc8c9f5575701d70ab85dd1932f1eb93b7d1e4ecdbc782b3abc72ff1640338a13,06-05-2025,2025-05-06 18:20:07.000 UTC,436,29883130,0x6205DfbE68444cFF504A20a712cEa794c6b6Cf04
0x2791dc5e14f7680d9d969acc26059ba56403b6d5,0xcffe8e924f641ef21718d543dc5bb243dd6e0d8da562fd383c668738065df376,24-12-2024,2024-12-24 18:09:31.000 UTC,211,24137212,0xBDA319Bc7Cc8F0829df39eC0FFF5D1E061FFadf7
0xdc98dbffcc648d6088a2ff8f7dc01aef050e58fc,0x0ac68f710add34fc3c59882e4b4f7f2a41d1e4334d61973062b9fbe21dcc3c88,15-12-2024,2024-12-15 19:22:51.000 UTC,464,23750612,0xBDA319Bc7Cc8F0829df39eC0FFF5D1E061FFadf7
0x38f6d2d9ea493c3c6ee865b5b952b5fe9e3e61fc,0xd24088cb468726d44a387b01b367706f84a1696ba48159338bf057aa45bb4bcc,24-05-2025,2025-05-24 12:31:53.000 UTC,442,30650283,0xc3f97660D0b47F0E05C3c513f73eeff7c1bd6c7a
0x8508fd4238162cb3f3d485f432202af3b40f164e,0xaceceb7539e9ee207e54d7840ced371b6b9d0cff2e8d107dcc9bfb1b34a2ebb7,11-05-2025,2025-05-11 05:18:17.000 UTC,65,30075675,0xCFede447ca3b4885720B5a327e3BFb02078f06e8
0xdc98dbffcc648d6088a2ff8f7dc01aef050e58fc,0xc073cfac8015589f7b027f2804800a4682e7353a132abd5780e75f4b58db4d02,21-06-2025,2025-06-21 12:30:01.000 UTC,680,31859827,0x430C09546ae9249AB75B9A4ef7B5FD9a4006D6f3
0x8fd1b615c006ebeb8a7cfb00a1dd809f31943b08,0x9e4c20233491598499cc0aa5dbd5f2bfa8895440477e0a5667f0a1c88ec2559b,10-05-2025,2025-05-10 05:22:53.000 UTC,528,30032613,0x0e956C897bBFCbd2155D3DfdD27c87fa5A0FaD39
0x2791dc5e14f7680d9d969acc26059ba56403b6d5,0x0c40c3f1466bd073a5437545add3a0ba5a922d571409337b2ca74f798f7bbfcc,12-01-2025,2025-01-12 13:00:05.000 UTC,383,24948729,0xBDA319Bc7Cc8F0829df39eC0FFF5D1E061FFadf7
0x38f6d2d9ea493c3c6ee865b5b952b5fe9e3e61fc,0x1e68aa3121a4bec6a5aaea559cc934b9fa64037d99fab801febdcaa563ca1440,14-07-2025,2025-07-14 08:29:55.000 UTC,205,32846224,0xc3f97660D0b47F0E05C3c513f73eeff7c1bd6c7a
0x2791dc5e14f7680d9d969acc26059ba56403b6d5,0x980260e72e6a2093652f607eb643e7517d367824b6ccb79a78786fab738deb0f,14-12-2024,2024-12-14 05:39:25.000 UTC,239,23682709,0xBDA319Bc7Cc8F0829df39eC0FFF5D1E061FFadf7
0x9eb86e93a809a41ab0e7cc0ba6f62561fda3015c,0x3e8c54b467bd42b551d3f67eb6bdf180db7c6c604f3e30a5727f36242556e362,04-01-2025,2025-01-04 09:27:55.000 UTC,235,24596764,0xBDA319Bc7Cc8F0829df39eC0FFF5D1E061FFadf7
0x8fd1b615c006ebeb8a7cfb00a1dd809f31943b08,0x8d9217d1bd71f6864c2f937fc2b2640db9a96c61d45fa3ad3d580746772587de,01-01-2025,2025-01-01 16:13:13.000 UTC,518,24479323,0xAfabcBbab5e4261B1d655c906738176191819164
0x2791dc5e14f7680d9d969acc26059ba56403b6d5,0x863ce287c95080d3a1e4a0b0c42c6f6534c33d0447617d2e23d10b0befbc83c1,05-01-2025,2025-01-05 08:24:53.000 UTC,679,24638073,0x0e956C897bBFCbd2155D3DfdD27c87fa5A0FaD39
0x2791dc5e14f7680d9d969acc26059ba56403b6d5,0x185e53aa8a23078b65f9017e33091e0d9c84b5069dbedc1e804b9bc4ce04424b,04-01-2025,2025-01-04 05:38:21.000 UTC,806,24589877,0x0e956C897bBFCbd2155D3DfdD27c87fa5A0FaD39
0xdc98dbffcc648d6088a2ff8f7dc01aef050e58fc,0x97821559687e67bf3f172f8693094869607140bc716fc52d4a557761ea9f451d,01-01-2025,2025-01-01 21:36:55.000 UTC,275,24489034,0x0e956C897bBFCbd2155D3DfdD27c87fa5A0FaD39
0x095d0de0ecfd6832f1a7961ae26d285d68655d60,0x1e4d45c2dcc12d2ce78817d63a1e48240d14ac69f331ae6526933b50aa3a23e6,13-05-2025,2025-05-13 05:50:23.000 UTC,36,30163038,0xf2c38dE50A250C0060fB45eBE4504B67f6F1be3C
0x9eb86e93a809a41ab0e7cc0ba6f62561fda3015c,0xcdb461ed5df75fab686eae3542a1ecf12fc5a4730dbe259c0028a1616d7673ec,19-12-2024,2024-12-19 11:21:27.000 UTC,414,23908970,0xBDA319Bc7Cc8F0829df39eC0FFF5D1E061FFadf7
0x095d0de0ecfd6832f1a7961ae26d285d68655d60,0xc9873f54249ccca20586bdb7e7133ed3057e21d110b0381ebcab6feb7502182f,22-01-2025,2025-01-22 04:48:37.000 UTC,206,25365985,0x0e956C897bBFCbd2155D3DfdD27c87fa5A0FaD39
0x38f6d2d9ea493c3c6ee865b5b952b5fe9e3e61fc,0xaaa1bc752702dc06cdea8f3d295adcd02450e1e376cc7435e39fe5a86aea841c,18-07-2025,2025-07-18 04:56:15.000 UTC,408,33012614,0xf2c38dE50A250C0060fB45eBE4504B67f6F1be3C
0x351f61e4c49cf11f24d9f2e737ca5eff81806355,0x54473b0152d1a355830447968cfb1e4d059211292939176b2ca1f796e632b2e7,05-06-2025,2025-06-05 00:24:49.000 UTC,383,31146871,0x0e956C897bBFCbd2155D3DfdD27c87fa5A0FaD39
0x38f6d2d9ea493c3c6ee865b5b952b5fe9e3e61fc,0xe0c7d5ccb0623b5e1bc204c2470b11a816d1e51b1fb12a607ef793c2db829fbc,03-06-2025,2025-06-03 04:13:39.000 UTC,281,31067336,0xc3f97660D0b47F0E05C3c513f73eeff7c1bd6c7a
0x2791dc5e14f7680d9d969acc26059ba56403b6d5,0xd6c93fdd62501cbc02a93dddc4a0f3afb2d54ba1fb761d0a8e5f02a080919260,16-12-2024,2024-12-16 11:31:43.000 UTC,329,23779678,0xBDA319Bc7Cc8F0829df39eC0FFF5D1E061FFadf7
0xdc98dbffcc648d6088a2ff8f7dc01aef050e58fc,0x015ac17630e783d08bfd30c0198b573827c2c498cdc1992604a1ee7a152bb26d,14-01-2025,2025-01-14 04:22:33.000 UTC,250,25019603,0xBDA319Bc7Cc8F0829df39eC0FFF5D1E061FFadf7
0x8fd1b615c006ebeb8a7cfb00a1dd809f31943b08,0xc80ecfc6c991d13c343cde4467d5b16fcee11138403f4dd33214c92b3c8cc093,16-12-2024,2024-12-16 01:56:09.000 UTC,133,23762411,0xBDA319Bc7Cc8F0829df39eC0FFF5D1E061FFadf7
0x8fd1b615c006ebeb8a7cfb00a1dd809f31943b08,0xaaa5114d11466f48e05b56ee8dc9b62685bfdee087266349f4c4302ebc6959b4,03-01-2025,2025-01-03 14:23:59.000 UTC,416,24562446,0xBDA319Bc7Cc8F0829df39eC0FFF5D1E061FFadf7
0x38f6d2d9ea493c3c6ee865b5b952b5fe9e3e61fc,0x77c1cf6f391969afc6a68cedb327ffcdfaeebd93f3584492bed9223040c1e5d2,04-01-2025,2025-01-04 18:17:53.000 UTC,290,24612663,0xBDA319Bc7Cc8F0829df39eC0FFF5D1E061FFadf7
0x8508fd4238162cb3f3d485f432202af3b40f164e,0x52f2d73cab1e34bdb3f752fa9b6f35b4a6e776820903fd9d092e1ec06692e34c,27-05-2025,2025-05-27 09:05:27.000 UTC,626,30773690,0xc3f97660D0b47F0E05C3c513f73eeff7c1bd6c7a
0x095d0de0ecfd6832f1a7961ae26d285d68655d60,0x49d2ae0b8b5ddb2a0ca512dd7855a17cabef653a3156f6cbde71aa589834ac1c,01-03-2025,2025-03-01 19:29:39.000 UTC,698,27034016,0x0e956C897bBFCbd2155D3DfdD27c87fa5A0FaD39
0x9eb86e93a809a41ab0e7cc0ba6f62561fda3015c,0x00d5b73a5fc0772438c6422fc157fb844b34b66c1f64be16bb1385f00d524620,15-12-2024,2024-12-15 13:43:15.000 UTC,167,23740424,0xCFede447ca3b4885720B5a327e3BFb02078f06e8
0x2791dc5e14f7680d9d969acc26059ba56403b6d5,0x2d75ae208956b352e2e2050f0f9141edfc6eb13a43488ce2d11422814a584451,09-01-2025,2025-01-09 04:27:09.000 UTC,388,24803741,0xBDA319Bc7Cc8F0829df39eC0FFF5D1E061FFadf7
0x9eb86e93a809a41ab0e7cc0ba6f62561fda3015c,0xd8b1659cff0fe83bd63bf9962973c3d671e4490db8091a920b89052040b866f3,07-01-2025,2025-01-07 00:20:23.000 UTC,380,24709938,0xBDA319Bc7Cc8F0829df39eC0FFF5D1E061FFadf7
0xdc98dbffcc648d6088a2ff8f7dc01aef050e58fc,0xe9a512a8e10cf73dae9bf0ed5e9c1cd592e11488e78a569f33cb6960284ee41e,05-01-2025,2025-01-05 08:44:47.000 UTC,281,24638670,0xBDA319Bc7Cc8F0829df39eC0FFF5D1E061FFadf7
0x351f61e4c49cf11f24d9f2e737ca5eff81806355,0x54f99347ceb1d4b955337e2b5c42cc258219348a2afb5bd2d195a668b89a33fe,10-08-2025,2025-08-10 06:59:47.000 UTC,1223,34009920,0x0e956C897bBFCbd2155D3DfdD27c87fa5A0FaD39
0x8508fd4238162cb3f3d485f432202af3b40f164e,0xac75f0331b8bdde29a0b33543dc6f7dd3845c64ced822c1b532fca6cdbdf341d,01-04-2025,2025-04-01 22:25:09.000 UTC,109,28378481,0x6205DfbE68444cFF504A20a712cEa794c6b6Cf04
0x9eb86e93a809a41ab0e7cc0ba6f62561fda3015c,0xf6c03fb16fe09ee580f5cc93a6607ea5985620b6d37c3db8ad6a75625e5c957f,01-06-2025,2025-06-01 04:33:25.000 UTC,279,30981529,0xc3f97660D0b47F0E05C3c513f73eeff7c1bd6c7a
0x2791dc5e14f7680d9d969acc26059ba56403b6d5,0x9c2e0501231fc2d96b8a97af90d5939390c43cde77ca0d252ffc986af63014b3,08-01-2025,2025-01-08 23:06:59.000 UTC,177,24794136,0xBDA319Bc7Cc8F0829df39eC0FFF5D1E061FFadf7
0x2791dc5e14f7680d9d969acc26059ba56403b6d5,0x226cb3cc78dff876e7eb0a0f6189e15a6b6bd26c0fb92766445da80e1d049904,07-01-2025,2025-01-07 21:22:03.000 UTC,311,24747788,0xBDA319Bc7Cc8F0829df39eC0FFF5D1E061FFadf7
0x8fd1b615c006ebeb8a7cfb00a1dd809f31943b08,0x9cffd112b48b7f8f254f5ccdda1c45a0f41074a95175f5186dc6fa5071d68262,28-12-2024,2024-12-28 05:46:07.000 UTC,1013,24287710,0xBDA319Bc7Cc8F0829df39eC0FFF5D1E061FFadf7
0x9eb86e93a809a41ab0e7cc0ba6f62561fda3015c,0x643dc450ed7ea4e22544368fd876db251f4ee90870603c6362924498d724164a,14-12-2024,2024-12-14 15:53:39.000 UTC,229,23701136,0xCFede447ca3b4885720B5a327e3BFb02078f06e8
0x2791dc5e14f7680d9d969acc26059ba56403b6d5,0xd688f34396454b91709c4c46ae9f94e255552982e94200e44d8e0ed2da668efb,14-12-2024,2024-12-14 12:59:39.000 UTC,270,23695916,0xBDA319Bc7Cc8F0829df39eC0FFF5D1E061FFadf7
0x38f6d2d9ea493c3c6ee865b5b952b5fe9e3e61fc,0xa31e0a24acfa3f6a89bda6aff173e6a7178a6ac0894127552384af38bfa2503a,31-05-2025,2025-05-31 11:53:21.000 UTC,570,30951527,0xc3f97660D0b47F0E05C3c513f73eeff7c1bd6c7a
0x095d0de0ecfd6832f1a7961ae26d285d68655d60,0x15e89f628bde6a5264f7d5485313abc587099d613e604d6e451b31b5c79d72cc,17-05-2025,2025-05-17 05:50:07.000 UTC,114,30335830,0x0e956C897bBFCbd2155D3DfdD27c87fa5A0FaD39
0x2791dc5e14f7680d9d969acc26059ba56403b6d5,0x702b5680a517cdd0364b3cd6f9959b8cbc13990880ecfdf3d04035170f9ec0ad,13-12-2024,2024-12-13 07:04:49.000 UTC,224,23642071,0xBDA319Bc7Cc8F0829df39eC0FFF5D1E061FFadf7
0x2791dc5e14f7680d9d969acc26059ba56403b6d5,0x5bb913d4bd781daf295253cee9cf96a915a41026caf7b08d99c42bb60fdcdf9d,18-12-2024,2024-12-18 16:19:21.000 UTC,306,23874707,0xBDA319Bc7Cc8F0829df39eC0FFF5D1E061FFadf7
0xdc98dbffcc648d6088a2ff8f7dc01aef050e58fc,0x8b57fd94c4651387e026396ed16542fb3c8b335b080f132db1a68ab236d19181,04-01-2025,2025-01-04 20:51:31.000 UTC,353,24617272,0xBDA319Bc7Cc8F0829df39eC0FFF5D1E061FFadf7
0x2791dc5e14f7680d9d969acc26059ba56403b6d5,0x16a17931556ce3c8e12ea2244fa5fd589d10fc2d4416141c9b71e227cbea83d4,29-12-2024,2024-12-29 00:52:53.000 UTC,452,24322113,0xBDA319Bc7Cc8F0829df39eC0FFF5D1E061FFadf7
0x9eb86e93a809a41ab0e7cc0ba6f62561fda3015c,0x4adf7ac14ef62b20f452d9b3c7f7795441db0608b2eeb23a4e6155a7826be26b,05-03-2025,2025-03-05 06:15:27.000 UTC,212,27182990,0xCFede447ca3b4885720B5a327e3BFb02078f06e8
0x9eb86e93a809a41ab0e7cc0ba6f62561fda3015c,0x3ecc19443ff77f28fd11beb1d07c486e0b4093b23c28fdd2b689f14f6f74b3f0,01-06-2025,2025-06-01 08:06:55.000 UTC,197,30987934,0xc3f97660D0b47F0E05C3c513f73eeff7c1bd6c7a
0x38f6d2d9ea493c3c6ee865b5b952b5fe9e3e61fc,0x681dc06d90fc5615b77165ce46e36ed4f1552e801bded6260094900a23d15ad6,02-01-2025,2025-01-02 20:15:09.000 UTC,252,24529781,0xBDA319Bc7Cc8F0829df39eC0FFF5D1E061FFadf7
0x9eb86e93a809a41ab0e7cc0ba6f62561fda3015c,0xf9c3e5f4c16dec7a9f33ff5ed1de503e5a9e60c14afaf9a01a98a49997beac38,14-02-2025,2025-02-14 23:24:31.000 UTC,208,26393062,0x6399ed6725cC163D019aA64FF55b22149D7179A8
0x9eb86e93a809a41ab0e7cc0ba6f62561fda3015c,0x08bab67271cdc824d8972f099132bbbcb4c87311b5fb5f9a090240518d01f062,15-12-2024,2024-12-15 17:43:49.000 UTC,226,23747641,0xBDA319Bc7Cc8F0829df39eC0FFF5D1E061FFadf7
0x095d0de0ecfd6832f1a7961ae26d285d68655d60,0x462bbf74994f496396cedc43dae26cb5bbcd7f2b6a56e8636ab8cf2a32ddb6e8,09-04-2025,2025-04-09 17:10:55.000 UTC,705,28714654,0x869305781fff479f0311974d55FeeB6Fc9DE96a2
0x9eb86e93a809a41ab0e7cc0ba6f62561fda3015c,0xee747ef4040b50c3675de037edfa25e1812d19f48020c868fb05dc920171d672,02-01-2025,2025-01-02 12:57:23.000 UTC,419,24516648,0xBDA319Bc7Cc8F0829df39eC0FFF5D1E061FFadf7
0x8fd1b615c006ebeb8a7cfb00a1dd809f31943b08,0x789e181407b5e70496c099683a36a04d9277fc94e4704f2d9f6544ce4aed76c6,28-12-2024,2024-12-28 14:06:13.000 UTC,409,24302713,0x45F8b8eC9c92D09BA8495074436fD97073423041
0x2791dc5e14f7680d9d969acc26059ba56403b6d5,0x39f9ac4caee144261aecdca32c6fe5d0f92822e000005f33e872d4f08319aad6,09-01-2025,2025-01-09 06:53:43.000 UTC,341,24808138,0x0e956C897bBFCbd2155D3DfdD27c87fa5A0FaD39
0x8508fd4238162cb3f3d485f432202af3b40f164e,0x47ba617356a9104dc4a7aaad1e989364d5665b58961e4d297c0a43113efe84f0,09-04-2025,2025-04-09 20:16:37.000 UTC,421,28720225,0x2B74B62c564456C48055bd515A62594742b3f545
0x095d0de0ecfd6832f1a7961ae26d285d68655d60,0xc32e035abc32ebfecc72509594ac53eb10667f68b7e42cc40639e1bb9cfe0210,09-03-2025,2025-03-09 17:57:09.000 UTC,353,27376841,0x0e956C897bBFCbd2155D3DfdD27c87fa5A0FaD39
0x9eb86e93a809a41ab0e7cc0ba6f62561fda3015c,0xc0ee0ef9d0f8c9dcdeeb6d495c3052361a7dbe5956914718b6143dac9c8d562e,04-01-2025,2025-01-04 11:40:27.000 UTC,404,24600740,0x869305781fff479f0311974d55FeeB6Fc9DE96a2
0x8fd1b615c006ebeb8a7cfb00a1dd809f31943b08,0xf505da98dcec27a9c9a1783f4827011e82d533c87f3940e776e19e45ee46cb64,31-12-2024,2024-12-31 07:23:37.000 UTC,132,24420235,0xBDA319Bc7Cc8F0829df39eC0FFF5D1E061FFadf7
0x38f6d2d9ea493c3c6ee865b5b952b5fe9e3e61fc,0x3c6e42d3a36726e1c255fbb1765662b5f9f4f03f3c66a73d4f9467693d9a53d4,09-01-2025,2025-01-09 02:51:37.000 UTC,310,24800875,0x0e956C897bBFCbd2155D3DfdD27c87fa5A0FaD39
0x38f6d2d9ea493c3c6ee865b5b952b5fe9e3e61fc,0xa420d25f4851d57d3be4026a38ab259ca245ad0784f64de7e2c260dace47e210,16-01-2025,2025-01-16 21:22:11.000 UTC,417,25136592,0x0e956C897bBFCbd2155D3DfdD27c87fa5A0FaD39
0x9eb86e93a809a41ab0e7cc0ba6f62561fda3015c,0xcd7a1055d02f6130e13fa7b7a7a95b4b146a0294457c27d602beba8c42933f65,04-03-2025,2025-03-04 06:50:33.000 UTC,219,27140843,0x6399ed6725cC163D019aA64FF55b22149D7179A8
0x9eb86e93a809a41ab0e7cc0ba6f62561fda3015c,0x862f93ca5833fcd45a06491b81e4bee13044779c09d6379d86e488a44f6add49,07-12-2024,2024-12-07 17:18:55.000 UTC,235,23401294,0x0e956C897bBFCbd2155D3DfdD27c87fa5A0FaD39
0x8fd1b615c006ebeb8a7cfb00a1dd809f31943b08,0x28bec0390fc05d49ab82bcd780be411a42ba41093361c1e0f2acc3408a44b9f0,12-12-2024,2024-12-12 01:34:09.000 UTC,150,23588951,0xBDA319Bc7Cc8F0829df39eC0FFF5D1E061FFadf7
0xdc98dbffcc648d6088a2ff8f7dc01aef050e58fc,0xad1714ff701d433c6a90c0ceea9b8568c90a6409dc5e3a1d51c5151c4ce3b9d3,13-01-2025,2025-01-13 11:31:37.000 UTC,276,24989275,0xBDA319Bc7Cc8F0829df39eC0FFF5D1E061FFadf7
0x8fd1b615c006ebeb8a7cfb00a1dd809f31943b08,0xec1349363dfde6f63810ccae9306964270cb049c1ae716bdd31a3788d7384fdd,09-01-2025,2025-01-09 23:20:47.000 UTC,305,24837750,0xBDA319Bc7Cc8F0829df39eC0FFF5D1E061FFadf7
0x9eb86e93a809a41ab0e7cc0ba6f62561fda3015c,0x1aa9854a9ea96c95edcd362aa993ef458948032ebe58bf109775c5f190a051ed,16-12-2024,2024-12-16 11:21:21.000 UTC,209,23779367,0xBDA319Bc7Cc8F0829df39eC0FFF5D1E061FFadf7
0x8fd1b615c006ebeb8a7cfb00a1dd809f31943b08,0x274e1d06f5bf53b797f66419796439859c0401e17e7c92f06eb908b9b7f181c5,15-12-2024,2024-12-15 11:19:45.000 UTC,274,23736119,0xCFede447ca3b4885720B5a327e3BFb02078f06e8
0x8fd1b615c006ebeb8a7cfb00a1dd809f31943b08,0xf93b0cfb9aef867798a9d70617f0a7f499bc95092758cd6cddff03421b42709e,16-12-2024,2024-12-16 15:48:25.000 UTC,581,23787379,0xBDA319Bc7Cc8F0829df39eC0FFF5D1E061FFadf7
0x8508fd4238162cb3f3d485f432202af3b40f164e,0xcef7d684bf388417cc989cd47869a8d2940c6774236fcf171a68ef628a7dbfce,02-06-2025,2025-06-02 11:53:31.000 UTC,549,31037932,0xc3f97660D0b47F0E05C3c513f73eeff7c1bd6c7a
0x2791dc5e14f7680d9d969acc26059ba56403b6d5,0x3ad8a2bae845581d2902736a513767317666e9ac199fd2e7a8e297fd2c0676de,04-01-2025,2025-01-04 15:54:37.000 UTC,408,24608365,0x869305781fff479f0311974d55FeeB6Fc9DE96a2
0x8fd1b615c006ebeb8a7cfb00a1dd809f31943b08,0x0c49f08b785ccc5dc0343b843a3445b63c52051ec1ccd0cd7f3b990dc069a99a,24-12-2024,2024-12-24 09:05:03.000 UTC,432,24120878,0xBDA319Bc7Cc8F0829df39eC0FFF5D1E061FFadf7
0xdc98dbffcc648d6088a2ff8f7dc01aef050e58fc,0xfeb580037c11228f050f266df51d4d09ad9504b94b1d7437022cb57389c27b6a,14-01-2025,2025-01-14 17:14:35.000 UTC,286,25042764,0xBDA319Bc7Cc8F0829df39eC0FFF5D1E061FFadf7
0x351f61e4c49cf11f24d9f2e737ca5eff81806355,0x3799003ccb1a5b212f2528545ce880a8fa9a8c6d75cda4574b330b706e4bccbb,29-08-2025,2025-08-29 21:26:03.000 UTC,49,34856708,0x0e956C897bBFCbd2155D3DfdD27c87fa5A0FaD39
0xdc98dbffcc648d6088a2ff8f7dc01aef050e58fc,0x8dcf0936ca08344328a442d6f1f0a2ef2b6d5d8094fe0106beedb7599a9cbdb5,09-01-2025,2025-01-09 16:31:29.000 UTC,483,24825471,0xBDA319Bc7Cc8F0829df39eC0FFF5D1E061FFadf7
0x2791dc5e14f7680d9d969acc26059ba56403b6d5,0x80788fe01f0421140b5d8c52c2c36bc3c0bb260cc8bffdf836fe77f1e233c177,09-03-2025,2025-03-09 05:05:15.000 UTC,149,27353684,0x0e956C897bBFCbd2155D3DfdD27c87fa5A0FaD39
0x2791dc5e14f7680d9d969acc26059ba56403b6d5,0x633c42b1fc56772e9890364ea89a94a05e417ce9679dc5807d2db2a17e12fb92,09-01-2025,2025-01-09 18:09:39.000 UTC,224,24828416,0x869305781fff479f0311974d55FeeB6Fc9DE96a2
0x2791dc5e14f7680d9d969acc26059ba56403b6d5,0xc3054c43883e21b6523720e54a4244c5651671d3262e57071d76ed78bbf268a6,13-01-2025,2025-01-13 21:50:11.000 UTC,614,25007832,0xBDA319Bc7Cc8F0829df39eC0FFF5D1E061FFadf7
0x9eb86e93a809a41ab0e7cc0ba6f62561fda3015c,0xecb7b50a81d13f5e31893f98e45422aeeb89abfcbb41389fb2c43e38b7eef9f5,10-06-2025,2025-06-10 16:03:43.000 UTC,1198,31391038,0xc3f97660D0b47F0E05C3c513f73eeff7c1bd6c7a
0x9eb86e93a809a41ab0e7cc0ba6f62561fda3015c,0x997e0c670e52125ed69d40fdd13e8fcba66782de9d7027a9c5f7893b5a5262a9,07-01-2025,2025-01-07 04:51:45.000 UTC,370,24718079,0xBDA319Bc7Cc8F0829df39eC0FFF5D1E061FFadf7
0x9eb86e93a809a41ab0e7cc0ba6f62561fda3015c,0xb0de5abb12ab327d51efb7b2ffa4443948caf0c5152d0e8b6e790a4addf51b83,03-03-2025,2025-03-03 17:42:15.000 UTC,186,27117194,0x6399ed6725cC163D019aA64FF55b22149D7179A8
0x9eb86e93a809a41ab0e7cc0ba6f62561fda3015c,0x0a6ba44ecab7d88087701e58c85c6409b712b180836b4116ae811177517b9531,01-01-2025,2025-01-01 18:46:31.000 UTC,342,24483922,0xC23924a846eca931Ec3014253E94f15b038bd0C8
0x38f6d2d9ea493c3c6ee865b5b952b5fe9e3e61fc,0xebde53504532996d154d6d9a10d83cf37af6f08141638d990cf4542c23763202,29-12-2024,2024-12-29 14:48:41.000 UTC,363,24347187,0x0e956C897bBFCbd2155D3DfdD27c87fa5A0FaD39
0x9eb86e93a809a41ab0e7cc0ba6f62561fda3015c,0xb69f77c77791bdac97e81e6d76a17df48c1ba26fbedfc8a22c5e6c15ffe971b6,02-01-2025,2025-01-02 00:48:19.000 UTC,307,24494776,0x869305781fff479f0311974d55FeeB6Fc9DE96a2
0xdc98dbffcc648d6088a2ff8f7dc01aef050e58fc,0x8de6d4f0ab9523548aa573835db0d00499e137147f428659d0e02fbfb6405665,01-01-2025,2025-01-01 02:31:23.000 UTC,797,24454668,0xCFede447ca3b4885720B5a327e3BFb02078f06e8
0x2791dc5e14f7680d9d969acc26059ba56403b6d5,0x6b804909226e521296f0b49bea92913739d05fe206d0c192149485648ccaa33e,05-01-2025,2025-01-05 05:55:59.000 UTC,233,24633606,0xB9E4E0368A9F281584C9adB685e6C9F4b9F37dBb
0x9eb86e93a809a41ab0e7cc0ba6f62561fda3015c,0x6f387a118ad059d428a5d32687b9162aceaf5ebcb8b0ec2a2338e9fed0157b6b,31-01-2025,2025-01-31 03:32:37.000 UTC,273,25752505,0x0e956C897bBFCbd2155D3DfdD27c87fa5A0FaD39
0x095d0de0ecfd6832f1a7961ae26d285d68655d60,0x6ee69d2ffef200aeabc6d2d02e4a1b536a5c59590308ac5e16cf55ef0fc5e277,24-04-2025,2025-04-24 15:40:37.000 UTC,2283,29359945,0x869305781fff479f0311974d55FeeB6Fc9DE96a2
0x8508fd4238162cb3f3d485f432202af3b40f164e,0x292cfd2a4d74c443759601aa20de45086314c992d61189804494a4acd6eed2c6,05-06-2025,2025-06-05 06:04:41.000 UTC,824,31157067,0xc3f97660D0b47F0E05C3c513f73eeff7c1bd6c7a
0x9eb86e93a809a41ab0e7cc0ba6f62561fda3015c,0xd97af31f31fde48375860687ad3696a6fd3f15a18b6f9b0ebaf93fac5f8a553a,21-12-2024,2024-12-21 04:17:05.000 UTC,327,23982639,0xBDA319Bc7Cc8F0829df39eC0FFF5D1E061FFadf7
0xdc98dbffcc648d6088a2ff8f7dc01aef050e58fc,0x98b7d7010b8a1c1688d332688300a190f457dc2783a7252d6644cfa344321abd,03-01-2025,2025-01-03 11:11:29.000 UTC,1166,24556671,0xB9E4E0368A9F281584C9adB685e6C9F4b9F37dBb
0xdc98dbffcc648d6088a2ff8f7dc01aef050e58fc,0x083f271a54ccc82f42c90f06b79321c60732e7fb312e1202a6846e45e83f7ede,01-01-2025,2025-01-01 20:35:37.000 UTC,355,24487195,0xBDA319Bc7Cc8F0829df39eC0FFF5D1E061FFadf7
0xdc98dbffcc648d6088a2ff8f7dc01aef050e58fc,0x5c54b16783f11b1e4d37238ca3e897c006038e04a8814b38245e3bec510bc08a,12-01-2025,2025-01-12 18:38:49.000 UTC,180,24958891,0xBDA319Bc7Cc8F0829df39eC0FFF5D1E061FFadf7
0x38f6d2d9ea493c3c6ee865b5b952b5fe9e3e61fc,0x962b591739afcc0f1bbf70ecae151807b97c8a29c6cd0cf0e7a6f30d80833484,04-01-2025,2025-01-04 11:44:41.000 UTC,347,24600867,0x0e956C897bBFCbd2155D3DfdD27c87fa5A0FaD39
0xdc98dbffcc648d6088a2ff8f7dc01aef050e58fc,0x3adbc842e6c38ea259b8c50c04f60726cabfef5c1c6731d96fb9a1af78bbc315,12-01-2025,2025-01-12 09:15:19.000 UTC,326,24941986,0xBDA319Bc7Cc8F0829df39eC0FFF5D1E061FFadf7
0x38f6d2d9ea493c3c6ee865b5b952b5fe9e3e61fc,0xa2a294394f135e4816d1ae8fe2a1179c0fa305768b290298eac1f93e399477f5,03-07-2025,2025-07-03 03:03:03.000 UTC,1517,32361218,0xc3f97660D0b47F0E05C3c513f73eeff7c1bd6c7a
0x8fd1b615c006ebeb8a7cfb00a1dd809f31943b08,0x390d62641c5016bc6b2f880ac30c283d15f6a28a09ba090f2197c3f4c94387f0,13-12-2024,2024-12-13 05:44:31.000 UTC,188,23639662,0xBDA319Bc7Cc8F0829df39eC0FFF5D1E061FFadf7
0x2791dc5e14f7680d9d969acc26059ba56403b6d5,0xb1c24fed9d76c38a623361b4b730e020943bfa54a2c68057e1e552bb9a8d9ae2,16-12-2024,2024-12-16 21:39:51.000 UTC,491,23797922,0xBDA319Bc7Cc8F0829df39eC0FFF5D1E061FFadf7
0x8fd1b615c006ebeb8a7cfb00a1dd809f31943b08,0x658336e2dad7e5e202d0de7605cefa477e25564be112d541d0fa4c66e6ed2b07,31-12-2024,2024-12-31 04:26:05.000 UTC,240,24414909,0xCFede447ca3b4885720B5a327e3BFb02078f06e8
0x9eb86e93a809a41ab0e7cc0ba6f62561fda3015c,0x3f9f9ca5ba0e522b283c2bd4d19d9d53a19efbe911a206172d5a4816f82cd80d,10-12-2024,2024-12-10 11:02:21.000 UTC,485,23519597,0xBDA319Bc7Cc8F0829df39eC0FFF5D1E061FFadf7
0x9eb86e93a809a41ab0e7cc0ba6f62561fda3015c,0xe2a0301848f6713b1c06b307ea9f501f7a9dc7fda2e981cc89a190331df9b1cf,05-02-2025,2025-02-05 00:16:31.000 UTC,210,25962622,0xB9E4E0368A9F281584C9adB685e6C9F4b9F37dBb
0xdc98dbffcc648d6088a2ff8f7dc01aef050e58fc,0x6aff996e60e2a46acd954da94b6f4aaa76b1e6c75016566b8837d43137ed36a9,09-06-2025,2025-06-09 13:19:09.000 UTC,554,31342901,0xc3f97660D0b47F0E05C3c513f73eeff7c1bd6c7a
0xdc98dbffcc648d6088a2ff8f7dc01aef050e58fc,0xffaf63953ff6896038dbf70fcf7859f915de611c42b5ca30156a57e4168fdb86,29-12-2024,2024-12-29 07:46:31.000 UTC,234,24334522,0x0e956C897bBFCbd2155D3DfdD27c87fa5A0FaD39
0xdc98dbffcc648d6088a2ff8f7dc01aef050e58fc,0x8da65fbe5d825c0aca6b05f5819c7636225ee178ce523c928cfd71a5ab69024f,27-05-2025,2025-05-27 03:45:25.000 UTC,710,30764089,0xc3f97660D0b47F0E05C3c513f73eeff7c1bd6c7a
0x8fd1b615c006ebeb8a7cfb00a1dd809f31943b08,0xcb24357fe89420adca5fb5d897005acf767d1cc83f03f1366377dd8491e624d6,20-12-2024,2024-12-20 15:16:19.000 UTC,406,23959216,0x45F8b8eC9c92D09BA8495074436fD97073423041
0x8fd1b615c006ebeb8a7cfb00a1dd809f31943b08,0x8be631a7729241e32c2f4e1e8882f578ed2e86ac7aea882b95fa7b859e7841cb,28-12-2024,2024-12-28 16:20:41.000 UTC,335,24306747,0xBDA319Bc7Cc8F0829df39eC0FFF5D1E061FFadf7
0x2791dc5e14f7680d9d969acc26059ba56403b6d5,0x5cefbf76472ce24d86491e02e9d0f5037b074302a6dfd80a2dc09b75cae1f9ec,14-12-2024,2024-12-14 11:26:07.000 UTC,275,23693110,0xBDA319Bc7Cc8F0829df39eC0FFF5D1E061FFadf7
0x9eb86e93a809a41ab0e7cc0ba6f62561fda3015c,0x729949300c31032462d60d4ba5a008233dc92eb131e520d37c4384abb7ee264b,03-01-2025,2025-01-03 22:28:53.000 UTC,348,24576993,0xBDA319Bc7Cc8F0829df39eC0FFF5D1E061FFadf7
0x9eb86e93a809a41ab0e7cc0ba6f62561fda3015c,0x982df271f1f58002e6b60132764b8c28ecbdbaa469be2f3260be1dda035fbd9b,30-12-2024,2024-12-30 16:02:45.000 UTC,515,24392609,0xCFede447ca3b4885720B5a327e3BFb02078f06e8
0xdc98dbffcc648d6088a2ff8f7dc01aef050e58fc,0x597b5a4b99a4378efcef3fc9245ae8dd45d0054eba5f311c9d49689bac9af7bb,14-01-2025,2025-01-14 01:44:55.000 UTC,380,25014874,0xBDA319Bc7Cc8F0829df39eC0FFF5D1E061FFadf7
0x8fd1b615c006ebeb8a7cfb00a1dd809f31943b08,0xafe04b7b576808a12c37eea0a27946cc5e5304f1093e13559f19d6ac05be6d9a,25-12-2024,2024-12-25 12:29:03.000 UTC,345,24170198,0xBDA319Bc7Cc8F0829df39eC0FFF5D1E061FFadf7
0x8fd1b615c006ebeb8a7cfb00a1dd809f31943b08,0x62a2162ce73ddda9b4594e28be09c194f936a6daef2ee3fef01ef18c4fb726f5,01-01-2025,2025-01-01 18:52:15.000 UTC,545,24484094,0xBDA319Bc7Cc8F0829df39eC0FFF5D1E061FFadf7
0x8508fd4238162cb3f3d485f432202af3b40f164e,0x670fdf1d400b24e2b2b353e7e377b102f221e1dbdcee65a4e7ad1aaad855b068,10-06-2025,2025-06-10 16:19:33.000 UTC,304,31391513,0xc3f97660D0b47F0E05C3c513f73eeff7c1bd6c7a
0x2791dc5e14f7680d9d969acc26059ba56403b6d5,0x2b00987cab437af4853d9488f830e3c7e8c9414550cd1ea859e2085d428d7286,15-01-2025,2025-01-15 16:17:17.000 UTC,279,25084245,0x869305781fff479f0311974d55FeeB6Fc9DE96a2
0x38f6d2d9ea493c3c6ee865b5b952b5fe9e3e61fc,0xbe40efb460158e726a233e4af3866807a5f6aed9d06566a02947af38f0cd3d1f,24-12-2024,2024-12-24 03:26:41.000 UTC,210,24110727,0xCFede447ca3b4885720B5a327e3BFb02078f06e8
0x351f61e4c49cf11f24d9f2e737ca5eff81806355,0x904a70e0c7e57450050f0022093181e1b8b7b9550b7b36d2168fcb0d61300fcb,18-08-2025,2025-08-18 05:59:27.000 UTC,108,34353710,0x0e956C897bBFCbd2155D3DfdD27c87fa5A0FaD39
0x2791dc5e14f7680d9d969acc26059ba56403b6d5,0x674d0c628e3190f97a0ffca1a23a20c4d96e948e528997ccd7496e6980d9ffac,03-07-2025,2025-07-03 19:59:49.000 UTC,286,32391721,0xCFede447ca3b4885720B5a327e3BFb02078f06e8
0x38f6d2d9ea493c3c6ee865b5b952b5fe9e3e61fc,0x90297d0004458a58e245cf64f96759bfa2ec6aa790d38dbee3b5829258965135,02-06-2025,2025-06-02 02:43:29.000 UTC,202,31021431,0xc3f97660D0b47F0E05C3c513f73eeff7c1bd6c7a
0x9eb86e93a809a41ab0e7cc0ba6f62561fda3015c,0x3a1ea3db40584cd5d81339f2dafccd04d7d2cab8aee2cc1c47d4280063929cd7,03-01-2025,2025-01-03 12:30:01.000 UTC,542,24559027,0xBDA319Bc7Cc8F0829df39eC0FFF5D1E061FFadf7
0x2791dc5e14f7680d9d969acc26059ba56403b6d5,0x5e793e0a395b7839f3e796095eedef0089ab354872aad54d5b28fe42e58c90cd,26-12-2024,2024-12-26 11:02:29.000 UTC,183,24210801,0xBDA319Bc7Cc8F0829df39eC0FFF5D1E061FFadf7
0xdc98dbffcc648d6088a2ff8f7dc01aef050e58fc,0x450a58f01476616433ca2145d17c04be59f3861a17195b48aafc9941125466ae,29-12-2024,2024-12-29 13:57:19.000 UTC,282,24345646,0xBDA319Bc7Cc8F0829df39eC0FFF5D1E061FFadf7
0xdc98dbffcc648d6088a2ff8f7dc01aef050e58fc,0xfcd82cb81d6b9b89afce89aba91df7fb40d23d0821ccbb29f46e54776c267ae4,12-01-2025,2025-01-12 17:08:03.000 UTC,191,24956168,0xBDA319Bc7Cc8F0829df39eC0FFF5D1E061FFadf7
0x9eb86e93a809a41ab0e7cc0ba6f62561fda3015c,0x5b176b09988cb0124e5f31021d29b078d05e734be55bc1c034ab46fcda4d2b77,09-01-2025,2025-01-09 05:54:27.000 UTC,315,24806360,0xBDA319Bc7Cc8F0829df39eC0FFF5D1E061FFadf7
0x38f6d2d9ea493c3c6ee865b5b952b5fe9e3e61fc,0x9040821dd4723298dfcf5e3776281936cc14d8832da9e4a3dce288f559885e4f,04-01-2025,2025-01-04 09:28:03.000 UTC,631,24596768,0xBDA319Bc7Cc8F0829df39eC0FFF5D1E061FFadf7
0x8810de2baa17067ddcfbd9e8f29c55f070a55f0b,0xf5d7bb63b80c44045f2ef37c89aff1645485af0c1c2b317211852900f266b159,09-05-2025,2025-05-09 10:53:31.000 UTC,471,29999332,0x0e956C897bBFCbd2155D3DfdD27c87fa5A0FaD39
0xdc98dbffcc648d6088a2ff8f7dc01aef050e58fc,0xc362a0ef248c87999d2e3f752356b0229f5547733a0a6ce2b19ff7aff76182de,05-06-2025,2025-06-05 06:19:33.000 UTC,712,31157513,0xc3f97660D0b47F0E05C3c513f73eeff7c1bd6c7a
0x8fd1b615c006ebeb8a7cfb00a1dd809f31943b08,0x018238eccd3b6ef6a9b56502c9a055383d1da0d9caf81d696ed1f72ec5dfccc7,01-03-2025,2025-03-01 21:54:59.000 UTC,234,27038376,0x869305781fff479f0311974d55FeeB6Fc9DE96a2
0x38f6d2d9ea493c3c6ee865b5b952b5fe9e3e61fc,0xa8997228e74ede40b00650ac79ced8fccaf7d379f3bb15d92d2007a39671ed6c,07-06-2025,2025-06-07 04:18:17.000 UTC,432,31240275,0xc3f97660D0b47F0E05C3c513f73eeff7c1bd6c7a
0x8508fd4238162cb3f3d485f432202af3b40f164e,0x345c1703bbd2ebe2159ae0da4ef05196128183c5cb43b1116ef925d8281dbbcc,02-04-2025,2025-04-02 12:25:13.000 UTC,459,28403683,0x2B74B62c564456C48055bd515A62594742b3f545
0x8508fd4238162cb3f3d485f432202af3b40f164e,0xd7a93560af14048961c54d516b348e62e5c2b51420ea81a25add0dd145e26351,21-05-2025,2025-05-21 06:44:51.000 UTC,94,30510272,0x6205DfbE68444cFF504A20a712cEa794c6b6Cf04
0xdc98dbffcc648d6088a2ff8f7dc01aef050e58fc,0x45bc70812daae4b2c015d699d07772ffb77c2ade8989b9a1d54c99f0fe5f4287,08-01-2025,2025-01-08 19:09:13.000 UTC,409,24787003,0x0e956C897bBFCbd2155D3DfdD27c87fa5A0FaD39
0x8fd1b615c006ebeb8a7cfb00a1dd809f31943b08,0x4f69b53da896ce43eb155565f50bfefa9eb40b280137f568143361dbda32ed7a,05-01-2025,2025-01-05 13:19:31.000 UTC,345,24646912,0xB9E4E0368A9F281584C9adB685e6C9F4b9F37dBb
0x8fd1b615c006ebeb8a7cfb00a1dd809f31943b08,0x527db9857d4e66fb094b9113ac9c44f7f3037af06641bbcaaeb0d2b820bc4b40,12-01-2025,2025-01-12 18:17:51.000 UTC,465,24958262,0xBDA319Bc7Cc8F0829df39eC0FFF5D1E061FFadf7
0x9eb86e93a809a41ab0e7cc0ba6f62561fda3015c,0x8950b32b1465f23de3d69df46a360e97a75bd52e92f4b72c758d0f0789c214ab,01-01-2025,2025-01-01 20:07:53.000 UTC,366,24486363,0xC23924a846eca931Ec3014253E94f15b038bd0C8
0xdc98dbffcc648d6088a2ff8f7dc01aef050e58fc,0x540e45cc5e8c580f2d2ff8b8f33ea3fafc64620027442701b33c8c3a1af09592,02-06-2025,2025-06-02 11:53:55.000 UTC,361,31037944,0xc3f97660D0b47F0E05C3c513f73eeff7c1bd6c7a
0x9eb86e93a809a41ab0e7cc0ba6f62561fda3015c,0x3bc2b830c7aabf55b2be2ce049e0f5717ffad7f8d5b1179db7494c911e5bc8cd,25-12-2024,2024-12-25 11:17:37.000 UTC,301,24168055,0xBDA319Bc7Cc8F0829df39eC0FFF5D1E061FFadf7
0x9eb86e93a809a41ab0e7cc0ba6f62561fda3015c,0xc476ef96ec8efe6000568b42a8ad08800de64ad55c8cb9b2df3d7a53f37c53b5,26-12-2024,2024-12-26 04:29:55.000 UTC,189,24199024,0xBDA319Bc7Cc8F0829df39eC0FFF5D1E061FFadf7
0x38f6d2d9ea493c3c6ee865b5b952b5fe9e3e61fc,0x994703e7386dcb52b6892acdd80eaa0d5f78941398bf2eb44a73f41ed317e2c8,29-12-2024,2024-12-29 11:25:45.000 UTC,159,24341099,0xCFede447ca3b4885720B5a327e3BFb02078f06e8
0x8fd1b615c006ebeb8a7cfb00a1dd809f31943b08,0x1726bd181359ef66c19c9afd9bef4c53bee449f0536e73defe1bd10bf9688507,21-02-2025,2025-02-21 19:18:03.000 UTC,462,26688068,0x869305781fff479f0311974d55FeeB6Fc9DE96a2
0xdc98dbffcc648d6088a2ff8f7dc01aef050e58fc,0x3826fb9cb670ec69cd04e76bfed58f072da01113ee18b7732c5435e5ddb8bca0,31-05-2025,2025-05-31 12:02:41.000 UTC,497,30951807,0xc3f97660D0b47F0E05C3c513f73eeff7c1bd6c7a
0x2791dc5e14f7680d9d969acc26059ba56403b6d5,0xa23d6e4f899d9abb99f0ea22fed607cc5a0f14ecea03f0ccc884037b3e8cfde3,10-01-2025,2025-01-10 09:42:11.000 UTC,1222,24856392,0xBDA319Bc7Cc8F0829df39eC0FFF5D1E061FFadf7
0x2791dc5e14f7680d9d969acc26059ba56403b6d5,0x9fcc4253963f95f83bf164c2a84b435160594bb97d140636ebed57e17e225df7,08-01-2025,2025-01-08 18:17:35.000 UTC,394,24785454,0xB9E4E0368A9F281584C9adB685e6C9F4b9F37dBb
0x8fd1b615c006ebeb8a7cfb00a1dd809f31943b08,0x37dc5d53fbba047114a9a1de0bdf4c8710f26a149d3d7a5e70c809f9a1c6ded9,26-05-2025,2025-05-26 10:56:41.000 UTC,1170,30733827,0xf2c38dE50A250C0060fB45eBE4504B67f6F1be3C
0x2791dc5e14f7680d9d969acc26059ba56403b6d5,0x4365798ba4d662bd899fc511784135e295daefa0b967f816393168bbffac8f46,19-12-2024,2024-12-19 06:12:09.000 UTC,215,23899691,0xBDA319Bc7Cc8F0829df39eC0FFF5D1E061FFadf7
0x38f6d2d9ea493c3c6ee865b5b952b5fe9e3e61fc,0x925edfa25983e7cf2f077f23af0f8a46230b61a9d9c67a5264f7bac4da83e51d,07-01-2025,2025-01-07 00:56:11.000 UTC,340,24711012,0xB9E4E0368A9F281584C9adB685e6C9F4b9F37dBb
0x9eb86e93a809a41ab0e7cc0ba6f62561fda3015c,0x1d73c8bde549ecc02b6cb6fea294c668def94f299f92fe823ec3794cdab9da86,17-06-2025,2025-06-17 14:31:59.000 UTC,551,31690686,0xCFede447ca3b4885720B5a327e3BFb02078f06e8
0x2791dc5e14f7680d9d969acc26059ba56403b6d5,0x9db0f00ef97fc061f37db17538e7e66884b635c04b2add7b0188ef435f8c2dde,21-06-2025,2025-06-21 09:18:49.000 UTC,566,31854091,0xCFede447ca3b4885720B5a327e3BFb02078f06e8
0x8fd1b615c006ebeb8a7cfb00a1dd809f31943b08,0x683d71d99d4519c26212e9c44ed991851c22c2adc1b45f653964ad3a1fb35693,25-12-2024,2024-12-25 06:50:51.000 UTC,300,24160052,0xBDA319Bc7Cc8F0829df39eC0FFF5D1E061FFadf7
0xdc98dbffcc648d6088a2ff8f7dc01aef050e58fc,0x977de8596063c981f5c5df593198d837d0af1153ee653f78601f34b167fbdc68,14-01-2025,2025-01-14 21:13:01.000 UTC,166,25049917,0xBDA319Bc7Cc8F0829df39eC0FFF5D1E061FFadf7
0x9eb86e93a809a41ab0e7cc0ba6f62561fda3015c,0xe020727db327698ee0bc816466926d834697934feae91609787377f8a185a996,16-12-2024,2024-12-16 14:40:45.000 UTC,409,23785349,0xCFede447ca3b4885720B5a327e3BFb02078f06e8
0xdc98dbffcc648d6088a2ff8f7dc01aef050e58fc,0xcf9b20b23735370e0bbf135e7753bde51787fb6ab7f6a0f9eefb85ad8ff9ef29,26-12-2024,2024-12-26 00:18:15.000 UTC,314,24191474,0xCFede447ca3b4885720B5a327e3BFb02078f06e8
0x38f6d2d9ea493c3c6ee865b5b952b5fe9e3e61fc,0x81b847a9ab688878f21418e1cdfb7cc3221285af6224738c83e61e4ab5787e9a,09-01-2025,2025-01-09 07:32:15.000 UTC,419,24809294,0x869305781fff479f0311974d55FeeB6Fc9DE96a2
0x9eb86e93a809a41ab0e7cc0ba6f62561fda3015c,0x58ec510b437d00fc493c834e7fd5ffc9ea3efbedfd8269789c97ad01afa25c1d,27-02-2025,2025-02-27 19:11:53.000 UTC,225,26947083,0x6399ed6725cC163D019aA64FF55b22149D7179A8
0xdc98dbffcc648d6088a2ff8f7dc01aef050e58fc,0x603289e2a1f29887ee9373db1da8fa268a485d1f0633aba649a53170546152d5,14-12-2024,2024-12-14 10:26:55.000 UTC,275,23691334,0xBDA319Bc7Cc8F0829df39eC0FFF5D1E061FFadf7
0x9eb86e93a809a41ab0e7cc0ba6f62561fda3015c,0xaec19419c279ecddd7e57af313a110d2ea1a123a4f799e2f001d4e1594bd33a6,06-06-2025,2025-06-06 03:53:43.000 UTC,309,31196338,0xc3f97660D0b47F0E05C3c513f73eeff7c1bd6c7a
0x2791dc5e14f7680d9d969acc26059ba56403b6d5,0xa300b0ce2e23780e3a7200d590f6c73eea2cd800888c1a32d03894311942d454,30-12-2024,2024-12-30 19:54:23.000 UTC,358,24399558,0xBDA319Bc7Cc8F0829df39eC0FFF5D1E061FFadf7
0xdc98dbffcc648d6088a2ff8f7dc01aef050e58fc,0xcc918a0ed582493ed0e9c918dbe1456dcc33967b7868a93442638ad062d1d1ff,30-12-2024,2024-12-30 08:43:29.000 UTC,240,24379431,0x0e956C897bBFCbd2155D3DfdD27c87fa5A0FaD39
0x2791dc5e14f7680d9d969acc26059ba56403b6d5,0x2fd4f2094a2e16112fcd4b8b8777e444dd7b07f72d2b9f96b41bb91a3bed3797,13-01-2025,2025-01-13 22:51:07.000 UTC,326,25009660,0xBDA319Bc7Cc8F0829df39eC0FFF5D1E061FFadf7
0x8fd1b615c006ebeb8a7cfb00a1dd809f31943b08,0xdbf056f9296878546169f5928cb378a4112ca8a50eb829e2bd3495a3c1528901,12-12-2024,2024-12-12 12:29:13.000 UTC,432,23608603,0x45F8b8eC9c92D09BA8495074436fD97073423041
0x38f6d2d9ea493c3c6ee865b5b952b5fe9e3e61fc,0xb90b1f45a9a5b5e0d910a61a78c22b88371653deabc2b0c7ed37aa1ed8a4a2dc,02-01-2025,2025-01-02 08:48:59.000 UTC,240,24509196,0x0e956C897bBFCbd2155D3DfdD27c87fa5A0FaD39
0x2791dc5e14f7680d9d969acc26059ba56403b6d5,0x3df6d2422c022ac7026c0bc5847b69e01d6bf35875a5def5fc26032cf7dfa919,11-01-2025,2025-01-11 00:47:25.000 UTC,264,24883549,0xBDA319Bc7Cc8F0829df39eC0FFF5D1E061FFadf7
0x9eb86e93a809a41ab0e7cc0ba6f62561fda3015c,0x2ab4747d4f462fc4025d1dce6f2f464afa958ccb31d3d39a40878bd4cdc72ce7,07-01-2025,2025-01-07 02:42:39.000 UTC,138,24714206,0xC23924a846eca931Ec3014253E94f15b038bd0C8
0x38f6d2d9ea493c3c6ee865b5b952b5fe9e3e61fc,0xbc0924851a14cba4eb93cff4db3bf80ffdae6a7459a3216a6a1ae188a89d99ca,08-01-2025,2025-01-08 10:45:29.000 UTC,263,24771891,0xBDA319Bc7Cc8F0829df39eC0FFF5D1E061FFadf7
0xdc98dbffcc648d6088a2ff8f7dc01aef050e58fc,0x6592755ac91b759bda2ba9b50c5ed6c9b6689587b8163031d31cc3e1f82f57f4,08-01-2025,2025-01-08 17:34:29.000 UTC,252,24784161,0x0e956C897bBFCbd2155D3DfdD27c87fa5A0FaD39
0x38f6d2d9ea493c3c6ee865b5b952b5fe9e3e61fc,0xd43414f6572ab93f3a052ea6c81b2968e92c179a39879aac42fbe07738a747b7,29-05-2025,2025-05-29 13:16:09.000 UTC,1141,30867611,0xCFede447ca3b4885720B5a327e3BFb02078f06e8
0x2791dc5e14f7680d9d969acc26059ba56403b6d5,0x8f6520c779bd95a2597c561226bb0750d664e434ec63ae702b2a966927f89117,27-12-2024,2024-12-27 02:49:39.000 UTC,443,24239216,0xBDA319Bc7Cc8F0829df39eC0FFF5D1E061FFadf7
0xdc98dbffcc648d6088a2ff8f7dc01aef050e58fc,0x945379b9d438a9e0513c4b967464887f3751875123f77347ea0c72e4e7603722,03-01-2025,2025-01-03 22:51:17.000 UTC,400,24577665,0x0e956C897bBFCbd2155D3DfdD27c87fa5A0FaD39
0x8508fd4238162cb3f3d485f432202af3b40f164e,0x5d59e2facebd982d1b79abe4dd328658f8b15674ee49ac0440496dc3b71a890d,01-06-2025,2025-06-01 10:37:09.000 UTC,491,30992441,0xc3f97660D0b47F0E05C3c513f73eeff7c1bd6c7a
0x351f61e4c49cf11f24d9f2e737ca5eff81806355,0x283a271d020cc0fa9ed50772412a6e71c2eadb47c0309eb26ccd52ab7ea67483,25-08-2025,2025-08-25 11:29:23.000 UTC,436,34666008,0x0e956C897bBFCbd2155D3DfdD27c87fa5A0FaD39
0x2791dc5e14f7680d9d969acc26059ba56403b6d5,0x5cf50789e7eaf81642cf58f434f87f8ba7aeb068abf6e71f58af80e61a67f9a0,28-12-2024,2024-12-28 03:35:01.000 UTC,315,24283777,0xBDA319Bc7Cc8F0829df39eC0FFF5D1E061FFadf7
0x9eb86e93a809a41ab0e7cc0ba6f62561fda3015c,0x4dc65a3fff834f89fbf86fbb2abd9f290f83a1a2a42e15f0322a3e1d973deffb,31-12-2024,2024-12-31 09:25:21.000 UTC,272,24423887,0xCFede447ca3b4885720B5a327e3BFb02078f06e8
0x9eb86e93a809a41ab0e7cc0ba6f62561fda3015c,0xfc9ffa4a7019ceeb19479bb2930889f2c7b8a04e8b872bd4d3ce4e2c8e98dcbc,02-01-2025,2025-01-02 06:38:15.000 UTC,477,24505274,0xC23924a846eca931Ec3014253E94f15b038bd0C8
0x095d0de0ecfd6832f1a7961ae26d285d68655d60,0xc3413e9f95ae091dd3c9ebee779616eb1c5bd54b87999cce531873cad7bba865,25-02-2025,2025-02-25 15:28:19.000 UTC,316,26853976,0x0e956C897bBFCbd2155D3DfdD27c87fa5A0FaD39
0x8fd1b615c006ebeb8a7cfb00a1dd809f31943b08,0xa80d44c1b538fb162be8493cc6eeeb2fe3a051b8bc107020f8421fb9602d110c,28-12-2024,2024-12-28 22:50:17.000 UTC,202,24318435,0xBDA319Bc7Cc8F0829df39eC0FFF5D1E061FFadf7
0x9eb86e93a809a41ab0e7cc0ba6f62561fda3015c,0x44b45b14f9e37f08fdf420b4b053d8640f9a5bf2c49690d4bcf5a634139b934c,03-01-2025,2025-01-03 08:42:31.000 UTC,277,24552202,0xBDA319Bc7Cc8F0829df39eC0FFF5D1E061FFadf7
0x9eb86e93a809a41ab0e7cc0ba6f62561fda3015c,0xee0b321dcaacf8d069db7c58f39c0b4087f0fdbfe7d5fdb30531ee168424d3ab,26-02-2025,2025-02-26 04:57:47.000 UTC,457,26878260,0x6399ed6725cC163D019aA64FF55b22149D7179A8
0x38f6d2d9ea493c3c6ee865b5b952b5fe9e3e61fc,0x296ae6a9aae6377961106cbfad213e5e40949a2a1d00b709fa2b202021668437,06-01-2025,2025-01-06 08:12:49.000 UTC,449,24680911,0x869305781fff479f0311974d55FeeB6Fc9DE96a2
0x2791dc5e14f7680d9d969acc26059ba56403b6d5,0x12bfa8daac33933163baba916e81fbad342479e1a4fe7bcb00a94a9b2d14b95a,03-01-2025,2025-01-03 12:29:25.000 UTC,425,24559009,0xBDA319Bc7Cc8F0829df39eC0FFF5D1E061FFadf7
0xdc98dbffcc648d6088a2ff8f7dc01aef050e58fc,0xa4c7400e08ce155d1c61e0cc61e1a739286b8ef17029d7ae6e54e7c55fb528b4,24-04-2025,2025-04-24 18:14:15.000 UTC,507,29364554,0x430C09546ae9249AB75B9A4ef7B5FD9a4006D6f3
0xdc98dbffcc648d6088a2ff8f7dc01aef050e58fc,0xe2a94a1a11437ca6a226490715d01c6de7c4ca47274f9fbfcf4cc2d65ca9bc3c,10-01-2025,2025-01-10 11:54:55.000 UTC,402,24860374,0xBDA319Bc7Cc8F0829df39eC0FFF5D1E061FFadf7
0x9eb86e93a809a41ab0e7cc0ba6f62561fda3015c,0x756118fd3ad9dccb45bf1285a578246c13b9b6273d36c79cef6154f8628598f3,31-12-2024,2024-12-31 23:09:13.000 UTC,187,24448603,0xCFede447ca3b4885720B5a327e3BFb02078f06e8
0x38f6d2d9ea493c3c6ee865b5b952b5fe9e3e61fc,0x041487428c834bbdbf75ec3bbb3edcca93b890d088682a08393ed1a7169808e1,09-01-2025,2025-01-09 23:32:53.000 UTC,1175,24838113,0xBDA319Bc7Cc8F0829df39eC0FFF5D1E061FFadf7
0x38f6d2d9ea493c3c6ee865b5b952b5fe9e3e61fc,0x5f1de55a38cf633ba4a908823b01943f83b12a382c77bdf4956a00a6b581f743,06-01-2025,2025-01-06 12:08:33.000 UTC,345,24687983,0xBDA319Bc7Cc8F0829df39eC0FFF5D1E061FFadf7
0x2791dc5e14f7680d9d969acc26059ba56403b6d5,0x8c72454b053255c31699e05f98d8241224eb3ef6340f2baa94f87962a6bbea3f,07-01-2025,2025-01-07 11:16:01.000 UTC,305,24729607,0x0e956C897bBFCbd2155D3DfdD27c87fa5A0FaD39
0xdc98dbffcc648d6088a2ff8f7dc01aef050e58fc,0xe6a1e3326c463e4f6fd18fa2353ac410a049386e123150be65a1028cb606811f,13-01-2025,2025-01-13 00:47:55.000 UTC,365,24969964,0xB9E4E0368A9F281584C9adB685e6C9F4b9F37dBb
0x8fd1b615c006ebeb8a7cfb00a1dd809f31943b08,0xd40539a6c48fba8194185040b61553686ba6b8ec7502b05b2d3f84c52e304721,03-01-2025,2025-01-03 21:50:39.000 UTC,401,24575846,0xBDA319Bc7Cc8F0829df39eC0FFF5D1E061FFadf7
0x38f6d2d9ea493c3c6ee865b5b952b5fe9e3e61fc,0x440662800bd9e211fee7f01a6638810643b8bd7a06f6d5215eea65df7cdb84f3,02-01-2025,2025-01-02 00:42:25.000 UTC,380,24494599,0x0e956C897bBFCbd2155D3DfdD27c87fa5A0FaD39
0x8508fd4238162cb3f3d485f432202af3b40f164e,0x6a409a58156515d680d4136275ad6e99c15dfb30fa435c28d5777f557da341e7,18-03-2025,2025-03-18 15:03:07.000 UTC,350,27760420,0x869305781fff479f0311974d55FeeB6Fc9DE96a2
0xdc98dbffcc648d6088a2ff8f7dc01aef050e58fc,0x2c866d93156a298ea968d4c1cceaf0ab3f4f548604ffd2c965dd3299e686c907,03-01-2025,2025-01-03 07:59:53.000 UTC,607,24550923,0xB9E4E0368A9F281584C9adB685e6C9F4b9F37dBb
0x8508fd4238162cb3f3d485f432202af3b40f164e,0x42827d4f750bb9ca7a506baec3da76f4b51c15ecdb34e0cf71fb10e980a8a688,03-04-2025,2025-04-03 15:22:53.000 UTC,444,28452213,0x2B74B62c564456C48055bd515A62594742b3f545
0x8fd1b615c006ebeb8a7cfb00a1dd809f31943b08,0x4e6a68d9cc69e5b3a2859e6c390e655e788639f2464d73fa02fe4f7e9ac31043,14-02-2025,2025-02-14 18:43:15.000 UTC,1447,26384624,0x0e956C897bBFCbd2155D3DfdD27c87fa5A0FaD39
0x2791dc5e14f7680d9d969acc26059ba56403b6d5,0x0172e22f16789667e847cf2b5d1b02bbecf448d05df6f9c4f9fa825a2300ff24,21-12-2024,2024-12-21 22:11:15.000 UTC,375,24014864,0xBDA319Bc7Cc8F0829df39eC0FFF5D1E061FFadf7
0x2791dc5e14f7680d9d969acc26059ba56403b6d5,0x98baea6d0572263edb898b58b4a68665e1d32f1dcbc8bfacbadde9b7cd4ab202,01-01-2025,2025-01-01 18:47:53.000 UTC,1893,24483963,0xBDA319Bc7Cc8F0829df39eC0FFF5D1E061FFadf7
0x9eb86e93a809a41ab0e7cc0ba6f62561fda3015c,0xb031aea1384af566e8ca4518945e06db56b55a54b56e0a24512eb2424998f867,04-01-2025,2025-01-04 17:46:31.000 UTC,221,24611722,0xBDA319Bc7Cc8F0829df39eC0FFF5D1E061FFadf7
0x2791dc5e14f7680d9d969acc26059ba56403b6d5,0xaf7c6528e88213ee4f39f16134d73e478118c13c4657ee47bffb221c07e3ea17,07-01-2025,2025-01-07 16:56:33.000 UTC,393,24739823,0xCFede447ca3b4885720B5a327e3BFb02078f06e8
0x2791dc5e14f7680d9d969acc26059ba56403b6d5,0xe0fe46b213b2febe0487f0ce9e58c2fd4693194d02fd9ca7d88689e7e2465e35,19-12-2024,2024-12-19 03:04:43.000 UTC,292,23894068,0xBDA319Bc7Cc8F0829df39eC0FFF5D1E061FFadf7
0x2791dc5e14f7680d9d969acc26059ba56403b6d5,0x05cfb59a4a9e706a67a9eec24d304869739005423c2c7a796c12a55760c261b4,17-01-2025,2025-01-17 21:46:51.000 UTC,249,25180532,0xf2c38dE50A250C0060fB45eBE4504B67f6F1be3C
0xdc98dbffcc648d6088a2ff8f7dc01aef050e58fc,0xc925e406246c15cdf687f9492202d21ebd18bc67d73dc4a147a899036db2c5f2,03-06-2025,2025-06-03 00:47:47.000 UTC,628,31061160,0xc3f97660D0b47F0E05C3c513f73eeff7c1bd6c7a
0x2791dc5e14f7680d9d969acc26059ba56403b6d5,0x3f016cf7fbd1c50c42f67aa09f57d84c3f7654d05f0bce7b1b97481f39d5f09d,24-12-2024,2024-12-24 01:07:49.000 UTC,440,24106561,0xBDA319Bc7Cc8F0829df39eC0FFF5D1E061FFadf7
0x095d0de0ecfd6832f1a7961ae26d285d68655d60,0x383c4c8c783f1b1016f3529827ba65298c260503e1a1780c05f18a20238f403d,19-05-2025,2025-05-19 05:12:15.000 UTC,55,30421094,0xCFede447ca3b4885720B5a327e3BFb02078f06e8
0x2791dc5e14f7680d9d969acc26059ba56403b6d5,0xfc9e091eb6d2d799c3224696f7347e9c9b1542969a2b34fa0366b6e3c0aedcaa,14-01-2025,2025-01-14 16:19:59.000 UTC,351,25041126,0xBDA319Bc7Cc8F0829df39eC0FFF5D1E061FFadf7
0x9eb86e93a809a41ab0e7cc0ba6f62561fda3015c,0x91f502b97b0c76b1111b6275d608e3e348c02af20755390e66aa5931fbe6d529,28-02-2025,2025-02-28 18:27:45.000 UTC,147,26988959,0x6399ed6725cC163D019aA64FF55b22149D7179A8
0x9eb86e93a809a41ab0e7cc0ba6f62561fda3015c,0x2c5ef01a635b00320f5f73825954553986a2defc94287a437e950649e1cc2e63,26-12-2024,2024-12-26 00:30:37.000 UTC,313,24191845,0xCFede447ca3b4885720B5a327e3BFb02078f06e8
0xdc98dbffcc648d6088a2ff8f7dc01aef050e58fc,0xeebf347403c7545357f1afa9c09c343339f761fa30e50498d70d0c4bff442cfc,22-05-2025,2025-05-22 17:57:57.000 UTC,1221,30573665,0x430C09546ae9249AB75B9A4ef7B5FD9a4006D6f3
0x9eb86e93a809a41ab0e7cc0ba6f62561fda3015c,0xe857b7de676605f60d7b9ea86126e86ec1cca22d164905601186d9500dca24ff,06-06-2025,2025-06-06 12:17:01.000 UTC,422,31211437,0xCFede447ca3b4885720B5a327e3BFb02078f06e8
0x8fd1b615c006ebeb8a7cfb00a1dd809f31943b08,0xe313007c2494f0e46fb17f751951a6477ebab61eecf1ea642e654e766788271e,03-01-2025,2025-01-03 11:11:37.000 UTC,343,24556675,0xB9E4E0368A9F281584C9adB685e6C9F4b9F37dBb
0x2791dc5e14f7680d9d969acc26059ba56403b6d5,0x30eda80dde1dcc5f5ef550d3004b108e9f8295f9e82b36a0c36f9e38840823c3,07-01-2025,2025-01-07 06:37:05.000 UTC,205,24721239,0x869305781fff479f0311974d55FeeB6Fc9DE96a2
0x9eb86e93a809a41ab0e7cc0ba6f62561fda3015c,0xba551955eab691c2ff33b4f5ebd711e185868d991f73db4d6ed049e3621c7243,18-12-2024,2024-12-18 03:11:09.000 UTC,399,23851061,0xBDA319Bc7Cc8F0829df39eC0FFF5D1E061FFadf7
0x9eb86e93a809a41ab0e7cc0ba6f62561fda3015c,0x367587b09637f2db2cc8c9e133e03f4500fc0fdf6ec06bb63be9b46171b9008a,02-01-2025,2025-01-02 08:03:39.000 UTC,315,24507836,0xC23924a846eca931Ec3014253E94f15b038bd0C8
0x2791dc5e14f7680d9d969acc26059ba56403b6d5,0x7b202e1338a592deea39bbbb76717cdfba6c22f201497810ae44f68628089ee5,07-01-2025,2025-01-07 11:07:41.000 UTC,246,24729357,0xBDA319Bc7Cc8F0829df39eC0FFF5D1E061FFadf7
0xdc98dbffcc648d6088a2ff8f7dc01aef050e58fc,0x903e0016e027aa67ff9a10d6b85764ccce2180341bae9c2b42f5a2679c7436b9,13-01-2025,2025-01-13 02:16:33.000 UTC,484,24972623,0xBDA319Bc7Cc8F0829df39eC0FFF5D1E061FFadf7
0x8fd1b615c006ebeb8a7cfb00a1dd809f31943b08,0x7c61980c78cc2d64c42c4e3441cb651a6f5a5ece858bd49f703e9ca262f693b5,14-01-2025,2025-01-14 19:50:55.000 UTC,258,25047454,0xf2c38dE50A250C0060fB45eBE4504B67f6F1be3C
0x38f6d2d9ea493c3c6ee865b5b952b5fe9e3e61fc,0x2bfc6eb34bc7c9f822aa167ab3101e0a1045bb9aeb47ade6e704d0bb779ee74a,26-12-2024,2024-12-26 02:33:29.000 UTC,251,24195531,0xCFede447ca3b4885720B5a327e3BFb02078f06e8
0x9eb86e93a809a41ab0e7cc0ba6f62561fda3015c,0x341c7d69a8b569316cd1827a2bf50cbd638b27d1444b833792640be11bfa7b48,20-12-2024,2024-12-20 18:36:27.000 UTC,249,23965220,0xCFede447ca3b4885720B5a327e3BFb02078f06e8
0x38f6d2d9ea493c3c6ee865b5b952b5fe9e3e61fc,0xc45486ea95a74c15e1f6814387197cf7a2405664833ebf7adc78e105c6b8858e,06-01-2025,2025-01-06 06:17:07.000 UTC,890,24677440,0xBDA319Bc7Cc8F0829df39eC0FFF5D1E061FFadf7
0x8fd1b615c006ebeb8a7cfb00a1dd809f31943b08,0xff15e813677537b243799a66b915a4181a314e3e26afdb53c62f44f1dfbc412a,13-12-2024,2024-12-13 13:31:59.000 UTC,395,23653686,0xCFede447ca3b4885720B5a327e3BFb02078f06e8
0x9eb86e93a809a41ab0e7cc0ba6f62561fda3015c,0xe681d36bb17c85f0833347227fcba9b48c585204efd29963af1651701a5a321f,10-01-2025,2025-01-10 03:43:07.000 UTC,407,24845620,0xBDA319Bc7Cc8F0829df39eC0FFF5D1E061FFadf7
0xdc98dbffcc648d6088a2ff8f7dc01aef050e58fc,0x0e9dbf3ad9308242b791c762888ed08f36775e3b725241256c8b77dbae463eb8,03-01-2025,2025-01-03 22:48:31.000 UTC,226,24577582,0xBDA319Bc7Cc8F0829df39eC0FFF5D1E061FFadf7
0xdc98dbffcc648d6088a2ff8f7dc01aef050e58fc,0xcf36aae84d4e977dc04ee3946a703ab71b18b2a9fe82768be657ce82ce8bb9fc,19-12-2024,2024-12-19 08:21:11.000 UTC,484,23903562,0xCFede447ca3b4885720B5a327e3BFb02078f06e8
0x9eb86e93a809a41ab0e7cc0ba6f62561fda3015c,0x18cd5d5bc05321da2a77ad99dc3ba9e17d0f3747eb344a6803805da3fa6a74ab,15-07-2025,2025-07-15 20:44:59.000 UTC,270,32911476,0xf2c38dE50A250C0060fB45eBE4504B67f6F1be3C
0xdc98dbffcc648d6088a2ff8f7dc01aef050e58fc,0x6d46316b37fd247417f25972ca5649cb2af0cde0744d3a5294dbfa9dd0681388,09-07-2025,2025-07-09 06:04:27.000 UTC,755,32625860,0xc3f97660D0b47F0E05C3c513f73eeff7c1bd6c7a
0x38f6d2d9ea493c3c6ee865b5b952b5fe9e3e61fc,0xd1db0ae0d710e88921351bc078332010d50fe944329285f2ad089bd49137a2b8,06-01-2025,2025-01-06 15:21:59.000 UTC,795,24693786,0xB9E4E0368A9F281584C9adB685e6C9F4b9F37dBb
0x8508fd4238162cb3f3d485f432202af3b40f164e,0xd286dea491e700c3031d9f6cb33ed1f2e8c286394fd73e717ab82c93222e9084,22-05-2025,2025-05-22 16:38:03.000 UTC,515,30571268,0xc3f97660D0b47F0E05C3c513f73eeff7c1bd6c7a
0x2791dc5e14f7680d9d969acc26059ba56403b6d5,0x812b2974c991e154633d3d80087957a0defe4e0dd012f0103a2fc1ec7d269a75,15-12-2024,2024-12-15 01:54:47.000 UTC,232,23719170,0xBDA319Bc7Cc8F0829df39eC0FFF5D1E061FFadf7
0x38f6d2d9ea493c3c6ee865b5b952b5fe9e3e61fc,0xbfd7e41df1cd6ada2c2fec7316e549d3bf90b2ec2e0312f5bc04a0a386dbb526,07-01-2025,2025-01-07 01:14:19.000 UTC,408,24711556,0x0e956C897bBFCbd2155D3DfdD27c87fa5A0FaD39
0x9eb86e93a809a41ab0e7cc0ba6f62561fda3015c,0x9d13961d69833c745015d070c99094a75478152bc284f84493f70f5c37b9aab5,16-12-2024,2024-12-16 03:50:49.000 UTC,446,23765851,0xCFede447ca3b4885720B5a327e3BFb02078f06e8
0x38f6d2d9ea493c3c6ee865b5b952b5fe9e3e61fc,0xfaec13daed2a89fd9fcc0eae4f024d8972cbf0241512a622007e52adab2016c9,06-01-2025,2025-01-06 11:54:39.000 UTC,308,24687566,0xBDA319Bc7Cc8F0829df39eC0FFF5D1E061FFadf7
0x19d36b9ee92a53ec1900447eba958f0030c688be,0xce9cd0e97409d0ee41d1a9ebc95c621f557ad4f60a3ea48cb9da62beefe82e5e,01-06-2025,2025-06-01 04:14:17.000 UTC,24,30980955,0x0e956C897bBFCbd2155D3DfdD27c87fa5A0FaD39
0x2791dc5e14f7680d9d969acc26059ba56403b6d5,0x362dfca25a933fb0abfdac4cceb1dafbb4a6a3247faa97c4cd75c73d081eba05,20-12-2024,2024-12-20 05:37:03.000 UTC,477,23941838,0xBDA319Bc7Cc8F0829df39eC0FFF5D1E061FFadf7
0xdc98dbffcc648d6088a2ff8f7dc01aef050e58fc,0x7e65e6b18fdbf2b6fa22b96e9ee10e854ff2f60045d8cf0e73f31a434ecf5fa6,13-01-2025,2025-01-13 17:51:31.000 UTC,240,25000672,0x869305781fff479f0311974d55FeeB6Fc9DE96a2
0x9eb86e93a809a41ab0e7cc0ba6f62561fda3015c,0xe3109e4b06149ea5992c501638b50bf98543f26b450f6e44b2b4b95ea4ee43b4,28-12-2024,2024-12-28 09:31:47.000 UTC,264,24294480,0xCFede447ca3b4885720B5a327e3BFb02078f06e8
0x8fd1b615c006ebeb8a7cfb00a1dd809f31943b08,0x00451676884eeffdb3edc114b8a94ccace869236ed824938619273ed07e3c223,04-01-2025,2025-01-04 10:35:39.000 UTC,227,24598796,0xBDA319Bc7Cc8F0829df39eC0FFF5D1E061FFadf7
0x8508fd4238162cb3f3d485f432202af3b40f164e,0x81bac361042c03ebd4ff0d6204dc6d245f1466593ea4cea6876e2f7f7c849e76,07-04-2025,2025-04-07 18:00:47.000 UTC,415,28629750,0x2B74B62c564456C48055bd515A62594742b3f545
0x2791dc5e14f7680d9d969acc26059ba56403b6d5,0x95b2449037b6053128cc1c182ece4f5f8f9b373291158f9f4db56390c547db64,19-12-2024,2024-12-19 00:26:51.000 UTC,358,23889332,0xBDA319Bc7Cc8F0829df39eC0FFF5D1E061FFadf7
0xdc98dbffcc648d6088a2ff8f7dc01aef050e58fc,0x99963ef7df508175e58470e39fd07dd337fd8fc864bbc12625bc3d0704f020ae,08-01-2025,2025-01-08 21:14:59.000 UTC,341,24790776,0xBDA319Bc7Cc8F0829df39eC0FFF5D1E061FFadf7
0x9eb86e93a809a41ab0e7cc0ba6f62561fda3015c,0x58bda8052d234d2cc84c6ed282fa9f0f10b6e0e10168fc03a71a77e74ab4685b,04-06-2025,2025-06-04 18:17:23.000 UTC,1058,31135848,0xc3f97660D0b47F0E05C3c513f73eeff7c1bd6c7a
0x095d0de0ecfd6832f1a7961ae26d285d68655d60,0x2e468326ab5c9cc41b71523cb35cc56577c12544bbd9338f52e3c4b69416811a,24-06-2025,2025-06-24 14:22:33.000 UTC,412,31992803,0x869305781fff479f0311974d55FeeB6Fc9DE96a2
0x38f6d2d9ea493c3c6ee865b5b952b5fe9e3e61fc,0x4fa32ade34539125a5cad85b4b4eb682738a4cfe8ffd1b2e9e2454081b2fafe0,08-01-2025,2025-01-08 00:28:29.000 UTC,373,24753381,0x0e956C897bBFCbd2155D3DfdD27c87fa5A0FaD39
0x2791dc5e14f7680d9d969acc26059ba56403b6d5,0x8a3e88580f8e2e466e4440060510526653cba30ac5964733492a48ec381e413e,06-02-2025,2025-02-06 01:47:35.000 UTC,554,26008554,0x0e956C897bBFCbd2155D3DfdD27c87fa5A0FaD39
0x8508fd4238162cb3f3d485f432202af3b40f164e,0xf5138068cd2bc5b7f61c7dc4bb2edec598514e183d3802fa113332c5184e5773,11-07-2025,2025-07-11 02:28:29.000 UTC,353,32705781,0x6205DfbE68444cFF504A20a712cEa794c6b6Cf04
0x9eb86e93a809a41ab0e7cc0ba6f62561fda3015c,0x6deb4e2170ab0ec6f15d5c33886345a4b22a63a1b9785527eeb5e3ac00db6a66,05-06-2025,2025-06-05 07:04:31.000 UTC,396,31158862,0xc3f97660D0b47F0E05C3c513f73eeff7c1bd6c7a
0x38f6d2d9ea493c3c6ee865b5b952b5fe9e3e61fc,0xe3b3622769a1b7a975058caa402b1334ea7a7ad573d52b7d4792e3d1b6f03660,09-01-2025,2025-01-09 05:33:47.000 UTC,241,24805740,0xB9E4E0368A9F281584C9adB685e6C9F4b9F37dBb
0x2791dc5e14f7680d9d969acc26059ba56403b6d5,0x13d2e2867cafc1f3f7da1e15c5c9b577997ce902e80f8f18da3e9bfeab68c2b7,11-07-2025,2025-07-11 00:16:31.000 UTC,802,32701822,0xCFede447ca3b4885720B5a327e3BFb02078f06e8
0x8508fd4238162cb3f3d485f432202af3b40f164e,0xdff4e86a212d447b60d58698a3093c01a994915bd557ec0ac259e8a622515673,01-06-2025,2025-06-01 04:46:51.000 UTC,495,30981932,0xc3f97660D0b47F0E05C3c513f73eeff7c1bd6c7a
0xdc98dbffcc648d6088a2ff8f7dc01aef050e58fc,0x598604d51de4ef3b60a02f324b9423282a72c2e9308c873370f9c42926d4d430,30-05-2025,2025-05-30 21:28:59.000 UTC,603,30925596,0xc3f97660D0b47F0E05C3c513f73eeff7c1bd6c7a
0x8fd1b615c006ebeb8a7cfb00a1dd809f31943b08,0x9d3fb7e14fe0f7dc0084b9d23edbf280d6a512d7d1ef7649c059bce1bf84fbd1,16-12-2024,2024-12-16 02:13:21.000 UTC,552,23762927,0xCFede447ca3b4885720B5a327e3BFb02078f06e8
0x9eb86e93a809a41ab0e7cc0ba6f62561fda3015c,0x1021b4abe0b6cc40814ad8c76d884f57d84a5f54a91389184231fb4649b95ecc,14-05-2025,2025-05-14 02:34:41.000 UTC,71,30200367,0xc3f97660D0b47F0E05C3c513f73eeff7c1bd6c7a
0x2791dc5e14f7680d9d969acc26059ba56403b6d5,0xb5d7b99c65224302cfab2830fc2a3b00b8f797eacfb18cd95af075149b5cc1ec,13-01-2025,2025-01-13 02:42:57.000 UTC,269,24973415,0x0e956C897bBFCbd2155D3DfdD27c87fa5A0FaD39
0x8fd1b615c006ebeb8a7cfb00a1dd809f31943b08,0xdc103077406b603daa9a7333366e6fff0530e654fc0e13fb7986f2ca2551151b,05-01-2025,2025-01-05 10:38:03.000 UTC,432,24642068,0xAfabcBbab5e4261B1d655c906738176191819164
0x9eb86e93a809a41ab0e7cc0ba6f62561fda3015c,0x8fcb9acb849a30ec4cb1b75908b47d2409837d16a990a685cf25bd2360de4813,02-01-2025,2025-01-02 10:45:43.000 UTC,343,24512698,0xBDA319Bc7Cc8F0829df39eC0FFF5D1E061FFadf7
0xdc98dbffcc648d6088a2ff8f7dc01aef050e58fc,0xc371981c2187cc4f1f44287dc0ad8fdc31a0e0f99a2ebdccae2d7877fc9cc98e,01-06-2025,2025-06-01 04:57:17.000 UTC,212,30982245,0xc3f97660D0b47F0E05C3c513f73eeff7c1bd6c7a
0x2791dc5e14f7680d9d969acc26059ba56403b6d5,0x03ba5ddbbe4ed19b222173065de6f5f8acf866e24810f84b0760c80abeb5077a,15-12-2024,2024-12-15 00:21:15.000 UTC,223,23716364,0xBDA319Bc7Cc8F0829df39eC0FFF5D1E061FFadf7
0x9eb86e93a809a41ab0e7cc0ba6f62561fda3015c,0xfecdd8234f3c61283ab75efbf502464a3846c3f37eee393eeb6060538ff1eadf,10-12-2024,2024-12-10 06:35:29.000 UTC,149,23511591,0xF33a96b5932D9E9B9A0eDA447AbD8C9d48d2e0c8
0x2791dc5e14f7680d9d969acc26059ba56403b6d5,0xc331715a452657a62bdf81ba2825b6ce536d67512c0560b7f8e737f8e667b8ba,10-03-2025,2025-03-10 03:27:49.000 UTC,148,27393961,0xCFede447ca3b4885720B5a327e3BFb02078f06e8
0x38f6d2d9ea493c3c6ee865b5b952b5fe9e3e61fc,0x3e76ddb5ce3a4314cf21290530327ce6cb56f114e3943d6554557ebdd1543bc2,22-01-2025,2025-01-22 18:59:17.000 UTC,372,25391505,0xB9E4E0368A9F281584C9adB685e6C9F4b9F37dBb
0x8fd1b615c006ebeb8a7cfb00a1dd809f31943b08,0x632b8a848a33c91eabb9e944c9add3fe374ebe28d599ee699c5c713e3bd00c93,05-01-2025,2025-01-05 10:06:43.000 UTC,333,24641128,0xBDA319Bc7Cc8F0829df39eC0FFF5D1E061FFadf7
0x9eb86e93a809a41ab0e7cc0ba6f62561fda3015c,0x3c888147ad90cd9c4ea9984ab82bbf36b56f0d4194ce738f8b99b00ff961e5c9,10-12-2024,2024-12-10 04:55:45.000 UTC,265,23508599,0xF33a96b5932D9E9B9A0eDA447AbD8C9d48d2e0c8
0xdc98dbffcc648d6088a2ff8f7dc01aef050e58fc,0xc18088688d7f322e489d55407d17c637d982bd12c25467058e3c7490a4eda535,10-01-2025,2025-01-10 14:31:01.000 UTC,355,24865057,0x869305781fff479f0311974d55FeeB6Fc9DE96a2
0x8fd1b615c006ebeb8a7cfb00a1dd809f31943b08,0x65e7c1d866f99992bbe170dd9de695ce6930332f8cad3d499c2b2e05445c7af3,10-12-2024,2024-12-10 15:46:31.000 UTC,257,23528122,0xBDA319Bc7Cc8F0829df39eC0FFF5D1E061FFadf7
0x9eb86e93a809a41ab0e7cc0ba6f62561fda3015c,0xa27914a7766258b2a3d8ea5178194f5625fc1ada4d388e42e9fb2a0139e9d0dc,07-12-2024,2024-12-07 12:56:25.000 UTC,278,23393419,0x0e956C897bBFCbd2155D3DfdD27c87fa5A0FaD39
0x9eb86e93a809a41ab0e7cc0ba6f62561fda3015c,0xbd917d58a61a3ec078a2453935f8eabfa8fd4b649ceccca5e29df8be80e3cb19,27-02-2025,2025-02-27 13:56:57.000 UTC,466,26937635,0x6399ed6725cC163D019aA64FF55b22149D7179A8
0x095d0de0ecfd6832f1a7961ae26d285d68655d60,0xcee714c21ba942eda86861f042b2bcf68c254515e73e030ec2a2a4722a064e0d,17-02-2025,2025-02-17 16:33:07.000 UTC,236,26510320,0x869305781fff479f0311974d55FeeB6Fc9DE96a2
0x9eb86e93a809a41ab0e7cc0ba6f62561fda3015c,0x4b6f9618f46ab5d4f2df589200f1bc2788c50d6c2b3da22d154966dc2ae1566b,26-02-2025,2025-02-26 07:17:41.000 UTC,18,26882457,0x6399ed6725cC163D019aA64FF55b22149D7179A8
0x2791dc5e14f7680d9d969acc26059ba56403b6d5,0xf0513418d8397a597a37fef117991c8e46a731152755e8d69d941db5e3db50ab,16-12-2024,2024-12-16 09:15:11.000 UTC,314,23775582,0xBDA319Bc7Cc8F0829df39eC0FFF5D1E061FFadf7
0xdc98dbffcc648d6088a2ff8f7dc01aef050e58fc,0x86674318c7a987cdf831ea2093c75246e1ccacf36df0e04b950003cd123f4fa7,14-01-2025,2025-01-14 21:07:31.000 UTC,509,25049752,0x869305781fff479f0311974d55FeeB6Fc9DE96a2
0xdc98dbffcc648d6088a2ff8f7dc01aef050e58fc,0x5f83ddf5fcd6bc3e222b3f080e8b67b8b8dc2770156fd9d1808065243b137cf8,14-01-2025,2025-01-14 01:59:47.000 UTC,494,25015320,0xBDA319Bc7Cc8F0829df39eC0FFF5D1E061FFadf7
0x2791dc5e14f7680d9d969acc26059ba56403b6d5,0x87af9cb41a6427126bb50eb7749fdc53e5598a8f38c0c1e7115f165ce51d6f98,07-12-2024,2024-12-07 05:43:45.000 UTC,197,23380439,0x0e956C897bBFCbd2155D3DfdD27c87fa5A0FaD39
0x2791dc5e14f7680d9d969acc26059ba56403b6d5,0xe86ef6c9c241d80966f1f1af4ec25167087aca202f57a4a072e60baf8db0fe9d,14-12-2024,2024-12-14 21:02:55.000 UTC,454,23710414,0xBDA319Bc7Cc8F0829df39eC0FFF5D1E061FFadf7
0x2791dc5e14f7680d9d969acc26059ba56403b6d5,0xed3d1d40577061045fc451b3fb450aa4e5ee358147ce12813906399bce8a03bb,09-01-2025,2025-01-09 02:40:21.000 UTC,414,24800537,0x869305781fff479f0311974d55FeeB6Fc9DE96a2
0x9eb86e93a809a41ab0e7cc0ba6f62561fda3015c,0x21685fc25e432cbe635c9e65eb76daf9b249a5e41ac2c690bd9eb10f8375e554,09-01-2025,2025-01-09 08:28:41.000 UTC,430,24810987,0xB9E4E0368A9F281584C9adB685e6C9F4b9F37dBb
0x9eb86e93a809a41ab0e7cc0ba6f62561fda3015c,0xbd8131dc0a1a5ec302150e23a4f00a215b84859a096ce5eaa40ec01c5b648979,01-01-2025,2025-01-01 15:35:49.000 UTC,224,24478201,0xBDA319Bc7Cc8F0829df39eC0FFF5D1E061FFadf7
0x351f61e4c49cf11f24d9f2e737ca5eff81806355,0x1a01d05f18d30d61ebfbd21ad65f212fbd351badc343eb3eb21281a0c0ce7b85,10-10-2025,2025-10-10 10:25:01.000 UTC,395,36651277,0x0e956C897bBFCbd2155D3DfdD27c87fa5A0FaD39
0x9eb86e93a809a41ab0e7cc0ba6f62561fda3015c,0x4c2c03e23e2a3d6d395a2768d2141eed7d1115804697416b71053d971b447349,11-12-2024,2024-12-11 07:00:57.000 UTC,788,23555555,0xBDA319Bc7Cc8F0829df39eC0FFF5D1E061FFadf7
0xdc98dbffcc648d6088a2ff8f7dc01aef050e58fc,0x9da070ed7b4907bceace729b253309b3d3aa8787baed5c5e155136489c150e08,04-01-2025,2025-01-04 04:47:41.000 UTC,419,24588357,0xBDA319Bc7Cc8F0829df39eC0FFF5D1E061FFadf7
0x2791dc5e14f7680d9d969acc26059ba56403b6d5,0xe2e1bd341ee6fa8dbcc6a6f5f21a9910bcbe52b7e64d2c80ef48fb9d5c031767,06-01-2025,2025-01-06 10:24:37.000 UTC,426,24684865,0xBDA319Bc7Cc8F0829df39eC0FFF5D1E061FFadf7
0x8fd1b615c006ebeb8a7cfb00a1dd809f31943b08,0xda59c174ecd18ef9506738f49a5b672bfcee48f660a1b98cade43e4cd0098cea,15-07-2025,2025-07-15 05:07:23.000 UTC,427,32883348,0xf2c38dE50A250C0060fB45eBE4504B67f6F1be3C
0x9eb86e93a809a41ab0e7cc0ba6f62561fda3015c,0x3c7cdc11cd7e039e7485fc77b2f11fe1dee811e45d9a483f4641c1995b61ec6c,06-02-2025,2025-02-06 05:25:43.000 UTC,210,26015098,0x0e956C897bBFCbd2155D3DfdD27c87fa5A0FaD39
0x9eb86e93a809a41ab0e7cc0ba6f62561fda3015c,0x31427bcec0d38f09bf9d5284d7c95cb4fa1e1625ec7d7b1b23a06779828d281e,09-12-2024,2024-12-09 11:42:25.000 UTC,588,23477599,0xF33a96b5932D9E9B9A0eDA447AbD8C9d48d2e0c8
0x8fd1b615c006ebeb8a7cfb00a1dd809f31943b08,0xb5b749eafbf425e6d1ce5caca2275975b03fde0e29f9196635dad0490bcb4d4a,06-01-2025,2025-01-06 04:46:11.000 UTC,432,24674712,0xBDA319Bc7Cc8F0829df39eC0FFF5D1E061FFadf7
0xdc98dbffcc648d6088a2ff8f7dc01aef050e58fc,0x0163ed17ec090e308bdb72163716abaf97658ab2075250ddeee5fa463692d9a8,13-01-2025,2025-01-13 10:21:37.000 UTC,187,24987175,0xBDA319Bc7Cc8F0829df39eC0FFF5D1E061FFadf7
0x38f6d2d9ea493c3c6ee865b5b952b5fe9e3e61fc,0x1b2bd10e23fb1701dd524eb8ecbe1c94505ccf0b937aa8a9e750621df11af0c2,07-06-2025,2025-06-07 02:19:03.000 UTC,399,31236698,0xc3f97660D0b47F0E05C3c513f73eeff7c1bd6c7a
0x2791dc5e14f7680d9d969acc26059ba56403b6d5,0x45d068c62b097966848b926fab8fa3391915ff50132a4311b99fd4adbfe14140,16-12-2024,2024-12-16 03:10:41.000 UTC,236,23764647,0xBDA319Bc7Cc8F0829df39eC0FFF5D1E061FFadf7
0xdc98dbffcc648d6088a2ff8f7dc01aef050e58fc,0x9bee5a65a6048083174d57e4ae3697e5e3bb069942cba576ccac82c19af2f3fa,13-01-2025,2025-01-13 01:07:17.000 UTC,345,24970545,0xBDA319Bc7Cc8F0829df39eC0FFF5D1E061FFadf7
0x8fd1b615c006ebeb8a7cfb00a1dd809f31943b08,0x66614ff820503b6b1590a1c899553173e6a3d4afd7c025eaa0d8cd486a348a97,20-12-2024,2024-12-20 03:22:33.000 UTC,329,23937803,0xBDA319Bc7Cc8F0829df39eC0FFF5D1E061FFadf7
0x38f6d2d9ea493c3c6ee865b5b952b5fe9e3e61fc,0xaf7d30b69fd59ed8a6189fdc19eb699459ed2d2d2af097c4cadb944a42bdefa6,13-01-2025,2025-01-13 13:55:09.000 UTC,278,24993581,0x0e956C897bBFCbd2155D3DfdD27c87fa5A0FaD39
0x2791dc5e14f7680d9d969acc26059ba56403b6d5,0xb79c79bcb66105ca57b61f44d2703d86cc75292945512099afda118d8193f5c4,09-01-2025,2025-01-09 03:38:45.000 UTC,638,24802289,0x0e956C897bBFCbd2155D3DfdD27c87fa5A0FaD39
0xdc98dbffcc648d6088a2ff8f7dc01aef050e58fc,0xa0c9305df714b6f5acb8dc80c04aae5212535629a86bb30a53186748916b9f7d,04-01-2025,2025-01-04 23:31:05.000 UTC,334,24622059,0x869305781fff479f0311974d55FeeB6Fc9DE96a2
0x38f6d2d9ea493c3c6ee865b5b952b5fe9e3e61fc,0xce8660aff7576f82f3248b035b66d634fc2b1e607e201ac95fed6aa926f586d0,10-06-2025,2025-06-10 13:28:23.000 UTC,445,31386378,0xc3f97660D0b47F0E05C3c513f73eeff7c1bd6c7a
0x2791dc5e14f7680d9d969acc26059ba56403b6d5,0xc06edd19c88a4cfde9da5bc0e8d2b8e113c5f1034198e87fc61193607e5dbd81,03-01-2025,2025-01-03 22:13:01.000 UTC,561,24576517,0xBDA319Bc7Cc8F0829df39eC0FFF5D1E061FFadf7
0x9eb86e93a809a41ab0e7cc0ba6f62561fda3015c,0x29296bfab49556cfb3e29d9da61bab66c1f36994e9df74103054e64f32e96abd,05-02-2025,2025-02-05 15:35:49.000 UTC,468,25990201,0xB9E4E0368A9F281584C9adB685e6C9F4b9F37dBb
0x8fd1b615c006ebeb8a7cfb00a1dd809f31943b08,0x1aca7cc9a0a3e3dec29e5936c141734d7dd8d66857326d5abb5c015d05633bb1,22-12-2024,2024-12-22 07:47:57.000 UTC,289,24032165,0xBDA319Bc7Cc8F0829df39eC0FFF5D1E061FFadf7
0xdc98dbffcc648d6088a2ff8f7dc01aef050e58fc,0x670fea55aa38a163c70837635f6feb31e85e5fbf19add1e414d45e26451f1187,30-12-2024,2024-12-30 00:06:09.000 UTC,308,24363911,0x869305781fff479f0311974d55FeeB6Fc9DE96a2
0xdc98dbffcc648d6088a2ff8f7dc01aef050e58fc,0x05317980bdf75b679c4f8a6048cc46035af775de1341ca3bbf5093c6e6d6864a,10-04-2025,2025-04-10 03:29:21.000 UTC,384,28733207,0x430C09546ae9249AB75B9A4ef7B5FD9a4006D6f3
0x38f6d2d9ea493c3c6ee865b5b952b5fe9e3e61fc,0xf9a05b0655b9ad0c1d88780b139cf160e56392f4a3e60742251db68f603fb7a8,08-01-2025,2025-01-08 11:20:23.000 UTC,178,24772938,0x869305781fff479f0311974d55FeeB6Fc9DE96a2
0x8fd1b615c006ebeb8a7cfb00a1dd809f31943b08,0x016dfaf2a369fc8c1268255f5a22bdee96fbab542e48bad300ee89c1c069069f,04-01-2025,2025-01-04 00:14:09.000 UTC,358,24580151,0xBDA319Bc7Cc8F0829df39eC0FFF5D1E061FFadf7
0xdc98dbffcc648d6088a2ff8f7dc01aef050e58fc,0x895c90c2c9eafd71caad61b1d78caf5893854f9b88bfe578121cc63792cffa96,07-01-2025,2025-01-07 09:19:39.000 UTC,295,24726116,0xB9E4E0368A9F281584C9adB685e6C9F4b9F37dBb
0x8fd1b615c006ebeb8a7cfb00a1dd809f31943b08,0xe6e6b1984de497c3ca4176f788a11609d04f46368303d154df4e30e76291e61e,08-12-2024,2024-12-08 19:44:07.000 UTC,202,23448850,0xCFede447ca3b4885720B5a327e3BFb02078f06e8
0x095d0de0ecfd6832f1a7961ae26d285d68655d60,0x05f163141d4eb1658e894ec9b8d8c901f10541403294b92e491a7dd7150af02b,03-04-2025,2025-04-03 17:09:47.000 UTC,410,28455420,0x0e956C897bBFCbd2155D3DfdD27c87fa5A0FaD39
0xdc98dbffcc648d6088a2ff8f7dc01aef050e58fc,0x163835a31f5191acdc997d945ddf7a7ca3c46a538b8c8c24145e12cad3c2ccf2,09-01-2025,2025-01-09 03:38:29.000 UTC,413,24802281,0x0e956C897bBFCbd2155D3DfdD27c87fa5A0FaD39
0xdc98dbffcc648d6088a2ff8f7dc01aef050e58fc,0x5598ee3f8db3d75c90fa9d7c594e48b5efe43827ff797405ba2cdc9d61b03252,13-07-2025,2025-07-13 19:36:25.000 UTC,35,32823019,0x430C09546ae9249AB75B9A4ef7B5FD9a4006D6f3
0xdc98dbffcc648d6088a2ff8f7dc01aef050e58fc,0xc15b5e8855ba0d568895f61fba359c7bc2725afcc45331eddafd13f345d15596,04-01-2025,2025-01-04 06:08:09.000 UTC,488,24590771,0xBDA319Bc7Cc8F0829df39eC0FFF5D1E061FFadf7
0x38f6d2d9ea493c3c6ee865b5b952b5fe9e3e61fc,0x22b1212d16160e3071129db761fc21386131a7e881f944119a8e8b1083ab4a53,04-03-2025,2025-03-04 02:48:39.000 UTC,869,27133586,0xB9E4E0368A9F281584C9adB685e6C9F4b9F37dBb
0x8508fd4238162cb3f3d485f432202af3b40f164e,0xaa8ffeff910e8c9a9e692d1787b62eae2d0f5b6c52be1bb538df4117bf79a8e2,05-04-2025,2025-04-05 17:41:29.000 UTC,195,28542771,0x2B74B62c564456C48055bd515A62594742b3f545
0x2791dc5e14f7680d9d969acc26059ba56403b6d5,0xb482262c76948973e953916e198f1216cb0be280b69f1626a4cef5e8e332b47e,09-01-2025,2025-01-09 04:11:19.000 UTC,339,24803266,0x0e956C897bBFCbd2155D3DfdD27c87fa5A0FaD39
0x38f6d2d9ea493c3c6ee865b5b952b5fe9e3e61fc,0x3a287c012b05dda011536f18180bfe825ddea7d9464d81240d32245765dbe70e,10-01-2025,2025-01-10 18:45:15.000 UTC,366,24872684,0xBDA319Bc7Cc8F0829df39eC0FFF5D1E061FFadf7
0x8fd1b615c006ebeb8a7cfb00a1dd809f31943b08,0xdb4e7dad67642429a06b024a2e6017691a82fcfce05291ea883579ec62012209,19-12-2024,2024-12-19 21:31:17.000 UTC,329,23927265,0xBDA319Bc7Cc8F0829df39eC0FFF5D1E061FFadf7
0x8508fd4238162cb3f3d485f432202af3b40f164e,0xcd5c0a0efe017324ac8445d34fcd4bdc2725f6f12ed8890f558df1961f9306d9,29-03-2025,2025-03-29 04:07:39.000 UTC,258,28215956,0x2B74B62c564456C48055bd515A62594742b3f545
0x2791dc5e14f7680d9d969acc26059ba56403b6d5,0x853610869a0b7fe9b3bd0f48984ca5b3ae7761ffe916c5ceb121d4c6b48cdcdb,12-07-2025,2025-07-12 05:34:07.000 UTC,121,32754550,0xCFede447ca3b4885720B5a327e3BFb02078f06e8
0x38f6d2d9ea493c3c6ee865b5b952b5fe9e3e61fc,0xf70ea08d07afcb66b77455d2c22fbc751503cfcbd8e009d88f0d3f4bd276c0d9,29-12-2024,2024-12-29 21:32:55.000 UTC,211,24359314,0x869305781fff479f0311974d55FeeB6Fc9DE96a2
0x9eb86e93a809a41ab0e7cc0ba6f62561fda3015c,0x2c9117ee109926174aa96d1716b8d2dc8f157646c46dc548351298ae3351c487,03-02-2025,2025-02-03 19:30:53.000 UTC,334,25910853,0x0e956C897bBFCbd2155D3DfdD27c87fa5A0FaD39
0x095d0de0ecfd6832f1a7961ae26d285d68655d60,0x12669d51f4d4863a0fa4a077c7c5ab655196281b1b1000d3291682ade5a5ae6b,25-04-2025,2025-04-25 12:26:55.000 UTC,477,29397334,0x869305781fff479f0311974d55FeeB6Fc9DE96a2
0x9eb86e93a809a41ab0e7cc0ba6f62561fda3015c,0xf020609c3cf59565973d131dbca5ccd52d6b621b35255649cae546ebb14c7f2e,20-02-2025,2025-02-20 18:25:19.000 UTC,354,26643286,0x6399ed6725cC163D019aA64FF55b22149D7179A8
0x38f6d2d9ea493c3c6ee865b5b952b5fe9e3e61fc,0x0d0f82cf43b2865300944c06937958b240c011101738993d21d943d67145a196,16-12-2024,2024-12-16 05:21:59.000 UTC,291,23768586,0xCFede447ca3b4885720B5a327e3BFb02078f06e8
0x2791dc5e14f7680d9d969acc26059ba56403b6d5,0x3f45bcf804f86bcf691827b0ac563f3dc8dfcada6d1e2971e4b0522b172483bd,05-01-2025,2025-01-05 14:54:35.000 UTC,393,24649764,0xBDA319Bc7Cc8F0829df39eC0FFF5D1E061FFadf7
0x8508fd4238162cb3f3d485f432202af3b40f164e,0x6b92f0ed59056216a7c380720e072798e351d05acfc0455ecc7899711afeb786,09-05-2025,2025-05-09 12:11:05.000 UTC,614,30001659,0x869305781fff479f0311974d55FeeB6Fc9DE96a2
0x8508fd4238162cb3f3d485f432202af3b40f164e,0xd64665738f40b872d474c4ab2c51c8e53e92a03e8cec8b80413a5419742e5b1e,10-05-2025,2025-05-10 07:00:23.000 UTC,693,30035538,0x869305781fff479f0311974d55FeeB6Fc9DE96a2
0xdc98dbffcc648d6088a2ff8f7dc01aef050e58fc,0x793c8953a739c72a1583440037a9b3dafa01cc5751e6bb4451b1e4ebc93c4c01,02-01-2025,2025-01-02 18:51:09.000 UTC,320,24527261,0xBDA319Bc7Cc8F0829df39eC0FFF5D1E061FFadf7
0x8508fd4238162cb3f3d485f432202af3b40f164e,0x39d32da9476c6ded82918763ab03c8e730e8d9ff749801b3b318a950edf9409c,08-04-2025,2025-04-08 15:59:29.000 UTC,177,28669311,0x2B74B62c564456C48055bd515A62594742b3f545
0x9eb86e93a809a41ab0e7cc0ba6f62561fda3015c,0xedab4256b910ea6579f85e768f018f7d14ae9071607bf4a8f782d3971be232a0,11-06-2025,2025-06-11 17:55:21.000 UTC,1731,31437587,0xc3f97660D0b47F0E05C3c513f73eeff7c1bd6c7a
0x095d0de0ecfd6832f1a7961ae26d285d68655d60,0x398c92784ed38e26b33b9516b3b9ea57ba8e6641cbc2623327bca667fb54c9eb,13-05-2025,2025-05-13 05:57:13.000 UTC,61,30163243,0x0e956C897bBFCbd2155D3DfdD27c87fa5A0FaD39
0x2791dc5e14f7680d9d969acc26059ba56403b6d5,0x92a06ad44656b1d3e980413ccdd7278f05eb093c431d94ba776eb6d0f65d33a0,17-01-2025,2025-01-17 13:11:53.000 UTC,460,25165083,0x0e956C897bBFCbd2155D3DfdD27c87fa5A0FaD39
0x8fd1b615c006ebeb8a7cfb00a1dd809f31943b08,0x179326f82b3745bee4e1fca3cbdd9109eff07957de0bba9ad5b5e68a1e39f049,09-01-2025,2025-01-09 11:28:31.000 UTC,242,24816382,0xB9E4E0368A9F281584C9adB685e6C9F4b9F37dBb
0x095d0de0ecfd6832f1a7961ae26d285d68655d60,0x717de881d914760e5422112ff501838fdf2999c0d7970c64069b9aa52ee87a97,08-05-2025,2025-05-08 01:45:03.000 UTC,237,29939678,0x869305781fff479f0311974d55FeeB6Fc9DE96a2
0x2791dc5e14f7680d9d969acc26059ba56403b6d5,0x4fedce90bc5879d7151f3af9c28c81d08c4b550ecd9f0b2ca97ce23d356f0d05,05-01-2025,2025-01-05 06:15:59.000 UTC,225,24634206,0x869305781fff479f0311974d55FeeB6Fc9DE96a2
0x2791dc5e14f7680d9d969acc26059ba56403b6d5,0x6e00d967e452f4c801d4b7171a200a13284849e7bb1355e0f04483f067e5979c,15-12-2024,2024-12-15 03:19:19.000 UTC,143,23721706,0xBDA319Bc7Cc8F0829df39eC0FFF5D1E061FFadf7
0x2791dc5e14f7680d9d969acc26059ba56403b6d5,0xcab89134e3c0c863e40f2aa15726654ecad5434443a437abd4e200da5f7ab53d,15-12-2024,2024-12-15 18:57:33.000 UTC,394,23749853,0xBDA319Bc7Cc8F0829df39eC0FFF5D1E061FFadf7
0x8fd1b615c006ebeb8a7cfb00a1dd809f31943b08,0x1b947320aae2c9b8795b6e5bad6db3a18740cabeafce931a4a8e8fd8f9c20f52,03-01-2025,2025-01-03 13:55:35.000 UTC,314,24561594,0xB9E4E0368A9F281584C9adB685e6C9F4b9F37dBb
0x8508fd4238162cb3f3d485f432202af3b40f164e,0x6d931cc4bcc116180ef16a570796ad0c626df4ce9bdd0126b56f8a810b62fca0,29-05-2025,2025-05-29 01:20:03.000 UTC,494,30846128,0xc3f97660D0b47F0E05C3c513f73eeff7c1bd6c7a
0x2791dc5e14f7680d9d969acc26059ba56403b6d5,0xaabe2de3caf76272928165394df6e95708f8973ae72a4a580f4b6aaf003e2921,09-01-2025,2025-01-09 20:53:51.000 UTC,181,24833342,0x869305781fff479f0311974d55FeeB6Fc9DE96a2
0x38f6d2d9ea493c3c6ee865b5b952b5fe9e3e61fc,0xf83ae088186c18219cd3a5124e4dc69d34b899e165bae05deeee4501b966a9fe,05-01-2025,2025-01-05 12:21:55.000 UTC,182,24645184,0x0e956C897bBFCbd2155D3DfdD27c87fa5A0FaD39
0x2791dc5e14f7680d9d969acc26059ba56403b6d5,0x14a9eb4a46b768ad619cb829ae69f39f5f0de7c0780eebb9e29dedfc0c18ed91,03-01-2025,2025-01-03 17:25:57.000 UTC,444,24567905,0xB9E4E0368A9F281584C9adB685e6C9F4b9F37dBb
0x2791dc5e14f7680d9d969acc26059ba56403b6d5,0xe5990756c32c7e38f67d976841f29a83c77007992d7598af7dc8ddecb7100a1b,06-02-2025,2025-02-06 08:35:45.000 UTC,229,26020799,0x0e956C897bBFCbd2155D3DfdD27c87fa5A0FaD39
0x8fd1b615c006ebeb8a7cfb00a1dd809f31943b08,0x98c28b30d1d0308b87b27512dd42ba83e7f60a5804c732a170b2ce7b36076592,12-01-2025,2025-01-12 17:14:11.000 UTC,433,24956352,0xBDA319Bc7Cc8F0829df39eC0FFF5D1E061FFadf7
0xdc98dbffcc648d6088a2ff8f7dc01aef050e58fc,0xbb694efcdadeb15bd32b4486294e1886923b997aa77347e22b595571380c0456,28-06-2025,2025-06-28 22:32:43.000 UTC,391,32180308,0xCFede447ca3b4885720B5a327e3BFb02078f06e8
0x9eb86e93a809a41ab0e7cc0ba6f62561fda3015c,0x5d6113e38d8f8288cdc3dc822b9c681d7e503ce573f437dc1e9f89662a9eed06,11-12-2024,2024-12-11 18:07:41.000 UTC,228,23575557,0xBDA319Bc7Cc8F0829df39eC0FFF5D1E061FFadf7
0x9eb86e93a809a41ab0e7cc0ba6f62561fda3015c,0xe66ff8431f1e7d9f1c34af14bb20b9f316a7e2f1d59ba104b0914c002d272ae0,27-12-2024,2024-12-27 20:23:25.000 UTC,379,24270829,0xCFede447ca3b4885720B5a327e3BFb02078f06e8
0x9eb86e93a809a41ab0e7cc0ba6f62561fda3015c,0xf0b9cc40373dcaaa52561fae1b0f8ac220d54ee48e11d1f1d645fc618801dff3,16-02-2025,2025-02-16 11:31:37.000 UTC,211,26458075,0x6399ed6725cC163D019aA64FF55b22149D7179A8
0xdc98dbffcc648d6088a2ff8f7dc01aef050e58fc,0xaf32280411caf9142243c6c2671b60a00ce49e6e20abd6ec996ee99c86da1acb,15-01-2025,2025-01-15 22:02:55.000 UTC,197,25094614,0x869305781fff479f0311974d55FeeB6Fc9DE96a2
0x9eb86e93a809a41ab0e7cc0ba6f62561fda3015c,0xce872e1ec176903e58f8664f4cf606b74653192cce42b47ea74f1c9c8e40f53d,04-01-2025,2025-01-04 05:57:39.000 UTC,386,24590456,0xBDA319Bc7Cc8F0829df39eC0FFF5D1E061FFadf7
0x2791dc5e14f7680d9d969acc26059ba56403b6d5,0x393f76f97632817a32c483a03e64f72c8862830da8b5851ad0eb2d90e615ee33,07-01-2025,2025-01-07 11:20:41.000 UTC,305,24729747,0x869305781fff479f0311974d55FeeB6Fc9DE96a2
0x2791dc5e14f7680d9d969acc26059ba56403b6d5,0xaff6a68456f11090abe40a74c3dda1a175c3773cff7678bcd48102197de58d58,26-12-2024,2024-12-26 12:48:01.000 UTC,233,24213967,0xBDA319Bc7Cc8F0829df39eC0FFF5D1E061FFadf7
0x8fd1b615c006ebeb8a7cfb00a1dd809f31943b08,0xa6b3ab2aed9535ede5c4035e162bc4bd172574c37dbde47afc9454c1c344bfa2,20-12-2024,2024-12-20 09:37:37.000 UTC,421,23949055,0xCFede447ca3b4885720B5a327e3BFb02078f06e8
0xdc98dbffcc648d6088a2ff8f7dc01aef050e58fc,0xe098b94963a847f2a153ed23c8a26d9c0ff35292a225fec9fda99d1117e74395,27-12-2024,2024-12-27 10:50:21.000 UTC,395,24253637,0xBDA319Bc7Cc8F0829df39eC0FFF5D1E061FFadf7
0xdc98dbffcc648d6088a2ff8f7dc01aef050e58fc,0x792edc8a82be0d4782cf1c67723219ff1931d4faeb8c32b76c89e7d22676a9a3,12-01-2025,2025-01-12 23:42:47.000 UTC,282,24968010,0xBDA319Bc7Cc8F0829df39eC0FFF5D1E061FFadf7
0x9eb86e93a809a41ab0e7cc0ba6f62561fda3015c,0x855cc7c073c7c8b2c0c12b07c7599040245e6563a5b1ff557e830a45dfa96140,09-01-2025,2025-01-09 02:53:47.000 UTC,2970,24800940,0x869305781fff479f0311974d55FeeB6Fc9DE96a2
0x095d0de0ecfd6832f1a7961ae26d285d68655d60,0xeea94392a467f6c596faa923bc29d5cd6e9b303cdc458baaf88a0af796733b1e,27-02-2025,2025-02-27 05:59:31.000 UTC,426,26923312,0x869305781fff479f0311974d55FeeB6Fc9DE96a2
0x38f6d2d9ea493c3c6ee865b5b952b5fe9e3e61fc,0x4ff7779b53cb84d8110b1121ef1aa6e12c76824187478fcfa16815468f38007b,04-01-2025,2025-01-04 00:21:11.000 UTC,412,24580362,0x869305781fff479f0311974d55FeeB6Fc9DE96a2
0xdc98dbffcc648d6088a2ff8f7dc01aef050e58fc,0x02368cf07ad1a4f34124cd936ec88288d5b008a2d8dac1e535e139c14c9d4ebc,17-12-2024,2024-12-17 01:10:49.000 UTC,324,23804251,0xCFede447ca3b4885720B5a327e3BFb02078f06e8
0x9eb86e93a809a41ab0e7cc0ba6f62561fda3015c,0x93574124ff9e87e09c35e0f970b0c0a0f57387c2c8ab1611095a078cb99021fa,04-03-2025,2025-03-04 09:00:31.000 UTC,438,27144742,0x6399ed6725cC163D019aA64FF55b22149D7179A8
0x8508fd4238162cb3f3d485f432202af3b40f164e,0xb5cbf3c4fbf74224ac92b7747816a12b26a44651b2d440ded8d506bdc5f3da42,25-06-2025,2025-06-25 20:03:49.000 UTC,363,32046241,0xc3f97660D0b47F0E05C3c513f73eeff7c1bd6c7a
0xdc98dbffcc648d6088a2ff8f7dc01aef050e58fc,0xcfe543acfabd9bec66c22fd70d4a24eaeb5e1769d8e378afb3d21a188c9b3382,21-12-2024,2024-12-21 23:18:41.000 UTC,482,24016887,0xBDA319Bc7Cc8F0829df39eC0FFF5D1E061FFadf7
0x2791dc5e14f7680d9d969acc26059ba56403b6d5,0x504e72973c0aed5e959c087b64cf48f3164e0b339e0ffb0ef530d3ed0b9f6214,12-12-2024,2024-12-12 17:42:41.000 UTC,369,23618007,0xBDA319Bc7Cc8F0829df39eC0FFF5D1E061FFadf7
0x8fd1b615c006ebeb8a7cfb00a1dd809f31943b08,0x7fce4263fbffae60414247ccc6d3162d4e32d9f844107d4700c89af5c754e306,20-06-2025,2025-06-20 07:41:55.000 UTC,217,31807984,0xCFede447ca3b4885720B5a327e3BFb02078f06e8
0x8fd1b615c006ebeb8a7cfb00a1dd809f31943b08,0x4a3539e7aefa2a50c1d21fb04d8b7824c04011e49ce0ec6e90c9d4feb0d197bb,20-02-2025,2025-02-20 04:04:09.000 UTC,169,26617451,0x869305781fff479f0311974d55FeeB6Fc9DE96a2
0x2791dc5e14f7680d9d969acc26059ba56403b6d5,0xc2553c844b9b6602ee8f9738fa76bc193bd1304a6de7dc4602a1f2ac5500e2b6,04-01-2025,2025-01-04 18:06:13.000 UTC,597,24612313,0xB9E4E0368A9F281584C9adB685e6C9F4b9F37dBb
0x095d0de0ecfd6832f1a7961ae26d285d68655d60,0xcd0367a39f69414f07965083a82a74ce1dcd644385e88a2324d35323ea3165e9,08-05-2025,2025-05-08 03:01:49.000 UTC,581,29941981,0x869305781fff479f0311974d55FeeB6Fc9DE96a2
0x2791dc5e14f7680d9d969acc26059ba56403b6d5,0x104988d7dd04ac504e90fac7a5311b5ef36bb22d9f0bcfb765c7b437c890875e,02-01-2025,2025-01-02 12:57:01.000 UTC,494,24516637,0xBDA319Bc7Cc8F0829df39eC0FFF5D1E061FFadf7
0x38f6d2d9ea493c3c6ee865b5b952b5fe9e3e61fc,0x13cf828e5c667d4825c9fb4bc3c635d1010ee535a339b4c0e85725a20eda4585,06-01-2025,2025-01-06 10:22:37.000 UTC,291,24684805,0xB9E4E0368A9F281584C9adB685e6C9F4b9F37dBb
0x38f6d2d9ea493c3c6ee865b5b952b5fe9e3e61fc,0x120e5dd09331bd34a6a0247480604e4680a96108671bd365c7721133a332eef4,02-01-2025,2025-01-02 07:25:23.000 UTC,266,24506688,0x0e956C897bBFCbd2155D3DfdD27c87fa5A0FaD39
0x8508fd4238162cb3f3d485f432202af3b40f164e,0x923219d0d25e3faf7582a987629dd7028c86b1c7d33b2647f6450028e1b50ed0,07-04-2025,2025-04-07 04:23:09.000 UTC,274,28605221,0x2B74B62c564456C48055bd515A62594742b3f545
0x38f6d2d9ea493c3c6ee865b5b952b5fe9e3e61fc,0x58d52eb29e9b145031969adefe0875ea44335be0006bc988d92e997f30286ca5,03-06-2025,2025-06-03 03:30:57.000 UTC,1711,31066055,0xc3f97660D0b47F0E05C3c513f73eeff7c1bd6c7a
0xdc98dbffcc648d6088a2ff8f7dc01aef050e58fc,0x44d006e2124c8e2bedbee7a19b20cd64edb15e26c3868aabd6ec504d14ee7629,08-07-2025,2025-07-08 12:45:19.000 UTC,374,32594686,0xc3f97660D0b47F0E05C3c513f73eeff7c1bd6c7a
0x2791dc5e14f7680d9d969acc26059ba56403b6d5,0xef31c63431a5e9fdfd9539db85b9a68e5e740974047ae019619b3d909f142f75,02-01-2025,2025-01-02 18:49:25.000 UTC,282,24527209,0xBDA319Bc7Cc8F0829df39eC0FFF5D1E061FFadf7
0x2791dc5e14f7680d9d969acc26059ba56403b6d5,0x55f2b63f8ae8d9efcce487830dbebae1a6d053312367ac8f3a5e77322098cf73,12-12-2024,2024-12-12 11:46:23.000 UTC,322,23607318,0xBDA319Bc7Cc8F0829df39eC0FFF5D1E061FFadf7
0x095d0de0ecfd6832f1a7961ae26d285d68655d60,0x00b6d5cb4497132d95165144f86079effa15ee8a869b355adf1c9cb860fda364,10-06-2025,2025-06-10 12:36:55.000 UTC,647,31384834,0xCFede447ca3b4885720B5a327e3BFb02078f06e8
0x9eb86e93a809a41ab0e7cc0ba6f62561fda3015c,0x744596995217b3eba2efbeddf8ec03706c39193693d0f411104c1fb88ca21b81,26-12-2024,2024-12-26 01:53:39.000 UTC,652,24194336,0xBDA319Bc7Cc8F0829df39eC0FFF5D1E061FFadf7
0x9eb86e93a809a41ab0e7cc0ba6f62561fda3015c,0x9328860b46240eea13d18f68b25f8aac003b260c32160fa203868f201fbf350b,03-03-2025,2025-03-03 17:54:03.000 UTC,287,27117548,0x6399ed6725cC163D019aA64FF55b22149D7179A8
0x2791dc5e14f7680d9d969acc26059ba56403b6d5,0x0a4eecb7aa5255ca76d5dbc5ebf5bdddb2c6e1973240369dffb9ea9c429882ce,19-06-2025,2025-06-19 16:20:37.000 UTC,870,31780345,0xCFede447ca3b4885720B5a327e3BFb02078f06e8
0x38f6d2d9ea493c3c6ee865b5b952b5fe9e3e61fc,0xf46eee75823c211dcdd662f3051f5b009672b0e709f0a8e329ee7689de493d83,08-12-2024,2024-12-08 05:20:01.000 UTC,228,23422927,0x0e956C897bBFCbd2155D3DfdD27c87fa5A0FaD39
0x38f6d2d9ea493c3c6ee865b5b952b5fe9e3e61fc,0x20573af9b380a127b56182d9932351f094292d77b7084a1baea06c50f37d0c37,02-06-2025,2025-06-02 05:08:39.000 UTC,440,31025786,0xc3f97660D0b47F0E05C3c513f73eeff7c1bd6c7a
0x8fd1b615c006ebeb8a7cfb00a1dd809f31943b08,0x5d37e4ce2843cb6eee5d226945ce3014a9324fa74384d0a57a5908dc5ada9381,13-07-2025,2025-07-13 19:42:27.000 UTC,442,32823200,0xf2c38dE50A250C0060fB45eBE4504B67f6F1be3C
0xdc98dbffcc648d6088a2ff8f7dc01aef050e58fc,0x42d1d2df3ef60cf2410ad2a3073d933d397e596b8739d351a1bf6b1390ef9650,05-06-2025,2025-06-05 07:05:03.000 UTC,563,31158878,0xc3f97660D0b47F0E05C3c513f73eeff7c1bd6c7a
0x2791dc5e14f7680d9d969acc26059ba56403b6d5,0x8db44f7fad45e3c191d2a7331b793d1ef47612bb5517b298cc15a455abef1275,27-12-2024,2024-12-27 17:01:39.000 UTC,397,24264776,0xBDA319Bc7Cc8F0829df39eC0FFF5D1E061FFadf7
0x2791dc5e14f7680d9d969acc26059ba56403b6d5,0xc1aa3c5cb7f7b20c7126ba9dba8175a88fd3a5d65f0505bfd89ec9c76ea913df,25-12-2024,2024-12-25 05:47:37.000 UTC,254,24158155,0xBDA319Bc7Cc8F0829df39eC0FFF5D1E061FFadf7
0x2791dc5e14f7680d9d969acc26059ba56403b6d5,0x9f761daafd6d0e4db43478521b56312163c220558e04622979b58796b7eaf6c3,17-01-2025,2025-01-17 07:50:09.000 UTC,190,25155431,0xB9E4E0368A9F281584C9adB685e6C9F4b9F37dBb
0x2791dc5e14f7680d9d969acc26059ba56403b6d5,0xe7570956cbf3cfda941e8ddc1931e564e6e515008ef04eac68b697cd1a17ff6b,10-12-2024,2024-12-10 03:59:33.000 UTC,377,23506913,0x0e956C897bBFCbd2155D3DfdD27c87fa5A0FaD39
0x2791dc5e14f7680d9d969acc26059ba56403b6d5,0x1b540752d554881e8a1807e8d70159445b24304aff7799f4f6ae3569324c6676,08-01-2025,2025-01-08 00:41:57.000 UTC,230,24753785,0xCFede447ca3b4885720B5a327e3BFb02078f06e8
0x9eb86e93a809a41ab0e7cc0ba6f62561fda3015c,0xdf5a55b7e2631ef3e242b099d4809980db6673b7596e238a49077acebe052db7,05-01-2025,2025-01-05 10:34:13.000 UTC,415,24641953,0xC23924a846eca931Ec3014253E94f15b038bd0C8
0x9eb86e93a809a41ab0e7cc0ba6f62561fda3015c,0x9a953cbc02bb776826ca6bde1fd902624818917e74aafbfa6daabb87fb7708b2,03-01-2025,2025-01-03 19:03:49.000 UTC,479,24570841,0xC23924a846eca931Ec3014253E94f15b038bd0C8
0x38f6d2d9ea493c3c6ee865b5b952b5fe9e3e61fc,0x31dcfb789bc70c89cd9e1561c3c4ad5ee01a547ecaac0b9b8a5f55d5de69c0de,25-05-2025,2025-05-25 03:57:09.000 UTC,278,30678041,0xf2c38dE50A250C0060fB45eBE4504B67f6F1be3C
0x8fd1b615c006ebeb8a7cfb00a1dd809f31943b08,0xe381e56dcce441185fc5f2dbece0bdc72b57de518a7acc3994269e2aadc3188d,19-12-2024,2024-12-19 07:24:55.000 UTC,198,23901874,0xBDA319Bc7Cc8F0829df39eC0FFF5D1E061FFadf7
0x8fd1b615c006ebeb8a7cfb00a1dd809f31943b08,0x21e95da76480e4ffc2681951b91f91df80cfc525090839e8253ddd27137f73bd,30-12-2024,2024-12-30 22:12:37.000 UTC,227,24403705,0xCFede447ca3b4885720B5a327e3BFb02078f06e8
0xdc98dbffcc648d6088a2ff8f7dc01aef050e58fc,0xe6a148a074b43ce2b6149ab49b64c33f6d43a31f35b3a36d3480e2eaefb520ef,08-01-2025,2025-01-08 04:32:55.000 UTC,192,24760714,0x869305781fff479f0311974d55FeeB6Fc9DE96a2
0x8508fd4238162cb3f3d485f432202af3b40f164e,0xe65ec8663d1e1915db5147992504ed030fe94776ad5f123cac138784c59b51a8,07-05-2025,2025-05-07 01:27:23.000 UTC,651,29895948,0x6205DfbE68444cFF504A20a712cEa794c6b6Cf04
0x9eb86e93a809a41ab0e7cc0ba6f62561fda3015c,0xf6e947b0cfe871f58b4587b75b3ce6af4176a988ba110238a7fdf5b817fe3f1b,20-12-2024,2024-12-20 18:05:33.000 UTC,326,23964293,0xBDA319Bc7Cc8F0829df39eC0FFF5D1E061FFadf7
0xdc98dbffcc648d6088a2ff8f7dc01aef050e58fc,0xec9c6824d2d68e7423d6a4cc0579513bef7d1669369a23ec380e8d4b1609f460,25-12-2024,2024-12-25 16:35:51.000 UTC,270,24177602,0xCFede447ca3b4885720B5a327e3BFb02078f06e8
0x9eb86e93a809a41ab0e7cc0ba6f62561fda3015c,0x3b3904fd1b6420e5da875e6bc9a1f953680d7bcc66c81184a72d6f9fdf61651c,07-12-2024,2024-12-07 23:49:33.000 UTC,233,23413013,0x0e956C897bBFCbd2155D3DfdD27c87fa5A0FaD39
0x8fd1b615c006ebeb8a7cfb00a1dd809f31943b08,0x2d7d722edd02805bcbc81714fb8c859d970d4252d3ad5d0fb7f000fa550a1c5c,03-07-2025,2025-07-03 01:25:59.000 UTC,423,32358306,0xf2c38dE50A250C0060fB45eBE4504B67f6F1be3C
0x2791dc5e14f7680d9d969acc26059ba56403b6d5,0xcbaf160b4daf0af8287059293cadb32a7a8ab1e126f03972d552c3bb11d46ba5,14-01-2025,2025-01-14 10:26:47.000 UTC,226,25030530,0x0e956C897bBFCbd2155D3DfdD27c87fa5A0FaD39
0x38f6d2d9ea493c3c6ee865b5b952b5fe9e3e61fc,0x13d7bb39807f9fa19d5f319166f0813c6e51c53a109b1966cf29836bae87c72e,21-05-2025,2025-05-21 10:26:51.000 UTC,185,30516932,0xc3f97660D0b47F0E05C3c513f73eeff7c1bd6c7a
0x8508fd4238162cb3f3d485f432202af3b40f164e,0x175ae2818ba99617c2a9f2cf98cde5c4306d8ac1806181edf8b956baea15a6fd,11-05-2025,2025-05-11 05:17:39.000 UTC,153,30075656,0xf2c38dE50A250C0060fB45eBE4504B67f6F1be3C
0xdc98dbffcc648d6088a2ff8f7dc01aef050e58fc,0xa64b4f79a36be4af0971d4778236bb6b74a51b8e6a00d869842d7f54587d407b,02-01-2025,2025-01-02 04:16:31.000 UTC,371,24501022,0xCFede447ca3b4885720B5a327e3BFb02078f06e8
0x38f6d2d9ea493c3c6ee865b5b952b5fe9e3e61fc,0x1f151891ffa6dcb275351ca2b1c1e9973544f4cf51713bb5ecd4b4d9cef9f100,02-01-2025,2025-01-02 08:02:33.000 UTC,418,24507803,0x0e956C897bBFCbd2155D3DfdD27c87fa5A0FaD39
0x38f6d2d9ea493c3c6ee865b5b952b5fe9e3e61fc,0x52b11d337ed2cf707c6f5f39abbc66f6caf2aa43773cfa2a6587d773a11657a6,01-06-2025,2025-06-01 06:40:25.000 UTC,343,30985339,0xc3f97660D0b47F0E05C3c513f73eeff7c1bd6c7a
0x8fd1b615c006ebeb8a7cfb00a1dd809f31943b08,0x8c9e76b027ebd68c902f38eb8af3c626583993549736c5f98493d29ea8566326,02-01-2025,2025-01-02 19:02:53.000 UTC,274,24527613,0xAfabcBbab5e4261B1d655c906738176191819164
0x38f6d2d9ea493c3c6ee865b5b952b5fe9e3e61fc,0x9162304197a657d13c5beb11e4ca2a9738b17e109d9b0c92ac0255cd022611bf,03-01-2025,2025-01-03 22:16:53.000 UTC,299,24576633,0xBDA319Bc7Cc8F0829df39eC0FFF5D1E061FFadf7
0x9eb86e93a809a41ab0e7cc0ba6f62561fda3015c,0xc4dc98862602c454e7c160abfc4e4ae58e1f611f661f3bc45e3d2ac965652cf9,28-12-2024,2024-12-28 22:47:07.000 UTC,1435,24318340,0xBDA319Bc7Cc8F0829df39eC0FFF5D1E061FFadf7
0xdc98dbffcc648d6088a2ff8f7dc01aef050e58fc,0x5b5bd124bac4b833caaa479dd7e34ab49de5e1ad298879296b0aa6a3ad5387e6,17-01-2025,2025-01-17 00:13:09.000 UTC,246,25141721,0xf2c38dE50A250C0060fB45eBE4504B67f6F1be3C
0x8fd1b615c006ebeb8a7cfb00a1dd809f31943b08,0x1d6624b85daee1b66c5929f6f4d0512b01d693101236f40991d89e72531c6669,26-12-2024,2024-12-26 07:14:11.000 UTC,286,24203952,0xBDA319Bc7Cc8F0829df39eC0FFF5D1E061FFadf7
0x38f6d2d9ea493c3c6ee865b5b952b5fe9e3e61fc,0x7e5719e2ae087b926f41279f537d2ff1660e232b23e218c98a932cb0d4009fc0,05-01-2025,2025-01-05 03:20:39.000 UTC,200,24628946,0xBDA319Bc7Cc8F0829df39eC0FFF5D1E061FFadf7
0x2791dc5e14f7680d9d969acc26059ba56403b6d5,0xdfdc617667fef6bfd33a13a191ab1478b2bb52b57850cb8916588e2a3eb90c7a,12-01-2025,2025-01-12 18:38:29.000 UTC,322,24958881,0xBDA319Bc7Cc8F0829df39eC0FFF5D1E061FFadf7
0x19d36b9ee92a53ec1900447eba958f0030c688be,0x431640bae9c0b56fdc307d72877199b2c86b880f51ef73db3a03a6d9ab4d6612,08-06-2025,2025-06-08 17:13:55.000 UTC,306,31306744,0x0e956C897bBFCbd2155D3DfdD27c87fa5A0FaD39
0xdc98dbffcc648d6088a2ff8f7dc01aef050e58fc,0x7440fcbe096c182fe4ac7fd5bd1d7a120000f0abc3fcae2c18f801c0439a1b91,27-12-2024,2024-12-27 20:16:19.000 UTC,500,24270616,0xCFede447ca3b4885720B5a327e3BFb02078f06e8
0xdc98dbffcc648d6088a2ff8f7dc01aef050e58fc,0xe1c03204345e8b818d42b783359988a797b490fe69c5f4950828bd35cb7b5081,13-01-2025,2025-01-13 23:01:59.000 UTC,138,25009986,0xBDA319Bc7Cc8F0829df39eC0FFF5D1E061FFadf7
0x8fd1b615c006ebeb8a7cfb00a1dd809f31943b08,0xb152f4c322921e48e2329948f237f53ccf8ac44754d97c970b3493fa2a48d531,08-02-2025,2025-02-08 02:41:31.000 UTC,407,26096572,0x0e956C897bBFCbd2155D3DfdD27c87fa5A0FaD39
0xdc98dbffcc648d6088a2ff8f7dc01aef050e58fc,0x1c5d101c459c62f812f557d9807455b40bc45e3def8c640d82d84a7a8cb193f9,01-06-2025,2025-06-01 10:37:23.000 UTC,595,30992448,0xc3f97660D0b47F0E05C3c513f73eeff7c1bd6c7a
0x8810de2baa17067ddcfbd9e8f29c55f070a55f0b,0x7d411d58e1aef4e67ec678266724e58424ad27993321b43a61503e96e25d7131,18-03-2025,2025-03-18 16:33:37.000 UTC,217,27763135,0x0e956C897bBFCbd2155D3DfdD27c87fa5A0FaD39
0x095d0de0ecfd6832f1a7961ae26d285d68655d60,0x8aa378c419687b64288b87a519f2e45c3ed514b64d35ee6f94242ac3b37ecd5b,30-04-2025,2025-04-30 15:37:23.000 UTC,182,29619048,0x869305781fff479f0311974d55FeeB6Fc9DE96a2
0x8fd1b615c006ebeb8a7cfb00a1dd809f31943b08,0x2ec35658e14d39f998a6df64045dc6dea4c6bd5767544de3c4d7ae767709d1d4,21-12-2024,2024-12-21 01:49:41.000 UTC,303,23978217,0xBDA319Bc7Cc8F0829df39eC0FFF5D1E061FFadf7
0x9eb86e93a809a41ab0e7cc0ba6f62561fda3015c,0xacb60a1d594d33d03bf052227db567b88c6cf44fdf44598977a62a3d1c5e253c,27-12-2024,2024-12-27 10:48:19.000 UTC,266,24253576,0xBDA319Bc7Cc8F0829df39eC0FFF5D1E061FFadf7
0x9eb86e93a809a41ab0e7cc0ba6f62561fda3015c,0xa828b980b1c5ffedfd8900356f2203002da09dbf048458e6cb4f871835dd0cb7,13-02-2025,2025-02-13 04:09:25.000 UTC,171,26315209,0x0e956C897bBFCbd2155D3DfdD27c87fa5A0FaD39
0x9eb86e93a809a41ab0e7cc0ba6f62561fda3015c,0x61ad90f1d90e7677732ceccab345cc52e45163a36e13a34fa8e80d8434e0ffe3,28-12-2024,2024-12-28 13:42:09.000 UTC,538,24301991,0xBDA319Bc7Cc8F0829df39eC0FFF5D1E061FFadf7
0x8fd1b615c006ebeb8a7cfb00a1dd809f31943b08,0xc150c68ec530b814a20d1624cddc7e4b1551afc7529f35c3d2670af9506a92c8,28-12-2024,2024-12-28 21:45:17.000 UTC,291,24316485,0xCFede447ca3b4885720B5a327e3BFb02078f06e8
0x351f61e4c49cf11f24d9f2e737ca5eff81806355,0x4fac5aa5d54e264de13f4a39da12f107575166ca2a7aa6db56924ec55ce61982,20-08-2025,2025-08-20 00:13:11.000 UTC,455,34429722,0x0e956C897bBFCbd2155D3DfdD27c87fa5A0FaD39
0x095d0de0ecfd6832f1a7961ae26d285d68655d60,0x215c87ab3ca6f22e8b01d7fc82c789b46aa7c5a623cb39c6e57bafbf1035d7ec,06-02-2025,2025-02-06 04:45:41.000 UTC,375,26013897,0xB9E4E0368A9F281584C9adB685e6C9F4b9F37dBb
0x2791dc5e14f7680d9d969acc26059ba56403b6d5,0x321723cdc2a54a5a176ae1a1af5e1e4f9a27fccfb0927303f109dc4e9a91116c,05-01-2025,2025-01-05 03:06:15.000 UTC,316,24628514,0x869305781fff479f0311974d55FeeB6Fc9DE96a2
0x38f6d2d9ea493c3c6ee865b5b952b5fe9e3e61fc,0x995ca4ef715f62f7778883905d3a96a1fefdfd993d20d940f44025b1955c0563,05-01-2025,2025-01-05 02:13:19.000 UTC,227,24626926,0xBDA319Bc7Cc8F0829df39eC0FFF5D1E061FFadf7
0x9eb86e93a809a41ab0e7cc0ba6f62561fda3015c,0x1a6c3fb98d6582128f8df9bfcb985869e90d3d0cd72871bf31d5ea8e6666683b,06-06-2025,2025-06-06 04:05:03.000 UTC,691,31196678,0xc3f97660D0b47F0E05C3c513f73eeff7c1bd6c7a
0x8508fd4238162cb3f3d485f432202af3b40f164e,0x7eb7db69963482b9e4fb201767f75c269ea8d20860a2de1a60ecdeef99d6cc93,20-04-2025,2025-04-20 03:47:43.000 UTC,250,29165758,0x6205DfbE68444cFF504A20a712cEa794c6b6Cf04
0x9eb86e93a809a41ab0e7cc0ba6f62561fda3015c,0xff529f46c10d4a271ac66fd318eb023c3aae021d5e9651e7d7d3c623ebc412ee,18-05-2025,2025-05-18 08:41:43.000 UTC,477,30384178,0xCFede447ca3b4885720B5a327e3BFb02078f06e8
0xdc98dbffcc648d6088a2ff8f7dc01aef050e58fc,0xa6a6c00fb35e47b8ad2f6a29604c3a6028fab84f859a5d8a447c45d7c17cba4e,02-01-2025,2025-01-02 15:35:55.000 UTC,426,24521404,0xBDA319Bc7Cc8F0829df39eC0FFF5D1E061FFadf7
0xdc98dbffcc648d6088a2ff8f7dc01aef050e58fc,0x6c45231db2f5a119cc565444b75e7fbbb0364af84e83d099817a738652015d23,06-01-2025,2025-01-06 22:41:15.000 UTC,578,24706964,0x0e956C897bBFCbd2155D3DfdD27c87fa5A0FaD39
0x2791dc5e14f7680d9d969acc26059ba56403b6d5,0x953209ae1ea08749cc4d9dcf61fbe5021e75c8098c92d27a36621c5ccc5b65b4,09-03-2025,2025-03-09 08:10:33.000 UTC,186,27359243,0x6205DfbE68444cFF504A20a712cEa794c6b6Cf04
0x9eb86e93a809a41ab0e7cc0ba6f62561fda3015c,0xcdf2e1c0c7e2c6bc15c4df4eebb4d07e1d9aadd9aa6bee654c6f0544fc04e223,07-12-2024,2024-12-07 06:39:47.000 UTC,178,23382120,0x0e956C897bBFCbd2155D3DfdD27c87fa5A0FaD39
0x8fd1b615c006ebeb8a7cfb00a1dd809f31943b08,0x0c602f23f048919c12f7e1936743fb49cd217a06c6f96db210e9a8d1950c1e28,14-12-2024,2024-12-14 21:36:23.000 UTC,334,23711418,0x45F8b8eC9c92D09BA8495074436fD97073423041
0x9eb86e93a809a41ab0e7cc0ba6f62561fda3015c,0x6bb80d2bbe663e85258f56f88f535feb08d9b5278ad4eae76ab15808dc15bbf7,15-07-2025,2025-07-15 23:28:27.000 UTC,50,32916380,0xCFede447ca3b4885720B5a327e3BFb02078f06e8
0xdc98dbffcc648d6088a2ff8f7dc01aef050e58fc,0xc52fb7f080e72c5cf7d668cb0c7a1e1b7212bdc2b97a80b7d5aac9996e295939,18-02-2025,2025-02-18 05:36:23.000 UTC,564,26533818,0x869305781fff479f0311974d55FeeB6Fc9DE96a2
0x38f6d2d9ea493c3c6ee865b5b952b5fe9e3e61fc,0x2ee78d3abfe65ada96f932bb68388cb9d1ad28a234e2f37c8c5acce9fc4e6422,04-07-2025,2025-07-04 15:01:03.000 UTC,360,32425958,0xc3f97660D0b47F0E05C3c513f73eeff7c1bd6c7a
0x8fd1b615c006ebeb8a7cfb00a1dd809f31943b08,0x22ebdd5602383006d00d8dc1d155d8f85ed6b01fcf4b76645e970bdf2e4db3e6,10-01-2025,2025-01-10 12:35:33.000 UTC,3443,24861593,0xBDA319Bc7Cc8F0829df39eC0FFF5D1E061FFadf7
0x38f6d2d9ea493c3c6ee865b5b952b5fe9e3e61fc,0xc643b4626582b528005b395b8a92a479054d13b506f263be730cc880dac47ba8,06-01-2025,2025-01-06 13:52:15.000 UTC,359,24691094,0x0e956C897bBFCbd2155D3DfdD27c87fa5A0FaD39
0x38f6d2d9ea493c3c6ee865b5b952b5fe9e3e61fc,0x1a756ede4d250e22f34fdad0777b6acae5235d847d1da87e2a7b1d8a7d6c1832,16-12-2024,2024-12-16 12:59:25.000 UTC,212,23782309,0x0e956C897bBFCbd2155D3DfdD27c87fa5A0FaD39
0x38f6d2d9ea493c3c6ee865b5b952b5fe9e3e61fc,0x31a6edca2b080ab4ec8221214739c6ae0f71ba5c3922868fe26fef865b875521,06-01-2025,2025-01-06 21:49:39.000 UTC,176,24705416,0xB9E4E0368A9F281584C9adB685e6C9F4b9F37dBb
0x8fd1b615c006ebeb8a7cfb00a1dd809f31943b08,0xe57b7a34948766d108e9fc581b4c24fdeddc8a30f7a11d1d1528973a9cd0e571,06-01-2025,2025-01-06 19:50:07.000 UTC,218,24701830,0xBDA319Bc7Cc8F0829df39eC0FFF5D1E061FFadf7
0xdc98dbffcc648d6088a2ff8f7dc01aef050e58fc,0x61cf3259cd07c39522cae5e1cd2b80e802a6cd77ec10c241e516fc288abdad95,22-06-2025,2025-06-22 17:13:53.000 UTC,288,31911543,0xc3f97660D0b47F0E05C3c513f73eeff7c1bd6c7a
0x2791dc5e14f7680d9d969acc26059ba56403b6d5,0x3966b90c7e1c4d0a0db90f5e07d1a1d8983ff414b3770d9406149b158c10aede,20-12-2024,2024-12-20 19:18:31.000 UTC,645,23966482,0xBDA319Bc7Cc8F0829df39eC0FFF5D1E061FFadf7
0x8fd1b615c006ebeb8a7cfb00a1dd809f31943b08,0x4a71cd0b80b4899d2ab655597600ee6dbfb0d1d3c49274c711d223754d1f0ae3,05-01-2025,2025-01-05 04:31:13.000 UTC,856,24631063,0xBDA319Bc7Cc8F0829df39eC0FFF5D1E061FFadf7
0x9eb86e93a809a41ab0e7cc0ba6f62561fda3015c,0x23ec1bdc75f89b6f4b056d8141bd0410efcb3ddef793f929967c61c459379941,31-12-2024,2024-12-31 04:36:29.000 UTC,253,24415221,0xCFede447ca3b4885720B5a327e3BFb02078f06e8
0x8fd1b615c006ebeb8a7cfb00a1dd809f31943b08,0x9ab6aa66e0b0283424c37d0b463be99f15b86d843692bfa44cda415217fabc51,18-12-2024,2024-12-18 22:12:37.000 UTC,426,23885305,0xBDA319Bc7Cc8F0829df39eC0FFF5D1E061FFadf7
0x8508fd4238162cb3f3d485f432202af3b40f164e,0x67ec7a0624c6f9925e5cfb4f1a94223ce8395b092245a4581c19328ebd73c155,31-05-2025,2025-05-31 04:22:43.000 UTC,910,30938008,0x6205DfbE68444cFF504A20a712cEa794c6b6Cf04
0xdc98dbffcc648d6088a2ff8f7dc01aef050e58fc,0xd1a9ebf73829630a6d0fb06ea115f59764fd5a379fccc032c7b976088614974f,12-05-2025,2025-05-12 04:36:43.000 UTC,178,30117628,0xCFede447ca3b4885720B5a327e3BFb02078f06e8
0xdc98dbffcc648d6088a2ff8f7dc01aef050e58fc,0x61ecbf3f497ac758ace322327dc1d0743cb4d235cc14a1b0ac7abd52acc0f741,11-01-2025,2025-01-11 21:34:51.000 UTC,346,24920972,0xBDA319Bc7Cc8F0829df39eC0FFF5D1E061FFadf7
0x8fd1b615c006ebeb8a7cfb00a1dd809f31943b08,0xa2f045a29a25fa5c94a921d32e3d0ac45d18cced7e35191818512f9cd2be4e70,04-01-2025,2025-01-04 10:35:45.000 UTC,941,24598799,0xB9E4E0368A9F281584C9adB685e6C9F4b9F37dBb
0x9eb86e93a809a41ab0e7cc0ba6f62561fda3015c,0xed0aff2d68fc1a3a56f2444432c637b9e3c23da2068f3ee2e77dca0a1f210d75,19-12-2024,2024-12-19 01:02:31.000 UTC,428,23890402,0xBDA319Bc7Cc8F0829df39eC0FFF5D1E061FFadf7
0xdc98dbffcc648d6088a2ff8f7dc01aef050e58fc,0x08a0af2f1f15d21a055ead7e52e6f1a1b084a5cb1df039434977460c6e929a38,09-01-2025,2025-01-09 20:28:19.000 UTC,250,24832576,0x869305781fff479f0311974d55FeeB6Fc9DE96a2
0x8508fd4238162cb3f3d485f432202af3b40f164e,0x256504bf6aebf4892f399a4175ea22dceed15cf94d58f06412f365195c88e840,19-03-2025,2025-03-19 04:22:51.000 UTC,167,27784412,0x2B74B62c564456C48055bd515A62594742b3f545
0x9eb86e93a809a41ab0e7cc0ba6f62561fda3015c,0x04915e357eebd9ab0eb3c45880293a8880b583d34db38b4d8d19239945653b58,08-01-2025,2025-01-08 02:39:49.000 UTC,304,24757321,0x869305781fff479f0311974d55FeeB6Fc9DE96a2
0xdc98dbffcc648d6088a2ff8f7dc01aef050e58fc,0xf41c751955f121b0145aa0303c7df1fcd4977ac95012c5d211d4dcf5e85a1ead,31-12-2024,2024-12-31 17:44:05.000 UTC,335,24438849,0x869305781fff479f0311974d55FeeB6Fc9DE96a2
0x8508fd4238162cb3f3d485f432202af3b40f164e,0x13f1c31d93e5b54cb00b820f8271b31298551bf79a47d11faccd9af75b26c31b,30-05-2025,2025-05-30 10:24:41.000 UTC,680,30905667,0xc3f97660D0b47F0E05C3c513f73eeff7c1bd6c7a
0xdc98dbffcc648d6088a2ff8f7dc01aef050e58fc,0x76c2bdb6b0df05022bde778cd663732eea670e9044946745b163e11e74507530,18-12-2024,2024-12-18 10:10:23.000 UTC,360,23863638,0xCFede447ca3b4885720B5a327e3BFb02078f06e8
0x8fd1b615c006ebeb8a7cfb00a1dd809f31943b08,0xe3511980d2a1fdddabf62c8eff4bc5135d40ca4f061556b5eb5470b4a12da18d,06-01-2025,2025-01-06 22:44:13.000 UTC,284,24707053,0xBDA319Bc7Cc8F0829df39eC0FFF5D1E061FFadf7
0x38f6d2d9ea493c3c6ee865b5b952b5fe9e3e61fc,0xff5ce7bed5528f416fba701ecaf7e0f832ce7591f194579cd1048d29c067c8e0,01-01-2025,2025-01-01 21:37:13.000 UTC,358,24489043,0x0e956C897bBFCbd2155D3DfdD27c87fa5A0FaD39
0x2791dc5e14f7680d9d969acc26059ba56403b6d5,0x72b84c73ee80e6731121f76fb887336f7a3cc57ac1a0e2eb7384d1c8ba3b9098,13-01-2025,2025-01-13 12:49:37.000 UTC,298,24991615,0x0e956C897bBFCbd2155D3DfdD27c87fa5A0FaD39
0x2791dc5e14f7680d9d969acc26059ba56403b6d5,0xcf2d64c76f8a7e816265fab27677d7b3311b0c1de7269d2ee52013841d116ca6,02-01-2025,2025-01-02 08:49:07.000 UTC,308,24509200,0x0e956C897bBFCbd2155D3DfdD27c87fa5A0FaD39
0x095d0de0ecfd6832f1a7961ae26d285d68655d60,0xbe2539008fe1d194f57e5f46d691f689d2bbe41f56b85ab96acf068f3497a393,05-02-2025,2025-02-05 15:35:11.000 UTC,64,25990182,0xB9E4E0368A9F281584C9adB685e6C9F4b9F37dBb
0x351f61e4c49cf11f24d9f2e737ca5eff81806355,0x56ab3bc7405a7134ca8930d766f54ff74c3be4bbfbdf4e60c32acdc806f80a7c,12-10-2025,2025-10-12 23:15:29.000 UTC,597,36760791,0x0e956C897bBFCbd2155D3DfdD27c87fa5A0FaD39
0x9eb86e93a809a41ab0e7cc0ba6f62561fda3015c,0xa5e072fbe7881d0c33e73e4e4d6bef06fed8a447585c954ae484c2e676b10a8c,01-01-2025,2025-01-01 15:13:51.000 UTC,320,24477542,0xC23924a846eca931Ec3014253E94f15b038bd0C8
0x351f61e4c49cf11f24d9f2e737ca5eff81806355,0x2059b95d09f55ffdd3d593b9a9f75ee056be816077811bd042b24ea10ab42e5e,12-08-2025,2025-08-12 04:13:07.000 UTC,179,34091320,0x0e956C897bBFCbd2155D3DfdD27c87fa5A0FaD39
0x38f6d2d9ea493c3c6ee865b5b952b5fe9e3e61fc,0x36496d584d46b9839c922a65aae644e157949a5a2e70754da0ff7c30265296ec,09-01-2025,2025-01-09 04:47:37.000 UTC,325,24804355,0xBDA319Bc7Cc8F0829df39eC0FFF5D1E061FFadf7
0x2791dc5e14f7680d9d969acc26059ba56403b6d5,0x5b9f8b68d3f4d995b66c32089fbee41895f64d814711bfdd04f5947c56ec2448,18-01-2025,2025-01-18 22:19:29.000 UTC,332,25224711,0xf2c38dE50A250C0060fB45eBE4504B67f6F1be3C
0x38f6d2d9ea493c3c6ee865b5b952b5fe9e3e61fc,0xf7d528820853058fb93008c4a6ddf1bd1d6c3f49165e6a48e4c8650e1f605c3f,06-06-2025,2025-06-06 05:35:03.000 UTC,462,31199378,0xc3f97660D0b47F0E05C3c513f73eeff7c1bd6c7a
0x9eb86e93a809a41ab0e7cc0ba6f62561fda3015c,0x12cb67aad1ccb331e06407586bdd1b54d1f4e9e839f7e03ee6471079249fbd17,22-05-2025,2025-05-22 16:37:25.000 UTC,2045,30571249,0xc3f97660D0b47F0E05C3c513f73eeff7c1bd6c7a
0x8fd1b615c006ebeb8a7cfb00a1dd809f31943b08,0x07b8591900f53029733c5ee2095beb6791aea45488908667c09304750a595bdc,15-12-2024,2024-12-15 09:52:23.000 UTC,207,23733498,0xBDA319Bc7Cc8F0829df39eC0FFF5D1E061FFadf7
0x2791dc5e14f7680d9d969acc26059ba56403b6d5,0xf08b330c2e38d84b589a9e7be2fbd1b35c502a3f894602069f8c7542cdca6174,13-12-2024,2024-12-13 00:39:31.000 UTC,430,23630512,0xBDA319Bc7Cc8F0829df39eC0FFF5D1E061FFadf7
0x9eb86e93a809a41ab0e7cc0ba6f62561fda3015c,0x4e0b5a8a496d849b4869451aaa71015892cf16813aefff4596b357451303d8cf,20-12-2024,2024-12-20 13:47:43.000 UTC,958,23956558,0xCFede447ca3b4885720B5a327e3BFb02078f06e8
0x38f6d2d9ea493c3c6ee865b5b952b5fe9e3e61fc,0x6a3140018c8dc3c80d6a790ed0d775d54929e43832c0b303a7419b1004c6ace2,07-01-2025,2025-01-07 04:51:29.000 UTC,378,24718071,0xBDA319Bc7Cc8F0829df39eC0FFF5D1E061FFadf7
0x8508fd4238162cb3f3d485f432202af3b40f164e,0xacfcbaea4a03f21a509bc79969eefa80ad1fc93d13800f4d778742c69724c2ee,09-07-2025,2025-07-09 12:29:45.000 UTC,244,32637419,0xf2c38dE50A250C0060fB45eBE4504B67f6F1be3C
0x8fd1b615c006ebeb8a7cfb00a1dd809f31943b08,0xd8108e6f2e2f6b4d22c201f66f0d6d98943b202483b57aecc55cedfbe0e027e2,18-02-2025,2025-02-18 05:09:49.000 UTC,240,26533021,0x869305781fff479f0311974d55FeeB6Fc9DE96a2
0xdc98dbffcc648d6088a2ff8f7dc01aef050e58fc,0x6828790c2c35fb9190616d4d3cb18eaf8fb402e4762bfd884a9986a31e627b46,13-01-2025,2025-01-13 13:27:13.000 UTC,278,24992743,0x869305781fff479f0311974d55FeeB6Fc9DE96a2
0x095d0de0ecfd6832f1a7961ae26d285d68655d60,0xf6f4126020562338a9258cc6a7a83620e29a3d261816b5d456f52c8bd0668547,24-04-2025,2025-04-24 15:04:45.000 UTC,705,29358869,0x869305781fff479f0311974d55FeeB6Fc9DE96a2
0x2791dc5e14f7680d9d969acc26059ba56403b6d5,0x670ba52dbcc598dc0ffe1976a80c6cf998a11ab49ed6dbf6576d43fb73978325,24-12-2024,2024-12-24 20:37:43.000 UTC,251,24141658,0xBDA319Bc7Cc8F0829df39eC0FFF5D1E061FFadf7
0x2791dc5e14f7680d9d969acc26059ba56403b6d5,0xa95f4c7030ccb73be36f8568d20f4edc50852ac9129178e252a77fd95e13494c,14-01-2025,2025-01-14 20:47:37.000 UTC,180,25049155,0x869305781fff479f0311974d55FeeB6Fc9DE96a2
0x9eb86e93a809a41ab0e7cc0ba6f62561fda3015c,0xc03709db2e7c1496db54f4fdda948c182fbd9537c23d5f5b83f9b02c5299b1e2,08-07-2025,2025-07-08 04:59:37.000 UTC,40,32580715,0xc3f97660D0b47F0E05C3c513f73eeff7c1bd6c7a
0x8508fd4238162cb3f3d485f432202af3b40f164e,0x6f00d58457b6b41a3d0cbf1aec9388b72e70bfa7455f61afd0ee3cbc5b3f69fc,15-05-2025,2025-05-15 23:08:45.000 UTC,166,30280589,0xf2c38dE50A250C0060fB45eBE4504B67f6F1be3C
0x9eb86e93a809a41ab0e7cc0ba6f62561fda3015c,0xa3c1f1e7561dd5645fce62b04f018bc23ac1594e86df42855a813c0c9fd236dc,11-12-2024,2024-12-11 10:32:07.000 UTC,377,23561890,0xBDA319Bc7Cc8F0829df39eC0FFF5D1E061FFadf7
0x8fd1b615c006ebeb8a7cfb00a1dd809f31943b08,0xc0f93f291d52db378a654277a724f2d309e76b2c2f10d85de19b73023d4dabb8,04-01-2025,2025-01-04 10:02:15.000 UTC,333,24597794,0xAfabcBbab5e4261B1d655c906738176191819164
0xdc98dbffcc648d6088a2ff8f7dc01aef050e58fc,0xa4217299900739331c7282e2c81f9e5bb752fff24715f01d2289a4bf9437393a,30-12-2024,2024-12-30 14:26:37.000 UTC,328,24389725,0x869305781fff479f0311974d55FeeB6Fc9DE96a2
0x2791dc5e14f7680d9d969acc26059ba56403b6d5,0xa403567119d0934dffe65e812bd822c829f36123c2d20b2bf99ca56d7cf6eb34,11-01-2025,2025-01-11 18:43:05.000 UTC,223,24915819,0xBDA319Bc7Cc8F0829df39eC0FFF5D1E061FFadf7
0x9eb86e93a809a41ab0e7cc0ba6f62561fda3015c,0x4183951aa98c4735ddd8698b95a4522253dd29fdf9bca1c93553703046f322f7,01-03-2025,2025-03-01 04:44:31.000 UTC,420,27007462,0x6399ed6725cC163D019aA64FF55b22149D7179A8
0x38f6d2d9ea493c3c6ee865b5b952b5fe9e3e61fc,0x9af3d6e8ede0bb7d170934a91a61f5af09d120d2aa0d3e927b23a2ec95842387,31-12-2024,2024-12-31 17:04:53.000 UTC,288,24437673,0x869305781fff479f0311974d55FeeB6Fc9DE96a2
0x38f6d2d9ea493c3c6ee865b5b952b5fe9e3e61fc,0x3db29e42b307789697a835d6c18208213b9359ab49267a42b84c803537e93708,14-01-2025,2025-01-14 21:09:01.000 UTC,161,25049797,0x0e956C897bBFCbd2155D3DfdD27c87fa5A0FaD39
0x095d0de0ecfd6832f1a7961ae26d285d68655d60,0xfc3cc533e84349f40a7772bbe859a7fd6c152155c4f17395823cce84e0689da2,28-03-2025,2025-03-28 06:04:23.000 UTC,219,28176258,0x0e956C897bBFCbd2155D3DfdD27c87fa5A0FaD39
0x9eb86e93a809a41ab0e7cc0ba6f62561fda3015c,0x952027c130bd788ed7cf475fc1b19f3b8f49a9cffd4218531a64187c1c44eefc,15-12-2024,2024-12-15 22:32:35.000 UTC,216,23756304,0xBDA319Bc7Cc8F0829df39eC0FFF5D1E061FFadf7
0x095d0de0ecfd6832f1a7961ae26d285d68655d60,0x55c28c4f7e82a1d08d50ad757222c5b059d8d50d971a6c810cbfca8d1c021150,02-03-2025,2025-03-02 18:49:19.000 UTC,227,27076006,0x0e956C897bBFCbd2155D3DfdD27c87fa5A0FaD39
0x38f6d2d9ea493c3c6ee865b5b952b5fe9e3e61fc,0x4c5fe578c35b11608d1be5d256edd6ba7005eaf9607aacdb763d6dba9ad08a67,03-06-2025,2025-06-03 02:53:37.000 UTC,497,31064935,0xc3f97660D0b47F0E05C3c513f73eeff7c1bd6c7a
0xdc98dbffcc648d6088a2ff8f7dc01aef050e58fc,0x83ce71e7c1e428907c759bc7652c78c54c9c2327ff124d258e1826f1f37f5bb0,11-06-2025,2025-06-11 17:01:45.000 UTC,431,31435979,0xc3f97660D0b47F0E05C3c513f73eeff7c1bd6c7a
0x2791dc5e14f7680d9d969acc26059ba56403b6d5,0xd1cdd2640467fa44bf33c5bef75c1c4fda0ad606a0354137469f35bb48d2c216,27-12-2024,2024-12-27 22:00:39.000 UTC,290,24273746,0xBDA319Bc7Cc8F0829df39eC0FFF5D1E061FFadf7
0x38f6d2d9ea493c3c6ee865b5b952b5fe9e3e61fc,0xdc3f96e39d056667d077c11d81fa85a4e3656827746ef5f860e9f05333089199,10-01-2025,2025-01-10 15:58:47.000 UTC,330,24867690,0x869305781fff479f0311974d55FeeB6Fc9DE96a2
0x8508fd4238162cb3f3d485f432202af3b40f164e,0xb1d823422b22d383e362a8d6c6dcdfddee388c727b5a033a7ce012a656514f20,11-03-2025,2025-03-11 01:13:53.000 UTC,411,27433143,0x2B74B62c564456C48055bd515A62594742b3f545
0xdc98dbffcc648d6088a2ff8f7dc01aef050e58fc,0x0fa21de273df90cfbc3a0b35ba11ae69c0ead8cfc885dfed50258d8563e066d8,06-01-2025,2025-01-06 20:27:55.000 UTC,434,24702964,0xBDA319Bc7Cc8F0829df39eC0FFF5D1E061FFadf7
0x8810de2baa17067ddcfbd9e8f29c55f070a55f0b,0xb66655bb4969c0ae468e510bb70eba3e00dc3c903ac7a7b0f125e56d29af668f,10-06-2025,2025-06-10 12:36:27.000 UTC,413,31384820,0xCFede447ca3b4885720B5a327e3BFb02078f06e8
0x9eb86e93a809a41ab0e7cc0ba6f62561fda3015c,0x149d8c7978c646c346b65c03fe4953b1790c7a9d39ba9a826cfdb59c3f7b956c,01-01-2025,2025-01-01 14:19:07.000 UTC,367,24475900,0xC23924a846eca931Ec3014253E94f15b038bd0C8
0x38f6d2d9ea493c3c6ee865b5b952b5fe9e3e61fc,0x1d4b636a7f82b6753ba56a6180a25522a108b4df95e8fcc4ff8fa5ef256f6cb3,03-01-2025,2025-01-03 20:13:13.000 UTC,263,24572923,0xBDA319Bc7Cc8F0829df39eC0FFF5D1E061FFadf7
0xdc98dbffcc648d6088a2ff8f7dc01aef050e58fc,0xb75363e53d15aaf05eb6d505edef6a3133c559d557ffb2deb6f5cee8f496a68b,09-01-2025,2025-01-09 14:27:43.000 UTC,938,24821758,0x869305781fff479f0311974d55FeeB6Fc9DE96a2
0x9eb86e93a809a41ab0e7cc0ba6f62561fda3015c,0xb78faaef3f61bceb0c229e2514d9f10f0b0784009dcc74a0a59c3e80bdaf0029,20-02-2025,2025-02-20 05:06:03.000 UTC,314,26619308,0x6399ed6725cC163D019aA64FF55b22149D7179A8
0xdc98dbffcc648d6088a2ff8f7dc01aef050e58fc,0xc8fba9ceadf0fe32b23807b061c077be36f0e090f1d4e1aa92996028c5960d1d,11-01-2025,2025-01-11 06:32:35.000 UTC,269,24893904,0xBDA319Bc7Cc8F0829df39eC0FFF5D1E061FFadf7
0xdc98dbffcc648d6088a2ff8f7dc01aef050e58fc,0x3a100c48015a82cd095eaaccd48d77e2a6bbd6a8d3db23e6d78286a300080a87,04-01-2025,2025-01-04 19:18:47.000 UTC,355,24614490,0x0e956C897bBFCbd2155D3DfdD27c87fa5A0FaD39
0x2791dc5e14f7680d9d969acc26059ba56403b6d5,0x503092ed82aa9e48a782f536b9686af15d5ae78dfb719097da20dcef318df40f,28-12-2024,2024-12-28 13:12:09.000 UTC,227,24301091,0xBDA319Bc7Cc8F0829df39eC0FFF5D1E061FFadf7
0x8fd1b615c006ebeb8a7cfb00a1dd809f31943b08,0x803d87a5bd70af8fabd68684148171da77a39940cfdb9ac6cf9283adbc78a32e,07-12-2024,2024-12-07 06:53:23.000 UTC,368,23382528,0x0e956C897bBFCbd2155D3DfdD27c87fa5A0FaD39
0x8fd1b615c006ebeb8a7cfb00a1dd809f31943b08,0x6ffa52f64aab8e305f2e737535bb23b733aabe4aa57d809ed22cfcc0cc27e803,03-01-2025,2025-01-03 12:40:45.000 UTC,234,24559349,0xBDA319Bc7Cc8F0829df39eC0FFF5D1E061FFadf7
0x9eb86e93a809a41ab0e7cc0ba6f62561fda3015c,0xcc1f8a0b2ad82083356668b3948330bf0b95e7ffe3e61f6d93cc36e90415f1b9,01-01-2025,2025-01-01 15:04:59.000 UTC,227,24477276,0xBDA319Bc7Cc8F0829df39eC0FFF5D1E061FFadf7
0x351f61e4c49cf11f24d9f2e737ca5eff81806355,0xa8e456bcc00f228a7fff0be2c8b6e1dddbf55c8c44d6f2f02c723c241db57fb5,01-12-2025,2025-12-01 12:41:47.000 UTC,540,38901780,0x0e956C897bBFCbd2155D3DfdD27c87fa5A0FaD39
0x8508fd4238162cb3f3d485f432202af3b40f164e,0x75bf3906b8957e7dd9817add612288c5ce05e03cb1c2ce12477b317d2e2e05fb,08-07-2025,2025-07-08 12:44:49.000 UTC,150,32594671,0xc3f97660D0b47F0E05C3c513f73eeff7c1bd6c7a
0x8fd1b615c006ebeb8a7cfb00a1dd809f31943b08,0xfc0a0ca0c3916054c60bc73ae5a0fe4b378ac941093f81a38928c812bc44234d,23-12-2024,2024-12-23 15:46:25.000 UTC,258,24089719,0xBDA319Bc7Cc8F0829df39eC0FFF5D1E061FFadf7
0x8fd1b615c006ebeb8a7cfb00a1dd809f31943b08,0x5695d90a9cb40cf19fafd8d6a6000b8639df0d9b93214cb47ecec84d494ed54c,17-02-2025,2025-02-17 12:07:11.000 UTC,259,26502342,0xF33a96b5932D9E9B9A0eDA447AbD8C9d48d2e0c8
0x8fd1b615c006ebeb8a7cfb00a1dd809f31943b08,0x84d22b85246ce2c713212f3cb4672a77c967577c351fd9040c70c4d634a7ac0d,03-01-2025,2025-01-03 01:16:47.000 UTC,395,24538830,0xAfabcBbab5e4261B1d655c906738176191819164
0xdc98dbffcc648d6088a2ff8f7dc01aef050e58fc,0x78a666b0c774d097626fda2d1e452eab9216d58992e63b7ecc0dc73345b851a1,03-01-2025,2025-01-03 18:58:19.000 UTC,510,24570676,0x869305781fff479f0311974d55FeeB6Fc9DE96a2
0xdc98dbffcc648d6088a2ff8f7dc01aef050e58fc,0x55b9974feebc5c99f1198efa51c82234b8e9e638054017d0560a34bf0333f69d,07-01-2025,2025-01-07 00:39:57.000 UTC,295,24710525,0xBDA319Bc7Cc8F0829df39eC0FFF5D1E061FFadf7
0x8fd1b615c006ebeb8a7cfb00a1dd809f31943b08,0x784046e29c3ada89ef4813ca60c3d50a0eeab77b09809c047ef0822ad8480867,29-12-2024,2024-12-29 06:04:59.000 UTC,317,24331476,0xBDA319Bc7Cc8F0829df39eC0FFF5D1E061FFadf7
0x9eb86e93a809a41ab0e7cc0ba6f62561fda3015c,0xa5c6360a347ae4328ecc2713ff1fe0c5ed6a700f5e77c74220176e115c770a3c,30-12-2024,2024-12-30 03:21:19.000 UTC,183,24369766,0xCFede447ca3b4885720B5a327e3BFb02078f06e8
0x38f6d2d9ea493c3c6ee865b5b952b5fe9e3e61fc,0x1d088e6374064bfbf3c7c61a6432c4c5d2bd5b6aa81cc7f3f306936d4a54faf8,04-01-2025,2025-01-04 23:26:47.000 UTC,372,24621930,0xBDA319Bc7Cc8F0829df39eC0FFF5D1E061FFadf7
0x8fd1b615c006ebeb8a7cfb00a1dd809f31943b08,0xbc7edda00e4efca0e4afe858f68689d2b0fb9b404d8b14a18aabe4db03db7f3d,31-12-2024,2024-12-31 17:26:41.000 UTC,190,24438327,0xBDA319Bc7Cc8F0829df39eC0FFF5D1E061FFadf7
0x38f6d2d9ea493c3c6ee865b5b952b5fe9e3e61fc,0x4eebbb513a74ab53e7660ef396f668ce354451b4bb0646f00dd81ecf18051d33,13-01-2025,2025-01-13 06:47:37.000 UTC,452,24980755,0x869305781fff479f0311974d55FeeB6Fc9DE96a2
0x8508fd4238162cb3f3d485f432202af3b40f164e,0x4fef99cfa90670a594cb5085fef21b07e07c9299c67bea11ef3162ca264bb930,11-04-2025,2025-04-11 12:42:41.000 UTC,487,28793007,0x2B74B62c564456C48055bd515A62594742b3f545
0x2791dc5e14f7680d9d969acc26059ba56403b6d5,0x9007dfc650c9c8ae61e3adc744328c541cfad543f177664af9ee467e8d7c2f3b,30-01-2025,2025-01-30 02:56:47.000 UTC,247,25708230,0x0e956C897bBFCbd2155D3DfdD27c87fa5A0FaD39
0xdc98dbffcc648d6088a2ff8f7dc01aef050e58fc,0xe2818dc3778b9ab60a991488328c185fcb0033bb5ecabc363de461f16afeb84f,11-01-2025,2025-01-11 03:15:33.000 UTC,286,24887993,0xBDA319Bc7Cc8F0829df39eC0FFF5D1E061FFadf7
0x8fd1b615c006ebeb8a7cfb00a1dd809f31943b08,0x9cdc3df13fa83018207c69aaa38e7a73eaeb3487b4c3a2b67e81d2585467ce4c,01-01-2025,2025-01-01 13:32:05.000 UTC,350,24474489,0xCFede447ca3b4885720B5a327e3BFb02078f06e8
0x38f6d2d9ea493c3c6ee865b5b952b5fe9e3e61fc,0xda86bf3d49949129ab9564c5193b728ac5c7f6600530f983f0368af2b26b27d1,29-05-2025,2025-05-29 14:05:47.000 UTC,1448,30869100,0xc3f97660D0b47F0E05C3c513f73eeff7c1bd6c7a
0xdc98dbffcc648d6088a2ff8f7dc01aef050e58fc,0xcf05dadb34568dd735abd279eac1c470e6b966fe2e0e4d774580373d3e31ad80,17-06-2025,2025-06-17 05:10:59.000 UTC,386,31673856,0xc3f97660D0b47F0E05C3c513f73eeff7c1bd6c7a
0x351f61e4c49cf11f24d9f2e737ca5eff81806355,0x643665ace180116abfc0b28ac34f8341e820a889c7fd00316008c924650222dd,15-08-2025,2025-08-15 21:54:21.000 UTC,443,34252757,0x0e956C897bBFCbd2155D3DfdD27c87fa5A0FaD39
0xdc98dbffcc648d6088a2ff8f7dc01aef050e58fc,0xcf2488e261f9fbdac2ba02b9d0d27b3d3679ffbe7f3d891323ce0a2027a9203b,11-01-2025,2025-01-11 22:18:39.000 UTC,229,24922286,0xBDA319Bc7Cc8F0829df39eC0FFF5D1E061FFadf7
0x2791dc5e14f7680d9d969acc26059ba56403b6d5,0xf8e7ae04b322d4719743fe67fc0822afdb5ae659f6d819b3de926b902b944437,05-01-2025,2025-01-05 13:56:49.000 UTC,277,24648031,0xB9E4E0368A9F281584C9adB685e6C9F4b9F37dBb
0x8fd1b615c006ebeb8a7cfb00a1dd809f31943b08,0xd66afeb170a4be3058f85d7bf5c4340c9794a46869111e3084cab5d5caab9a4a,27-12-2024,2024-12-27 02:56:37.000 UTC,259,24239425,0x45F8b8eC9c92D09BA8495074436fD97073423041
0xdc98dbffcc648d6088a2ff8f7dc01aef050e58fc,0x305979a97f6353acd235f409a289083c85b9d69b4a1ac8dbe916f88b77b07b71,25-06-2025,2025-06-25 20:05:23.000 UTC,162,32046288,0xc3f97660D0b47F0E05C3c513f73eeff7c1bd6c7a
0x38f6d2d9ea493c3c6ee865b5b952b5fe9e3e61fc,0x956288a052c7122749eecd7af9f8115dcef74513456cfec43b6eae79fdd1ac85,11-06-2025,2025-06-11 04:37:31.000 UTC,418,31413652,0xc3f97660D0b47F0E05C3c513f73eeff7c1bd6c7a
0x38f6d2d9ea493c3c6ee865b5b952b5fe9e3e61fc,0x88ba2857e42fcd72e37552aa9429552b9504675b401b06d29fbdc9c53e637fe9,10-06-2025,2025-06-10 16:45:25.000 UTC,1026,31392289,0xc3f97660D0b47F0E05C3c513f73eeff7c1bd6c7a
0xdc98dbffcc648d6088a2ff8f7dc01aef050e58fc,0x33263cfa77e1bd03aefaaa4f505de0298380a4dbbec75c842a3a63eb072699d5,07-01-2025,2025-01-07 19:36:11.000 UTC,309,24744612,0xBDA319Bc7Cc8F0829df39eC0FFF5D1E061FFadf7
0x2791dc5e14f7680d9d969acc26059ba56403b6d5,0x9056847082c6f93841bbff8ac6fc76a8c62feb3fff3fd81531d9e6582edd3375,08-01-2025,2025-01-08 18:51:47.000 UTC,205,24786480,0xCFede447ca3b4885720B5a327e3BFb02078f06e8
0x8508fd4238162cb3f3d485f432202af3b40f164e,0x98c7090bfe277d98cd669858f79b3bb30d48c38d8ce6523d144461ed0ec26087,11-06-2025,2025-06-11 02:06:35.000 UTC,711,31409124,0x6205DfbE68444cFF504A20a712cEa794c6b6Cf04
0x8fd1b615c006ebeb8a7cfb00a1dd809f31943b08,0x40c1b68b0cc5ab8518862291c9d1e48494f82739dc968f2d3bfdaae137f13517,12-12-2024,2024-12-12 23:56:47.000 UTC,325,23629230,0xBDA319Bc7Cc8F0829df39eC0FFF5D1E061FFadf7
0x8fd1b615c006ebeb8a7cfb00a1dd809f31943b08,0x67000b37df5da915739c48eb7ce1ce613f479b43d06e3b7a1b468cfd32f0ec36,01-01-2025,2025-01-01 23:24:09.000 UTC,443,24492251,0xBDA319Bc7Cc8F0829df39eC0FFF5D1E061FFadf7
0x38f6d2d9ea493c3c6ee865b5b952b5fe9e3e61fc,0x8a766b066a24d1f5d2828fc4c30870cf17cba52d3f85abc4dab3fbec67ddbae7,25-12-2024,2024-12-25 08:41:39.000 UTC,436,24163376,0xCFede447ca3b4885720B5a327e3BFb02078f06e8
0x38f6d2d9ea493c3c6ee865b5b952b5fe9e3e61fc,0x6156e7d2b82a658e9607620214beb89c8dbbadf7cb424b0942a64e25c59856fe,02-01-2025,2025-01-02 15:36:43.000 UTC,389,24521428,0xBDA319Bc7Cc8F0829df39eC0FFF5D1E061FFadf7
0x2791dc5e14f7680d9d969acc26059ba56403b6d5,0x23001bb401e38a607946a6f6eedfed36ba19d9061aef95d457db4114890c7ae0,09-01-2025,2025-01-09 04:46:57.000 UTC,348,24804335,0xBDA319Bc7Cc8F0829df39eC0FFF5D1E061FFadf7
0x8810de2baa17067ddcfbd9e8f29c55f070a55f0b,0xa39241120be7b9fc767473d58b0ccfabde452f727efe08816bbc84b660cd6d49,07-04-2025,2025-04-07 07:59:53.000 UTC,280,28611723,0x0e956C897bBFCbd2155D3DfdD27c87fa5A0FaD39
0x2791dc5e14f7680d9d969acc26059ba56403b6d5,0x95d7955139bb149d7ac05e93db9786aee25c6ef5c23f4295d72744b0f064c3c8,09-01-2025,2025-01-09 05:53:07.000 UTC,305,24806320,0xBDA319Bc7Cc8F0829df39eC0FFF5D1E061FFadf7
0x9eb86e93a809a41ab0e7cc0ba6f62561fda3015c,0x72377411b63ea7638f9928b630347ef42fb30dcf1fd9b683096a472f16001e45,09-01-2025,2025-01-09 03:25:35.000 UTC,359,24801894,0xBDA319Bc7Cc8F0829df39eC0FFF5D1E061FFadf7
0x8fd1b615c006ebeb8a7cfb00a1dd809f31943b08,0x7201fdda24ce618126e481f606a1ab7623ea3b8025b7aa98d432a01d7df9385e,14-12-2024,2024-12-14 20:07:11.000 UTC,419,23708742,0xCFede447ca3b4885720B5a327e3BFb02078f06e8
0x9eb86e93a809a41ab0e7cc0ba6f62561fda3015c,0xc720f85a6cc146a40f3a323c919be42bbd04abdd6561cbc0192190e622a729a3,15-12-2024,2024-12-15 06:27:47.000 UTC,184,23727360,0xCFede447ca3b4885720B5a327e3BFb02078f06e8
0x095d0de0ecfd6832f1a7961ae26d285d68655d60,0x685be2c14ed3d13e33df21984f03720ceebf0f98a19162a3da96e78b8ff4f5fb,05-03-2025,2025-03-05 23:58:59.000 UTC,477,27214896,0x0e956C897bBFCbd2155D3DfdD27c87fa5A0FaD39
0x9eb86e93a809a41ab0e7cc0ba6f62561fda3015c,0xb02adfe80e2e104efa2970c8a81e1c1d81df9f06ada77d7204861680d3b8e236,09-06-2025,2025-06-09 13:17:45.000 UTC,380,31342859,0xc3f97660D0b47F0E05C3c513f73eeff7c1bd6c7a
0x2791dc5e14f7680d9d969acc26059ba56403b6d5,0x96e6ed4c4fae66cba222d73956d93357bb80207fee9d55c11c774165c875b4b7,06-01-2025,2025-01-06 02:42:55.000 UTC,338,24671014,0xBDA319Bc7Cc8F0829df39eC0FFF5D1E061FFadf7
0x8508fd4238162cb3f3d485f432202af3b40f164e,0x6edc7203fa1c2587de877e6f7eb3ec4bdd511bfddc631165fed9b8396a23b887,19-05-2025,2025-05-19 11:16:07.000 UTC,1197,30432010,0x6205DfbE68444cFF504A20a712cEa794c6b6Cf04
0x9eb86e93a809a41ab0e7cc0ba6f62561fda3015c,0xbee881d012bac157eb87ecd197d9a9e984dc0d022461a358fc42a4ebe636b16e,27-12-2024,2024-12-27 15:59:01.000 UTC,345,24262897,0xCFede447ca3b4885720B5a327e3BFb02078f06e8
0x8508fd4238162cb3f3d485f432202af3b40f164e,0xb900d192bce3f04bf570b36025eb5a317f824262ef4863f75fdcb08a16e7b525,13-03-2025,2025-03-13 02:04:21.000 UTC,479,27521057,0x2B74B62c564456C48055bd515A62594742b3f545
0x2791dc5e14f7680d9d969acc26059ba56403b6d5,0x9615c08520d8e8dd3ecaa3592c9fd5f3f727fbd537e5760ea268d76924b863af,02-01-2025,2025-01-02 10:13:59.000 UTC,470,24511746,0x869305781fff479f0311974d55FeeB6Fc9DE96a2
0x9eb86e93a809a41ab0e7cc0ba6f62561fda3015c,0x82dc9b2699842252e1869da04a8606cc44d6e90e64ea547afc21586596ecccac,08-01-2025,2025-01-08 10:40:17.000 UTC,811,24771735,0xBDA319Bc7Cc8F0829df39eC0FFF5D1E061FFadf7
0x38f6d2d9ea493c3c6ee865b5b952b5fe9e3e61fc,0x1ade80641292c969254bdfcc9aeb24f72e860adba79bf08cb8e9f7d06c5bcb06,04-01-2025,2025-01-04 10:13:57.000 UTC,323,24598145,0xBDA319Bc7Cc8F0829df39eC0FFF5D1E061FFadf7
0x2791dc5e14f7680d9d969acc26059ba56403b6d5,0xca3636c965463b9634abcc396c4c6cb9b06dd1be4bc74b2c381fc3b3699cfffe,23-12-2024,2024-12-23 10:57:41.000 UTC,343,24081057,0xBDA319Bc7Cc8F0829df39eC0FFF5D1E061FFadf7
0x9eb86e93a809a41ab0e7cc0ba6f62561fda3015c,0xe8d0b4ae29701346c027d2ef56e824a6a703fc8cdb3102f53bc6c863da9a4f9e,31-12-2024,2024-12-31 18:28:05.000 UTC,607,24440169,0xCFede447ca3b4885720B5a327e3BFb02078f06e8
0x8508fd4238162cb3f3d485f432202af3b40f164e,0xc9a790f197ee43de74ba7d531351aa82f0d008df2d4fa0aecf8786ca5f6ba5ad,09-03-2025,2025-03-09 05:28:27.000 UTC,500,27354380,0x869305781fff479f0311974d55FeeB6Fc9DE96a2
0x095d0de0ecfd6832f1a7961ae26d285d68655d60,0x5fb81f0cd7c9cc3017e7749ed1620e8232621d8fe54123ccfd1fa43cde9f1809,26-04-2025,2025-04-26 01:38:23.000 UTC,833,29421078,0x869305781fff479f0311974d55FeeB6Fc9DE96a2
0x9eb86e93a809a41ab0e7cc0ba6f62561fda3015c,0xbc566e3a6659aabc1342c640ddb1e49f228a6ce08adb35713ea64d1ecc2ec262,31-05-2025,2025-05-31 12:00:59.000 UTC,370,30951756,0xc3f97660D0b47F0E05C3c513f73eeff7c1bd6c7a
0x2791dc5e14f7680d9d969acc26059ba56403b6d5,0x0c533801200d3ce6f6911c151acfa3fa01171d7d79c381498b82b9893f4e3348,05-01-2025,2025-01-05 02:42:27.000 UTC,599,24627800,0x869305781fff479f0311974d55FeeB6Fc9DE96a2
0x9eb86e93a809a41ab0e7cc0ba6f62561fda3015c,0x4cf3202c4d16c0561046e74ae56a2dd7325a21eed8ca9ee40e9dae28a7c73926,10-01-2025,2025-01-10 03:15:57.000 UTC,222,24844805,0xC23924a846eca931Ec3014253E94f15b038bd0C8
0x095d0de0ecfd6832f1a7961ae26d285d68655d60,0x3ee31de45cd839a36b3a80009aaf7f9ae00faa29769c84d2113d60774063eddd,06-03-2025,2025-03-06 17:49:31.000 UTC,370,27247012,0x0e956C897bBFCbd2155D3DfdD27c87fa5A0FaD39
0xdc98dbffcc648d6088a2ff8f7dc01aef050e58fc,0x554a2b86e6788b194b875e8d595913255b55f2bf65f63d05748a1121754a8144,01-05-2025,2025-05-01 09:41:03.000 UTC,374,29651558,0x430C09546ae9249AB75B9A4ef7B5FD9a4006D6f3
0x9eb86e93a809a41ab0e7cc0ba6f62561fda3015c,0x3572ad15a29b0f481a4b52e14d2a4e39c0fd973c355adccfe92eaf9ebeaa8519,30-05-2025,2025-05-30 13:45:53.000 UTC,440,30911703,0xc3f97660D0b47F0E05C3c513f73eeff7c1bd6c7a
0x19d36b9ee92a53ec1900447eba958f0030c688be,0x0dc0136ffdb19201d3e934a02d0b716fc1bbd2a38fa2e9dbdbba5e42dfa4f846,15-05-2025,2025-05-15 04:18:25.000 UTC,74,30246679,0x0e956C897bBFCbd2155D3DfdD27c87fa5A0FaD39
0x38f6d2d9ea493c3c6ee865b5b952b5fe9e3e61fc,0x183da09c9520e82f434ed70a983f8c37798fb2671191609a59ea7d8f85c8e74a,21-12-2024,2024-12-21 21:07:17.000 UTC,772,24012945,0xCFede447ca3b4885720B5a327e3BFb02078f06e8
0x8fd1b615c006ebeb8a7cfb00a1dd809f31943b08,0x1be78a6cc4d559a276b8447c0da075619ade8b8510ed3088ee9f35ca886472f8,18-04-2025,2025-04-18 15:50:49.000 UTC,862,29101051,0x0e956C897bBFCbd2155D3DfdD27c87fa5A0FaD39
0x8810de2baa17067ddcfbd9e8f29c55f070a55f0b,0x6255616353e1d0d3e4efce43eeed8c69179ea8757458ad48677475b39de6ad5a,09-03-2025,2025-03-09 22:01:21.000 UTC,362,27384167,0x0e956C897bBFCbd2155D3DfdD27c87fa5A0FaD39
0x8508fd4238162cb3f3d485f432202af3b40f164e,0xacc4dfe3c9b64f8fd3ad26cbdf7c2306128ab4f69642a660f0fcb59a3568c1d0,31-05-2025,2025-05-31 00:12:43.000 UTC,628,30930508,0x6205DfbE68444cFF504A20a712cEa794c6b6Cf04
0xdc98dbffcc648d6088a2ff8f7dc01aef050e58fc,0xef09ae23a35cd763a3dcd41449f598bd59f342fdbed2ff3a8004a60b282f1fc6,18-02-2025,2025-02-18 05:34:59.000 UTC,97,26533776,0xCFede447ca3b4885720B5a327e3BFb02078f06e8
0x8fd1b615c006ebeb8a7cfb00a1dd809f31943b08,0x26a691472604fe3385293da0543352cdfcb611ae47b0fefb6be85ccf56fbd6aa,04-01-2025,2025-01-04 10:27:37.000 UTC,234,24598555,0xAfabcBbab5e4261B1d655c906738176191819164
0x38f6d2d9ea493c3c6ee865b5b952b5fe9e3e61fc,0xde1b6b23a2acca9d761f53c3ecca80b2e8e26c8f86330d08567b4cf613109ae5,28-02-2025,2025-02-28 05:11:05.000 UTC,346,26965059,0x0e956C897bBFCbd2155D3DfdD27c87fa5A0FaD39
0x9eb86e93a809a41ab0e7cc0ba6f62561fda3015c,0x17de1e3d0df546699c8c896dba2bfa334c2a68e0b60dbeaa1fd2944ad3c8de77,09-01-2025,2025-01-09 11:38:43.000 UTC,498,24816688,0x869305781fff479f0311974d55FeeB6Fc9DE96a2
0x38f6d2d9ea493c3c6ee865b5b952b5fe9e3e61fc,0xaca5f51c85cea0ff313df76ca767b3ad9626f29c690517b602d5374de1408745,11-12-2024,2024-12-11 00:00:43.000 UTC,310,23542948,0x0e956C897bBFCbd2155D3DfdD27c87fa5A0FaD39
0x8fd1b615c006ebeb8a7cfb00a1dd809f31943b08,0x30639d71c72d2ab3f8f3464e32e26a1a4a9533f174ff09fadb60ef0dddf6c244,21-12-2024,2024-12-21 15:32:05.000 UTC,361,24002889,0xCFede447ca3b4885720B5a327e3BFb02078f06e8
0x8810de2baa17067ddcfbd9e8f29c55f070a55f0b,0x39d8fe488ad4ba60b8b75c86b131fc292addf3bd6186b5e7d03d77b97cd9d640,26-03-2025,2025-03-26 19:11:39.000 UTC,310,28113476,0x0e956C897bBFCbd2155D3DfdD27c87fa5A0FaD39
0x2791dc5e14f7680d9d969acc26059ba56403b6d5,0x5936e3451bc548f4e3c45cf5c750bb1510e25986fd4892b92e1ea14793355876,03-01-2025,2025-01-03 20:35:43.000 UTC,649,24573598,0xBDA319Bc7Cc8F0829df39eC0FFF5D1E061FFadf7
0x38f6d2d9ea493c3c6ee865b5b952b5fe9e3e61fc,0x9ab7d9687ad0ccd5e3fff8132e38bfa6636ab16d0d0b62e0456e32f0b70acdb2,02-01-2025,2025-01-02 21:29:33.000 UTC,317,24532013,0x0e956C897bBFCbd2155D3DfdD27c87fa5A0FaD39
0x2791dc5e14f7680d9d969acc26059ba56403b6d5,0xef314e2685db5aa1c4037489a8e9076edee68a2aebfca34dc6fe9a00d771c64b,02-02-2025,2025-02-02 15:23:57.000 UTC,179,25860245,0xB9E4E0368A9F281584C9adB685e6C9F4b9F37dBb
0x38f6d2d9ea493c3c6ee865b5b952b5fe9e3e61fc,0x4b386f567376f33f1a35f398f0f59dcaccd94c4d4504468729b9d92acee52be9,07-01-2025,2025-01-07 01:38:15.000 UTC,351,24712274,0x869305781fff479f0311974d55FeeB6Fc9DE96a2
0x38f6d2d9ea493c3c6ee865b5b952b5fe9e3e61fc,0xdb5272a4ab03c2452dc891d0077f30f67b970fced9d66ce7c57842d3e5dcc464,29-05-2025,2025-05-29 11:24:53.000 UTC,744,30864273,0xc3f97660D0b47F0E05C3c513f73eeff7c1bd6c7a
0x38f6d2d9ea493c3c6ee865b5b952b5fe9e3e61fc,0x036a90c073aed7fe845c359ddff7785a4b35a7176b6b7c1ae9528ddcb4cd6c8f,06-01-2025,2025-01-06 20:36:29.000 UTC,701,24703221,0xB9E4E0368A9F281584C9adB685e6C9F4b9F37dBb
0x8508fd4238162cb3f3d485f432202af3b40f164e,0xa78029e89c3038107eb88b1da0c5136f3c1a20588b2afdf86e8bcb3a7abfc0f2,30-05-2025,2025-05-30 11:20:07.000 UTC,520,30907330,0x6205DfbE68444cFF504A20a712cEa794c6b6Cf04
0x38f6d2d9ea493c3c6ee865b5b952b5fe9e3e61fc,0x7071f8ef71a51c0e8fe0097546fcd2b6fb3fa81f46336eb438808fd96f155dcd,09-01-2025,2025-01-09 00:07:43.000 UTC,169,24795958,0x869305781fff479f0311974d55FeeB6Fc9DE96a2
0x38f6d2d9ea493c3c6ee865b5b952b5fe9e3e61fc,0xb9ae3468c741b1fe0243a997e5af5c6124339413b4ffe9a00314d9d0eff95543,12-01-2025,2025-01-12 16:04:23.000 UTC,274,24954258,0x869305781fff479f0311974d55FeeB6Fc9DE96a2
0x2791dc5e14f7680d9d969acc26059ba56403b6d5,0xffd207c493c3c1716349bcbb7d4aedec4c2c5e513c5a7747ff8cec9dfc8d54d7,13-01-2025,2025-01-13 14:02:19.000 UTC,465,24993796,0xBDA319Bc7Cc8F0829df39eC0FFF5D1E061FFadf7
0x2791dc5e14f7680d9d969acc26059ba56403b6d5,0x00327db6dca3f9d2b69ab4b6b0be53ad37658c5eede8d1458649047f6790d655,14-12-2024,2024-12-14 07:19:57.000 UTC,333,23685725,0xBDA319Bc7Cc8F0829df39eC0FFF5D1E061FFadf7
0x2791dc5e14f7680d9d969acc26059ba56403b6d5,0xac8a1bf7dbadd15dee5b0ac3c76374a09cac3e5b17e96dca1c9b1b07e1755044,05-01-2025,2025-01-05 04:04:47.000 UTC,139,24630270,0xCFede447ca3b4885720B5a327e3BFb02078f06e8
0x2791dc5e14f7680d9d969acc26059ba56403b6d5,0x9e141c2b18f0aa7af91f2a264a45e03772289d942216f26461772879b15f7e47,12-12-2024,2024-12-12 01:40:23.000 UTC,664,23589138,0xBDA319Bc7Cc8F0829df39eC0FFF5D1E061FFadf7
0xdc98dbffcc648d6088a2ff8f7dc01aef050e58fc,0x6bb5721525849c3dc3f811bf136c975deba2b901b35467639545a0b5b227870f,03-01-2025,2025-01-03 06:33:57.000 UTC,318,24548345,0xBDA319Bc7Cc8F0829df39eC0FFF5D1E061FFadf7
0x8508fd4238162cb3f3d485f432202af3b40f164e,0xea1aaea77dca6e06693efb7998e47f4ca67ed38e9e04e9e925a117861658592a,01-04-2025,2025-04-01 18:50:21.000 UTC,349,28372037,0x2B74B62c564456C48055bd515A62594742b3f545
0x2791dc5e14f7680d9d969acc26059ba56403b6d5,0x2979ee53d0ac04403443b788f358d9c4474ff2d8b0601fadc0f32ed263259f90,11-05-2025,2025-05-11 00:46:13.000 UTC,201,30067513,0xCFede447ca3b4885720B5a327e3BFb02078f06e8
0xdc98dbffcc648d6088a2ff8f7dc01aef050e58fc,0x00f86c5ff109cf14b36a29f0754ba3fecb33b7a09f8bf34fed392754555062ee,07-01-2025,2025-01-07 18:06:57.000 UTC,296,24741935,0xBDA319Bc7Cc8F0829df39eC0FFF5D1E061FFadf7
0x8508fd4238162cb3f3d485f432202af3b40f164e,0xbb85897e1aee946184a206aa722ab6b712096f9d6ddda8c9c741b26191afda36,19-04-2025,2025-04-19 21:35:55.000 UTC,493,29154604,0x869305781fff479f0311974d55FeeB6Fc9DE96a2
0xdc98dbffcc648d6088a2ff8f7dc01aef050e58fc,0xf483d0b1121d5c5430873da713f7b6c1a19c6dcdb877c9f1f247bb57d37531a7,03-06-2025,2025-06-03 14:58:21.000 UTC,747,31086677,0xc3f97660D0b47F0E05C3c513f73eeff7c1bd6c7a
0x9eb86e93a809a41ab0e7cc0ba6f62561fda3015c,0xb3ce3e156eb23022307ca771e338da548b35d601fca9a98d2ff2b7039ac4b337,02-03-2025,2025-03-02 06:36:49.000 UTC,229,27054031,0x6399ed6725cC163D019aA64FF55b22149D7179A8
0x351f61e4c49cf11f24d9f2e737ca5eff81806355,0x173450d2a221908e290390f050b3505b18d658e46e5cbe61c0c55d1e74abfca6,21-08-2025,2025-08-21 21:18:45.000 UTC,459,34510889,0x0e956C897bBFCbd2155D3DfdD27c87fa5A0FaD39
0x9eb86e93a809a41ab0e7cc0ba6f62561fda3015c,0xf3d8cb3e54d4dbf86308305c2bca7902dfe1d4e44b24db098cc2f4d7f1232e8e,12-12-2024,2024-12-12 13:43:09.000 UTC,439,23610821,0xCFede447ca3b4885720B5a327e3BFb02078f06e8
0xdc98dbffcc648d6088a2ff8f7dc01aef050e58fc,0xcd38b6eccb1e49a908cd9359db1d9cf32db3a7b411222d14f4fe886f2e4ef60e,24-12-2024,2024-12-24 07:45:09.000 UTC,356,24118481,0xBDA319Bc7Cc8F0829df39eC0FFF5D1E061FFadf7
0x2791dc5e14f7680d9d969acc26059ba56403b6d5,0xe4628d220dcdf0f4ac073f6acb6febb7149057c46dc8aaf309b6b4802bfe69de,07-01-2025,2025-01-07 18:29:19.000 UTC,261,24742606,0x0e956C897bBFCbd2155D3DfdD27c87fa5A0FaD39
0x8fd1b615c006ebeb8a7cfb00a1dd809f31943b08,0xa8fa93763a965e07a3328fcb0f317cbc78570292024c0863c47d4bebc7d00fa8,10-01-2025,2025-01-10 15:53:11.000 UTC,362,24867522,0xBDA319Bc7Cc8F0829df39eC0FFF5D1E061FFadf7
0x2791dc5e14f7680d9d969acc26059ba56403b6d5,0xab465fddb02c815559ba30885c710623398259ec8de12b851b504999276ec235,12-01-2025,2025-01-12 07:14:15.000 UTC,758,24938354,0x0e956C897bBFCbd2155D3DfdD27c87fa5A0FaD39
0x8fd1b615c006ebeb8a7cfb00a1dd809f31943b08,0x00084a62d1bbb3c84514691e90acdab5820f5f11bcb177d7bce5b47d00217b93,17-12-2024,2024-12-17 02:17:57.000 UTC,347,23806265,0xBDA319Bc7Cc8F0829df39eC0FFF5D1E061FFadf7
0x2791dc5e14f7680d9d969acc26059ba56403b6d5,0x5294989d91d4248a8b27d9c8ca4ef8e736807761e40ea65ed33bd2806b1394d3,09-01-2025,2025-01-09 15:05:35.000 UTC,374,24822894,0x0e956C897bBFCbd2155D3DfdD27c87fa5A0FaD39
0x2791dc5e14f7680d9d969acc26059ba56403b6d5,0xb87e44f8ec56cf0984ea268363175a2a6037632062a88e7f8bbc1e299c4da8ae,24-12-2024,2024-12-24 23:25:37.000 UTC,1328,24146695,0xBDA319Bc7Cc8F0829df39eC0FFF5D1E061FFadf7
0x38f6d2d9ea493c3c6ee865b5b952b5fe9e3e61fc,0xa52df873c990b80db48881c141447878b860e862734e445227609254b2451c47,22-01-2025,2025-01-22 03:27:49.000 UTC,239,25363561,0xB9E4E0368A9F281584C9adB685e6C9F4b9F37dBb
0x9eb86e93a809a41ab0e7cc0ba6f62561fda3015c,0xa4471d0c18d23804eeca88723f15d4aa408c3b70519a6c06c3e33e3391d911bf,21-05-2025,2025-05-21 05:42:57.000 UTC,492,30508415,0xc3f97660D0b47F0E05C3c513f73eeff7c1bd6c7a
0x8508fd4238162cb3f3d485f432202af3b40f164e,0xf3bddb6bcc384daaf22c9d13d8c43a2d1bf1e6736cef58f73f7b190b8b8d3011,02-04-2025,2025-04-02 11:26:57.000 UTC,487,28401935,0x2B74B62c564456C48055bd515A62594742b3f545
0xdc98dbffcc648d6088a2ff8f7dc01aef050e58fc,0x68259a2064acbd3a23252337d0a1055e3d8105300120c0e4150559af71ee72ce,11-05-2025,2025-05-11 04:07:47.000 UTC,79,30073560,0x869305781fff479f0311974d55FeeB6Fc9DE96a2
0xdc98dbffcc648d6088a2ff8f7dc01aef050e58fc,0xf262ce180b9f04e92869e78a7db402cf4a99e3efbf2946b1e733eac5b637a1a3,05-01-2025,2025-01-05 08:52:19.000 UTC,536,24638896,0xB9E4E0368A9F281584C9adB685e6C9F4b9F37dBb
0x9eb86e93a809a41ab0e7cc0ba6f62561fda3015c,0x7c2dd4597b9dd0183deb3a13b8f6f4524dae1f3008768d0d2928c88650631ade,02-01-2025,2025-01-02 13:01:45.000 UTC,1252,24516779,0xC23924a846eca931Ec3014253E94f15b038bd0C8
0x9eb86e93a809a41ab0e7cc0ba6f62561fda3015c,0xd8fbcd8db92152daab58237e2030f3becfef75e2b73ee1cccbf765572259d49f,26-12-2024,2024-12-26 09:04:27.000 UTC,366,24207260,0xCFede447ca3b4885720B5a327e3BFb02078f06e8
0x9eb86e93a809a41ab0e7cc0ba6f62561fda3015c,0x2e68758f920b297381dd1a00da38a7377fb2d80489d4c1f2fe536dc0a3e3c873,09-01-2025,2025-01-09 13:29:45.000 UTC,325,24820019,0xB9E4E0368A9F281584C9adB685e6C9F4b9F37dBb
0x38f6d2d9ea493c3c6ee865b5b952b5fe9e3e61fc,0x4051786726e261060ac9d0cda30aae2661639b6c23d301a10f11b387b19fd0b7,16-01-2025,2025-01-16 23:39:01.000 UTC,136,25140697,0xCFede447ca3b4885720B5a327e3BFb02078f06e8
0x2791dc5e14f7680d9d969acc26059ba56403b6d5,0x80ce847f69958bacf378843c3d1f1b74334b4590b7cef6e0c3d75fd6216bfa94,15-12-2024,2024-12-15 03:08:57.000 UTC,216,23721395,0xCFede447ca3b4885720B5a327e3BFb02078f06e8
0x2791dc5e14f7680d9d969acc26059ba56403b6d5,0x31408448af61892ac2227fb929090e9b7ee12e41dcd106ca87c5c3a190423021,10-01-2025,2025-01-10 18:16:35.000 UTC,215,24871824,0x869305781fff479f0311974d55FeeB6Fc9DE96a2
0x8508fd4238162cb3f3d485f432202af3b40f164e,0xbfd57e68742a063920b40236d1febe6443fd0d55ab6c1690b6c1b01a772af57f,30-05-2025,2025-05-30 06:46:47.000 UTC,637,30899130,0x6205DfbE68444cFF504A20a712cEa794c6b6Cf04
0x8fd1b615c006ebeb8a7cfb00a1dd809f31943b08,0x4e882bd6f32576d43b4c70a8b1d7f449dc9c6daa100328893ea68016117b84a7,12-12-2024,2024-12-12 22:43:33.000 UTC,313,23627033,0xBDA319Bc7Cc8F0829df39eC0FFF5D1E061FFadf7
0xdc98dbffcc648d6088a2ff8f7dc01aef050e58fc,0xbe2520ceed5c15d33fdea8dddb6bedf69f8586a3fc60e4519b5c63dc24682d31,09-01-2025,2025-01-09 05:32:53.000 UTC,238,24805713,0x0e956C897bBFCbd2155D3DfdD27c87fa5A0FaD39
0x38f6d2d9ea493c3c6ee865b5b952b5fe9e3e61fc,0xa1b2b04583a5e4c2aa7ffe9b747ce052868674f9384b96dbc8c85b86206121aa,13-01-2025,2025-01-13 06:41:39.000 UTC,139,24980576,0x0e956C897bBFCbd2155D3DfdD27c87fa5A0FaD39
0x9eb86e93a809a41ab0e7cc0ba6f62561fda3015c,0x91594ba29f10996fd8fc7989e1a3beb4f879033f1bddf8403efe30cd76cf53db,29-05-2025,2025-05-29 04:54:11.000 UTC,584,30852552,0xc3f97660D0b47F0E05C3c513f73eeff7c1bd6c7a
0x2791dc5e14f7680d9d969acc26059ba56403b6d5,0x876a0e0f1ac3dda3d77ab980819a98366084b899330c2f5ccab7311ae79209a3,12-12-2024,2024-12-12 13:51:53.000 UTC,334,23611083,0xBDA319Bc7Cc8F0829df39eC0FFF5D1E061FFadf7
0x8508fd4238162cb3f3d485f432202af3b40f164e,0x994276d1227fd438c47eba3c27cb685ab4e1a5a90a3c1017e6753514f2f7aec9,08-04-2025,2025-04-08 11:56:35.000 UTC,313,28662024,0x6205DfbE68444cFF504A20a712cEa794c6b6Cf04
0x8508fd4238162cb3f3d485f432202af3b40f164e,0xc794254ff7b57bfe30f3cfe345aec613491037bd4856969c7b224ef9e16e4fb6,06-06-2025,2025-06-06 06:48:37.000 UTC,165,31201585,0xc3f97660D0b47F0E05C3c513f73eeff7c1bd6c7a
0xdc98dbffcc648d6088a2ff8f7dc01aef050e58fc,0x6a1e2ab1267f7583a91b4be5c368b35a1f2b879f959b187dfc476b7fa219e8e3,01-01-2025,2025-01-01 01:28:35.000 UTC,344,24452784,0x0e956C897bBFCbd2155D3DfdD27c87fa5A0FaD39
0x38f6d2d9ea493c3c6ee865b5b952b5fe9e3e61fc,0x9d7b8a8713eb08e2cd8613b64dad297a03cb9d235711dea6196409462de3b7cc,15-01-2025,2025-01-15 04:46:11.000 UTC,437,25063512,0x869305781fff479f0311974d55FeeB6Fc9DE96a2
0xdc98dbffcc648d6088a2ff8f7dc01aef050e58fc,0x3e9cbcb1064268fd694775b97fedc84476fff3c3c64c479c17d4a660e3834f39,08-01-2025,2025-01-08 15:43:49.000 UTC,399,24780841,0xBDA319Bc7Cc8F0829df39eC0FFF5D1E061FFadf7
0x9eb86e93a809a41ab0e7cc0ba6f62561fda3015c,0x77f52e9572a291b6902250e5c7a37a6e84f0306602d55a7675052ab78aad65a5,05-06-2025,2025-06-05 07:41:25.000 UTC,484,31159969,0xc3f97660D0b47F0E05C3c513f73eeff7c1bd6c7a
0x8fd1b615c006ebeb8a7cfb00a1dd809f31943b08,0x3e5fec849d7212323f97130b50d42648fdb921b4ae02475d886664e34fa7b325,22-12-2024,2024-12-22 10:26:31.000 UTC,218,24036922,0xCFede447ca3b4885720B5a327e3BFb02078f06e8
0x38f6d2d9ea493c3c6ee865b5b952b5fe9e3e61fc,0xb0f4122b1f910e6626f16202570a30673f9ed18bc920e8c284c84982a1b3168a,07-01-2025,2025-01-07 01:34:03.000 UTC,507,24712148,0xB9E4E0368A9F281584C9adB685e6C9F4b9F37dBb
0x38f6d2d9ea493c3c6ee865b5b952b5fe9e3e61fc,0x731e35684bf6d00d86c133ea3291537d5fe54763c3086f78819374b5228b64c0,08-01-2025,2025-01-08 15:37:15.000 UTC,438,24780644,0x0e956C897bBFCbd2155D3DfdD27c87fa5A0FaD39
0xdc98dbffcc648d6088a2ff8f7dc01aef050e58fc,0xba3a1ddfc636d3afb113b85c806a1bdb89763c31745b46eccb4f44024118fce6,09-01-2025,2025-01-09 06:26:39.000 UTC,247,24807326,0xBDA319Bc7Cc8F0829df39eC0FFF5D1E061FFadf7
0x8508fd4238162cb3f3d485f432202af3b40f164e,0xfe231930e3f3acebcf196eb82e20d24be33331b48bfaf705e9cd5de543572f65,29-05-2025,2025-05-29 04:55:59.000 UTC,678,30852606,0xc3f97660D0b47F0E05C3c513f73eeff7c1bd6c7a
0x8508fd4238162cb3f3d485f432202af3b40f164e,0x18ee93fdf039c7ff9c1549cc13ce1f21e606b87f904b4c707f354b7f71f7c113,09-04-2025,2025-04-09 14:42:59.000 UTC,266,28710216,0x2B74B62c564456C48055bd515A62594742b3f545
0x8508fd4238162cb3f3d485f432202af3b40f164e,0x4d5b75d6e73cb3e6dfc51858badbb45a77ad8aedf1fa84865061de29a3cb059b,19-03-2025,2025-03-19 11:00:47.000 UTC,393,27796350,0x2B74B62c564456C48055bd515A62594742b3f545
0x8508fd4238162cb3f3d485f432202af3b40f164e,0xd5d87c92130cfe803590f1525572c9a800c0e459ff6d82fc2e7f4c9055554e02,15-04-2025,2025-04-15 02:57:27.000 UTC,336,28948250,0x2B74B62c564456C48055bd515A62594742b3f545
0x2791dc5e14f7680d9d969acc26059ba56403b6d5,0xe98c65553c6811f050d20c87e9e82f2de3439d873dd1a854704b2d664dd4cc88,19-12-2024,2024-12-19 15:14:11.000 UTC,514,23915952,0xBDA319Bc7Cc8F0829df39eC0FFF5D1E061FFadf7
0x38f6d2d9ea493c3c6ee865b5b952b5fe9e3e61fc,0x53a63bdf7274e2913f33e72ab6b2903161e7c8950c5bdb5841b291c974122d25,05-01-2025,2025-01-05 00:09:25.000 UTC,184,24623209,0xBDA319Bc7Cc8F0829df39eC0FFF5D1E061FFadf7
0x8810de2baa17067ddcfbd9e8f29c55f070a55f0b,0x1d8efad313c2280604d28f2a24928c77ee32dfa48cfc13ec768913b97e384150,08-05-2025,2025-05-08 14:02:43.000 UTC,474,29961808,0x0e956C897bBFCbd2155D3DfdD27c87fa5A0FaD39
0x2791dc5e14f7680d9d969acc26059ba56403b6d5,0xf1901ff76e54efe1e001e0f769ad69453fd4b307d92d9853287a5369518f3e9f,13-12-2024,2024-12-13 21:19:03.000 UTC,232,23667698,0xBDA319Bc7Cc8F0829df39eC0FFF5D1E061FFadf7
0x8fd1b615c006ebeb8a7cfb00a1dd809f31943b08,0x69443207e8427d9fcf9f307f7ccbda22f0575e13ccd8c9a3f33a497603d6c32d,03-01-2025,2025-01-03 18:50:35.000 UTC,699,24570444,0xBDA319Bc7Cc8F0829df39eC0FFF5D1E061FFadf7
0x2791dc5e14f7680d9d969acc26059ba56403b6d5,0x042f7f26e5c0970ce769f268be5428bbcf3250c5b8ad565fd2bffef3b340659f,09-03-2025,2025-03-09 16:22:31.000 UTC,195,27374002,0xCFede447ca3b4885720B5a327e3BFb02078f06e8
0x8508fd4238162cb3f3d485f432202af3b40f164e,0x036ef9aa597fa0d8367d0e9b69b1b4ba815556525e197bf98175637a908dfcc0,29-03-2025,2025-03-29 01:10:45.000 UTC,205,28210649,0x2B74B62c564456C48055bd515A62594742b3f545
0x8fd1b615c006ebeb8a7cfb00a1dd809f31943b08,0x083b5593b6c0099747ca784fc346bbdb084b0fa7b9941aa7ad8ce047e9d16cab,18-12-2024,2024-12-18 08:23:37.000 UTC,450,23860435,0x45F8b8eC9c92D09BA8495074436fD97073423041
0xdc98dbffcc648d6088a2ff8f7dc01aef050e58fc,0xdfc6343d8a0bc63fae97cff4cfd8af1d5675fef3b5f7f328f10b71ea46841ed5,13-01-2025,2025-01-13 10:40:05.000 UTC,884,24987729,0x0e956C897bBFCbd2155D3DfdD27c87fa5A0FaD39
0x8508fd4238162cb3f3d485f432202af3b40f164e,0xcc3e2279ad56d4ee12b8592406e0ebdeb67d6e417a10c30c75a1585b39a83dad,02-06-2025,2025-06-02 02:43:55.000 UTC,605,31021444,0xc3f97660D0b47F0E05C3c513f73eeff7c1bd6c7a
0x38f6d2d9ea493c3c6ee865b5b952b5fe9e3e61fc,0x85d1aec24d66687f45949b9914df7cd9b6bd1a2878cd7b5a93563b2f76974e62,25-02-2025,2025-02-25 10:12:27.000 UTC,429,26844500,0x0e956C897bBFCbd2155D3DfdD27c87fa5A0FaD39
0x8508fd4238162cb3f3d485f432202af3b40f164e,0x9a2f5933b5f1ff9cdc238e71a84fcb53b85847f1a120a64bb6c0d77ef1d4b21e,02-07-2025,2025-07-02 11:01:05.000 UTC,457,32332359,0x6205DfbE68444cFF504A20a712cEa794c6b6Cf04
0x9eb86e93a809a41ab0e7cc0ba6f62561fda3015c,0x17ee7643df23804444b9073783d3e87601ce13e1d878f72b2e3b61869758927b,29-12-2024,2024-12-29 11:10:25.000 UTC,370,24340639,0xCFede447ca3b4885720B5a327e3BFb02078f06e8
0x9eb86e93a809a41ab0e7cc0ba6f62561fda3015c,0xda4aa0a5e38351aa458dc70f5eda1528fb2673ead855f7a661fa43b57f5ab77a,29-06-2025,2025-06-29 09:15:23.000 UTC,878,32199588,0xf2c38dE50A250C0060fB45eBE4504B67f6F1be3C
0x8fd1b615c006ebeb8a7cfb00a1dd809f31943b08,0x03ae2cb3b8fe17f8ad9d0e4cd40c828bfd9f94f6ecd4357f93cfba9b063409ae,03-01-2025,2025-01-03 22:25:25.000 UTC,404,24576889,0xBDA319Bc7Cc8F0829df39eC0FFF5D1E061FFadf7
0x38f6d2d9ea493c3c6ee865b5b952b5fe9e3e61fc,0x37ff17037638795b5247dfaccdd4c1bf99bdee8ae52118001f50a9249ebf75d7,12-05-2025,2025-05-12 05:01:45.000 UTC,157,30118379,0xB57eC27f68Bd356e300D57079B6cdbe57d50830d
0x2791dc5e14f7680d9d969acc26059ba56403b6d5,0xbe1e12f355302fa8a6aac0736ab1ac88f771d14f0f7fb12b27f9c9271d51fef5,15-07-2025,2025-07-15 18:28:17.000 UTC,446,32907375,0xCFede447ca3b4885720B5a327e3BFb02078f06e8
0x8fd1b615c006ebeb8a7cfb00a1dd809f31943b08,0xee22f2beff23c07e897c8245031116fbf6bbe065d9b172204107f02aa0b3d96a,17-12-2024,2024-12-17 15:12:23.000 UTC,424,23829498,0xCFede447ca3b4885720B5a327e3BFb02078f06e8
0x38f6d2d9ea493c3c6ee865b5b952b5fe9e3e61fc,0xbfa54df2c41344f64d21d6cc6539ccccddaebd40c66b8a4521134e69d028e30e,29-05-2025,2025-05-29 16:40:19.000 UTC,347,30873736,0xc3f97660D0b47F0E05C3c513f73eeff7c1bd6c7a
0x9eb86e93a809a41ab0e7cc0ba6f62561fda3015c,0xde99981397f8bf2c755c4fa0bac2dfa23e0db7c05a1f8e49d4fb78bfbbb34280,21-12-2024,2024-12-21 10:55:57.000 UTC,372,23994605,0xCFede447ca3b4885720B5a327e3BFb02078f06e8
0x9eb86e93a809a41ab0e7cc0ba6f62561fda3015c,0x4ce5f15dd7e28132c1194f26ef44db2eba3c4f21ade223212deb56a4545f9aad,23-06-2025,2025-06-23 18:30:55.000 UTC,1176,31957054,0xCFede447ca3b4885720B5a327e3BFb02078f06e8
0x2791dc5e14f7680d9d969acc26059ba56403b6d5,0xfddab7e1702e3444bc894670088e9f1cd736c01173f1efd91e77780a8ded9d68,13-12-2024,2024-12-13 11:38:33.000 UTC,289,23650283,0xBDA319Bc7Cc8F0829df39eC0FFF5D1E061FFadf7
0x8fd1b615c006ebeb8a7cfb00a1dd809f31943b08,0xf6ff0153068377a1bbf4409f14e95d66608dc54e418f0c7efd00f1a57e52850f,05-01-2025,2025-01-05 11:13:51.000 UTC,251,24643142,0xAfabcBbab5e4261B1d655c906738176191819164
0x8508fd4238162cb3f3d485f432202af3b40f164e,0xd5a079be33e3e5ab01f35d5d4f2efa1aa32615171a62639b6b024756cc730ea4,28-05-2025,2025-05-28 20:01:49.000 UTC,684,30836581,0xc3f97660D0b47F0E05C3c513f73eeff7c1bd6c7a
0x38f6d2d9ea493c3c6ee865b5b952b5fe9e3e61fc,0xac0dd1311913034434ca4dc53e4c860395c98d179919b6d74f2a1abb62a6bd4d,10-01-2025,2025-01-10 02:10:45.000 UTC,560,24842849,0x0e956C897bBFCbd2155D3DfdD27c87fa5A0FaD39
0x095d0de0ecfd6832f1a7961ae26d285d68655d60,0x91843ce2fe22df29b9bd25fa48dedc1c96f98d1ae5203b778928ac5ac696133b,16-07-2025,2025-07-16 05:55:17.000 UTC,3,32927985,0x869305781fff479f0311974d55FeeB6Fc9DE96a2
0xdc98dbffcc648d6088a2ff8f7dc01aef050e58fc,0x9face589a25aab395e16443dd174af64358b55f4c51e6ed38be8cf4133aa5280,13-01-2025,2025-01-13 02:42:45.000 UTC,178,24973409,0x0e956C897bBFCbd2155D3DfdD27c87fa5A0FaD39
0x8508fd4238162cb3f3d485f432202af3b40f164e,0xaac01e6e4e773507113d613ace81b56c985260f54c33545ed4722fd5be318b61,14-03-2025,2025-03-14 23:00:47.000 UTC,306,27601950,0x2B74B62c564456C48055bd515A62594742b3f545
0x8508fd4238162cb3f3d485f432202af3b40f164e,0x3eae26f5a140ec048ffc6b9395f71005f22ceef1c4d38955ffafea8c3dd601f8,22-05-2025,2025-05-22 13:14:31.000 UTC,1523,30565162,0xc3f97660D0b47F0E05C3c513f73eeff7c1bd6c7a
0xdc98dbffcc648d6088a2ff8f7dc01aef050e58fc,0x5019f8d0b502d3574a7d026e5f067338097e9c1a084d88dfc0bc57c466038800,14-01-2025,2025-01-14 20:54:41.000 UTC,448,25049367,0xBDA319Bc7Cc8F0829df39eC0FFF5D1E061FFadf7
0x2791dc5e14f7680d9d969acc26059ba56403b6d5,0x15c9669d21673fbc61a009ecb8c2ac8db1a12d00ada33d1f2430e52790d15691,06-01-2025,2025-01-06 20:59:11.000 UTC,465,24703902,0xBDA319Bc7Cc8F0829df39eC0FFF5D1E061FFadf7
0x8508fd4238162cb3f3d485f432202af3b40f164e,0xe5a80c159d3c267e7cf0de33680b117e0500b8231693402b62eaf2d5e5f5d4c2,09-04-2025,2025-04-09 21:31:29.000 UTC,474,28722471,0x2B74B62c564456C48055bd515A62594742b3f545
0x8fd1b615c006ebeb8a7cfb00a1dd809f31943b08,0x1c6002d89bf33c41826263cf1c80527ca0da6ba867516bc79eea15e5f85b6fc6,26-12-2024,2024-12-26 03:35:23.000 UTC,303,24197388,0xBDA319Bc7Cc8F0829df39eC0FFF5D1E061FFadf7
0x2791dc5e14f7680d9d969acc26059ba56403b6d5,0x5f45f1f4bb770b8764250644b06c12a5d80edb7e0789099d3e647f83123c4628,12-01-2025,2025-01-12 22:05:19.000 UTC,362,24965086,0x0e956C897bBFCbd2155D3DfdD27c87fa5A0FaD39
0xdc98dbffcc648d6088a2ff8f7dc01aef050e58fc,0xbac49aab378143ddea8cf0225c9bf2eb1670b0f168edcbe06ace252c7589cd34,23-12-2024,2024-12-23 18:23:21.000 UTC,236,24094427,0xCFede447ca3b4885720B5a327e3BFb02078f06e8
0x38f6d2d9ea493c3c6ee865b5b952b5fe9e3e61fc,0xa8496c24ece9510a9600b95c82aea94c529c1ed82e3f2d39269b4e0555d6efa6,07-01-2025,2025-01-07 14:27:15.000 UTC,328,24735344,0xCFede447ca3b4885720B5a327e3BFb02078f06e8
0x2791dc5e14f7680d9d969acc26059ba56403b6d5,0x49aecb6b810f19fb35dc7d431b51bc4ba471422ff46da128b240725a2e478b0e,08-01-2025,2025-01-08 17:34:37.000 UTC,276,24784165,0x0e956C897bBFCbd2155D3DfdD27c87fa5A0FaD39
0x9eb86e93a809a41ab0e7cc0ba6f62561fda3015c,0x437586709156637b76d33025da174ed96b03fa55823728a66a2563da9ffe28f0,03-01-2025,2025-01-03 23:10:05.000 UTC,341,24578229,0xC23924a846eca931Ec3014253E94f15b038bd0C8
0x2791dc5e14f7680d9d969acc26059ba56403b6d5,0x03e7b068d42e6144ed90bb3c61dc0595115881d202e74a6daacc5262ec9faa2f,16-12-2024,2024-12-16 10:23:01.000 UTC,465,23777617,0xBDA319Bc7Cc8F0829df39eC0FFF5D1E061FFadf7
0x38f6d2d9ea493c3c6ee865b5b952b5fe9e3e61fc,0xa61436ffb13c9f930d457c7dc89c66950098f385a3a29d55d19333280241314a,26-02-2025,2025-02-26 14:13:25.000 UTC,437,26894929,0xB9E4E0368A9F281584C9adB685e6C9F4b9F37dBb
0x8508fd4238162cb3f3d485f432202af3b40f164e,0x46bba5c30001b8890c830456b09bfc3c8c61482410a22fe37c0423293ad4f4a7,31-05-2025,2025-05-31 05:15:39.000 UTC,349,30939596,0x6205DfbE68444cFF504A20a712cEa794c6b6Cf04
0x9eb86e93a809a41ab0e7cc0ba6f62561fda3015c,0xc9090e9dd8861a555d3fa6dbb2b7a99637176a94fe5e0d73ff8fa0bb7a4e3817,07-01-2025,2025-01-07 02:21:43.000 UTC,273,24713578,0xC23924a846eca931Ec3014253E94f15b038bd0C8
0x38f6d2d9ea493c3c6ee865b5b952b5fe9e3e61fc,0x7e316fff0c0fe984a211281144feca038d5a290f28d5e1336b895a9ccdeafe7d,06-01-2025,2025-01-06 22:07:05.000 UTC,357,24705939,0xBDA319Bc7Cc8F0829df39eC0FFF5D1E061FFadf7
0x2791dc5e14f7680d9d969acc26059ba56403b6d5,0x69c0f4a3fe50e0bd89346d23503cfb48b8c0d70142d857cc4a5ae70e02b1a379,26-12-2024,2024-12-26 01:53:31.000 UTC,243,24194332,0xBDA319Bc7Cc8F0829df39eC0FFF5D1E061FFadf7
0x2791dc5e14f7680d9d969acc26059ba56403b6d5,0x99b49ca369731f25c4438f2e3fab48d9ac45d6194a4cdf7cb465a33ad33e1989,24-12-2024,2024-12-24 11:33:33.000 UTC,183,24125333,0xBDA319Bc7Cc8F0829df39eC0FFF5D1E061FFadf7
0x2791dc5e14f7680d9d969acc26059ba56403b6d5,0x32eed52ee186db9fc50d1b320cc973aa8cff4c5d22c9b7bd7fbb3ecedfd307e2,24-12-2024,2024-12-24 12:46:55.000 UTC,334,24127534,0xBDA319Bc7Cc8F0829df39eC0FFF5D1E061FFadf7
0x8810de2baa17067ddcfbd9e8f29c55f070a55f0b,0x58ccab117e5b1ae244605ceddbda28b429bc35a84f6b5328b60d76914e9e2af9,27-03-2025,2025-03-27 10:56:23.000 UTC,160,28141818,0x0e956C897bBFCbd2155D3DfdD27c87fa5A0FaD39
0x2791dc5e14f7680d9d969acc26059ba56403b6d5,0x502e6c4184a59ef5c90e72d3172e849b397819428baa740dbeb04d4bb4fe06f3,14-01-2025,2025-01-14 20:48:07.000 UTC,400,25049170,0xBDA319Bc7Cc8F0829df39eC0FFF5D1E061FFadf7
0x095d0de0ecfd6832f1a7961ae26d285d68655d60,0x6c3f9cb74c22ee90c3e92c46acf991009e74cb75d4a44fa154ff1300310f2b7b,03-03-2025,2025-03-03 18:56:17.000 UTC,445,27119415,0x0e956C897bBFCbd2155D3DfdD27c87fa5A0FaD39
0x8fd1b615c006ebeb8a7cfb00a1dd809f31943b08,0xbc6d1a214d5bd3d8095ede6852dcf49f1407b2f52e8e03ebe4120d3bdef2584c,05-01-2025,2025-01-05 21:45:09.000 UTC,275,24662081,0xAfabcBbab5e4261B1d655c906738176191819164
0x8fd1b615c006ebeb8a7cfb00a1dd809f31943b08,0xfff5a8a0e634ef1a5327e57567fa88c9d8e94237cc6ad98ff48cfdf02cdaf611,01-01-2025,2025-01-01 22:30:03.000 UTC,444,24490628,0xAfabcBbab5e4261B1d655c906738176191819164
0xdc98dbffcc648d6088a2ff8f7dc01aef050e58fc,0x54ec0e0703af835181836f5869aec44a254de16b83a967b5743e3e3148ca3b03,06-06-2025,2025-06-06 07:49:47.000 UTC,343,31203420,0xc3f97660D0b47F0E05C3c513f73eeff7c1bd6c7a
0x8508fd4238162cb3f3d485f432202af3b40f164e,0xbe0428f94b60369c7e35be10308ddc321408a74e657b332006be054e4d389549,15-05-2025,2025-05-15 23:09:33.000 UTC,301,30280613,0xCFede447ca3b4885720B5a327e3BFb02078f06e8
0x9eb86e93a809a41ab0e7cc0ba6f62561fda3015c,0x61dd1ddd68b8db31f692501c9927e546c8777402ace74e1b69c0a2293060d76f,28-12-2024,2024-12-28 05:11:13.000 UTC,208,24286663,0xCFede447ca3b4885720B5a327e3BFb02078f06e8
0x8fd1b615c006ebeb8a7cfb00a1dd809f31943b08,0xf269f29bc01836896063c81c35af3357153c0cc3cd967589b488e9ad9751c824,01-01-2025,2025-01-01 11:50:37.000 UTC,312,24471445,0xAfabcBbab5e4261B1d655c906738176191819164
0x8fd1b615c006ebeb8a7cfb00a1dd809f31943b08,0x8a136c149c614c71cc0b210174f4cc7442089f379658d90410cac5074dff0d5a,22-01-2025,2025-01-22 04:14:25.000 UTC,101,25364959,0x0e956C897bBFCbd2155D3DfdD27c87fa5A0FaD39
0x8508fd4238162cb3f3d485f432202af3b40f164e,0xc1830780e07d8e04afeddfb6568810f0c3590161bd032955dd1e7242e6014001,11-04-2025,2025-04-11 02:11:23.000 UTC,182,28774068,0x2B74B62c564456C48055bd515A62594742b3f545
0x38f6d2d9ea493c3c6ee865b5b952b5fe9e3e61fc,0xac2412e39bf010b7a6cd043daef946cf378da5c1d6e63e5928f771373bdf0511,09-01-2025,2025-01-09 05:32:09.000 UTC,225,24805691,0x869305781fff479f0311974d55FeeB6Fc9DE96a2
0xdc98dbffcc648d6088a2ff8f7dc01aef050e58fc,0x170a1a3909b475db3b4c409136cc8b56f8e0b666007181b2ffe5029eb634ebd4,27-12-2024,2024-12-27 11:17:39.000 UTC,188,24254456,0xBDA319Bc7Cc8F0829df39eC0FFF5D1E061FFadf7
0x38f6d2d9ea493c3c6ee865b5b952b5fe9e3e61fc,0xc2bf0355897166f1b87e9dc85e50ebe2cc2cbc80287b052104c0e2386cdab443,23-05-2025,2025-05-23 19:23:45.000 UTC,614,30619439,0xB57eC27f68Bd356e300D57079B6cdbe57d50830d
0x38f6d2d9ea493c3c6ee865b5b952b5fe9e3e61fc,0x992521ba265ca2479b5ff767dde20ae93d25d43e09fe382779d65ef537d9dc75,14-01-2025,2025-01-14 20:14:07.000 UTC,370,25048150,0x869305781fff479f0311974d55FeeB6Fc9DE96a2
0x8508fd4238162cb3f3d485f432202af3b40f164e,0x28539c91c5a783cba984ace412a243dad73bd19c3b9889f264b760449502dce2,08-05-2025,2025-05-08 00:43:59.000 UTC,574,29937846,0x869305781fff479f0311974d55FeeB6Fc9DE96a2
0x2791dc5e14f7680d9d969acc26059ba56403b6d5,0xec8323291da905c094249bf871198473e274ab5df8b5ac3d6dae4542b0330ac8,13-01-2025,2025-01-13 01:57:33.000 UTC,417,24972053,0xBDA319Bc7Cc8F0829df39eC0FFF5D1E061FFadf7
0x2791dc5e14f7680d9d969acc26059ba56403b6d5,0xb7e7c4e4b3a50174d1ed4d6dbf32d6654f6e861e5a2015483cf2ee497a34d6dc,09-03-2025,2025-03-09 05:03:57.000 UTC,50,27353645,0x0e956C897bBFCbd2155D3DfdD27c87fa5A0FaD39
0x8fd1b615c006ebeb8a7cfb00a1dd809f31943b08,0xdf49f29f0d4561123b48a62f1124c98406be59b2d6f77976d2731bf95d6a8a43,26-12-2024,2024-12-26 19:31:05.000 UTC,388,24226059,0xCFede447ca3b4885720B5a327e3BFb02078f06e8
0x38f6d2d9ea493c3c6ee865b5b952b5fe9e3e61fc,0x53864c529e7ff27df28ccc5465791c39c4bab8dde47a4efb4c703352eed6f1cc,20-02-2025,2025-02-20 10:54:35.000 UTC,295,26629764,0xB9E4E0368A9F281584C9adB685e6C9F4b9F37dBb
0xdc98dbffcc648d6088a2ff8f7dc01aef050e58fc,0x83bb686b51981a7e5958275692484dfe862759712e38e3d82345777c29f26634,01-01-2025,2025-01-01 13:07:21.000 UTC,405,24473747,0x869305781fff479f0311974d55FeeB6Fc9DE96a2
0x9eb86e93a809a41ab0e7cc0ba6f62561fda3015c,0x9e38adee862ad5efbcf7745543602f43ca06962a907e0bdfc265d6fd9e14d1a7,01-02-2025,2025-02-01 07:46:51.000 UTC,330,25803332,0xB9E4E0368A9F281584C9adB685e6C9F4b9F37dBb
0xdc98dbffcc648d6088a2ff8f7dc01aef050e58fc,0x9dbcb47ebdc28c2acaf0165bdffac13deae8df87fa489de1d95068a2d695b48d,03-06-2025,2025-06-03 11:13:33.000 UTC,351,31079933,0xc3f97660D0b47F0E05C3c513f73eeff7c1bd6c7a
0x8508fd4238162cb3f3d485f432202af3b40f164e,0xcc29fe951490160a2b88fd89c65f8a88092debddb12a4c21fe07d0ef41bb82d9,01-07-2025,2025-07-01 20:38:27.000 UTC,1031,32306480,0x6205DfbE68444cFF504A20a712cEa794c6b6Cf04
0xdc98dbffcc648d6088a2ff8f7dc01aef050e58fc,0xb84a4b2086181dd96b6a8bd1226b9a737b2dc805ed82e6334f92cf18f79887f3,17-01-2025,2025-01-17 21:33:01.000 UTC,323,25180117,0x869305781fff479f0311974d55FeeB6Fc9DE96a2
0xdc98dbffcc648d6088a2ff8f7dc01aef050e58fc,0xa19ccb7353f2dc7f82d7f595caa8e822262e3c545aa93c54744e0073d0081f6e,09-01-2025,2025-01-09 00:17:47.000 UTC,390,24796260,0x869305781fff479f0311974d55FeeB6Fc9DE96a2
0x8fd1b615c006ebeb8a7cfb00a1dd809f31943b08,0x0ffd78140bdeb7b14495d3159e25b270025ae814430ca6319132c6dde2dfaa47,10-12-2024,2024-12-10 02:16:11.000 UTC,296,23503812,0xBDA319Bc7Cc8F0829df39eC0FFF5D1E061FFadf7
0x8fd1b615c006ebeb8a7cfb00a1dd809f31943b08,0xfe95b09eab2a86fa5291efec1c0c0b74ae5ff4672d229757bcff303087dc8987,13-12-2024,2024-12-13 17:47:13.000 UTC,210,23661343,0x0e956C897bBFCbd2155D3DfdD27c87fa5A0FaD39
0x8fd1b615c006ebeb8a7cfb00a1dd809f31943b08,0x542e7f2cdfa128ffaa67c3b1df41080ea8fb8f1f06414baa8b682122774bc1f3,27-06-2025,2025-06-27 21:47:29.000 UTC,246,32135751,0xf2c38dE50A250C0060fB45eBE4504B67f6F1be3C
0x38f6d2d9ea493c3c6ee865b5b952b5fe9e3e61fc,0x3c9892145b40915155f426e7f51d6e9cceec413656f59713ea198f13ad12a597,19-02-2025,2025-02-19 13:49:43.000 UTC,247,26591818,0xB9E4E0368A9F281584C9adB685e6C9F4b9F37dBb
0xdc98dbffcc648d6088a2ff8f7dc01aef050e58fc,0xc59f272dc0f85f5ae88cdc9a5c23145912fe5bde0f1f03bc9f3a00721477bb0c,24-06-2025,2025-06-24 14:40:21.000 UTC,465,31993337,0x430C09546ae9249AB75B9A4ef7B5FD9a4006D6f3
0x8fd1b615c006ebeb8a7cfb00a1dd809f31943b08,0x776e38c747965222a2f174c28b6c5c2cb72d8e41a7a1d90cbf6866ddfec4eaf7,28-12-2024,2024-12-28 13:30:55.000 UTC,926,24301654,0xBDA319Bc7Cc8F0829df39eC0FFF5D1E061FFadf7
0x38f6d2d9ea493c3c6ee865b5b952b5fe9e3e61fc,0x44ad1306839e6484d1b3e9e5842e1c39e12bbdd9ede04f28d9056e484672415a,25-06-2025,2025-06-25 16:19:29.000 UTC,736,32039511,0xCFede447ca3b4885720B5a327e3BFb02078f06e8
0x38f6d2d9ea493c3c6ee865b5b952b5fe9e3e61fc,0x680c8a29442738ff8946dffcf4e1d544981bd9080ce7aceb4b0c720938fddf6b,25-12-2024,2024-12-25 19:24:59.000 UTC,184,24182676,0xCFede447ca3b4885720B5a327e3BFb02078f06e8
0x8fd1b615c006ebeb8a7cfb00a1dd809f31943b08,0x1738dd2b4e4820c33ad10681b7e5173467c0634a3085e946d655a64236f3a5a0,01-01-2025,2025-01-01 10:33:33.000 UTC,217,24469133,0xBDA319Bc7Cc8F0829df39eC0FFF5D1E061FFadf7
0x8fd1b615c006ebeb8a7cfb00a1dd809f31943b08,0x3e2e8a45dae77a698da6964e72ab9e7e03bfb7c8fcfcb7ccfe7e1b8c47825f5c,01-01-2025,2025-01-01 06:50:23.000 UTC,290,24462438,0xCFede447ca3b4885720B5a327e3BFb02078f06e8
0x38f6d2d9ea493c3c6ee865b5b952b5fe9e3e61fc,0xbed4779681d0d254d98f5963560bf62fe95b99a08c12afd2f30d1c9fb6cb2bfe,06-01-2025,2025-01-06 02:17:53.000 UTC,349,24670263,0x0e956C897bBFCbd2155D3DfdD27c87fa5A0FaD39
0x8810de2baa17067ddcfbd9e8f29c55f070a55f0b,0x15b1c203c381a6383fa2deedd66ef9efd7f42274b285f63a9dfebd21c5dfedda,26-03-2025,2025-03-26 23:32:17.000 UTC,285,28121295,0x0e956C897bBFCbd2155D3DfdD27c87fa5A0FaD39
0xdc98dbffcc648d6088a2ff8f7dc01aef050e58fc,0x6aa8db055f4e19bd4a7cc5f6547771a94a664590ca687b14845f58fccdcd88a2,03-06-2025,2025-06-03 12:59:59.000 UTC,781,31083126,0xCFede447ca3b4885720B5a327e3BFb02078f06e8
0x9eb86e93a809a41ab0e7cc0ba6f62561fda3015c,0x0ba7135952b2aabe00e8aa8a85891f2c2cd0a80f91af4a60c2ee5c403cbbbf4f,18-12-2024,2024-12-18 23:55:21.000 UTC,440,23888387,0xBDA319Bc7Cc8F0829df39eC0FFF5D1E061FFadf7
0x38f6d2d9ea493c3c6ee865b5b952b5fe9e3e61fc,0x5f0fd0988b485ae907e22887d899d93548af0825ac0d27a8f7a4033bd79101ef,06-06-2025,2025-06-06 07:56:49.000 UTC,1265,31203631,0xc3f97660D0b47F0E05C3c513f73eeff7c1bd6c7a
0x9eb86e93a809a41ab0e7cc0ba6f62561fda3015c,0xb356748c7bc9ed9f27c2732b06fa74b1231b2dfd22589beaa3e31135595fe5e3,13-12-2024,2024-12-13 05:48:05.000 UTC,351,23639769,0xBDA319Bc7Cc8F0829df39eC0FFF5D1E061FFadf7
0x38f6d2d9ea493c3c6ee865b5b952b5fe9e3e61fc,0xaeb2708139a53f3e06b334de00fcf57b0d92757dfd0ccf9cb55ea901eec92491,02-01-2025,2025-01-02 22:54:27.000 UTC,341,24534560,0x869305781fff479f0311974d55FeeB6Fc9DE96a2
0x2791dc5e14f7680d9d969acc26059ba56403b6d5,0xdaf5eb8da5a1d07e15479377fa845748ba87d67a2f096ca201b71be79f98fa6b,26-02-2025,2025-02-26 19:09:49.000 UTC,458,26903821,0x0e956C897bBFCbd2155D3DfdD27c87fa5A0FaD39
0xdc98dbffcc648d6088a2ff8f7dc01aef050e58fc,0x52f42368e52bcd54f0b8ca3c60dcc33ba7bcc70e5813c8f6034740f135175083,01-01-2025,2025-01-01 04:01:59.000 UTC,470,24457386,0xBDA319Bc7Cc8F0829df39eC0FFF5D1E061FFadf7
0x38f6d2d9ea493c3c6ee865b5b952b5fe9e3e61fc,0x851acd8a07cc70c3ea73519f3c24b706dfec29a94b1c73477a950487f5758c9d,02-01-2025,2025-01-02 10:23:21.000 UTC,247,24512027,0xBDA319Bc7Cc8F0829df39eC0FFF5D1E061FFadf7
0x38f6d2d9ea493c3c6ee865b5b952b5fe9e3e61fc,0x1f342188abd57ba696b299ed841520823b6a072f6a25a04deeddf8815aef6e20,10-06-2025,2025-06-10 19:33:05.000 UTC,407,31397319,0xc3f97660D0b47F0E05C3c513f73eeff7c1bd6c7a
0x2791dc5e14f7680d9d969acc26059ba56403b6d5,0x7645e56bb11bbc8bd402c1a486d424de092739c2c63567c996c1021458ae5f1f,05-01-2025,2025-01-05 09:29:17.000 UTC,498,24640005,0x869305781fff479f0311974d55FeeB6Fc9DE96a2
0x9eb86e93a809a41ab0e7cc0ba6f62561fda3015c,0xf2f9752e025b211db8641d6e8110d1cdc5fc2671166dc2bf91657dbbb29848bd,01-01-2025,2025-01-01 15:26:49.000 UTC,348,24477931,0xC23924a846eca931Ec3014253E94f15b038bd0C8
0x9eb86e93a809a41ab0e7cc0ba6f62561fda3015c,0x11ed5d18303088c0a3548d1ae3bc3707a62f70dd98e789f2ca36ce9d93c9bbcd,25-02-2025,2025-02-25 16:29:27.000 UTC,271,26855810,0x6399ed6725cC163D019aA64FF55b22149D7179A8
0x9eb86e93a809a41ab0e7cc0ba6f62561fda3015c,0x2da90c19faa6c77df4102a10742cb4cb3465e4bb95b3ed376aab6022ef3ca6da,17-05-2025,2025-05-17 06:16:43.000 UTC,110,30336628,0xc3f97660D0b47F0E05C3c513f73eeff7c1bd6c7a
0xdc98dbffcc648d6088a2ff8f7dc01aef050e58fc,0x84216aba38c58edb4bb9224ceb255ca1a3cef3293b5c6f3a7fa59f941905bf5c,01-06-2025,2025-06-01 17:52:15.000 UTC,256,31005494,0xc3f97660D0b47F0E05C3c513f73eeff7c1bd6c7a
0x38f6d2d9ea493c3c6ee865b5b952b5fe9e3e61fc,0x2a91634ecab69bd4e2ad897544cbb581b205dc188c0a4c3c3fff73c16af075a2,08-02-2025,2025-02-08 02:42:15.000 UTC,277,26096594,0x0e956C897bBFCbd2155D3DfdD27c87fa5A0FaD39
0x9eb86e93a809a41ab0e7cc0ba6f62561fda3015c,0xb21cbc1d02761094125560724fa2e40490bcb989d2520fdfec9e1b9971d0c15f,24-12-2024,2024-12-24 18:09:51.000 UTC,392,24137222,0xBDA319Bc7Cc8F0829df39eC0FFF5D1E061FFadf7
0x2791dc5e14f7680d9d969acc26059ba56403b6d5,0xabf5bb33e5acc18c4a8068e0a85c353c1ae4eb89ca4ec08e87ba7bef9d2e02cf,21-12-2024,2024-12-21 19:51:55.000 UTC,242,24010684,0xBDA319Bc7Cc8F0829df39eC0FFF5D1E061FFadf7
0x38f6d2d9ea493c3c6ee865b5b952b5fe9e3e61fc,0xa429b1706d1834d69ff708acee9f44e39aed4812655cf82c4533fe9873079816,01-01-2025,2025-01-01 16:18:11.000 UTC,284,24479472,0xCFede447ca3b4885720B5a327e3BFb02078f06e8
0x38f6d2d9ea493c3c6ee865b5b952b5fe9e3e61fc,0xfee7acb59d06b3bbc47afde3a7d3b7f9606a6f60f2a48281fe1161924df1659f,08-01-2025,2025-01-08 20:17:15.000 UTC,419,24789044,0xB9E4E0368A9F281584C9adB685e6C9F4b9F37dBb
0x8fd1b615c006ebeb8a7cfb00a1dd809f31943b08,0x6da3b3fb3c3275c2ba64d88443e290ba8fd661cbfeaf4d814c7dfdb05782155c,05-03-2025,2025-03-05 06:33:33.000 UTC,280,27183533,0x0e956C897bBFCbd2155D3DfdD27c87fa5A0FaD39
0x2791dc5e14f7680d9d969acc26059ba56403b6d5,0xdd6e5b10951cb3595b61bfc5c67e6c4ed658200cd70e3bffdbbd59472232237a,10-01-2025,2025-01-10 15:56:31.000 UTC,294,24867622,0x869305781fff479f0311974d55FeeB6Fc9DE96a2
0xdc98dbffcc648d6088a2ff8f7dc01aef050e58fc,0xcefc910712b8da6bae475a05030b1eae4f16434a21e178a93e5113a83169cf6f,06-01-2025,2025-01-06 16:49:23.000 UTC,582,24696408,0x869305781fff479f0311974d55FeeB6Fc9DE96a2
0x2791dc5e14f7680d9d969acc26059ba56403b6d5,0xdaa56b30b77f98e3fd2008f836c3cb6fd9bba6e92b2cc0c6898d98bcfb13c6bc,25-12-2024,2024-12-25 11:17:27.000 UTC,313,24168050,0xBDA319Bc7Cc8F0829df39eC0FFF5D1E061FFadf7
0x8fd1b615c006ebeb8a7cfb00a1dd809f31943b08,0x0cb9ac4ac8f95301bcc4ce973aa45cff8061be2f3c00b391abc25ec8c508ac7f,01-01-2025,2025-01-01 08:51:43.000 UTC,234,24466078,0xAfabcBbab5e4261B1d655c906738176191819164
0x8fd1b615c006ebeb8a7cfb00a1dd809f31943b08,0xa6c2f853e3285d537bd8127ca498fa5ca19ebc32f4359f6eb7aa5bc5d40aca0e,06-01-2025,2025-01-06 18:25:25.000 UTC,512,24699289,0xAfabcBbab5e4261B1d655c906738176191819164
0x9eb86e93a809a41ab0e7cc0ba6f62561fda3015c,0x8b735b12d0bb31bd782ecb1567aa4c0cdb437072483d78eb79989521fcfe53eb,08-01-2025,2025-01-08 17:38:35.000 UTC,349,24784284,0xBDA319Bc7Cc8F0829df39eC0FFF5D1E061FFadf7
0x8fd1b615c006ebeb8a7cfb00a1dd809f31943b08,0xa576af71f2f89b3c4102a917a5a8e65a21e4243103c45b6626aec1e03be0f860,12-12-2024,2024-12-12 06:57:17.000 UTC,362,23598645,0xBDA319Bc7Cc8F0829df39eC0FFF5D1E061FFadf7
0x2791dc5e14f7680d9d969acc26059ba56403b6d5,0xd500859eef8ab6086c7ff5629b1f09cab8b29e2c9b2842925935aa199850828d,07-01-2025,2025-01-07 02:54:15.000 UTC,586,24714554,0xBDA319Bc7Cc8F0829df39eC0FFF5D1E061FFadf7
0xdc98dbffcc648d6088a2ff8f7dc01aef050e58fc,0xd16e6c474e08f7882c255b8543fdbd6eace02fe6dc07b861f4f7aa06913bac51,06-01-2025,2025-01-06 20:58:55.000 UTC,483,24703894,0xBDA319Bc7Cc8F0829df39eC0FFF5D1E061FFadf7
0x351f61e4c49cf11f24d9f2e737ca5eff81806355,0x07c6f56b9faa2858c2c15dcb0d2dc80d5f7996a8c455bba1df8ad12ebc6352c5,14-11-2025,2025-11-14 21:18:07.000 UTC,758,38182870,0x0e956C897bBFCbd2155D3DfdD27c87fa5A0FaD39
0x9eb86e93a809a41ab0e7cc0ba6f62561fda3015c,0x70deaa9686e05f150cc2355754873ac78ad8dd33c08a58027ad994f74390d5b6,04-01-2025,2025-01-04 23:31:35.000 UTC,280,24622074,0x869305781fff479f0311974d55FeeB6Fc9DE96a2
0x38f6d2d9ea493c3c6ee865b5b952b5fe9e3e61fc,0x5504a13f0fb160e6a7d6e51f6eab8e93718e2c67ab5014f694dc3347bbec1d9d,02-01-2025,2025-01-02 06:24:51.000 UTC,307,24504872,0x869305781fff479f0311974d55FeeB6Fc9DE96a2
0x8508fd4238162cb3f3d485f432202af3b40f164e,0xe33eaed2abe208eb8db727f4a49c3caa89f7166ffc018845348045e1a7db1b20,17-06-2025,2025-06-17 02:45:39.000 UTC,1205,31669496,0xc3f97660D0b47F0E05C3c513f73eeff7c1bd6c7a
0x8fd1b615c006ebeb8a7cfb00a1dd809f31943b08,0xe70c0b431ebbe8fc2cf289fb07b52ef4dbbd136e3fef9bf6a5e309b960a86e87,02-01-2025,2025-01-02 16:26:25.000 UTC,296,24522919,0xBDA319Bc7Cc8F0829df39eC0FFF5D1E061FFadf7
0x8fd1b615c006ebeb8a7cfb00a1dd809f31943b08,0x7ef22139f0070585f4706fcfc3235a598e3dc6e4f55d04c3bc5c53b6bda408e6,05-01-2025,2025-01-05 12:18:47.000 UTC,361,24645090,0xBDA319Bc7Cc8F0829df39eC0FFF5D1E061FFadf7
0x2791dc5e14f7680d9d969acc26059ba56403b6d5,0xe194fdb1bee80f3dd43599e7cadbd1fcfb0460cc371d30539f5bb16948bd7263,06-01-2025,2025-01-06 23:30:25.000 UTC,272,24708439,0xBDA319Bc7Cc8F0829df39eC0FFF5D1E061FFadf7
0xdc98dbffcc648d6088a2ff8f7dc01aef050e58fc,0x71eafe7017f7c216a95e13b4db59ad5b6d2ff2ee5040c8d092fbcc5cfd7cf5d3,24-01-2025,2025-01-24 05:16:39.000 UTC,183,25453226,0xf2c38dE50A250C0060fB45eBE4504B67f6F1be3C
0xdc98dbffcc648d6088a2ff8f7dc01aef050e58fc,0x08453412d00e95eee479dc64b5bcd15a8486c95797c4fe36e41eb86a96b31ea7,06-01-2025,2025-01-06 12:58:23.000 UTC,317,24689478,0xB9E4E0368A9F281584C9adB685e6C9F4b9F37dBb
0xdc98dbffcc648d6088a2ff8f7dc01aef050e58fc,0xed37e07eee07f47ec75bc3099e1ead84d4fb18f2bef3595e32e5355fd87d8b85,12-01-2025,2025-01-12 03:01:59.000 UTC,289,24930786,0xBDA319Bc7Cc8F0829df39eC0FFF5D1E061FFadf7
0x38f6d2d9ea493c3c6ee865b5b952b5fe9e3e61fc,0x0770acd7e09a66eba22e1547122f5e194278c241d2ec58149d0924e2b10b16f9,22-01-2025,2025-01-22 04:24:03.000 UTC,165,25365248,0xB9E4E0368A9F281584C9adB685e6C9F4b9F37dBb
0x9eb86e93a809a41ab0e7cc0ba6f62561fda3015c,0xe55e296faf8f29295cea3e0df57221310e2d6acc472cd861d986dc9cc7170101,22-05-2025,2025-05-22 16:27:05.000 UTC,641,30570939,0xc3f97660D0b47F0E05C3c513f73eeff7c1bd6c7a
0x2791dc5e14f7680d9d969acc26059ba56403b6d5,0x8e04db72c8caf3ae437ba020da83cda63f566ffc1cdaa009d0a0f60de94f127e,11-01-2025,2025-01-11 21:33:35.000 UTC,790,24920934,0xBDA319Bc7Cc8F0829df39eC0FFF5D1E061FFadf7
0x9eb86e93a809a41ab0e7cc0ba6f62561fda3015c,0xb102e354d46ffa6c20225f86f32e712d2e09014843bc66a1492a39e1a104a791,16-02-2025,2025-02-16 11:07:55.000 UTC,217,26457364,0x6399ed6725cC163D019aA64FF55b22149D7179A8
0x2791dc5e14f7680d9d969acc26059ba56403b6d5,0xbe925c451d0a024121969154a219cd642a5e8ceedefa878a3f9cc6fbf3323062,15-01-2025,2025-01-15 04:49:21.000 UTC,337,25063607,0xBDA319Bc7Cc8F0829df39eC0FFF5D1E061FFadf7
0x38f6d2d9ea493c3c6ee865b5b952b5fe9e3e61fc,0x0d236db7f85f44be8e907caa75a98b06df6740edb8f40367bee8465cdba3419d,18-12-2024,2024-12-18 00:06:53.000 UTC,581,23845533,0xCFede447ca3b4885720B5a327e3BFb02078f06e8
0x38f6d2d9ea493c3c6ee865b5b952b5fe9e3e61fc,0x25d1e2f3c0f04d971893d7023316d57e48d5bf72155466a9ece9e8040628fc63,06-01-2025,2025-01-06 20:35:29.000 UTC,504,24703191,0x0e956C897bBFCbd2155D3DfdD27c87fa5A0FaD39
0x9eb86e93a809a41ab0e7cc0ba6f62561fda3015c,0x51e0e31bb10d2a119169835fa991a63f39efa6a5cfa9d470d94e139cc7af940f,24-01-2025,2025-01-24 03:43:57.000 UTC,319,25450445,0xCFede447ca3b4885720B5a327e3BFb02078f06e8
0xdc98dbffcc648d6088a2ff8f7dc01aef050e58fc,0x21dee4131f5c6eab794046455decdf656740b7485a9e69bcffb709c0f6cc9f0f,06-01-2025,2025-01-06 01:32:49.000 UTC,335,24668911,0x869305781fff479f0311974d55FeeB6Fc9DE96a2
0xdc98dbffcc648d6088a2ff8f7dc01aef050e58fc,0xc8f2de079d8687f4079b8cc9bca00bab804c5020c3cdebdf4c937a4dcb1611a2,08-01-2025,2025-01-08 21:40:31.000 UTC,497,24791542,0xBDA319Bc7Cc8F0829df39eC0FFF5D1E061FFadf7
0x2791dc5e14f7680d9d969acc26059ba56403b6d5,0x60693dd64a383da067d6dae611cd2c05528823f26854b4de3e40eafaed86f9b6,22-12-2024,2024-12-22 14:11:25.000 UTC,252,24043669,0xBDA319Bc7Cc8F0829df39eC0FFF5D1E061FFadf7
0xdc98dbffcc648d6088a2ff8f7dc01aef050e58fc,0x0e9a8131a4d3194ff807299ac9e2c00d1430c0fa6b8e1cb89fa2b7510ce875b0,15-01-2025,2025-01-15 19:50:47.000 UTC,479,25090650,0xB9E4E0368A9F281584C9adB685e6C9F4b9F37dBb
0x8810de2baa17067ddcfbd9e8f29c55f070a55f0b,0x6c886c0f623b240949ffc5650f2f22e0bf8e09d18abacf27ad67dddc1ff6512b,24-04-2025,2025-04-24 12:15:25.000 UTC,488,29353789,0x0e956C897bBFCbd2155D3DfdD27c87fa5A0FaD39
0x8fd1b615c006ebeb8a7cfb00a1dd809f31943b08,0x1b2e30283de3b770ff35acbc493f4957f542c9295b40820ab121d928102c7d80,11-12-2024,2024-12-11 21:09:47.000 UTC,227,23581020,0xBDA319Bc7Cc8F0829df39eC0FFF5D1E061FFadf7
0xdc98dbffcc648d6088a2ff8f7dc01aef050e58fc,0x79da476f12e0138df0b8d65d03f91f218cb1d83f933d128968eb792ccc30a771,07-01-2025,2025-01-07 08:13:07.000 UTC,231,24724120,0xBDA319Bc7Cc8F0829df39eC0FFF5D1E061FFadf7
0xdc98dbffcc648d6088a2ff8f7dc01aef050e58fc,0x90d97dd945d34d1a6819c2b09e3aa8934e19341413bf524eca880f4992a6a2f2,14-07-2025,2025-07-14 03:14:25.000 UTC,319,32836759,0xf2c38dE50A250C0060fB45eBE4504B67f6F1be3C
0x38f6d2d9ea493c3c6ee865b5b952b5fe9e3e61fc,0xf0d0d7d0b420d6390b948f13b5cecad58aea5230303289a15ca8ce22bccc2f37,02-06-2025,2025-06-02 08:17:25.000 UTC,178,31031449,0xc3f97660D0b47F0E05C3c513f73eeff7c1bd6c7a
0x8fd1b615c006ebeb8a7cfb00a1dd809f31943b08,0x1431d5989c0450295f81dc66d5f4c0381f24b3c47db14e477cd6f8d97d04d8c0,29-12-2024,2024-12-29 07:52:11.000 UTC,306,24334692,0xBDA319Bc7Cc8F0829df39eC0FFF5D1E061FFadf7
0x2791dc5e14f7680d9d969acc26059ba56403b6d5,0x26482a56210cff50290878bdf89e24c57ee3f2530c7c81c85a3057c2221d54ed,03-01-2025,2025-01-03 22:48:17.000 UTC,237,24577575,0xBDA319Bc7Cc8F0829df39eC0FFF5D1E061FFadf7
0x8508fd4238162cb3f3d485f432202af3b40f164e,0x05124e6d787b7ccd3566d30115c305ef095e4d5f1538234b4ea6a6924853fda9,18-06-2025,2025-06-18 04:10:07.000 UTC,424,31715230,0x6205DfbE68444cFF504A20a712cEa794c6b6Cf04
0xdc98dbffcc648d6088a2ff8f7dc01aef050e58fc,0x4674df96ee878ebad19dbaf576d255484e2a5f5943293f2f45a67076b972e149,20-12-2024,2024-12-20 06:33:57.000 UTC,324,23943545,0xCFede447ca3b4885720B5a327e3BFb02078f06e8
0x9eb86e93a809a41ab0e7cc0ba6f62561fda3015c,0x62af00f8d7c6d8ae505ca36e95ca39871cc29d85f1114cdb63ac66ddd3f19cd2,31-12-2024,2024-12-31 15:29:49.000 UTC,233,24434821,0xBDA319Bc7Cc8F0829df39eC0FFF5D1E061FFadf7
0x9eb86e93a809a41ab0e7cc0ba6f62561fda3015c,0x81e1ed81d657ebc707165192dc9413f8b45558caa3c6b5acdfe6c364108423ec,01-01-2025,2025-01-01 20:31:29.000 UTC,335,24487071,0xBDA319Bc7Cc8F0829df39eC0FFF5D1E061FFadf7
0x9eb86e93a809a41ab0e7cc0ba6f62561fda3015c,0x73eaa0e264dc3924d60429f7fd1d743e0c82308efacc6f762816415c418936c3,02-01-2025,2025-01-02 04:57:35.000 UTC,325,24502254,0xBDA319Bc7Cc8F0829df39eC0FFF5D1E061FFadf7
0x095d0de0ecfd6832f1a7961ae26d285d68655d60,0x3e5f51b2a438e4066f61ff11e27cacc44debb6a1beff9e9bee8f23e72b81f412,05-02-2025,2025-02-05 12:16:17.000 UTC,712,25984215,0x869305781fff479f0311974d55FeeB6Fc9DE96a2
0x095d0de0ecfd6832f1a7961ae26d285d68655d60,0x9d04faf6c8b7f8712fed3181ce1a1a869390782b51f0f98e64ca1182cc4393cf,03-04-2025,2025-04-03 08:15:43.000 UTC,327,28439398,0x869305781fff479f0311974d55FeeB6Fc9DE96a2
0xdc98dbffcc648d6088a2ff8f7dc01aef050e58fc,0xd033bc6c634e6cf8919396a249479cd53d917235681c83c1513747bdbe0c9b43,03-06-2025,2025-06-03 11:26:55.000 UTC,462,31080334,0xc3f97660D0b47F0E05C3c513f73eeff7c1bd6c7a
0xdc98dbffcc648d6088a2ff8f7dc01aef050e58fc,0xc713b315cbe49a6f7a129416275f5a2a07a49f00c754c10a8a0dc58089ee89b4,06-01-2025,2025-01-06 08:06:41.000 UTC,513,24680727,0xBDA319Bc7Cc8F0829df39eC0FFF5D1E061FFadf7
0x2791dc5e14f7680d9d969acc26059ba56403b6d5,0x5dc72846c2a2868a7c3d2be6e7933b937e77de5dd5e24beab548968986826f4a,06-01-2025,2025-01-06 19:28:23.000 UTC,340,24701178,0xB9E4E0368A9F281584C9adB685e6C9F4b9F37dBb
0x8fd1b615c006ebeb8a7cfb00a1dd809f31943b08,0x29dc8717390df475f578c6796ec8f51659eccb2fc3db255cb397adb84dc65882,16-12-2024,2024-12-16 04:25:29.000 UTC,337,23766891,0xBDA319Bc7Cc8F0829df39eC0FFF5D1E061FFadf7
0x9eb86e93a809a41ab0e7cc0ba6f62561fda3015c,0x15e06e8180e64007ad43604c9f472394da9d86aeeb423c97904fb7dd20e9c0d0,01-01-2025,2025-01-01 22:40:25.000 UTC,274,24490939,0x869305781fff479f0311974d55FeeB6Fc9DE96a2
0x38f6d2d9ea493c3c6ee865b5b952b5fe9e3e61fc,0xb6839564596a2804d49c0c80b35b09593bdcd914cb7450bc5f08c912a604fdeb,07-01-2025,2025-01-07 14:48:53.000 UTC,347,24735993,0x0e956C897bBFCbd2155D3DfdD27c87fa5A0FaD39
0x9eb86e93a809a41ab0e7cc0ba6f62561fda3015c,0x8e213e3064dd0e6c59b916070b65041e3e2c63c39a02e71762e5dafb38315449,24-05-2025,2025-05-24 18:34:39.000 UTC,597,30661166,0xc3f97660D0b47F0E05C3c513f73eeff7c1bd6c7a
0x38f6d2d9ea493c3c6ee865b5b952b5fe9e3e61fc,0xd087c82c0d3f5d79b5b8d54d23a2334b06c5290bf034f85db24124cf947e7cee,08-01-2025,2025-01-08 23:12:41.000 UTC,516,24794307,0x0e956C897bBFCbd2155D3DfdD27c87fa5A0FaD39
0x38f6d2d9ea493c3c6ee865b5b952b5fe9e3e61fc,0xd349ffe597249a6190da851dfd4fabf2cc02b85ae6ab13d43941a56a146f82f0,22-05-2025,2025-05-22 15:31:35.000 UTC,726,30569274,0xCFede447ca3b4885720B5a327e3BFb02078f06e8
0x095d0de0ecfd6832f1a7961ae26d285d68655d60,0xddc8b9e3643927637bbaed95de3a0b325797819cba07d9664b6836fdad557057,25-03-2025,2025-03-25 19:34:13.000 UTC,211,28070953,0x869305781fff479f0311974d55FeeB6Fc9DE96a2
0x9eb86e93a809a41ab0e7cc0ba6f62561fda3015c,0xac4aab8d5ec2276f9ddaff1f6b87077be8b42bc53eb3859ffe7746166aa93e40,03-01-2025,2025-01-03 04:36:37.000 UTC,309,24544825,0xBDA319Bc7Cc8F0829df39eC0FFF5D1E061FFadf7
0xdc98dbffcc648d6088a2ff8f7dc01aef050e58fc,0x0d1216e177b979fbbbcc3e8a5ab910f28a4fc49b28ef3c4be7a709040d81e101,02-01-2025,2025-01-02 21:48:21.000 UTC,324,24532577,0x869305781fff479f0311974d55FeeB6Fc9DE96a2
0x2791dc5e14f7680d9d969acc26059ba56403b6d5,0x0cc743269cc0318b1093a91c4da8527b391f07ba7f5359cba33ef475e3ed72e8,28-12-2024,2024-12-28 18:59:31.000 UTC,312,24311512,0xBDA319Bc7Cc8F0829df39eC0FFF5D1E061FFadf7
0x8fd1b615c006ebeb8a7cfb00a1dd809f31943b08,0x983911ad9e5cb245624375780361a12964bec251ec1a1c56d13a20b2a0c40632,02-01-2025,2025-01-02 10:10:45.000 UTC,646,24511649,0xBDA319Bc7Cc8F0829df39eC0FFF5D1E061FFadf7
0x8fd1b615c006ebeb8a7cfb00a1dd809f31943b08,0xadcaa11bb876bc759fb7595bc193771cc9c0cb53bdf2696d18617565e7be1d15,14-12-2024,2024-12-14 22:03:37.000 UTC,767,23712235,0xBDA319Bc7Cc8F0829df39eC0FFF5D1E061FFadf7
0x8fd1b615c006ebeb8a7cfb00a1dd809f31943b08,0x97412a9462b9b21263fe65983d1e4e170837fcd60b90a5ccf2d9a54d52ec941c,05-01-2025,2025-01-05 02:38:39.000 UTC,318,24627686,0xBDA319Bc7Cc8F0829df39eC0FFF5D1E061FFadf7
0x2791dc5e14f7680d9d969acc26059ba56403b6d5,0x7df3eef4fe5ad22c92fae698d90af693397ca8997179437d20a54aab1ca09f34,05-02-2025,2025-02-05 04:35:55.000 UTC,186,25970404,0x0e956C897bBFCbd2155D3DfdD27c87fa5A0FaD39
0xdc98dbffcc648d6088a2ff8f7dc01aef050e58fc,0xc5e792671d4e98b23b0947aeb2bd65068c7b2306b548b623158adada8f117713,09-01-2025,2025-01-09 01:38:29.000 UTC,246,24798681,0xBDA319Bc7Cc8F0829df39eC0FFF5D1E061FFadf7
0x8508fd4238162cb3f3d485f432202af3b40f164e,0x5175df904c39e97138540fd3d8d0ba1794553eb726fa40f2f36b97b629b7ac92,07-04-2025,2025-04-07 13:41:33.000 UTC,490,28621973,0x2B74B62c564456C48055bd515A62594742b3f545
0x2791dc5e14f7680d9d969acc26059ba56403b6d5,0x6b202899057d0a50e7c05f4ba88c1e28e72f7ca431a28be68835f9b5b3c2360c,08-01-2025,2025-01-08 22:42:11.000 UTC,280,24793392,0xBDA319Bc7Cc8F0829df39eC0FFF5D1E061FFadf7
0xdc98dbffcc648d6088a2ff8f7dc01aef050e58fc,0x282d343a120ea078b36bcb66c3401ef5e4ddda42d0733995888126b8a13792b0,10-01-2025,2025-01-10 08:35:47.000 UTC,257,24854400,0xBDA319Bc7Cc8F0829df39eC0FFF5D1E061FFadf7
0x2791dc5e14f7680d9d969acc26059ba56403b6d5,0xc54e44e7c6589229749c65804b96aced078809c9a825434992360c73f798483a,12-01-2025,2025-01-12 14:40:51.000 UTC,301,24951752,0xBDA319Bc7Cc8F0829df39eC0FFF5D1E061FFadf7
0x2791dc5e14f7680d9d969acc26059ba56403b6d5,0xde49582bc2a5e6fb5c2c3c614ed2c8d9eafea573513ff4c2bf65eb67e2cb788b,29-12-2024,2024-12-29 10:22:55.000 UTC,212,24339214,0xBDA319Bc7Cc8F0829df39eC0FFF5D1E061FFadf7
0x38f6d2d9ea493c3c6ee865b5b952b5fe9e3e61fc,0x692c107da608b8a676a4a2f4319a9caf4bff660fe656c20953200c588060dc70,11-06-2025,2025-06-11 08:22:11.000 UTC,882,31420392,0xc3f97660D0b47F0E05C3c513f73eeff7c1bd6c7a
0x38f6d2d9ea493c3c6ee865b5b952b5fe9e3e61fc,0xc499174bcb35c76d3cda44d7e9e1628fde9f6951ff1c5ecc6b072d0fda15273e,30-12-2024,2024-12-30 06:40:25.000 UTC,507,24375739,0x869305781fff479f0311974d55FeeB6Fc9DE96a2
0x8fd1b615c006ebeb8a7cfb00a1dd809f31943b08,0x77efbbdf98ecfaf5066244d021649ebbe2c62e84be56d6eb8ed38775246f8f7f,22-12-2024,2024-12-22 15:36:31.000 UTC,255,24046222,0xBDA319Bc7Cc8F0829df39eC0FFF5D1E061FFadf7
0xdc98dbffcc648d6088a2ff8f7dc01aef050e58fc,0xe31e89e572fe9dfcee7cf576ea1369580912027c03cb95491919c0755874f2c0,24-01-2025,2025-01-24 05:16:11.000 UTC,274,25453212,0xCFede447ca3b4885720B5a327e3BFb02078f06e8
0x9eb86e93a809a41ab0e7cc0ba6f62561fda3015c,0xf4a4b123784b9b10afff0371e72ab39ab36246682bfaa769fa3d7d3a41960051,18-12-2024,2024-12-18 09:55:29.000 UTC,306,23863191,0xCFede447ca3b4885720B5a327e3BFb02078f06e8
0xdc98dbffcc648d6088a2ff8f7dc01aef050e58fc,0x7899501b51d89e1a953cb21f89eba03ed6f92b193bf16be58e16d7dc18700205,25-06-2025,2025-06-25 20:11:53.000 UTC,631,32046483,0xf2c38dE50A250C0060fB45eBE4504B67f6F1be3C
0xdc98dbffcc648d6088a2ff8f7dc01aef050e58fc,0x69a096cefc26e815a5d19448b531002f2812af721d5687979b88f22800d0f3b5,02-06-2025,2025-06-02 05:09:15.000 UTC,542,31025804,0xc3f97660D0b47F0E05C3c513f73eeff7c1bd6c7a
0x9eb86e93a809a41ab0e7cc0ba6f62561fda3015c,0xfff6463bd6150410068326d51c2904973dd84aca1615727e1902ecd42f10579c,29-12-2024,2024-12-29 19:19:53.000 UTC,215,24355323,0xCFede447ca3b4885720B5a327e3BFb02078f06e8
0x9eb86e93a809a41ab0e7cc0ba6f62561fda3015c,0xd4300eb1da1913efaff4d015ccab1f4c252c0d2ab2d18c27a35426653ca073f5,27-02-2025,2025-02-27 08:19:41.000 UTC,1329,26927517,0x6399ed6725cC163D019aA64FF55b22149D7179A8
0x9eb86e93a809a41ab0e7cc0ba6f62561fda3015c,0x187926ad32e5334ff8c4e7ed14c3124cc9905073ce64d7b6eb0dbbf1fc9adb00,20-05-2025,2025-05-20 05:35:27.000 UTC,33,30464990,0xc3f97660D0b47F0E05C3c513f73eeff7c1bd6c7a
0xdc98dbffcc648d6088a2ff8f7dc01aef050e58fc,0x1bf24e19e0fd866de18de01b98567817f92953b6171a7f673382d78863dd3c80,14-01-2025,2025-01-14 07:16:19.000 UTC,224,25024816,0xBDA319Bc7Cc8F0829df39eC0FFF5D1E061FFadf7
0x9eb86e93a809a41ab0e7cc0ba6f62561fda3015c,0x61b376c6b68defc6eaac30e83063ba6116eccf7c9a9d9373e37930fb5a96eaeb,07-01-2025,2025-01-07 00:40:43.000 UTC,437,24710548,0xBDA319Bc7Cc8F0829df39eC0FFF5D1E061FFadf7
0x9eb86e93a809a41ab0e7cc0ba6f62561fda3015c,0x369ec5bcafb020f81b98dd8491f332f86017614e34139624fb4182e6b77f4741,29-05-2025,2025-05-29 01:28:01.000 UTC,421,30846367,0xc3f97660D0b47F0E05C3c513f73eeff7c1bd6c7a
0x2791dc5e14f7680d9d969acc26059ba56403b6d5,0xb9ecdf5397058d06b9223336a0c76d65ddf2b1297c5cc6830c6ff3712799ac8a,08-01-2025,2025-01-08 21:40:45.000 UTC,409,24791549,0xBDA319Bc7Cc8F0829df39eC0FFF5D1E061FFadf7
0x9eb86e93a809a41ab0e7cc0ba6f62561fda3015c,0x8b82966c6e1a942773fb6bb9d96b14533999d79739131398af9bde2af22a6eb4,12-12-2024,2024-12-12 23:19:11.000 UTC,430,23628102,0xCFede447ca3b4885720B5a327e3BFb02078f06e8
0x8508fd4238162cb3f3d485f432202af3b40f164e,0xc2d472fd19b10713c51f5532637f263b82ee370f3bc77930abb383dc35719114,09-04-2025,2025-04-09 18:35:09.000 UTC,489,28717181,0x869305781fff479f0311974d55FeeB6Fc9DE96a2
0x38f6d2d9ea493c3c6ee865b5b952b5fe9e3e61fc,0x70a6dce982ac0feac2ef159ae8ba48e0f8502f9a9d223260a2ac10747e4dc954,03-01-2025,2025-01-03 11:10:25.000 UTC,239,24556639,0x869305781fff479f0311974d55FeeB6Fc9DE96a2
0x38f6d2d9ea493c3c6ee865b5b952b5fe9e3e61fc,0x5b65f0462cde1322d88fb1d9638ed4736174522d3f2bc39b87bafe3dbfc948a9,30-05-2025,2025-05-30 13:16:59.000 UTC,938,30910836,0xc3f97660D0b47F0E05C3c513f73eeff7c1bd6c7a
0x38f6d2d9ea493c3c6ee865b5b952b5fe9e3e61fc,0xa95d744eb2cd816523def62a5660e012d8effb24d77dbffb2958fa18f499bc66,08-12-2024,2024-12-08 05:31:09.000 UTC,448,23423261,0x0e956C897bBFCbd2155D3DfdD27c87fa5A0FaD39
0xdc98dbffcc648d6088a2ff8f7dc01aef050e58fc,0x003688d26fec5ecebc7c05f5457ca96c4ebf014b432313d969df752f4415ab68,17-01-2025,2025-01-17 00:15:11.000 UTC,255,25141782,0x869305781fff479f0311974d55FeeB6Fc9DE96a2
0x2791dc5e14f7680d9d969acc26059ba56403b6d5,0x845105714ec412bf50bde285f080521180cb5fa7122897abbc77d3d32adc855b,13-12-2024,2024-12-13 23:37:13.000 UTC,459,23671843,0xBDA319Bc7Cc8F0829df39eC0FFF5D1E061FFadf7
0x2791dc5e14f7680d9d969acc26059ba56403b6d5,0x279073a5d1123f0f6fbcbb9085d23f02cdd592a8c2726c88933af4013e14e2a7,10-01-2025,2025-01-10 04:38:53.000 UTC,504,24847293,0xBDA319Bc7Cc8F0829df39eC0FFF5D1E061FFadf7
0x38f6d2d9ea493c3c6ee865b5b952b5fe9e3e61fc,0x54f4ed2008e13c656f9c95f8a9839617441fd6b16b4917b4f76afc4010bf95e1,20-01-2025,2025-01-20 01:51:35.000 UTC,406,25274274,0xf2c38dE50A250C0060fB45eBE4504B67f6F1be3C
0x8fd1b615c006ebeb8a7cfb00a1dd809f31943b08,0x82c48d96fd0483c8a5571c8a116b8f56bba2b90c979f4e09d51ff5e56a397f59,21-12-2024,2024-12-21 03:29:09.000 UTC,232,23981201,0xCFede447ca3b4885720B5a327e3BFb02078f06e8
0xdc98dbffcc648d6088a2ff8f7dc01aef050e58fc,0x926798f7748c36d3f8495f53ca02b16fe6b1f34dd44ff77ba3ccb728c23558d1,23-12-2024,2024-12-23 18:16:41.000 UTC,414,24094227,0xBDA319Bc7Cc8F0829df39eC0FFF5D1E061FFadf7
0x9eb86e93a809a41ab0e7cc0ba6f62561fda3015c,0x652499dd7e75b129adad9a73e29f7a1c63f9b7ea374e2d4f81af26f6698082c2,17-12-2024,2024-12-17 15:11:17.000 UTC,505,23829465,0xCFede447ca3b4885720B5a327e3BFb02078f06e8
0x8508fd4238162cb3f3d485f432202af3b40f164e,0x2e14b72fe1ea66e82a29ee16d8c32e6a4f4d15dabf026c3bb574ab8b4963e73d,01-06-2025,2025-06-01 04:33:47.000 UTC,369,30981540,0xc3f97660D0b47F0E05C3c513f73eeff7c1bd6c7a
0x8fd1b615c006ebeb8a7cfb00a1dd809f31943b08,0xc59492f0de7c02e1fa758848a441139525c9a8c6f6d2864ad6fb04091b867f1b,09-02-2025,2025-02-09 01:32:33.000 UTC,395,26137703,0xF33a96b5932D9E9B9A0eDA447AbD8C9d48d2e0c8
0xdc98dbffcc648d6088a2ff8f7dc01aef050e58fc,0xadcdb875bf8758a7e80a49e05b96f4150a628b789902e5c96ad018d5e60a9df3,04-07-2025,2025-07-04 15:01:35.000 UTC,260,32425974,0xc3f97660D0b47F0E05C3c513f73eeff7c1bd6c7a
0x9eb86e93a809a41ab0e7cc0ba6f62561fda3015c,0xa93e4d297cdbf171ec28a64346424e3da9a9d8e051be25d11081d68d155c038c,06-01-2025,2025-01-06 14:12:35.000 UTC,467,24691704,0xBDA319Bc7Cc8F0829df39eC0FFF5D1E061FFadf7
0x38f6d2d9ea493c3c6ee865b5b952b5fe9e3e61fc,0xf2621a8854b7effa2ea4b4292b83276fb8b46d89f5d643a57b68a4b26d8630af,05-01-2025,2025-01-05 16:48:49.000 UTC,438,24653191,0xB9E4E0368A9F281584C9adB685e6C9F4b9F37dBb
0x8508fd4238162cb3f3d485f432202af3b40f164e,0xda63c9faff3955291db80377e51eba0554d5a64c2c6db4e8870a70a9f97dae2b,13-04-2025,2025-04-13 22:03:17.000 UTC,990,28896225,0x869305781fff479f0311974d55FeeB6Fc9DE96a2
0x9eb86e93a809a41ab0e7cc0ba6f62561fda3015c,0x0eec41f5cdbe13ba04412f249c7ff4904552e93b95df6b25ed95bcd1f3720b27,07-01-2025,2025-01-07 19:27:41.000 UTC,220,24744357,0xC23924a846eca931Ec3014253E94f15b038bd0C8
0x8fd1b615c006ebeb8a7cfb00a1dd809f31943b08,0x4e6990ee2dea855dd9f9f44fa4f0499b858856800ecc4c88f9647fdcfb9ee232,18-02-2025,2025-02-18 04:50:01.000 UTC,282,26532427,0xf2c38dE50A250C0060fB45eBE4504B67f6F1be3C
0xdc98dbffcc648d6088a2ff8f7dc01aef050e58fc,0x32b7ef705ee2b0d4c2e863e0e2b320fd6f99674092242797733be297ba3b836e,10-07-2025,2025-07-10 00:31:01.000 UTC,777,32659057,0xCFede447ca3b4885720B5a327e3BFb02078f06e8
0x9eb86e93a809a41ab0e7cc0ba6f62561fda3015c,0x0c7d5badebbe514f50629f5b7ec4356d6d9713a931d2d2e70a1fdcb77ec2b380,08-01-2025,2025-01-08 19:36:49.000 UTC,274,24787831,0xBDA319Bc7Cc8F0829df39eC0FFF5D1E061FFadf7
0x095d0de0ecfd6832f1a7961ae26d285d68655d60,0x8288927901f6ec4ccafb1924ce98223fcf826aea99dd045fea30fabef2bc0fea,26-04-2025,2025-04-26 03:35:43.000 UTC,187,29424598,0x869305781fff479f0311974d55FeeB6Fc9DE96a2
0x9eb86e93a809a41ab0e7cc0ba6f62561fda3015c,0xe641407efdc37001c944fda949d508a042d71a21888dc6a2b074b93d58921965,02-03-2025,2025-03-02 07:10:19.000 UTC,662,27055036,0x6399ed6725cC163D019aA64FF55b22149D7179A8
0xdc98dbffcc648d6088a2ff8f7dc01aef050e58fc,0xe2e79cd3e275a9165e532143c75560f4a06a097cd934228787113100eb5ced7e,29-05-2025,2025-05-29 02:25:41.000 UTC,159,30848097,0xCFede447ca3b4885720B5a327e3BFb02078f06e8
0x38f6d2d9ea493c3c6ee865b5b952b5fe9e3e61fc,0xe27c1adf231df39f622d33ad4680cf80c3cf6de46db3c9fa25fa9fa17959c58f,19-02-2025,2025-02-19 03:31:31.000 UTC,136,26573272,0xB9E4E0368A9F281584C9adB685e6C9F4b9F37dBb
0xdc98dbffcc648d6088a2ff8f7dc01aef050e58fc,0x3a1c311942edd81a72cd98ee809e27393fd733380fd9ac2ac37c48ba9db5e8ef,25-05-2025,2025-05-25 21:31:49.000 UTC,930,30709681,0xc3f97660D0b47F0E05C3c513f73eeff7c1bd6c7a
0x38f6d2d9ea493c3c6ee865b5b952b5fe9e3e61fc,0xa03cc8207faeec025cf10d404ce0723b4d992dea3fc64af02c13259a1919d207,14-01-2025,2025-01-14 13:37:33.000 UTC,447,25036253,0x869305781fff479f0311974d55FeeB6Fc9DE96a2
0x2791dc5e14f7680d9d969acc26059ba56403b6d5,0xb2105f9c9444e668d4739f8695025efc0276d784228d0e964c5f8b84740d9431,08-01-2025,2025-01-08 20:43:11.000 UTC,367,24789822,0xBDA319Bc7Cc8F0829df39eC0FFF5D1E061FFadf7
0x8fd1b615c006ebeb8a7cfb00a1dd809f31943b08,0x4da7f2dd9c59c7d671c8b8df009706485a8d8938bba4b947e41274c3abfd46dd,18-12-2024,2024-12-18 13:27:15.000 UTC,342,23869544,0xCFede447ca3b4885720B5a327e3BFb02078f06e8
0x2791dc5e14f7680d9d969acc26059ba56403b6d5,0x966c7e775878b57cc05b13e0c4dd950aa7675f437914dd1007f09edd15781e9b,26-12-2024,2024-12-26 18:01:57.000 UTC,336,24223385,0xBDA319Bc7Cc8F0829df39eC0FFF5D1E061FFadf7
0x9eb86e93a809a41ab0e7cc0ba6f62561fda3015c,0x8ff0a3557f2c4300239cd491ca6ac1f78856f58b0b6aad00b41d9d6c07b4830b,03-01-2025,2025-01-03 12:11:29.000 UTC,373,24558471,0xC23924a846eca931Ec3014253E94f15b038bd0C8
0x8fd1b615c006ebeb8a7cfb00a1dd809f31943b08,0x8a13234329b01b8fbf79bbf4f9bb03cca6a1d0af0371c754e3cad7c6fac3d3ab,23-12-2024,2024-12-23 08:07:13.000 UTC,1519,24075943,0xBDA319Bc7Cc8F0829df39eC0FFF5D1E061FFadf7
0xdc98dbffcc648d6088a2ff8f7dc01aef050e58fc,0x48ce1ed19bec8d06f27203b5c17d0b953b1a555a2baf2a2d2231d6bf2bccfde2,20-12-2024,2024-12-20 23:50:55.000 UTC,282,23974654,0xBDA319Bc7Cc8F0829df39eC0FFF5D1E061FFadf7
0x9eb86e93a809a41ab0e7cc0ba6f62561fda3015c,0x985054a65ddbe6a2478501aa5b260c1768340724fc2adfd09dfd3e1ffd0ccc58,23-05-2025,2025-05-23 08:56:23.000 UTC,219,30600618,0xc3f97660D0b47F0E05C3c513f73eeff7c1bd6c7a
0x9eb86e93a809a41ab0e7cc0ba6f62561fda3015c,0x9b25db6cd1e7eef0da2ca7725f848274cdbb60f798a36f86615ecfeeeaa3245a,09-12-2024,2024-12-09 20:08:55.000 UTC,574,23492794,0x6399ed6725cC163D019aA64FF55b22149D7179A8
0x2791dc5e14f7680d9d969acc26059ba56403b6d5,0x3c65f56f5b822060a893a2373d727284e5e01764dbd4a6f74324865ccdae575e,14-01-2025,2025-01-14 10:25:49.000 UTC,258,25030501,0x869305781fff479f0311974d55FeeB6Fc9DE96a2
0x9eb86e93a809a41ab0e7cc0ba6f62561fda3015c,0x9768286f6772f0a36137bef98acf3c612afe3b04da622b6eab0cff74cbb291d7,02-01-2025,2025-01-02 16:41:21.000 UTC,261,24523367,0xBDA319Bc7Cc8F0829df39eC0FFF5D1E061FFadf7
0x8508fd4238162cb3f3d485f432202af3b40f164e,0x11b7907bad51b81b5f64d623ac3e4832e592414c8d4486e2f7b25399fbcdfa8b,18-04-2025,2025-04-18 15:31:59.000 UTC,403,29100486,0x2B74B62c564456C48055bd515A62594742b3f545
0x8fd1b615c006ebeb8a7cfb00a1dd809f31943b08,0x47a2df0362d4f2a92f6f5fb8e4ecceefac9dadbe415faba553fc7dd22cf3279e,18-07-2025,2025-07-18 04:34:11.000 UTC,385,33011952,0xCFede447ca3b4885720B5a327e3BFb02078f06e8
0x095d0de0ecfd6832f1a7961ae26d285d68655d60,0x6deb8152d2c24a526e4bd8923800d68421dffdf3f9c52eff8da806f0dc0e02e7,06-02-2025,2025-02-06 07:06:15.000 UTC,451,26018114,0x0e956C897bBFCbd2155D3DfdD27c87fa5A0FaD39
0x8508fd4238162cb3f3d485f432202af3b40f164e,0x0bbb697de254197d35ff393b63409d5af5bdf3dbaace6baeb0e5164fff574502,24-05-2025,2025-05-24 18:29:09.000 UTC,1164,30661001,0xc3f97660D0b47F0E05C3c513f73eeff7c1bd6c7a
0x095d0de0ecfd6832f1a7961ae26d285d68655d60,0x8cd6e358b60a1bb84c486a941daae111782a7d75d5604c409b6eb0105de996e5,08-05-2025,2025-05-08 00:44:05.000 UTC,602,29937849,0x869305781fff479f0311974d55FeeB6Fc9DE96a2
0x2791dc5e14f7680d9d969acc26059ba56403b6d5,0x04486161570d339ce16280f65b4a7c3e5549d0506d20eb36f052dbf57d26de27,13-01-2025,2025-01-13 03:43:49.000 UTC,280,24975241,0xBDA319Bc7Cc8F0829df39eC0FFF5D1E061FFadf7
0x2791dc5e14f7680d9d969acc26059ba56403b6d5,0x2b1df779d18c176cb1fb97be7488abe646b1f74433087aad29cd3824b8e93ddc,28-12-2024,2024-12-28 04:53:45.000 UTC,334,24286139,0xBDA319Bc7Cc8F0829df39eC0FFF5D1E061FFadf7
0x8fd1b615c006ebeb8a7cfb00a1dd809f31943b08,0xdf744be8386e2da77297f77e7cc1b7f317f48569e55be7d31bc661dff096c636,04-01-2025,2025-01-04 14:29:55.000 UTC,440,24605824,0xB9E4E0368A9F281584C9adB685e6C9F4b9F37dBb
0xdc98dbffcc648d6088a2ff8f7dc01aef050e58fc,0x903fe95816640c1dd28fc44fb278df84883d2809798c05b72b2b39ccd63ce539,18-06-2025,2025-06-18 21:51:39.000 UTC,553,31747076,0x430C09546ae9249AB75B9A4ef7B5FD9a4006D6f3
0x351f61e4c49cf11f24d9f2e737ca5eff81806355,0xcb782a6119776e3cabee2d65e0c376a6bd093a5c7c4faded75deaa96408c8b3c,14-08-2025,2025-08-14 00:25:43.000 UTC,356,34170898,0x0e956C897bBFCbd2155D3DfdD27c87fa5A0FaD39
0x2791dc5e14f7680d9d969acc26059ba56403b6d5,0x7ed877ff1b125448cb7862520573d5861f183ad5a185d025b813d41601aff9be,16-12-2024,2024-12-16 18:45:23.000 UTC,355,23792688,0xBDA319Bc7Cc8F0829df39eC0FFF5D1E061FFadf7
0x095d0de0ecfd6832f1a7961ae26d285d68655d60,0xeeeeb70f50acafacde203933c02efdf315aa451937e3e07cdc7f8b5526ca3ff4,09-04-2025,2025-04-09 20:06:51.000 UTC,265,28719932,0x869305781fff479f0311974d55FeeB6Fc9DE96a2
0x38f6d2d9ea493c3c6ee865b5b952b5fe9e3e61fc,0x745d7807562e756e14f825ccb7f5c6322288356a746c856b42c1976cf9b263d2,29-12-2024,2024-12-29 04:32:55.000 UTC,228,24328714,0xCFede447ca3b4885720B5a327e3BFb02078f06e8
0x38f6d2d9ea493c3c6ee865b5b952b5fe9e3e61fc,0xde0ce427188c11e2c21eef2f8d9d0dfb5989df16d56921d5687824aa5c4985ed,31-12-2024,2024-12-31 03:43:37.000 UTC,344,24413635,0xCFede447ca3b4885720B5a327e3BFb02078f06e8
0x9eb86e93a809a41ab0e7cc0ba6f62561fda3015c,0x17490453e22fd281ffd581b80656b384f7c272c301e206e25b28352a9956d38b,06-02-2025,2025-02-06 07:06:49.000 UTC,347,26018131,0x0e956C897bBFCbd2155D3DfdD27c87fa5A0FaD39
0x38f6d2d9ea493c3c6ee865b5b952b5fe9e3e61fc,0x701d9a9857fb1119a293275486d5dbfd0a2b389698a28e1718d298c2eb1290b4,08-01-2025,2025-01-08 03:23:47.000 UTC,373,24758640,0xBDA319Bc7Cc8F0829df39eC0FFF5D1E061FFadf7
0x8508fd4238162cb3f3d485f432202af3b40f164e,0xe399ab7b0a3bada4b50e45596c2d35af14fd666e9d6b1ae9e243b5a77537f5bb,08-06-2025,2025-06-08 22:33:15.000 UTC,694,31316324,0xc3f97660D0b47F0E05C3c513f73eeff7c1bd6c7a
0x8508fd4238162cb3f3d485f432202af3b40f164e,0x5a3b7e2a2620379589b809f82c9ed0200d7efce821d539524bf7f898967f9a50,11-05-2025,2025-05-11 03:06:41.000 UTC,637,30071727,0x869305781fff479f0311974d55FeeB6Fc9DE96a2
0x2791dc5e14f7680d9d969acc26059ba56403b6d5,0x0f50ba04ca41fb94157c27cb671e57ca5f2e43eb72c62baa337adbcbc145eaa2,13-07-2025,2025-07-13 19:43:03.000 UTC,1435,32823218,0xf2c38dE50A250C0060fB45eBE4504B67f6F1be3C
0x2791dc5e14f7680d9d969acc26059ba56403b6d5,0x0415a7e70c56ff85c0be210623697a8fb4acf4512a83e5b49e212ec0f489a567,05-01-2025,2025-01-05 10:38:35.000 UTC,375,24642084,0xBDA319Bc7Cc8F0829df39eC0FFF5D1E061FFadf7
0x2791dc5e14f7680d9d969acc26059ba56403b6d5,0x1ee9f62221d028ecab4e31ffd0fbf5f99407e01e3a20e669bdf31a79a6abe69c,07-01-2025,2025-01-07 04:23:15.000 UTC,392,24717224,0xBDA319Bc7Cc8F0829df39eC0FFF5D1E061FFadf7
0x9eb86e93a809a41ab0e7cc0ba6f62561fda3015c,0x06fe9af895023a061ec45b9d3095cdd74267ad36295bee2d41f5085a779904a5,13-12-2024,2024-12-13 06:02:23.000 UTC,3468,23640198,0xCFede447ca3b4885720B5a327e3BFb02078f06e8
0x2791dc5e14f7680d9d969acc26059ba56403b6d5,0xd2b411bec4d14587efb1507ad3433c7b86382b83c54a33406fdddd607a093eb9,14-01-2025,2025-01-14 04:22:13.000 UTC,261,25019593,0xBDA319Bc7Cc8F0829df39eC0FFF5D1E061FFadf7
0xdc98dbffcc648d6088a2ff8f7dc01aef050e58fc,0xc4de913276438d32098a5ab304fcfe286e88af4d3c5381a03bafb026630a49ba,31-12-2024,2024-12-31 10:54:55.000 UTC,234,24426574,0xCFede447ca3b4885720B5a327e3BFb02078f06e8
0x095d0de0ecfd6832f1a7961ae26d285d68655d60,0x6e719f74bb4442230f70580aeb01dbc67bd80b120c00e9e3a1980af45a34bd59,13-03-2025,2025-03-13 17:27:41.000 UTC,430,27548757,0x0e956C897bBFCbd2155D3DfdD27c87fa5A0FaD39
0x2791dc5e14f7680d9d969acc26059ba56403b6d5,0x869a68be69036e4964d360b935a46a350fb355b2fa715ca7a41c28650cb3fd85,09-01-2025,2025-01-09 09:24:59.000 UTC,310,24812676,0xBDA319Bc7Cc8F0829df39eC0FFF5D1E061FFadf7
0x2791dc5e14f7680d9d969acc26059ba56403b6d5,0x9f93ce0f5cd901ef13a1c13ba690e79f2f47a7adbe06f7272fe96848d698519e,10-01-2025,2025-01-10 07:30:29.000 UTC,295,24852441,0xBDA319Bc7Cc8F0829df39eC0FFF5D1E061FFadf7
0xdc98dbffcc648d6088a2ff8f7dc01aef050e58fc,0xdc4a864510d0871da48d501691ebb12f6021520b53445ac9860d0d26abfc7153,02-01-2025,2025-01-02 10:21:47.000 UTC,259,24511980,0x869305781fff479f0311974d55FeeB6Fc9DE96a2
0x095d0de0ecfd6832f1a7961ae26d285d68655d60,0x17d95f8ebf0aa6e5d1a2e09557518128c25b17814ed593b462372313b8ae9a69,13-05-2025,2025-05-13 06:05:53.000 UTC,59,30163503,0x0e956C897bBFCbd2155D3DfdD27c87fa5A0FaD39
0x8fd1b615c006ebeb8a7cfb00a1dd809f31943b08,0x7905425a946b85027358af095d3887b48300480e60b8eaac1d89859e8d629298,28-12-2024,2024-12-28 01:48:17.000 UTC,291,24280575,0xBDA319Bc7Cc8F0829df39eC0FFF5D1E061FFadf7
0xdc98dbffcc648d6088a2ff8f7dc01aef050e58fc,0x71324e7fb1162dab10a6c871dc55bc45f533ce354d13be426adebb23dd14cf38,07-04-2025,2025-04-07 14:56:33.000 UTC,317,28624223,0x430C09546ae9249AB75B9A4ef7B5FD9a4006D6f3
0x9eb86e93a809a41ab0e7cc0ba6f62561fda3015c,0x005e899876ba4c58b61f09fc1f3c971cb2514d9c9f1130390b8cc2307a6571da,28-02-2025,2025-02-28 17:58:15.000 UTC,277,26988074,0x6399ed6725cC163D019aA64FF55b22149D7179A8
0xdc98dbffcc648d6088a2ff8f7dc01aef050e58fc,0x7e985b2b37dbd82864ce1c5fbec8bb2c639971b8b13b14994221b795bb377dc1,30-05-2025,2025-05-30 12:42:39.000 UTC,491,30909806,0xc3f97660D0b47F0E05C3c513f73eeff7c1bd6c7a
0x38f6d2d9ea493c3c6ee865b5b952b5fe9e3e61fc,0x4ea961b4ecf093e815e5c52d075669d426e7a470813b6a0b320785fe81b4bdf5,08-01-2025,2025-01-08 07:18:25.000 UTC,270,24765679,0xBDA319Bc7Cc8F0829df39eC0FFF5D1E061FFadf7
0x8508fd4238162cb3f3d485f432202af3b40f164e,0x8fe13b5d52b4374cc55370a17ec3ac22f3fa747741e031881d17e5202b5bf6bc,20-05-2025,2025-05-20 03:14:59.000 UTC,235,30460776,0x6205DfbE68444cFF504A20a712cEa794c6b6Cf04
0x8fd1b615c006ebeb8a7cfb00a1dd809f31943b08,0x8c6da145de2f200d37be6e80cc1ce19037c3441b3a20f86ac88b55db7b1a1f9f,26-12-2024,2024-12-26 14:23:23.000 UTC,220,24216828,0xBDA319Bc7Cc8F0829df39eC0FFF5D1E061FFadf7
0xdc98dbffcc648d6088a2ff8f7dc01aef050e58fc,0x00a40734f18050506c83d6848b92c4d8da9a7b86bebc58f576d93cb007a6ffb9,07-01-2025,2025-01-07 06:28:59.000 UTC,958,24720996,0xBDA319Bc7Cc8F0829df39eC0FFF5D1E061FFadf7
0x2791dc5e14f7680d9d969acc26059ba56403b6d5,0xbe152374925d3b28ded8f60694c2e05ce64d26981c80afd79936518c3de616e0,14-01-2025,2025-01-14 10:43:41.000 UTC,265,25031037,0x0e956C897bBFCbd2155D3DfdD27c87fa5A0FaD39
0x9eb86e93a809a41ab0e7cc0ba6f62561fda3015c,0xf8755bc924e6f77877becde5c9614a3722a4dba27fde872a79faa7f1e8d1f333,06-06-2025,2025-06-06 08:52:55.000 UTC,608,31205314,0xc3f97660D0b47F0E05C3c513f73eeff7c1bd6c7a
0xdc98dbffcc648d6088a2ff8f7dc01aef050e58fc,0x079a822ebe8aadf0f2f823db3f117f71c730e5f43ffb306a154025936a7fb975,12-01-2025,2025-01-12 07:13:47.000 UTC,289,24938340,0x0e956C897bBFCbd2155D3DfdD27c87fa5A0FaD39
0x095d0de0ecfd6832f1a7961ae26d285d68655d60,0xc24c1e7499d2d38bff9daebff557bccae64526dc125c24f3c7afd58c8c3224ba,13-03-2025,2025-03-13 12:36:17.000 UTC,275,27540015,0x869305781fff479f0311974d55FeeB6Fc9DE96a2
0x9eb86e93a809a41ab0e7cc0ba6f62561fda3015c,0xa73b47f6502fc1ddb8affa664035d0685430a8c8d862f5b1537c1e7b23842570,02-06-2025,2025-06-02 11:53:11.000 UTC,307,31037922,0xc3f97660D0b47F0E05C3c513f73eeff7c1bd6c7a
0x8fd1b615c006ebeb8a7cfb00a1dd809f31943b08,0x47948f06701e5619dad63cbfbaab40cfb494b585604cd219fe7eddd18dc7fc5e,24-12-2024,2024-12-24 06:36:49.000 UTC,188,24116431,0xBDA319Bc7Cc8F0829df39eC0FFF5D1E061FFadf7
0x2791dc5e14f7680d9d969acc26059ba56403b6d5,0x74dd9dba023062378147a51f9f5c1c89efb6c1b6475f0c68ad86c4507e61e9b2,15-12-2024,2024-12-15 06:40:03.000 UTC,510,23727728,0xBDA319Bc7Cc8F0829df39eC0FFF5D1E061FFadf7
0x38f6d2d9ea493c3c6ee865b5b952b5fe9e3e61fc,0x96aec7f8823a8b7be3a4a4c9c25bfa328516d6d34919521f6c53828155957dd1,08-01-2025,2025-01-08 22:42:45.000 UTC,273,24793409,0xBDA319Bc7Cc8F0829df39eC0FFF5D1E061FFadf7
0x2791dc5e14f7680d9d969acc26059ba56403b6d5,0xdbf62d2db1ac3dbafe82c1207db625d2317a9cc8eb0fd7d0e2037545ea97c1d5,16-12-2024,2024-12-16 04:44:17.000 UTC,403,23767455,0xBDA319Bc7Cc8F0829df39eC0FFF5D1E061FFadf7
0x38f6d2d9ea493c3c6ee865b5b952b5fe9e3e61fc,0xd22bc8b0c137c5840994cf29d342fe70db85b258f3c4e53cf8001d81d772207d,01-01-2025,2025-01-01 15:02:53.000 UTC,930,24477213,0x869305781fff479f0311974d55FeeB6Fc9DE96a2
0x2791dc5e14f7680d9d969acc26059ba56403b6d5,0xd561f2d3e7dcd965955edee1041866facbc868dc6455eca603ffadc77400c20c,16-01-2025,2025-01-16 23:26:03.000 UTC,222,25140308,0x869305781fff479f0311974d55FeeB6Fc9DE96a2
0x38f6d2d9ea493c3c6ee865b5b952b5fe9e3e61fc,0xf4dc3c5c1c82ef7e767786ed725597bf3e2bfeceeb3514c68fc72a69b62f23fe,16-01-2025,2025-01-16 23:49:33.000 UTC,378,25141013,0xB9E4E0368A9F281584C9adB685e6C9F4b9F37dBb
0x38f6d2d9ea493c3c6ee865b5b952b5fe9e3e61fc,0xe8f8dbc119631d053d25f41da408dd4b1ab42966deeacb804c1a404b02efb8f6,04-01-2025,2025-01-04 03:34:55.000 UTC,370,24586174,0x869305781fff479f0311974d55FeeB6Fc9DE96a2
0x095d0de0ecfd6832f1a7961ae26d285d68655d60,0x813fa0f24026aaf1ce96c761efa8b99c98f60ac5134144af97672ad2e3b718b5,10-05-2025,2025-05-10 05:23:19.000 UTC,261,30032626,0x0e956C897bBFCbd2155D3DfdD27c87fa5A0FaD39
0x9eb86e93a809a41ab0e7cc0ba6f62561fda3015c,0xcea3ae1b57d9d944b6e0cf7c5c175fc10a16a0759bc1c2b6c088e5e9cbb580fa,01-06-2025,2025-06-01 21:53:57.000 UTC,211,31012745,0xc3f97660D0b47F0E05C3c513f73eeff7c1bd6c7a
0x8fd1b615c006ebeb8a7cfb00a1dd809f31943b08,0xebd361b7125b7d9384f1e68b05b1ddc465786bef675466685d600c8fe987c7d2,11-07-2025,2025-07-11 02:09:21.000 UTC,1732,32705207,0xf2c38dE50A250C0060fB45eBE4504B67f6F1be3C
0x38f6d2d9ea493c3c6ee865b5b952b5fe9e3e61fc,0xf4cc93f6bd71b1485a485930c0f49fba56e806c4c5b319146fcd4add6ed1dec7,10-01-2025,2025-01-10 08:01:21.000 UTC,293,24853367,0x869305781fff479f0311974d55FeeB6Fc9DE96a2
0x38f6d2d9ea493c3c6ee865b5b952b5fe9e3e61fc,0xef3a54574f063c6f5b2ce32cfc35a6d4886c090005b6b1c3ff764fe6caffed2e,04-01-2025,2025-01-04 00:55:05.000 UTC,216,24581379,0xBDA319Bc7Cc8F0829df39eC0FFF5D1E061FFadf7
0x8508fd4238162cb3f3d485f432202af3b40f164e,0x4ba3fa704fdb90ddac0791f8fc0e9a4f07ff76a9e1d787e010fe7c3458b18281,22-05-2025,2025-05-22 22:39:39.000 UTC,683,30582116,0xc3f97660D0b47F0E05C3c513f73eeff7c1bd6c7a
0x8fd1b615c006ebeb8a7cfb00a1dd809f31943b08,0xad5712ea95ce4e0baae2f79e34e9abc4ce4bcbeed5286680ca354acc4e430150,24-12-2024,2024-12-24 03:24:39.000 UTC,1422,24110666,0xBDA319Bc7Cc8F0829df39eC0FFF5D1E061FFadf7
0x9eb86e93a809a41ab0e7cc0ba6f62561fda3015c,0x29accc52b27dd4458a1ba5cf6882ece99ce796991ae8005d6f5a8b092eeba8ac,03-01-2025,2025-01-03 16:30:31.000 UTC,394,24566242,0xBDA319Bc7Cc8F0829df39eC0FFF5D1E061FFadf7
0x9eb86e93a809a41ab0e7cc0ba6f62561fda3015c,0x9f3890b5303a0fca9f67ebb65d869634df522e8687258669240a5d639a26e20b,11-06-2025,2025-06-11 04:37:41.000 UTC,448,31413657,0xc3f97660D0b47F0E05C3c513f73eeff7c1bd6c7a
0x2791dc5e14f7680d9d969acc26059ba56403b6d5,0xd4e1fbf988ce562aac855f01553a11bb7a184b197f99734dd90d1a7e7fecb9e3,14-01-2025,2025-01-14 20:14:35.000 UTC,250,25048164,0x869305781fff479f0311974d55FeeB6Fc9DE96a2
0xdc98dbffcc648d6088a2ff8f7dc01aef050e58fc,0xa3f2cc02906530178a7283b5a296733958a1446ca4751136dfdb7b0db5072027,17-01-2025,2025-01-17 21:23:05.000 UTC,380,25179819,0xBDA319Bc7Cc8F0829df39eC0FFF5D1E061FFadf7
0x38f6d2d9ea493c3c6ee865b5b952b5fe9e3e61fc,0x49c6bd3cdb649e59cc7794791fc33228ce16682b6effeab49d1fa2505003e734,03-01-2025,2025-01-03 22:48:59.000 UTC,260,24577596,0xBDA319Bc7Cc8F0829df39eC0FFF5D1E061FFadf7
0x8fd1b615c006ebeb8a7cfb00a1dd809f31943b08,0x99a759318f3340ed9212eccabf2894d0e7f7ffdeb137ab2b9fe4e14e9f6b1ace,12-12-2024,2024-12-12 05:38:01.000 UTC,264,23596267,0xBDA319Bc7Cc8F0829df39eC0FFF5D1E061FFadf7
0x2791dc5e14f7680d9d969acc26059ba56403b6d5,0xebb971119bf140b84d9d66ba685a089cd88e286bb595a904418fa533b316cd70,12-12-2024,2024-12-12 07:40:43.000 UTC,328,23599948,0xBDA319Bc7Cc8F0829df39eC0FFF5D1E061FFadf7
0x9eb86e93a809a41ab0e7cc0ba6f62561fda3015c,0x0a4679d12150ab40a9a18ca4361c728ab9bf0be7d6c84ba08bc4edfb31dc892c,01-01-2025,2025-01-01 14:40:27.000 UTC,130,24476540,0xBDA319Bc7Cc8F0829df39eC0FFF5D1E061FFadf7
0x2791dc5e14f7680d9d969acc26059ba56403b6d5,0xec7723bee346c6e4364fce7fff793b2cb30cbe03b70251b9a71d5e4d12b74005,15-12-2024,2024-12-15 09:03:19.000 UTC,156,23732026,0xBDA319Bc7Cc8F0829df39eC0FFF5D1E061FFadf7
0x8fd1b615c006ebeb8a7cfb00a1dd809f31943b08,0x5f03b085644741a709b4546d33218d901ab25e09e16aac437ca806bc605070d6,04-01-2025,2025-01-04 08:52:37.000 UTC,373,24595705,0xBDA319Bc7Cc8F0829df39eC0FFF5D1E061FFadf7
0x8fd1b615c006ebeb8a7cfb00a1dd809f31943b08,0xfaae4a8ec686c41dbc47f218fcf51d40ea15485189df4c121d63cd800fc5421e,18-12-2024,2024-12-18 19:42:43.000 UTC,452,23880808,0xBDA319Bc7Cc8F0829df39eC0FFF5D1E061FFadf7
0xdc98dbffcc648d6088a2ff8f7dc01aef050e58fc,0x460766de602d3d1c0e963422cbd26abe080aefb6fcf31533cf8f96be5234284e,03-01-2025,2025-01-03 22:45:39.000 UTC,320,24577496,0xB9E4E0368A9F281584C9adB685e6C9F4b9F37dBb
0x2791dc5e14f7680d9d969acc26059ba56403b6d5,0x81120f2840067cda85ead15dcdd09e7d7becad0c51c55f8a6f4c89a75eead3dc,13-01-2025,2025-01-13 11:51:31.000 UTC,327,24989872,0x869305781fff479f0311974d55FeeB6Fc9DE96a2
0x8fd1b615c006ebeb8a7cfb00a1dd809f31943b08,0x6a07775d3263b911d4193fa3bba5c49f8dc1fb42c1736c1f7c2b15756d6cbd9d,24-12-2024,2024-12-24 05:00:27.000 UTC,1151,24113540,0xBDA319Bc7Cc8F0829df39eC0FFF5D1E061FFadf7
0x38f6d2d9ea493c3c6ee865b5b952b5fe9e3e61fc,0xe1a2c09812b706cba5bb5c063872a653126c0dde62bdaf01c2f3b942b456a5d4,28-12-2024,2024-12-28 04:06:47.000 UTC,246,24284730,0xCFede447ca3b4885720B5a327e3BFb02078f06e8
0x2791dc5e14f7680d9d969acc26059ba56403b6d5,0x9ba2e669e0918e0f45ab17f94b23984e9eb28a5ce77393cfe8a14ea965f89ce0,04-01-2025,2025-01-04 04:29:47.000 UTC,538,24587820,0xBDA319Bc7Cc8F0829df39eC0FFF5D1E061FFadf7
0x8810de2baa17067ddcfbd9e8f29c55f070a55f0b,0x8052ee2626d558f572de72af78ff6bd3a2be496e1c22d34f7d686fde7aa297af,11-05-2025,2025-05-11 06:59:41.000 UTC,398,30078717,0x0e956C897bBFCbd2155D3DfdD27c87fa5A0FaD39
0xdc98dbffcc648d6088a2ff8f7dc01aef050e58fc,0xb22cfe2ff85bc25df9443628eb48f674ffe6db7dddebc458800c3f08b1b64755,16-04-2025,2025-04-16 13:36:01.000 UTC,219,29010607,0x430C09546ae9249AB75B9A4ef7B5FD9a4006D6f3
0x8508fd4238162cb3f3d485f432202af3b40f164e,0x95f141fdd7be37e235179f1bb02bdaceb5abcf9eb43612567667c50b5c2f1b4d,29-05-2025,2025-05-29 07:41:55.000 UTC,760,30857584,0xc3f97660D0b47F0E05C3c513f73eeff7c1bd6c7a
0x9eb86e93a809a41ab0e7cc0ba6f62561fda3015c,0x0d5f4e5d3fcbdc15911adea46fccc4cd7c6dac8991d1393a90ef2bcb44a08221,03-06-2025,2025-06-03 03:46:09.000 UTC,734,31066511,0xc3f97660D0b47F0E05C3c513f73eeff7c1bd6c7a
0x2791dc5e14f7680d9d969acc26059ba56403b6d5,0xe3f9da7caf4b903ff0afba407561bfe36d150e506fb3ee83d5494cb5227b111d,16-12-2024,2024-12-16 14:54:53.000 UTC,1094,23785773,0xBDA319Bc7Cc8F0829df39eC0FFF5D1E061FFadf7
0x2791dc5e14f7680d9d969acc26059ba56403b6d5,0x507f81442161f2b41f995a6469f5dd8d5ea447aad26eba5d9e584a692888d066,06-01-2025,2025-01-06 21:47:17.000 UTC,273,24705345,0x869305781fff479f0311974d55FeeB6Fc9DE96a2
0x38f6d2d9ea493c3c6ee865b5b952b5fe9e3e61fc,0xd482a24f3e65ab2e47dd5a5a867b8d188f5a50f320c67b98ac3977e3e28c3906,21-05-2025,2025-05-21 15:11:13.000 UTC,382,30525463,0xc3f97660D0b47F0E05C3c513f73eeff7c1bd6c7a
0x8508fd4238162cb3f3d485f432202af3b40f164e,0x63aa8fc1af49e4225c236c01cc249f1fca19a171ce04fc70a06d3e469c096a30,17-05-2025,2025-05-17 10:19:31.000 UTC,549,30343912,0x6205DfbE68444cFF504A20a712cEa794c6b6Cf04
0x9eb86e93a809a41ab0e7cc0ba6f62561fda3015c,0xffc25cd700ed79e1e271d8b2bd0601e658afd8c413cf2c5952d98d3a209eb515,06-01-2025,2025-01-06 22:31:59.000 UTC,403,24706686,0x869305781fff479f0311974d55FeeB6Fc9DE96a2
0xdc98dbffcc648d6088a2ff8f7dc01aef050e58fc,0xe63bfbf7ac19c68b78639e8e7ee3e36a10326d4d2f03b11fed7f3e7cb8cbb646,08-01-2025,2025-01-08 11:35:17.000 UTC,468,24773385,0xB9E4E0368A9F281584C9adB685e6C9F4b9F37dBb
0x2791dc5e14f7680d9d969acc26059ba56403b6d5,0x8d8788ec3b697990ceb72d40150cf194d6c9cfe1e7c77c0122f9c7590db748c4,02-01-2025,2025-01-02 11:09:35.000 UTC,436,24513414,0xBDA319Bc7Cc8F0829df39eC0FFF5D1E061FFadf7
0x9eb86e93a809a41ab0e7cc0ba6f62561fda3015c,0xd0264a149d8beac1c77422226d07aee25e539a4bdd1a2ce2fab920173b95d791,27-02-2025,2025-02-27 03:23:07.000 UTC,120,26918620,0x6399ed6725cC163D019aA64FF55b22149D7179A8
0x38f6d2d9ea493c3c6ee865b5b952b5fe9e3e61fc,0x94af359a02e80d9e39abf10740e885786b7cb5e55c6460f1f2da73e4e9349d63,05-06-2025,2025-06-05 07:41:19.000 UTC,472,31159966,0xc3f97660D0b47F0E05C3c513f73eeff7c1bd6c7a
0x9eb86e93a809a41ab0e7cc0ba6f62561fda3015c,0xb9d8c5862bb0328f3fec81a3166e2c7051bf8ebbac8029f4c4a58282197fb862,08-12-2024,2024-12-08 21:55:41.000 UTC,108,23452797,0xF33a96b5932D9E9B9A0eDA447AbD8C9d48d2e0c8
0x8fd1b615c006ebeb8a7cfb00a1dd809f31943b08,0x8e65417f80a9ca39adfbbc447f23e8f79ac61e9d1765c251eba731740113c45a,11-12-2024,2024-12-11 10:18:25.000 UTC,290,23561479,0xBDA319Bc7Cc8F0829df39eC0FFF5D1E061FFadf7
0x38f6d2d9ea493c3c6ee865b5b952b5fe9e3e61fc,0xfd5017f1ee0ed05f7e3266859cf1a7b4b4768823fb3846e1cbc029b1bd80760b,05-02-2025,2025-02-05 20:06:21.000 UTC,357,25998317,0xB9E4E0368A9F281584C9adB685e6C9F4b9F37dBb
0x9eb86e93a809a41ab0e7cc0ba6f62561fda3015c,0xcb746fd7678a0fa58cdf61ce9f9bb9b82675d732a64ee78c8017b9fb91ba913f,06-01-2025,2025-01-06 16:51:29.000 UTC,451,24696471,0xBDA319Bc7Cc8F0829df39eC0FFF5D1E061FFadf7
0x351f61e4c49cf11f24d9f2e737ca5eff81806355,0xb7f40669af53b05719c73d230bf4435394eb068dbfbb1804731c2d70c20e64e4,20-08-2025,2025-08-20 16:43:39.000 UTC,660,34459436,0x0e956C897bBFCbd2155D3DfdD27c87fa5A0FaD39
0x8fd1b615c006ebeb8a7cfb00a1dd809f31943b08,0x99a8505a71cb42054bb0c2194eee91e0a33d825e3679153bfc6426ecac678f53,18-12-2024,2024-12-18 08:02:55.000 UTC,192,23859814,0xBDA319Bc7Cc8F0829df39eC0FFF5D1E061FFadf7
0x2791dc5e14f7680d9d969acc26059ba56403b6d5,0x759e4482a70be7149856e1112e99e9cb06b0274a438ef4f3c69aa232e3e179f6,15-12-2024,2024-12-15 16:08:55.000 UTC,488,23744794,0xBDA319Bc7Cc8F0829df39eC0FFF5D1E061FFadf7
0x38f6d2d9ea493c3c6ee865b5b952b5fe9e3e61fc,0x198b808458ede80bcf49d60178bd04d02c3395307a5a07620d6dc9aed24eca93,07-01-2025,2025-01-07 21:22:53.000 UTC,284,24747813,0xBDA319Bc7Cc8F0829df39eC0FFF5D1E061FFadf7
0xdc98dbffcc648d6088a2ff8f7dc01aef050e58fc,0xcae99198da2c8ccf8fb561c2b5ba3ac24fcc481fc2e6ec38ab49af72da253f74,29-12-2024,2024-12-29 13:41:57.000 UTC,259,24345185,0x0e956C897bBFCbd2155D3DfdD27c87fa5A0FaD39
0xdc98dbffcc648d6088a2ff8f7dc01aef050e58fc,0xf1519f16621e10a6b744546bacb71cf945a54d9f06761c5ec31747d543c1cbf2,11-01-2025,2025-01-11 12:36:49.000 UTC,130,24904831,0xBDA319Bc7Cc8F0829df39eC0FFF5D1E061FFadf7
0x38f6d2d9ea493c3c6ee865b5b952b5fe9e3e61fc,0xf77365f1fd053869bccfb72f1d05eae1a08124f3196c6a3264a8c092bc4efc0d,03-03-2025,2025-03-03 21:05:09.000 UTC,393,27123281,0x0e956C897bBFCbd2155D3DfdD27c87fa5A0FaD39
0x8fd1b615c006ebeb8a7cfb00a1dd809f31943b08,0x21b83331aa782161e3c9c0b0a350ae3c3628940a6934264b5d9e9eb585ce2ef2,23-12-2024,2024-12-23 13:20:45.000 UTC,642,24085349,0xCFede447ca3b4885720B5a327e3BFb02078f06e8
0x9eb86e93a809a41ab0e7cc0ba6f62561fda3015c,0x7c1219d29d9a60bb7e8656a10b5871495a1be417400910fb1a450bad5e4c9c45,15-05-2025,2025-05-15 17:16:37.000 UTC,389,30270025,0xc3f97660D0b47F0E05C3c513f73eeff7c1bd6c7a
0x095d0de0ecfd6832f1a7961ae26d285d68655d60,0x0becd1a161d03d92569cf68cabf0c55511c0b826d5709984316be040f043b374,24-02-2025,2025-02-24 19:55:27.000 UTC,219,26818790,0x0e956C897bBFCbd2155D3DfdD27c87fa5A0FaD39
0xdc98dbffcc648d6088a2ff8f7dc01aef050e58fc,0x032e528e4f4f1fe9785cbd3ec78698ca3554010cd8cfc7bcc0140fd126cb16c8,29-05-2025,2025-05-29 11:37:31.000 UTC,345,30864652,0xc3f97660D0b47F0E05C3c513f73eeff7c1bd6c7a
0x8fd1b615c006ebeb8a7cfb00a1dd809f31943b08,0x4c59d6149610bf8d99b9f7afbd1988976a1f75366832b32ea0aa6638e68e1676,28-06-2025,2025-06-28 19:10:15.000 UTC,416,32174234,0xCFede447ca3b4885720B5a327e3BFb02078f06e8
0x38f6d2d9ea493c3c6ee865b5b952b5fe9e3e61fc,0x25837b97f243a261334a597dae76e8e2e33f2b032d6032962981a789c5723db8,19-05-2025,2025-05-19 05:38:39.000 UTC,371,30421886,0xf2c38dE50A250C0060fB45eBE4504B67f6F1be3C
0x38f6d2d9ea493c3c6ee865b5b952b5fe9e3e61fc,0xd1a0e93f9a46ad8e5f8845ecb03e86917624f56bde7c362d895cdf21efe069db,03-06-2025,2025-06-03 13:09:23.000 UTC,842,31083408,0xc3f97660D0b47F0E05C3c513f73eeff7c1bd6c7a
0x9eb86e93a809a41ab0e7cc0ba6f62561fda3015c,0x1303a725431ed2cd86346ca9bbf7f4d22e8dc3136e65db0b4127d10e5f624433,19-02-2025,2025-02-19 01:55:33.000 UTC,178,26570393,0x6399ed6725cC163D019aA64FF55b22149D7179A8
0x2791dc5e14f7680d9d969acc26059ba56403b6d5,0xca633d7134ce8837b46dde16792ad963c85d32cd8c4381b9c6e0318b5e4c0c75,20-01-2025,2025-01-20 00:37:11.000 UTC,396,25272042,0xB9E4E0368A9F281584C9adB685e6C9F4b9F37dBb
0x8508fd4238162cb3f3d485f432202af3b40f164e,0xb8daf308ab0b6c6c4df213d09ccc2ce1ad7f2326a81cd482d85300fd0cc25d5d,15-05-2025,2025-05-15 23:16:07.000 UTC,142,30280810,0x6205DfbE68444cFF504A20a712cEa794c6b6Cf04
0x9eb86e93a809a41ab0e7cc0ba6f62561fda3015c,0x52aaf5b53ca1a0fb1d3340f59ced9e488243084bbe116eabf4b6aad325c0354f,13-12-2024,2024-12-13 12:33:27.000 UTC,545,23651930,0xBDA319Bc7Cc8F0829df39eC0FFF5D1E061FFadf7
0x351f61e4c49cf11f24d9f2e737ca5eff81806355,0x94f15ab16c524a9676ca35c82b7a8c7589e67d98a76ed4c28fa389b2a9816a54,28-08-2025,2025-08-28 10:13:45.000 UTC,95,34793339,0x0e956C897bBFCbd2155D3DfdD27c87fa5A0FaD39
0x9eb86e93a809a41ab0e7cc0ba6f62561fda3015c,0x83e06bf972a0bcd7837e689fa6f39aa0654979440e858fed6223e9bc06219ef1,05-03-2025,2025-03-05 01:55:51.000 UTC,313,27175202,0x6399ed6725cC163D019aA64FF55b22149D7179A8
0x8508fd4238162cb3f3d485f432202af3b40f164e,0x9ec2962f79fba88cb905e91f1181e6bf4db1000e6c2fc9fe10b7e256ef9dd637,09-04-2025,2025-04-09 12:43:01.000 UTC,247,28706617,0x2B74B62c564456C48055bd515A62594742b3f545
0x9eb86e93a809a41ab0e7cc0ba6f62561fda3015c,0xc7970b20e21bdfdd381f22a35e3ee87bf765f6795373709250ed72219b0e272e,22-01-2025,2025-01-22 04:06:03.000 UTC,289,25364708,0x0e956C897bBFCbd2155D3DfdD27c87fa5A0FaD39
0xdc98dbffcc648d6088a2ff8f7dc01aef050e58fc,0xef096f2c063a07891a6f320571dad5768abbbdc65e0d0a2056157d8e18d10597,23-12-2024,2024-12-23 10:01:09.000 UTC,355,24079361,0xCFede447ca3b4885720B5a327e3BFb02078f06e8
0x38f6d2d9ea493c3c6ee865b5b952b5fe9e3e61fc,0xadd70741faec4ed5743f78b8f2906398cd3892e3616d354a063862358bfe3d07,12-07-2025,2025-07-12 01:56:49.000 UTC,1450,32748031,0xCFede447ca3b4885720B5a327e3BFb02078f06e8
0x9eb86e93a809a41ab0e7cc0ba6f62561fda3015c,0x451fc95e94a37b1cc68232818d40400333e7cf33d6092b87057b74b73aa7aa81,14-07-2025,2025-07-14 08:29:43.000 UTC,76,32846218,0xc3f97660D0b47F0E05C3c513f73eeff7c1bd6c7a
0x2791dc5e14f7680d9d969acc26059ba56403b6d5,0x54be3057062ae017f0ba94f14ebe1077646dc0d1275d7490e92db22bc5baac34,14-01-2025,2025-01-14 05:08:17.000 UTC,325,25020975,0xB9E4E0368A9F281584C9adB685e6C9F4b9F37dBb
0x8fd1b615c006ebeb8a7cfb00a1dd809f31943b08,0xa8c2a50146ebcc68ada7dda79f3115dc678340650af38a2d61d336af7ead78ba,10-01-2025,2025-01-10 18:33:21.000 UTC,320,24872327,0xBDA319Bc7Cc8F0829df39eC0FFF5D1E061FFadf7
0x38f6d2d9ea493c3c6ee865b5b952b5fe9e3e61fc,0x1a916f7627f058a9e9b8be66c7f5824fa104bda8706e56c8f38b16c4a9d8a383,15-12-2024,2024-12-15 12:05:27.000 UTC,373,23737490,0xCFede447ca3b4885720B5a327e3BFb02078f06e8
0x9eb86e93a809a41ab0e7cc0ba6f62561fda3015c,0xc18f0fe4c860b2998698967161c19759d27fb030c804ec5ee6700345aeb0756a,06-01-2025,2025-01-06 23:12:51.000 UTC,319,24707912,0xC23924a846eca931Ec3014253E94f15b038bd0C8
0x9eb86e93a809a41ab0e7cc0ba6f62561fda3015c,0xe5f5d68a246c5a7b14b6d46e38bb5e5a2680f6b59233739f4805424c614c9af9,24-02-2025,2025-02-24 15:56:55.000 UTC,293,26811634,0x6399ed6725cC163D019aA64FF55b22149D7179A8
0x095d0de0ecfd6832f1a7961ae26d285d68655d60,0xad58e188f85ade87793fe8c671b7f632843550299795df9dc0d03dfd658a50d5,20-05-2025,2025-05-20 02:28:33.000 UTC,561,30459383,0x869305781fff479f0311974d55FeeB6Fc9DE96a2
0x2791dc5e14f7680d9d969acc26059ba56403b6d5,0x16b727fff0bea6148edec4171071e761bca67a3dfa8bf6cd2c98eb532251fa32,14-01-2025,2025-01-14 22:18:21.000 UTC,850,25051877,0xB9E4E0368A9F281584C9adB685e6C9F4b9F37dBb
0x9eb86e93a809a41ab0e7cc0ba6f62561fda3015c,0xfd372e4955f6f5eeb799a01e13f1acfb9b39a81477176f83a9ceaf5b0997a7f9,27-02-2025,2025-02-27 16:25:27.000 UTC,323,26942090,0x6399ed6725cC163D019aA64FF55b22149D7179A8
0x9eb86e93a809a41ab0e7cc0ba6f62561fda3015c,0x8ea0f9add3a9d8d5f14fc0dfed682cb861c2146e24ac2e38f269506c6693a953,02-01-2025,2025-01-02 12:08:27.000 UTC,348,24515180,0xBDA319Bc7Cc8F0829df39eC0FFF5D1E061FFadf7
0x8fd1b615c006ebeb8a7cfb00a1dd809f31943b08,0xf014c5e3f4981843a700722dd1b2dc0ed0c92afa827a2c68acf36539d85d7b59,12-01-2025,2025-01-12 10:28:45.000 UTC,297,24944189,0xBDA319Bc7Cc8F0829df39eC0FFF5D1E061FFadf7
0x8810de2baa17067ddcfbd9e8f29c55f070a55f0b,0x1e5d9053bce6e2b4c809fd02f3152a68114ac4fa58d32e1484c914cda05f1bd9,28-03-2025,2025-03-28 07:59:31.000 UTC,207,28179712,0x0e956C897bBFCbd2155D3DfdD27c87fa5A0FaD39
0x9eb86e93a809a41ab0e7cc0ba6f62561fda3015c,0x513f3a865aeb0409f6097832e4362f1ddcfb64a65ffc510beb359ffe6a9aae09,22-05-2025,2025-05-22 06:24:31.000 UTC,1103,30552862,0xc3f97660D0b47F0E05C3c513f73eeff7c1bd6c7a
0x9eb86e93a809a41ab0e7cc0ba6f62561fda3015c,0xfaa66cb106fb1694c3b704792c5dd8b7ad03aba28e9909acef70c954dc9ed95f,20-12-2024,2024-12-20 14:15:13.000 UTC,380,23957383,0xBDA319Bc7Cc8F0829df39eC0FFF5D1E061FFadf7
0x8fd1b615c006ebeb8a7cfb00a1dd809f31943b08,0xf147c0b42c4d3f20c08945be9e83b341e724d1919414c36ed2763dd324260724,25-12-2024,2024-12-25 05:18:43.000 UTC,664,24157288,0xCFede447ca3b4885720B5a327e3BFb02078f06e8
0x8508fd4238162cb3f3d485f432202af3b40f164e,0x27bb4461c0531794a8ca1ba217c99b14ddbf1d373339ac6d2d7522cd2fcc1b7e,05-06-2025,2025-06-05 06:26:05.000 UTC,747,31157709,0xc3f97660D0b47F0E05C3c513f73eeff7c1bd6c7a
0x8fd1b615c006ebeb8a7cfb00a1dd809f31943b08,0x5fc53a122522f0ce5d479d4f6929c51a04c733e2a77d02a5ffa4ff97f7b1d0e3,08-12-2024,2024-12-08 19:39:29.000 UTC,127,23448711,0x0e956C897bBFCbd2155D3DfdD27c87fa5A0FaD39
0x2791dc5e14f7680d9d969acc26059ba56403b6d5,0xb744c04efd5001a317dc42abdbe8e74a7abacb5ad000f55af4aa8eef99701e7f,24-12-2024,2024-12-24 00:50:13.000 UTC,455,24106033,0xBDA319Bc7Cc8F0829df39eC0FFF5D1E061FFadf7
0x9eb86e93a809a41ab0e7cc0ba6f62561fda3015c,0x61f743e1ed42170e6116a3d07500518b69539955a7aaa9e326ca5a8d7238a791,04-01-2025,2025-01-04 11:14:51.000 UTC,192,24599972,0xC23924a846eca931Ec3014253E94f15b038bd0C8
0x351f61e4c49cf11f24d9f2e737ca5eff81806355,0x6e13371fb758228f5f6953179fc710f7e1ba32b79d3949280a2b591e00f07162,27-11-2025,2025-11-27 09:54:09.000 UTC,499,38723951,0x0e956C897bBFCbd2155D3DfdD27c87fa5A0FaD39
0x9eb86e93a809a41ab0e7cc0ba6f62561fda3015c,0xb75f95b7909c1a007855137ed7aa0dbd40eb639036624146aa0bd5206d4268db,02-01-2025,2025-01-02 15:35:31.000 UTC,501,24521392,0xBDA319Bc7Cc8F0829df39eC0FFF5D1E061FFadf7
0x9eb86e93a809a41ab0e7cc0ba6f62561fda3015c,0x72947572862d9d1bc4939ff46ab43cd418bc5ab380528d94c6123ab0ec332507,24-12-2024,2024-12-24 08:49:33.000 UTC,473,24120413,0xBDA319Bc7Cc8F0829df39eC0FFF5D1E061FFadf7
0x095d0de0ecfd6832f1a7961ae26d285d68655d60,0x7c28a19ff595ed2fc779dbe781e979e8a985c9855b87a80836f9b0a9a21dc0a9,20-04-2025,2025-04-20 17:10:45.000 UTC,519,29189849,0x869305781fff479f0311974d55FeeB6Fc9DE96a2
0x8fd1b615c006ebeb8a7cfb00a1dd809f31943b08,0xad809a2990ba8e01ff6474a80ff4cca75edf4fd71ebbdbea64e66461d92b43f8,10-12-2024,2024-12-10 23:48:23.000 UTC,314,23542578,0xBDA319Bc7Cc8F0829df39eC0FFF5D1E061FFadf7
0x2791dc5e14f7680d9d969acc26059ba56403b6d5,0x72461a9df98acc1b9c570a3eedae5e216acd68b1afcf995c0d9514c27bb4832f,06-01-2025,2025-01-06 06:16:55.000 UTC,152,24677434,0xBDA319Bc7Cc8F0829df39eC0FFF5D1E061FFadf7
0x8fd1b615c006ebeb8a7cfb00a1dd809f31943b08,0x61a0577fabb8ca74a1c6000eb95a94ab4a2a4bed0b090f3ac353b109aece5bec,20-12-2024,2024-12-20 20:08:29.000 UTC,593,23967981,0x45F8b8eC9c92D09BA8495074436fD97073423041
0x2791dc5e14f7680d9d969acc26059ba56403b6d5,0x36be0775b84b4562414e90ae1ef50b78bb6c49fd934a4f44e4c006165c186eb6,09-01-2025,2025-01-09 07:46:19.000 UTC,334,24809716,0xB9E4E0368A9F281584C9adB685e6C9F4b9F37dBb
0x8508fd4238162cb3f3d485f432202af3b40f164e,0xdbc154b3e11bbea9c7bff173a6d7f3264ee27713298698f35c4de1f070219b82,09-06-2025,2025-06-09 13:18:45.000 UTC,567,31342889,0xc3f97660D0b47F0E05C3c513f73eeff7c1bd6c7a
0x2791dc5e14f7680d9d969acc26059ba56403b6d5,0x8bfe8c5c70eb6404156c788b7ecb131ca75751817874d0c9b82f60cdd7cc6bb6,30-12-2024,2024-12-30 11:08:03.000 UTC,527,24383768,0xBDA319Bc7Cc8F0829df39eC0FFF5D1E061FFadf7
0x8508fd4238162cb3f3d485f432202af3b40f164e,0x7b25c1eee43708c1437f8ce60f2a2ed111fe349e5b96986280e11d442f46ad44,09-04-2025,2025-04-09 23:25:39.000 UTC,265,28725896,0x2B74B62c564456C48055bd515A62594742b3f545
0x351f61e4c49cf11f24d9f2e737ca5eff81806355,0xa91f1a459b9a3a3da127dadd301c29f838b1c5bd8723c035ac405a062f5654f6,03-09-2025,2025-09-03 13:18:35.000 UTC,706,35058084,0x0e956C897bBFCbd2155D3DfdD27c87fa5A0FaD39
0x351f61e4c49cf11f24d9f2e737ca5eff81806355,0x136c24e9db8e0423cd7ee0af026b6cd3b88cafb7fab3193b565ddae402b7e5c1,21-10-2025,2025-10-21 18:50:21.000 UTC,2603,37141637,0x0e956C897bBFCbd2155D3DfdD27c87fa5A0FaD39
0x2791dc5e14f7680d9d969acc26059ba56403b6d5,0xb3ced71df7e74c110128cadb32f94a2bf95d9099d1badcba57a6ac7fab8df601,16-01-2025,2025-01-16 00:25:19.000 UTC,991,25098886,0x0e956C897bBFCbd2155D3DfdD27c87fa5A0FaD39
0x38f6d2d9ea493c3c6ee865b5b952b5fe9e3e61fc,0x066612eca29989866e546df40a135031fdca8284a6330faa970d28f9e191f143,25-12-2024,2024-12-25 12:19:13.000 UTC,220,24169903,0xCFede447ca3b4885720B5a327e3BFb02078f06e8
0x9eb86e93a809a41ab0e7cc0ba6f62561fda3015c,0xef57394e1b7e67521f129b83a14bbffff0a2e5a291b0da012d608b6d3a76c8b0,19-02-2025,2025-02-19 16:49:19.000 UTC,267,26597206,0x6399ed6725cC163D019aA64FF55b22149D7179A8
